File,version,documents
FL_2024_5ca806c9d35c4297878d20dcfb1cf9db.html.gz,2025-01-09-base,"[{'sentences': [{'generated_prob': 0.0005314075970090926, 'sentence': 'Get the best experience and stay connected to your community with our Spectrum News app.', 'perplexity': 0, 'highlight_sentence_for_ai': False}, {'generated_prob': 0.0006907520582899451, 'sentence': 'Learn More Get the best experience and stay connected to your community with our Spectrum News app.', 'perplexity': 0, 'highlight_sentence_for_ai': False}, {'generated_prob': 0.0007134481566026807, 'sentence': 'Learn More Continue in Browser Get hyperlocal forecasts, radar and weather alerts.', 'perplexity': 0, 'highlight_sentence_for_ai': False}, {'generated_prob': 0.0004258074040990323, 'sentence': 'Please enter a valid zipcode.', 'perplexity': 0, 'highlight_sentence_for_ai': False}, {'generated_prob': 0.00027884208247996867, 'sentence': 'Save A disabled toddler has been reunited with his wheelchair stroller after it was stolen from the driveway of his home in Queens.', 'perplexity': 0, 'highlight_sentence_for_ai': False}, {'generated_prob': 8.585854811826721e-05, 'sentence': 'âI am glad, and I am grateful to God that I found it.', 'perplexity': 0, 'highlight_sentence_for_ai': False}, {'generated_prob': 8.906308357836679e-05, 'sentence': 'Iâve been holding back my tears.', 'perplexity': 0, 'highlight_sentence_for_ai': False}, {'generated_prob': 7.495325553463772e-05, 'sentence': 'These are tears of sadness and also joy,â said Marta Escobar, who has been on an emotional rollercoaster since her 4-year-old sonâs stroller was taken on New Yearâs Day.', 'perplexity': 0, 'highlight_sentence_for_ai': False}, {'generated_prob': 7.354366243816912e-05, 'sentence': 'âMy daughter told me today that sheâs scared Iâm gonna die, and sheâs gonna lose me, because sheâs been watching the stress of everything going on.â AJâs wheelchair stroller, along with his medication, diapers and three additional strollers were stolen from their driveway in South Ozone Park.', 'perplexity': 0, 'highlight_sentence_for_ai': False}, {'generated_prob': 5.367356789065525e-05, 'sentence': 'One week later, Escobar saw a woman on her street wheeling the double stroller that had been taken.', 'perplexity': 0, 'highlight_sentence_for_ai': False}, {'generated_prob': 6.65998668409884e-05, 'sentence': 'âI asked her, âWhere did you get the stroller from?', 'perplexity': 0, 'highlight_sentence_for_ai': False}, {'generated_prob': 6.775939982617274e-05, 'sentence': 'Four strollers got stolen from my house and one of them looks just like that,ââ Escobar said.', 'perplexity': 0, 'highlight_sentence_for_ai': False}, {'generated_prob': 7.235509110614657e-05, 'sentence': 'She said the woman initially told her another family gave her the stroller for her two daughters.', 'perplexity': 0, 'highlight_sentence_for_ai': False}, {'generated_prob': 9.888707427307963e-05, 'sentence': 'But after showing the woman photos of the missing stroller, Escobar said she confessed.', 'perplexity': 0, 'highlight_sentence_for_ai': False}, {'generated_prob': 0.000175117704202421, 'sentence': 'âIâm sorry, Miss.', 'perplexity': 0, 'highlight_sentence_for_ai': False}, {'generated_prob': 0.0006090165115892887, 'sentence': 'I took your stroller, the double stroller, and nothing else.', 'perplexity': 0, 'highlight_sentence_for_ai': False}, {'generated_prob': 0.0006074351258575916, 'sentence': 'I took it because I needed it,â the woman said.', 'perplexity': 0, 'highlight_sentence_for_ai': False}, {'generated_prob': 0.0004849944089073688, 'sentence': 'The woman was identified by police as 25-year-old Daniela Sosa.', 'perplexity': 0, 'highlight_sentence_for_ai': False}, {'generated_prob': 0.0005999798304401338, 'sentence': 'Escobar said Sosa told her that sheâs originally from Venezuela and arrived here in the city on New Yearâs Eve.', 'perplexity': 0, 'highlight_sentence_for_ai': False}, {'generated_prob': 0.000866730697453022, 'sentence': 'âI understand that youâre struggling, that you just came here and youâre in a new place, but you donât need to be taking anybodyâs things,â Escobar said.', 'perplexity': 0, 'highlight_sentence_for_ai': False}, {'generated_prob': 0.0009218010236509144, 'sentence': 'When police arrived, they took Sosa into custody and charged her.', 'perplexity': 0, 'highlight_sentence_for_ai': False}, {'generated_prob': 0.0007580957608297467, 'sentence': 'AJ has since been reunited with his wheelchair stroller, but Escobar said she doesnât feel safe.', 'perplexity': 0, 'highlight_sentence_for_ai': False}, {'generated_prob': 0.001150657655671239, 'sentence': 'âThe city is failing us by putting all these people into private neighborhoods without knowing how itâs gonna affect us and our families,â Escobar said.', 'perplexity': 0, 'highlight_sentence_for_ai': False}, {'generated_prob': 0.0009673703461885452, 'sentence': 'Escobar said sheâs grateful for the outpouring of love and support she received since NY1âs story first aired.', 'perplexity': 0, 'highlight_sentence_for_ai': False}, {'generated_prob': 0.0012372490018606186, 'sentence': 'âIt touched my heart and made me feel like I made an impact in everything Iâve done in my life, that people were actually coming back and pouring their hearts towards me now,â Escobar said.', 'perplexity': 0, 'highlight_sentence_for_ai': False}, {'generated_prob': 0.003832318587228656, 'sentence': 'Sosa, also a mother, has been charged with grand larceny and criminal possession of stolen property.', 'perplexity': 0, 'highlight_sentence_for_ai': False}, {'generated_prob': 0.004832911305129528, 'sentence': 'Meanwhile, Escobar has taken out an order of protection against her.', 'perplexity': 0, 'highlight_sentence_for_ai': False}], 'paragraphs': [{'start_sentence_index': 0, 'num_sentences': 27, 'completely_generated_prob': 6.669367083709894e-24}], 'completely_generated_prob': 0.010647891959681275, 'class_probabilities': {'human': 0.9893113230945234, 'ai': 0.010647891959681275, 'mixed': 4.0784945795346054e-05}, 'average_generated_prob': 0, 'predicted_class': 'human', 'confidence_score': 0.9893113230945234, 'confidence_category': 'high', 'confidence_scores_raw': {'identity': {'ai': 0.010647891959681275, 'human': 0.9893113230945234, 'mixed': 4.0784945795346054e-05}}, 'confidence_thresholds_raw': {'identity': {'ai': {'reject': 0.65, 'low': 0.75, 'medium': 0.92}, 'human': {'reject': 0.7, 'low': 0.82, 'medium': 0.92}, 'mixed': {'reject': 0.7, 'low': 0.8, 'medium': 0.88}}}, 'overall_burstiness': 0, 'writing_stats': {}, 'subclass': {'ai': {}, 'human': {}, 'mixed': {}}, 'result_message': 'Our detector is highly confident that the text is written entirely by a human.', 'document_classification': 'HUMAN_ONLY', 'version': '2025-01-09-base', 'language': 'en', 'pageNumber': 0, 'inputText': 'Get the best experience and stay connected to your community with our Spectrum News app. Learn More Get the best experience and stay connected to your community with our Spectrum News app. Learn More Continue in Browser Get hyperlocal forecasts, radar and weather alerts. Please enter a valid zipcode. Save A disabled toddler has been reunited with his wheelchair stroller after it was stolen from the driveway of his home in Queens. â\x80\x9cI am glad, and I am grateful to God that I found it. Iâ\x80\x99ve been holding back my tears. These are tears of sadness and also joy,â\x80\x9d said Marta Escobar, who has been on an emotional rollercoaster since her 4-year-old sonâ\x80\x99s stroller was taken on New Yearâ\x80\x99s Day. â\x80\x9cMy daughter told me today that sheâ\x80\x99s scared Iâ\x80\x99m gonna die, and sheâ\x80\x99s gonna lose me, because sheâ\x80\x99s been watching the stress of everything going on.â\x80\x9d AJâ\x80\x99s wheelchair stroller, along with his medication, diapers and three additional strollers were stolen from their driveway in South Ozone Park. One week later, Escobar saw a woman on her street wheeling the double stroller that had been taken. â\x80\x9cI asked her, â\x80\x98Where did you get the stroller from? Four strollers got stolen from my house and one of them looks just like that,â\x80\x99â\x80\x9d Escobar said. She said the woman initially told her another family gave her the stroller for her two daughters. But after showing the woman photos of the missing stroller, Escobar said she confessed. â\x80\x9cIâ\x80\x99m sorry, Miss. I took your stroller, the double stroller, and nothing else. I took it because I needed it,â\x80\x9d the woman said. The woman was identified by police as 25-year-old Daniela Sosa. Escobar said Sosa told her that sheâ\x80\x99s originally from Venezuela and arrived here in the city on New Yearâ\x80\x99s Eve. â\x80\x9cI understand that youâ\x80\x99re struggling, that you just came here and youâ\x80\x99re in a new place, but you donâ\x80\x99t need to be taking anybodyâ\x80\x99s things,â\x80\x9d Escobar said. When police arrived, they took Sosa into custody and charged her. AJ has since been reunited with his wheelchair stroller, but Escobar said she doesnâ\x80\x99t feel safe. â\x80\x9cThe city is failing us by putting all these people into private neighborhoods without knowing how itâ\x80\x99s gonna affect us and our families,â\x80\x9d Escobar said. Escobar said sheâ\x80\x99s grateful for the outpouring of love and support she received since NY1â\x80\x99s story first aired. â\x80\x9cIt touched my heart and made me feel like I made an impact in everything Iâ\x80\x99ve done in my life, that people were actually coming back and pouring their hearts towards me now,â\x80\x9d Escobar said. Sosa, also a mother, has been charged with grand larceny and criminal possession of stolen property. Meanwhile, Escobar has taken out an order of protection against her.'}]"
FL_2024_62d1e0e551e723459e8a2302f5dc78b1.html.gz,2025-01-09-base,"[{'sentences': [{'generated_prob': 0.028015591204166412, 'sentence': 'videos En Vivo Para continuar, suscribite a americateve.', 'perplexity': 0, 'highlight_sentence_for_ai': False}, {'generated_prob': 0.025693044066429138, 'sentence': 'Si ya sos un usuario suscripto, iniciá sesión.', 'perplexity': 0, 'highlight_sentence_for_ai': False}, {'generated_prob': 0.01603221520781517, 'sentence': 'Fuentes del Servicio de Inmigración y Control de Aduanas (ICE) y de Investigaciones de Seguridad Nacional confirmaron que los individuos presuntamente implicados en el incidente fueron detenidos en en una estación de autobuses Greyhound, Arizona.', 'perplexity': 0, 'highlight_sentence_for_ai': False}, {'generated_prob': 0.016306454315781593, 'sentence': 'Las identidades de los sospechosos se mantienen en secreto, y aún no se han revelado detalles sobre quiénes fueron arrestados y su participación en la agresión.', 'perplexity': 0, 'highlight_sentence_for_ai': False}, {'generated_prob': 0.014225724153220654, 'sentence': 'Este arresto sigue a la creencia de que cuatro inmigrantes involucrados originalmente en el ataque a los agentes de policía en Nueva York se dirigían a California después del altercado.', 'perplexity': 0, 'highlight_sentence_for_ai': False}, {'generated_prob': 0.03265758976340294, 'sentence': 'Darwin Andrés Gómez, Kelvin Servita Arocha, Wilson Juárez y Yorman Reverón, quienes inicialmente huyeron a California después de ser liberados sin derecho a fianza, fueron posteriormente detenidos en el estado.', 'perplexity': 0, 'highlight_sentence_for_ai': False}, {'generated_prob': 0.22494979202747345, 'sentence': 'Además, Jhoán Boada, Jandry Barros y Yohenry Brito también fueron arrestados en relación con el incidente.', 'perplexity': 0, 'highlight_sentence_for_ai': False}, {'generated_prob': 0.2659623324871063, 'sentence': 'La gobernadora de Nueva York, Kathy Hochul, expresó su preocupación durante una conferencia de prensa, enfatizando su deseo de hablar con el fiscal de distrito de Manhattan, Alvin Bragg.', 'perplexity': 0, 'highlight_sentence_for_ai': False}, {'generated_prob': 0.5320786237716675, 'sentence': 'Hochul, demócrata, cuestionó la liberación sin derecho a fianza de la mayoría de los sospechosos, argumentando que la agresión a un oficial de policía debería justificar la detención.', 'perplexity': 0, 'highlight_sentence_for_ai': False}, {'generated_prob': 0.472438782453537, 'sentence': 'Además, señaló la posibilidad de más de 100 delitos que podrían resultar en deportación, instando a una discusión con el fiscal de distrito sobre las opciones disponibles.', 'perplexity': 0, 'highlight_sentence_for_ai': False}, {'generated_prob': 0.38278037309646606, 'sentence': 'Suscribite a nuestro Newsletter Copyright americateve 2024.', 'perplexity': 0, 'highlight_sentence_for_ai': False}, {'generated_prob': 0.5422284603118896, 'sentence': 'Todos los derechos reservados.', 'perplexity': 0, 'highlight_sentence_for_ai': False}], 'paragraphs': [{'start_sentence_index': 0, 'num_sentences': 12, 'completely_generated_prob': 1.0731758790825431e-10}], 'completely_generated_prob': 0.13433858807402332, 'class_probabilities': {'human': 0.8647018505825909, 'ai': 0.13433858807402332, 'mixed': 0.0009595613433858808}, 'average_generated_prob': 0, 'predicted_class': 'human', 'confidence_score': 0.8647018505825909, 'confidence_category': 'medium', 'confidence_scores_raw': {'identity': {'ai': 0.13433858807402332, 'human': 0.8647018505825909, 'mixed': 0.0009595613433858808}}, 'confidence_thresholds_raw': {'identity': {'ai': {'reject': 0.65, 'low': 0.75, 'medium': 0.92}, 'human': {'reject': 0.7, 'low': 0.82, 'medium': 0.92}, 'mixed': {'reject': 0.7, 'low': 0.8, 'medium': 0.88}}}, 'overall_burstiness': 0, 'writing_stats': {}, 'subclass': {'ai': {}, 'human': {}, 'mixed': {}}, 'result_message': 'Our detector is moderately confident that the text is written entirely by a human.', 'document_classification': 'HUMAN_ONLY', 'version': '2025-01-09-base', 'language': 'en', 'pageNumber': 0, 'inputText': 'videos En Vivo Para continuar, suscribite a americateve. Si ya sos un usuario suscripto, iniciá sesión. Fuentes del Servicio de Inmigración y Control de Aduanas (ICE) y de Investigaciones de Seguridad Nacional confirmaron que los individuos presuntamente implicados en el incidente fueron detenidos en en una estación de autobuses Greyhound, Arizona. Las identidades de los sospechosos se mantienen en secreto, y aún no se han revelado detalles sobre quiénes fueron arrestados y su participación en la agresión. Este arresto sigue a la creencia de que cuatro inmigrantes involucrados originalmente en el ataque a los agentes de policía en Nueva York se dirigían a California después del altercado. Darwin Andrés Gómez, Kelvin Servita Arocha, Wilson Juárez y Yorman Reverón, quienes inicialmente huyeron a California después de ser liberados sin derecho a fianza, fueron posteriormente detenidos en el estado. Además, Jhoán Boada, Jandry Barros y Yohenry Brito también fueron arrestados en relación con el incidente. La gobernadora de Nueva York, Kathy Hochul, expresó su preocupación durante una conferencia de prensa, enfatizando su deseo de hablar con el fiscal de distrito de Manhattan, Alvin Bragg. Hochul, demócrata, cuestionó la liberación sin derecho a fianza de la mayoría de los sospechosos, argumentando que la agresión a un oficial de policía debería justificar la detención. Además, señaló la posibilidad de más de 100 delitos que podrían resultar en deportación, instando a una discusión con el fiscal de distrito sobre las opciones disponibles. Suscribite a nuestro Newsletter Copyright americateve 2024. Todos los derechos reservados.'}]"
FL_2024_6ad60ca5391273d4e4bd5342e3c2ad6d.html.gz,2025-01-09-base,"[{'sentences': [{'generated_prob': 0.00010088869748869911, 'sentence': 'Get the best experience and stay connected to your community with our Spectrum News app.', 'perplexity': 0, 'highlight_sentence_for_ai': False}, {'generated_prob': 0.00011731344420695677, 'sentence': 'Learn More Get the best experience and stay connected to your community with our Spectrum News app.', 'perplexity': 0, 'highlight_sentence_for_ai': False}, {'generated_prob': 0.00013569316070061177, 'sentence': 'Learn More Continue in Browser Get hyperlocal forecasts, radar and weather alerts.', 'perplexity': 0, 'highlight_sentence_for_ai': False}, {'generated_prob': 8.687874651513994e-05, 'sentence': 'Please enter a valid zipcode.', 'perplexity': 0, 'highlight_sentence_for_ai': False}, {'generated_prob': 5.78827821300365e-05, 'sentence': 'Save COLUMBUS, Ohio â Delta-8 THC is a compound that can be found hemp.', 'perplexity': 0, 'highlight_sentence_for_ai': False}, {'generated_prob': 5.610406878986396e-05, 'sentence': 'When concentrated or manipulated, it can give people a high when consumed, just like marijuana.', 'perplexity': 0, 'highlight_sentence_for_ai': False}, {'generated_prob': 6.160650809761137e-05, 'sentence': 'âWell, Delta-8 has gotten a lot easier to get now,â said Gary Wenk, a professor of behavioral science at Ohio State University.', 'perplexity': 0, 'highlight_sentence_for_ai': False}, {'generated_prob': 4.437543248059228e-05, 'sentence': 'It can be easily accessible for both adults and children.', 'perplexity': 0, 'highlight_sentence_for_ai': False}, {'generated_prob': 5.943367432337254e-05, 'sentence': 'There were more than 100 reported poisonings that involved Delta-8 THC last year, according to data from the Ohio Poison Control Center.', 'perplexity': 0, 'highlight_sentence_for_ai': False}, {'generated_prob': 9.83252830337733e-05, 'sentence': 'Among those, approximately 40% affected children.', 'perplexity': 0, 'highlight_sentence_for_ai': False}, {'generated_prob': 4.9202004447579384e-05, 'sentence': 'Gov.', 'perplexity': 0, 'highlight_sentence_for_ai': False}, {'generated_prob': 3.7742538552265614e-05, 'sentence': 'Mike DeWine is calling on lawmakers to regulate it.', 'perplexity': 0, 'highlight_sentence_for_ai': False}, {'generated_prob': 4.3845684558618814e-05, 'sentence': 'âWhen itâs hurting kids are serious risk for children, I think that means itâs time for the state legislature to take action,â said DeWine.', 'perplexity': 0, 'highlight_sentence_for_ai': False}, {'generated_prob': 4.130322122364305e-05, 'sentence': 'During a news conference Wednesday, DeWine held up a bag of Delta-8 THC gummies to show how the packaging can be catered to a younger audience.', 'perplexity': 0, 'highlight_sentence_for_ai': False}, {'generated_prob': 5.110018901177682e-05, 'sentence': 'When children ingest too much, it can have serious effects on their brains.', 'perplexity': 0, 'highlight_sentence_for_ai': False}, {'generated_prob': 7.434665894834325e-05, 'sentence': 'âWe know theyâre harmful for kids.', 'perplexity': 0, 'highlight_sentence_for_ai': False}, {'generated_prob': 0.0006375805824063718, 'sentence': 'We know theyâre readily available.', 'perplexity': 0, 'highlight_sentence_for_ai': False}, {'generated_prob': 0.00039242784259840846, 'sentence': 'And today you can ask your state legislature to take action,â said DeWine.', 'perplexity': 0, 'highlight_sentence_for_ai': False}, {'generated_prob': 0.0004968595458194613, 'sentence': 'âWe cannot, local police cannot move anything.', 'perplexity': 0, 'highlight_sentence_for_ai': False}, {'generated_prob': 0.0007807639776729047, 'sentence': 'I cannot do anything without action by the state legislature.â Joseph Evans, owner of H&H Hemp Company, said that Delta-8 is not the problem, but misuse is.', 'perplexity': 0, 'highlight_sentence_for_ai': False}, {'generated_prob': 0.0009566912776790559, 'sentence': 'âDelta-8 is regulated by the Ohio Department of Agriculture.', 'perplexity': 0, 'highlight_sentence_for_ai': False}, {'generated_prob': 0.0016572955064475536, 'sentence': 'Thatâs who we answer to,â said Evans.', 'perplexity': 0, 'highlight_sentence_for_ai': False}, {'generated_prob': 0.001296507427468896, 'sentence': 'âThereâs a lot of people who feel like Delta -8 is not regulated.', 'perplexity': 0, 'highlight_sentence_for_ai': False}, {'generated_prob': 0.0016820456366986036, 'sentence': 'Thatâs a myth.', 'perplexity': 0, 'highlight_sentence_for_ai': False}, {'generated_prob': 0.0013947846600785851, 'sentence': 'Thatâs not true at all.', 'perplexity': 0, 'highlight_sentence_for_ai': False}, {'generated_prob': 0.001507198205217719, 'sentence': 'And like any other product, itâs only unsafe if you have people that donât know what theyâre doing with it.â Delta-8 is not unsafe, Evans said.', 'perplexity': 0, 'highlight_sentence_for_ai': False}, {'generated_prob': 0.0019896954763680696, 'sentence': 'âThere are what I would call, âbad actorsâ out there that are manufacturing products that are not what I would consider safe,â said Evans.', 'perplexity': 0, 'highlight_sentence_for_ai': False}, {'generated_prob': 0.0018604779615998268, 'sentence': 'âDelta-8 isnât unsafe.', 'perplexity': 0, 'highlight_sentence_for_ai': False}, {'generated_prob': 0.0019679635297507048, 'sentence': 'It just thereâs people that have unsafe practices.â As for DeWine, he said going forward he will continue to advocate against the selling of Delta-8 THC in general, not just to children.', 'perplexity': 0, 'highlight_sentence_for_ai': False}], 'paragraphs': [{'start_sentence_index': 0, 'num_sentences': 29, 'completely_generated_prob': 1.1173676947417224e-25}], 'completely_generated_prob': 0.006754980621615862, 'class_probabilities': {'human': 0.9932450193783842, 'ai': 0.006754980621615862, 'mixed': 0}, 'average_generated_prob': 0, 'predicted_class': 'human', 'confidence_score': 0.9932450193783842, 'confidence_category': 'high', 'confidence_scores_raw': {'identity': {'ai': 0.006754980621615862, 'human': 0.9932450193783842, 'mixed': 0}}, 'confidence_thresholds_raw': {'identity': {'ai': {'reject': 0.65, 'low': 0.75, 'medium': 0.92}, 'human': {'reject': 0.7, 'low': 0.82, 'medium': 0.92}, 'mixed': {'reject': 0.7, 'low': 0.8, 'medium': 0.88}}}, 'overall_burstiness': 0, 'writing_stats': {}, 'subclass': {'ai': {}, 'human': {}, 'mixed': {}}, 'result_message': 'Our detector is highly confident that the text is written entirely by a human.', 'document_classification': 'HUMAN_ONLY', 'version': '2025-01-09-base', 'language': 'en', 'pageNumber': 0, 'inputText': 'Get the best experience and stay connected to your community with our Spectrum News app. Learn More Get the best experience and stay connected to your community with our Spectrum News app. Learn More Continue in Browser Get hyperlocal forecasts, radar and weather alerts. Please enter a valid zipcode. Save COLUMBUS, Ohio â\x80\x94 Delta-8 THC is a compound that can be found hemp. When concentrated or manipulated, it can give people a high when consumed, just like marijuana. â\x80\x9cWell, Delta-8 has gotten a lot easier to get now,â\x80\x9d said Gary Wenk, a professor of behavioral science at Ohio State University. It can be easily accessible for both adults and children. There were more than 100 reported poisonings that involved Delta-8 THC last year, according to data from the Ohio Poison Control Center. Among those, approximately 40% affected children. Gov. Mike DeWine is calling on lawmakers to regulate it. â\x80\x9cWhen itâ\x80\x99s hurting kids are serious risk for children, I think that means itâ\x80\x99s time for the state legislature to take action,â\x80\x9d said DeWine. During a news conference Wednesday, DeWine held up a bag of Delta-8 THC gummies to show how the packaging can be catered to a younger audience. When children ingest too much, it can have serious effects on their brains. â\x80\x9cWe know theyâ\x80\x99re harmful for kids. We know theyâ\x80\x99re readily available. And today you can ask your state legislature to take action,â\x80\x9d said DeWine. â\x80\x9cWe cannot, local police cannot move anything. I cannot do anything without action by the state legislature.â\x80\x9d Joseph Evans, owner of H&H Hemp Company, said that Delta-8 is not the problem, but misuse is. â\x80\x9cDelta-8 is regulated by the Ohio Department of Agriculture. Thatâ\x80\x99s who we answer to,â\x80\x9d said Evans. â\x80\x9cThereâ\x80\x99s a lot of people who feel like Delta -8 is not regulated. Thatâ\x80\x99s a myth. Thatâ\x80\x99s not true at all. And like any other product, itâ\x80\x99s only unsafe if you have people that donâ\x80\x99t know what theyâ\x80\x99re doing with it.â\x80\x9d Delta-8 is not unsafe, Evans said. â\x80\x9cThere are what I would call, â\x80\x98bad actorsâ\x80\x99 out there that are manufacturing products that are not what I would consider safe,â\x80\x9d said Evans. â\x80\x9cDelta-8 isnâ\x80\x99t unsafe. It just thereâ\x80\x99s people that have unsafe practices.â\x80\x9d As for DeWine, he said going forward he will continue to advocate against the selling of Delta-8 THC in general, not just to children.'}]"
