File,version,documents
NV_2024_22dca6f0c4ff0e4158fdf10b86b31336.html.gz,2025-01-09-base,"[{'sentences': [{'generated_prob': 0.00012356176739558578, 'sentence': 'NASHVILLE, Tenn. (WSMV/Gray News) - An arrest affidavit for music star Darius Rucker shows that the alleged offenses happened nearly a year ago in Tennessee.', 'perplexity': 0, 'highlight_sentence_for_ai': False}, {'generated_prob': 0.0001478776684962213, 'sentence': 'Rucker, known for being the lead singer of Hootie & the Blowfish and his solo career in the country music scene, was arrested nearly a year after he was found with psychedelic drugs during a traffic stop in Franklin, Tennessee, the affidavit said.', 'perplexity': 0, 'highlight_sentence_for_ai': False}, {'generated_prob': 0.000141608266858384, 'sentence': 'On Feb. 19, 2023, a Franklin Police Department officer pulled Rucker over for a traffic violation on Murfreesboro Road.', 'perplexity': 0, 'highlight_sentence_for_ai': False}, {'generated_prob': 0.00013445095100905746, 'sentence': ""Police said they smelled the odor of marijuana coming from the singer's GMC pickup."", 'perplexity': 0, 'highlight_sentence_for_ai': False}, {'generated_prob': 0.0001448673428967595, 'sentence': 'When asked, Rucker said had “smoked weed in the vehicle,” but not that night, according to the affidavit.', 'perplexity': 0, 'highlight_sentence_for_ai': False}, {'generated_prob': 0.0001603469718247652, 'sentence': 'Police said they searched the vehicle, and an officer found 14 unstamped, grayish and purple pills and a THC pen, which read “88.5% THC,” the affidavit said.', 'perplexity': 0, 'highlight_sentence_for_ai': False}, {'generated_prob': 0.0001472480216762051, 'sentence': 'Police said they also found a blunt on Rucker.', 'perplexity': 0, 'highlight_sentence_for_ai': False}, {'generated_prob': 0.0001382320187985897, 'sentence': 'Rucker told police his girlfriend gave him the items and he did not know what the pills were.', 'perplexity': 0, 'highlight_sentence_for_ai': False}, {'generated_prob': 0.0001383128110319376, 'sentence': 'Police released Rucker from the scene without charges, pending the identification of the 14 pills.', 'perplexity': 0, 'highlight_sentence_for_ai': False}, {'generated_prob': 0.0001595393696334213, 'sentence': 'An arrest warrant was signed after the Tennessee Bureau of Investigation said the pills tested positive for psilocybin, a psychedelic and Schedule I controlled substance.', 'perplexity': 0, 'highlight_sentence_for_ai': False}, {'generated_prob': 0.0001874972804216668, 'sentence': 'Rucker is facing charges of simple possession, casual exchange and violation of registration law.', 'perplexity': 0, 'highlight_sentence_for_ai': False}, {'generated_prob': 0.00017400314391124994, 'sentence': 'He was released Thursday on a $10,500 bond.', 'perplexity': 0, 'highlight_sentence_for_ai': False}, {'generated_prob': 0.00016749405767768621, 'sentence': 'Hootie & the Blowfish, of which Rucker is a member, is set to return to the road this summer.', 'perplexity': 0, 'highlight_sentence_for_ai': False}, {'generated_prob': 0.00017918231606017798, 'sentence': ""“Darius Rucker is fully cooperating with authorities related to misdemeanor charges,” Rucker's attorney Mark Puryear said."", 'perplexity': 0, 'highlight_sentence_for_ai': False}, {'generated_prob': 0.00021820818074047565, 'sentence': 'Copyright 2024 WSMV via Gray Media Group, Inc. All rights reserved.', 'perplexity': 0, 'highlight_sentence_for_ai': False}], 'paragraphs': [{'start_sentence_index': 0, 'num_sentences': 15, 'completely_generated_prob': 2.5938383721896624e-13}], 'completely_generated_prob': 0.01565789170260218, 'class_probabilities': {'human': 0.9843421082973979, 'ai': 0.01565789170260218, 'mixed': 0}, 'average_generated_prob': 0, 'predicted_class': 'human', 'confidence_score': 0.9843421082973979, 'confidence_category': 'high', 'confidence_scores_raw': {'identity': {'ai': 0.01565789170260218, 'human': 0.9843421082973979, 'mixed': 0}}, 'confidence_thresholds_raw': {'identity': {'ai': {'reject': 0.65, 'low': 0.75, 'medium': 0.92}, 'human': {'reject': 0.7, 'low': 0.82, 'medium': 0.92}, 'mixed': {'reject': 0.7, 'low': 0.8, 'medium': 0.88}}}, 'overall_burstiness': 0, 'writing_stats': {}, 'subclass': {'ai': {}, 'human': {}, 'mixed': {}}, 'result_message': 'Our detector is highly confident that the text is written entirely by a human.', 'document_classification': 'HUMAN_ONLY', 'version': '2025-01-09-base', 'language': 'en', 'pageNumber': 0, 'inputText': 'NASHVILLE, Tenn. (WSMV/Gray News) – An arrest affidavit for music star Darius Rucker shows that the alleged offenses happened nearly a year ago in Tennessee. Rucker, known for being the lead singer of Hootie & the Blowfish and his solo career in the country music scene, was arrested nearly a year after he was found with psychedelic drugs during a traffic stop in Franklin, Tennessee, the affidavit said. On Feb. 19, 2023, a Franklin Police Department officer pulled Rucker over for a traffic violation on Murfreesboro Road. Police said they smelled the odor of marijuana coming from the singer’s GMC pickup. When asked, Rucker said had “smoked weed in the vehicle,” but not that night, according to the affidavit. Police said they searched the vehicle, and an officer found 14 unstamped, grayish and purple pills and a THC pen, which read “88.5% THC,” the affidavit said. Police said they also found a blunt on Rucker. Rucker told police his girlfriend gave him the items and he did not know what the pills were. Police released Rucker from the scene without charges, pending the identification of the 14 pills. An arrest warrant was signed after the Tennessee Bureau of Investigation said the pills tested positive for psilocybin, a psychedelic and Schedule I controlled substance. Rucker is facing charges of simple possession, casual exchange and violation of registration law. He was released Thursday on a $10,500 bond. Hootie & the Blowfish, of which Rucker is a member, is set to return to the road this summer. “Darius Rucker is fully cooperating with authorities related to misdemeanor charges,” Rucker’s attorney Mark Puryear said. Copyright 2024 WSMV via Gray Media Group, Inc. All rights reserved.'}]"
NV_2024_3485e3f85d265f678339692b5da5e155.html.gz,2025-01-09-base,"[{'sentences': [{'generated_prob': 1.010937376122456e-05, 'sentence': 'Menu Lawmakers voiced their views after the U.S. launched retaliatory strikes in Syria and Iraq on Friday.', 'perplexity': 0, 'highlight_sentence_for_ai': False}, {'generated_prob': 8.12228608992882e-06, 'sentence': 'Some U.S. lawmakers, including Iowa Republican Rep. Joni Ernst, reacted favorably to the strike, with some confirming with reporters they were notified in advance that the planned strikes would be carried out.', 'perplexity': 0, 'highlight_sentence_for_ai': False}, {'generated_prob': 7.823673513485119e-06, 'sentence': 'Rep. Ernst said Friday, ""Finally.', 'perplexity': 0, 'highlight_sentence_for_ai': False}, {'generated_prob': 1.1385838661226444e-05, 'sentence': 'Iran needs to know the price for American lives.""', 'perplexity': 0, 'highlight_sentence_for_ai': False}, {'generated_prob': 9.410572602064349e-06, 'sentence': 'The strikes began at 4 p.m.', 'perplexity': 0, 'highlight_sentence_for_ai': False}, {'generated_prob': 9.67134110396728e-06, 'sentence': ""ET according to U.S. officials who said the military targeted Iran's Islamic Revolutionary Guards Corps Quds Force, along with affiliated militia groups."", 'perplexity': 0, 'highlight_sentence_for_ai': False}, {'generated_prob': 8.87484748091083e-06, 'sentence': ""A spokesperson for Sen. Chuck Schumer's office confirmed to Scripps News that Sen. Schumer was notified in advance of the strikes."", 'perplexity': 0, 'highlight_sentence_for_ai': False}, {'generated_prob': 9.479101208853535e-06, 'sentence': 'Virginian Democratic Sen. Tim Kaine, who is on the Foreign Relations and Armed Services committees, said, ""Iranian-backed militia groups killed three U.S. service members and injured many others.', 'perplexity': 0, 'highlight_sentence_for_ai': False}, {'generated_prob': 1.155684185505379e-05, 'sentence': 'While we don\'t want to unnecessarily escalate the situation, when U.S. service members are killed and injured, we have an obligation to respond to hold those responsible to account.""', 'perplexity': 0, 'highlight_sentence_for_ai': False}, {'generated_prob': 1.1827745765913278e-05, 'sentence': 'Some have pointed out statements made by other lawmakers in the hours after the planned strikes, urging caution and warning their colleagues to be careful with their statements.', 'perplexity': 0, 'highlight_sentence_for_ai': False}, {'generated_prob': 1.4537703464156948e-05, 'sentence': 'Democratic Sen. Tammy Duckworth of Illinois said some Republican lawmakers have been ""making reckless, irresponsible comments that dangerously risk escalating tensions even further.""', 'perplexity': 0, 'highlight_sentence_for_ai': False}, {'generated_prob': 1.779607919161208e-05, 'sentence': 'Sen. Duckworth said in a video posted to Twitter, ""Our troops deserve better than that.""', 'perplexity': 0, 'highlight_sentence_for_ai': False}, {'generated_prob': 3.529330570017919e-06, 'sentence': 'SEE MORE: US begins retaliatory strikes on Iranian armed forces in Middle East House Foreign Affairs Committee Chair Rep. Michael McCaul said in a statement: ""After almost a week, today\'s strikes are long overdue following a delay that allowed our enemies to prepare.', 'perplexity': 0, 'highlight_sentence_for_ai': False}, {'generated_prob': 3.316281208753935e-06, 'sentence': 'The Biden admin must be decisive with sustained retaliatory strikes and begin to enforce oil and other sanctions to cut off the source of terror funding.""', 'perplexity': 0, 'highlight_sentence_for_ai': False}, {'generated_prob': 2.893160854000598e-06, 'sentence': 'The strikes were the first direct response to a deadly Jan. 28 drone attack targeting a U.S. outpost in Jordan that killed three U.S. military service members, and also wounded at least 40 others.', 'perplexity': 0, 'highlight_sentence_for_ai': False}, {'generated_prob': 2.719981466725585e-06, 'sentence': 'Secretary of Defense Lloyd J. Austin said the strikes, at the direction of President Joe Biden, were conducted on ""seven facilities, which included more than 85 targets in Iraq and Syria, that Iran\'s Islamic Revolutionary Guard Corps and affiliated militias use to attack U.S. forces.', 'perplexity': 0, 'highlight_sentence_for_ai': False}, {'generated_prob': 3.485259640001459e-06, 'sentence': 'This is the start of our response.""', 'perplexity': 0, 'highlight_sentence_for_ai': False}, {'generated_prob': 4.200697730993852e-06, 'sentence': 'Republican Sen. Roger Wicker of Mississippi, who is the highest-ranking GOP member of the Senate Armed Services Committee, said, ""These military strikes are welcome, but come far too late for the three brave Americans who died and the nearly 50 wounded.""', 'perplexity': 0, 'highlight_sentence_for_ai': False}, {'generated_prob': 4.065665962116327e-06, 'sentence': 'President Biden said in a statement that the strikes would ""continue at times and places of our choosing.""', 'perplexity': 0, 'highlight_sentence_for_ai': False}, {'generated_prob': 4.885893304162892e-06, 'sentence': 'Trending stories at Scrippsnews.com Report a typo', 'perplexity': 0, 'highlight_sentence_for_ai': False}], 'paragraphs': [{'start_sentence_index': 0, 'num_sentences': 20, 'completely_generated_prob': 1.0446359549956209e-17}], 'completely_generated_prob': 0, 'class_probabilities': {'human': 1, 'ai': 0, 'mixed': 0}, 'average_generated_prob': 0, 'predicted_class': 'human', 'confidence_score': 1, 'confidence_category': 'high', 'confidence_scores_raw': {'identity': {'ai': 0, 'human': 1, 'mixed': 0}}, 'confidence_thresholds_raw': {'identity': {'ai': {'reject': 0.65, 'low': 0.75, 'medium': 0.92}, 'human': {'reject': 0.7, 'low': 0.82, 'medium': 0.92}, 'mixed': {'reject': 0.7, 'low': 0.8, 'medium': 0.88}}}, 'overall_burstiness': 0, 'writing_stats': {}, 'subclass': {'ai': {}, 'human': {}, 'mixed': {}}, 'result_message': 'Our detector is highly confident that the text is written entirely by a human.', 'document_classification': 'HUMAN_ONLY', 'version': '2025-01-09-base', 'language': 'en', 'pageNumber': 0, 'inputText': 'Menu Lawmakers voiced their views after the U.S. launched retaliatory strikes in Syria and Iraq on Friday. Some U.S. lawmakers, including Iowa Republican Rep. Joni Ernst, reacted favorably to the strike, with some confirming with reporters they were notified in advance that the planned strikes would be carried out. Rep. Ernst said Friday, ""Finally. Iran needs to know the price for American lives."" The strikes began at 4 p.m. ET according to U.S. officials who said the military targeted Iran’s Islamic Revolutionary Guards Corps Quds Force, along with affiliated militia groups. A spokesperson for Sen. Chuck Schumer\'s office confirmed to Scripps News that Sen. Schumer was notified in advance of the strikes. Virginian Democratic Sen. Tim Kaine, who is on the Foreign Relations and Armed Services committees, said, ""Iranian-backed militia groups killed three U.S. service members and injured many others. While we don\'t want to unnecessarily escalate the situation, when U.S. service members are killed and injured, we have an obligation to respond to hold those responsible to account."" Some have pointed out statements made by other lawmakers in the hours after the planned strikes, urging caution and warning their colleagues to be careful with their statements. Democratic Sen. Tammy Duckworth of Illinois said some Republican lawmakers have been ""making reckless, irresponsible comments that dangerously risk escalating tensions even further."" Sen. Duckworth said in a video posted to Twitter, ""Our troops deserve better than that."" SEE MORE: US begins retaliatory strikes on Iranian armed forces in Middle East House Foreign Affairs Committee Chair Rep. Michael McCaul said in a statement: ""After almost a week, today\'s strikes are long overdue following a delay that allowed our enemies to prepare. The Biden admin must be decisive with sustained retaliatory strikes and begin to enforce oil and other sanctions to cut off the source of terror funding."" The strikes were the first direct response to a deadly Jan. 28 drone attack targeting a U.S. outpost in Jordan that killed three U.S. military service members, and also wounded at least 40 others. Secretary of Defense Lloyd J. Austin said the strikes, at the direction of President Joe Biden, were conducted on ""seven facilities, which included more than 85 targets in Iraq and Syria, that Iran\'s Islamic Revolutionary Guard Corps and affiliated militias use to attack U.S. forces. This is the start of our response."" Republican Sen. Roger Wicker of Mississippi, who is the highest-ranking GOP member of the Senate Armed Services Committee, said, ""These military strikes are welcome, but come far too late for the three brave Americans who died and the nearly 50 wounded."" President Biden said in a statement that the strikes would ""continue at times and places of our choosing."" Trending stories at Scrippsnews.com Report a typo'}]"
