File,version,documents
FL_2023_9140e3101bce3d009994ff6405d00c06.html.gz,2025-01-09-base,"[{'sentences': [{'generated_prob': 9.888154454529285e-05, 'sentence': 'VALDOSTA, Ga. (WALB) - WALB News 10 has learned new details about a wild crash on Highway 84 in Lowndes County that many have seen all over social media.', 'perplexity': 0, 'highlight_sentence_for_ai': False}, {'generated_prob': 0.00011430033191572875, 'sentence': 'The video has been shared on just about every social media platform in the last week.', 'perplexity': 0, 'highlight_sentence_for_ai': False}, {'generated_prob': 0.00013959669740870595, 'sentence': ""It's body cam footage from a Lowndes County Sheriff's Office deputy who was on the opposite side of the highway investigating another crash."", 'perplexity': 0, 'highlight_sentence_for_ai': False}, {'generated_prob': 0.00011408966383896768, 'sentence': 'While on the scene, the video shows a car driving up the back of a tow truck full speed, and then flying over the truck and flipping in the air.', 'perplexity': 0, 'highlight_sentence_for_ai': False}, {'generated_prob': 0.00011833893950097263, 'sentence': 'The deputy then rushes to the aid of the driver, reportedly a woman who survived.', 'perplexity': 0, 'highlight_sentence_for_ai': False}, {'generated_prob': 0.00012220005737617612, 'sentence': ""WCTV, WALB's sister station, confirmed that the driver of that vehicle is a 21-year-old woman from Tallahassee and suffered serious injuries and was taken to South Georgia Medical Center."", 'perplexity': 0, 'highlight_sentence_for_ai': False}, {'generated_prob': 0.00010039543849416077, 'sentence': ""The incident is raising awareness of Georgia's Move Over Law."", 'perplexity': 0, 'highlight_sentence_for_ai': False}, {'generated_prob': 0.0001194520591525361, 'sentence': 'Which requires drivers to slow down, and/or move over a lane when approaching emergency vehicles on the side of the road, which includes tow trucks.', 'perplexity': 0, 'highlight_sentence_for_ai': False}, {'generated_prob': 8.783952944213524e-05, 'sentence': '“People not moving over actually has hit my family as well.', 'perplexity': 0, 'highlight_sentence_for_ai': False}, {'generated_prob': 0.00011228663788642734, 'sentence': 'In 1966 when my father was 12, he lost his father, my grandfather.', 'perplexity': 0, 'highlight_sentence_for_ai': False}, {'generated_prob': 9.906692866934463e-05, 'sentence': 'He was hooking up to a vehicle and a drunk driver rear-ended the tow truck that he was right behind causing him to pass away at the scene,” Louis Kenda, part owner of Kenda Truck Center, said.', 'perplexity': 0, 'highlight_sentence_for_ai': False}, {'generated_prob': 0.00010325880430173129, 'sentence': ""To protect roadside workers and drivers with disabled vehicles, AAA is offering some precautionary tips: “I can control the load that I am towing, I can control where it's at once I arrive on the scene, and I can control how it gets off my truck."", 'perplexity': 0, 'highlight_sentence_for_ai': False}, {'generated_prob': 0.0001056574983522296, 'sentence': 'The only thing I cannot control is the people driving by.', 'perplexity': 0, 'highlight_sentence_for_ai': False}, {'generated_prob': 8.0009427620098e-05, 'sentence': 'That is the worst nightmare,” Kenda said.', 'perplexity': 0, 'highlight_sentence_for_ai': False}, {'generated_prob': 9.069863881450146e-05, 'sentence': 'WALB is still working to confirm the condition of the driver who flew over the truck, and if she is facing charges.', 'perplexity': 0, 'highlight_sentence_for_ai': False}, {'generated_prob': 0.0001597768859937787, 'sentence': ""Penalties for not abiding by Georgia's Move Over Law include a fine of $500 and three points on your license."", 'perplexity': 0, 'highlight_sentence_for_ai': False}, {'generated_prob': 0.00013598616351373494, 'sentence': 'Copyright 2023 WALB.', 'perplexity': 0, 'highlight_sentence_for_ai': False}, {'generated_prob': 0.00025135636678896844, 'sentence': 'All rights reserved.', 'perplexity': 0, 'highlight_sentence_for_ai': False}], 'paragraphs': [{'start_sentence_index': 0, 'num_sentences': 18, 'completely_generated_prob': 6.037935602283885e-16}], 'completely_generated_prob': 0.006608679833334143, 'class_probabilities': {'human': 0.9933913201666659, 'ai': 0.006608679833334143, 'mixed': 0}, 'average_generated_prob': 0, 'predicted_class': 'human', 'confidence_score': 0.9933913201666659, 'confidence_category': 'high', 'confidence_scores_raw': {'identity': {'ai': 0.006608679833334143, 'human': 0.9933913201666659, 'mixed': 0}}, 'confidence_thresholds_raw': {'identity': {'ai': {'reject': 0.65, 'low': 0.75, 'medium': 0.92}, 'human': {'reject': 0.7, 'low': 0.82, 'medium': 0.92}, 'mixed': {'reject': 0.7, 'low': 0.8, 'medium': 0.88}}}, 'overall_burstiness': 0, 'writing_stats': {}, 'subclass': {'ai': {}, 'human': {}, 'mixed': {}}, 'result_message': 'Our detector is highly confident that the text is written entirely by a human.', 'document_classification': 'HUMAN_ONLY', 'version': '2025-01-09-base', 'language': 'en', 'pageNumber': 0, 'inputText': 'VALDOSTA, Ga. (WALB) - WALB News 10 has learned new details about a wild crash on Highway 84 in Lowndes County that many have seen all over social media. The video has been shared on just about every social media platform in the last week. It’s body cam footage from a Lowndes County Sheriff’s Office deputy who was on the opposite side of the highway investigating another crash. While on the scene, the video shows a car driving up the back of a tow truck full speed, and then flying over the truck and flipping in the air. The deputy then rushes to the aid of the driver, reportedly a woman who survived. WCTV, WALB’s sister station, confirmed that the driver of that vehicle is a 21-year-old woman from Tallahassee and suffered serious injuries and was taken to South Georgia Medical Center. The incident is raising awareness of Georgia’s Move Over Law. Which requires drivers to slow down, and/or move over a lane when approaching emergency vehicles on the side of the road, which includes tow trucks. “People not moving over actually has hit my family as well. In 1966 when my father was 12, he lost his father, my grandfather. He was hooking up to a vehicle and a drunk driver rear-ended the tow truck that he was right behind causing him to pass away at the scene,” Louis Kenda, part owner of Kenda Truck Center, said. To protect roadside workers and drivers with disabled vehicles, AAA is offering some precautionary tips: “I can control the load that I am towing, I can control where it’s at once I arrive on the scene, and I can control how it gets off my truck. The only thing I cannot control is the people driving by. That is the worst nightmare,” Kenda said. WALB is still working to confirm the condition of the driver who flew over the truck, and if she is facing charges. Penalties for not abiding by Georgia’s Move Over Law include a fine of $500 and three points on your license. Copyright 2023 WALB. All rights reserved.'}]"
FL_2023_97d3c167f44033daca5792221ea3b119.html.gz,2025-01-09-base,"[{'sentences': [{'generated_prob': 0.009055282920598984, 'sentence': 'The latest breaking updates, delivered straight to your email inbox.', 'perplexity': 0, 'highlight_sentence_for_ai': False}, {'generated_prob': 0.0010223439894616604, 'sentence': 'Major weather events devastated parts of the world in 2023, as the Earth continues to see warming trends, reports from the National Oceanic and Atmospheric Administration show.', 'perplexity': 0, 'highlight_sentence_for_ai': False}, {'generated_prob': 0.0008635984268039465, 'sentence': 'Video above: Fires wreak havoc on historic town of Lahaina NOAA says as of Dec. 8 there were 25 ""confirmed weather/climate disaster events with losses exceeding $1 billion each to affect United States.""', 'perplexity': 0, 'highlight_sentence_for_ai': False}, {'generated_prob': 0.000585887348279357, 'sentence': 'Here are the weather stories that defined 2023: Thousands of people were displaced from the hundreds of wildfires that began to erupt in Canada in the spring of 2023.', 'perplexity': 0, 'highlight_sentence_for_ai': False}, {'generated_prob': 0.00048138663987629116, 'sentence': 'The record-breaking fire season in Canada burned land roughly the size of North Dakota, according to NASA\'s Earth Observatory, ""While the total number of reported fires has not been unusualᅳ6,595 by Octoberᅳa subset of the fires reached extraordinary sizes.""', 'perplexity': 0, 'highlight_sentence_for_ai': False}, {'generated_prob': 0.00030266307294368744, 'sentence': 'The smoke also led to poor air quality for millions across the midwest and eastern U.S.', 'perplexity': 0, 'highlight_sentence_for_ai': False}, {'generated_prob': 0.00028527318499982357, 'sentence': 'It is the deadliest U.S. wildfire in more than a century.', 'perplexity': 0, 'highlight_sentence_for_ai': False}, {'generated_prob': 0.00038380519254133105, 'sentence': 'Flames overtook the scenic island of Maui on Aug. 8, fueled by dry weather and winds from a nearby hurricane.', 'perplexity': 0, 'highlight_sentence_for_ai': False}, {'generated_prob': 0.0003801829006988555, 'sentence': 'The community of Lahaina suffered the most with many buildings destroyed in the fire.', 'perplexity': 0, 'highlight_sentence_for_ai': False}, {'generated_prob': 0.0003629502607509494, 'sentence': 'President Joe Biden and first lady Jill Biden visited nearly two weeks after the fire tore through the western part of the island.', 'perplexity': 0, 'highlight_sentence_for_ai': False}, {'generated_prob': 0.0003161099157296121, 'sentence': 'The death toll has varied but currently stands at 100 people.', 'perplexity': 0, 'highlight_sentence_for_ai': False}, {'generated_prob': 0.0003355366352479905, 'sentence': 'According to the Associated Press, 12,000 people were displaced in the fire, half of whom were still living in hotels due to housing shortage as of mid-December.', 'perplexity': 0, 'highlight_sentence_for_ai': False}, {'generated_prob': 0.0002777458284981549, 'sentence': 'Video above: Maui police release Lahaina wildfire body cam video The governor of Hawaii wants to convert vacation rentals to long-term housing for displaced survivors.', 'perplexity': 0, 'highlight_sentence_for_ai': False}, {'generated_prob': 0.00016601434617768973, 'sentence': ""Hurricane Idalia made landfall as a powerful Category 3 hurricane in Florida's Big Bend region."", 'perplexity': 0, 'highlight_sentence_for_ai': False}, {'generated_prob': 0.00018759997328743339, 'sentence': 'The storm was the strongest to make landfall in the region in more than 125 years.', 'perplexity': 0, 'highlight_sentence_for_ai': False}, {'generated_prob': 0.00015090106171555817, 'sentence': 'Idalia rapidly intensified over 24 hours.', 'perplexity': 0, 'highlight_sentence_for_ai': False}, {'generated_prob': 0.0002993001835420728, 'sentence': 'It was a Category 1 storm with 75 mph winds and grew to a monstrous Category 4 storm with 130 mph sustained winds within a day before decreasing to 125 mph winds and Cat 3 by the time it made landfall.', 'perplexity': 0, 'highlight_sentence_for_ai': False}, {'generated_prob': 0.0004178385715931654, 'sentence': 'The historic storm had record-breaking storm surge from Tampa to the Big Bend.', 'perplexity': 0, 'highlight_sentence_for_ai': False}, {'generated_prob': 0.0005009221495129168, 'sentence': 'Video below: 2023 Atlantic hurricane season recap Violent storms spawned dozens of tornadoes from the South to the Midwest and the Northeast in April, killing at least 32 people.', 'perplexity': 0, 'highlight_sentence_for_ai': False}, {'generated_prob': 0.00019534645252861083, 'sentence': 'President Biden had declared broad areas of the country major disaster areas, which made federal resources and financial aid available for recovery.', 'perplexity': 0, 'highlight_sentence_for_ai': False}, {'generated_prob': 0.00013854225107934326, 'sentence': 'Earlier in March, more than two dozen people were killed after a tornado devastated Mississippi.', 'perplexity': 0, 'highlight_sentence_for_ai': False}, {'generated_prob': 9.438271081307903e-05, 'sentence': '""What we\'ve seen over the last 36 hours in Mississippi is on one hand heartbreaking, on the other hand, inspiring and quite frankly makes me damn proud to be a Mississippian,"" Mississippi Gov.', 'perplexity': 0, 'highlight_sentence_for_ai': False}, {'generated_prob': 9.640189091442153e-05, 'sentence': 'Tate Reeves said in the aftermath.', 'perplexity': 0, 'highlight_sentence_for_ai': False}, {'generated_prob': 0.00029614209779538214, 'sentence': 'A massive earthquake struck Syria and Turkey in February, killing at least 50,000 people, according to a report from the AP.', 'perplexity': 0, 'highlight_sentence_for_ai': False}, {'generated_prob': 0.0003201559011358768, 'sentence': 'The 7.8 magnitude quake hit southern Turkey and northern Syria, and was followed by powerful aftershocks.', 'perplexity': 0, 'highlight_sentence_for_ai': False}, {'generated_prob': 0.0002782333758659661, 'sentence': ""'What do I have left?"", 'perplexity': 0, 'highlight_sentence_for_ai': False}, {'generated_prob': 0.00025528602418489754, 'sentence': ""': Turkey earthquake survivors face despair, as rescues wane Video above: Turkey quake survivors wait in anguish The Associated Press and CNN contributed to this report."", 'perplexity': 0, 'highlight_sentence_for_ai': False}, {'generated_prob': 0.0009335653157904744, 'sentence': 'Hearst Television participates in various affiliate marketing programs, which means we may get paid commissions on editorially chosen products purchased through our links to retailer sites.', 'perplexity': 0, 'highlight_sentence_for_ai': False}], 'paragraphs': [{'start_sentence_index': 0, 'num_sentences': 28, 'completely_generated_prob': 8.637890762238192e-25}], 'completely_generated_prob': 0.006922837844142335, 'class_probabilities': {'human': 0.99303778363816, 'ai': 0.006922837844142335, 'mixed': 3.937851769764606e-05}, 'average_generated_prob': 0, 'predicted_class': 'human', 'confidence_score': 0.99303778363816, 'confidence_category': 'high', 'confidence_scores_raw': {'identity': {'ai': 0.006922837844142335, 'human': 0.99303778363816, 'mixed': 3.937851769764606e-05}}, 'confidence_thresholds_raw': {'identity': {'ai': {'reject': 0.65, 'low': 0.75, 'medium': 0.92}, 'human': {'reject': 0.7, 'low': 0.82, 'medium': 0.92}, 'mixed': {'reject': 0.7, 'low': 0.8, 'medium': 0.88}}}, 'overall_burstiness': 0, 'writing_stats': {}, 'subclass': {'ai': {}, 'human': {}, 'mixed': {}}, 'result_message': 'Our detector is highly confident that the text is written entirely by a human.', 'document_classification': 'HUMAN_ONLY', 'version': '2025-01-09-base', 'language': 'en', 'pageNumber': 0, 'inputText': 'The latest breaking updates, delivered straight to your email inbox. Major weather events devastated parts of the world in 2023, as the Earth continues to see warming trends, reports from the National Oceanic and Atmospheric Administration show. Video above: Fires wreak havoc on historic town of Lahaina NOAA says as of Dec. 8 there were 25 ""confirmed weather/climate disaster events with losses exceeding $1 billion each to affect United States."" Here are the weather stories that defined 2023: Thousands of people were displaced from the hundreds of wildfires that began to erupt in Canada in the spring of 2023. The record-breaking fire season in Canada burned land roughly the size of North Dakota, according to NASA\'s Earth Observatory, ""While the total number of reported fires has not been unusual—6,595 by October—a subset of the fires reached extraordinary sizes."" The smoke also led to poor air quality for millions across the midwest and eastern U.S. It is the deadliest U.S. wildfire in more than a century. Flames overtook the scenic island of Maui on Aug. 8, fueled by dry weather and winds from a nearby hurricane. The community of Lahaina suffered the most with many buildings destroyed in the fire. President Joe Biden and first lady Jill Biden visited nearly two weeks after the fire tore through the western part of the island. The death toll has varied but currently stands at 100 people. According to the Associated Press, 12,000 people were displaced in the fire, half of whom were still living in hotels due to housing shortage as of mid-December. Video above: Maui police release Lahaina wildfire body cam video The governor of Hawaii wants to convert vacation rentals to long-term housing for displaced survivors. Hurricane Idalia made landfall as a powerful Category 3 hurricane in Florida\'s Big Bend region. The storm was the strongest to make landfall in the region in more than 125 years. Idalia rapidly intensified over 24 hours. It was a Category 1 storm with 75 mph winds and grew to a monstrous Category 4 storm with 130 mph sustained winds within a day before decreasing to 125 mph winds and Cat 3 by the time it made landfall. The historic storm had record-breaking storm surge from Tampa to the Big Bend. Video below: 2023 Atlantic hurricane season recap Violent storms spawned dozens of tornadoes from the South to the Midwest and the Northeast in April, killing at least 32 people. President Biden had declared broad areas of the country major disaster areas, which made federal resources and financial aid available for recovery. Earlier in March, more than two dozen people were killed after a tornado devastated Mississippi. ""What we’ve seen over the last 36 hours in Mississippi is on one hand heartbreaking, on the other hand, inspiring and quite frankly makes me damn proud to be a Mississippian,"" Mississippi Gov. Tate Reeves said in the aftermath. A massive earthquake struck Syria and Turkey in February, killing at least 50,000 people, according to a report from the AP. The 7.8 magnitude quake hit southern Turkey and northern Syria, and was followed by powerful aftershocks. \'What do I have left?\': Turkey earthquake survivors face despair, as rescues wane Video above: Turkey quake survivors wait in anguish The Associated Press and CNN contributed to this report. Hearst Television participates in various affiliate marketing programs, which means we may get paid commissions on editorially chosen products purchased through our links to retailer sites.'}]"
FL_2023_9e334277ef32eab44927a9fe13a08a84.html.gz,2025-01-09-base,"[{'sentences': [{'generated_prob': 5.27883785252925e-05, 'sentence': 'The Pentagon on Monday identified the five Army aviation special operations forces killed when their UH-60 helicopter crashed in the Eastern Mediterranean.', 'perplexity': 0, 'highlight_sentence_for_ai': False}, {'generated_prob': 3.785075750784017e-05, 'sentence': ""The military's European Command said the helicopter went down over the weekend during an air refueling mission as part of military training."", 'perplexity': 0, 'highlight_sentence_for_ai': False}, {'generated_prob': 4.5976954424986616e-05, 'sentence': 'The five service members who died were Chief Warrant Officer 3 Stephen R. Dwyer, 38, of Clarksville, Tennessee; Chief Warrant Officer 2 Shane M. Barnes, 34, of Sacramento, California; Staff Sgt.', 'perplexity': 0, 'highlight_sentence_for_ai': False}, {'generated_prob': 5.794689059257507e-05, 'sentence': 'Tanner W. Grone, 26, of Gorham, New Hampshire; Sgt.', 'perplexity': 0, 'highlight_sentence_for_ai': False}, {'generated_prob': 5.415028135757893e-05, 'sentence': 'Andrew P. Southard, 27, of Apache Junction, Arizona; and Sgt.', 'perplexity': 0, 'highlight_sentence_for_ai': False}, {'generated_prob': 5.92959149798844e-05, 'sentence': 'Cade M. Wolfe, 24, of Mankato, Minnesota.', 'perplexity': 0, 'highlight_sentence_for_ai': False}, {'generated_prob': 3.899800867657177e-05, 'sentence': ""The U.S. has built up its force presence in the Eastern Mediterranean and the Middle East in response to Hamas' Oct. 7 attack on Israel."", 'perplexity': 0, 'highlight_sentence_for_ai': False}, {'generated_prob': 5.572543159360066e-05, 'sentence': 'There are two carrier strike groups operating in the region, U.S. Air Force squadrons have received additional crews and warplanes, and U.S. special operations forces have been added to help Israel in efforts to rescue hostages taken into Gaza.', 'perplexity': 0, 'highlight_sentence_for_ai': False}, {'generated_prob': 4.5895660150563344e-05, 'sentence': 'Army aviation special operations forces are assigned to the 160th Special Operations Aviation Regiment based at Fort Campbell, Kentucky.', 'perplexity': 0, 'highlight_sentence_for_ai': False}, {'generated_prob': 5.8767942391568795e-05, 'sentence': 'The group has almost 3,000 soldiers and more than 200 aircraft, according to the U.S. Army Special Operations Command.', 'perplexity': 0, 'highlight_sentence_for_ai': False}, {'generated_prob': 0.000657698605209589, 'sentence': 'Pilot killed in US military jet crash in California Hearst Television participates in various affiliate marketing programs, which means we may get paid commissions on editorially chosen products purchased through our links to retailer sites.', 'perplexity': 0, 'highlight_sentence_for_ai': False}], 'paragraphs': [{'start_sentence_index': 0, 'num_sentences': 11, 'completely_generated_prob': 7.905466206762634e-10}], 'completely_generated_prob': 0.005223988389608424, 'class_probabilities': {'human': 0.9947760116103915, 'ai': 0.005223988389608424, 'mixed': 0}, 'average_generated_prob': 0, 'predicted_class': 'human', 'confidence_score': 0.9947760116103915, 'confidence_category': 'high', 'confidence_scores_raw': {'identity': {'ai': 0.005223988389608424, 'human': 0.9947760116103915, 'mixed': 0}}, 'confidence_thresholds_raw': {'identity': {'ai': {'reject': 0.65, 'low': 0.75, 'medium': 0.92}, 'human': {'reject': 0.7, 'low': 0.82, 'medium': 0.92}, 'mixed': {'reject': 0.7, 'low': 0.8, 'medium': 0.88}}}, 'overall_burstiness': 0, 'writing_stats': {}, 'subclass': {'ai': {}, 'human': {}, 'mixed': {}}, 'result_message': 'Our detector is highly confident that the text is written entirely by a human.', 'document_classification': 'HUMAN_ONLY', 'version': '2025-01-09-base', 'language': 'en', 'pageNumber': 0, 'inputText': ""The Pentagon on Monday identified the five Army aviation special operations forces killed when their UH-60 helicopter crashed in the Eastern Mediterranean. The military’s European Command said the helicopter went down over the weekend during an air refueling mission as part of military training. The five service members who died were Chief Warrant Officer 3 Stephen R. Dwyer, 38, of Clarksville, Tennessee; Chief Warrant Officer 2 Shane M. Barnes, 34, of Sacramento, California; Staff Sgt. Tanner W. Grone, 26, of Gorham, New Hampshire; Sgt. Andrew P. Southard, 27, of Apache Junction, Arizona; and Sgt. Cade M. Wolfe, 24, of Mankato, Minnesota. The U.S. has built up its force presence in the Eastern Mediterranean and the Middle East in response to Hamas' Oct. 7 attack on Israel. There are two carrier strike groups operating in the region, U.S. Air Force squadrons have received additional crews and warplanes, and U.S. special operations forces have been added to help Israel in efforts to rescue hostages taken into Gaza. Army aviation special operations forces are assigned to the 160th Special Operations Aviation Regiment based at Fort Campbell, Kentucky. The group has almost 3,000 soldiers and more than 200 aircraft, according to the U.S. Army Special Operations Command. Pilot killed in US military jet crash in California Hearst Television participates in various affiliate marketing programs, which means we may get paid commissions on editorially chosen products purchased through our links to retailer sites.""}]"
