File,version,documents
MD_2022_b56d3ce1ab69610f9baa95cd00e44825.html.gz,2025-01-09-base,"[{'sentences': [{'generated_prob': 0.05951324850320816, 'sentence': 'Partly cloudy.', 'perplexity': 0, 'highlight_sentence_for_ai': False}, {'generated_prob': 0.12921005487442017, 'sentence': 'Low 63F.', 'perplexity': 0, 'highlight_sentence_for_ai': False}, {'generated_prob': 0.07204808294773102, 'sentence': 'Winds light and variable..', 'perplexity': 0, 'highlight_sentence_for_ai': False}, {'generated_prob': 0.06418531388044357, 'sentence': 'Partly cloudy.', 'perplexity': 0, 'highlight_sentence_for_ai': False}, {'generated_prob': 0.04831746593117714, 'sentence': 'Low 63F.', 'perplexity': 0, 'highlight_sentence_for_ai': False}, {'generated_prob': 0.06432491540908813, 'sentence': 'Winds light and variable.', 'perplexity': 0, 'highlight_sentence_for_ai': False}, {'generated_prob': 0.0997270792722702, 'sentence': 'Updated: June 1, 2024 @ 5:42 pm Tiffany Wright On July 14, 2022, Governor Larry Hogan appointed Tiffany Wright as a member of the Patuxent River Commission for a term to expire September 30, 2025.', 'perplexity': 0, 'highlight_sentence_for_ai': False}, {'generated_prob': 0.09013772755861282, 'sentence': 'The Patuxent River Commission aims to protect, enhance, and restore the natural wildlife and environmental resources that the river provides.', 'perplexity': 0, 'highlight_sentence_for_ai': False}, {'generated_prob': 0.06980160623788834, 'sentence': 'Tiffany Wright is currently employed as a Watershed Manager in the City of Bowie Department of Planning and Sustainability.', 'perplexity': 0, 'highlight_sentence_for_ai': False}, {'generated_prob': 0.07382738590240479, 'sentence': ""She is a graduate of Coastal Carolina University, holding a bachelor's degree in Marine Science."", 'perplexity': 0, 'highlight_sentence_for_ai': False}, {'generated_prob': 0.07586396485567093, 'sentence': ""Since joining the City in 2009, Tiffany has completed many major assignments and initiatives, such as starting the City's stream team program, implementing a new tree planting program for residents (Plant One Tree on Us), helping to draft the City's first Sustainability Plan, and more."", 'perplexity': 0, 'highlight_sentence_for_ai': False}, {'generated_prob': 0.05115747079253197, 'sentence': ""In addition to her watershed manager duties, Tiffany assists the Emergency Operations Center and is the delegated authority to act on behalf of the Department Director upon activation of the City's Continuity of Operations Plan."", 'perplexity': 0, 'highlight_sentence_for_ai': False}, {'generated_prob': 0.0055459728464484215, 'sentence': 'She is also co-author and publisher of the annual State of the Environment Report, produces multi-media outreach material such as the Welcome to Your Watershed webinar, gives presentations at local schools and frequently assists the Chesapeake Bay Trust with reviewing their grant applications.', 'perplexity': 0, 'highlight_sentence_for_ai': False}, {'generated_prob': 0.008174512535333633, 'sentence': ""“Tiffany's many years of managing local stream clean ups, public education, forest cover expansion efforts and habitat restoration make her a perfect addition to this important Statewide Commission,” says Joe Meinert, Director of the Planning and Sustainability Department for the City of Bowie."", 'perplexity': 0, 'highlight_sentence_for_ai': False}, {'generated_prob': 0.012887038290500641, 'sentence': 'Log In Keep it Clean.', 'perplexity': 0, 'highlight_sentence_for_ai': False}, {'generated_prob': 0.005244357045739889, 'sentence': 'Please avoid obscene, vulgar, lewd, racist or sexually-oriented language.', 'perplexity': 0, 'highlight_sentence_for_ai': False}, {'generated_prob': 0.009482108987867832, 'sentence': 'PLEASE TURN OFF YOUR CAPS LOCK.', 'perplexity': 0, 'highlight_sentence_for_ai': False}, {'generated_prob': 0.0067506274208426476, 'sentence': ""Don't Threaten."", 'perplexity': 0, 'highlight_sentence_for_ai': False}, {'generated_prob': 0.004583380650728941, 'sentence': 'Threats of harming another person will not be tolerated.', 'perplexity': 0, 'highlight_sentence_for_ai': False}, {'generated_prob': 0.002338087186217308, 'sentence': 'Be Truthful.', 'perplexity': 0, 'highlight_sentence_for_ai': False}, {'generated_prob': 0.003960572648793459, 'sentence': ""Don't knowingly lie about anyone or anything."", 'perplexity': 0, 'highlight_sentence_for_ai': False}, {'generated_prob': 0.0028642648831009865, 'sentence': 'Be Nice.', 'perplexity': 0, 'highlight_sentence_for_ai': False}, {'generated_prob': 0.006270475219935179, 'sentence': 'No racism, sexism or any sort of -ism that is degrading to another person.', 'perplexity': 0, 'highlight_sentence_for_ai': False}, {'generated_prob': 0.005841478705406189, 'sentence': 'Be Proactive.', 'perplexity': 0, 'highlight_sentence_for_ai': False}, {'generated_prob': 0.009749381802976131, 'sentence': ""Use the 'Report' link on each comment to let us know of abusive posts."", 'perplexity': 0, 'highlight_sentence_for_ai': False}, {'generated_prob': 0.010954665020108223, 'sentence': 'Share with Us.', 'perplexity': 0, 'highlight_sentence_for_ai': False}, {'generated_prob': 0.013713754713535309, 'sentence': ""We'd love to hear eyewitness accounts, the history behind an article."", 'perplexity': 0, 'highlight_sentence_for_ai': False}, {'generated_prob': 0.006144058424979448, 'sentence': 'Sign up to receive news and updates from this site directly to your desktop.', 'perplexity': 0, 'highlight_sentence_for_ai': False}, {'generated_prob': 0.008838602341711521, 'sentence': 'Click on the bell icon to manage your notifications at any time.', 'perplexity': 0, 'highlight_sentence_for_ai': False}, {'generated_prob': 0.5691008567810059, 'sentence': 'Your browser is out of date and potentially vulnerable to security risks.We recommend switching to one of the following browsers: Get up-to-the-minute news sent straight to your device.', 'perplexity': 0, 'highlight_sentence_for_ai': False}], 'paragraphs': [{'start_sentence_index': 0, 'num_sentences': 30, 'completely_generated_prob': 1.4437221714898518e-26}], 'completely_generated_prob': 0.05924693143200553, 'class_probabilities': {'human': 0.9404634541111649, 'ai': 0.05924693143200553, 'mixed': 0.0002896144568295141}, 'average_generated_prob': 0, 'predicted_class': 'human', 'confidence_score': 0.9404634541111649, 'confidence_category': 'high', 'confidence_scores_raw': {'identity': {'ai': 0.05924693143200553, 'human': 0.9404634541111649, 'mixed': 0.0002896144568295141}}, 'confidence_thresholds_raw': {'identity': {'ai': {'reject': 0.65, 'low': 0.75, 'medium': 0.92}, 'human': {'reject': 0.7, 'low': 0.82, 'medium': 0.92}, 'mixed': {'reject': 0.7, 'low': 0.8, 'medium': 0.88}}}, 'overall_burstiness': 0, 'writing_stats': {}, 'subclass': {'ai': {}, 'human': {}, 'mixed': {}}, 'result_message': 'Our detector is highly confident that the text is written entirely by a human.', 'document_classification': 'HUMAN_ONLY', 'version': '2025-01-09-base', 'language': 'en', 'pageNumber': 0, 'inputText': ""Partly cloudy. Low 63F. Winds light and variable.. Partly cloudy. Low 63F. Winds light and variable. Updated: June 1, 2024 @ 5:42 pm Tiffany Wright On July 14, 2022, Governor Larry Hogan appointed Tiffany Wright as a member of the Patuxent River Commission for a term to expire September 30, 2025. The Patuxent River Commission aims to protect, enhance, and restore the natural wildlife and environmental resources that the river provides. Tiffany Wright is currently employed as a Watershed Manager in the City of Bowie Department of Planning and Sustainability. She is a graduate of Coastal Carolina University, holding a bachelor’s degree in Marine Science. Since joining the City in 2009, Tiffany has completed many major assignments and initiatives, such as starting the City’s stream team program, implementing a new tree planting program for residents (Plant One Tree on Us), helping to draft the City’s first Sustainability Plan, and more. In addition to her watershed manager duties, Tiffany assists the Emergency Operations Center and is the delegated authority to act on behalf of the Department Director upon activation of the City’s Continuity of Operations Plan. She is also co-author and publisher of the annual State of the Environment Report, produces multi-media outreach material such as the Welcome to Your Watershed webinar, gives presentations at local schools and frequently assists the Chesapeake Bay Trust with reviewing their grant applications. “Tiffany’s many years of managing local stream clean ups, public education, forest cover expansion efforts and habitat restoration make her a perfect addition to this important Statewide Commission,” says Joe Meinert, Director of the Planning and Sustainability Department for the City of Bowie. Log In Keep it Clean. Please avoid obscene, vulgar, lewd, racist or sexually-oriented language. PLEASE TURN OFF YOUR CAPS LOCK. Don't Threaten. Threats of harming another person will not be tolerated. Be Truthful. Don't knowingly lie about anyone or anything. Be Nice. No racism, sexism or any sort of -ism that is degrading to another person. Be Proactive. Use the 'Report' link on each comment to let us know of abusive posts. Share with Us. We'd love to hear eyewitness accounts, the history behind an article. Sign up to receive news and updates from this site directly to your desktop. Click on the bell icon to manage your notifications at any time. Your browser is out of date and potentially vulnerable to security risks.We recommend switching to one of the following browsers: Get up-to-the-minute news sent straight to your device.""}]"
MD_2022_c20404be015729a83a38c618b7bbadc7.html.gz,2025-01-09-base,"[{'sentences': [{'generated_prob': 0.002984333783388138, 'sentence': 'A little bit of everything The U.S. has largely had a liberal-leaning Supreme Court since the Roe v. Wade decision.', 'perplexity': 0, 'highlight_sentence_for_ai': False}, {'generated_prob': 0.003492431016638875, 'sentence': ""Now, for the first time, A former colleague and good friend told me a quote, “Just when you think humanity has reached its lowest point, the bottom drops out and you find that there are many, many more bottoms to come.” Image by Gerd Altmann from Pixabay The first strategic mistake that the European Union and President Biden made with Russia's Image by Hier und jetzt endet leider meine Reise auf Pixabay?"", 'perplexity': 0, 'highlight_sentence_for_ai': False}, {'generated_prob': 0.0036827789153903723, 'sentence': 'from Pixabay “If you are working with a I need to ask for your advice.', 'perplexity': 0, 'highlight_sentence_for_ai': False}, {'generated_prob': 0.005825945641845465, 'sentence': 'I will provide you with two quotes.', 'perplexity': 0, 'highlight_sentence_for_ai': False}, {'generated_prob': 0.004530708305537701, 'sentence': 'Which one should be on my tombstone?', 'perplexity': 0, 'highlight_sentence_for_ai': False}, {'generated_prob': 0.004027104005217552, 'sentence': 'I cannot decide and would appreciate your input.', 'perplexity': 0, 'highlight_sentence_for_ai': False}, {'generated_prob': 0.0063917310908436775, 'sentence': ""I have not done anything particularly bad or good, don't know if I have impacted or changed anything or anyone."", 'perplexity': 0, 'highlight_sentence_for_ai': False}, {'generated_prob': 0.004325606860220432, 'sentence': 'I think my kids love me, and I know my dog does, as much as a 9-month-old Pomeranian can love.', 'perplexity': 0, 'highlight_sentence_for_ai': False}, {'generated_prob': 0.0067881192080676556, 'sentence': ""Image by kerttu from Pixabay Yes, this Article will Stay Invisible, But … Given that I am a social worker I hate having to put these in my articles and often don't because if one reads close enough, I never justify or condone child sexual abuse."", 'perplexity': 0, 'highlight_sentence_for_ai': False}, {'generated_prob': 0.00845167227089405, 'sentence': 'I ask tough questions.', 'perplexity': 0, 'highlight_sentence_for_ai': False}, {'generated_prob': 0.005799586419016123, 'sentence': ""Image by denizecenci from Pixabay In the Subtle Art of Not Giving a F*ck, Mark Manson's words brought to light Image by M P from Pixabay In his recent article entitled “Offshore Core,” Harvard history professor James Hankins argues that Image by Gerd Altmann from Pixabay I shouldn't have been surprised at my rejection from a Ph.D. program in public Source No account?"", 'perplexity': 0, 'highlight_sentence_for_ai': False}, {'generated_prob': 0.011183083988726139, 'sentence': 'Register here Forgot password Copyright © 2012 - 2024 Baltimore Post-ExaminerWebsite Hosting & Management by Mays & Associates', 'perplexity': 0, 'highlight_sentence_for_ai': False}], 'paragraphs': [{'start_sentence_index': 0, 'num_sentences': 12, 'completely_generated_prob': 1.0731758790825431e-10}], 'completely_generated_prob': 0.017917192071486437, 'class_probabilities': {'human': 0.9820828079285135, 'ai': 0.017917192071486437, 'mixed': 0}, 'average_generated_prob': 0, 'predicted_class': 'human', 'confidence_score': 0.9820828079285135, 'confidence_category': 'high', 'confidence_scores_raw': {'identity': {'ai': 0.017917192071486437, 'human': 0.9820828079285135, 'mixed': 0}}, 'confidence_thresholds_raw': {'identity': {'ai': {'reject': 0.65, 'low': 0.75, 'medium': 0.92}, 'human': {'reject': 0.7, 'low': 0.82, 'medium': 0.92}, 'mixed': {'reject': 0.7, 'low': 0.8, 'medium': 0.88}}}, 'overall_burstiness': 0, 'writing_stats': {}, 'subclass': {'ai': {}, 'human': {}, 'mixed': {}}, 'result_message': 'Our detector is highly confident that the text is written entirely by a human.', 'document_classification': 'HUMAN_ONLY', 'version': '2025-01-09-base', 'language': 'en', 'pageNumber': 0, 'inputText': 'A little bit of everything The U.S. has largely had a liberal-leaning Supreme Court since the Roe v. Wade decision. Now, for the first time, A former colleague and good friend told me a quote, “Just when you think humanity has reached its lowest point, the bottom drops out and you find that there are many, many more bottoms to come.” Image by Gerd Altmann from Pixabay The first strategic mistake that the European Union and President Biden made with Russia’s Image by Hier und jetzt endet leider meine Reise auf Pixabay ? from Pixabay “If you are working with a I need to ask for your advice. I will provide you with two quotes. Which one should be on my tombstone? I cannot decide and would appreciate your input. I have not done anything particularly bad or good, don’t know if I have impacted or changed anything or anyone. I think my kids love me, and I know my dog does, as much as a 9-month-old Pomeranian can love. Image by kerttu from Pixabay Yes, this Article will Stay Invisible, But … Given that I am a social worker I hate having to put these in my articles and often don’t because if one reads close enough, I never justify or condone child sexual abuse. I ask tough questions. Image by denizecenci from Pixabay In the Subtle Art of Not Giving a F*ck, Mark Manson’s words brought to light Image by M P from Pixabay In his recent article entitled “Offshore Core,” Harvard history professor James Hankins argues that Image by Gerd Altmann from Pixabay I shouldn’t have been surprised at my rejection from a Ph.D. program in public Source No account? Register here Forgot password Copyright © 2012 - 2024 Baltimore Post-ExaminerWebsite Hosting & Management by Mays & Associates'}]"
MD_2022_c35e56a7d499ff13970436a164b28af3.html.gz,2025-01-09-base,"[{'sentences': [{'generated_prob': 0.00017848913557827473, 'sentence': ""The Hellenic Society has officially re-entered Loyola's campus, since ending in fall of 2020."", 'perplexity': 0, 'highlight_sentence_for_ai': False}, {'generated_prob': 0.00014183131861500442, 'sentence': 'The meeting took place on Oct. 20, 2022.', 'perplexity': 0, 'highlight_sentence_for_ai': False}, {'generated_prob': 0.00023401703219860792, 'sentence': '“Many members had stopped going to meetings ever since quarantine began.', 'perplexity': 0, 'highlight_sentence_for_ai': False}, {'generated_prob': 0.00019352504750713706, 'sentence': ""By the time fall 2020 came around, the Hellenic Society was completely forgotten,” Maria Diacoloukas '23 said."", 'perplexity': 0, 'highlight_sentence_for_ai': False}, {'generated_prob': 0.00027429958572611213, 'sentence': ""The previous co-presidents of the Hellenic Society were Marissa Flevotomos '21 and Deanna Gavaris '22."", 'perplexity': 0, 'highlight_sentence_for_ai': False}, {'generated_prob': 0.0003007059858646244, 'sentence': ""This academic year, Christina Ridgill '24, decided to resurrect the club."", 'perplexity': 0, 'highlight_sentence_for_ai': False}, {'generated_prob': 0.00035426608519628644, 'sentence': '“As someone who is Greek, I know a lot of people on campus who either are Greek, or interested in Greek culture, so it seemed like a perfect idea to recreate it,” Ridgill, the president of the club, said.', 'perplexity': 0, 'highlight_sentence_for_ai': False}, {'generated_prob': 0.0004407888336572796, 'sentence': 'About 10 people were present at the first meeting, held in the Sellinger School of Business and Management.', 'perplexity': 0, 'highlight_sentence_for_ai': False}, {'generated_prob': 0.0004090743022970855, 'sentence': 'At the meeting, Ridgill and the board discussed the events taking place involving the Hellenic Society, such as Oxi Day, Greek festivals, and more.', 'perplexity': 0, 'highlight_sentence_for_ai': False}, {'generated_prob': 0.00044068292481824756, 'sentence': '“As someone who had been in a Greek youth club all through middle and high school, I missed having a Greek community.', 'perplexity': 0, 'highlight_sentence_for_ai': False}, {'generated_prob': 0.0003095433348789811, 'sentence': 'I know many other Greeks on campus feel the same,” Diacoloukas said.', 'perplexity': 0, 'highlight_sentence_for_ai': False}, {'generated_prob': 0.0003846068284474313, 'sentence': 'Alex Ridgill is the Vice President of The Hellenic Society, and Stephanie Diacogiannis is the historian.', 'perplexity': 0, 'highlight_sentence_for_ai': False}, {'generated_prob': 0.0006266764830797911, 'sentence': '“We are planning a trip to the Hellenic Heritage Museum in Baltimore, attending the International Festival, and continuing to hold meetings where we discuss and inform members on Greek holidays and feast days,” Ridgill said.', 'perplexity': 0, 'highlight_sentence_for_ai': False}, {'generated_prob': 0.0005372486775740981, 'sentence': '“I am looking forward to the club starting up again, hopefully better than ever,” Diacoloukas said.', 'perplexity': 0, 'highlight_sentence_for_ai': False}, {'generated_prob': 0.0009221844375133514, 'sentence': 'Meetings will be held on Thursdays at 5:30 p.m. in Sellinger room 005.', 'perplexity': 0, 'highlight_sentence_for_ai': False}, {'generated_prob': 0.0004760358715429902, 'sentence': 'Contact Christina Ridgill at [email protected] about any inquiries about the Hellenic Society.', 'perplexity': 0, 'highlight_sentence_for_ai': False}, {'generated_prob': 0.000986430561169982, 'sentence': 'Featured Image courtesy of Sophie Hertz.', 'perplexity': 0, 'highlight_sentence_for_ai': False}], 'paragraphs': [{'start_sentence_index': 0, 'num_sentences': 17, 'completely_generated_prob': 4.571217651318373e-15}], 'completely_generated_prob': 0.00982192507144982, 'class_probabilities': {'human': 0.9901780749285501, 'ai': 0.00982192507144982, 'mixed': 0}, 'average_generated_prob': 0, 'predicted_class': 'human', 'confidence_score': 0.9901780749285501, 'confidence_category': 'high', 'confidence_scores_raw': {'identity': {'ai': 0.00982192507144982, 'human': 0.9901780749285501, 'mixed': 0}}, 'confidence_thresholds_raw': {'identity': {'ai': {'reject': 0.65, 'low': 0.75, 'medium': 0.92}, 'human': {'reject': 0.7, 'low': 0.82, 'medium': 0.92}, 'mixed': {'reject': 0.7, 'low': 0.8, 'medium': 0.88}}}, 'overall_burstiness': 0, 'writing_stats': {}, 'subclass': {'ai': {}, 'human': {}, 'mixed': {}}, 'result_message': 'Our detector is highly confident that the text is written entirely by a human.', 'document_classification': 'HUMAN_ONLY', 'version': '2025-01-09-base', 'language': 'en', 'pageNumber': 0, 'inputText': 'The Hellenic Society has officially re-entered Loyola’s campus, since ending in fall of 2020. The meeting took place on Oct. 20, 2022. “Many members had stopped going to meetings ever since quarantine began. By the time fall 2020 came around, the Hellenic Society was completely forgotten,” Maria Diacoloukas ‘23 said. The previous co-presidents of the Hellenic Society were Marissa Flevotomos ‘21 and Deanna Gavaris ‘22. This academic year, Christina Ridgill ‘24, decided to resurrect the club. “As someone who is Greek, I know a lot of people on campus who either are Greek, or interested in Greek culture, so it seemed like a perfect idea to recreate it,” Ridgill, the president of the club, said. About 10 people were present at the first meeting, held in the Sellinger School of Business and Management. At the meeting, Ridgill and the board discussed the events taking place involving the Hellenic Society, such as Oxi Day, Greek festivals, and more. “As someone who had been in a Greek youth club all through middle and high school, I missed having a Greek community. I know many other Greeks on campus feel the same,” Diacoloukas said. Alex Ridgill is the Vice President of The Hellenic Society, and Stephanie Diacogiannis is the historian. “We are planning a trip to the Hellenic Heritage Museum in Baltimore, attending the International Festival, and continuing to hold meetings where we discuss and inform members on Greek holidays and feast days,” Ridgill said. “I am looking forward to the club starting up again, hopefully better than ever,” Diacoloukas said. Meetings will be held on Thursdays at 5:30 p.m. in Sellinger room 005. Contact Christina Ridgill at [email protected] about any inquiries about the Hellenic Society. Featured Image courtesy of Sophie Hertz.'}]"
