File,version,documents
GA_2023_cc7ba5afe0a511d9122dfc66bbcd14eb.html.gz,2025-01-09-base,"[{'sentences': [{'generated_prob': 0.1273660957813263, 'sentence': 'Dresden Park is getting an update and will need to close for the next 14 months to accommodate the changes.', 'perplexity': 0, 'highlight_sentence_for_ai': False}, {'generated_prob': 0.1453169733285904, 'sentence': 'Chamblee police have made an arrest in a disturbing case that unraveled at a Whole Foods on May 11.', 'perplexity': 0, 'highlight_sentence_for_ai': False}, {'generated_prob': 0.1733156144618988, 'sentence': 'The Chamblee Police Department is reporting that a man allegedly ejaculated on a woman at the Whole Foods store at 5001 Peachtree Boulevard near Clairmont Road in Chamblee on May 11.', 'perplexity': 0, 'highlight_sentence_for_ai': False}, {'generated_prob': 0.19931793212890625, 'sentence': 'A 48-year-old Georgia police lieutenant was arrested, accused of sharing child pornography online.', 'perplexity': 0, 'highlight_sentence_for_ai': False}, {'generated_prob': 0.23131240904331207, 'sentence': 'Buford Highway was closed in both directions around 11 a.m. in Chamblee after a construction crew partially snapped a power pole.', 'perplexity': 0, 'highlight_sentence_for_ai': False}, {'generated_prob': 0.18057766556739807, 'sentence': 'A man was arrested at the Federal Bureau of Investigation office in Chamblee after ramming a car into their security gate just after noon, according to the FBI.', 'perplexity': 0, 'highlight_sentence_for_ai': False}, {'generated_prob': 0.2040080726146698, 'sentence': 'Police responded to a shooting early Monday morning in the 3600 block of Clairmont Road, which is near Dresden Drive.', 'perplexity': 0, 'highlight_sentence_for_ai': False}, {'generated_prob': 0.17595291137695312, 'sentence': 'For his 100th birthday, World War II veteran Paul Crawford flew a P-51 Mustang.', 'perplexity': 0, 'highlight_sentence_for_ai': False}, {'generated_prob': 0.2794662117958069, 'sentence': 'One person was arrested in the shooting of a man believed to be homeless at a Chamblee gas station on Monday afternoon.', 'perplexity': 0, 'highlight_sentence_for_ai': False}, {'generated_prob': 0.3397246301174164, 'sentence': 'A Chamblee police officer opened fire on a man armed with a machete following a shoplifting call.', 'perplexity': 0, 'highlight_sentence_for_ai': False}, {'generated_prob': 0.24454671144485474, 'sentence': 'The brutal ambush beating Brandon White received that made him want to become a police officers and protect others from similar attacks.', 'perplexity': 0, 'highlight_sentence_for_ai': False}, {'generated_prob': 0.0003604564117267728, 'sentence': 'A man was charged with arson after he told Chamblee police he started a fire at his home with his brother inside.', 'perplexity': 0, 'highlight_sentence_for_ai': False}, {'generated_prob': 0.0003860591386910528, 'sentence': 'A newly-released video from the Chamblee Police Department shows a dramatic confrontation between two drivers on Jan. 20.', 'perplexity': 0, 'highlight_sentence_for_ai': False}, {'generated_prob': 0.0004699583223555237, 'sentence': 'A suspected drunk driver fleeing from Chamblee police ended up in a head-on crash along Shallowford Road on Thursday evening.', 'perplexity': 0, 'highlight_sentence_for_ai': False}, {'generated_prob': 0.0005325803067535162, 'sentence': ""Frigid temperatures are too dangerous for people who don't have a home or who can't afford heat."", 'perplexity': 0, 'highlight_sentence_for_ai': False}, {'generated_prob': 0.0004602967528626323, 'sentence': 'On Friday night, a Chamblee police officer says she was hit by a driver believed to be drunk.', 'perplexity': 0, 'highlight_sentence_for_ai': False}, {'generated_prob': 0.0005567930638790131, 'sentence': 'A police officer shot a driver during a traffic stop outside a Chamblee Walgreens on Thursday morning, officials say.', 'perplexity': 0, 'highlight_sentence_for_ai': False}, {'generated_prob': 0.00035949813900515437, 'sentence': ""The Bronx Bagel Buggy started as a hobby during the pandemic for its owners, but it's become their full-time passion and full-time job."", 'perplexity': 0, 'highlight_sentence_for_ai': False}, {'generated_prob': 0.0005406502168625593, 'sentence': 'The pilot and co-pilot of a charter plane had some scary moments Thursday afternoon when the landing gear of the plane failed to deploy while landing in DeKalb County.', 'perplexity': 0, 'highlight_sentence_for_ai': False}, {'generated_prob': 0.0005240351310931146, 'sentence': 'A bomb threat resulted in the evacuation of Vintage Pizzeria and Heritage Lofts in the 5400 block of Peachtree Road in Chamblee early Thursday afternoon.', 'perplexity': 0, 'highlight_sentence_for_ai': False}, {'generated_prob': 0.0003039954463019967, 'sentence': 'This material may not be published, broadcast, rewritten, or redistributed.', 'perplexity': 0, 'highlight_sentence_for_ai': False}, {'generated_prob': 0.00043997380998916924, 'sentence': '©2024 FOX Television Stations', 'perplexity': 0, 'highlight_sentence_for_ai': False}], 'paragraphs': [{'start_sentence_index': 0, 'num_sentences': 22, 'completely_generated_prob': 1.790351317743908e-19}], 'completely_generated_prob': 0.06633669730667867, 'class_probabilities': {'human': 0.9336633026933213, 'ai': 0.06633669730667867, 'mixed': 0}, 'average_generated_prob': 0, 'predicted_class': 'human', 'confidence_score': 0.9336633026933213, 'confidence_category': 'high', 'confidence_scores_raw': {'identity': {'ai': 0.06633669730667867, 'human': 0.9336633026933213, 'mixed': 0}}, 'confidence_thresholds_raw': {'identity': {'ai': {'reject': 0.65, 'low': 0.75, 'medium': 0.92}, 'human': {'reject': 0.7, 'low': 0.82, 'medium': 0.92}, 'mixed': {'reject': 0.7, 'low': 0.8, 'medium': 0.88}}}, 'overall_burstiness': 0, 'writing_stats': {}, 'subclass': {'ai': {}, 'human': {}, 'mixed': {}}, 'result_message': 'Our detector is highly confident that the text is written entirely by a human.', 'document_classification': 'HUMAN_ONLY', 'version': '2025-01-09-base', 'language': 'en', 'pageNumber': 0, 'inputText': ""Dresden Park is getting an update and will need to close for the next 14 months to accommodate the changes. Chamblee police have made an arrest in a disturbing case that unraveled at a Whole Foods on May 11. The Chamblee Police Department is reporting that a man allegedly ejaculated on a woman at the Whole Foods store at 5001 Peachtree Boulevard near Clairmont Road in Chamblee on May 11. A 48-year-old Georgia police lieutenant was arrested, accused of sharing child pornography online. Buford Highway was closed in both directions around 11 a.m. in Chamblee after a construction crew partially snapped a power pole. A man was arrested at the Federal Bureau of Investigation office in Chamblee after ramming a car into their security gate just after noon, according to the FBI. Police responded to a shooting early Monday morning in the 3600 block of Clairmont Road, which is near Dresden Drive. For his 100th birthday, World War II veteran Paul Crawford flew a P-51 Mustang. One person was arrested in the shooting of a man believed to be homeless at a Chamblee gas station on Monday afternoon. A Chamblee police officer opened fire on a man armed with a machete following a shoplifting call. The brutal ambush beating Brandon White received that made him want to become a police officers and protect others from similar attacks. A man was charged with arson after he told Chamblee police he started a fire at his home with his brother inside. A newly-released video from the Chamblee Police Department shows a dramatic confrontation between two drivers on Jan. 20. A suspected drunk driver fleeing from Chamblee police ended up in a head-on crash along Shallowford Road on Thursday evening. Frigid temperatures are too dangerous for people who don’t have a home or who can’t afford heat. On Friday night, a Chamblee police officer says she was hit by a driver believed to be drunk. A police officer shot a driver during a traffic stop outside a Chamblee Walgreens on Thursday morning, officials say. The Bronx Bagel Buggy started as a hobby during the pandemic for its owners, but it's become their full-time passion and full-time job. The pilot and co-pilot of a charter plane had some scary moments Thursday afternoon when the landing gear of the plane failed to deploy while landing in DeKalb County. A bomb threat resulted in the evacuation of Vintage Pizzeria and Heritage Lofts in the 5400 block of Peachtree Road in Chamblee early Thursday afternoon. This material may not be published, broadcast, rewritten, or redistributed. ©2024 FOX Television Stations""}]"
GA_2023_d220c6a4aecaf1df66fff69aaffceb24.html.gz,2025-01-09-base,"[{'sentences': [{'generated_prob': 0.008016332983970642, 'sentence': 'Sections About Connect With Us The End Zone is a weekly segment on 41NBC/WMGT and 41NBC.com to showcase local Middle Georgia High School Football scores and highlights.', 'perplexity': 0, 'highlight_sentence_for_ai': False}, {'generated_prob': 0.008446198888123035, 'sentence': 'The show airs on 41NBC every Friday at 11:15 PM and the highlights/segment will be available online immediately after.', 'perplexity': 0, 'highlight_sentence_for_ai': False}, {'generated_prob': 0.012248089537024498, 'sentence': ""December 20, 2023 MACON, Georgia (41NBC/WMGT) ᅳ It's National Signing Day!"", 'perplexity': 0, 'highlight_sentence_for_ai': False}, {'generated_prob': 0.012329654768109322, 'sentence': ""Here's a running list of Middle Georgia football players who have signed letters of intent or are expected to sign soon."", 'perplexity': 0, 'highlight_sentence_for_ai': False}, {'generated_prob': 0.021423740312457085, 'sentence': 'The list is compiled from national recruiting service reports (247Sports, Rivals,… December 1, 2023 MANCHESTER, Georgia (41NBC/WMGT) ᅳ The Telfair County Trojans visited the Manchester Blue Devils for a spot in the GHSA A-Division II state championship game.', 'perplexity': 0, 'highlight_sentence_for_ai': False}, {'generated_prob': 0.014150146394968033, 'sentence': 'The Trojans had beaten… December 1, 2023 MACON, Georgia (41NBC/WMGT) ᅳ The John Milledge Trojans played the Valwood Valiants on Thursday night in the GIAA-AAA state championship game.', 'perplexity': 0, 'highlight_sentence_for_ai': False}, {'generated_prob': 0.020287707448005676, 'sentence': ""The… December 1, 2023 MACON, Georgia (41NBC/WMGT) ᅳ The FPD Vikings took on the Brookstone Cougars at Mercer's Five Star Stadium Friday for the GIAA-AAAA state championship."", 'perplexity': 0, 'highlight_sentence_for_ai': False}, {'generated_prob': 0.029182782396674156, 'sentence': ""The Vikings… December 1, 2023 FAYETTEVILLE, Georgia (41NBC/WMGT) ᅳThe Perry Panthers were on the road to take on the Starr's Mill Panthers for a spot in the GHSA AAAA state championship."", 'perplexity': 0, 'highlight_sentence_for_ai': False}, {'generated_prob': 0.015979254618287086, 'sentence': ""Perry… December 1, 2023 MACON, Georgia (41NBC/WMGT) - Here are Middle Georgia's high school football scores from the semifinals of the GHSA football playoffs and finals of the… December 1, 2023 MACON, Georgia (41NBC/WMGT) - Chance Jones is out as Stratford Academy's head football coach after two seasons."", 'perplexity': 0, 'highlight_sentence_for_ai': False}, {'generated_prob': 0.009980376809835434, 'sentence': 'The news was first reported this week by the Central Georgia Sports Report, which cited an email school officials sent to parents.', 'perplexity': 0, 'highlight_sentence_for_ai': False}, {'generated_prob': 0.04197309538722038, 'sentence': 'Head… November 24, 2023 FORSYTH, Georgia (41NBC/WMGT) ᅳ The Mary Persons Bulldogs hosted the Cedar Grove Saints for a quarterfinal matchup at Dan Pitts Stadium at Mitchell Field.', 'perplexity': 0, 'highlight_sentence_for_ai': False}, {'generated_prob': 0.006800886243581772, 'sentence': 'The Bulldogs have… November 24, 2023 WARNER ROBINS, Georgia (41NBC/WMGT) ᅳThe Warner Robins Demons took on the Creekside Seminoles on Friday night at McConnell-Talbert Stadium.', 'perplexity': 0, 'highlight_sentence_for_ai': False}, {'generated_prob': 0.008552598766982555, 'sentence': 'The Demons beat Creekside last year in the quarterfinals… November 24, 2023 MILLEDGEVILLE, Georgia (41NBC/WMGT) ᅳ The John Milledge Trojans welcomed in the Pinewood Christian Patriots to Trojan Field on Friday night in a GIAA semi-final game.', 'perplexity': 0, 'highlight_sentence_for_ai': False}, {'generated_prob': 0.013523835688829422, 'sentence': 'The Trojans have… © 2024 41NBC News | WMGT-DT.', 'perplexity': 0, 'highlight_sentence_for_ai': False}, {'generated_prob': 0.022814400494098663, 'sentence': 'Clear.', 'perplexity': 0, 'highlight_sentence_for_ai': False}, {'generated_prob': 0.0193330105394125, 'sentence': 'Accurate.', 'perplexity': 0, 'highlight_sentence_for_ai': False}, {'generated_prob': 0.026809247210621834, 'sentence': 'To the Point.', 'perplexity': 0, 'highlight_sentence_for_ai': False}, {'generated_prob': 0.012020293623209, 'sentence': ""Talk to 41NBC/WMGT's anchors, reporters and meteorologists."", 'perplexity': 0, 'highlight_sentence_for_ai': False}, {'generated_prob': 0.01321678701788187, 'sentence': 'When you see news happening, share it!', 'perplexity': 0, 'highlight_sentence_for_ai': False}, {'generated_prob': 0.014970310963690281, 'sentence': ""We'd love to hear from you."", 'perplexity': 0, 'highlight_sentence_for_ai': False}, {'generated_prob': 0.010440007783472538, 'sentence': '(478) 745- 4141 | Share It Download the 41NBC News App and the 41NBC Accuweather App on your smartphone or tablet.', 'perplexity': 0, 'highlight_sentence_for_ai': False}, {'generated_prob': 0.017041973769664764, 'sentence': 'NEWS App | WEATHER App Get breaking news alerts, daily headlines and exclusive offers in your inbox.', 'perplexity': 0, 'highlight_sentence_for_ai': False}, {'generated_prob': 0.012080442160367966, 'sentence': '41NBC Email Sign Up', 'perplexity': 0, 'highlight_sentence_for_ai': False}], 'paragraphs': [{'start_sentence_index': 0, 'num_sentences': 23, 'completely_generated_prob': 2.3367398512545458e-20}], 'completely_generated_prob': 0.025041194076269924, 'class_probabilities': {'human': 0.974671313226954, 'ai': 0.025041194076269924, 'mixed': 0.00028749269677611}, 'average_generated_prob': 0, 'predicted_class': 'human', 'confidence_score': 0.974671313226954, 'confidence_category': 'high', 'confidence_scores_raw': {'identity': {'ai': 0.025041194076269924, 'human': 0.974671313226954, 'mixed': 0.00028749269677611}}, 'confidence_thresholds_raw': {'identity': {'ai': {'reject': 0.65, 'low': 0.75, 'medium': 0.92}, 'human': {'reject': 0.7, 'low': 0.82, 'medium': 0.92}, 'mixed': {'reject': 0.7, 'low': 0.8, 'medium': 0.88}}}, 'overall_burstiness': 0, 'writing_stats': {}, 'subclass': {'ai': {}, 'human': {}, 'mixed': {}}, 'result_message': 'Our detector is highly confident that the text is written entirely by a human.', 'document_classification': 'HUMAN_ONLY', 'version': '2025-01-09-base', 'language': 'en', 'pageNumber': 0, 'inputText': ""Sections About Connect With Us The End Zone is a weekly segment on 41NBC/WMGT and 41NBC.com to showcase local Middle Georgia High School Football scores and highlights. The show airs on 41NBC every Friday at 11:15 PM and the highlights/segment will be available online immediately after. December 20, 2023 MACON, Georgia (41NBC/WMGT) — It's National Signing Day! Here's a running list of Middle Georgia football players who have signed letters of intent or are expected to sign soon. The list is compiled from national recruiting service reports (247Sports, Rivals,… December 1, 2023 MANCHESTER, Georgia (41NBC/WMGT) — The Telfair County Trojans visited the Manchester Blue Devils for a spot in the GHSA A-Division II state championship game. The Trojans had beaten… December 1, 2023 MACON, Georgia (41NBC/WMGT) — The John Milledge Trojans played the Valwood Valiants on Thursday night in the GIAA-AAA state championship game. The… December 1, 2023 MACON, Georgia (41NBC/WMGT) — The FPD Vikings took on the Brookstone Cougars at Mercer's Five Star Stadium Friday for the GIAA-AAAA state championship. The Vikings… December 1, 2023 FAYETTEVILLE, Georgia (41NBC/WMGT) —The Perry Panthers were on the road to take on the Starr's Mill Panthers for a spot in the GHSA AAAA state championship. Perry… December 1, 2023 MACON, Georgia (41NBC/WMGT) – Here are Middle Georgia’s high school football scores from the semifinals of the GHSA football playoffs and finals of the… December 1, 2023 MACON, Georgia (41NBC/WMGT) - Chance Jones is out as Stratford Academy's head football coach after two seasons. The news was first reported this week by the Central Georgia Sports Report, which cited an email school officials sent to parents. Head… November 24, 2023 FORSYTH, Georgia (41NBC/WMGT) — The Mary Persons Bulldogs hosted the Cedar Grove Saints for a quarterfinal matchup at Dan Pitts Stadium at Mitchell Field. The Bulldogs have… November 24, 2023 WARNER ROBINS, Georgia (41NBC/WMGT) —The Warner Robins Demons took on the Creekside Seminoles on Friday night at McConnell-Talbert Stadium. The Demons beat Creekside last year in the quarterfinals… November 24, 2023 MILLEDGEVILLE, Georgia (41NBC/WMGT) — The John Milledge Trojans welcomed in the Pinewood Christian Patriots to Trojan Field on Friday night in a GIAA semi-final game. The Trojans have… © 2024 41NBC News | WMGT-DT. Clear. Accurate. To the Point. Talk to 41NBC/WMGT’s anchors, reporters and meteorologists. When you see news happening, share it! We’d love to hear from you. (478) 745- 4141 | Share It Download the 41NBC News App and the 41NBC Accuweather App on your smartphone or tablet. NEWS App | WEATHER App Get breaking news alerts, daily headlines and exclusive offers in your inbox. 41NBC Email Sign Up""}]"
GA_2023_d4aaa501bd9ce541ca224cf6718f7a88.html.gz,2025-01-09-base,"[{'sentences': [{'generated_prob': 0.0002474341890774667, 'sentence': 'Aria joined WTOC in November of 2022.', 'perplexity': 0, 'highlight_sentence_for_ai': False}, {'generated_prob': 0.00023585811140947044, 'sentence': ""She is an anchor for THE News at Daybreak and works on WTOC Investigates' Asked and Answered franchise."", 'perplexity': 0, 'highlight_sentence_for_ai': False}, {'generated_prob': 0.0001980263041332364, 'sentence': 'Aria recently worked in Cleveland, OH as a reporter where she focused on community stories and seeking results.', 'perplexity': 0, 'highlight_sentence_for_ai': False}, {'generated_prob': 0.00021405619918368757, 'sentence': 'Before working in Cleveland, Aria was a reporter in Evansville, IN.', 'perplexity': 0, 'highlight_sentence_for_ai': False}, {'generated_prob': 0.00027283752569928765, 'sentence': 'She is originally from Kannapolis, North Carolina, a small town outside of Charlotte.', 'perplexity': 0, 'highlight_sentence_for_ai': False}, {'generated_prob': 0.0003418148262426257, 'sentence': 'Aria graduated from The University of North Carolina Wilmington in May of 2018.', 'perplexity': 0, 'highlight_sentence_for_ai': False}, {'generated_prob': 0.00026522992993704975, 'sentence': 'There she earned her Bachelor of Arts degree in Communication Studies and minored in Psychology.', 'perplexity': 0, 'highlight_sentence_for_ai': False}, {'generated_prob': 0.0003070018719881773, 'sentence': 'While Studying at UNCW she spent a semester abroad in England where she attended Keele University and took classes in film and marketing.', 'perplexity': 0, 'highlight_sentence_for_ai': False}, {'generated_prob': 0.00018485021428205073, 'sentence': 'Aria is a proud member of Alpha Kappa Alpha Sorority Inc. and loves finding ways to give back to her community.', 'perplexity': 0, 'highlight_sentence_for_ai': False}, {'generated_prob': 0.0001758843136485666, 'sentence': 'When Aria is not working, she loves playing and taking photos with her dog Kaizer, binge watching TV shows, trying new restaurants, and traveling to new places.', 'perplexity': 0, 'highlight_sentence_for_ai': False}, {'generated_prob': 0.00025783677119761705, 'sentence': 'You can reach out to Aria via email at aria.janel@wtoc.com or by following her on social media @ariajaneltv.', 'perplexity': 0, 'highlight_sentence_for_ai': False}, {'generated_prob': 0.0002895201905630529, 'sentence': 'You can send Aria a tip for Asked and Answered by calling 912-238-8351.', 'perplexity': 0, 'highlight_sentence_for_ai': False}, {'generated_prob': 0.0010823642369359732, 'sentence': ""News News Health News Style Food Morning Break Morning Break Asked and Answered Events Asked and Answered Asked and Answered Asked and Answered Asked and Answered Events Community News Asked and Answered Food St. Patrick's Day News Celebrating Black History Calendar Morning Break Asked and Answered WTOC Investigates Asked and Answered WTOC Investigates Asked and Answered News Asked and Answered Asked and Answered Asked and Answered Asked and Answered WTOC Investigates Asked and Answered Asked and Answered Asked and Answered Elections Center Asked and Answered Asked and Answered Asked and Answered Food Asked and Answered Morning Break Asked and Answered Morning Break and Afternoon Break Events Morning Break and Afternoon Break"", 'perplexity': 0, 'highlight_sentence_for_ai': False}], 'paragraphs': [{'start_sentence_index': 0, 'num_sentences': 13, 'completely_generated_prob': 1.4476848035102901e-11}], 'completely_generated_prob': 0.00879996730024586, 'class_probabilities': {'human': 0.9912000326997541, 'ai': 0.00879996730024586, 'mixed': 0}, 'average_generated_prob': 0, 'predicted_class': 'human', 'confidence_score': 0.9912000326997541, 'confidence_category': 'high', 'confidence_scores_raw': {'identity': {'ai': 0.00879996730024586, 'human': 0.9912000326997541, 'mixed': 0}}, 'confidence_thresholds_raw': {'identity': {'ai': {'reject': 0.65, 'low': 0.75, 'medium': 0.92}, 'human': {'reject': 0.7, 'low': 0.82, 'medium': 0.92}, 'mixed': {'reject': 0.7, 'low': 0.8, 'medium': 0.88}}}, 'overall_burstiness': 0, 'writing_stats': {}, 'subclass': {'ai': {}, 'human': {}, 'mixed': {}}, 'result_message': 'Our detector is highly confident that the text is written entirely by a human.', 'document_classification': 'HUMAN_ONLY', 'version': '2025-01-09-base', 'language': 'en', 'pageNumber': 0, 'inputText': ""Aria joined WTOC in November of 2022. She is an anchor for THE News at Daybreak and works on WTOC Investigates' Asked and Answered franchise. Aria recently worked in Cleveland, OH as a reporter where she focused on community stories and seeking results. Before working in Cleveland, Aria was a reporter in Evansville, IN. She is originally from Kannapolis, North Carolina, a small town outside of Charlotte. Aria graduated from The University of North Carolina Wilmington in May of 2018. There she earned her Bachelor of Arts degree in Communication Studies and minored in Psychology. While Studying at UNCW she spent a semester abroad in England where she attended Keele University and took classes in film and marketing. Aria is a proud member of Alpha Kappa Alpha Sorority Inc. and loves finding ways to give back to her community. When Aria is not working, she loves playing and taking photos with her dog Kaizer, binge watching TV shows, trying new restaurants, and traveling to new places. You can reach out to Aria via email at aria.janel@wtoc.com or by following her on social media @ariajaneltv. You can send Aria a tip for Asked and Answered by calling 912-238-8351. News News Health News Style Food Morning Break Morning Break Asked and Answered Events Asked and Answered Asked and Answered Asked and Answered Asked and Answered Events Community News Asked and Answered Food St. Patrick's Day News Celebrating Black History Calendar Morning Break Asked and Answered WTOC Investigates Asked and Answered WTOC Investigates Asked and Answered News Asked and Answered Asked and Answered Asked and Answered Asked and Answered WTOC Investigates Asked and Answered Asked and Answered Asked and Answered Elections Center Asked and Answered Asked and Answered Asked and Answered Food Asked and Answered Morning Break Asked and Answered Morning Break and Afternoon Break Events Morning Break and Afternoon Break""}]"
