File,version,documents
OH_2021_18fa8481783a34d096178824614375f6.html.gz,2025-01-09-base,"[{'sentences': [{'generated_prob': 0.0003074052801821381, 'sentence': ""Friday afternoon Andrew and I looked at a bunch of houses but I didn't like any enough to write an offer so no getting my heartbroken this weekend."", 'perplexity': 0, 'highlight_sentence_for_ai': False}, {'generated_prob': 0.0002428485022392124, 'sentence': 'Saturday was a busy day!', 'perplexity': 0, 'highlight_sentence_for_ai': False}, {'generated_prob': 0.0003020506410393864, 'sentence': 'I started it with a morning jog then ran off to Lake Patrol!', 'perplexity': 0, 'highlight_sentence_for_ai': False}, {'generated_prob': 0.00036508397897705436, 'sentence': 'I was on it with Falen this week and we had a blast like always!', 'perplexity': 0, 'highlight_sentence_for_ai': False}, {'generated_prob': 0.0002790374855976552, 'sentence': 'When we rolled up to these boats I said we had to pet their dogs in order to give them free stuff so they brought Harper up to the boat and we were able to give her some pets!', 'perplexity': 0, 'highlight_sentence_for_ai': False}, {'generated_prob': 0.00028579082572832704, 'sentence': 'After that I ran home and then Andrew and I biked to the Pryes Block Party.', 'perplexity': 0, 'highlight_sentence_for_ai': False}, {'generated_prob': 0.00022629671730101109, 'sentence': 'A ton of people were there and the first thing Andrew wanted to do was get pizza.', 'perplexity': 0, 'highlight_sentence_for_ai': False}, {'generated_prob': 0.00030855415388941765, 'sentence': 'Tina was there with a crew of her friends too!', 'perplexity': 0, 'highlight_sentence_for_ai': False}, {'generated_prob': 0.0003447310591582209, 'sentence': 'After that, Falen, Jake, Andrew, and I ran off to get ice cream about 20 minutes away.', 'perplexity': 0, 'highlight_sentence_for_ai': False}, {'generated_prob': 0.0003708013682626188, 'sentence': 'Once we got there, we saw there was air coming out of one of the tires so while Falen and I waited in the long line to get ice cream, Andrew and Jake worked on the tire.', 'perplexity': 0, 'highlight_sentence_for_ai': False}, {'generated_prob': 0.0004988473956473172, 'sentence': 'They were able to fix it pretty quick, so we ate our ice cream and then went home!', 'perplexity': 0, 'highlight_sentence_for_ai': False}], 'paragraphs': [{'start_sentence_index': 0, 'num_sentences': 11, 'completely_generated_prob': 7.905466206762634e-10}], 'completely_generated_prob': 0.006608679833334143, 'class_probabilities': {'human': 0.9933913201666659, 'ai': 0.006608679833334143, 'mixed': 0}, 'average_generated_prob': 0, 'predicted_class': 'human', 'confidence_score': 0.9933913201666659, 'confidence_category': 'high', 'confidence_scores_raw': {'identity': {'ai': 0.006608679833334143, 'human': 0.9933913201666659, 'mixed': 0}}, 'confidence_thresholds_raw': {'identity': {'ai': {'reject': 0.65, 'low': 0.75, 'medium': 0.92}, 'human': {'reject': 0.7, 'low': 0.82, 'medium': 0.92}, 'mixed': {'reject': 0.7, 'low': 0.8, 'medium': 0.88}}}, 'overall_burstiness': 0, 'writing_stats': {}, 'subclass': {'ai': {}, 'human': {}, 'mixed': {}}, 'result_message': 'Our detector is highly confident that the text is written entirely by a human.', 'document_classification': 'HUMAN_ONLY', 'version': '2025-01-09-base', 'language': 'en', 'pageNumber': 0, 'inputText': ""Friday afternoon Andrew and I looked at a bunch of houses but I didn't like any enough to write an offer so no getting my heartbroken this weekend. Saturday was a busy day! I started it with a morning jog then ran off to Lake Patrol! I was on it with Falen this week and we had a blast like always! When we rolled up to these boats I said we had to pet their dogs in order to give them free stuff so they brought Harper up to the boat and we were able to give her some pets! After that I ran home and then Andrew and I biked to the Pryes Block Party. A ton of people were there and the first thing Andrew wanted to do was get pizza. Tina was there with a crew of her friends too! After that, Falen, Jake, Andrew, and I ran off to get ice cream about 20 minutes away. Once we got there, we saw there was air coming out of one of the tires so while Falen and I waited in the long line to get ice cream, Andrew and Jake worked on the tire. They were able to fix it pretty quick, so we ate our ice cream and then went home!""}]"
OH_2021_22a72088371c64ce517e6d8c052724ef.html.gz,2025-01-09-base,"[{'sentences': [{'generated_prob': 3.1866304198047146e-05, 'sentence': ""Photo: Courtesy of All Elite Wrestling Kyle O'Reilly is officially 'All Elite' and the group formerly known to NXT fans as 'Undisputed Era' appears to have reunited."", 'perplexity': 0, 'highlight_sentence_for_ai': False}, {'generated_prob': 3.5225300962338224e-05, 'sentence': ""O'Reilly made his anticipated All Elite Wrestling debut on Wednesday (December 23) night by helping longtime friend (and rival) Adam Cole defeat Orange Cassidy in the opening match of Dynamite on TNT."", 'perplexity': 0, 'highlight_sentence_for_ai': False}, {'generated_prob': 3.848017877317034e-05, 'sentence': ""O'Reilly attacked Cassidy while his former reDRagon and Undisputed Era partner Bobby Fish had referee Bryce Remsburg was distracted, leading to Cole hitting his finisher, 'The Boom,' to score the pinfall."", 'perplexity': 0, 'highlight_sentence_for_ai': False}, {'generated_prob': 5.732565841753967e-05, 'sentence': ""The trio then warded off a response from Cassidy's fellow 'Best Friends' faction members Trent?"", 'perplexity': 0, 'highlight_sentence_for_ai': False}, {'generated_prob': 4.838444874621928e-05, 'sentence': 'and Chuck Taylor.', 'perplexity': 0, 'highlight_sentence_for_ai': False}, {'generated_prob': 4.617568265530281e-05, 'sentence': 'Last week, Cole told fellow \'SuperKliq\' members the Young Bucks (Matt and Nick Jackson) that he had ""the best Christmas present"" lined up for AEW\'s special \'Holiday Bash\' edition of Dynamite, leading to speculation that O\'Reilly, whose contract with WWE had expired earlier this month, was set to debut.', 'perplexity': 0, 'highlight_sentence_for_ai': False}, {'generated_prob': 7.051780994515866e-05, 'sentence': 'Shorty after, O\'Reilly tweeted the eyes emoji with a gif of Brad Pitt from the film Seven, in reference to the box Cole was holding while teasing the ""gift.""', 'perplexity': 0, 'highlight_sentence_for_ai': False}, {'generated_prob': 6.901588494656608e-05, 'sentence': 'The Bucks, however, didn\'t seem appreciative of the ""gift"" as they confronted Cole, who left the ring with O\'Reilly and Fish.', 'perplexity': 0, 'highlight_sentence_for_ai': False}, {'generated_prob': 0.0009460925357416272, 'sentence': ""After his debut, O'Reilly shared a series of tweets expressing his gratitude for AEW, CEO Tony Khan and confirming that he and Fish would once again use the reDRagon name."", 'perplexity': 0, 'highlight_sentence_for_ai': False}, {'generated_prob': 0.00048644511844031513, 'sentence': '""Life is crazy and I\'m very grateful that my professional wrestling abilities have taken me to a new frontier in which to explore my a**-kicking ways,"" O\'Reilly tweeted.', 'perplexity': 0, 'highlight_sentence_for_ai': False}, {'generated_prob': 0.0005280313780531287, 'sentence': '""Proud to be apart of @AEW and thanks to @TonyKhan for the opportunity.', 'perplexity': 0, 'highlight_sentence_for_ai': False}, {'generated_prob': 0.00033392885234206915, 'sentence': '""If you\'re a fan of mine from elsewhere I hope you continue to support me.', 'perplexity': 0, 'highlight_sentence_for_ai': False}, {'generated_prob': 0.0006851357175037265, 'sentence': ""If you're new to KOR prepare to see a man that pours his f'n soul into that ring every night and has an unquenchable thirst for cans of whoop a**."", 'perplexity': 0, 'highlight_sentence_for_ai': False}, {'generated_prob': 0.0008062403067015111, 'sentence': '""Also, reDRagon is back!!!""', 'perplexity': 0, 'highlight_sentence_for_ai': False}, {'generated_prob': 0.0008634834666736424, 'sentence': ""O'Reilly established himself as one of wrestling's best workers competing for numerous promotions, most notably Ring of Honor and New Japan Pro Wrestling, before signing with WWE and debuting on its NXT brand in 2017, as did Fish, although the two initially competed separately in singles matches, despite having gained a legacy as one of wrestling's top tag teams elsewhere."", 'perplexity': 0, 'highlight_sentence_for_ai': False}, {'generated_prob': 0.0008610304212197661, 'sentence': ""O'Reilly and Fish first appeared on NXT programming together by attacking then-NXT Tag Team Champions Sanity at NXT TakeOver: Brooklyn III and later newly crowned NXT Champion Drew McIntyre in the show's main event alongside Cole, who made his debut during the attack."", 'perplexity': 0, 'highlight_sentence_for_ai': False}], 'paragraphs': [{'start_sentence_index': 0, 'num_sentences': 16, 'completely_generated_prob': 3.4496480286678e-14}], 'completely_generated_prob': 0.006922837844142335, 'class_probabilities': {'human': 0.99303778363816, 'ai': 0.006922837844142335, 'mixed': 3.937851769764606e-05}, 'average_generated_prob': 0, 'predicted_class': 'human', 'confidence_score': 0.99303778363816, 'confidence_category': 'high', 'confidence_scores_raw': {'identity': {'ai': 0.006922837844142335, 'human': 0.99303778363816, 'mixed': 3.937851769764606e-05}}, 'confidence_thresholds_raw': {'identity': {'ai': {'reject': 0.65, 'low': 0.75, 'medium': 0.92}, 'human': {'reject': 0.7, 'low': 0.82, 'medium': 0.92}, 'mixed': {'reject': 0.7, 'low': 0.8, 'medium': 0.88}}}, 'overall_burstiness': 0, 'writing_stats': {}, 'subclass': {'ai': {}, 'human': {}, 'mixed': {}}, 'result_message': 'Our detector is highly confident that the text is written entirely by a human.', 'document_classification': 'HUMAN_ONLY', 'version': '2025-01-09-base', 'language': 'en', 'pageNumber': 0, 'inputText': 'Photo: Courtesy of All Elite Wrestling Kyle O\'Reilly is officially \'All Elite\' and the group formerly known to NXT fans as \'Undisputed Era\' appears to have reunited. O\'Reilly made his anticipated All Elite Wrestling debut on Wednesday (December 23) night by helping longtime friend (and rival) Adam Cole defeat Orange Cassidy in the opening match of Dynamite on TNT. O\'Reilly attacked Cassidy while his former reDRagon and Undisputed Era partner Bobby Fish had referee Bryce Remsburg was distracted, leading to Cole hitting his finisher, \'The Boom,\' to score the pinfall. The trio then warded off a response from Cassidy\'s fellow \'Best Friends\' faction members Trent? and Chuck Taylor. Last week, Cole told fellow \'SuperKliq\' members the Young Bucks (Matt and Nick Jackson) that he had ""the best Christmas present"" lined up for AEW\'s special \'Holiday Bash\' edition of Dynamite, leading to speculation that O\'Reilly, whose contract with WWE had expired earlier this month, was set to debut. Shorty after, O\'Reilly tweeted the eyes emoji with a gif of Brad Pitt from the film Seven, in reference to the box Cole was holding while teasing the ""gift."" The Bucks, however, didn\'t seem appreciative of the ""gift"" as they confronted Cole, who left the ring with O\'Reilly and Fish. After his debut, O\'Reilly shared a series of tweets expressing his gratitude for AEW, CEO Tony Khan and confirming that he and Fish would once again use the reDRagon name. ""Life is crazy and I\'m very grateful that my professional wrestling abilities have taken me to a new frontier in which to explore my a**-kicking ways,"" O\'Reilly tweeted. ""Proud to be apart of @AEW and thanks to @TonyKhan for the opportunity. ""If you\'re a fan of mine from elsewhere I hope you continue to support me. If you\'re new to KOR prepare to see a man that pours his f\'n soul into that ring every night and has an unquenchable thirst for cans of whoop a**. ""Also, reDRagon is back!!!"" O\'Reilly established himself as one of wrestling\'s best workers competing for numerous promotions, most notably Ring of Honor and New Japan Pro Wrestling, before signing with WWE and debuting on its NXT brand in 2017, as did Fish, although the two initially competed separately in singles matches, despite having gained a legacy as one of wrestling\'s top tag teams elsewhere. O\'Reilly and Fish first appeared on NXT programming together by attacking then-NXT Tag Team Champions Sanity at NXT TakeOver: Brooklyn III and later newly crowned NXT Champion Drew McIntyre in the show\'s main event alongside Cole, who made his debut during the attack.'}]"
OH_2021_404459d87acdc86010f20035b73e66e5.html.gz,2025-01-09-base,"[{'sentences': [{'generated_prob': 7.219323015306145e-05, 'sentence': 'Sections Links ZANESVILLE, Ohio- After working with the Zanesville Police Department for 34 years, and the last three of them being as a student resource officer at Zane Grey Intermediate, Mike Choma is gearing up for retirement.', 'perplexity': 0, 'highlight_sentence_for_ai': False}, {'generated_prob': 5.9811682149302214e-05, 'sentence': 'In his more than three decades serving the Zanesville area, and three years serving Zane Grey Intermediate, he made sure that he developed relationships with the students and fostered an environment of mutual respect and understanding.', 'perplexity': 0, 'highlight_sentence_for_ai': False}, {'generated_prob': 5.6906275858636945e-05, 'sentence': ""“I think the safety is important, probably the most, but I think it's important that they see you as a human being and not just something they see on TV, somebody that has feelings… I think they need to see that we're human, and I think a lot of people have lost touch with that we are human beings,” Mike Choma, school resource officer at Zane Grey Intermediate stated."", 'perplexity': 0, 'highlight_sentence_for_ai': False}, {'generated_prob': 6.01653810008429e-05, 'sentence': 'While retiring officer Choma is not leaving his post just yet.', 'perplexity': 0, 'highlight_sentence_for_ai': False}, {'generated_prob': 6.49622525088489e-05, 'sentence': 'He will continue to serve Zane Grey Intermediate while enjoying a little more free time.', 'perplexity': 0, 'highlight_sentence_for_ai': False}, {'generated_prob': 8.818219066597521e-05, 'sentence': ""“I'm continuing here at the school as a sort of like resource officer but security officer."", 'perplexity': 0, 'highlight_sentence_for_ai': False}, {'generated_prob': 6.444759492296726e-05, 'sentence': ""I'll be wearing the uniform, and I'll be doing about the same job… I'll do some traveling, having some fun, doing some vacations, just a little bit more free time, and a little less stress,” Officer Choma said."", 'perplexity': 0, 'highlight_sentence_for_ai': False}, {'generated_prob': 6.727175059495494e-05, 'sentence': ""When asked why now was the time to retire, he said that he didn't have any regrets working with the police force and enjoyed his time there, but it was time for him to take things a little more slow."", 'perplexity': 0, 'highlight_sentence_for_ai': False}, {'generated_prob': 0.00011389419523766264, 'sentence': 'Because Local Matters © 2024 WHIZ - Fox 5 / Marquee Broadcasting.', 'perplexity': 0, 'highlight_sentence_for_ai': False}], 'paragraphs': [{'start_sentence_index': 0, 'num_sentences': 9, 'completely_generated_prob': 4.1887248735431006e-08}], 'completely_generated_prob': 0.006602786460384316, 'class_probabilities': {'human': 0.9933972135396156, 'ai': 0.006602786460384316, 'mixed': 0}, 'average_generated_prob': 0, 'predicted_class': 'human', 'confidence_score': 0.9933972135396156, 'confidence_category': 'high', 'confidence_scores_raw': {'identity': {'ai': 0.006602786460384316, 'human': 0.9933972135396156, 'mixed': 0}}, 'confidence_thresholds_raw': {'identity': {'ai': {'reject': 0.65, 'low': 0.75, 'medium': 0.92}, 'human': {'reject': 0.7, 'low': 0.82, 'medium': 0.92}, 'mixed': {'reject': 0.7, 'low': 0.8, 'medium': 0.88}}}, 'overall_burstiness': 0, 'writing_stats': {}, 'subclass': {'ai': {}, 'human': {}, 'mixed': {}}, 'result_message': 'Our detector is highly confident that the text is written entirely by a human.', 'document_classification': 'HUMAN_ONLY', 'version': '2025-01-09-base', 'language': 'en', 'pageNumber': 0, 'inputText': 'Sections Links ZANESVILLE, Ohio- After working with the Zanesville Police Department for 34 years, and the last three of them being as a student resource officer at Zane Grey Intermediate, Mike Choma is gearing up for retirement. In his more than three decades serving the Zanesville area, and three years serving Zane Grey Intermediate, he made sure that he developed relationships with the students and fostered an environment of mutual respect and understanding. “I think the safety is important, probably the most, but I think it’s important that they see you as a human being and not just something they see on TV, somebody that has feelings… I think they need to see that we’re human, and I think a lot of people have lost touch with that we are human beings,” Mike Choma, school resource officer at Zane Grey Intermediate stated. While retiring officer Choma is not leaving his post just yet. He will continue to serve Zane Grey Intermediate while enjoying a little more free time. “I’m continuing here at the school as a sort of like resource officer but security officer. I’ll be wearing the uniform, and I’ll be doing about the same job… I’ll do some traveling, having some fun, doing some vacations, just a little bit more free time, and a little less stress,” Officer Choma said. When asked why now was the time to retire, he said that he didn’t have any regrets working with the police force and enjoyed his time there, but it was time for him to take things a little more slow. Because Local Matters © 2024 WHIZ – Fox 5 / Marquee Broadcasting.'}]"
