File,version,documents
MI_2022_2a258cb94c674a65390c231b4a7bb09a.html.gz,2025-01-09-base,"[{'sentences': [{'generated_prob': 6.076175850466825e-05, 'sentence': 'Digital News Producer Gov.', 'perplexity': 0, 'highlight_sentence_for_ai': False}, {'generated_prob': 5.162937304703519e-05, 'sentence': 'Gretchen Whitmer The latest exclusive EPIC-MRA poll for ABC12 shows 52% of likely voters in Michigan disapprove of Gov.', 'perplexity': 0, 'highlight_sentence_for_ai': False}, {'generated_prob': 4.44723991677165e-05, 'sentence': ""Gretchen Whitmer's job performance."", 'perplexity': 0, 'highlight_sentence_for_ai': False}, {'generated_prob': 3.0956151022110134e-05, 'sentence': 'LANSING, Mich. (WJRT) - Likely voters in Michigan gave poor grades for Gov.', 'perplexity': 0, 'highlight_sentence_for_ai': False}, {'generated_prob': 3.0705581593792886e-05, 'sentence': 'Gretchen Whitmer and President Joe Biden as the pivotal 2022 campaigns ramp up.', 'perplexity': 0, 'highlight_sentence_for_ai': False}, {'generated_prob': 3.621084033511579e-05, 'sentence': 'EPIC-MRA conducted a statewide poll exclusive to ABC12 News last week, which showed both Biden and Whitmer got majority negative job approval ratings from 600 likely Michigan voters.', 'perplexity': 0, 'highlight_sentence_for_ai': False}, {'generated_prob': 3.2188949262490496e-05, 'sentence': 'Results show 52% of people polled have a negative view of Whitmer while 45% gave her positive marks and 3% were undecided or refused to answer.', 'perplexity': 0, 'highlight_sentence_for_ai': False}, {'generated_prob': 3.3197138691321015e-05, 'sentence': 'Only 41% of likely voters polled indicated they would support Whitmer for a second term as governor this year while 49% want to replace her or give someone else a chance in the office.', 'perplexity': 0, 'highlight_sentence_for_ai': False}, {'generated_prob': 4.0773309592623264e-05, 'sentence': 'Ten percent of those polled did not answer.', 'perplexity': 0, 'highlight_sentence_for_ai': False}, {'generated_prob': 3.842500154860318e-05, 'sentence': ""Most of the 600 people polled believe Michigan's economy is on the wrong track."", 'perplexity': 0, 'highlight_sentence_for_ai': False}, {'generated_prob': 4.030135823995806e-05, 'sentence': ""Some 65% gave an unfavorable view of the state's economy while 29% have a favorable opinion and 6% were undecided."", 'perplexity': 0, 'highlight_sentence_for_ai': False}, {'generated_prob': 5.271838745102286e-05, 'sentence': 'A total of 45% of those polled believe Michigan is heading in the wrong direction while 35% say the state is heading in the right direction and 20% did not give an opinion.', 'perplexity': 0, 'highlight_sentence_for_ai': False}, {'generated_prob': 0.00761142885312438, 'sentence': 'In a hypothetical head-to-head matchup with Republican gubernatorial front-runner James Craig on the Nov. 2022 ballot, Whitmer leads with 46% of those polled while 41% said they would vote for Craig.', 'perplexity': 0, 'highlight_sentence_for_ai': False}, {'generated_prob': 0.010789290070533752, 'sentence': ""However, 55% of those polled said they don't recognize Craig's name."", 'perplexity': 0, 'highlight_sentence_for_ai': False}, {'generated_prob': 0.0027912973891943693, 'sentence': 'Results are worse for Biden with 66% of those polled in Michigan giving him a negative job approval while only 32% gave him a positive rating as president.', 'perplexity': 0, 'highlight_sentence_for_ai': False}, {'generated_prob': 0.003320657880976796, 'sentence': 'The negative ratings include 44% who say Biden is doing a poor job and 22% who say his work is just fair.', 'perplexity': 0, 'highlight_sentence_for_ai': False}, {'generated_prob': 0.003453547367826104, 'sentence': 'Results show 45% of people polled believe the coronavirus pandemic has gotten worse over the past couple months, 36% believe it has remained about the same and 13% believe it has improved and 6% did not give an opinion.', 'perplexity': 0, 'highlight_sentence_for_ai': False}, {'generated_prob': 0.004297585692256689, 'sentence': 'The poll has a margin of error around 4%.', 'perplexity': 0, 'highlight_sentence_for_ai': False}, {'generated_prob': 0.0024107415229082108, 'sentence': ""Entering the election year, the first-term governor's account had about $9.9 million, according to a report filed Monday."", 'perplexity': 0, 'highlight_sentence_for_ai': False}, {'generated_prob': 0.0022604470141232014, 'sentence': 'That dwarfs all 13 Republican challengers.', 'perplexity': 0, 'highlight_sentence_for_ai': False}, {'generated_prob': 0.0043667033314704895, 'sentence': ""Entering the election year, the first-term governor's account had about $9.9 million, according to a report filed Monday."", 'perplexity': 0, 'highlight_sentence_for_ai': False}, {'generated_prob': 0.003710271092131734, 'sentence': 'That dwarfs all 13 Republican challengers.', 'perplexity': 0, 'highlight_sentence_for_ai': False}, {'generated_prob': 0.014205937273800373, 'sentence': 'Digital News Producer Your browser is out of date and potentially vulnerable to security risks.We recommend switching to one of the following browsers:', 'perplexity': 0, 'highlight_sentence_for_ai': False}], 'paragraphs': [{'start_sentence_index': 0, 'num_sentences': 23, 'completely_generated_prob': 2.3367398512545458e-20}], 'completely_generated_prob': 0.007195114450398789, 'class_probabilities': {'human': 0.992763958266874, 'ai': 0.007195114450398789, 'mixed': 4.092728272717754e-05}, 'average_generated_prob': 0, 'predicted_class': 'human', 'confidence_score': 0.992763958266874, 'confidence_category': 'high', 'confidence_scores_raw': {'identity': {'ai': 0.007195114450398789, 'human': 0.992763958266874, 'mixed': 4.092728272717754e-05}}, 'confidence_thresholds_raw': {'identity': {'ai': {'reject': 0.65, 'low': 0.75, 'medium': 0.92}, 'human': {'reject': 0.7, 'low': 0.82, 'medium': 0.92}, 'mixed': {'reject': 0.7, 'low': 0.8, 'medium': 0.88}}}, 'overall_burstiness': 0, 'writing_stats': {}, 'subclass': {'ai': {}, 'human': {}, 'mixed': {}}, 'result_message': 'Our detector is highly confident that the text is written entirely by a human.', 'document_classification': 'HUMAN_ONLY', 'version': '2025-01-09-base', 'language': 'en', 'pageNumber': 0, 'inputText': ""Digital News Producer Gov. Gretchen Whitmer The latest exclusive EPIC-MRA poll for ABC12 shows 52% of likely voters in Michigan disapprove of Gov. Gretchen Whitmer's job performance. LANSING, Mich. (WJRT) - Likely voters in Michigan gave poor grades for Gov. Gretchen Whitmer and President Joe Biden as the pivotal 2022 campaigns ramp up. EPIC-MRA conducted a statewide poll exclusive to ABC12 News last week, which showed both Biden and Whitmer got majority negative job approval ratings from 600 likely Michigan voters. Results show 52% of people polled have a negative view of Whitmer while 45% gave her positive marks and 3% were undecided or refused to answer. Only 41% of likely voters polled indicated they would support Whitmer for a second term as governor this year while 49% want to replace her or give someone else a chance in the office. Ten percent of those polled did not answer. Most of the 600 people polled believe Michigan's economy is on the wrong track. Some 65% gave an unfavorable view of the state's economy while 29% have a favorable opinion and 6% were undecided. A total of 45% of those polled believe Michigan is heading in the wrong direction while 35% say the state is heading in the right direction and 20% did not give an opinion. In a hypothetical head-to-head matchup with Republican gubernatorial front-runner James Craig on the Nov. 2022 ballot, Whitmer leads with 46% of those polled while 41% said they would vote for Craig. However, 55% of those polled said they don't recognize Craig's name. Results are worse for Biden with 66% of those polled in Michigan giving him a negative job approval while only 32% gave him a positive rating as president. The negative ratings include 44% who say Biden is doing a poor job and 22% who say his work is just fair. Results show 45% of people polled believe the coronavirus pandemic has gotten worse over the past couple months, 36% believe it has remained about the same and 13% believe it has improved and 6% did not give an opinion. The poll has a margin of error around 4%. Entering the election year, the first-term governor’s account had about $9.9 million, according to a report filed Monday. That dwarfs all 13 Republican challengers. Entering the election year, the first-term governor’s account had about $9.9 million, according to a report filed Monday. That dwarfs all 13 Republican challengers. Digital News Producer Your browser is out of date and potentially vulnerable to security risks.We recommend switching to one of the following browsers:""}]"
MI_2022_42e4f096021844fb2af89d7ffb690611.html.gz,2025-01-09-base,"[{'sentences': [{'generated_prob': 0.00011764102237066254, 'sentence': 'Morning and Noon Anchor Christine Winter currently anchors ABC12 News This Morning and ABC12 News at Noon.', 'perplexity': 0, 'highlight_sentence_for_ai': False}, {'generated_prob': 0.00019047500973101705, 'sentence': 'Plane crash SOUTH HAVEN, Mich. (AP) - Police say two men died after the plane they were in crashed near a southwestern Michigan airport shortly after takeoff.', 'perplexity': 0, 'highlight_sentence_for_ai': False}, {'generated_prob': 0.00017980686970986426, 'sentence': ""South Haven Police Chief Natalie Thompson said Wednesday the plane crashed around 7:30 a.m. Tuesday but the wreckage wasn't discovered until nearly 24 hours later."", 'perplexity': 0, 'highlight_sentence_for_ai': False}, {'generated_prob': 0.0002792117011267692, 'sentence': 'It was found about 1 mile from South Haven Regional Airport.', 'perplexity': 0, 'highlight_sentence_for_ai': False}, {'generated_prob': 0.0002931714407168329, 'sentence': 'She says the bodies of the two men were found in the wreckage of the Aerospace 600 around 7 a.m. Wednesday.', 'perplexity': 0, 'highlight_sentence_for_ai': False}, {'generated_prob': 0.00034797954140231013, 'sentence': 'South Haven police were told by the Federal Aviation Administration around 11:30 p.m. Tuesday that the plane was missing.', 'perplexity': 0, 'highlight_sentence_for_ai': False}, {'generated_prob': 0.0004757967253681272, 'sentence': 'Investigators say both victims were experienced pilots planning to fly for no more than two hours on a training flight on Tuesday.', 'perplexity': 0, 'highlight_sentence_for_ai': False}, {'generated_prob': 0.0004181381082162261, 'sentence': 'The Federal Aviation Administration and National Transportation Safety Board are looking into what caused the crash.', 'perplexity': 0, 'highlight_sentence_for_ai': False}, {'generated_prob': 0.0009818973485380411, 'sentence': '(Copyright 2022 The Associated Press.', 'perplexity': 0, 'highlight_sentence_for_ai': False}, {'generated_prob': 0.0020197639241814613, 'sentence': 'All rights reserved.', 'perplexity': 0, 'highlight_sentence_for_ai': False}, {'generated_prob': 0.0022194639313966036, 'sentence': 'This material may not be published, broadcast, rewritten or redistributed without permission.)', 'perplexity': 0, 'highlight_sentence_for_ai': False}, {'generated_prob': 0.0016152505995705724, 'sentence': 'Subscribe to receive breaking news, daily headlines, latest forecast, local sports and more with ABC12 News email alerts.', 'perplexity': 0, 'highlight_sentence_for_ai': False}, {'generated_prob': 0.003314510453492403, 'sentence': 'No injuries were reported following a plane crash in Livingston County Monday afternoon.', 'perplexity': 0, 'highlight_sentence_for_ai': False}, {'generated_prob': 0.005419221706688404, 'sentence': 'No injuries were reported following a plane crash in Livingston County Monday afternoon.', 'perplexity': 0, 'highlight_sentence_for_ai': False}, {'generated_prob': 0.004826728720217943, 'sentence': 'Morning and Noon Anchor Christine Winter currently anchors ABC12 News This Morning and ABC12 News at Noon.', 'perplexity': 0, 'highlight_sentence_for_ai': False}, {'generated_prob': 0.06464790552854538, 'sentence': 'Your browser is out of date and potentially vulnerable to security risks.We recommend switching to one of the following browsers:', 'perplexity': 0, 'highlight_sentence_for_ai': False}], 'paragraphs': [{'start_sentence_index': 0, 'num_sentences': 16, 'completely_generated_prob': 3.4496480286678e-14}], 'completely_generated_prob': 0.007195114450398789, 'class_probabilities': {'human': 0.992763958266874, 'ai': 0.007195114450398789, 'mixed': 4.092728272717754e-05}, 'average_generated_prob': 0, 'predicted_class': 'human', 'confidence_score': 0.992763958266874, 'confidence_category': 'high', 'confidence_scores_raw': {'identity': {'ai': 0.007195114450398789, 'human': 0.992763958266874, 'mixed': 4.092728272717754e-05}}, 'confidence_thresholds_raw': {'identity': {'ai': {'reject': 0.65, 'low': 0.75, 'medium': 0.92}, 'human': {'reject': 0.7, 'low': 0.82, 'medium': 0.92}, 'mixed': {'reject': 0.7, 'low': 0.8, 'medium': 0.88}}}, 'overall_burstiness': 0, 'writing_stats': {}, 'subclass': {'ai': {}, 'human': {}, 'mixed': {}}, 'result_message': 'Our detector is highly confident that the text is written entirely by a human.', 'document_classification': 'HUMAN_ONLY', 'version': '2025-01-09-base', 'language': 'en', 'pageNumber': 0, 'inputText': 'Morning and Noon Anchor Christine Winter currently anchors ABC12 News This Morning and ABC12 News at Noon. Plane crash SOUTH HAVEN, Mich. (AP) - Police say two men died after the plane they were in crashed near a southwestern Michigan airport shortly after takeoff. South Haven Police Chief Natalie Thompson said Wednesday the plane crashed around 7:30 a.m. Tuesday but the wreckage wasn’t discovered until nearly 24 hours later. It was found about 1 mile from South Haven Regional Airport. She says the bodies of the two men were found in the wreckage of the Aerospace 600 around 7 a.m. Wednesday. South Haven police were told by the Federal Aviation Administration around 11:30 p.m. Tuesday that the plane was missing. Investigators say both victims were experienced pilots planning to fly for no more than two hours on a training flight on Tuesday. The Federal Aviation Administration and National Transportation Safety Board are looking into what caused the crash. (Copyright 2022 The Associated Press. All rights reserved. This material may not be published, broadcast, rewritten or redistributed without permission.) Subscribe to receive breaking news, daily headlines, latest forecast, local sports and more with ABC12 News email alerts. No injuries were reported following a plane crash in Livingston County Monday afternoon. No injuries were reported following a plane crash in Livingston County Monday afternoon. Morning and Noon Anchor Christine Winter currently anchors ABC12 News This Morning and ABC12 News at Noon. Your browser is out of date and potentially vulnerable to security risks.We recommend switching to one of the following browsers:'}]"
