File,version,documents
FL_2023_47b8a3b53ece272e11c89d4ade71ba56.html.gz,2025-01-09-base,"[{'sentences': [{'generated_prob': 3.0475026505882852e-05, 'sentence': 'CHINCOTEAGUE, Va. (WTKR) - Thousands of people attended a famous pony swim in Virginia Wednesday.', 'perplexity': 0, 'highlight_sentence_for_ai': False}, {'generated_prob': 3.31947194354143e-05, 'sentence': 'The crowd gathered at the eastern shore in the town of Chincoteague for the unique and historic event.', 'perplexity': 0, 'highlight_sentence_for_ai': False}, {'generated_prob': 3.584384830901399e-05, 'sentence': 'For some, being at the swim was a dream fulfilled.', 'perplexity': 0, 'highlight_sentence_for_ai': False}, {'generated_prob': 3.3537071431055665e-05, 'sentence': ""For others, it's a trip they take every year."", 'perplexity': 0, 'highlight_sentence_for_ai': False}, {'generated_prob': 3.1020270398585126e-05, 'sentence': 'Darby Callahan lives right outside of New York City and started coming to the event in 1995.', 'perplexity': 0, 'highlight_sentence_for_ai': False}, {'generated_prob': 3.298529554740526e-05, 'sentence': 'It has always been her dream to buy a Chincoteague pony after reading the classic book, “Misty of Chincoteague,” as a little girl.', 'perplexity': 0, 'highlight_sentence_for_ai': False}, {'generated_prob': 2.7843274438055232e-05, 'sentence': '“I bid $800 and got this little pony who we call Island Dream because it was a dream.', 'perplexity': 0, 'highlight_sentence_for_ai': False}, {'generated_prob': 2.728094295889605e-05, 'sentence': ""And it's always been my dream to come to Chincoteague because I love Chincoteague,” Callahan said."", 'perplexity': 0, 'highlight_sentence_for_ai': False}, {'generated_prob': 3.6700213968288153e-05, 'sentence': '“So, we donated her back and every year we would come and we would see her.” According to urban legend, the ponies arrived on the island after a Spanish ship carrying wild horses sank in the 1600s.', 'perplexity': 0, 'highlight_sentence_for_ai': False}, {'generated_prob': 4.351276220404543e-05, 'sentence': 'Now, the annual pony swim and auction is done every year to control the herd and raise money for the Chincoteague Volunteer Fire Department.', 'perplexity': 0, 'highlight_sentence_for_ai': False}, {'generated_prob': 3.814337833318859e-05, 'sentence': ""“We've never lost a pony in 98 years of doing the pony swim."", 'perplexity': 0, 'highlight_sentence_for_ai': False}, {'generated_prob': 3.023947101610247e-05, 'sentence': ""It's just something we do."", 'perplexity': 0, 'highlight_sentence_for_ai': False}, {'generated_prob': 4.3734540668083355e-05, 'sentence': 'We always look out for the ponies.', 'perplexity': 0, 'highlight_sentence_for_ai': False}, {'generated_prob': 4.0091454138746485e-05, 'sentence': ""They're number one,” said Chincoteague Mayor Arthur Leonard."", 'perplexity': 0, 'highlight_sentence_for_ai': False}, {'generated_prob': 3.493812619126402e-05, 'sentence': 'Leonard said a member of his family has been in the round-up since the very first swim in 1925.', 'perplexity': 0, 'highlight_sentence_for_ai': False}, {'generated_prob': 3.302916229586117e-05, 'sentence': '“Watching my boys ride the horses and hopefully my grandson will do it one of these days,” Leonard said.', 'perplexity': 0, 'highlight_sentence_for_ai': False}, {'generated_prob': 4.073215677635744e-05, 'sentence': 'The pony swim is followed by a parade through the island.', 'perplexity': 0, 'highlight_sentence_for_ai': False}, {'generated_prob': 4.56873131042812e-05, 'sentence': 'After the swim, veterinarians examine the ponies which are then sold at auction.', 'perplexity': 0, 'highlight_sentence_for_ai': False}, {'generated_prob': 3.6517692933557555e-05, 'sentence': 'Copyright 2023 WTKR via CNN Newsource.', 'perplexity': 0, 'highlight_sentence_for_ai': False}, {'generated_prob': 4.224686199449934e-05, 'sentence': 'All rights reserved.', 'perplexity': 0, 'highlight_sentence_for_ai': False}], 'paragraphs': [{'start_sentence_index': 0, 'num_sentences': 20, 'completely_generated_prob': 1.0446359549956209e-17}], 'completely_generated_prob': 0, 'class_probabilities': {'human': 1, 'ai': 0, 'mixed': 0}, 'average_generated_prob': 0, 'predicted_class': 'human', 'confidence_score': 1, 'confidence_category': 'high', 'confidence_scores_raw': {'identity': {'ai': 0, 'human': 1, 'mixed': 0}}, 'confidence_thresholds_raw': {'identity': {'ai': {'reject': 0.65, 'low': 0.75, 'medium': 0.92}, 'human': {'reject': 0.7, 'low': 0.82, 'medium': 0.92}, 'mixed': {'reject': 0.7, 'low': 0.8, 'medium': 0.88}}}, 'overall_burstiness': 0, 'writing_stats': {}, 'subclass': {'ai': {}, 'human': {}, 'mixed': {}}, 'result_message': 'Our detector is highly confident that the text is written entirely by a human.', 'document_classification': 'HUMAN_ONLY', 'version': '2025-01-09-base', 'language': 'en', 'pageNumber': 0, 'inputText': 'CHINCOTEAGUE, Va. (WTKR) – Thousands of people attended a famous pony swim in Virginia Wednesday. The crowd gathered at the eastern shore in the town of Chincoteague for the unique and historic event. For some, being at the swim was a dream fulfilled. For others, it’s a trip they take every year. Darby Callahan lives right outside of New York City and started coming to the event in 1995. It has always been her dream to buy a Chincoteague pony after reading the classic book, “Misty of Chincoteague,” as a little girl. “I bid $800 and got this little pony who we call Island Dream because it was a dream. And it’s always been my dream to come to Chincoteague because I love Chincoteague,” Callahan said. “So, we donated her back and every year we would come and we would see her.” According to urban legend, the ponies arrived on the island after a Spanish ship carrying wild horses sank in the 1600s. Now, the annual pony swim and auction is done every year to control the herd and raise money for the Chincoteague Volunteer Fire Department. “We’ve never lost a pony in 98 years of doing the pony swim. It’s just something we do. We always look out for the ponies. They’re number one,” said Chincoteague Mayor Arthur Leonard. Leonard said a member of his family has been in the round-up since the very first swim in 1925. “Watching my boys ride the horses and hopefully my grandson will do it one of these days,” Leonard said. The pony swim is followed by a parade through the island. After the swim, veterinarians examine the ponies which are then sold at auction. Copyright 2023 WTKR via CNN Newsource. All rights reserved.'}]"
FL_2023_49169e8cdcf70865dfbb3c703896a5e6.html.gz,2025-01-09-base,"[{'sentences': [{'generated_prob': 0.00034453999251127243, 'sentence': 'As of Friday, CDC data estimates indicate that the quickly spreading variant is now causing almost half of infections nationwide As of Friday, CDC data estimates indicate that the quickly spreading variant is now causing almost half of infections nationwide The latest breaking updates, delivered straight to your email inbox.', 'perplexity': 0, 'highlight_sentence_for_ai': False}, {'generated_prob': 0.00012657296610996127, 'sentence': 'As of Friday, CDC data estimates indicate that the quickly spreading variant is now causing almost half of infections nationwide The omicron coronavirus subvariant JN.1 now makes up 44.2% of COVID-19 cases in the United States, according to the U.S. Centers for Disease Control and Prevention.', 'perplexity': 0, 'highlight_sentence_for_ai': False}, {'generated_prob': 0.00010179095261264592, 'sentence': 'As of Friday, CDC data estimates indicate that the quickly spreading variant is now causing almost half of infections nationwide, when just days ago it was estimated that JN.1 caused only about 20% of infections.', 'perplexity': 0, 'highlight_sentence_for_ai': False}, {'generated_prob': 0.0001180079925688915, 'sentence': 'JN.1 makes up nearly 57% of new COVID-19 cases in the Northeast, according to the data.', 'perplexity': 0, 'highlight_sentence_for_ai': False}, {'generated_prob': 0.00014942714187782258, 'sentence': 'Earlier this week, the variant was already dominant in the region, causing about a third of new infections at the time.', 'perplexity': 0, 'highlight_sentence_for_ai': False}, {'generated_prob': 0.00017777357425075024, 'sentence': 'Globally, JN.1 continues to be reported in multiple countries, and its prevalence has been rapidly increasing.', 'perplexity': 0, 'highlight_sentence_for_ai': False}, {'generated_prob': 0.00025240497780032456, 'sentence': 'The World Health Organization named it a variant of interest on Tuesday because of its “rapidly increasing spread” but noted that the additional public health risk remains low.', 'perplexity': 0, 'highlight_sentence_for_ai': False}, {'generated_prob': 0.0002455594658385962, 'sentence': 'The CDC estimates that the prevalence of JN.1 more than doubled in the U.S. between late November and mid-December.', 'perplexity': 0, 'highlight_sentence_for_ai': False}, {'generated_prob': 0.0003911903768312186, 'sentence': 'It seems to be getting an assist from holiday travel and waning immunity.', 'perplexity': 0, 'highlight_sentence_for_ai': False}, {'generated_prob': 4.940056896884926e-05, 'sentence': 'Variant trackers say they expect JN.1 to become the leading coronavirus variant around the world in a matter of weeks.', 'perplexity': 0, 'highlight_sentence_for_ai': False}, {'generated_prob': 6.598101754207164e-05, 'sentence': ""Vaccine immunity is expected to remain “cross-reactive” to JN.1 ᅳ a descendant of the variant BA.2.86 ᅳ itself a subvariant that came to the world's attention over the summer because of the large number of changes to its spike proteins."", 'perplexity': 0, 'highlight_sentence_for_ai': False}, {'generated_prob': 6.141429184935987e-05, 'sentence': 'COVID-19 caused seven hospitalizations for every 100,000 people in the week ending on Dec. 9, accounting for a 3% increase, CDC data shows.', 'perplexity': 0, 'highlight_sentence_for_ai': False}, {'generated_prob': 5.092543869977817e-05, 'sentence': 'More than three-quarters of U.S. hospital beds are currently in use, which is largely in line with trends over the past three years since the COVID-19 pandemic.', 'perplexity': 0, 'highlight_sentence_for_ai': False}, {'generated_prob': 4.69080732727889e-05, 'sentence': 'However, the CDC warns that rising respiratory virus hospitalizations could strain health care resources in the coming weeks.', 'perplexity': 0, 'highlight_sentence_for_ai': False}, {'generated_prob': 4.8793357564136386e-05, 'sentence': 'Overall, COVID-19 data shows weekly hospitalizations have been trending down in recent weeks.', 'perplexity': 0, 'highlight_sentence_for_ai': False}, {'generated_prob': 6.181396020110697e-05, 'sentence': 'Meanwhile, flu hospitalizations are rising but remain steady compared with recent weeks, according to CDC data.', 'perplexity': 0, 'highlight_sentence_for_ai': False}, {'generated_prob': 9.816503734327853e-05, 'sentence': 'Flu-like activity is very high in five states and high in 15 states.', 'perplexity': 0, 'highlight_sentence_for_ai': False}, {'generated_prob': 9.847757610259578e-05, 'sentence': ""CNN Health's Brenda Goodman contributed to this report."", 'perplexity': 0, 'highlight_sentence_for_ai': False}, {'generated_prob': 0.0002604285255074501, 'sentence': 'Hearst Television participates in various affiliate marketing programs, which means we may get paid commissions on editorially chosen products purchased through our links to retailer sites.', 'perplexity': 0, 'highlight_sentence_for_ai': False}], 'paragraphs': [{'start_sentence_index': 0, 'num_sentences': 19, 'completely_generated_prob': 7.952272508076387e-17}], 'completely_generated_prob': 0.004984336704281843, 'class_probabilities': {'human': 0.9950156632957182, 'ai': 0.004984336704281843, 'mixed': 0}, 'average_generated_prob': 0, 'predicted_class': 'human', 'confidence_score': 0.9950156632957182, 'confidence_category': 'high', 'confidence_scores_raw': {'identity': {'ai': 0.004984336704281843, 'human': 0.9950156632957182, 'mixed': 0}}, 'confidence_thresholds_raw': {'identity': {'ai': {'reject': 0.65, 'low': 0.75, 'medium': 0.92}, 'human': {'reject': 0.7, 'low': 0.82, 'medium': 0.92}, 'mixed': {'reject': 0.7, 'low': 0.8, 'medium': 0.88}}}, 'overall_burstiness': 0, 'writing_stats': {}, 'subclass': {'ai': {}, 'human': {}, 'mixed': {}}, 'result_message': 'Our detector is highly confident that the text is written entirely by a human.', 'document_classification': 'HUMAN_ONLY', 'version': '2025-01-09-base', 'language': 'en', 'pageNumber': 0, 'inputText': 'As of Friday, CDC data estimates indicate that the quickly spreading variant is now causing almost half of infections nationwide As of Friday, CDC data estimates indicate that the quickly spreading variant is now causing almost half of infections nationwide The latest breaking updates, delivered straight to your email inbox. As of Friday, CDC data estimates indicate that the quickly spreading variant is now causing almost half of infections nationwide The omicron coronavirus subvariant JN.1 now makes up 44.2% of COVID-19 cases in the United States, according to the U.S. Centers for Disease Control and Prevention. As of Friday, CDC data estimates indicate that the quickly spreading variant is now causing almost half of infections nationwide, when just days ago it was estimated that JN.1 caused only about 20% of infections. JN.1 makes up nearly 57% of new COVID-19 cases in the Northeast, according to the data. Earlier this week, the variant was already dominant in the region, causing about a third of new infections at the time. Globally, JN.1 continues to be reported in multiple countries, and its prevalence has been rapidly increasing. The World Health Organization named it a variant of interest on Tuesday because of its “rapidly increasing spread” but noted that the additional public health risk remains low. The CDC estimates that the prevalence of JN.1 more than doubled in the U.S. between late November and mid-December. It seems to be getting an assist from holiday travel and waning immunity. Variant trackers say they expect JN.1 to become the leading coronavirus variant around the world in a matter of weeks. Vaccine immunity is expected to remain “cross-reactive” to JN.1 — a descendant of the variant BA.2.86 — itself a subvariant that came to the world’s attention over the summer because of the large number of changes to its spike proteins. COVID-19 caused seven hospitalizations for every 100,000 people in the week ending on Dec. 9, accounting for a 3% increase, CDC data shows. More than three-quarters of U.S. hospital beds are currently in use, which is largely in line with trends over the past three years since the COVID-19 pandemic. However, the CDC warns that rising respiratory virus hospitalizations could strain health care resources in the coming weeks. Overall, COVID-19 data shows weekly hospitalizations have been trending down in recent weeks. Meanwhile, flu hospitalizations are rising but remain steady compared with recent weeks, according to CDC data. Flu-like activity is very high in five states and high in 15 states. CNN Health’s Brenda Goodman contributed to this report. Hearst Television participates in various affiliate marketing programs, which means we may get paid commissions on editorially chosen products purchased through our links to retailer sites.'}]"
FL_2023_53ef6cf15010091d6627cdc99b24fae5.html.gz,2025-01-09-base,"[{'sentences': [{'generated_prob': 4.620092659024522e-05, 'sentence': 'Menu Each week, we here at Scripps News take the time to respond to your calls to our toll-free viewer hotline ᅳ which continue to come in by the thousands.', 'perplexity': 0, 'highlight_sentence_for_ai': False}, {'generated_prob': 4.084292595507577e-05, 'sentence': 'Michelle from Texas said: ""I wanted to thank you for putting your phone number up on the screen.', 'perplexity': 0, 'highlight_sentence_for_ai': False}, {'generated_prob': 5.936524030403234e-05, 'sentence': 'Very unusual that you can even reach out and touch anyone with a phone number, or find it for that matter - much less a news channel.', 'perplexity': 0, 'highlight_sentence_for_ai': False}, {'generated_prob': 8.920211985241622e-05, 'sentence': 'So thumbs up for that.""', 'perplexity': 0, 'highlight_sentence_for_ai': False}, {'generated_prob': 9.120312461163849e-05, 'sentence': ""SEE MORE: Trump coverage dominates viewer feedback We're thrilled to hear that so many of you enjoy reaching out to let us know what's on your mind."", 'perplexity': 0, 'highlight_sentence_for_ai': False}, {'generated_prob': 9.398891415912658e-05, 'sentence': 'Some of you have even connected with us to share your story ideas.', 'perplexity': 0, 'highlight_sentence_for_ai': False}, {'generated_prob': 7.376250869128853e-05, 'sentence': 'Stephanie from Florida said: “I would love to see a report on what is a lobbyist.', 'perplexity': 0, 'highlight_sentence_for_ai': False}, {'generated_prob': 7.995517080416903e-05, 'sentence': ""I had an incredible conversation with a lobbyist on a plane once…who told me it's basically marketing, it's just marketing, that all politics are just marketing campaigns.” We were sold!"", 'perplexity': 0, 'highlight_sentence_for_ai': False}, {'generated_prob': 6.434951501432806e-05, 'sentence': 'Our Saturday night program ""The Why"" decided to dig deeper.', 'perplexity': 0, 'highlight_sentence_for_ai': False}, {'generated_prob': 5.3922591177979484e-05, 'sentence': 'That story can be found below.', 'perplexity': 0, 'highlight_sentence_for_ai': False}, {'generated_prob': 6.08520713285543e-05, 'sentence': 'SEE MORE: What makes a lobbyist?', 'perplexity': 0, 'highlight_sentence_for_ai': False}, {'generated_prob': 9.337929077446461e-05, 'sentence': 'Story ideas like that one are always welcome on our viewer hotline.', 'perplexity': 0, 'highlight_sentence_for_ai': False}, {'generated_prob': 8.606778283137828e-05, 'sentence': 'But we also hear about the technical difficulties some of you face when watching us over-the-air on antenna.', 'perplexity': 0, 'highlight_sentence_for_ai': False}, {'generated_prob': 0.03775734454393387, 'sentence': 'Sally from North Carolina said: I call all the time because my picture is frozen again, and you are my news source.', 'perplexity': 0, 'highlight_sentence_for_ai': False}, {'generated_prob': 0.06252992153167725, 'sentence': 'You are the only news channel I get.', 'perplexity': 0, 'highlight_sentence_for_ai': False}, {'generated_prob': 0.03194298967719078, 'sentence': 'Could you please unfreeze the picture so I can see the news?""', 'perplexity': 0, 'highlight_sentence_for_ai': False}, {'generated_prob': 0.022201668471097946, 'sentence': ""It's frustrating and we wish we could fix the issue that easily."", 'perplexity': 0, 'highlight_sentence_for_ai': False}, {'generated_prob': 0.039495401084423065, 'sentence': ""But unfortunately, most of the time that's outside our control."", 'perplexity': 0, 'highlight_sentence_for_ai': False}, {'generated_prob': 0.03067600540816784, 'sentence': 'We recommend checking out the freetvproject.org ᅳ a website owned by the E.W.', 'perplexity': 0, 'highlight_sentence_for_ai': False}, {'generated_prob': 0.022788576781749725, 'sentence': 'Scripps Company ᅳ for tips on how to improve your signal.', 'perplexity': 0, 'highlight_sentence_for_ai': False}, {'generated_prob': 0.12120655179023743, 'sentence': 'It might mean repositioning your antenna or keeping the cable away from other power cords.', 'perplexity': 0, 'highlight_sentence_for_ai': False}, {'generated_prob': 0.1842499077320099, 'sentence': ""But even then, things like weather and where you're located can wreck your reception."", 'perplexity': 0, 'highlight_sentence_for_ai': False}, {'generated_prob': 0.07797212153673172, 'sentence': 'Just remember you can always watch us 24/7 on your favorite streaming platform or on our website at scrippsnews.com.', 'perplexity': 0, 'highlight_sentence_for_ai': False}, {'generated_prob': 0.10372322052717209, 'sentence': 'We appreciate your continued viewership and feedback, so please keep those calls coming!', 'perplexity': 0, 'highlight_sentence_for_ai': False}, {'generated_prob': 0.05889185518026352, 'sentence': ""Let us know how we're doing ᅳ good or bad ᅳ anytime on our toll-free Scripps News Viewer Hotline at 1-833-4-SCRIPPS to lend your voice to the conversation."", 'perplexity': 0, 'highlight_sentence_for_ai': False}, {'generated_prob': 0.070640429854393, 'sentence': 'Trending stories at Scrippsnews.com', 'perplexity': 0, 'highlight_sentence_for_ai': False}], 'paragraphs': [{'start_sentence_index': 0, 'num_sentences': 26, 'completely_generated_prob': 5.1426723732539106e-23}], 'completely_generated_prob': 0.05924693143200553, 'class_probabilities': {'human': 0.9404634541111649, 'ai': 0.05924693143200553, 'mixed': 0.0002896144568295141}, 'average_generated_prob': 0, 'predicted_class': 'human', 'confidence_score': 0.9404634541111649, 'confidence_category': 'high', 'confidence_scores_raw': {'identity': {'ai': 0.05924693143200553, 'human': 0.9404634541111649, 'mixed': 0.0002896144568295141}}, 'confidence_thresholds_raw': {'identity': {'ai': {'reject': 0.65, 'low': 0.75, 'medium': 0.92}, 'human': {'reject': 0.7, 'low': 0.82, 'medium': 0.92}, 'mixed': {'reject': 0.7, 'low': 0.8, 'medium': 0.88}}}, 'overall_burstiness': 0, 'writing_stats': {}, 'subclass': {'ai': {}, 'human': {}, 'mixed': {}}, 'result_message': 'Our detector is highly confident that the text is written entirely by a human.', 'document_classification': 'HUMAN_ONLY', 'version': '2025-01-09-base', 'language': 'en', 'pageNumber': 0, 'inputText': 'Menu Each week, we here at Scripps News take the time to respond to your calls to our toll-free viewer hotline — which continue to come in by the thousands. Michelle from Texas said: ""I wanted to thank you for putting your phone number up on the screen. Very unusual that you can even reach out and touch anyone with a phone number, or find it for that matter – much less a news channel. So thumbs up for that."" SEE MORE: Trump coverage dominates viewer feedback We\'re thrilled to hear that so many of you enjoy reaching out to let us know what\'s on your mind. Some of you have even connected with us to share your story ideas. Stephanie from Florida said: “I would love to see a report on what is a lobbyist. I had an incredible conversation with a lobbyist on a plane once…who told me it’s basically marketing, it’s just marketing, that all politics are just marketing campaigns.” We were sold! Our Saturday night program ""The Why"" decided to dig deeper. That story can be found below. SEE MORE: What makes a lobbyist? Story ideas like that one are always welcome on our viewer hotline. But we also hear about the technical difficulties some of you face when watching us over-the-air on antenna. Sally from North Carolina said: I call all the time because my picture is frozen again, and you are my news source. You are the only news channel I get. Could you please unfreeze the picture so I can see the news?"" It\'s frustrating and we wish we could fix the issue that easily. But unfortunately, most of the time that\'s outside our control. We recommend checking out the freetvproject.org — a website owned by the E.W. Scripps Company — for tips on how to improve your signal. It might mean repositioning your antenna or keeping the cable away from other power cords. But even then, things like weather and where you\'re located can wreck your reception. Just remember you can always watch us 24/7 on your favorite streaming platform or on our website at scrippsnews.com. We appreciate your continued viewership and feedback, so please keep those calls coming! Let us know how we’re doing — good or bad — anytime on our toll-free Scripps News Viewer Hotline at 1-833-4-SCRIPPS to lend your voice to the conversation. Trending stories at Scrippsnews.com'}]"
