File,version,documents
TX_2022_aacfd3c7824c1a48f395d8a1d8a38e92.html.gz,2025-01-09-base,"[{'sentences': [{'generated_prob': 0.00048398011131212115, 'sentence': 'Next up in 5 Example video title will go here for this video Next up in 5 Example video title will go here for this video ANDREWS, Texas ᅳ The National Transportation Safety Board is providing more preliminary information concerning the crash that killed nine people, including a 13-year-old boy and six members of the USW golf team.', 'perplexity': 0, 'highlight_sentence_for_ai': False}, {'generated_prob': 0.0003970898105762899, 'sentence': 'According to the NTSB, the 13-year-old boy was behind the wheel of the Dodge 2500 when its left front tire blew.', 'perplexity': 0, 'highlight_sentence_for_ai': False}, {'generated_prob': 0.0003444611211307347, 'sentence': 'The tire was a spare, and the vehicle was traveling at a high rate of speed.', 'perplexity': 0, 'highlight_sentence_for_ai': False}, {'generated_prob': 0.0003578320611268282, 'sentence': 'When the tire blew, it caused the truck to veer into the van head on.', 'perplexity': 0, 'highlight_sentence_for_ai': False}, {'generated_prob': 0.0003352905623614788, 'sentence': 'The NTSB also noted that several of the students in the van were not wearing seatbelts at the time of the crash.', 'perplexity': 0, 'highlight_sentence_for_ai': False}, {'generated_prob': 0.00045062918798066676, 'sentence': ""One of the van's passengers was ejected from the vehicle."", 'perplexity': 0, 'highlight_sentence_for_ai': False}, {'generated_prob': 0.00022940049530006945, 'sentence': 'The NTSB is considering the crash a ""mass casualty accident.""', 'perplexity': 0, 'highlight_sentence_for_ai': False}, {'generated_prob': 0.0003733538615051657, 'sentence': 'While the preliminary crash report is expected to be released in two to three weeks, gathering the rest of the evidence will likely take months as it will involve reconstructing the scene, getting information from the vehicle recorders and interviewing witnesses.', 'perplexity': 0, 'highlight_sentence_for_ai': False}, {'generated_prob': 0.00038601807318627834, 'sentence': '#BREAKING: The NTSB say the 13-year-old victim was behind the wheel of the Dodge truck at the time of the crash.', 'perplexity': 0, 'highlight_sentence_for_ai': False}, {'generated_prob': 0.0005249679088592529, 'sentence': 'Officials say the left front tire was a spare, it blew and sent the truck into the northbound lane, ultimately hitting the USW van.', 'perplexity': 0, 'highlight_sentence_for_ai': False}, {'generated_prob': 0.001775825396180153, 'sentence': 'Notifications can be turned off anytime in the browser settings.', 'perplexity': 0, 'highlight_sentence_for_ai': False}], 'paragraphs': [{'start_sentence_index': 0, 'num_sentences': 11, 'completely_generated_prob': 7.905466206762634e-10}], 'completely_generated_prob': 0.021455281010771585, 'class_probabilities': {'human': 0.978263083885808, 'ai': 0.021455281010771585, 'mixed': 0.00028163510342057015}, 'average_generated_prob': 0, 'predicted_class': 'human', 'confidence_score': 0.978263083885808, 'confidence_category': 'high', 'confidence_scores_raw': {'identity': {'ai': 0.021455281010771585, 'human': 0.978263083885808, 'mixed': 0.00028163510342057015}}, 'confidence_thresholds_raw': {'identity': {'ai': {'reject': 0.65, 'low': 0.75, 'medium': 0.92}, 'human': {'reject': 0.7, 'low': 0.82, 'medium': 0.92}, 'mixed': {'reject': 0.7, 'low': 0.8, 'medium': 0.88}}}, 'overall_burstiness': 0, 'writing_stats': {}, 'subclass': {'ai': {}, 'human': {}, 'mixed': {}}, 'result_message': 'Our detector is highly confident that the text is written entirely by a human.', 'document_classification': 'HUMAN_ONLY', 'version': '2025-01-09-base', 'language': 'en', 'pageNumber': 0, 'inputText': 'Next up in 5 Example video title will go here for this video Next up in 5 Example video title will go here for this video ANDREWS, Texas — The National Transportation Safety Board is providing more preliminary information concerning the crash that killed nine people, including a 13-year-old boy and six members of the USW golf team. According to the NTSB, the 13-year-old boy was behind the wheel of the Dodge 2500 when its left front tire blew. The tire was a spare, and the vehicle was traveling at a high rate of speed. When the tire blew, it caused the truck to veer into the van head on. The NTSB also noted that several of the students in the van were not wearing seatbelts at the time of the crash. One of the van\'s passengers was ejected from the vehicle. The NTSB is considering the crash a ""mass casualty accident."" While the preliminary crash report is expected to be released in two to three weeks, gathering the rest of the evidence will likely take months as it will involve reconstructing the scene, getting information from the vehicle recorders and interviewing witnesses. #BREAKING: The NTSB say the 13-year-old victim was behind the wheel of the Dodge truck at the time of the crash. Officials say the left front tire was a spare, it blew and sent the truck into the northbound lane, ultimately hitting the USW van. Notifications can be turned off anytime in the browser settings.'}]"
TX_2022_ad3ec65bc15ed7ce57a4a8ec4fe7d0e8.html.gz,2025-01-09-base,"[{'sentences': [{'generated_prob': 0.0002570322249084711, 'sentence': 'The lawsuit filed against Tiffany Haddish and Aries Spears that accused the comedians of sexual battery, sexual harassment and sexual abuse of a minor has been dismissed.', 'perplexity': 0, 'highlight_sentence_for_ai': False}, {'generated_prob': 0.00011570881179068238, 'sentence': 'The lawsuit.', 'perplexity': 0, 'highlight_sentence_for_ai': False}, {'generated_prob': 0.00021359357924666256, 'sentence': 'which was filed in late August by a 22-year-old woman and her minor brother (identified as Jane and John Doe), was dismissed at the request of the plaintiff.', 'perplexity': 0, 'highlight_sentence_for_ai': False}, {'generated_prob': 0.00023059314116835594, 'sentence': ""Spears took to Instagram to address the lawsuit's dismissal, sharing a screenshot of the news with the caption “I hope y'all keep that same energy.” Haddish's representative Cesidia Carosa also provided a photo of the notice of dismissal, adding that it was filed “with prejudice,” meaning the plaintiffs will be unable to file the same claims against Haddish or Spears again."", 'perplexity': 0, 'highlight_sentence_for_ai': False}, {'generated_prob': 0.0002456172660458833, 'sentence': 'Jane and John Doe alleged in the lawsuit that they were both assaulted by Haddish and Spears in Los Angeles several years ago when they were minors, claiming Haddish was a “longtime family friend” of their mother.', 'perplexity': 0, 'highlight_sentence_for_ai': False}, {'generated_prob': 0.00020960661640856415, 'sentence': 'The lawsuit described several instances of grooming and molestation by Haddish and Spears, such as when the comedians worked with the plaintiffs on a “Funny or Die” project about eight years ago that was sexually suggestive.', 'perplexity': 0, 'highlight_sentence_for_ai': False}, {'generated_prob': 8.559766865801066e-05, 'sentence': 'In a statement posted to Instagram Sept. 5, Haddish said that while there was very little she could say on the legal matter, she deeply regretted taking part in the “Funny or Die” skit.', 'perplexity': 0, 'highlight_sentence_for_ai': False}, {'generated_prob': 8.35993851069361e-05, 'sentence': ""writing, “Clearly, while this sketch was intended to be comedic, it wasn't funny at all.” According to the lawsuit, the plaintiffs' mother previously attempted to work out a $15,000 settlement with Spears over the video of John Doe but was unsuccessful."", 'perplexity': 0, 'highlight_sentence_for_ai': False}, {'generated_prob': 0.00015896768309175968, 'sentence': 'The suit did not specify the monetary value the plaintiffs were seeking.', 'perplexity': 0, 'highlight_sentence_for_ai': False}, {'generated_prob': 0.00012479805445764214, 'sentence': ""Spears' attorney Debra Opri called the lawsuit a “shakedown”, while Haddish's lawyer Andrew Brettler called the plaintiff's previous claims of abuse “bogus.” Brettler said: “Every attorney who has initially taken on her case - and there were several - ultimately dropped the matter once it became clear that the claims were meritless and Ms. Haddish would not be shaken down.” Editorial credit: Kathy Hutchins / Shutterstock.com View All"", 'perplexity': 0, 'highlight_sentence_for_ai': False}], 'paragraphs': [{'start_sentence_index': 0, 'num_sentences': 10, 'completely_generated_prob': 5.7802509961791254e-09}], 'completely_generated_prob': 0.006602786460384316, 'class_probabilities': {'human': 0.9933972135396156, 'ai': 0.006602786460384316, 'mixed': 0}, 'average_generated_prob': 0, 'predicted_class': 'human', 'confidence_score': 0.9933972135396156, 'confidence_category': 'high', 'confidence_scores_raw': {'identity': {'ai': 0.006602786460384316, 'human': 0.9933972135396156, 'mixed': 0}}, 'confidence_thresholds_raw': {'identity': {'ai': {'reject': 0.65, 'low': 0.75, 'medium': 0.92}, 'human': {'reject': 0.7, 'low': 0.82, 'medium': 0.92}, 'mixed': {'reject': 0.7, 'low': 0.8, 'medium': 0.88}}}, 'overall_burstiness': 0, 'writing_stats': {}, 'subclass': {'ai': {}, 'human': {}, 'mixed': {}}, 'result_message': 'Our detector is highly confident that the text is written entirely by a human.', 'document_classification': 'HUMAN_ONLY', 'version': '2025-01-09-base', 'language': 'en', 'pageNumber': 0, 'inputText': 'The lawsuit filed against Tiffany Haddish and Aries Spears that accused the comedians of sexual battery, sexual harassment and sexual abuse of a minor has been dismissed. The lawsuit. which was filed in late August by a 22-year-old woman and her minor brother (identified as Jane and John Doe), was dismissed at the request of the plaintiff. Spears took to Instagram to address the lawsuit’s dismissal, sharing a screenshot of the news with the caption “I hope y’all keep that same energy.” Haddish’s representative Cesidia Carosa also provided a photo of the notice of dismissal, adding that it was filed “with prejudice,” meaning the plaintiffs will be unable to file the same claims against Haddish or Spears again. Jane and John Doe alleged in the lawsuit that they were both assaulted by Haddish and Spears in Los Angeles several years ago when they were minors, claiming Haddish was a “longtime family friend” of their mother. The lawsuit described several instances of grooming and molestation by Haddish and Spears, such as when the comedians worked with the plaintiffs on a “Funny or Die” project about eight years ago that was sexually suggestive. In a statement posted to Instagram Sept. 5, Haddish said that while there was very little she could say on the legal matter, she deeply regretted taking part in the “Funny or Die” skit. writing, “Clearly, while this sketch was intended to be comedic, it wasn’t funny at all.” According to the lawsuit, the plaintiffs’ mother previously attempted to work out a $15,000 settlement with Spears over the video of John Doe but was unsuccessful. The suit did not specify the monetary value the plaintiffs were seeking. Spears’ attorney Debra Opri called the lawsuit a “shakedown”, while Haddish’s lawyer Andrew Brettler called the plaintiff’s previous claims of abuse “bogus.” Brettler said: “Every attorney who has initially taken on her case – and there were several – ultimately dropped the matter once it became clear that the claims were meritless and Ms. Haddish would not be shaken down.” Editorial credit: Kathy Hutchins / Shutterstock.com View All'}]"
TX_2022_b60facd8fa5e60f253c1074afcf4bc0b.html.gz,2025-01-09-base,"[{'sentences': [{'generated_prob': 5.8293298934586346e-05, 'sentence': 'Next up in 5 Example video title will go here for this video Next up in 5 Example video title will go here for this video NEW HAVEN, Conn. ᅳ A Hamden mother is hoping for change at hospitals after she lost her baby to a rare virus.', 'perplexity': 0, 'highlight_sentence_for_ai': False}, {'generated_prob': 5.630485247820616e-05, 'sentence': 'Ronan Delancy was born on May 21 at Yale New Haven Hospital.', 'perplexity': 0, 'highlight_sentence_for_ai': False}, {'generated_prob': 3.724965426954441e-05, 'sentence': 'A few days later, he showed a variety of fussy symptoms and doctors did multiple tests only to later find out he had a variant of Human Parechovirus.', 'perplexity': 0, 'highlight_sentence_for_ai': False}, {'generated_prob': 2.7749931177822873e-05, 'sentence': 'Parechovirus is a virus that is spread through surfaces, objects, or an infected person through sneezing, coughing, or saliva.', 'perplexity': 0, 'highlight_sentence_for_ai': False}, {'generated_prob': 3.0577015422750264e-05, 'sentence': 'It typically has little to no symptoms but known symptoms in young children include fever, cold or flu-like symptoms and diarrhea.', 'perplexity': 0, 'highlight_sentence_for_ai': False}, {'generated_prob': 4.0272585465572774e-05, 'sentence': 'It can cause a severe blood infection, meningitis or encephalitis in babies mostly under 3 months.', 'perplexity': 0, 'highlight_sentence_for_ai': False}, {'generated_prob': 3.624487726483494e-05, 'sentence': 'RELATED: Fisher-Price rockers linked to at least 13 deaths ""It breaks my heart because he should be here right now,"" said Katherine Delancy of Hamden.', 'perplexity': 0, 'highlight_sentence_for_ai': False}, {'generated_prob': 5.2091720135649666e-05, 'sentence': ""Katherine and her husband Mitch opened the green folder for the first time since their son's passing."", 'perplexity': 0, 'highlight_sentence_for_ai': False}, {'generated_prob': 5.473046621773392e-05, 'sentence': 'Inside were his feet and hand prints.', 'perplexity': 0, 'highlight_sentence_for_ai': False}, {'generated_prob': 7.153974729590118e-05, 'sentence': 'Ronin passed away 34 days after he was born.', 'perplexity': 0, 'highlight_sentence_for_ai': False}, {'generated_prob': 4.27625491283834e-05, 'sentence': 'Sign up for the FOX61 newsletters: Morning Forecast, Morning Headlines, Evening Headlines ""We didn\'t know our time would be so short,"" added Delancy.', 'perplexity': 0, 'highlight_sentence_for_ai': False}, {'generated_prob': 4.9478301662020385e-05, 'sentence': 'Doctors at first speculated Ronan had Colic, but Katherine knew it was more than that.', 'perplexity': 0, 'highlight_sentence_for_ai': False}, {'generated_prob': 7.320586882997304e-05, 'sentence': '""Later on that night, I had a bad feeling.', 'perplexity': 0, 'highlight_sentence_for_ai': False}, {'generated_prob': 7.825606007827446e-05, 'sentence': 'His oxygen saturation dropped from what should be 100 down to 70 and they checked again and it was down to 20,"" added Delancy.', 'perplexity': 0, 'highlight_sentence_for_ai': False}, {'generated_prob': 4.748093488160521e-05, 'sentence': 'Immediately, Ronan was intubated and started having seizures.', 'perplexity': 0, 'highlight_sentence_for_ai': False}, {'generated_prob': 6.399503035936505e-05, 'sentence': 'RELATED: Child in Bridgeport fighting for his life after suffering severe third-degree burns It was after doctors conducted different kinds of tests they then officially diagnosed him with Human Parechovirus, a type of virus that typically affects children under two years old.', 'perplexity': 0, 'highlight_sentence_for_ai': False}, {'generated_prob': 0.00010918747284449637, 'sentence': ""Dr. Ian Michelow with Connecticut Children's said he diagnosed two cases in the last month."", 'perplexity': 0, 'highlight_sentence_for_ai': False}, {'generated_prob': 0.0001186955050798133, 'sentence': '""It\'s like many other viruses spread either by the intestinal tract so contaminated hands or objects put in their mouth or it could be spread by respiratory droplets,"" said Dr. Michelow, head of the Division of Pediatric Infectious Diseases and Immunology.', 'perplexity': 0, 'highlight_sentence_for_ai': False}, {'generated_prob': 9.987368684960529e-05, 'sentence': ""It was not long until Ronan suffered brain damage and passed away in his mother's arms."", 'perplexity': 0, 'highlight_sentence_for_ai': False}, {'generated_prob': 0.00040823666495271027, 'sentence': '""We were sitting outside and music was playing and it was as beautiful as we could make it be for him,"" added Delancy.', 'perplexity': 0, 'highlight_sentence_for_ai': False}, {'generated_prob': 0.00057555380044505, 'sentence': 'Katherine is now using her story with the hope infants can have access to testing sooner as it may lead to a different outcome.', 'perplexity': 0, 'highlight_sentence_for_ai': False}, {'generated_prob': 0.0007843389757908881, 'sentence': '""Honestly, the only thing that\'s keeping me going is to prevent this from happening to somebody else,"" added Delancy.', 'perplexity': 0, 'highlight_sentence_for_ai': False}, {'generated_prob': 0.0008022637921385467, 'sentence': '""If a child is sick and needs to have whatever reason a spinal tap to check if there\'s an infection around the brain, we have the technology.', 'perplexity': 0, 'highlight_sentence_for_ai': False}, {'generated_prob': 0.00036311912117525935, 'sentence': 'Not everywhere but certainly academic centers, referral centers,"" added Dr. Michelow.', 'perplexity': 0, 'highlight_sentence_for_ai': False}, {'generated_prob': 0.00018588636885397136, 'sentence': 'Carmen Chau is an anchor and reporter at FOX61 News.', 'perplexity': 0, 'highlight_sentence_for_ai': False}, {'generated_prob': 0.0001049857382895425, 'sentence': 'She can be reached at cchau@fox61.com.', 'perplexity': 0, 'highlight_sentence_for_ai': False}, {'generated_prob': 0.00017160357674583793, 'sentence': 'Follow her on Facebook and Twitter.', 'perplexity': 0, 'highlight_sentence_for_ai': False}, {'generated_prob': 0.00017587393813300878, 'sentence': '--- Have a story idea or something on your mind you want to share?', 'perplexity': 0, 'highlight_sentence_for_ai': False}, {'generated_prob': 0.00014550115156453103, 'sentence': 'We want to hear from you!', 'perplexity': 0, 'highlight_sentence_for_ai': False}, {'generated_prob': 0.000166768062626943, 'sentence': 'Email us at newstips@fox61.com ---- HERE ARE MORE WAYS TO GET FOX61 NEWS Download the FOX61 News APP iTunes: Click here to download Google Play: Click here to download Stream Live on ROKU: Add the channel from the ROKU store or by searching FOX61.', 'perplexity': 0, 'highlight_sentence_for_ai': False}, {'generated_prob': 0.00024024797312449664, 'sentence': ""Steam Live on FIRE TV: Search 'FOX61' and click 'Get' to download."", 'perplexity': 0, 'highlight_sentence_for_ai': False}, {'generated_prob': 0.0002740433847066015, 'sentence': 'FOLLOW US ON TWITTER, FACEBOOK & INSTAGRAM Notifications can be turned off anytime in the browser settings.', 'perplexity': 0, 'highlight_sentence_for_ai': False}], 'paragraphs': [{'start_sentence_index': 0, 'num_sentences': 32, 'completely_generated_prob': 2.402550696571401e-28}], 'completely_generated_prob': 0.0054507966211679235, 'class_probabilities': {'human': 0.9945097664902408, 'ai': 0.0054507966211679235, 'mixed': 3.94368885912277e-05}, 'average_generated_prob': 0, 'predicted_class': 'human', 'confidence_score': 0.9945097664902408, 'confidence_category': 'high', 'confidence_scores_raw': {'identity': {'ai': 0.0054507966211679235, 'human': 0.9945097664902408, 'mixed': 3.94368885912277e-05}}, 'confidence_thresholds_raw': {'identity': {'ai': {'reject': 0.65, 'low': 0.75, 'medium': 0.92}, 'human': {'reject': 0.7, 'low': 0.82, 'medium': 0.92}, 'mixed': {'reject': 0.7, 'low': 0.8, 'medium': 0.88}}}, 'overall_burstiness': 0, 'writing_stats': {}, 'subclass': {'ai': {}, 'human': {}, 'mixed': {}}, 'result_message': 'Our detector is highly confident that the text is written entirely by a human.', 'document_classification': 'HUMAN_ONLY', 'version': '2025-01-09-base', 'language': 'en', 'pageNumber': 0, 'inputText': 'Next up in 5 Example video title will go here for this video Next up in 5 Example video title will go here for this video NEW HAVEN, Conn. — A Hamden mother is hoping for change at hospitals after she lost her baby to a rare virus. Ronan Delancy was born on May 21 at Yale New Haven Hospital. A few days later, he showed a variety of fussy symptoms and doctors did multiple tests only to later find out he had a variant of Human Parechovirus. Parechovirus is a virus that is spread through surfaces, objects, or an infected person through sneezing, coughing, or saliva. It typically has little to no symptoms but known symptoms in young children include fever, cold or flu-like symptoms and diarrhea. It can cause a severe blood infection, meningitis or encephalitis in babies mostly under 3 months. RELATED: Fisher-Price rockers linked to at least 13 deaths ""It breaks my heart because he should be here right now,"" said Katherine Delancy of Hamden. Katherine and her husband Mitch opened the green folder for the first time since their son\'s passing. Inside were his feet and hand prints. Ronin passed away 34 days after he was born. Sign up for the FOX61 newsletters: Morning Forecast, Morning Headlines, Evening Headlines ""We didn’t know our time would be so short,"" added Delancy. Doctors at first speculated Ronan had Colic, but Katherine knew it was more than that. ""Later on that night, I had a bad feeling. His oxygen saturation dropped from what should be 100 down to 70 and they checked again and it was down to 20,"" added Delancy. Immediately, Ronan was intubated and started having seizures. RELATED: Child in Bridgeport fighting for his life after suffering severe third-degree burns It was after doctors conducted different kinds of tests they then officially diagnosed him with Human Parechovirus, a type of virus that typically affects children under two years old. Dr. Ian Michelow with Connecticut Children\'s said he diagnosed two cases in the last month. ""It’s like many other viruses spread either by the intestinal tract so contaminated hands or objects put in their mouth or it could be spread by respiratory droplets,"" said Dr. Michelow, head of the Division of Pediatric Infectious Diseases and Immunology. It was not long until Ronan suffered brain damage and passed away in his mother\'s arms. ""We were sitting outside and music was playing and it was as beautiful as we could make it be for him,"" added Delancy. Katherine is now using her story with the hope infants can have access to testing sooner as it may lead to a different outcome. ""Honestly, the only thing that’s keeping me going is to prevent this from happening to somebody else,"" added Delancy. ""If a child is sick and needs to have whatever reason a spinal tap to check if there’s an infection around the brain, we have the technology. Not everywhere but certainly academic centers, referral centers,"" added Dr. Michelow. Carmen Chau is an anchor and reporter at FOX61 News. She can be reached at cchau@fox61.com. Follow her on Facebook and Twitter. --- Have a story idea or something on your mind you want to share? We want to hear from you! Email us at newstips@fox61.com ---- HERE ARE MORE WAYS TO GET FOX61 NEWS Download the FOX61 News APP iTunes: Click here to download Google Play: Click here to download Stream Live on ROKU: Add the channel from the ROKU store or by searching FOX61. Steam Live on FIRE TV: Search ‘FOX61’ and click ‘Get’ to download. FOLLOW US ON TWITTER, FACEBOOK & INSTAGRAM Notifications can be turned off anytime in the browser settings.'}]"
