File,version,documents
LA_2023_251c53a0ac8750d919e5b558a5a33809.html.gz,2025-01-09-base,"[{'sentences': [{'generated_prob': 9.905482875183225e-05, 'sentence': 'With all the green in the photo above, you might not expect it was taken on December 4.', 'perplexity': 0, 'highlight_sentence_for_ai': False}, {'generated_prob': 0.00013512547593563795, 'sentence': ""Another reason I love the weather down here, not that I don't complain like everybody else about the extended stretches of occasional 100's."", 'perplexity': 0, 'highlight_sentence_for_ai': False}, {'generated_prob': 0.00011399025970604271, 'sentence': ""It's been awhile since the old clubs have seen daylight, so I decided I might see if I could still operate them correctly."", 'perplexity': 0, 'highlight_sentence_for_ai': False}, {'generated_prob': 0.00013089469575788826, 'sentence': 'I think I still have the jist of it, meaning I could make contact with the ball and change its position somewhat.', 'perplexity': 0, 'highlight_sentence_for_ai': False}, {'generated_prob': 0.00015014898963272572, 'sentence': ""Might just try to get a round in before the year's end."", 'perplexity': 0, 'highlight_sentence_for_ai': False}, {'generated_prob': 0.00014212123642209917, 'sentence': 'Then again, maybe not.', 'perplexity': 0, 'highlight_sentence_for_ai': False}, {'generated_prob': 0.00010940882930299267, 'sentence': 'Shortly after taking the pic below, where Rosie the pup seems to be giving me a read on distance, I took her advice and elected to use an easy wedge.', 'perplexity': 0, 'highlight_sentence_for_ai': False}, {'generated_prob': 0.00012560340110212564, 'sentence': 'Well, I ended up over-easing my shot, it soared above the house next door and landed in the street somewhere.', 'perplexity': 0, 'highlight_sentence_for_ai': False}, {'generated_prob': 0.00017002997628878802, 'sentence': ""I didn't hear it bounce on the pavement, and decided not to try to hunt it down, for fear I'd find a Titleist-sized hole in one of my neighbor's windshields."", 'perplexity': 0, 'highlight_sentence_for_ai': False}, {'generated_prob': 0.00018950078811030835, 'sentence': 'I opted to lay-low indoors the rest of the day…with the blinds shut tight.', 'perplexity': 0, 'highlight_sentence_for_ai': False}, {'generated_prob': 0.0003591685963328928, 'sentence': '98 Rocks is a part of Alpha Media LLC.© 2024 Alpha Media LLC.', 'perplexity': 0, 'highlight_sentence_for_ai': False}, {'generated_prob': 0.0004025963135063648, 'sentence': 'All Rights Reserved.', 'perplexity': 0, 'highlight_sentence_for_ai': False}], 'paragraphs': [{'start_sentence_index': 0, 'num_sentences': 12, 'completely_generated_prob': 1.0731758790825431e-10}], 'completely_generated_prob': 0.0051780533755591265, 'class_probabilities': {'human': 0.9948219466244408, 'ai': 0.0051780533755591265, 'mixed': 0}, 'average_generated_prob': 0, 'predicted_class': 'human', 'confidence_score': 0.9948219466244408, 'confidence_category': 'high', 'confidence_scores_raw': {'identity': {'ai': 0.0051780533755591265, 'human': 0.9948219466244408, 'mixed': 0}}, 'confidence_thresholds_raw': {'identity': {'ai': {'reject': 0.65, 'low': 0.75, 'medium': 0.92}, 'human': {'reject': 0.7, 'low': 0.82, 'medium': 0.92}, 'mixed': {'reject': 0.7, 'low': 0.8, 'medium': 0.88}}}, 'overall_burstiness': 0, 'writing_stats': {}, 'subclass': {'ai': {}, 'human': {}, 'mixed': {}}, 'result_message': 'Our detector is highly confident that the text is written entirely by a human.', 'document_classification': 'HUMAN_ONLY', 'version': '2025-01-09-base', 'language': 'en', 'pageNumber': 0, 'inputText': 'With all the green in the photo above, you might not expect it was taken on December 4. Another reason I love the weather down here, not that I don’t complain like everybody else about the extended stretches of occasional 100’s. It’s been awhile since the old clubs have seen daylight, so I decided I might see if I could still operate them correctly. I think I still have the jist of it, meaning I could make contact with the ball and change its position somewhat. Might just try to get a round in before the year’s end. Then again, maybe not. Shortly after taking the pic below, where Rosie the pup seems to be giving me a read on distance, I took her advice and elected to use an easy wedge. Well, I ended up over-easing my shot, it soared above the house next door and landed in the street somewhere. I didn’t hear it bounce on the pavement, and decided not to try to hunt it down, for fear I’d find a Titleist-sized hole in one of my neighbor’s windshields. I opted to lay-low indoors the rest of the day…with the blinds shut tight. 98 Rocks is a part of Alpha Media LLC.© 2024 Alpha Media LLC. All Rights Reserved.'}]"
LA_2023_3ca36bce2b79bebcd62854a3909cf967.html.gz,2025-01-09-base,"[{'sentences': [{'generated_prob': 0.005161220673471689, 'sentence': ""Coming on July 6th to Marksville, it's the legendary Lee Greenwood!!"", 'perplexity': 0, 'highlight_sentence_for_ai': False}, {'generated_prob': 0.005695456173270941, 'sentence': 'The man behind iconic hits such as ""God... Get ready for two HUGE nights of Mud Racing!!', 'perplexity': 0, 'highlight_sentence_for_ai': False}, {'generated_prob': 0.004467995837330818, 'sentence': 'Think you got what it takes to win it all?', 'perplexity': 0, 'highlight_sentence_for_ai': False}, {'generated_prob': 0.0065560429356992245, 'sentence': 'Sign up now at Glas... Mint Flooring and Tile, in Pollock is hosting their first ever Summer Neighborhood Festival this May 31st and June... Landon Wright drives you home each weekday after a long day at work with the Drive at 5.', 'perplexity': 0, 'highlight_sentence_for_ai': False}, {'generated_prob': 0.0032828724943101406, 'sentence': ""Brought you by Jewel's Qu... Coming on July 6th to Marksville, it's the legendary Lee Greenwood!!"", 'perplexity': 0, 'highlight_sentence_for_ai': False}, {'generated_prob': 0.002882391447201371, 'sentence': 'The man behind iconic hits such as ""God... Get ready for two HUGE nights of Mud Racing!!', 'perplexity': 0, 'highlight_sentence_for_ai': False}, {'generated_prob': 0.001937196939252317, 'sentence': 'Think you got what it takes to win it all?', 'perplexity': 0, 'highlight_sentence_for_ai': False}, {'generated_prob': 0.001968423370271921, 'sentence': 'Sign up now at Glas... Mint Flooring and Tile, in Pollock is hosting their first ever Summer Neighborhood Festival this May 31st and June... Landon Wright drives you home each weekday after a long day at work with the Drive at 5.', 'perplexity': 0, 'highlight_sentence_for_ai': False}, {'generated_prob': 0.0008571773068979383, 'sentence': ""Brought you by Jewel's Quick S... Stay up to date with news from The Louisiana Radio Network plus the latest weather forecast so you can plan your day!"", 'perplexity': 0, 'highlight_sentence_for_ai': False}, {'generated_prob': 0.0007554158801212907, 'sentence': ""Sunday mornings at 9am, it's the Pure American Country Radio Show!"", 'perplexity': 0, 'highlight_sentence_for_ai': False}, {'generated_prob': 0.0010744876926764846, 'sentence': 'Catch 2 hours of interviews, legendary songs, trivia...', 'perplexity': 0, 'highlight_sentence_for_ai': False}], 'paragraphs': [{'start_sentence_index': 0, 'num_sentences': 11, 'completely_generated_prob': 7.905466206762634e-10}], 'completely_generated_prob': 0.010903818453797858, 'class_probabilities': {'human': 0.9888045200658648, 'ai': 0.010903818453797858, 'mixed': 0.0002916614803373708}, 'average_generated_prob': 0, 'predicted_class': 'human', 'confidence_score': 0.9888045200658648, 'confidence_category': 'high', 'confidence_scores_raw': {'identity': {'ai': 0.010903818453797858, 'human': 0.9888045200658648, 'mixed': 0.0002916614803373708}}, 'confidence_thresholds_raw': {'identity': {'ai': {'reject': 0.65, 'low': 0.75, 'medium': 0.92}, 'human': {'reject': 0.7, 'low': 0.82, 'medium': 0.92}, 'mixed': {'reject': 0.7, 'low': 0.8, 'medium': 0.88}}}, 'overall_burstiness': 0, 'writing_stats': {}, 'subclass': {'ai': {}, 'human': {}, 'mixed': {}}, 'result_message': 'Our detector is highly confident that the text is written entirely by a human.', 'document_classification': 'HUMAN_ONLY', 'version': '2025-01-09-base', 'language': 'en', 'pageNumber': 0, 'inputText': 'Coming on July 6th to Marksville, it\'s the legendary Lee Greenwood!! The man behind iconic hits such as ""God... Get ready for two HUGE nights of Mud Racing!! Think you got what it takes to win it all? Sign up now at Glas... Mint Flooring and Tile, in Pollock is hosting their first ever Summer Neighborhood Festival this May 31st and June... Landon Wright drives you home each weekday after a long day at work with the Drive at 5. Brought you by Jewel\'s Qu... Coming on July 6th to Marksville, it\'s the legendary Lee Greenwood!! The man behind iconic hits such as ""God... Get ready for two HUGE nights of Mud Racing!! Think you got what it takes to win it all? Sign up now at Glas... Mint Flooring and Tile, in Pollock is hosting their first ever Summer Neighborhood Festival this May 31st and June... Landon Wright drives you home each weekday after a long day at work with the Drive at 5. Brought you by Jewel\'s Quick S... Stay up to date with news from The Louisiana Radio Network plus the latest weather forecast so you can plan your day! Sunday mornings at 9am, it\'s the Pure American Country Radio Show! Catch 2 hours of interviews, legendary songs, trivia...'}]"
LA_2023_505fb1a1d62e4ac78fd7fcd266df877f.html.gz,2025-01-09-base,"[{'sentences': [{'generated_prob': 0.00015858410915825516, 'sentence': 'LAFAYETTE, La.', 'perplexity': 0, 'highlight_sentence_for_ai': False}, {'generated_prob': 0.00012111930118408054, 'sentence': '(KPEL News) - A New Iberia man will be spending quite a bit of time behind bars after a joint investigation by the US Drug Enforcement Administration, Department of Homeland Security Investigations, Louisiana State Police, and New Iberia Police say he was transporting drugs and proceeds to and from Lafayette, Louisiana; California; Iowa; and South Carolina.', 'perplexity': 0, 'highlight_sentence_for_ai': False}, {'generated_prob': 0.00011478466331027448, 'sentence': 'The DEA began investigating in 2020 and found 44-year-old Joseph R. Johnson to be supplying a drug trafficking organization operating in the Lafayette area.', 'perplexity': 0, 'highlight_sentence_for_ai': False}, {'generated_prob': 0.00011356870527379215, 'sentence': 'Investigation say Johnson frequently traveled to southern California to Louisiana so he could distribute the drugs.', 'perplexity': 0, 'highlight_sentence_for_ai': False}, {'generated_prob': 0.00015122353215701878, 'sentence': 'Then, he used the mail to transport the drugs and proceeds to the other states mentioned above.', 'perplexity': 0, 'highlight_sentence_for_ai': False}, {'generated_prob': 0.00016527021944057196, 'sentence': ""Agents say they were able to intercept Johnson's wire communications in 2021, identifying multiple co-conspirators who were helping Johnson traffic methamphetamine, which was being shipped to and from the co-conspirators involved in the drug trafficking organization."", 'perplexity': 0, 'highlight_sentence_for_ai': False}, {'generated_prob': 0.00021130242384970188, 'sentence': 'Investigators then identified and intercepted a vehicle that was transporting over 30 pound of methamphetamine concealed inside.', 'perplexity': 0, 'highlight_sentence_for_ai': False}, {'generated_prob': 0.00023722561309114099, 'sentence': 'Johnson admitted to willfully conspiring with his codefendants in this case when he pled guilty on April 27, 2023 to one count of conspiracy to distribute and possess with intent to distribute methamphetamine.', 'perplexity': 0, 'highlight_sentence_for_ai': False}, {'generated_prob': 0.00041017099283635616, 'sentence': 'United States District Judge Robert R. Summerhays sentenced Johnson to 13 years, 1 month in prison followed by five years of supervised release.', 'perplexity': 0, 'highlight_sentence_for_ai': False}, {'generated_prob': 0.0003563680802471936, 'sentence': 'The case was prosecuted by Assistant United States Attorneys Daniel J. Vermaelen and J. Aaron Crawford.', 'perplexity': 0, 'highlight_sentence_for_ai': False}, {'generated_prob': 0.0003966915246564895, 'sentence': 'Gallery Credit: Cindy Campbell', 'perplexity': 0, 'highlight_sentence_for_ai': False}], 'paragraphs': [{'start_sentence_index': 0, 'num_sentences': 11, 'completely_generated_prob': 7.905466206762634e-10}], 'completely_generated_prob': 0.006608679833334143, 'class_probabilities': {'human': 0.9933913201666659, 'ai': 0.006608679833334143, 'mixed': 0}, 'average_generated_prob': 0, 'predicted_class': 'human', 'confidence_score': 0.9933913201666659, 'confidence_category': 'high', 'confidence_scores_raw': {'identity': {'ai': 0.006608679833334143, 'human': 0.9933913201666659, 'mixed': 0}}, 'confidence_thresholds_raw': {'identity': {'ai': {'reject': 0.65, 'low': 0.75, 'medium': 0.92}, 'human': {'reject': 0.7, 'low': 0.82, 'medium': 0.92}, 'mixed': {'reject': 0.7, 'low': 0.8, 'medium': 0.88}}}, 'overall_burstiness': 0, 'writing_stats': {}, 'subclass': {'ai': {}, 'human': {}, 'mixed': {}}, 'result_message': 'Our detector is highly confident that the text is written entirely by a human.', 'document_classification': 'HUMAN_ONLY', 'version': '2025-01-09-base', 'language': 'en', 'pageNumber': 0, 'inputText': ""LAFAYETTE, La. (KPEL News) - A New Iberia man will be spending quite a bit of time behind bars after a joint investigation by the US Drug Enforcement Administration, Department of Homeland Security Investigations, Louisiana State Police, and New Iberia Police say he was transporting drugs and proceeds to and from Lafayette, Louisiana; California; Iowa; and South Carolina. The DEA began investigating in 2020 and found 44-year-old Joseph R. Johnson to be supplying a drug trafficking organization operating in the Lafayette area. Investigation say Johnson frequently traveled to southern California to Louisiana so he could distribute the drugs. Then, he used the mail to transport the drugs and proceeds to the other states mentioned above. Agents say they were able to intercept Johnson's wire communications in 2021, identifying multiple co-conspirators who were helping Johnson traffic methamphetamine, which was being shipped to and from the co-conspirators involved in the drug trafficking organization. Investigators then identified and intercepted a vehicle that was transporting over 30 pound of methamphetamine concealed inside. Johnson admitted to willfully conspiring with his codefendants in this case when he pled guilty on April 27, 2023 to one count of conspiracy to distribute and possess with intent to distribute methamphetamine. United States District Judge Robert R. Summerhays sentenced Johnson to 13 years, 1 month in prison followed by five years of supervised release. The case was prosecuted by Assistant United States Attorneys Daniel J. Vermaelen and J. Aaron Crawford. Gallery Credit: Cindy Campbell""}]"
