File,version,documents
LA_2023_8e6f1fd56bcf9ce47570cea199e58682.html.gz,2025-01-09-base,"[{'sentences': [{'generated_prob': 1.5236260878737085e-05, 'sentence': ""NEW ORLEANS (WVUE) - Among the survivors of Monday's Interstate-55 pileup was a student driver, taking her final roadway test, and her instructor."", 'perplexity': 0, 'highlight_sentence_for_ai': False}, {'generated_prob': 1.3547844901040662e-05, 'sentence': 'They made it out of the 168-vehicle crash alive, unharmed and without a scratch on their car.', 'perplexity': 0, 'highlight_sentence_for_ai': False}, {'generated_prob': 1.3854883036401588e-05, 'sentence': ""Instructor Gisela Chevalier said she got into her J&G International Driving School car Monday morning (Oct. 23) to test a student on the I-10 to I-55 route she's used for years."", 'perplexity': 0, 'highlight_sentence_for_ai': False}, {'generated_prob': 1.2876275832240935e-05, 'sentence': ""“I'm not afraid of fog."", 'perplexity': 0, 'highlight_sentence_for_ai': False}, {'generated_prob': 1.2961263564648107e-05, 'sentence': ""So, I told my student, 'Don't be afraid of fog,'” Chevalier said."", 'perplexity': 0, 'highlight_sentence_for_ai': False}, {'generated_prob': 1.414386133546941e-05, 'sentence': ""“We have to drive on foggy days, on rainy days, so that's OK.” But on this foggy day, visibility dropped to near zero on I-55 near Manchac."", 'perplexity': 0, 'highlight_sentence_for_ai': False}, {'generated_prob': 1.1434884982008953e-05, 'sentence': ""Chevalier's student driver was behind the wheel."", 'perplexity': 0, 'highlight_sentence_for_ai': False}, {'generated_prob': 1.2758177035721019e-05, 'sentence': 'In front of their car was a flatbed trailer.', 'perplexity': 0, 'highlight_sentence_for_ai': False}, {'generated_prob': 1.1873543371621054e-05, 'sentence': 'Coming up behind them, a double 18-wheeler.', 'perplexity': 0, 'highlight_sentence_for_ai': False}, {'generated_prob': 1.1868311048601754e-05, 'sentence': 'They both slammed on the brake and hoped for the best.', 'perplexity': 0, 'highlight_sentence_for_ai': False}, {'generated_prob': 1.1662341421470046e-05, 'sentence': ""“I'm very proud of her, because she did what we taught her to do,” Chevalier said."", 'perplexity': 0, 'highlight_sentence_for_ai': False}, {'generated_prob': 1.6486714230268262e-05, 'sentence': '“We are here because she handled it really good.', 'perplexity': 0, 'highlight_sentence_for_ai': False}, {'generated_prob': 1.298551978834439e-05, 'sentence': 'Really brave.” Chevalier was happy with her driver, but critical of those sharing the road that morning.', 'perplexity': 0, 'highlight_sentence_for_ai': False}, {'generated_prob': 1.6226145817199722e-05, 'sentence': '“A lot of cars were passing -- a little bit of speeding -- due to the smoke and fog.', 'perplexity': 0, 'highlight_sentence_for_ai': False}, {'generated_prob': 1.2813756256946363e-05, 'sentence': 'In my opinion, they were a little bit too fast,” Chevalier said.', 'perplexity': 0, 'highlight_sentence_for_ai': False}, {'generated_prob': 2.4385117285419255e-05, 'sentence': '“A lot of them with the lights off.', 'perplexity': 0, 'highlight_sentence_for_ai': False}, {'generated_prob': 2.8648097213590518e-05, 'sentence': ""And that's why that state trooper was almost going from car to car, in his car, 'Hey turn the lights on.'"", 'perplexity': 0, 'highlight_sentence_for_ai': False}, {'generated_prob': 0.002740009455010295, 'sentence': ""I had the automatic, but evidently it wasn't enough.” Not soon after, the pileups began, 911 calls were made and dispatchers sent whomever they could to assist victims."", 'perplexity': 0, 'highlight_sentence_for_ai': False}, {'generated_prob': 0.003377145156264305, 'sentence': ""“We do have everybody in route to y'all."", 'perplexity': 0, 'highlight_sentence_for_ai': False}, {'generated_prob': 0.0033121558371931314, 'sentence': 'Multiple fire departments, police and ambulance,” said an operator.', 'perplexity': 0, 'highlight_sentence_for_ai': False}, {'generated_prob': 0.003690754994750023, 'sentence': ""“So, they're coming that way, and they'll get to you when they can.” Chevalier says the cars around hers were smashed beyond recognition."", 'perplexity': 0, 'highlight_sentence_for_ai': False}, {'generated_prob': 0.0022752019576728344, 'sentence': 'She and her student spent hours trapped on the bridge.', 'perplexity': 0, 'highlight_sentence_for_ai': False}, {'generated_prob': 0.004126698710024357, 'sentence': 'They saw a fire truck driving in reverse to get to victims.', 'perplexity': 0, 'highlight_sentence_for_ai': False}, {'generated_prob': 0.0025652889162302017, 'sentence': 'They saw first responders getting out and walking where the road was impassable.', 'perplexity': 0, 'highlight_sentence_for_ai': False}, {'generated_prob': 0.002876534592360258, 'sentence': 'And when it came time to give her student a final grade, she had no hesitation.', 'perplexity': 0, 'highlight_sentence_for_ai': False}, {'generated_prob': 0.002395136281847954, 'sentence': '“She was really calm, too,” Chevalier said.', 'perplexity': 0, 'highlight_sentence_for_ai': False}, {'generated_prob': 0.0027157783042639494, 'sentence': '“She was at the wheel when all that happened.', 'perplexity': 0, 'highlight_sentence_for_ai': False}, {'generated_prob': 0.004139405209571123, 'sentence': 'When we were ready to leave and turn around, I took the wheel, because I thought it was too much for her, honestly,” Chevalier said.', 'perplexity': 0, 'highlight_sentence_for_ai': False}, {'generated_prob': 0.004684419836848974, 'sentence': ""“She's a master."", 'perplexity': 0, 'highlight_sentence_for_ai': False}, {'generated_prob': 0.003648881334811449, 'sentence': 'She made 100 (for her grade), no doubt about it.', 'perplexity': 0, 'highlight_sentence_for_ai': False}, {'generated_prob': 0.004602021537721157, 'sentence': ""She earned it.” Chevalier says she graduated that driver's husband as well, just last week."", 'perplexity': 0, 'highlight_sentence_for_ai': False}, {'generated_prob': 0.004964206367731094, 'sentence': ""Chevalier also didn't wait long to conquer the fear of riding again."", 'perplexity': 0, 'highlight_sentence_for_ai': False}, {'generated_prob': 0.004800376482307911, 'sentence': 'She said another student was tested Tuesday morning in the same car, on roughly the same route, albeit modified by the closed stretch of I-55 still being cleared of wreckage.', 'perplexity': 0, 'highlight_sentence_for_ai': False}, {'generated_prob': 0.014607102610170841, 'sentence': 'See a spelling or grammar error in our story?', 'perplexity': 0, 'highlight_sentence_for_ai': False}, {'generated_prob': 0.006992656271904707, 'sentence': 'Click Here to report it.', 'perplexity': 0, 'highlight_sentence_for_ai': False}, {'generated_prob': 0.01109778881072998, 'sentence': 'Please include the headline.', 'perplexity': 0, 'highlight_sentence_for_ai': False}, {'generated_prob': 0.01735805906355381, 'sentence': 'Subscribe to the Fox 8 YouTube channel.', 'perplexity': 0, 'highlight_sentence_for_ai': False}, {'generated_prob': 0.00835622102022171, 'sentence': 'Copyright 2023 WVUE.', 'perplexity': 0, 'highlight_sentence_for_ai': False}, {'generated_prob': 0.007993345148861408, 'sentence': 'All rights reserved.', 'perplexity': 0, 'highlight_sentence_for_ai': False}], 'paragraphs': [{'start_sentence_index': 0, 'num_sentences': 39, 'completely_generated_prob': 1.3880297752938097e-34}], 'completely_generated_prob': 0.025041194076269924, 'class_probabilities': {'human': 0.974671313226954, 'ai': 0.025041194076269924, 'mixed': 0.00028749269677611}, 'average_generated_prob': 0, 'predicted_class': 'human', 'confidence_score': 0.974671313226954, 'confidence_category': 'high', 'confidence_scores_raw': {'identity': {'ai': 0.025041194076269924, 'human': 0.974671313226954, 'mixed': 0.00028749269677611}}, 'confidence_thresholds_raw': {'identity': {'ai': {'reject': 0.65, 'low': 0.75, 'medium': 0.92}, 'human': {'reject': 0.7, 'low': 0.82, 'medium': 0.92}, 'mixed': {'reject': 0.7, 'low': 0.8, 'medium': 0.88}}}, 'overall_burstiness': 0, 'writing_stats': {}, 'subclass': {'ai': {}, 'human': {}, 'mixed': {}}, 'result_message': 'Our detector is highly confident that the text is written entirely by a human.', 'document_classification': 'HUMAN_ONLY', 'version': '2025-01-09-base', 'language': 'en', 'pageNumber': 0, 'inputText': 'NEW ORLEANS (WVUE) - Among the survivors of Monday’s Interstate-55 pileup was a student driver, taking her final roadway test, and her instructor. They made it out of the 168-vehicle crash alive, unharmed and without a scratch on their car. Instructor Gisela Chevalier said she got into her J&G International Driving School car Monday morning (Oct. 23) to test a student on the I-10 to I-55 route she’s used for years. “I’m not afraid of fog. So, I told my student, ‘Don’t be afraid of fog,’” Chevalier said. “We have to drive on foggy days, on rainy days, so that’s OK.” But on this foggy day, visibility dropped to near zero on I-55 near Manchac. Chevalier’s student driver was behind the wheel. In front of their car was a flatbed trailer. Coming up behind them, a double 18-wheeler. They both slammed on the brake and hoped for the best. “I’m very proud of her, because she did what we taught her to do,” Chevalier said. “We are here because she handled it really good. Really brave.” Chevalier was happy with her driver, but critical of those sharing the road that morning. “A lot of cars were passing -- a little bit of speeding -- due to the smoke and fog. In my opinion, they were a little bit too fast,” Chevalier said. “A lot of them with the lights off. And that’s why that state trooper was almost going from car to car, in his car, ‘Hey turn the lights on.’ I had the automatic, but evidently it wasn’t enough.” Not soon after, the pileups began, 911 calls were made and dispatchers sent whomever they could to assist victims. “We do have everybody in route to y’all. Multiple fire departments, police and ambulance,” said an operator. “So, they’re coming that way, and they’ll get to you when they can.” Chevalier says the cars around hers were smashed beyond recognition. She and her student spent hours trapped on the bridge. They saw a fire truck driving in reverse to get to victims. They saw first responders getting out and walking where the road was impassable. And when it came time to give her student a final grade, she had no hesitation. “She was really calm, too,” Chevalier said. “She was at the wheel when all that happened. When we were ready to leave and turn around, I took the wheel, because I thought it was too much for her, honestly,” Chevalier said. “She’s a master. She made 100 (for her grade), no doubt about it. She earned it.” Chevalier says she graduated that driver’s husband as well, just last week. Chevalier also didn’t wait long to conquer the fear of riding again. She said another student was tested Tuesday morning in the same car, on roughly the same route, albeit modified by the closed stretch of I-55 still being cleared of wreckage. See a spelling or grammar error in our story? Click Here to report it. Please include the headline. Subscribe to the Fox 8 YouTube channel. Copyright 2023 WVUE. All rights reserved.'}]"
LA_2023_a32f1437160a4ae16bc8da139aa9e53d.html.gz,2025-01-09-base,"[{'sentences': [{'generated_prob': 8.750127744860947e-05, 'sentence': 'BATON ROUGE, La.', 'perplexity': 0, 'highlight_sentence_for_ai': False}, {'generated_prob': 4.579872984322719e-05, 'sentence': ""(WAFB) - Just like that, Governor John Bel Edwards's eight years in the governor's mansion is coming to an end."", 'perplexity': 0, 'highlight_sentence_for_ai': False}, {'generated_prob': 5.196948768571019e-05, 'sentence': ""On Monday, Dec. 18, he reflected on everything he's encountered during his eight years in office."", 'perplexity': 0, 'highlight_sentence_for_ai': False}, {'generated_prob': 4.203173011774197e-05, 'sentence': ""While running through the list of accomplishments his office has achieved, the one he's most proud of is expanding Medicaid."", 'perplexity': 0, 'highlight_sentence_for_ai': False}, {'generated_prob': 5.482190317707136e-05, 'sentence': ""“Now, more than half a million working Louisianians have access to healthcare who otherwise wouldn't,” Gov."", 'perplexity': 0, 'highlight_sentence_for_ai': False}, {'generated_prob': 3.7854293623240665e-05, 'sentence': 'Edwards said.', 'perplexity': 0, 'highlight_sentence_for_ai': False}, {'generated_prob': 4.477306720218621e-05, 'sentence': ""The governor also noted the large amount of surplus dollars in the state's bank, comparing how things are now to when he first took office in 2016."", 'perplexity': 0, 'highlight_sentence_for_ai': False}, {'generated_prob': 4.337412246968597e-05, 'sentence': '“When I took office, the state had a $2 billion budget deficit and $400 million in the stabilization fund.', 'perplexity': 0, 'highlight_sentence_for_ai': False}, {'generated_prob': 4.830423495150171e-05, 'sentence': ""I'll be leaving office with $3.2 billion and two reserve accounts and a balanced budget that adequately invests in our most critical priorities,” Gov."", 'perplexity': 0, 'highlight_sentence_for_ai': False}, {'generated_prob': 4.443810394150205e-05, 'sentence': 'Edwards continued.', 'perplexity': 0, 'highlight_sentence_for_ai': False}, {'generated_prob': 3.363980067661032e-05, 'sentence': 'Between all the regular challenges a governor faces, several natural disasters and a pandemic, he certainly had his work cut out for him.', 'perplexity': 0, 'highlight_sentence_for_ai': False}, {'generated_prob': 4.302459637983702e-05, 'sentence': '“There have been over 244 emergencies resulting in more than 50 state disaster declarations and 21 federal disaster declarations over the past eight years,” he said.', 'perplexity': 0, 'highlight_sentence_for_ai': False}, {'generated_prob': 3.521762846503407e-05, 'sentence': ""And although the next governor will take a much different approach on the issues, he sincerely wished Jeff Landry the best, saying at the end of the day, he's a Louisianian and only wants to see our state succeed."", 'perplexity': 0, 'highlight_sentence_for_ai': False}, {'generated_prob': 3.484487024252303e-05, 'sentence': 'He and the first lady say they plan to return to their home in Tangipahoa Parish, where the two will enjoy becoming grandparents.', 'perplexity': 0, 'highlight_sentence_for_ai': False}, {'generated_prob': 3.264932820457034e-05, 'sentence': 'He did not mention any plans of running for office in the future.', 'perplexity': 0, 'highlight_sentence_for_ai': False}, {'generated_prob': 3.855441536870785e-05, 'sentence': ""Although he said he doesn't plan to run for anything else, he also went on to say that he'll never say never."", 'perplexity': 0, 'highlight_sentence_for_ai': False}, {'generated_prob': 5.1575989346019924e-05, 'sentence': 'Click here to report a typo.', 'perplexity': 0, 'highlight_sentence_for_ai': False}, {'generated_prob': 4.73106701974757e-05, 'sentence': 'Copyright 2023 WAFB.', 'perplexity': 0, 'highlight_sentence_for_ai': False}, {'generated_prob': 4.632845593732782e-05, 'sentence': 'All rights reserved.', 'perplexity': 0, 'highlight_sentence_for_ai': False}], 'paragraphs': [{'start_sentence_index': 0, 'num_sentences': 19, 'completely_generated_prob': 7.952272508076387e-17}], 'completely_generated_prob': 0.0032000700015312844, 'class_probabilities': {'human': 0.9967999299984688, 'ai': 0.0032000700015312844, 'mixed': 0}, 'average_generated_prob': 0, 'predicted_class': 'human', 'confidence_score': 0.9967999299984688, 'confidence_category': 'high', 'confidence_scores_raw': {'identity': {'ai': 0.0032000700015312844, 'human': 0.9967999299984688, 'mixed': 0}}, 'confidence_thresholds_raw': {'identity': {'ai': {'reject': 0.65, 'low': 0.75, 'medium': 0.92}, 'human': {'reject': 0.7, 'low': 0.82, 'medium': 0.92}, 'mixed': {'reject': 0.7, 'low': 0.8, 'medium': 0.88}}}, 'overall_burstiness': 0, 'writing_stats': {}, 'subclass': {'ai': {}, 'human': {}, 'mixed': {}}, 'result_message': 'Our detector is highly confident that the text is written entirely by a human.', 'document_classification': 'HUMAN_ONLY', 'version': '2025-01-09-base', 'language': 'en', 'pageNumber': 0, 'inputText': 'BATON ROUGE, La. (WAFB) - Just like that, Governor John Bel Edwards’s eight years in the governor’s mansion is coming to an end. On Monday, Dec. 18, he reflected on everything he’s encountered during his eight years in office. While running through the list of accomplishments his office has achieved, the one he’s most proud of is expanding Medicaid. “Now, more than half a million working Louisianians have access to healthcare who otherwise wouldn’t,” Gov. Edwards said. The governor also noted the large amount of surplus dollars in the state’s bank, comparing how things are now to when he first took office in 2016. “When I took office, the state had a $2 billion budget deficit and $400 million in the stabilization fund. I’ll be leaving office with $3.2 billion and two reserve accounts and a balanced budget that adequately invests in our most critical priorities,” Gov. Edwards continued. Between all the regular challenges a governor faces, several natural disasters and a pandemic, he certainly had his work cut out for him. “There have been over 244 emergencies resulting in more than 50 state disaster declarations and 21 federal disaster declarations over the past eight years,” he said. And although the next governor will take a much different approach on the issues, he sincerely wished Jeff Landry the best, saying at the end of the day, he’s a Louisianian and only wants to see our state succeed. He and the first lady say they plan to return to their home in Tangipahoa Parish, where the two will enjoy becoming grandparents. He did not mention any plans of running for office in the future. Although he said he doesn’t plan to run for anything else, he also went on to say that he’ll never say never. Click here to report a typo. Copyright 2023 WAFB. All rights reserved.'}]"
LA_2023_c6c121f9162cbb18a3deb3a36d3e11eb.html.gz,2025-01-09-base,"[{'sentences': [{'generated_prob': 9.573403076501563e-05, 'sentence': 'The latest breaking updates, delivered straight to your email inbox.', 'perplexity': 0, 'highlight_sentence_for_ai': False}, {'generated_prob': 3.9381156966555864e-05, 'sentence': ""Rupert Murdoch, the 92-year-old media magnate who created Fox News, is stepping down as leader of both Fox's parent company and his News Corp. media holdings."", 'perplexity': 0, 'highlight_sentence_for_ai': False}, {'generated_prob': 3.788947287830524e-05, 'sentence': 'Fox said Thursday that Murdoch would become chairman emeritus of both companies.', 'perplexity': 0, 'highlight_sentence_for_ai': False}, {'generated_prob': 4.250245547154918e-05, 'sentence': 'His son, Lachlan, will become News Corp. chairman and continue as chief executive officer of Fox Corp. Lachlan Murdoch said that “we are grateful that he will serve as chairman emeritus and know he will continue to provide valued counsel to both companies.” Besides Fox News, Murdoch started the Fox broadcast network, the first to successfully challenge the Big Three of ABC, CBS and NBC.', 'perplexity': 0, 'highlight_sentence_for_ai': False}, {'generated_prob': 4.445068771019578e-05, 'sentence': 'He is owner of the Wall Street Journal and the New York Post.', 'perplexity': 0, 'highlight_sentence_for_ai': False}, {'generated_prob': 4.771904059452936e-05, 'sentence': ""Murdoch is a force in the conservative world, where Fox News Channel has profoundly influenced television and the nation's politics since its start in 1996."", 'perplexity': 0, 'highlight_sentence_for_ai': False}, {'generated_prob': 4.040290878037922e-05, 'sentence': 'Murdoch vowed in a letter to employees that he would remain engaged at Fox.', 'perplexity': 0, 'highlight_sentence_for_ai': False}, {'generated_prob': 5.399277142714709e-05, 'sentence': '“In my new role, I can guarantee you that I will be involved every day in the contest of ideas, Murdoch wrote.', 'perplexity': 0, 'highlight_sentence_for_ai': False}, {'generated_prob': 4.04620441258885e-05, 'sentence': '“Our companies are communities, and I will be an active member of our community.', 'perplexity': 0, 'highlight_sentence_for_ai': False}, {'generated_prob': 4.992315371055156e-05, 'sentence': ""I will be watching our broadcasts with a critical eye, reading our newspapers and websites and books with much interest.” There was no immediate word on why Murdoch's announcement came now."", 'perplexity': 0, 'highlight_sentence_for_ai': False}, {'generated_prob': 5.17866101290565e-05, 'sentence': 'Ironically, it is the week author and Murdoch biographer Michael Wolff is publishing a book, “The End of Fox News,” speculating on what will happen to the network when the patriarch is gone.', 'perplexity': 0, 'highlight_sentence_for_ai': False}, {'generated_prob': 0.00029712243122048676, 'sentence': 'Hearst Television participates in various affiliate marketing programs, which means we may get paid commissions on editorially chosen products purchased through our links to retailer sites.', 'perplexity': 0, 'highlight_sentence_for_ai': False}], 'paragraphs': [{'start_sentence_index': 0, 'num_sentences': 12, 'completely_generated_prob': 1.0731758790825431e-10}], 'completely_generated_prob': 0.003212696250244639, 'class_probabilities': {'human': 0.9967873037497554, 'ai': 0.003212696250244639, 'mixed': 0}, 'average_generated_prob': 0, 'predicted_class': 'human', 'confidence_score': 0.9967873037497554, 'confidence_category': 'high', 'confidence_scores_raw': {'identity': {'ai': 0.003212696250244639, 'human': 0.9967873037497554, 'mixed': 0}}, 'confidence_thresholds_raw': {'identity': {'ai': {'reject': 0.65, 'low': 0.75, 'medium': 0.92}, 'human': {'reject': 0.7, 'low': 0.82, 'medium': 0.92}, 'mixed': {'reject': 0.7, 'low': 0.8, 'medium': 0.88}}}, 'overall_burstiness': 0, 'writing_stats': {}, 'subclass': {'ai': {}, 'human': {}, 'mixed': {}}, 'result_message': 'Our detector is highly confident that the text is written entirely by a human.', 'document_classification': 'HUMAN_ONLY', 'version': '2025-01-09-base', 'language': 'en', 'pageNumber': 0, 'inputText': ""The latest breaking updates, delivered straight to your email inbox. Rupert Murdoch, the 92-year-old media magnate who created Fox News, is stepping down as leader of both Fox's parent company and his News Corp. media holdings. Fox said Thursday that Murdoch would become chairman emeritus of both companies. His son, Lachlan, will become News Corp. chairman and continue as chief executive officer of Fox Corp. Lachlan Murdoch said that “we are grateful that he will serve as chairman emeritus and know he will continue to provide valued counsel to both companies.” Besides Fox News, Murdoch started the Fox broadcast network, the first to successfully challenge the Big Three of ABC, CBS and NBC. He is owner of the Wall Street Journal and the New York Post. Murdoch is a force in the conservative world, where Fox News Channel has profoundly influenced television and the nation's politics since its start in 1996. Murdoch vowed in a letter to employees that he would remain engaged at Fox. “In my new role, I can guarantee you that I will be involved every day in the contest of ideas, Murdoch wrote. “Our companies are communities, and I will be an active member of our community. I will be watching our broadcasts with a critical eye, reading our newspapers and websites and books with much interest.” There was no immediate word on why Murdoch's announcement came now. Ironically, it is the week author and Murdoch biographer Michael Wolff is publishing a book, “The End of Fox News,” speculating on what will happen to the network when the patriarch is gone. Hearst Television participates in various affiliate marketing programs, which means we may get paid commissions on editorially chosen products purchased through our links to retailer sites.""}]"
