File,version,documents
MA_2023_01c8ff2398d3c98b5512ba6d967ff817.html.gz,2025-01-09-base,"[{'sentences': [{'generated_prob': 0.03602158650755882, 'sentence': ""Island prepped for president's arrival Biden not the only president to visit Nantucket Javascript is required for you to be able to read premium content."", 'perplexity': 0, 'highlight_sentence_for_ai': False}, {'generated_prob': 0.03667471930384636, 'sentence': 'Please enable it in your browser settings.', 'perplexity': 0, 'highlight_sentence_for_ai': False}, {'generated_prob': 0.07525182515382767, 'sentence': 'Log In Keep it Clean.', 'perplexity': 0, 'highlight_sentence_for_ai': False}, {'generated_prob': 0.039842329919338226, 'sentence': 'Please avoid obscene, vulgar, lewd, racist or sexually-oriented language.', 'perplexity': 0, 'highlight_sentence_for_ai': False}, {'generated_prob': 0.029576493427157402, 'sentence': 'PLEASE TURN OFF YOUR CAPS LOCK.', 'perplexity': 0, 'highlight_sentence_for_ai': False}, {'generated_prob': 0.04809945449233055, 'sentence': ""Don't Threaten."", 'perplexity': 0, 'highlight_sentence_for_ai': False}, {'generated_prob': 0.0185658298432827, 'sentence': 'Threats of harming another person will not be tolerated.', 'perplexity': 0, 'highlight_sentence_for_ai': False}, {'generated_prob': 0.0324830524623394, 'sentence': 'Be Truthful.', 'perplexity': 0, 'highlight_sentence_for_ai': False}, {'generated_prob': 0.02676645666360855, 'sentence': ""Don't knowingly lie about anyone or anything."", 'perplexity': 0, 'highlight_sentence_for_ai': False}, {'generated_prob': 0.017080390825867653, 'sentence': 'Be Nice.', 'perplexity': 0, 'highlight_sentence_for_ai': False}, {'generated_prob': 0.03405142202973366, 'sentence': 'No racism, sexism or any sort of -ism that is degrading to another person.', 'perplexity': 0, 'highlight_sentence_for_ai': False}, {'generated_prob': 0.0500328466296196, 'sentence': 'Be Proactive.', 'perplexity': 0, 'highlight_sentence_for_ai': False}, {'generated_prob': 0.048393335193395615, 'sentence': ""Use the 'Report' link on each comment to let us know of abusive posts."", 'perplexity': 0, 'highlight_sentence_for_ai': False}, {'generated_prob': 0.04214693605899811, 'sentence': 'Share with Us.', 'perplexity': 0, 'highlight_sentence_for_ai': False}, {'generated_prob': 0.05642898008227348, 'sentence': ""We'd love to hear eyewitness accounts, the history behind an article."", 'perplexity': 0, 'highlight_sentence_for_ai': False}, {'generated_prob': 0.09219574928283691, 'sentence': ""Your browser is out of date and potentially vulnerable to security risks.We recommend switching to one of the following browsers: Account processing issue - the email address may already exist Have the latest local news delivered every morning so you don't miss out on updates."", 'perplexity': 0, 'highlight_sentence_for_ai': False}, {'generated_prob': 0.13746099174022675, 'sentence': 'Receive our newspaper electronically with the e-Edition email.', 'perplexity': 0, 'highlight_sentence_for_ai': False}, {'generated_prob': 0.12511053681373596, 'sentence': 'Get the latest headlines on local sports!', 'perplexity': 0, 'highlight_sentence_for_ai': False}, {'generated_prob': 0.06522591412067413, 'sentence': 'Thank you.', 'perplexity': 0, 'highlight_sentence_for_ai': False}, {'generated_prob': 0.10097636282444, 'sentence': 'Your account has been registered, and you are now logged in.', 'perplexity': 0, 'highlight_sentence_for_ai': False}, {'generated_prob': 0.14208830893039703, 'sentence': 'Check your email for details.', 'perplexity': 0, 'highlight_sentence_for_ai': False}, {'generated_prob': 0.12356892228126526, 'sentence': 'Invalid password or account does not exist Submitting this form below will send a message to your email with a link to change your password.', 'perplexity': 0, 'highlight_sentence_for_ai': False}, {'generated_prob': 0.09468859434127808, 'sentence': 'An email message containing instructions on how to reset your password has been sent to the email address listed on your account.', 'perplexity': 0, 'highlight_sentence_for_ai': False}, {'generated_prob': 0.1151716485619545, 'sentence': 'No promotional rates found.', 'perplexity': 0, 'highlight_sentence_for_ai': False}, {'generated_prob': 0.07316328585147858, 'sentence': 'Secure & Encrypted Secure transaction.', 'perplexity': 0, 'highlight_sentence_for_ai': False}, {'generated_prob': 0.08185715973377228, 'sentence': 'Secure transaction.', 'perplexity': 0, 'highlight_sentence_for_ai': False}, {'generated_prob': 0.09119759500026703, 'sentence': 'Cancel anytime.', 'perplexity': 0, 'highlight_sentence_for_ai': False}, {'generated_prob': 0.07149653881788254, 'sentence': 'Thank you.', 'perplexity': 0, 'highlight_sentence_for_ai': False}, {'generated_prob': 0.08164890855550766, 'sentence': 'Your gift purchase was successful!', 'perplexity': 0, 'highlight_sentence_for_ai': False}, {'generated_prob': 0.09760934859514236, 'sentence': 'Your purchase was successful, and you are now logged in.', 'perplexity': 0, 'highlight_sentence_for_ai': False}, {'generated_prob': 0.11415332555770874, 'sentence': 'A receipt was sent to your email.', 'perplexity': 0, 'highlight_sentence_for_ai': False}], 'paragraphs': [{'start_sentence_index': 0, 'num_sentences': 31, 'completely_generated_prob': 1.863374990750522e-27}], 'completely_generated_prob': 0.037515521221829135, 'class_probabilities': {'human': 0.9622006644706045, 'ai': 0.037515521221829135, 'mixed': 0.00028381430756647936}, 'average_generated_prob': 0, 'predicted_class': 'human', 'confidence_score': 0.9622006644706045, 'confidence_category': 'high', 'confidence_scores_raw': {'identity': {'ai': 0.037515521221829135, 'human': 0.9622006644706045, 'mixed': 0.00028381430756647936}}, 'confidence_thresholds_raw': {'identity': {'ai': {'reject': 0.65, 'low': 0.75, 'medium': 0.92}, 'human': {'reject': 0.7, 'low': 0.82, 'medium': 0.92}, 'mixed': {'reject': 0.7, 'low': 0.8, 'medium': 0.88}}}, 'overall_burstiness': 0, 'writing_stats': {}, 'subclass': {'ai': {}, 'human': {}, 'mixed': {}}, 'result_message': 'Our detector is highly confident that the text is written entirely by a human.', 'document_classification': 'HUMAN_ONLY', 'version': '2025-01-09-base', 'language': 'en', 'pageNumber': 0, 'inputText': ""Island prepped for president's arrival Biden not the only president to visit Nantucket Javascript is required for you to be able to read premium content. Please enable it in your browser settings. Log In Keep it Clean. Please avoid obscene, vulgar, lewd, racist or sexually-oriented language. PLEASE TURN OFF YOUR CAPS LOCK. Don't Threaten. Threats of harming another person will not be tolerated. Be Truthful. Don't knowingly lie about anyone or anything. Be Nice. No racism, sexism or any sort of -ism that is degrading to another person. Be Proactive. Use the 'Report' link on each comment to let us know of abusive posts. Share with Us. We'd love to hear eyewitness accounts, the history behind an article. Your browser is out of date and potentially vulnerable to security risks.We recommend switching to one of the following browsers: Account processing issue - the email address may already exist Have the latest local news delivered every morning so you don't miss out on updates. Receive our newspaper electronically with the e-Edition email. Get the latest headlines on local sports! Thank you . Your account has been registered, and you are now logged in. Check your email for details. Invalid password or account does not exist Submitting this form below will send a message to your email with a link to change your password. An email message containing instructions on how to reset your password has been sent to the email address listed on your account. No promotional rates found. Secure & Encrypted Secure transaction. Secure transaction. Cancel anytime. Thank you. Your gift purchase was successful! Your purchase was successful, and you are now logged in. A receipt was sent to your email.""}]"
MA_2023_051209be8cc6207df612090e57e9eb45.html.gz,2025-01-09-base,"[{'sentences': [{'generated_prob': 0.0002841383684426546, 'sentence': 'Q. I submitted an application to USCIS almost a year ago, and I am about to move to a new address.', 'perplexity': 0, 'highlight_sentence_for_ai': False}, {'generated_prob': 0.0005634123226627707, 'sentence': 'How can I let the agency know?', 'perplexity': 0, 'highlight_sentence_for_ai': False}, {'generated_prob': 0.0005333889275789261, 'sentence': 'Is setting up mail forwarding with USPS enough?', 'perplexity': 0, 'highlight_sentence_for_ai': False}, {'generated_prob': 0.0007824177737347782, 'sentence': 'A.', 'perplexity': 0, 'highlight_sentence_for_ai': False}, {'generated_prob': 0.00019795338448602706, 'sentence': 'Until you become a US citizen, whenever you move, you have an obligation to notify USCIS within ten days of your move that you have a new address.', 'perplexity': 0, 'highlight_sentence_for_ai': False}, {'generated_prob': 0.00021619843028020114, 'sentence': 'You cannot expect that filing a change of address notice with USPS will ensure that USCIS correspondence will arrive at your new place of residence because security concerns will prevent USPS from forwarding most government correspondence.', 'perplexity': 0, 'highlight_sentence_for_ai': False}, {'generated_prob': 0.00025302544236183167, 'sentence': 'Failure to respond to USCIS deadlines, failure to attend interviews or appointments, or mail returned to USCIS as undeliverable can all lead to a USCIS determination that you abandoned your application, resulting in a denial.', 'perplexity': 0, 'highlight_sentence_for_ai': False}, {'generated_prob': 0.0002423894329695031, 'sentence': ""USCIS offers three ways to change an address: mail a paper form to the agency, submit the form on USCIS' website, or update your USCIS online account."", 'perplexity': 0, 'highlight_sentence_for_ai': False}, {'generated_prob': 0.000340120168402791, 'sentence': 'This third option only exists for individuals who submitted their application online.', 'perplexity': 0, 'highlight_sentence_for_ai': False}, {'generated_prob': 0.00020603250595740974, 'sentence': 'If you did not, then you will want to visit uscis.gov/ar-11.', 'perplexity': 0, 'highlight_sentence_for_ai': False}, {'generated_prob': 0.00028178011416457593, 'sentence': 'Since you have a pending application, you must inform USCIS directly of the address change so that the officer(s) processing the case can mail future notices to the correct address.', 'perplexity': 0, 'highlight_sentence_for_ai': False}, {'generated_prob': 0.00021172048582229763, 'sentence': 'On the USCIS webpage, you will see the option to file online and the option to mail the paper form.', 'perplexity': 0, 'highlight_sentence_for_ai': False}, {'generated_prob': 0.00021414564980659634, 'sentence': ""Should you choose to mail the physical form to USCIS, you'll need to print out Form AR-11, complete it, and mail it to the provided address."", 'perplexity': 0, 'highlight_sentence_for_ai': False}, {'generated_prob': 0.00017331981507595628, 'sentence': 'If you are a victim of domestic violence, trafficking, or other crime, or if you previously filed a Form I-751 abuse waiver, you are required to mail the form to protect your privacy, and you will need to look up the specific address for where to mail your AR-11.', 'perplexity': 0, 'highlight_sentence_for_ai': False}, {'generated_prob': 0.00023061745741870254, 'sentence': ""If you are able to and choose to file online, and you currently have a pending application, then you will need to input additional details, e.g., the case's receipt number, the applicant's or petitioner's biographic information, etc."", 'perplexity': 0, 'highlight_sentence_for_ai': False}, {'generated_prob': 0.00019783973402809352, 'sentence': 'If you do not have a pending case, then you will only input information about yourself and your addresses.', 'perplexity': 0, 'highlight_sentence_for_ai': False}, {'generated_prob': 0.00033677852479740977, 'sentence': 'You do not need to pay any filing fee when submitting the change of address form to USCIS.', 'perplexity': 0, 'highlight_sentence_for_ai': False}, {'generated_prob': 0.00043972444836981595, 'sentence': 'We strongly suggest that you make an effort to keep proof of your address change.', 'perplexity': 0, 'highlight_sentence_for_ai': False}, {'generated_prob': 0.05125749111175537, 'sentence': 'If you file by mail, then you should keep a copy of the AR-11 and pay extra to ensure you can track the envelope you send to USCIS to prove that it was indeed delivered.', 'perplexity': 0, 'highlight_sentence_for_ai': False}, {'generated_prob': 0.04091249778866768, 'sentence': 'If you file online, then you will receive an email from USCIS with the confirmation number and details about your form submission.', 'perplexity': 0, 'highlight_sentence_for_ai': False}, {'generated_prob': 0.056308165192604065, 'sentence': 'You should print out that page or save it somewhere on your computer or phone where you will be able to access it in the future.', 'perplexity': 0, 'highlight_sentence_for_ai': False}, {'generated_prob': 0.04336543753743172, 'sentence': ""If your pending case requires a financial sponsor to submit an affidavit of support (Form I-864) or you have submitted an affidavit of support for a friend's or family member's application, then the sponsor is obligated to notify USCIS when the sponsor moves."", 'perplexity': 0, 'highlight_sentence_for_ai': False}, {'generated_prob': 0.0323420912027359, 'sentence': 'In this circumstance, however, a different form must be sent: Form I-865.', 'perplexity': 0, 'highlight_sentence_for_ai': False}, {'generated_prob': 0.04664628207683563, 'sentence': 'No fee is required.', 'perplexity': 0, 'highlight_sentence_for_ai': False}, {'generated_prob': 0.06141030043363571, 'sentence': 'Disclaimer: These articles are published to inform the general public, not to advise in individual cases.', 'perplexity': 0, 'highlight_sentence_for_ai': False}, {'generated_prob': 0.048529233783483505, 'sentence': 'All law, including immigration law, is always subject to change.', 'perplexity': 0, 'highlight_sentence_for_ai': False}, {'generated_prob': 0.034930385649204254, 'sentence': ""If you seek legal advice you can contact Rian's immigration legal staff at 617-984-6542."", 'perplexity': 0, 'highlight_sentence_for_ai': False}, {'generated_prob': 0.06968549638986588, 'sentence': 'In Print - Get the next four editions of the Boston Irish Magazine by USPS 1st Class Mail directly to your home Order online.', 'perplexity': 0, 'highlight_sentence_for_ai': False}], 'paragraphs': [{'start_sentence_index': 0, 'num_sentences': 28, 'completely_generated_prob': 8.637890762238192e-25}], 'completely_generated_prob': 0.025041194076269924, 'class_probabilities': {'human': 0.974671313226954, 'ai': 0.025041194076269924, 'mixed': 0.00028749269677611}, 'average_generated_prob': 0, 'predicted_class': 'human', 'confidence_score': 0.974671313226954, 'confidence_category': 'high', 'confidence_scores_raw': {'identity': {'ai': 0.025041194076269924, 'human': 0.974671313226954, 'mixed': 0.00028749269677611}}, 'confidence_thresholds_raw': {'identity': {'ai': {'reject': 0.65, 'low': 0.75, 'medium': 0.92}, 'human': {'reject': 0.7, 'low': 0.82, 'medium': 0.92}, 'mixed': {'reject': 0.7, 'low': 0.8, 'medium': 0.88}}}, 'overall_burstiness': 0, 'writing_stats': {}, 'subclass': {'ai': {}, 'human': {}, 'mixed': {}}, 'result_message': 'Our detector is highly confident that the text is written entirely by a human.', 'document_classification': 'HUMAN_ONLY', 'version': '2025-01-09-base', 'language': 'en', 'pageNumber': 0, 'inputText': 'Q. I submitted an application to USCIS almost a year ago, and I am about to move to a new address. How can I let the agency know? Is setting up mail forwarding with USPS enough? A. Until you become a US citizen, whenever you move, you have an obligation to notify USCIS within ten days of your move that you have a new address. You cannot expect that filing a change of address notice with USPS will ensure that USCIS correspondence will arrive at your new place of residence because security concerns will prevent USPS from forwarding most government correspondence. Failure to respond to USCIS deadlines, failure to attend interviews or appointments, or mail returned to USCIS as undeliverable can all lead to a USCIS determination that you abandoned your application, resulting in a denial. USCIS offers three ways to change an address: mail a paper form to the agency, submit the form on USCIS’ website, or update your USCIS online account. This third option only exists for individuals who submitted their application online. If you did not, then you will want to visit uscis.gov/ar-11. Since you have a pending application, you must inform USCIS directly of the address change so that the officer(s) processing the case can mail future notices to the correct address. On the USCIS webpage, you will see the option to file online and the option to mail the paper form. Should you choose to mail the physical form to USCIS, you’ll need to print out Form AR-11, complete it, and mail it to the provided address. If you are a victim of domestic violence, trafficking, or other crime, or if you previously filed a Form I-751 abuse waiver, you are required to mail the form to protect your privacy, and you will need to look up the specific address for where to mail your AR-11. If you are able to and choose to file online, and you currently have a pending application, then you will need to input additional details, e.g., the case’s receipt number, the applicant’s or petitioner’s biographic information, etc. If you do not have a pending case, then you will only input information about yourself and your addresses. You do not need to pay any filing fee when submitting the change of address form to USCIS. We strongly suggest that you make an effort to keep proof of your address change. If you file by mail, then you should keep a copy of the AR-11 and pay extra to ensure you can track the envelope you send to USCIS to prove that it was indeed delivered. If you file online, then you will receive an email from USCIS with the confirmation number and details about your form submission. You should print out that page or save it somewhere on your computer or phone where you will be able to access it in the future. If your pending case requires a financial sponsor to submit an affidavit of support (Form I-864) or you have submitted an affidavit of support for a friend’s or family member’s application, then the sponsor is obligated to notify USCIS when the sponsor moves. In this circumstance, however, a different form must be sent: Form I-865. No fee is required. Disclaimer: These articles are published to inform the general public, not to advise in individual cases. All law, including immigration law, is always subject to change. If you seek legal advice you can contact Rian’s immigration legal staff at 617-984-6542. In Print - Get the next four editions of the Boston Irish Magazine by USPS 1st Class Mail directly to your home Order online.'}]"
