File,version,documents
OH_2020_218336bfcb3a34198738f9e55caede75.html.gz,2025-01-09-base,"[{'sentences': [{'generated_prob': 4.394941424834542e-05, 'sentence': 'NBC4 WCMH-TV Please enter a search term.', 'perplexity': 0, 'highlight_sentence_for_ai': False}, {'generated_prob': 4.519396316027269e-05, 'sentence': 'Please enter a search term.', 'perplexity': 0, 'highlight_sentence_for_ai': False}, {'generated_prob': 3.487407957436517e-05, 'sentence': 'Kerry Charles is a weeknight anchor for NBC4.', 'perplexity': 0, 'highlight_sentence_for_ai': False}, {'generated_prob': 2.9845177778042853e-05, 'sentence': 'He joined the station after working as an anchor/reporter in Atlanta.', 'perplexity': 0, 'highlight_sentence_for_ai': False}, {'generated_prob': 4.027704562759027e-05, 'sentence': 'Before that, he spent seven years as a morning news anchor in Greensboro, North Carolina.', 'perplexity': 0, 'highlight_sentence_for_ai': False}, {'generated_prob': 4.131256719119847e-05, 'sentence': 'Kerry began his on-air career in Shreveport, Louisiana.', 'perplexity': 0, 'highlight_sentence_for_ai': False}, {'generated_prob': 5.4935182561166584e-05, 'sentence': 'Additionally, Kerry worked as a newscast producer at stations in Columbus and Cincinnati.', 'perplexity': 0, 'highlight_sentence_for_ai': False}, {'generated_prob': 5.782125663245097e-05, 'sentence': 'Central Ohio is home for Kerry.', 'perplexity': 0, 'highlight_sentence_for_ai': False}, {'generated_prob': 6.161813507787883e-05, 'sentence': 'He attended Columbus City Schools and graduated from Linden-McKinley High School.', 'perplexity': 0, 'highlight_sentence_for_ai': False}, {'generated_prob': 6.182371726026759e-05, 'sentence': 'Kerry studied communication at the University of Cincinnati.', 'perplexity': 0, 'highlight_sentence_for_ai': False}, {'generated_prob': 6.948583177290857e-05, 'sentence': ""Kerry's interest in broadcasting started at an early age."", 'perplexity': 0, 'highlight_sentence_for_ai': False}, {'generated_prob': 5.628083090414293e-05, 'sentence': 'While attending Crestview Middle School, he became a host for Kids Sundae.', 'perplexity': 0, 'highlight_sentence_for_ai': False}, {'generated_prob': 6.177756586112082e-05, 'sentence': 'The weekly radio program aired on WCBE 90.5FM.', 'perplexity': 0, 'highlight_sentence_for_ai': False}, {'generated_prob': 5.5845986935310066e-05, 'sentence': 'He was also a young anchor and reporter for the Kids News Network, the weekly television program that aired on Saturday mornings.', 'perplexity': 0, 'highlight_sentence_for_ai': False}, {'generated_prob': 6.781552656320855e-05, 'sentence': 'Since joining NBC4, Kerry has worked on projects that have been recognized by the Associated Press, the National Association of Black Journalists (NABJ), and the National Academy of Television Arts & Sciences (Emmy).', 'perplexity': 0, 'highlight_sentence_for_ai': False}, {'generated_prob': 5.959916961728595e-05, 'sentence': 'In his years away from home, Kerry covered all sorts of stories.', 'perplexity': 0, 'highlight_sentence_for_ai': False}, {'generated_prob': 8.594368409831077e-05, 'sentence': 'He followed two viewers to the Bahamas to check on their families and childhood homes following Hurricane Dorian.', 'perplexity': 0, 'highlight_sentence_for_ai': False}, {'generated_prob': 8.157960837706923e-05, 'sentence': 'He covered a presidential debate and three national political conventions.', 'perplexity': 0, 'highlight_sentence_for_ai': False}, {'generated_prob': 0.0005792446900159121, 'sentence': 'Kerry anchored special coverage on the scene of the Charleston church shootings, the 50th anniversary of the March on Washington for Jobs & Freedom, and Super Bowl LIII.', 'perplexity': 0, 'highlight_sentence_for_ai': False}, {'generated_prob': 0.0005541969439946115, 'sentence': 'During the grand opening of Tyler Perry Studios in Atlanta, he interviewed several entertainment icons.', 'perplexity': 0, 'highlight_sentence_for_ai': False}, {'generated_prob': 0.00099509849678725, 'sentence': 'Kerry believes in giving back to the community.', 'perplexity': 0, 'highlight_sentence_for_ai': False}, {'generated_prob': 0.0007373049738816917, 'sentence': 'He helps organize and execute an annual Thanksgiving dinner giveaway, which has fed countless central Ohio families.', 'perplexity': 0, 'highlight_sentence_for_ai': False}, {'generated_prob': 0.001120556378737092, 'sentence': ""Kerry is a Board of Trustee for St. Stephen's Community House, a member of the Fort Hayes High School Film/TV Advisory Committee and engages in service projects through memberships with Phi Beta Sigma and NABJ."", 'perplexity': 0, 'highlight_sentence_for_ai': False}, {'generated_prob': 0.0006359396502375603, 'sentence': 'During his time in North Carolina, he helped launch an ongoing effort that gives kids free haircuts, lunches, grooming lessons, and access to financial literacy workshops.', 'perplexity': 0, 'highlight_sentence_for_ai': False}, {'generated_prob': 0.0007949318969622254, 'sentence': 'For his work in the community, Kerry received the 2023 Pillar of the Community Award from the UC African American Alumni Affiliate.', 'perplexity': 0, 'highlight_sentence_for_ai': False}, {'generated_prob': 0.0007244116859510541, 'sentence': 'In 2018, Kerry was inducted into the Morehouse College MLK College of Ministers and Laity.', 'perplexity': 0, 'highlight_sentence_for_ai': False}, {'generated_prob': 0.0006116930162534118, 'sentence': 'The honorary college honors professionals who, in part, use their platform to better the lives of others.', 'perplexity': 0, 'highlight_sentence_for_ai': False}, {'generated_prob': 0.00038288094219751656, 'sentence': 'He was also named a UC Communication Alumni Champion (2014).', 'perplexity': 0, 'highlight_sentence_for_ai': False}, {'generated_prob': 0.0007091364241205156, 'sentence': 'You can watch Kerry weeknights on NBC4 at 6, 7 & 11.', 'perplexity': 0, 'highlight_sentence_for_ai': False}], 'paragraphs': [{'start_sentence_index': 0, 'num_sentences': 29, 'completely_generated_prob': 1.1173676947417224e-25}], 'completely_generated_prob': 0.005203089766913354, 'class_probabilities': {'human': 0.9947969102330866, 'ai': 0.005203089766913354, 'mixed': 0}, 'average_generated_prob': 0, 'predicted_class': 'human', 'confidence_score': 0.9947969102330866, 'confidence_category': 'high', 'confidence_scores_raw': {'identity': {'ai': 0.005203089766913354, 'human': 0.9947969102330866, 'mixed': 0}}, 'confidence_thresholds_raw': {'identity': {'ai': {'reject': 0.65, 'low': 0.75, 'medium': 0.92}, 'human': {'reject': 0.7, 'low': 0.82, 'medium': 0.92}, 'mixed': {'reject': 0.7, 'low': 0.8, 'medium': 0.88}}}, 'overall_burstiness': 0, 'writing_stats': {}, 'subclass': {'ai': {}, 'human': {}, 'mixed': {}}, 'result_message': 'Our detector is highly confident that the text is written entirely by a human.', 'document_classification': 'HUMAN_ONLY', 'version': '2025-01-09-base', 'language': 'en', 'pageNumber': 0, 'inputText': 'NBC4 WCMH-TV Please enter a search term. Please enter a search term. Kerry Charles is a weeknight anchor for NBC4. He joined the station after working as an anchor/reporter in Atlanta. Before that, he spent seven years as a morning news anchor in Greensboro, North Carolina. Kerry began his on-air career in Shreveport, Louisiana. Additionally, Kerry worked as a newscast producer at stations in Columbus and Cincinnati. Central Ohio is home for Kerry. He attended Columbus City Schools and graduated from Linden-McKinley High School. Kerry studied communication at the University of Cincinnati. Kerry’s interest in broadcasting started at an early age. While attending Crestview Middle School, he became a host for Kids Sundae. The weekly radio program aired on WCBE 90.5FM. He was also a young anchor and reporter for the Kids News Network, the weekly television program that aired on Saturday mornings. Since joining NBC4, Kerry has worked on projects that have been recognized by the Associated Press, the National Association of Black Journalists (NABJ), and the National Academy of Television Arts & Sciences (Emmy). In his years away from home, Kerry covered all sorts of stories. He followed two viewers to the Bahamas to check on their families and childhood homes following Hurricane Dorian. He covered a presidential debate and three national political conventions. Kerry anchored special coverage on the scene of the Charleston church shootings, the 50th anniversary of the March on Washington for Jobs & Freedom, and Super Bowl LIII. During the grand opening of Tyler Perry Studios in Atlanta, he interviewed several entertainment icons. Kerry believes in giving back to the community. He helps organize and execute an annual Thanksgiving dinner giveaway, which has fed countless central Ohio families. Kerry is a Board of Trustee for St. Stephen’s Community House, a member of the Fort Hayes High School Film/TV Advisory Committee and engages in service projects through memberships with Phi Beta Sigma and NABJ. During his time in North Carolina, he helped launch an ongoing effort that gives kids free haircuts, lunches, grooming lessons, and access to financial literacy workshops. For his work in the community, Kerry received the 2023 Pillar of the Community Award from the UC African American Alumni Affiliate. In 2018, Kerry was inducted into the Morehouse College MLK College of Ministers and Laity. The honorary college honors professionals who, in part, use their platform to better the lives of others. He was also named a UC Communication Alumni Champion (2014). You can watch Kerry weeknights on NBC4 at 6, 7 & 11.'}]"
OH_2020_501a96c347cd38d4fbd9601628380667.html.gz,2025-01-09-base,"[{'sentences': [{'generated_prob': 0.00024260295322164893, 'sentence': ""Menu Heavy snow, blizzard conditions marked Northern Ohio's Valentine's Day of 2007."", 'perplexity': 0, 'highlight_sentence_for_ai': False}, {'generated_prob': 0.00019241112750023603, 'sentence': ""The snow began on the morning of the Feb. 13 and finally let up during the morning of Valentine's Day."", 'perplexity': 0, 'highlight_sentence_for_ai': False}, {'generated_prob': 0.00022630102466791868, 'sentence': 'Snow totals approaching two feet were common along and east of Interstate 71 from Cleveland to Mansfield.', 'perplexity': 0, 'highlight_sentence_for_ai': False}, {'generated_prob': 0.0002140118449460715, 'sentence': 'Snow fall ranged from 12 inches near Toledo to a swath of 17 inch and greater amounts from Mansfield up through Medina to Richfield.', 'perplexity': 0, 'highlight_sentence_for_ai': False}, {'generated_prob': 0.0002342715160921216, 'sentence': 'Temperatures were in the 20s while the snow was falling, but in the nights following the snow, temperatures dipped into the single digits.', 'perplexity': 0, 'highlight_sentence_for_ai': False}, {'generated_prob': 0.00026433635503053665, 'sentence': 'On the 15th, Cleveland Hopkins Airport dipped to -4 degrees F. Wind gusts of 30-35 mph were also common, blowing the newly fallen snow around.', 'perplexity': 0, 'highlight_sentence_for_ai': False}, {'generated_prob': 0.0004451773129403591, 'sentence': 'Low pressure, often labeled as a panhandle hook from its origin near the panhandles of Oklahoma and Texas, developed moving into the Mississippi River valley and into the central Appalachians.', 'perplexity': 0, 'highlight_sentence_for_ai': False}, {'generated_prob': 0.0002814275212585926, 'sentence': 'This placed Ohio in a favorable position for widespread heavy snows.', 'perplexity': 0, 'highlight_sentence_for_ai': False}, {'generated_prob': 0.003906301222741604, 'sentence': 'SNOW TOTALS from the February 13-14, 2007 Snow Storm: PUBLIC INFORMATION STATEMENT SPOTTER REPORTSNATIONAL WEATHER SERVICE CLEVELAND OHas of 1225 PM EST THU FEB 15 2007 ********************STORM TOTAL SNOWFALL******************** OHIO...ASHTABULA COUNTY... SAYBROOK 22.1"" as of 11:43 AM 2/15 ASHTABULA 13.4"" as of 11:32 AM 2/15 ASHTABULA 1SW 11.5"" as of 11:38 AM 2/15...CRAWFORD COUNTY... GALION 18.5"" as of 10:13 AM 2/15 BUCYRUS 15.0"" as of 7:20 PM 2/14...CUYAHOGA COUNTY... PEPPER PIKE 23.5"" as of 11:40 AM 2/15 LYNDHURST 17.5"" as of 11:42 AM 2/15 CLEVELAND HEIGHTS 12.8"" as of 11:42 AM 2/15 GARFIELD HTS 11.5"" as of 9:44 AM 2/15 LAKEWOOD 11.5"" as of 7:21 PM 2/14...GEAUGA COUNTY... CHARDON 12.5"" as of 11:41 AM 2/15 THOMPSON 3S 11.5"" as of 11:49 AM 2/15...HOLMES COUNTY... FRYBURG 9.6 1150 AM 2/15...HURON COUNTY... NORWALK 10.5 1139 AM 2/15...LAKE COUNTY... MENTOR 1S LK 12.0 1144 AM 2/15...LORAIN COUNTY... CAMDEN-TWP 12.6 834 PM 2/14 SHEFFIELD LAKE 12.0 1100 AM 2/14 N RIDGEVILLE 10.1 905 PM 2/14 OBERLIN 10.0 1100 AM 2/14...LUCAS COUNTY... TOLEDO 14.8 1100 AM 2/14 SYLVANIA TWP 10.1 1146 AM 2/15 MAUMEE 9.5 1100 AM 2/14 TOLEDO AIRPORT 8.9 1100 AM 2/14 TOLEDO-PT PLACE 8.0 1100 AM 2/14...MAHONING COUNTY... BOARDMAN SE 8.0 1147 AM 2/15...MARION COUNTY... MARION 9.4 1100 AM 2/14...MEDINA COUNTY... BRUNSWICK 13.6 1148 AM 2/15 HINCKLEY 12.2 1106 AM 2/15 CHIPPEWA LK 10.0 1100 AM 2/14...PORTAGE COUNTY... MANTUA 15.5 1136 AM 2/15 HIRAM RAPIDS 15.1 1139 AM 2/15 RAVENNA 1E 15.0 1147 AM 2/15 HIRAM 12.0 1139 AM 2/15 AURORA 10.7 1150 AM 2/15...SANDUSKY COUNTY... CLYDE 10.5 1100 AM 2/14 FREMONT 9.8 1100 AM 2/14 OAK HARBOR 5S 8.5 1100 AM 2/14...SUMMIT COUNTY... RICHFIELD 18.1 837 PM 2/14 MUNROE FALLS 15.5 730 PM 2/14 TALLMADGE 2NE 14.3 1137 AM 2/15 TWINSBURG 12.0 1137 AM 2/15 TALLMADGE 11.7 1138 AM 2/15...TRUMBULL COUNTY... NEWTON FALLS 12.0 1152 AM 2/15...WAYNE COUNTY... DOYLESTOWN 14.3 1149 AM 2/15 WOOSTER 7N 13.4 1149 AM 2/15 DALTON 10.5 1100 AM 2/14 KIDRON 1N 7.0 1141 AM 2/15', 'perplexity': 0, 'highlight_sentence_for_ai': False}], 'paragraphs': [{'start_sentence_index': 0, 'num_sentences': 9, 'completely_generated_prob': 4.1887248735431006e-08}], 'completely_generated_prob': 0.02065958899652478, 'class_probabilities': {'human': 0.979301577189572, 'ai': 0.02065958899652478, 'mixed': 3.883381390324206e-05}, 'average_generated_prob': 0, 'predicted_class': 'human', 'confidence_score': 0.979301577189572, 'confidence_category': 'high', 'confidence_scores_raw': {'identity': {'ai': 0.02065958899652478, 'human': 0.979301577189572, 'mixed': 3.883381390324206e-05}}, 'confidence_thresholds_raw': {'identity': {'ai': {'reject': 0.65, 'low': 0.75, 'medium': 0.92}, 'human': {'reject': 0.7, 'low': 0.82, 'medium': 0.92}, 'mixed': {'reject': 0.7, 'low': 0.8, 'medium': 0.88}}}, 'overall_burstiness': 0, 'writing_stats': {}, 'subclass': {'ai': {}, 'human': {}, 'mixed': {}}, 'result_message': 'Our detector is highly confident that the text is written entirely by a human.', 'document_classification': 'HUMAN_ONLY', 'version': '2025-01-09-base', 'language': 'en', 'pageNumber': 0, 'inputText': 'Menu Heavy snow, blizzard conditions marked Northern Ohio\'s Valentine\'s Day of 2007. The snow began on the morning of the Feb. 13 and finally let up during the morning of Valentine\'s Day. Snow totals approaching two feet were common along and east of Interstate 71 from Cleveland to Mansfield. Snow fall ranged from 12 inches near Toledo to a swath of 17 inch and greater amounts from Mansfield up through Medina to Richfield. Temperatures were in the 20s while the snow was falling, but in the nights following the snow, temperatures dipped into the single digits. On the 15th, Cleveland Hopkins Airport dipped to -4 degrees F. Wind gusts of 30-35 mph were also common, blowing the newly fallen snow around. Low pressure, often labeled as a panhandle hook from its origin near the panhandles of Oklahoma and Texas, developed moving into the Mississippi River valley and into the central Appalachians. This placed Ohio in a favorable position for widespread heavy snows. SNOW TOTALS from the February 13-14, 2007 Snow Storm: PUBLIC INFORMATION STATEMENT SPOTTER REPORTSNATIONAL WEATHER SERVICE CLEVELAND OHas of 1225 PM EST THU FEB 15 2007 ********************STORM TOTAL SNOWFALL******************** OHIO ...ASHTABULA COUNTY... SAYBROOK 22.1"" as of 11:43 AM 2/15 ASHTABULA 13.4"" as of 11:32 AM 2/15 ASHTABULA 1SW 11.5"" as of 11:38 AM 2/15 ...CRAWFORD COUNTY... GALION 18.5"" as of 10:13 AM 2/15 BUCYRUS 15.0"" as of 7:20 PM 2/14 ...CUYAHOGA COUNTY... PEPPER PIKE 23.5"" as of 11:40 AM 2/15 LYNDHURST 17.5"" as of 11:42 AM 2/15 CLEVELAND HEIGHTS 12.8"" as of 11:42 AM 2/15 GARFIELD HTS 11.5"" as of 9:44 AM 2/15 LAKEWOOD 11.5"" as of 7:21 PM 2/14 ...GEAUGA COUNTY... CHARDON 12.5"" as of 11:41 AM 2/15 THOMPSON 3S 11.5"" as of 11:49 AM 2/15 ...HOLMES COUNTY... FRYBURG 9.6 1150 AM 2/15 ...HURON COUNTY... NORWALK 10.5 1139 AM 2/15 ...LAKE COUNTY... MENTOR 1S LK 12.0 1144 AM 2/15 ...LORAIN COUNTY... CAMDEN-TWP 12.6 834 PM 2/14 SHEFFIELD LAKE 12.0 1100 AM 2/14 N RIDGEVILLE 10.1 905 PM 2/14 OBERLIN 10.0 1100 AM 2/14 ...LUCAS COUNTY... TOLEDO 14.8 1100 AM 2/14 SYLVANIA TWP 10.1 1146 AM 2/15 MAUMEE 9.5 1100 AM 2/14 TOLEDO AIRPORT 8.9 1100 AM 2/14 TOLEDO-PT PLACE 8.0 1100 AM 2/14 ...MAHONING COUNTY... BOARDMAN SE 8.0 1147 AM 2/15 ...MARION COUNTY... MARION 9.4 1100 AM 2/14 ...MEDINA COUNTY... BRUNSWICK 13.6 1148 AM 2/15 HINCKLEY 12.2 1106 AM 2/15 CHIPPEWA LK 10.0 1100 AM 2/14 ...PORTAGE COUNTY... MANTUA 15.5 1136 AM 2/15 HIRAM RAPIDS 15.1 1139 AM 2/15 RAVENNA 1E 15.0 1147 AM 2/15 HIRAM 12.0 1139 AM 2/15 AURORA 10.7 1150 AM 2/15 ...SANDUSKY COUNTY... CLYDE 10.5 1100 AM 2/14 FREMONT 9.8 1100 AM 2/14 OAK HARBOR 5S 8.5 1100 AM 2/14 ...SUMMIT COUNTY... RICHFIELD 18.1 837 PM 2/14 MUNROE FALLS 15.5 730 PM 2/14 TALLMADGE 2NE 14.3 1137 AM 2/15 TWINSBURG 12.0 1137 AM 2/15 TALLMADGE 11.7 1138 AM 2/15 ...TRUMBULL COUNTY... NEWTON FALLS 12.0 1152 AM 2/15 ...WAYNE COUNTY... DOYLESTOWN 14.3 1149 AM 2/15 WOOSTER 7N 13.4 1149 AM 2/15 DALTON 10.5 1100 AM 2/14 KIDRON 1N 7.0 1141 AM 2/15'}]"
OH_2020_9cc0e9aeb524b16dab3181c8a4d06fd4.html.gz,2025-01-09-base,"[{'sentences': [{'generated_prob': 7.9986137279775e-05, 'sentence': 'Sections Links ZANESVILLE - There will be one new building on the Zanesville campus and another one in Buffalo, Ohio.', 'perplexity': 0, 'highlight_sentence_for_ai': False}, {'generated_prob': 5.930698534939438e-05, 'sentence': 'In Zanesville, the facility will be adding an exercise science and sports management program.', 'perplexity': 0, 'highlight_sentence_for_ai': False}, {'generated_prob': 5.572287045652047e-05, 'sentence': ""“It'll house that program."", 'perplexity': 0, 'highlight_sentence_for_ai': False}, {'generated_prob': 7.59867180022411e-05, 'sentence': ""The exercise science and sports management as well as building a gym, an exercise track, and we'll be moving our criminal justice program into that same facility so it'll create almost like a new front entrance for our campus so construction is underway, designs are out there, it's going to be pretty nice,” Director of the Zanesville campus Scott Sabino said."", 'perplexity': 0, 'highlight_sentence_for_ai': False}, {'generated_prob': 8.110899943858385e-05, 'sentence': 'The addition to the Buffalo campus will be bringing an AGCO program which stands for agriculture, genetics, conservation, and operations of farming.', 'perplexity': 0, 'highlight_sentence_for_ai': False}, {'generated_prob': 9.453159145778045e-05, 'sentence': '“I think its going to be beneficial to the students.', 'perplexity': 0, 'highlight_sentence_for_ai': False}, {'generated_prob': 9.425150346942246e-05, 'sentence': ""I think it's going to be beneficial to the community."", 'perplexity': 0, 'highlight_sentence_for_ai': False}, {'generated_prob': 0.0001275844406336546, 'sentence': 'If you look at the Ohio job outlook for our region, agriculture continues to rank in the top five areas of need for workforce development areas,” Counselor from the Buffalo campus Josh Moore said.', 'perplexity': 0, 'highlight_sentence_for_ai': False}, {'generated_prob': 0.00012161712220404297, 'sentence': 'The complexes are scheduled to be completed next summer and available for students at the beginning of the academic year.', 'perplexity': 0, 'highlight_sentence_for_ai': False}, {'generated_prob': 0.0001243869191966951, 'sentence': 'Because Local Matters © 2024 WHIZ - Fox 5 / Marquee Broadcasting.', 'perplexity': 0, 'highlight_sentence_for_ai': False}], 'paragraphs': [{'start_sentence_index': 0, 'num_sentences': 10, 'completely_generated_prob': 5.7802509961791254e-09}], 'completely_generated_prob': 0.0065769246948333485, 'class_probabilities': {'human': 0.9934230753051666, 'ai': 0.0065769246948333485, 'mixed': 0}, 'average_generated_prob': 0, 'predicted_class': 'human', 'confidence_score': 0.9934230753051666, 'confidence_category': 'high', 'confidence_scores_raw': {'identity': {'ai': 0.0065769246948333485, 'human': 0.9934230753051666, 'mixed': 0}}, 'confidence_thresholds_raw': {'identity': {'ai': {'reject': 0.65, 'low': 0.75, 'medium': 0.92}, 'human': {'reject': 0.7, 'low': 0.82, 'medium': 0.92}, 'mixed': {'reject': 0.7, 'low': 0.8, 'medium': 0.88}}}, 'overall_burstiness': 0, 'writing_stats': {}, 'subclass': {'ai': {}, 'human': {}, 'mixed': {}}, 'result_message': 'Our detector is highly confident that the text is written entirely by a human.', 'document_classification': 'HUMAN_ONLY', 'version': '2025-01-09-base', 'language': 'en', 'pageNumber': 0, 'inputText': 'Sections Links ZANESVILLE – There will be one new building on the Zanesville campus and another one in Buffalo, Ohio. In Zanesville, the facility will be adding an exercise science and sports management program. “It’ll house that program. The exercise science and sports management as well as building a gym, an exercise track, and we’ll be moving our criminal justice program into that same facility so it’ll create almost like a new front entrance for our campus so construction is underway, designs are out there, it’s going to be pretty nice,” Director of the Zanesville campus Scott Sabino said. The addition to the Buffalo campus will be bringing an AGCO program which stands for agriculture, genetics, conservation, and operations of farming. “I think its going to be beneficial to the students. I think it’s going to be beneficial to the community. If you look at the Ohio job outlook for our region, agriculture continues to rank in the top five areas of need for workforce development areas,” Counselor from the Buffalo campus Josh Moore said. The complexes are scheduled to be completed next summer and available for students at the beginning of the academic year. Because Local Matters © 2024 WHIZ – Fox 5 / Marquee Broadcasting.'}]"
