File,version,documents
GA_2023_1555bc4a21862f771a8ad7d4b6ff6359.html.gz,2025-01-09-base,"[{'sentences': [{'generated_prob': 0.004048699513077736, 'sentence': ""Select Page by Staff Reports | May 21, 2024 | Alabama News, Cherokee News | 0 | On Thursday, May 16th, the Dekalb County Sheriff's Office received a report of a Theft of... by Staff Reports | May 20, 2024 | Alabama News, Cherokee News | 0 | According to Sheriff Jeff Shaver, deputies and investigators conducted a warrant round up in... by Staff Reports | May 1, 2024 | Alabama News, Cherokee News, Floyd News | 0 | Truitt Clifford Alford, 48 of Centre, was arrested this week after reports said he illegally used... by Staff Reports | Apr 28, 2024 | Alabama News, Cherokee News | 0 | According to Cherokee County Sheriff Jeff Shaver - medics responded to a residence at the... by Staff Reports | Apr 22, 2024 | Alabama News, Cherokee News, Floyd News | 0 | Larry Wayne Causey, 62 of Centre, was arrested this week after reports said he stole an iPhone 15... by Staff Reports | Apr 16, 2024 | Alabama News, Cherokee News | 0 | District Attorney Summer Summerford announced today that Joseph Thomas Roden was found guilty on... by Staff Reports | Apr 9, 2024 | Alabama News, Cherokee News, Floyd News | 0 | Johnathon Ty Davis, 38 of Gaylesville, was arrested in Rome after reports said he shoved a man... by Staff Reports | Mar 4, 2024 | Alabama News, Georgia News | 0 | CDC released today updated recommendations for how people can protect themselves and... by Staff Reports | Feb 13, 2024 | Alabama News, Cherokee News | 0 | A man was shot at his residence on County Road 71 in the Woods Bend Communityin Cherokee County,... by Staff Reports | Jan 29, 2024 | Alabama News, Cherokee News | 0 | Former officer, Jairo Alexander Castillo (32 of Collinsville), was arrested and taken... 242 North 5th Avenue Rome, GA 30165 Email: [email protected] Phone: (706) 331-7098 Designed by Elegant Themes | Powered by WordPress"", 'perplexity': 0, 'highlight_sentence_for_ai': False}], 'paragraphs': [{'start_sentence_index': 0, 'num_sentences': 1, 'completely_generated_prob': 0.11111110864197542}], 'completely_generated_prob': 0.025041194076269924, 'class_probabilities': {'human': 0.974671313226954, 'ai': 0.025041194076269924, 'mixed': 0.00028749269677611}, 'average_generated_prob': 0, 'predicted_class': 'human', 'confidence_score': 0.974671313226954, 'confidence_category': 'high', 'confidence_scores_raw': {'identity': {'ai': 0.025041194076269924, 'human': 0.974671313226954, 'mixed': 0.00028749269677611}}, 'confidence_thresholds_raw': {'identity': {'ai': {'reject': 0.65, 'low': 0.75, 'medium': 0.92}, 'human': {'reject': 0.7, 'low': 0.82, 'medium': 0.92}, 'mixed': {'reject': 0.7, 'low': 0.8, 'medium': 0.88}}}, 'overall_burstiness': 0, 'writing_stats': {}, 'subclass': {'ai': {}, 'human': {}, 'mixed': {}}, 'result_message': 'Our detector is highly confident that the text is written entirely by a human.', 'document_classification': 'HUMAN_ONLY', 'version': '2025-01-09-base', 'language': 'en', 'pageNumber': 0, 'inputText': 'Select Page by Staff Reports | May 21, 2024 | Alabama News, Cherokee News | 0 | On Thursday, May 16th, the Dekalb County Sheriff’s Office received a report of a Theft of... by Staff Reports | May 20, 2024 | Alabama News, Cherokee News | 0 | According to Sheriff Jeff Shaver, deputies and investigators conducted a warrant round up in... by Staff Reports | May 1, 2024 | Alabama News, Cherokee News, Floyd News | 0 | Truitt Clifford Alford, 48 of Centre, was arrested this week after reports said he illegally used... by Staff Reports | Apr 28, 2024 | Alabama News, Cherokee News | 0 | According to Cherokee County Sheriff Jeff Shaver – medics responded to a residence at the... by Staff Reports | Apr 22, 2024 | Alabama News, Cherokee News, Floyd News | 0 | Larry Wayne Causey, 62 of Centre, was arrested this week after reports said he stole an iPhone 15... by Staff Reports | Apr 16, 2024 | Alabama News, Cherokee News | 0 | District Attorney Summer Summerford announced today that Joseph Thomas Roden was found guilty on... by Staff Reports | Apr 9, 2024 | Alabama News, Cherokee News, Floyd News | 0 | Johnathon Ty Davis, 38 of Gaylesville, was arrested in Rome after reports said he shoved a man... by Staff Reports | Mar 4, 2024 | Alabama News, Georgia News | 0 | CDC released today updated recommendations for how people can protect themselves and... by Staff Reports | Feb 13, 2024 | Alabama News, Cherokee News | 0 | A man was shot at his residence on County Road 71 in the Woods Bend Communityin Cherokee County,... by Staff Reports | Jan 29, 2024 | Alabama News, Cherokee News | 0 | Former officer, Jairo Alexander Castillo (32 of Collinsville), was arrested and taken... 242 North 5th Avenue Rome, GA 30165 Email: [email protected] Phone: (706) 331-7098 Designed by Elegant Themes | Powered by WordPress'}]"
GA_2023_508c0ee7ef79ddb6c1c21ac42044ebae.html.gz,2025-01-09-base,"[{'sentences': [{'generated_prob': 5.036818402004428e-05, 'sentence': 'Photo: Getty Images Carolina Panthers tight end Hayden Hurst has been diagnosed with post-traumatic amnesia by an independent neurologist due to a hit he took in the November 9 game against the Chicago Bears, his father revealed in a post shared on his X account Wednesday (December 6).', 'perplexity': 0, 'highlight_sentence_for_ai': False}, {'generated_prob': 5.476661681313999e-05, 'sentence': '""Hayden Hurst has been diagnosed with Post Traumatic Amnesia by an independent neurologist as a result of the hit he took in Chicago November 9,"" Jerry Hurst wrote.', 'perplexity': 0, 'highlight_sentence_for_ai': False}, {'generated_prob': 0.00011309891851851717, 'sentence': '""Slow recovery, don\'t know when he\'ll be back.', 'perplexity': 0, 'highlight_sentence_for_ai': False}, {'generated_prob': 0.00010372549877502024, 'sentence': 'Prayers appreciated!""', 'perplexity': 0, 'highlight_sentence_for_ai': False}, {'generated_prob': 6.276104249991477e-05, 'sentence': 'Hurst, 30, was reported to be a ""limited practice participant"" on Wednesday prior to his father\'s update.', 'perplexity': 0, 'highlight_sentence_for_ai': False}, {'generated_prob': 7.16669310349971e-05, 'sentence': ""The former South Carolina standout missed the past three games due to a concussion he suffered in the 16-13 'Thursday Night Football' loss to the Bears."", 'perplexity': 0, 'highlight_sentence_for_ai': False}, {'generated_prob': 8.67705384735018e-05, 'sentence': ""Hurts would've needed to be cleared an independent neurologist before returning from injury."", 'perplexity': 0, 'highlight_sentence_for_ai': False}, {'generated_prob': 6.538690649904311e-05, 'sentence': 'The 30-year-old recorded 18 receptions for 184 yards and one touchdown in eight starts and nine appearances in 2023.', 'perplexity': 0, 'highlight_sentence_for_ai': False}, {'generated_prob': 5.203341424930841e-05, 'sentence': 'Hurst signed a three-year, $21.75 million contract with the Panthers as a free agent this past offseason, having spent the 2022 season with the Cincinnati Bengals.', 'perplexity': 0, 'highlight_sentence_for_ai': False}, {'generated_prob': 0.00013503471564035863, 'sentence': 'Hurts was selected by the Baltimore Ravens at No.', 'perplexity': 0, 'highlight_sentence_for_ai': False}, {'generated_prob': 9.041807061294094e-05, 'sentence': '25 overall in the 2018 NFL Draft and spent his first two seasons with the franchise before being traded to the Baltimore Ravens prior to the 2020 season.', 'perplexity': 0, 'highlight_sentence_for_ai': False}], 'paragraphs': [{'start_sentence_index': 0, 'num_sentences': 11, 'completely_generated_prob': 7.905466206762634e-10}], 'completely_generated_prob': 0.005055181561100128, 'class_probabilities': {'human': 0.9949448184388998, 'ai': 0.005055181561100128, 'mixed': 0}, 'average_generated_prob': 0, 'predicted_class': 'human', 'confidence_score': 0.9949448184388998, 'confidence_category': 'high', 'confidence_scores_raw': {'identity': {'ai': 0.005055181561100128, 'human': 0.9949448184388998, 'mixed': 0}}, 'confidence_thresholds_raw': {'identity': {'ai': {'reject': 0.65, 'low': 0.75, 'medium': 0.92}, 'human': {'reject': 0.7, 'low': 0.82, 'medium': 0.92}, 'mixed': {'reject': 0.7, 'low': 0.8, 'medium': 0.88}}}, 'overall_burstiness': 0, 'writing_stats': {}, 'subclass': {'ai': {}, 'human': {}, 'mixed': {}}, 'result_message': 'Our detector is highly confident that the text is written entirely by a human.', 'document_classification': 'HUMAN_ONLY', 'version': '2025-01-09-base', 'language': 'en', 'pageNumber': 0, 'inputText': 'Photo: Getty Images Carolina Panthers tight end Hayden Hurst has been diagnosed with post-traumatic amnesia by an independent neurologist due to a hit he took in the November 9 game against the Chicago Bears, his father revealed in a post shared on his X account Wednesday (December 6). ""Hayden Hurst has been diagnosed with Post Traumatic Amnesia by an independent neurologist as a result of the hit he took in Chicago November 9,"" Jerry Hurst wrote. ""Slow recovery, don’t know when he’ll be back. Prayers appreciated!"" Hurst, 30, was reported to be a ""limited practice participant"" on Wednesday prior to his father\'s update. The former South Carolina standout missed the past three games due to a concussion he suffered in the 16-13 \'Thursday Night Football\' loss to the Bears. Hurts would\'ve needed to be cleared an independent neurologist before returning from injury. The 30-year-old recorded 18 receptions for 184 yards and one touchdown in eight starts and nine appearances in 2023. Hurst signed a three-year, $21.75 million contract with the Panthers as a free agent this past offseason, having spent the 2022 season with the Cincinnati Bengals. Hurts was selected by the Baltimore Ravens at No. 25 overall in the 2018 NFL Draft and spent his first two seasons with the franchise before being traded to the Baltimore Ravens prior to the 2020 season.'}]"
GA_2023_6be627201b0f7167ccf8b53ee228ce73.html.gz,2025-01-09-base,"[{'sentences': [{'generated_prob': 0.0006594619480893016, 'sentence': 'So, we already know Alicia Keys and Usher may perform together at the big game this Sunday, according to TMZ.', 'perplexity': 0, 'highlight_sentence_for_ai': False}, {'generated_prob': 0.0005396050401031971, 'sentence': 'But, who else is performing with Usher at the Super Bowl halftime show?', 'perplexity': 0, 'highlight_sentence_for_ai': False}, {'generated_prob': 0.00041872370638884604, 'sentence': 'Home title theft is a silent scam that takes advantage of public records, siphons off your equity and leaves you with nothing but a sinking feeling in your gut.', 'perplexity': 0, 'highlight_sentence_for_ai': False}, {'generated_prob': 0.00031927652889862657, 'sentence': 'The state of Georgia has earmarked $11 million dollars for the construction of a “truth-telling museum” at Stone Mountain Park, says LaDawn Blackett.', 'perplexity': 0, 'highlight_sentence_for_ai': False}, {'generated_prob': 0.00032296631252393126, 'sentence': ""She believes it's time for the new museum to finally address the Civil War period fully and fairly."", 'perplexity': 0, 'highlight_sentence_for_ai': False}, {'generated_prob': 0.00033991553937084973, 'sentence': ""Do you think it's time for the “truth-telling museum” to educate the truth of the civil war era rather than to praise the era of the confederation?"", 'perplexity': 0, 'highlight_sentence_for_ai': False}, {'generated_prob': 0.00043535075383260846, 'sentence': 'Let us know whether you like it, or Not!', 'perplexity': 0, 'highlight_sentence_for_ai': False}, {'generated_prob': 0.00029582902789115906, 'sentence': ""OPINION: The quality of a child's education should not depend on where their parents live, how much money they make, or the color of their skin, says LaDawn Jones."", 'perplexity': 0, 'highlight_sentence_for_ai': False}, {'generated_prob': 0.0002887945156544447, 'sentence': ""She believes it's time to reexamine the Equal Opportunities Act and consider new ideas that will make public education attendance zones fairer."", 'perplexity': 0, 'highlight_sentence_for_ai': False}, {'generated_prob': 0.0004433168505784124, 'sentence': ""Do you think it's time to rethink the way we determine public school attendance zones?"", 'perplexity': 0, 'highlight_sentence_for_ai': False}, {'generated_prob': 0.0003810858470387757, 'sentence': 'Let us know whether you like It or Not!', 'perplexity': 0, 'highlight_sentence_for_ai': False}, {'generated_prob': 0.0005001580575481057, 'sentence': 'All the news you need to know, every day By clicking Sign Up, I confirmthat I have read and agreeto the Privacy Policy and Terms of Service.', 'perplexity': 0, 'highlight_sentence_for_ai': False}, {'generated_prob': 0.0003964640782214701, 'sentence': 'This material may not be published, broadcast, rewritten, or redistributed.', 'perplexity': 0, 'highlight_sentence_for_ai': False}, {'generated_prob': 0.00032711264793761075, 'sentence': '©2024 FOX Television Stations', 'perplexity': 0, 'highlight_sentence_for_ai': False}], 'paragraphs': [{'start_sentence_index': 0, 'num_sentences': 14, 'completely_generated_prob': 1.9423489116273474e-12}], 'completely_generated_prob': 0.006608679833334143, 'class_probabilities': {'human': 0.9933913201666659, 'ai': 0.006608679833334143, 'mixed': 0}, 'average_generated_prob': 0, 'predicted_class': 'human', 'confidence_score': 0.9933913201666659, 'confidence_category': 'high', 'confidence_scores_raw': {'identity': {'ai': 0.006608679833334143, 'human': 0.9933913201666659, 'mixed': 0}}, 'confidence_thresholds_raw': {'identity': {'ai': {'reject': 0.65, 'low': 0.75, 'medium': 0.92}, 'human': {'reject': 0.7, 'low': 0.82, 'medium': 0.92}, 'mixed': {'reject': 0.7, 'low': 0.8, 'medium': 0.88}}}, 'overall_burstiness': 0, 'writing_stats': {}, 'subclass': {'ai': {}, 'human': {}, 'mixed': {}}, 'result_message': 'Our detector is highly confident that the text is written entirely by a human.', 'document_classification': 'HUMAN_ONLY', 'version': '2025-01-09-base', 'language': 'en', 'pageNumber': 0, 'inputText': ""So, we already know Alicia Keys and Usher may perform together at the big game this Sunday, according to TMZ. But, who else is performing with Usher at the Super Bowl halftime show? Home title theft is a silent scam that takes advantage of public records, siphons off your equity and leaves you with nothing but a sinking feeling in your gut. The state of Georgia has earmarked $11 million dollars for the construction of a “truth-telling museum” at Stone Mountain Park, says LaDawn Blackett. She believes it’s time for the new museum to finally address the Civil War period fully and fairly. Do you think it’s time for the “truth-telling museum” to educate the truth of the civil war era rather than to praise the era of the confederation? Let us know whether you like it, or Not! OPINION: The quality of a child’s education should not depend on where their parents live, how much money they make, or the color of their skin, says LaDawn Jones. She believes it's time to reexamine the Equal Opportunities Act and consider new ideas that will make public education attendance zones fairer. Do you think it's time to rethink the way we determine public school attendance zones? Let us know whether you like It or Not! All the news you need to know, every day By clicking Sign Up, I confirmthat I have read and agreeto the Privacy Policy and Terms of Service. This material may not be published, broadcast, rewritten, or redistributed. ©2024 FOX Television Stations""}]"
