File,version,documents
MT_2024_006c15067d1fb398073caae482a6c04b.html.gz,2025-01-09-base,"[{'sentences': [{'generated_prob': 0.0011672407854348421, 'sentence': 'Close to 30 locals came out to the West Annex meeting room in Columbus on Tuesday, Jan. 30, where Stillwater County Commissioners sought public comment on the possibility of a countywide transit program that could potentially provide roundtrip transportation to all parts of the county and into nearby counties as well.', 'perplexity': 0, 'highlight_sentence_for_ai': False}, {'generated_prob': 0.0008032280020415783, 'sentence': 'The intent of the meeting was to provide information on two non-competitive grants: one through the Individuals with Disabilities Program and one for the Rural Transit Assistance Program.', 'perplexity': 0, 'highlight_sentence_for_ai': False}, {'generated_prob': 0.0005816961056552827, 'sentence': 'The purpose of these grants is to support public transportation in rural areas with populations less than 50,000.', 'perplexity': 0, 'highlight_sentence_for_ai': False}, {'generated_prob': 0.000635626376606524, 'sentence': 'Stillwater County Commission Chair Steve Riveland said the Rural Transit Assistance Program particularly helps offset the operations cost of the program.', 'perplexity': 0, 'highlight_sentence_for_ai': False}, {'generated_prob': 0.0009063572506420314, 'sentence': 'The grants are available through the Montana Department of Transportation via the Federal Transit Administration.', 'perplexity': 0, 'highlight_sentence_for_ai': False}, {'generated_prob': 0.00043673109030351043, 'sentence': 'Javascript is required for you to be able to read premium content.', 'perplexity': 0, 'highlight_sentence_for_ai': False}, {'generated_prob': 0.0005698875756934285, 'sentence': 'Please enable it in your browser settings.', 'perplexity': 0, 'highlight_sentence_for_ai': False}, {'generated_prob': 0.0009255504701286554, 'sentence': 'Get our free email newsletters ᅳ latest headlines and e-edition notifications.', 'perplexity': 0, 'highlight_sentence_for_ai': False}, {'generated_prob': 0.0007256935932673514, 'sentence': ""We're always interested in hearing about news in our community."", 'perplexity': 0, 'highlight_sentence_for_ai': False}, {'generated_prob': 0.0010408475063741207, 'sentence': ""Let us know what's going on!"", 'perplexity': 0, 'highlight_sentence_for_ai': False}, {'generated_prob': 0.001005113939754665, 'sentence': 'Your browser is out of date and potentially vulnerable to security risks.We recommend switching to one of the following browsers: Get up-to-the-minute news sent straight to your device.', 'perplexity': 0, 'highlight_sentence_for_ai': False}, {'generated_prob': 0.0017187122721225023, 'sentence': 'Account processing issue - the email address may already exist Sign up with Thank you.', 'perplexity': 0, 'highlight_sentence_for_ai': False}, {'generated_prob': 0.0013293727533891797, 'sentence': 'Your account has been registered, and you are now logged in.', 'perplexity': 0, 'highlight_sentence_for_ai': False}, {'generated_prob': 0.002003810601308942, 'sentence': 'Check your email for details.', 'perplexity': 0, 'highlight_sentence_for_ai': False}, {'generated_prob': 0.001255577546544373, 'sentence': 'Invalid password or account does not exist Sign in with Submitting this form below will send a message to your email with a link to change your password.', 'perplexity': 0, 'highlight_sentence_for_ai': False}, {'generated_prob': 0.0011936717201024294, 'sentence': 'An email message containing instructions on how to reset your password has been sent to the email address listed on your account.', 'perplexity': 0, 'highlight_sentence_for_ai': False}, {'generated_prob': 0.00266153272241354, 'sentence': 'No promotional rates found.', 'perplexity': 0, 'highlight_sentence_for_ai': False}, {'generated_prob': 0.0016458505997434258, 'sentence': 'Secure & Encrypted Secure transaction.', 'perplexity': 0, 'highlight_sentence_for_ai': False}, {'generated_prob': 0.0014502599369734526, 'sentence': 'Secure transaction.', 'perplexity': 0, 'highlight_sentence_for_ai': False}, {'generated_prob': 0.0019922698847949505, 'sentence': 'Cancel anytime.', 'perplexity': 0, 'highlight_sentence_for_ai': False}, {'generated_prob': 0.001327184378169477, 'sentence': 'Thank you.', 'perplexity': 0, 'highlight_sentence_for_ai': False}, {'generated_prob': 0.0014417594065889716, 'sentence': 'Your gift purchase was successful!', 'perplexity': 0, 'highlight_sentence_for_ai': False}, {'generated_prob': 0.0017664410406723619, 'sentence': 'Your purchase was successful, and you are now logged in.', 'perplexity': 0, 'highlight_sentence_for_ai': False}, {'generated_prob': 0.0020233707036823034, 'sentence': 'A receipt was sent to your email.', 'perplexity': 0, 'highlight_sentence_for_ai': False}], 'paragraphs': [{'start_sentence_index': 0, 'num_sentences': 24, 'completely_generated_prob': 3.0444088223900345e-21}], 'completely_generated_prob': 0.009821925071449819, 'class_probabilities': {'human': 0.9901780749285501, 'ai': 0.009821925071449819, 'mixed': 0}, 'average_generated_prob': 0, 'predicted_class': 'human', 'confidence_score': 0.9901780749285501, 'confidence_category': 'high', 'confidence_scores_raw': {'identity': {'ai': 0.009821925071449819, 'human': 0.9901780749285501, 'mixed': 0}}, 'confidence_thresholds_raw': {'identity': {'ai': {'reject': 0.65, 'low': 0.75, 'medium': 0.92}, 'human': {'reject': 0.7, 'low': 0.82, 'medium': 0.92}, 'mixed': {'reject': 0.7, 'low': 0.8, 'medium': 0.88}}}, 'overall_burstiness': 0, 'writing_stats': {}, 'subclass': {'ai': {}, 'human': {}, 'mixed': {}}, 'result_message': 'Our detector is highly confident that the text is written entirely by a human.', 'document_classification': 'HUMAN_ONLY', 'version': '2025-01-09-base', 'language': 'en', 'pageNumber': 0, 'inputText': ""Close to 30 locals came out to the West Annex meeting room in Columbus on Tuesday, Jan. 30, where Stillwater County Commissioners sought public comment on the possibility of a countywide transit program that could potentially provide roundtrip transportation to all parts of the county and into nearby counties as well. The intent of the meeting was to provide information on two non-competitive grants: one through the Individuals with Disabilities Program and one for the Rural Transit Assistance Program. The purpose of these grants is to support public transportation in rural areas with populations less than 50,000. Stillwater County Commission Chair Steve Riveland said the Rural Transit Assistance Program particularly helps offset the operations cost of the program. The grants are available through the Montana Department of Transportation via the Federal Transit Administration. Javascript is required for you to be able to read premium content. Please enable it in your browser settings. Get our free email newsletters — latest headlines and e-edition notifications. We're always interested in hearing about news in our community. Let us know what's going on! Your browser is out of date and potentially vulnerable to security risks.We recommend switching to one of the following browsers: Get up-to-the-minute news sent straight to your device. Account processing issue - the email address may already exist Sign up with Thank you . Your account has been registered, and you are now logged in. Check your email for details. Invalid password or account does not exist Sign in with Submitting this form below will send a message to your email with a link to change your password. An email message containing instructions on how to reset your password has been sent to the email address listed on your account. No promotional rates found. Secure & Encrypted Secure transaction. Secure transaction. Cancel anytime. Thank you. Your gift purchase was successful! Your purchase was successful, and you are now logged in. A receipt was sent to your email.""}]"
MT_2024_09c4a5d7e065c76e03652c8632aace83.html.gz,2025-01-09-base,"[{'sentences': [{'generated_prob': 0.00016435969155281782, 'sentence': 'Have any questions?', 'perplexity': 0, 'highlight_sentence_for_ai': False}, {'generated_prob': 0.0002485683944541961, 'sentence': 'Please give us a call at 406-433-2403 Copyright © · Wick Communications Terms of Use | Privacy Policy SAVAGE ᅳ The Savage Public School was given an all clear on Wednesday morning following a bomb threat.', 'perplexity': 0, 'highlight_sentence_for_ai': False}, {'generated_prob': 0.00017163001757580787, 'sentence': ""At 6:30 a.m. Wednesday, the Richland County Sheriff's Office received a call from a member of personnel at the Savage school relating to a suspicious e-mail which indicated a bomb threat, said John K. Dynneson, Richland County Sheriff."", 'perplexity': 0, 'highlight_sentence_for_ai': False}, {'generated_prob': 0.00015006167814135551, 'sentence': 'Martha Potter, superintendent of Savage Public School, commented that ""all procedures were followed.""', 'perplexity': 0, 'highlight_sentence_for_ai': False}, {'generated_prob': 0.00011835283658001572, 'sentence': '“We responded and with the assistance of the Savage Fire Department, we did a search of the school,” Dynneson said.', 'perplexity': 0, 'highlight_sentence_for_ai': False}, {'generated_prob': 0.0001136605569627136, 'sentence': 'He stated that after the school was cleared, “it made a big difference when we actually got to look at the e-mail,” which appeared to be an apparent hoax.', 'perplexity': 0, 'highlight_sentence_for_ai': False}, {'generated_prob': 9.921236051013693e-05, 'sentence': ""“Unfortunately, these are the types of things we run into these days,” Dynneson said, adding that he didn't want to comment further as the case is under investigation on a state level."", 'perplexity': 0, 'highlight_sentence_for_ai': False}, {'generated_prob': 8.950167830334976e-05, 'sentence': 'This particular hoax was not something limited to just Savage.', 'perplexity': 0, 'highlight_sentence_for_ai': False}, {'generated_prob': 0.00014730831026099622, 'sentence': 'Several schools in Montana received similar e-mailed threats Wednesday morning.', 'perplexity': 0, 'highlight_sentence_for_ai': False}, {'generated_prob': 0.00013635972572956234, 'sentence': 'According to news reports from across the state, schools in Great Falls, East Helena, Fort Benton, Highwood, Bozeman, and Big Sandy, and as close as Glasgow, received similar threats.', 'perplexity': 0, 'highlight_sentence_for_ai': False}, {'generated_prob': 0.00020020385272800922, 'sentence': ""Savage did not have class on Wednesday; not long after the Sheriff's Office was notified, the Savage Public School posted on Facebook that there would be no school today."", 'perplexity': 0, 'highlight_sentence_for_ai': False}, {'generated_prob': 0.008103370666503906, 'sentence': 'However, in a separate post, made after the school received the all-clear, the school announced that classes would be held Thursday.', 'perplexity': 0, 'highlight_sentence_for_ai': False}, {'generated_prob': 0.014527970924973488, 'sentence': '“We will continue to work with local and state law enforcement and will take necessary precautions,” the Savage Public School stated in their Facebook post.', 'perplexity': 0, 'highlight_sentence_for_ai': False}, {'generated_prob': 0.011018454097211361, 'sentence': ""“The safety of our staff and students is our number one priority.” We're always interested in hearing about news in our community."", 'perplexity': 0, 'highlight_sentence_for_ai': False}, {'generated_prob': 0.0064940070733428, 'sentence': ""Let us know what's going on!"", 'perplexity': 0, 'highlight_sentence_for_ai': False}, {'generated_prob': 0.007598441559821367, 'sentence': 'Copyright © 1998- · Sidney Herald · 310 2nd Ave NE, Sidney, MT 59270 | Terms of Use | Privacy Policy | Contact Us | The SIDNEY HERALD is owned by Wick Communications.', 'perplexity': 0, 'highlight_sentence_for_ai': False}, {'generated_prob': 0.0018488871864974499, 'sentence': 'Get up-to-the-minute news sent straight to your device.', 'perplexity': 0, 'highlight_sentence_for_ai': False}, {'generated_prob': 0.0011764599476009607, 'sentence': 'Account processing issue - the email address may already exist Receive the digital, interactive PDF of the newspaper in your inbox.', 'perplexity': 0, 'highlight_sentence_for_ai': False}, {'generated_prob': 0.0008057597442530096, 'sentence': 'Sign up with Thank you.', 'perplexity': 0, 'highlight_sentence_for_ai': False}, {'generated_prob': 0.0007647553575225174, 'sentence': 'Your account has been registered, and you are now logged in.', 'perplexity': 0, 'highlight_sentence_for_ai': False}, {'generated_prob': 0.001028259051963687, 'sentence': 'Check your email for details.', 'perplexity': 0, 'highlight_sentence_for_ai': False}, {'generated_prob': 0.0010773784015327692, 'sentence': 'Invalid password or account does not exist Sign in with Submitting this form below will send a message to your email with a link to change your password.', 'perplexity': 0, 'highlight_sentence_for_ai': False}, {'generated_prob': 0.0012922532623633742, 'sentence': 'An email message containing instructions on how to reset your password has been sent to the email address listed on your account.', 'perplexity': 0, 'highlight_sentence_for_ai': False}, {'generated_prob': 0.001296515460126102, 'sentence': 'No promotional rates found.', 'perplexity': 0, 'highlight_sentence_for_ai': False}, {'generated_prob': 0.0006728458683937788, 'sentence': 'Secure & Encrypted Secure transaction.', 'perplexity': 0, 'highlight_sentence_for_ai': False}, {'generated_prob': 0.0005508665926754475, 'sentence': 'Secure transaction.', 'perplexity': 0, 'highlight_sentence_for_ai': False}, {'generated_prob': 0.0008408643770962954, 'sentence': 'Cancel anytime.', 'perplexity': 0, 'highlight_sentence_for_ai': False}, {'generated_prob': 0.0007091231527738273, 'sentence': 'Thank you.', 'perplexity': 0, 'highlight_sentence_for_ai': False}, {'generated_prob': 0.0010828544618561864, 'sentence': 'Your gift purchase was successful!', 'perplexity': 0, 'highlight_sentence_for_ai': False}, {'generated_prob': 0.001171665731817484, 'sentence': 'Your purchase was successful, and you are now logged in.', 'perplexity': 0, 'highlight_sentence_for_ai': False}, {'generated_prob': 0.0017848769202828407, 'sentence': 'A receipt was sent to your email.', 'perplexity': 0, 'highlight_sentence_for_ai': False}], 'paragraphs': [{'start_sentence_index': 0, 'num_sentences': 31, 'completely_generated_prob': 1.863374990750522e-27}], 'completely_generated_prob': 0.016264498660767183, 'class_probabilities': {'human': 0.9834523722759598, 'ai': 0.016264498660767183, 'mixed': 0.000283129063273}, 'average_generated_prob': 0, 'predicted_class': 'human', 'confidence_score': 0.9834523722759598, 'confidence_category': 'high', 'confidence_scores_raw': {'identity': {'ai': 0.016264498660767183, 'human': 0.9834523722759598, 'mixed': 0.000283129063273}}, 'confidence_thresholds_raw': {'identity': {'ai': {'reject': 0.65, 'low': 0.75, 'medium': 0.92}, 'human': {'reject': 0.7, 'low': 0.82, 'medium': 0.92}, 'mixed': {'reject': 0.7, 'low': 0.8, 'medium': 0.88}}}, 'overall_burstiness': 0, 'writing_stats': {}, 'subclass': {'ai': {}, 'human': {}, 'mixed': {}}, 'result_message': 'Our detector is highly confident that the text is written entirely by a human.', 'document_classification': 'HUMAN_ONLY', 'version': '2025-01-09-base', 'language': 'en', 'pageNumber': 0, 'inputText': 'Have any questions? Please give us a call at 406-433-2403 Copyright © • Wick Communications Terms of Use | Privacy Policy SAVAGE — The Savage Public School was given an all clear on Wednesday morning following a bomb threat. At 6:30 a.m. Wednesday, the Richland County Sheriff’s Office received a call from a member of personnel at the Savage school relating to a suspicious e-mail which indicated a bomb threat, said John K. Dynneson, Richland County Sheriff. Martha Potter, superintendent of Savage Public School, commented that ""all procedures were followed."" “We responded and with the assistance of the Savage Fire Department, we did a search of the school,” Dynneson said. He stated that after the school was cleared, “it made a big difference when we actually got to look at the e-mail,” which appeared to be an apparent hoax. “Unfortunately, these are the types of things we run into these days,” Dynneson said, adding that he didn’t want to comment further as the case is under investigation on a state level. This particular hoax was not something limited to just Savage. Several schools in Montana received similar e-mailed threats Wednesday morning. According to news reports from across the state, schools in Great Falls, East Helena, Fort Benton, Highwood, Bozeman, and Big Sandy, and as close as Glasgow, received similar threats. Savage did not have class on Wednesday; not long after the Sheriff\'s Office was notified, the Savage Public School posted on Facebook that there would be no school today. However, in a separate post, made after the school received the all-clear, the school announced that classes would be held Thursday. “We will continue to work with local and state law enforcement and will take necessary precautions,” the Savage Public School stated in their Facebook post. “The safety of our staff and students is our number one priority.” We\'re always interested in hearing about news in our community. Let us know what\'s going on! Copyright © 1998- • Sidney Herald • 310 2nd Ave NE, Sidney, MT 59270 | Terms of Use | Privacy Policy | Contact Us | The SIDNEY HERALD is owned by Wick Communications. Get up-to-the-minute news sent straight to your device. Account processing issue - the email address may already exist Receive the digital, interactive PDF of the newspaper in your inbox. Sign up with Thank you . Your account has been registered, and you are now logged in. Check your email for details. Invalid password or account does not exist Sign in with Submitting this form below will send a message to your email with a link to change your password. An email message containing instructions on how to reset your password has been sent to the email address listed on your account. No promotional rates found. Secure & Encrypted Secure transaction. Secure transaction. Cancel anytime. Thank you. Your gift purchase was successful! Your purchase was successful, and you are now logged in. A receipt was sent to your email.'}]"
