File,version,documents
ME_2024_1793d1d262971f8409b128bbf7fb65f2.html.gz,2025-01-09-base,"[{'sentences': [{'generated_prob': 0.003779007587581873, 'sentence': 'I\'m not sure if we can ""brag"" about this, but this is pretty wild if you did not know.', 'perplexity': 0, 'highlight_sentence_for_ai': False}, {'generated_prob': 0.0018777177901938558, 'sentence': 'The smallest town in America is in Maine.', 'perplexity': 0, 'highlight_sentence_for_ai': False}, {'generated_prob': 0.003391051199287176, 'sentence': 'After randomly searching where the smallest town in the country is, I was shocked to find many towns listed.', 'perplexity': 0, 'highlight_sentence_for_ai': False}, {'generated_prob': 0.0028522671200335026, 'sentence': ""It's not clean-cut, and there's room for speculation."", 'perplexity': 0, 'highlight_sentence_for_ai': False}, {'generated_prob': 0.006481762509793043, 'sentence': 'That is because there are a few ""towns"" that are only populated by one family.', 'perplexity': 0, 'highlight_sentence_for_ai': False}, {'generated_prob': 0.004972070921212435, 'sentence': 'For example, according to a Country Living article, there is a town in Alaska called Hobart Bay that only has one resident.', 'perplexity': 0, 'highlight_sentence_for_ai': False}, {'generated_prob': 0.005292144604027271, 'sentence': 'Similarly, there is a town in Maine that also only has one sole resident.', 'perplexity': 0, 'highlight_sentence_for_ai': False}, {'generated_prob': 0.006614830810576677, 'sentence': 'And that town is tiny, tiny.', 'perplexity': 0, 'highlight_sentence_for_ai': False}, {'generated_prob': 0.009321445599198341, 'sentence': 'Like, less-than-one-mile tiny.', 'perplexity': 0, 'highlight_sentence_for_ai': False}, {'generated_prob': 0.0029271403327584267, 'sentence': 'According to a NewsWeek article, the smallest town in America is Hibberts Gore.', 'perplexity': 0, 'highlight_sentence_for_ai': False}, {'generated_prob': 0.0035701394081115723, 'sentence': 'The town only covers an area of.752 square miles.', 'perplexity': 0, 'highlight_sentence_for_ai': False}, {'generated_prob': 0.0052719721570611, 'sentence': 'Shocked about this news, I had to follow up where everyone does: Wikipedia.', 'perplexity': 0, 'highlight_sentence_for_ai': False}, {'generated_prob': 0.005518426187336445, 'sentence': 'Sure enough, according to the Wikipedia page: According to the United States Census Bureau, Hibberts Gore has a total area of 0.752 sq mi (1.95 km2), of which 0.745 sq mi (1.93 km2) is land and 0.007 sq mi (0.02 km2), or 0.9%, is water.', 'perplexity': 0, 'highlight_sentence_for_ai': False}, {'generated_prob': 0.006544338073581457, 'sentence': '[2] The water is primarily wetlands, part of Sheepscot Pond, which is the headwaters of Sheepscot River.', 'perplexity': 0, 'highlight_sentence_for_ai': False}, {'generated_prob': 0.004906124901026487, 'sentence': 'That is not even the wildest part.', 'perplexity': 0, 'highlight_sentence_for_ai': False}, {'generated_prob': 0.004632286261767149, 'sentence': 'One person, not a family, is on this land.', 'perplexity': 0, 'highlight_sentence_for_ai': False}, {'generated_prob': 0.00553771760314703, 'sentence': 'How does one person have ""ownership"" over their own town?', 'perplexity': 0, 'highlight_sentence_for_ai': False}, {'generated_prob': 0.00963981170207262, 'sentence': 'According to Newsweek, the land was ignored by the surveyors who mapped Maine.', 'perplexity': 0, 'highlight_sentence_for_ai': False}, {'generated_prob': 0.008073093369603157, 'sentence': 'Gallery Credit: Megan Gallery Credit: Ginny Rogers', 'perplexity': 0, 'highlight_sentence_for_ai': False}], 'paragraphs': [{'start_sentence_index': 0, 'num_sentences': 19, 'completely_generated_prob': 7.952272508076387e-17}], 'completely_generated_prob': 0.02103284929902213, 'class_probabilities': {'human': 0.9789278799624425, 'ai': 0.02103284929902213, 'mixed': 3.927073853532657e-05}, 'average_generated_prob': 0, 'predicted_class': 'human', 'confidence_score': 0.9789278799624425, 'confidence_category': 'high', 'confidence_scores_raw': {'identity': {'ai': 0.02103284929902213, 'human': 0.9789278799624425, 'mixed': 3.927073853532657e-05}}, 'confidence_thresholds_raw': {'identity': {'ai': {'reject': 0.65, 'low': 0.75, 'medium': 0.92}, 'human': {'reject': 0.7, 'low': 0.82, 'medium': 0.92}, 'mixed': {'reject': 0.7, 'low': 0.8, 'medium': 0.88}}}, 'overall_burstiness': 0, 'writing_stats': {}, 'subclass': {'ai': {}, 'human': {}, 'mixed': {}}, 'result_message': 'Our detector is highly confident that the text is written entirely by a human.', 'document_classification': 'HUMAN_ONLY', 'version': '2025-01-09-base', 'language': 'en', 'pageNumber': 0, 'inputText': 'I\'m not sure if we can ""brag"" about this, but this is pretty wild if you did not know. The smallest town in America is in Maine. After randomly searching where the smallest town in the country is, I was shocked to find many towns listed. It\'s not clean-cut, and there\'s room for speculation. That is because there are a few ""towns"" that are only populated by one family. For example, according to a Country Living article, there is a town in Alaska called Hobart Bay that only has one resident. Similarly, there is a town in Maine that also only has one sole resident. And that town is tiny, tiny. Like, less-than-one-mile tiny. According to a NewsWeek article, the smallest town in America is Hibberts Gore. The town only covers an area of .752 square miles. Shocked about this news, I had to follow up where everyone does: Wikipedia. Sure enough, according to the Wikipedia page: According to the United States Census Bureau, Hibberts Gore has a total area of 0.752 sq mi (1.95 km2), of which 0.745 sq mi (1.93 km2) is land and 0.007 sq mi (0.02 km2), or 0.9%, is water.[2] The water is primarily wetlands, part of Sheepscot Pond, which is the headwaters of Sheepscot River. That is not even the wildest part. One person, not a family, is on this land. How does one person have ""ownership"" over their own town? According to Newsweek, the land was ignored by the surveyors who mapped Maine. Gallery Credit: Megan Gallery Credit: Ginny Rogers'}]"
ME_2024_2200dd432901ae63a964d545e0dba290.html.gz,2025-01-09-base,"[{'sentences': [{'generated_prob': 0.0020719068124890327, 'sentence': ""The Boston accent is either something you're really proud of, or something you're trying to conceal, and it might slip out after a few too many Bud Lights."", 'perplexity': 0, 'highlight_sentence_for_ai': False}, {'generated_prob': 0.0022682754788547754, 'sentence': ""Some celebrities that hail from New England are so good at turning on the Boston accent on command; it's like flipping a light switch."", 'perplexity': 0, 'highlight_sentence_for_ai': False}, {'generated_prob': 0.0045659467577934265, 'sentence': 'Remember the Smaht Pahk Superbowl commercial from a few years ago with a star-studded cast of New Englanders?', 'perplexity': 0, 'highlight_sentence_for_ai': False}, {'generated_prob': 0.011963938362896442, 'sentence': 'This had us howling.', 'perplexity': 0, 'highlight_sentence_for_ai': False}, {'generated_prob': 0.00634367810562253, 'sentence': 'The best line might be: ""stop being a smahty pants"".', 'perplexity': 0, 'highlight_sentence_for_ai': False}, {'generated_prob': 0.0025672477204352617, 'sentence': 'As a broadcaster, I have to be conscious to speak with no accent at all.', 'perplexity': 0, 'highlight_sentence_for_ai': False}, {'generated_prob': 0.0021339314989745617, 'sentence': 'Though the Boston accent feels like home for so many, others might find it jarring.', 'perplexity': 0, 'highlight_sentence_for_ai': False}, {'generated_prob': 0.004076697863638401, 'sentence': 'Once in a while, it will slip out if I am talking about my favorite place to get a MAH-GARITA.', 'perplexity': 0, 'highlight_sentence_for_ai': False}, {'generated_prob': 0.002368504647165537, 'sentence': ""For some reason, that's the word I have trouble with."", 'perplexity': 0, 'highlight_sentence_for_ai': False}, {'generated_prob': 0.002569646341726184, 'sentence': 'It appears that Ellen Fleming, who is a reporter for WWLP 22 News, was fighting off some Boston accent tendencies during a broadcast earlier this year.', 'perplexity': 0, 'highlight_sentence_for_ai': False}, {'generated_prob': 0.002681495388969779, 'sentence': 'It was relatable to so many of us, and has been viewed millions of times!', 'perplexity': 0, 'highlight_sentence_for_ai': False}, {'generated_prob': 0.0034119179472327232, 'sentence': 'One of the pair of eyeballs that came across this video was our very own Governor Sununu.', 'perplexity': 0, 'highlight_sentence_for_ai': False}, {'generated_prob': 0.0024426672607660294, 'sentence': 'He replied to the video, letting Ellen know that it\'s all good in the hood: It\'s not the first time someone referred to our fine state as ""New Hampsha"", and it certainly won\'t be the last.', 'perplexity': 0, 'highlight_sentence_for_ai': False}, {'generated_prob': 0.0016594541957601905, 'sentence': 'Do you have an accent?', 'perplexity': 0, 'highlight_sentence_for_ai': False}, {'generated_prob': 0.0023113565985113382, 'sentence': 'What words do you say that people call you out on?', 'perplexity': 0, 'highlight_sentence_for_ai': False}, {'generated_prob': 0.003334052162244916, 'sentence': ""Speaking of New Hampshire, here are some towns that you'd better know how to pronounce if you're going to call yourself a Granite Stater: Gallery Credit: Kira Lew"", 'perplexity': 0, 'highlight_sentence_for_ai': False}], 'paragraphs': [{'start_sentence_index': 0, 'num_sentences': 16, 'completely_generated_prob': 3.4496480286678e-14}], 'completely_generated_prob': 0.02065958899652478, 'class_probabilities': {'human': 0.979301577189572, 'ai': 0.02065958899652478, 'mixed': 3.883381390324206e-05}, 'average_generated_prob': 0, 'predicted_class': 'human', 'confidence_score': 0.979301577189572, 'confidence_category': 'high', 'confidence_scores_raw': {'identity': {'ai': 0.02065958899652478, 'human': 0.979301577189572, 'mixed': 3.883381390324206e-05}}, 'confidence_thresholds_raw': {'identity': {'ai': {'reject': 0.65, 'low': 0.75, 'medium': 0.92}, 'human': {'reject': 0.7, 'low': 0.82, 'medium': 0.92}, 'mixed': {'reject': 0.7, 'low': 0.8, 'medium': 0.88}}}, 'overall_burstiness': 0, 'writing_stats': {}, 'subclass': {'ai': {}, 'human': {}, 'mixed': {}}, 'result_message': 'Our detector is highly confident that the text is written entirely by a human.', 'document_classification': 'HUMAN_ONLY', 'version': '2025-01-09-base', 'language': 'en', 'pageNumber': 0, 'inputText': 'The Boston accent is either something you\'re really proud of, or something you\'re trying to conceal, and it might slip out after a few too many Bud Lights. Some celebrities that hail from New England are so good at turning on the Boston accent on command; it\'s like flipping a light switch. Remember the Smaht Pahk Superbowl commercial from a few years ago with a star-studded cast of New Englanders? This had us howling. The best line might be: ""stop being a smahty pants"". As a broadcaster, I have to be conscious to speak with no accent at all. Though the Boston accent feels like home for so many, others might find it jarring. Once in a while, it will slip out if I am talking about my favorite place to get a MAH-GARITA. For some reason, that\'s the word I have trouble with. It appears that Ellen Fleming, who is a reporter for WWLP 22 News, was fighting off some Boston accent tendencies during a broadcast earlier this year. It was relatable to so many of us, and has been viewed millions of times! One of the pair of eyeballs that came across this video was our very own Governor Sununu. He replied to the video, letting Ellen know that it\'s all good in the hood: It\'s not the first time someone referred to our fine state as ""New Hampsha"", and it certainly won\'t be the last. Do you have an accent? What words do you say that people call you out on? Speaking of New Hampshire, here are some towns that you\'d better know how to pronounce if you\'re going to call yourself a Granite Stater: Gallery Credit: Kira Lew'}]"
ME_2024_34c994d57149d388cbde8b9396d3be8c.html.gz,2025-01-09-base,"[{'sentences': [{'generated_prob': 0.002099648816511035, 'sentence': ""The Boston accent is either something you're really proud of, or something you're trying to conceal, and it might slip out after a few too many Bud Lights."", 'perplexity': 0, 'highlight_sentence_for_ai': False}, {'generated_prob': 0.0023056797217577696, 'sentence': ""Some celebrities that hail from New England are so good at turning on the Boston accent on command; it's like flipping a light switch."", 'perplexity': 0, 'highlight_sentence_for_ai': False}, {'generated_prob': 0.004685659892857075, 'sentence': 'Remember the Smaht Pahk Superbowl commercial from a few years ago with a star-studded cast of New Englanders?', 'perplexity': 0, 'highlight_sentence_for_ai': False}, {'generated_prob': 0.012237492948770523, 'sentence': 'This had us howling.', 'perplexity': 0, 'highlight_sentence_for_ai': False}, {'generated_prob': 0.00650824373587966, 'sentence': 'The best line might be: ""stop being a smahty pants"".', 'perplexity': 0, 'highlight_sentence_for_ai': False}, {'generated_prob': 0.002585196401923895, 'sentence': 'As a broadcaster, I have to be conscious to speak with no accent at all.', 'perplexity': 0, 'highlight_sentence_for_ai': False}, {'generated_prob': 0.0021774389315396547, 'sentence': 'Though the Boston accent feels like home for so many, others might find it jarring.', 'perplexity': 0, 'highlight_sentence_for_ai': False}, {'generated_prob': 0.004225035198032856, 'sentence': 'Once in a while, it will slip out if I am talking about my favorite place to get a MAH-GARITA.', 'perplexity': 0, 'highlight_sentence_for_ai': False}, {'generated_prob': 0.0024233751464635134, 'sentence': ""For some reason, that's the word I have trouble with."", 'perplexity': 0, 'highlight_sentence_for_ai': False}, {'generated_prob': 0.0026343369390815496, 'sentence': 'It appears that Ellen Fleming, who is a reporter for WWLP 22 News, was fighting off some Boston accent tendencies during a broadcast earlier this year.', 'perplexity': 0, 'highlight_sentence_for_ai': False}, {'generated_prob': 0.00271782698109746, 'sentence': 'It was relatable to so many of us, and has been viewed millions of times!', 'perplexity': 0, 'highlight_sentence_for_ai': False}, {'generated_prob': 0.003469277173280716, 'sentence': 'One of the pair of eyeballs that came across this video was our very own Governor Sununu.', 'perplexity': 0, 'highlight_sentence_for_ai': False}, {'generated_prob': 0.0024938599672168493, 'sentence': 'He replied to the video, letting Ellen know that it\'s all good in the hood: It\'s not the first time someone referred to our fine state as ""New Hampsha"", and it certainly won\'t be the last.', 'perplexity': 0, 'highlight_sentence_for_ai': False}, {'generated_prob': 0.0016749822534620762, 'sentence': 'Do you have an accent?', 'perplexity': 0, 'highlight_sentence_for_ai': False}, {'generated_prob': 0.0023780453484505415, 'sentence': 'What words do you say that people call you out on?', 'perplexity': 0, 'highlight_sentence_for_ai': False}, {'generated_prob': 0.0034154546447098255, 'sentence': ""Speaking of New Hampshire, here are some towns that you'd better know how to pronounce if you're going to call yourself a Granite Stater: Gallery Credit: Kira Lew"", 'perplexity': 0, 'highlight_sentence_for_ai': False}], 'paragraphs': [{'start_sentence_index': 0, 'num_sentences': 16, 'completely_generated_prob': 3.4496480286678e-14}], 'completely_generated_prob': 0.02065958899652478, 'class_probabilities': {'human': 0.979301577189572, 'ai': 0.02065958899652478, 'mixed': 3.883381390324206e-05}, 'average_generated_prob': 0, 'predicted_class': 'human', 'confidence_score': 0.979301577189572, 'confidence_category': 'high', 'confidence_scores_raw': {'identity': {'ai': 0.02065958899652478, 'human': 0.979301577189572, 'mixed': 3.883381390324206e-05}}, 'confidence_thresholds_raw': {'identity': {'ai': {'reject': 0.65, 'low': 0.75, 'medium': 0.92}, 'human': {'reject': 0.7, 'low': 0.82, 'medium': 0.92}, 'mixed': {'reject': 0.7, 'low': 0.8, 'medium': 0.88}}}, 'overall_burstiness': 0, 'writing_stats': {}, 'subclass': {'ai': {}, 'human': {}, 'mixed': {}}, 'result_message': 'Our detector is highly confident that the text is written entirely by a human.', 'document_classification': 'HUMAN_ONLY', 'version': '2025-01-09-base', 'language': 'en', 'pageNumber': 0, 'inputText': 'The Boston accent is either something you\'re really proud of, or something you\'re trying to conceal, and it might slip out after a few too many Bud Lights. Some celebrities that hail from New England are so good at turning on the Boston accent on command; it\'s like flipping a light switch. Remember the Smaht Pahk Superbowl commercial from a few years ago with a star-studded cast of New Englanders? This had us howling. The best line might be: ""stop being a smahty pants"". As a broadcaster, I have to be conscious to speak with no accent at all. Though the Boston accent feels like home for so many, others might find it jarring. Once in a while, it will slip out if I am talking about my favorite place to get a MAH-GARITA. For some reason, that\'s the word I have trouble with. It appears that Ellen Fleming, who is a reporter for WWLP 22 News, was fighting off some Boston accent tendencies during a broadcast earlier this year. It was relatable to so many of us, and has been viewed millions of times! One of the pair of eyeballs that came across this video was our very own Governor Sununu. He replied to the video, letting Ellen know that it\'s all good in the hood: It\'s not the first time someone referred to our fine state as ""New Hampsha"", and it certainly won\'t be the last. Do you have an accent? What words do you say that people call you out on? Speaking of New Hampshire, here are some towns that you\'d better know how to pronounce if you\'re going to call yourself a Granite Stater: Gallery Credit: Kira Lew'}]"
