File,version,documents
SD_2022_11b24f9a7638625184e7a329049d9690.html.gz,2025-01-09-base,"[{'sentences': [{'generated_prob': 0.0005770701100118458, 'sentence': 'Listen Live 2 years ago in Local Jamie Smith Photo: WNAX Democratic Governor candidate Jamie Smith has been circulating around the state for months in his quest for votes.', 'perplexity': 0, 'highlight_sentence_for_ai': False}, {'generated_prob': 0.0006552896811626852, 'sentence': 'He says there are lots of issues that need attention…… Smith says while the state got hundreds of millions of federal pandemic dollars, those will only last so long….. Smith, who has been House minority leader, says the state has a pretty big rainy day fund….. We have reached out to Governor Kristi Noem but have received no response.', 'perplexity': 0, 'highlight_sentence_for_ai': False}, {'generated_prob': 0.001492212526500225, 'sentence': ""1 day ago in Local UNDATED - The 12-person jury in Donald Trump's hush money trial convicted him Thursday of 34 counts of falsifying business… 2 days ago in Local RAPID CITY, S.D."", 'perplexity': 0, 'highlight_sentence_for_ai': False}, {'generated_prob': 0.001261595985852182, 'sentence': '- A South Dakota man has been arrested on felony and misdemeanor charges, including for allegedly assaulting… 3 days ago in Local CENTERVILLE, S.D.', 'perplexity': 0, 'highlight_sentence_for_ai': False}, {'generated_prob': 0.0010673785582184792, 'sentence': '(AP) ᅳ Three people were shot to death in a small South Dakota town, and a former law… 4 days ago in Local ELK POINT, S.D.', 'perplexity': 0, 'highlight_sentence_for_ai': False}, {'generated_prob': 0.001209005480632186, 'sentence': '- A man and woman are in custody after an officer-involved shooting and pursuit over the weekend.… 1 week ago in Local MITCHELL, S.D.', 'perplexity': 0, 'highlight_sentence_for_ai': False}, {'generated_prob': 0.002191156381741166, 'sentence': '- A juvenile is in custody following a stabbing incident at the Hitchcock Park basketball court Wednesday evening.… Radio 570 WNAXCopyright 2024 Saga Communications, Inc. All rights reserved.', 'perplexity': 0, 'highlight_sentence_for_ai': False}, {'generated_prob': 0.0024856918025761843, 'sentence': 'EEO Report | FCC Public File | FCC Applications For assistance accessing public files, contact pfhelp@wnax.com Privacy Policy | Terms of Use | Contests & Rules | Some images copyright AP, Clipart.com Non-Discriminatory Advertising Letter | Advisory Public Notice - Non-Discriminatory Ad Contracts', 'perplexity': 0, 'highlight_sentence_for_ai': False}], 'paragraphs': [{'start_sentence_index': 0, 'num_sentences': 8, 'completely_generated_prob': 3.002405151306975e-07}], 'completely_generated_prob': 0.01861304959480408, 'class_probabilities': {'human': 0.9813464938142095, 'ai': 0.01861304959480408, 'mixed': 4.045659098641626e-05}, 'average_generated_prob': 0, 'predicted_class': 'human', 'confidence_score': 0.9813464938142095, 'confidence_category': 'high', 'confidence_scores_raw': {'identity': {'ai': 0.01861304959480408, 'human': 0.9813464938142095, 'mixed': 4.045659098641626e-05}}, 'confidence_thresholds_raw': {'identity': {'ai': {'reject': 0.65, 'low': 0.75, 'medium': 0.92}, 'human': {'reject': 0.7, 'low': 0.82, 'medium': 0.92}, 'mixed': {'reject': 0.7, 'low': 0.8, 'medium': 0.88}}}, 'overall_burstiness': 0, 'writing_stats': {}, 'subclass': {'ai': {}, 'human': {}, 'mixed': {}}, 'result_message': 'Our detector is highly confident that the text is written entirely by a human.', 'document_classification': 'HUMAN_ONLY', 'version': '2025-01-09-base', 'language': 'en', 'pageNumber': 0, 'inputText': 'Listen Live 2 years ago in Local Jamie Smith Photo: WNAX Democratic Governor candidate Jamie Smith has been circulating around the state for months in his quest for votes. He says there are lots of issues that need attention…… Smith says while the state got hundreds of millions of federal pandemic dollars, those will only last so long….. Smith, who has been House minority leader, says the state has a pretty big rainy day fund….. We have reached out to Governor Kristi Noem but have received no response. 1 day ago in Local UNDATED – The 12-person jury in Donald Trump’s hush money trial convicted him Thursday of 34 counts of falsifying business… 2 days ago in Local RAPID CITY, S.D. – A South Dakota man has been arrested on felony and misdemeanor charges, including for allegedly assaulting… 3 days ago in Local CENTERVILLE, S.D. (AP) — Three people were shot to death in a small South Dakota town, and a former law… 4 days ago in Local ELK POINT, S.D. – A man and woman are in custody after an officer-involved shooting and pursuit over the weekend.… 1 week ago in Local MITCHELL, S.D. – A juvenile is in custody following a stabbing incident at the Hitchcock Park basketball court Wednesday evening.… Radio 570 WNAXCopyright 2024 Saga Communications, Inc. All rights reserved. EEO Report | FCC Public File | FCC Applications For assistance accessing public files, contact pfhelp@wnax.com Privacy Policy | Terms of Use | Contests & Rules | Some images copyright AP, Clipart.com Non-Discriminatory Advertising Letter | Advisory Public Notice - Non-Discriminatory Ad Contracts'}]"
SD_2022_420cfac50d247cfbd4c3a425ebebf714.html.gz,2025-01-09-base,"[{'sentences': [{'generated_prob': 0.000233731436310336, 'sentence': ""WASHINGTON - The United States House of Representatives passed legislation on Wednesday that would repeal 11 old federal laws that target Native Americans, including laws that forcibly removed Native American children from their families and placed them in “Indian reform schools.” The measure had previously passed the Senate, and the legislation is now headed to the president's desk for signature."", 'perplexity': 0, 'highlight_sentence_for_ai': False}, {'generated_prob': 0.0005722272908315063, 'sentence': 'South Dakota Senator Mike Rounds first introduced the Repealing Existing Substandard Provisions Encouraging Conciliation with Tribes (RESPECT) Act in 2019.', 'perplexity': 0, 'highlight_sentence_for_ai': False}, {'generated_prob': 0.00041682261507958174, 'sentence': 'It passed the Senate but was never voted on in the House.', 'perplexity': 0, 'highlight_sentence_for_ai': False}, {'generated_prob': 0.00047318844008259475, 'sentence': 'Rounds reintroduced the bill in March 2021.', 'perplexity': 0, 'highlight_sentence_for_ai': False}, {'generated_prob': 0.0004147696017753333, 'sentence': 'It passed the Senate two months later.', 'perplexity': 0, 'highlight_sentence_for_ai': False}, {'generated_prob': 0.0009547262452542782, 'sentence': '“While we cannot rewrite the past, we need to acknowledge it and continue to strive for a more perfect Union,” said Rounds.', 'perplexity': 0, 'highlight_sentence_for_ai': False}, {'generated_prob': 0.0011712592095136642, 'sentence': ""“It's long overdue to remove these immoral, discriminatory federal laws from our books."", 'perplexity': 0, 'highlight_sentence_for_ai': False}, {'generated_prob': 0.0024501087609678507, 'sentence': 'Throughout history, Native Americans have been subjected to unfair treatment from our federal government, including the forced removal of their children from their homes.', 'perplexity': 0, 'highlight_sentence_for_ai': False}, {'generated_prob': 0.004089727532118559, 'sentence': 'Clearly, there is no place in our legal code for such measures, and it is appalling these laws are still in our federal code.', 'perplexity': 0, 'highlight_sentence_for_ai': False}, {'generated_prob': 0.0008571513462811708, 'sentence': ""I am pleased this bipartisan, commonsense legislation is heading to the president's desk to be signed into law.” South Dakota Representative Dusty Johnson, along with Reps. Tom O'Halleran (D-Arizona) and Tom Cole (R-Oklahoma) cosponsored the companion bill that passed the House of Representatives Wednesday."", 'perplexity': 0, 'highlight_sentence_for_ai': False}, {'generated_prob': 0.0010426234221085906, 'sentence': '“Repealing these laws is a step in the right direction to right the wrongs against Native Americans,” said Johnson.', 'perplexity': 0, 'highlight_sentence_for_ai': False}, {'generated_prob': 0.0011910524917766452, 'sentence': '“There is no reason these archaic and discriminatory laws remain on the books.', 'perplexity': 0, 'highlight_sentence_for_ai': False}, {'generated_prob': 0.0021677478216588497, 'sentence': ""Senator Rounds' leadership on this bill was key to getting it passed in the Senate, and I am proud to help usher the RESPECT Act across the finish line in the House.” A complete list of laws that the Act would repeal can be found here."", 'perplexity': 0, 'highlight_sentence_for_ai': False}, {'generated_prob': 0.009084083139896393, 'sentence': ""The RESPECT Act is supported by the Great Plains Tribal Chairmen's Association (GPTCA) and the National Congress of American Indians (NCAI)."", 'perplexity': 0, 'highlight_sentence_for_ai': False}, {'generated_prob': 0.04541344568133354, 'sentence': 'Your browser is out of date and potentially vulnerable to security risks.We recommend switching to one of the following browsers: Get up-to-the-minute news sent straight to your device.', 'perplexity': 0, 'highlight_sentence_for_ai': False}], 'paragraphs': [{'start_sentence_index': 0, 'num_sentences': 15, 'completely_generated_prob': 2.5938383721896624e-13}], 'completely_generated_prob': 0.009180599824664711, 'class_probabilities': {'human': 0.9907801111847393, 'ai': 0.009180599824664711, 'mixed': 3.928899059593116e-05}, 'average_generated_prob': 0, 'predicted_class': 'human', 'confidence_score': 0.9907801111847393, 'confidence_category': 'high', 'confidence_scores_raw': {'identity': {'ai': 0.009180599824664711, 'human': 0.9907801111847393, 'mixed': 3.928899059593116e-05}}, 'confidence_thresholds_raw': {'identity': {'ai': {'reject': 0.65, 'low': 0.75, 'medium': 0.92}, 'human': {'reject': 0.7, 'low': 0.82, 'medium': 0.92}, 'mixed': {'reject': 0.7, 'low': 0.8, 'medium': 0.88}}}, 'overall_burstiness': 0, 'writing_stats': {}, 'subclass': {'ai': {}, 'human': {}, 'mixed': {}}, 'result_message': 'Our detector is highly confident that the text is written entirely by a human.', 'document_classification': 'HUMAN_ONLY', 'version': '2025-01-09-base', 'language': 'en', 'pageNumber': 0, 'inputText': 'WASHINGTON – The United States House of Representatives passed legislation on Wednesday that would repeal 11 old federal laws that target Native Americans, including laws that forcibly removed Native American children from their families and placed them in “Indian reform schools.” The measure had previously passed the Senate, and the legislation is now headed to the president’s desk for signature. South Dakota Senator Mike Rounds first introduced the Repealing Existing Substandard Provisions Encouraging Conciliation with Tribes (RESPECT) Act in 2019. It passed the Senate but was never voted on in the House. Rounds reintroduced the bill in March 2021. It passed the Senate two months later. “While we cannot rewrite the past, we need to acknowledge it and continue to strive for a more perfect Union,” said Rounds. “It’s long overdue to remove these immoral, discriminatory federal laws from our books. Throughout history, Native Americans have been subjected to unfair treatment from our federal government, including the forced removal of their children from their homes. Clearly, there is no place in our legal code for such measures, and it is appalling these laws are still in our federal code. I am pleased this bipartisan, commonsense legislation is heading to the president’s desk to be signed into law.” South Dakota Representative Dusty Johnson, along with Reps. Tom O’Halleran (D-Arizona) and Tom Cole (R-Oklahoma) cosponsored the companion bill that passed the House of Representatives Wednesday. “Repealing these laws is a step in the right direction to right the wrongs against Native Americans,” said Johnson. “There is no reason these archaic and discriminatory laws remain on the books. Senator Rounds’ leadership on this bill was key to getting it passed in the Senate, and I am proud to help usher the RESPECT Act across the finish line in the House.” A complete list of laws that the Act would repeal can be found here. The RESPECT Act is supported by the Great Plains Tribal Chairmen’s Association (GPTCA) and the National Congress of American Indians (NCAI). Your browser is out of date and potentially vulnerable to security risks.We recommend switching to one of the following browsers: Get up-to-the-minute news sent straight to your device.'}]"
SD_2022_53363b6c6250cb17a8fcf158ecd05732.html.gz,2025-01-09-base,"[{'sentences': [{'generated_prob': 0.00023005751427263021, 'sentence': ""TAKABA, Kenya (Reuters) - Kenyan pastoralists are losing their herds as the Horn of Africa's worst drought in 40 years leaves pasture desiccated and cows with nothing to eat."", 'perplexity': 0, 'highlight_sentence_for_ai': False}, {'generated_prob': 0.0001989662559935823, 'sentence': 'In Mandera County in northeastern Kenya, which borders Somalia and Ethiopia, herder Ali Hacho Ali, 56, said all but five of his herd of 70 cows had died.', 'perplexity': 0, 'highlight_sentence_for_ai': False}, {'generated_prob': 0.0001732278906274587, 'sentence': '“I have never witnessed such before,” said Hacho Ali.', 'perplexity': 0, 'highlight_sentence_for_ai': False}, {'generated_prob': 0.00018777113291434944, 'sentence': '“Our livestock has died and we are sick from malnutrition but we cannot see any support from the government.” The drought looks almost certain to persist, according to the World Meteorological Organization which said last week the Horn of Africa was entering its fifth consecutive failed rainy season.', 'perplexity': 0, 'highlight_sentence_for_ai': False}, {'generated_prob': 0.00020886071433778852, 'sentence': ""(Reporting by Thomas Mukoya; Writing by Estelle Shirbon; Editing by Rosalba O'Brien) Boeing's Starliner capsule set for launch of first crewed space flight 1h ago Prabowo says Indonesia willing to send peacekeeping troops to Gaza 5h ago Jittery markets struggle with South Africa coalition puzzle 2h ago Doping-Enhanced Games could lead to the exploitation of young athletes, FIMS says 2h ago Japanese billionaire Maezawa 'dearMoon' mission cancels moon flyby 6h ago Israel's Netanyahu says there cannot be permanent Gaza ceasefire until Hamas destroyed 1h ago This site is protected by reCAPTCHA and the Google Privacy Policy and Terms of Service apply."", 'perplexity': 0, 'highlight_sentence_for_ai': False}], 'paragraphs': [{'start_sentence_index': 0, 'num_sentences': 5, 'completely_generated_prob': 0.00010005932717626924}], 'completely_generated_prob': 0.009998674697021016, 'class_probabilities': {'human': 0.990001325302979, 'ai': 0.009998674697021016, 'mixed': 0}, 'average_generated_prob': 0, 'predicted_class': 'human', 'confidence_score': 0.990001325302979, 'confidence_category': 'high', 'confidence_scores_raw': {'identity': {'ai': 0.009998674697021016, 'human': 0.990001325302979, 'mixed': 0}}, 'confidence_thresholds_raw': {'identity': {'ai': {'reject': 0.65, 'low': 0.75, 'medium': 0.92}, 'human': {'reject': 0.7, 'low': 0.82, 'medium': 0.92}, 'mixed': {'reject': 0.7, 'low': 0.8, 'medium': 0.88}}}, 'overall_burstiness': 0, 'writing_stats': {}, 'subclass': {'ai': {}, 'human': {}, 'mixed': {}}, 'result_message': 'Our detector is highly confident that the text is written entirely by a human.', 'document_classification': 'HUMAN_ONLY', 'version': '2025-01-09-base', 'language': 'en', 'pageNumber': 0, 'inputText': ""TAKABA, Kenya (Reuters) – Kenyan pastoralists are losing their herds as the Horn of Africa’s worst drought in 40 years leaves pasture desiccated and cows with nothing to eat. In Mandera County in northeastern Kenya, which borders Somalia and Ethiopia, herder Ali Hacho Ali, 56, said all but five of his herd of 70 cows had died. “I have never witnessed such before,” said Hacho Ali. “Our livestock has died and we are sick from malnutrition but we cannot see any support from the government.” The drought looks almost certain to persist, according to the World Meteorological Organization which said last week the Horn of Africa was entering its fifth consecutive failed rainy season. (Reporting by Thomas Mukoya; Writing by Estelle Shirbon; Editing by Rosalba O’Brien) Boeing's Starliner capsule set for launch of first crewed space flight 1h ago Prabowo says Indonesia willing to send peacekeeping troops to Gaza 5h ago Jittery markets struggle with South Africa coalition puzzle 2h ago Doping-Enhanced Games could lead to the exploitation of young athletes, FIMS says 2h ago Japanese billionaire Maezawa 'dearMoon' mission cancels moon flyby 6h ago Israel's Netanyahu says there cannot be permanent Gaza ceasefire until Hamas destroyed 1h ago This site is protected by reCAPTCHA and the Google Privacy Policy and Terms of Service apply.""}]"
SD_2022_81cae540fc4f03155ed3c16a92fc245a.html.gz,2025-01-09-base,"[{'sentences': [{'generated_prob': 0.002551645040512085, 'sentence': ""Listen Live 6:12-6:13 a.m. - Farm News Update 6:33-6:36 a.m. - American Ag Radio Network: Ag Weather 7:12-7:16 a.m. - American Ag Radio Network: Farm News 7:33-7:36 a.m. - American Ag Radio Network: Early Market Summary 7:56-7:59 a.m. - American Ag Radio Network: Early Market Check 8:12-8:13 a.m. - Farm News Update 8:30-8:36 a.m. - Opening Markets with Market Analyst 8:54-8:57 a.m. - American Ag Radio Network: Opening Markets 10:11-10:12 a.m. - Farm News Update 10:16-10:20 a.m.- WNAX Farm News 10:30-10:33 a.m. - American Ag Radio Network: Markets 10:55-10:58 a.m. - American Ag Radio Network: Markets 11:11-11:12 a.m. - Farm News Update 11:16-11:20 a.m. - Farm News Feature 11:30-11:37 a.m. - Markets with Market Analyst 11:55-11:58 a.m. - American Ag Radio Network: Markets 12:30-12:36 p.m. - Markets 12:44-12:44 p.m. -American Ag Radio Network: Farm News Today 12:55-12:58 p.m. - American Ag Radio Network: Markets 1:11-1:15 p.m. - American Ag Radio Network: Farm News Update 1:16-1:20 p.m. - WNAX Farm News Feature 1:30-1:38 p.m. - Commodity Wrap-up Program with Market Analyst 1:43-1:47 p.m. - American Ag Radio Network: Farm News 1:50-1:53 p.m. - Cash Grains 3:11-3:12 p.m. - Farm News Update 4:12-4:13 p.m. - Farm News Update 5:12-5:13 p.m. - Farm News Update 1 day ago in Local UNDATED - The 12-person jury in Donald Trump's hush money trial convicted him Thursday of 34 counts of falsifying business… 2 days ago in Local RAPID CITY, S.D."", 'perplexity': 0, 'highlight_sentence_for_ai': False}, {'generated_prob': 0.0005759646883234382, 'sentence': '- A South Dakota man has been arrested on felony and misdemeanor charges, including for allegedly assaulting… 3 days ago in Local CENTERVILLE, S.D.', 'perplexity': 0, 'highlight_sentence_for_ai': False}, {'generated_prob': 0.0005306610837578773, 'sentence': '(AP) ᅳ Three people were shot to death in a small South Dakota town, and a former law… 4 days ago in Local ELK POINT, S.D.', 'perplexity': 0, 'highlight_sentence_for_ai': False}, {'generated_prob': 0.0007165270508266985, 'sentence': '- A man and woman are in custody after an officer-involved shooting and pursuit over the weekend.… 1 week ago in Local MITCHELL, S.D.', 'perplexity': 0, 'highlight_sentence_for_ai': False}, {'generated_prob': 0.0008441462996415794, 'sentence': '- A juvenile is in custody following a stabbing incident at the Hitchcock Park basketball court Wednesday evening.… Radio 570 WNAXCopyright 2024 Saga Communications, Inc. All rights reserved.', 'perplexity': 0, 'highlight_sentence_for_ai': False}, {'generated_prob': 0.001997821731492877, 'sentence': 'EEO Report | FCC Public File | FCC Applications For assistance accessing public files, contact pfhelp@wnax.com Privacy Policy | Terms of Use | Contests & Rules | Some images copyright AP, Clipart.com Non-Discriminatory Advertising Letter | Advisory Public Notice - Non-Discriminatory Ad Contracts', 'perplexity': 0, 'highlight_sentence_for_ai': False}], 'paragraphs': [{'start_sentence_index': 0, 'num_sentences': 6, 'completely_generated_prob': 1.474742012248794e-05}], 'completely_generated_prob': 0.016264498660767183, 'class_probabilities': {'human': 0.9834523722759598, 'ai': 0.016264498660767183, 'mixed': 0.000283129063273}, 'average_generated_prob': 0, 'predicted_class': 'human', 'confidence_score': 0.9834523722759598, 'confidence_category': 'high', 'confidence_scores_raw': {'identity': {'ai': 0.016264498660767183, 'human': 0.9834523722759598, 'mixed': 0.000283129063273}}, 'confidence_thresholds_raw': {'identity': {'ai': {'reject': 0.65, 'low': 0.75, 'medium': 0.92}, 'human': {'reject': 0.7, 'low': 0.82, 'medium': 0.92}, 'mixed': {'reject': 0.7, 'low': 0.8, 'medium': 0.88}}}, 'overall_burstiness': 0, 'writing_stats': {}, 'subclass': {'ai': {}, 'human': {}, 'mixed': {}}, 'result_message': 'Our detector is highly confident that the text is written entirely by a human.', 'document_classification': 'HUMAN_ONLY', 'version': '2025-01-09-base', 'language': 'en', 'pageNumber': 0, 'inputText': 'Listen Live 6:12-6:13 a.m. – Farm News Update 6:33-6:36 a.m. – American Ag Radio Network: Ag Weather 7:12-7:16 a.m. – American Ag Radio Network: Farm News 7:33-7:36 a.m. – American Ag Radio Network: Early Market Summary 7:56-7:59 a.m. – American Ag Radio Network: Early Market Check 8:12-8:13 a.m. – Farm News Update 8:30-8:36 a.m. – Opening Markets with Market Analyst 8:54–8:57 a.m. – American Ag Radio Network: Opening Markets 10:11-10:12 a.m. – Farm News Update 10:16-10:20 a.m.- WNAX Farm News 10:30-10:33 a.m. – American Ag Radio Network: Markets 10:55-10:58 a.m. – American Ag Radio Network: Markets 11:11-11:12 a.m. – Farm News Update 11:16-11:20 a.m. – Farm News Feature 11:30-11:37 a.m. – Markets with Market Analyst 11:55-11:58 a.m. – American Ag Radio Network: Markets 12:30-12:36 p.m. – Markets 12:44-12:44 p.m. -American Ag Radio Network: Farm News Today 12:55-12:58 p.m. – American Ag Radio Network: Markets 1:11-1:15 p.m. – American Ag Radio Network: Farm News Update 1:16-1:20 p.m. – WNAX Farm News Feature 1:30-1:38 p.m. – Commodity Wrap-up Program with Market Analyst 1:43-1:47 p.m. – American Ag Radio Network: Farm News 1:50-1:53 p.m. – Cash Grains 3:11-3:12 p.m. – Farm News Update 4:12-4:13 p.m. – Farm News Update 5:12-5:13 p.m. – Farm News Update 1 day ago in Local UNDATED – The 12-person jury in Donald Trump’s hush money trial convicted him Thursday of 34 counts of falsifying business… 2 days ago in Local RAPID CITY, S.D. – A South Dakota man has been arrested on felony and misdemeanor charges, including for allegedly assaulting… 3 days ago in Local CENTERVILLE, S.D. (AP) — Three people were shot to death in a small South Dakota town, and a former law… 4 days ago in Local ELK POINT, S.D. – A man and woman are in custody after an officer-involved shooting and pursuit over the weekend.… 1 week ago in Local MITCHELL, S.D. – A juvenile is in custody following a stabbing incident at the Hitchcock Park basketball court Wednesday evening.… Radio 570 WNAXCopyright 2024 Saga Communications, Inc. All rights reserved. EEO Report | FCC Public File | FCC Applications For assistance accessing public files, contact pfhelp@wnax.com Privacy Policy | Terms of Use | Contests & Rules | Some images copyright AP, Clipart.com Non-Discriminatory Advertising Letter | Advisory Public Notice - Non-Discriminatory Ad Contracts'}]"
