File,version,documents
MD_2022_05415175de0b8ac65432e65860e6b6cb.html.gz,2025-01-09-base,"[{'sentences': [{'generated_prob': 0.00039559268043376505, 'sentence': 'By Jack Chavez, Staff Writer Decatur Park renovations are a top priority for the Berlin Parks Commission after a unanimous vote last week.', 'perplexity': 0, 'highlight_sentence_for_ai': False}, {'generated_prob': 0.0004890256677754223, 'sentence': ""FILE PHOTO An all-new Stephen Decatur Park got bumped up to the top of the Berlin Parks Commission's priority list during its July 5 meeting."", 'perplexity': 0, 'highlight_sentence_for_ai': False}, {'generated_prob': 0.0005332982400432229, 'sentence': 'Mayor Zack Tyndall stopped by the meeting to support the project.', 'perplexity': 0, 'highlight_sentence_for_ai': False}, {'generated_prob': 0.00052912492537871, 'sentence': '“We brought this up a year ago almost, looking at the playground equipment and hopefully pursuing a grant application for an inclusive playground that would span multiple ages at (the park),” he said.', 'perplexity': 0, 'highlight_sentence_for_ai': False}, {'generated_prob': 0.0004547715070657432, 'sentence': 'Tyndall brought up the recent independent report that found the park equipment to be in a state of deterioration by and large and needed to be replaced.', 'perplexity': 0, 'highlight_sentence_for_ai': False}, {'generated_prob': 0.00047986212302930653, 'sentence': 'He estimated that a total renovation would cost a little more than $1 million.', 'perplexity': 0, 'highlight_sentence_for_ai': False}, {'generated_prob': 0.0002977177791763097, 'sentence': 'The plan still needs to be fleshed out concerning funding.', 'perplexity': 0, 'highlight_sentence_for_ai': False}, {'generated_prob': 0.0005175935220904648, 'sentence': 'Still, Tyndall said it would be prudent to enlist the help of the Maryland Department of Natural Resources so the renovations would not just refrain from destroying any vegetation but possibly enhance it.', 'perplexity': 0, 'highlight_sentence_for_ai': False}, {'generated_prob': 0.0004163127450738102, 'sentence': 'No preliminary designs have been discussed but Tyndall did bring concept art showing what a new park could look like.', 'perplexity': 0, 'highlight_sentence_for_ai': False}, {'generated_prob': 0.0003782261919695884, 'sentence': '“(We could) preserve the natural beauty of Stephen Decatur Park but also add something where all ages and abilities can play,” he said.', 'perplexity': 0, 'highlight_sentence_for_ai': False}, {'generated_prob': 0.000413247209507972, 'sentence': 'He also brought up fishing, adding that the pond at the park is in no condition for fishing now.', 'perplexity': 0, 'highlight_sentence_for_ai': False}, {'generated_prob': 0.0004245795134920627, 'sentence': 'Town administrator Mary Bohlen concurred.', 'perplexity': 0, 'highlight_sentence_for_ai': False}, {'generated_prob': 0.0004199020331725478, 'sentence': ""“If you were to cast a line in there now you'd catch everything under the sun except a fish,” she said."", 'perplexity': 0, 'highlight_sentence_for_ai': False}, {'generated_prob': 0.00047571168397553265, 'sentence': 'Meanwhile, the commission approved a table-tennis library at the soon-to-be table tennis park located at Burbage Park on William Street.', 'perplexity': 0, 'highlight_sentence_for_ai': False}, {'generated_prob': 0.0005800101207569242, 'sentence': 'The library will look much the same as a free lending library stand ᅳ one of which may also be coming to the park, according to the commission ᅳ and offer equipment for table tennis that interested parties may not possess themselves.', 'perplexity': 0, 'highlight_sentence_for_ai': False}, {'generated_prob': 0.00032275079865939915, 'sentence': 'The Planning Commission next meets on Aug. 2.', 'perplexity': 0, 'highlight_sentence_for_ai': False}, {'generated_prob': 0.00034876647987402976, 'sentence': 'This story appears in the print version of the Bayside Gazette on July 14, 2022.', 'perplexity': 0, 'highlight_sentence_for_ai': False}], 'paragraphs': [{'start_sentence_index': 0, 'num_sentences': 17, 'completely_generated_prob': 4.571217651318373e-15}], 'completely_generated_prob': 0.009782813243742878, 'class_probabilities': {'human': 0.9902171867562571, 'ai': 0.009782813243742878, 'mixed': 0}, 'average_generated_prob': 0, 'predicted_class': 'human', 'confidence_score': 0.9902171867562571, 'confidence_category': 'high', 'confidence_scores_raw': {'identity': {'ai': 0.009782813243742878, 'human': 0.9902171867562571, 'mixed': 0}}, 'confidence_thresholds_raw': {'identity': {'ai': {'reject': 0.65, 'low': 0.75, 'medium': 0.92}, 'human': {'reject': 0.7, 'low': 0.82, 'medium': 0.92}, 'mixed': {'reject': 0.7, 'low': 0.8, 'medium': 0.88}}}, 'overall_burstiness': 0, 'writing_stats': {}, 'subclass': {'ai': {}, 'human': {}, 'mixed': {}}, 'result_message': 'Our detector is highly confident that the text is written entirely by a human.', 'document_classification': 'HUMAN_ONLY', 'version': '2025-01-09-base', 'language': 'en', 'pageNumber': 0, 'inputText': 'By Jack Chavez, Staff Writer Decatur Park renovations are a top priority for the Berlin Parks Commission after a unanimous vote last week. FILE PHOTO An all-new Stephen Decatur Park got bumped up to the top of the Berlin Parks Commission’s priority list during its July 5 meeting. Mayor Zack Tyndall stopped by the meeting to support the project. “We brought this up a year ago almost, looking at the playground equipment and hopefully pursuing a grant application for an inclusive playground that would span multiple ages at (the park),” he said. Tyndall brought up the recent independent report that found the park equipment to be in a state of deterioration by and large and needed to be replaced. He estimated that a total renovation would cost a little more than $1 million. The plan still needs to be fleshed out concerning funding. Still, Tyndall said it would be prudent to enlist the help of the Maryland Department of Natural Resources so the renovations would not just refrain from destroying any vegetation but possibly enhance it. No preliminary designs have been discussed but Tyndall did bring concept art showing what a new park could look like. “(We could) preserve the natural beauty of Stephen Decatur Park but also add something where all ages and abilities can play,” he said. He also brought up fishing, adding that the pond at the park is in no condition for fishing now. Town administrator Mary Bohlen concurred. “If you were to cast a line in there now you’d catch everything under the sun except a fish,” she said. Meanwhile, the commission approved a table-tennis library at the soon-to-be table tennis park located at Burbage Park on William Street. The library will look much the same as a free lending library stand — one of which may also be coming to the park, according to the commission — and offer equipment for table tennis that interested parties may not possess themselves. The Planning Commission next meets on Aug. 2. This story appears in the print version of the Bayside Gazette on July 14, 2022.'}]"
MD_2022_09f7e03558bf4c6fe7f4ab14b18f3bd1.html.gz,2025-01-09-base,"[{'sentences': [{'generated_prob': 0.005738617852330208, 'sentence': 'On the Beach & Boardwalk.View our 360 Virtual tours and live webcams.', 'perplexity': 0, 'highlight_sentence_for_ai': False}, {'generated_prob': 0.008534105494618416, 'sentence': 'Search by price & book you stay South African lobster tail, whole lobsters, and Certified Angus Beef® steaks prepared perfectly.', 'perplexity': 0, 'highlight_sentence_for_ai': False}, {'generated_prob': 0.007289307191967964, 'sentence': 'Visit captainstableoc.com Downtown waterfront dining and entertainment overlooking the bay at the end of the bridge.', 'perplexity': 0, 'highlight_sentence_for_ai': False}, {'generated_prob': 0.004440790507942438, 'sentence': 'Visit https://www.angleroc.net/ View our coupons & deals section for savings.', 'perplexity': 0, 'highlight_sentence_for_ai': False}, {'generated_prob': 0.00600501149892807, 'sentence': 'View available offers for Ocean City activites, restaurants, and shops.', 'perplexity': 0, 'highlight_sentence_for_ai': False}, {'generated_prob': 0.024390067905187607, 'sentence': 'May 22, 2024 at 6:30pm 2 hour sunset cruise with 2 local craft beers.', 'perplexity': 0, 'highlight_sentence_for_ai': False}, {'generated_prob': 0.014282720163464546, 'sentence': 'only $40!', 'perplexity': 0, 'highlight_sentence_for_ai': False}, {'generated_prob': 0.016376592218875885, 'sentence': 'July 4th, 2024 Celebrate Independence Day at the Beach!', 'perplexity': 0, 'highlight_sentence_for_ai': False}, {'generated_prob': 0.014395002275705338, 'sentence': 'Only comment I really have is that the Air Show is way too late this year.', 'perplexity': 0, 'highlight_sentence_for_ai': False}, {'generated_prob': 0.012445708736777306, 'sentence': ""Students heading back to… Well I think it's ridiculous that bikes, dogs, skateboards, scooters, etc are not allowed year round on your boardwalk."", 'perplexity': 0, 'highlight_sentence_for_ai': False}, {'generated_prob': 0.014997759833931923, 'sentence': 'A… Polite serving great food enjoy my time with Samira and Brian were awesome So ocean city is not pet friendly at all.', 'perplexity': 0, 'highlight_sentence_for_ai': False}, {'generated_prob': 0.01203249767422676, 'sentence': 'This is just a way to get people in.', 'perplexity': 0, 'highlight_sentence_for_ai': False}, {'generated_prob': 0.012583994306623936, 'sentence': 'I had… Save my name, email, and website in this browser for the next time I comment.', 'perplexity': 0, 'highlight_sentence_for_ai': False}, {'generated_prob': 0.0151045061647892, 'sentence': 'Δ OceanCity.com is your source for vacation information and year round sights, sounds and news from Ocean City, Maryland.', 'perplexity': 0, 'highlight_sentence_for_ai': False}, {'generated_prob': 0.0159367173910141, 'sentence': 'If you are a local business and want to be seen by millions, contact us about opportunities on OceanCity.com.', 'perplexity': 0, 'highlight_sentence_for_ai': False}, {'generated_prob': 0.04815405234694481, 'sentence': '© 2000 - 2023 · STATE VENTURES, LLC · PRIVACY · ANNAPOLIS, MD · COLLEGE PARK, MD · MARYLAND', 'perplexity': 0, 'highlight_sentence_for_ai': False}], 'paragraphs': [{'start_sentence_index': 0, 'num_sentences': 16, 'completely_generated_prob': 3.4496480286678e-14}], 'completely_generated_prob': 0.03751552122182913, 'class_probabilities': {'human': 0.9622006644706045, 'ai': 0.03751552122182913, 'mixed': 0.00028381430756647936}, 'average_generated_prob': 0, 'predicted_class': 'human', 'confidence_score': 0.9622006644706045, 'confidence_category': 'high', 'confidence_scores_raw': {'identity': {'ai': 0.03751552122182913, 'human': 0.9622006644706045, 'mixed': 0.00028381430756647936}}, 'confidence_thresholds_raw': {'identity': {'ai': {'reject': 0.65, 'low': 0.75, 'medium': 0.92}, 'human': {'reject': 0.7, 'low': 0.82, 'medium': 0.92}, 'mixed': {'reject': 0.7, 'low': 0.8, 'medium': 0.88}}}, 'overall_burstiness': 0, 'writing_stats': {}, 'subclass': {'ai': {}, 'human': {}, 'mixed': {}}, 'result_message': 'Our detector is highly confident that the text is written entirely by a human.', 'document_classification': 'HUMAN_ONLY', 'version': '2025-01-09-base', 'language': 'en', 'pageNumber': 0, 'inputText': 'On the Beach & Boardwalk.View our 360 Virtual tours and live webcams. Search by price & book you stay South African lobster tail, whole lobsters, and Certified Angus Beef® steaks prepared perfectly. Visit captainstableoc.com Downtown waterfront dining and entertainment overlooking the bay at the end of the bridge. Visit https://www.angleroc.net/ View our coupons & deals section for savings. View available offers for Ocean City activites, restaurants, and shops. May 22, 2024 at 6:30pm 2 hour sunset cruise with 2 local craft beers. only $40! July 4th, 2024 Celebrate Independence Day at the Beach! Only comment I really have is that the Air Show is way too late this year. Students heading back to… Well I think it’s ridiculous that bikes, dogs, skateboards, scooters, etc are not allowed year round on your boardwalk. A… Polite serving great food enjoy my time with Samira and Brian were awesome So ocean city is not pet friendly at all. This is just a way to get people in. I had… Save my name, email, and website in this browser for the next time I comment. Δ OceanCity.com is your source for vacation information and year round sights, sounds and news from Ocean City, Maryland. If you are a local business and want to be seen by millions, contact us about opportunities on OceanCity.com. © 2000 - 2023 · STATE VENTURES, LLC · PRIVACY · ANNAPOLIS, MD · COLLEGE PARK, MD · MARYLAND'}]"
