File,version,documents
NC_2023_006806373d8c76eaaccb7ae0f6cf0954.html.gz,2025-01-09-base,"[{'sentences': [{'generated_prob': 0.007146070711314678, 'sentence': 'Harnett County deputies, Erwin police and volunteers combed through the woods and Cape Fear River area around Bunnlevel Erwin Road in search of a runaway foster child Thursday morning.', 'perplexity': 0, 'highlight_sentence_for_ai': False}, {'generated_prob': 0.005734264850616455, 'sentence': 'Harnett County Sheriff Wayne Coats said that 14-year-old Destiny Swift of the Sanford area exited a car on Bunnlevel Erwin Road, near Roosevelt Road, and disappeared into the woods.', 'perplexity': 0, 'highlight_sentence_for_ai': False}, {'generated_prob': 0.007387011777609587, 'sentence': 'A search with K9s ensued, but Swift was not found.', 'perplexity': 0, 'highlight_sentence_for_ai': False}, {'generated_prob': 0.002204741584137082, 'sentence': 'Javascript is required for you to be able to read premium content.', 'perplexity': 0, 'highlight_sentence_for_ai': False}, {'generated_prob': 0.002437862101942301, 'sentence': 'Please enable it in your browser settings.', 'perplexity': 0, 'highlight_sentence_for_ai': False}, {'generated_prob': 0.0033490632195025682, 'sentence': 'Robert Jordan can be reached at rjordan@mydailyrecord.com or 910-230-2037.', 'perplexity': 0, 'highlight_sentence_for_ai': False}, {'generated_prob': 0.0026681977324187756, 'sentence': 'Log In Keep it Clean.', 'perplexity': 0, 'highlight_sentence_for_ai': False}, {'generated_prob': 0.0016197074437513947, 'sentence': 'Please avoid obscene, vulgar, lewd, racist or sexually-oriented language.', 'perplexity': 0, 'highlight_sentence_for_ai': False}, {'generated_prob': 0.0034317118115723133, 'sentence': 'PLEASE TURN OFF YOUR CAPS LOCK.', 'perplexity': 0, 'highlight_sentence_for_ai': False}, {'generated_prob': 0.003658268367871642, 'sentence': ""Don't Threaten."", 'perplexity': 0, 'highlight_sentence_for_ai': False}, {'generated_prob': 0.0019690266344696283, 'sentence': 'Threats of harming another person will not be tolerated.', 'perplexity': 0, 'highlight_sentence_for_ai': False}, {'generated_prob': 0.0029681515879929066, 'sentence': 'Be Truthful.', 'perplexity': 0, 'highlight_sentence_for_ai': False}, {'generated_prob': 0.0025613131001591682, 'sentence': ""Don't knowingly lie about anyone or anything."", 'perplexity': 0, 'highlight_sentence_for_ai': False}, {'generated_prob': 0.0021138987503945827, 'sentence': 'Be Nice.', 'perplexity': 0, 'highlight_sentence_for_ai': False}, {'generated_prob': 0.002452230080962181, 'sentence': 'No racism, sexism or any sort of -ism that is degrading to another person.', 'perplexity': 0, 'highlight_sentence_for_ai': False}, {'generated_prob': 0.002842760644853115, 'sentence': 'Be Proactive.', 'perplexity': 0, 'highlight_sentence_for_ai': False}, {'generated_prob': 0.0041765570640563965, 'sentence': ""Use the 'Report' link on each comment to let us know of abusive posts."", 'perplexity': 0, 'highlight_sentence_for_ai': False}, {'generated_prob': 0.005597412586212158, 'sentence': 'Share with Us.', 'perplexity': 0, 'highlight_sentence_for_ai': False}, {'generated_prob': 0.005137217231094837, 'sentence': ""We'd love to hear eyewitness accounts, the history behind an article."", 'perplexity': 0, 'highlight_sentence_for_ai': False}, {'generated_prob': 0.008495465852320194, 'sentence': 'Your browser is out of date and potentially vulnerable to security risks.We recommend switching to one of the following browsers: Account processing issue - the email address may already exist Thank you.', 'perplexity': 0, 'highlight_sentence_for_ai': False}, {'generated_prob': 0.0069864289835095406, 'sentence': 'Your account has been registered, and you are now logged in.', 'perplexity': 0, 'highlight_sentence_for_ai': False}, {'generated_prob': 0.008664445020258427, 'sentence': 'Check your email for details.', 'perplexity': 0, 'highlight_sentence_for_ai': False}, {'generated_prob': 0.00719575397670269, 'sentence': 'Invalid password or account does not exist Submitting this form below will send a message to your email with a link to change your password.', 'perplexity': 0, 'highlight_sentence_for_ai': False}, {'generated_prob': 0.007835889235138893, 'sentence': 'An email message containing instructions on how to reset your password has been sent to the email address listed on your account.', 'perplexity': 0, 'highlight_sentence_for_ai': False}, {'generated_prob': 0.011322347447276115, 'sentence': 'No promotional rates found.', 'perplexity': 0, 'highlight_sentence_for_ai': False}, {'generated_prob': 0.008446790277957916, 'sentence': 'Secure & Encrypted Secure transaction.', 'perplexity': 0, 'highlight_sentence_for_ai': False}, {'generated_prob': 0.007118516135960817, 'sentence': 'Secure transaction.', 'perplexity': 0, 'highlight_sentence_for_ai': False}, {'generated_prob': 0.009418844245374203, 'sentence': 'Cancel anytime.', 'perplexity': 0, 'highlight_sentence_for_ai': False}, {'generated_prob': 0.009590917266905308, 'sentence': 'Thank you.', 'perplexity': 0, 'highlight_sentence_for_ai': False}, {'generated_prob': 0.008342111483216286, 'sentence': 'Your gift purchase was successful!', 'perplexity': 0, 'highlight_sentence_for_ai': False}, {'generated_prob': 0.010190059430897236, 'sentence': 'Your purchase was successful, and you are now logged in.', 'perplexity': 0, 'highlight_sentence_for_ai': False}, {'generated_prob': 0.014335641637444496, 'sentence': 'A receipt was sent to your email.', 'perplexity': 0, 'highlight_sentence_for_ai': False}], 'paragraphs': [{'start_sentence_index': 0, 'num_sentences': 32, 'completely_generated_prob': 2.402550696571401e-28}], 'completely_generated_prob': 0.021596770642208402, 'class_probabilities': {'human': 0.9781216349765232, 'ai': 0.021596770642208402, 'mixed': 0.00028159438126836863}, 'average_generated_prob': 0, 'predicted_class': 'human', 'confidence_score': 0.9781216349765232, 'confidence_category': 'high', 'confidence_scores_raw': {'identity': {'ai': 0.021596770642208402, 'human': 0.9781216349765232, 'mixed': 0.00028159438126836863}}, 'confidence_thresholds_raw': {'identity': {'ai': {'reject': 0.65, 'low': 0.75, 'medium': 0.92}, 'human': {'reject': 0.7, 'low': 0.82, 'medium': 0.92}, 'mixed': {'reject': 0.7, 'low': 0.8, 'medium': 0.88}}}, 'overall_burstiness': 0, 'writing_stats': {}, 'subclass': {'ai': {}, 'human': {}, 'mixed': {}}, 'result_message': 'Our detector is highly confident that the text is written entirely by a human.', 'document_classification': 'HUMAN_ONLY', 'version': '2025-01-09-base', 'language': 'en', 'pageNumber': 0, 'inputText': ""Harnett County deputies, Erwin police and volunteers combed through the woods and Cape Fear River area around Bunnlevel Erwin Road in search of a runaway foster child Thursday morning. Harnett County Sheriff Wayne Coats said that 14-year-old Destiny Swift of the Sanford area exited a car on Bunnlevel Erwin Road, near Roosevelt Road, and disappeared into the woods. A search with K9s ensued, but Swift was not found. Javascript is required for you to be able to read premium content. Please enable it in your browser settings. Robert Jordan can be reached at rjordan@mydailyrecord.com or 910-230-2037. Log In Keep it Clean. Please avoid obscene, vulgar, lewd, racist or sexually-oriented language. PLEASE TURN OFF YOUR CAPS LOCK. Don't Threaten. Threats of harming another person will not be tolerated. Be Truthful. Don't knowingly lie about anyone or anything. Be Nice. No racism, sexism or any sort of -ism that is degrading to another person. Be Proactive. Use the 'Report' link on each comment to let us know of abusive posts. Share with Us. We'd love to hear eyewitness accounts, the history behind an article. Your browser is out of date and potentially vulnerable to security risks.We recommend switching to one of the following browsers: Account processing issue - the email address may already exist Thank you . Your account has been registered, and you are now logged in. Check your email for details. Invalid password or account does not exist Submitting this form below will send a message to your email with a link to change your password. An email message containing instructions on how to reset your password has been sent to the email address listed on your account. No promotional rates found. Secure & Encrypted Secure transaction. Secure transaction. Cancel anytime. Thank you. Your gift purchase was successful! Your purchase was successful, and you are now logged in. A receipt was sent to your email.""}]"
NC_2023_00ddc64e4034ce1b14f2ccdd9ecec276.html.gz,2025-01-09-base,"[{'sentences': [{'generated_prob': 0.010534494183957577, 'sentence': 'CHARLESTON ᅳ Charleston Southern Athletics has announced inductees for its Hall of Fame Class of 2024.', 'perplexity': 0, 'highlight_sentence_for_ai': False}, {'generated_prob': 0.008712849579751492, 'sentence': 'The group features three former student… The arrival of summer means many are planning for vacations.', 'perplexity': 0, 'highlight_sentence_for_ai': False}, {'generated_prob': 0.009059298783540726, 'sentence': 'For those looking to expand their horizons and truly get ""away from it all,"" they… An outdoor appreciation event for Yadkin County School personnel is planned as a thank you for local teachers and staff.', 'perplexity': 0, 'highlight_sentence_for_ai': False}, {'generated_prob': 0.010942863300442696, 'sentence': ""Pack the Park is sche… The Starmount soccer team took on Queen's Grant High School on May 13 in a playoff game."", 'perplexity': 0, 'highlight_sentence_for_ai': False}, {'generated_prob': 0.00761568546295166, 'sentence': 'The team loss 6-1.', 'perplexity': 0, 'highlight_sentence_for_ai': False}, {'generated_prob': 0.011742645874619484, 'sentence': 'Forbush closed out its season on Wednesday in the third round of the NCHSAA state 2A playoffs with a 2-0 loss to North Stanly.', 'perplexity': 0, 'highlight_sentence_for_ai': False}, {'generated_prob': 0.010423648171126842, 'sentence': ""The Falcons end… As is tradition, wine festival weekend in Elkin kicked off on May 17 with the Hugh Chatham Health Foundation's annual fundraising gala."", 'perplexity': 0, 'highlight_sentence_for_ai': False}, {'generated_prob': 0.0028313416987657547, 'sentence': ""This y… Send community and church events to trieditor@elkintribune.com by Monday at noon for the same week's edition for publication in The Yadkin Rip… Harrison kburns@yadkinripple.com Area veterans and supporters gathered on a rainy Memorial Day in Hamptonville to recognize t… East Wilkes Lady Cardinals are headed to play in the 1A NCHSAA State Championship in softbal… The Lady Elk's Track & Field Team won the Northwest 1A Conference Championship on May 2.… Scattered thunderstorms developing during the afternoon."", 'perplexity': 0, 'highlight_sentence_for_ai': False}, {'generated_prob': 0.004272621124982834, 'sentence': 'High 76F.', 'perplexity': 0, 'highlight_sentence_for_ai': False}, {'generated_prob': 0.004708557389676571, 'sentence': 'Winds SSW at 5 to 10 mph.', 'perplexity': 0, 'highlight_sentence_for_ai': False}, {'generated_prob': 0.0033310353755950928, 'sentence': 'Chance of rain 40%.', 'perplexity': 0, 'highlight_sentence_for_ai': False}, {'generated_prob': 0.002949449699372053, 'sentence': 'Scattered thunderstorms in the evening, with mostly cloudy skies overnight.', 'perplexity': 0, 'highlight_sentence_for_ai': False}, {'generated_prob': 0.0043616159819066525, 'sentence': 'Low 62F.', 'perplexity': 0, 'highlight_sentence_for_ai': False}, {'generated_prob': 0.003244689665734768, 'sentence': 'Winds light and variable.', 'perplexity': 0, 'highlight_sentence_for_ai': False}, {'generated_prob': 0.0032655131071805954, 'sentence': 'Chance of rain 40%.', 'perplexity': 0, 'highlight_sentence_for_ai': False}, {'generated_prob': 0.0036643617786467075, 'sentence': 'Sunshine and clouds mixed.', 'perplexity': 0, 'highlight_sentence_for_ai': False}, {'generated_prob': 0.0041549718007445335, 'sentence': 'A stray shower or thunderstorm is possible.', 'perplexity': 0, 'highlight_sentence_for_ai': False}, {'generated_prob': 0.0035299183800816536, 'sentence': 'High 82F.', 'perplexity': 0, 'highlight_sentence_for_ai': False}, {'generated_prob': 0.0031028930097818375, 'sentence': 'Winds light and variable.', 'perplexity': 0, 'highlight_sentence_for_ai': False}, {'generated_prob': 0.0027624694630503654, 'sentence': 'By Kitsey Burns Harrison kburns Kitsey Burns Harrison | The Yadkin Ripple Kitsey Burns Harrison | The Tribune Kitsey Burns Harrison | The Yadkin Ripple Your browser is out of date and potentially vulnerable to security risks.We recommend switching to one of the following browsers:', 'perplexity': 0, 'highlight_sentence_for_ai': False}], 'paragraphs': [{'start_sentence_index': 0, 'num_sentences': 20, 'completely_generated_prob': 1.0446359549956209e-17}], 'completely_generated_prob': 0.03483077260757957, 'class_probabilities': {'human': 0.9651284621953693, 'ai': 0.03483077260757957, 'mixed': 4.07651970510046e-05}, 'average_generated_prob': 0, 'predicted_class': 'human', 'confidence_score': 0.9651284621953693, 'confidence_category': 'high', 'confidence_scores_raw': {'identity': {'ai': 0.03483077260757957, 'human': 0.9651284621953693, 'mixed': 4.07651970510046e-05}}, 'confidence_thresholds_raw': {'identity': {'ai': {'reject': 0.65, 'low': 0.75, 'medium': 0.92}, 'human': {'reject': 0.7, 'low': 0.82, 'medium': 0.92}, 'mixed': {'reject': 0.7, 'low': 0.8, 'medium': 0.88}}}, 'overall_burstiness': 0, 'writing_stats': {}, 'subclass': {'ai': {}, 'human': {}, 'mixed': {}}, 'result_message': 'Our detector is highly confident that the text is written entirely by a human.', 'document_classification': 'HUMAN_ONLY', 'version': '2025-01-09-base', 'language': 'en', 'pageNumber': 0, 'inputText': 'CHARLESTON — Charleston Southern Athletics has announced inductees for its Hall of Fame Class of 2024. The group features three former student… The arrival of summer means many are planning for vacations. For those looking to expand their horizons and truly get ""away from it all,"" they… An outdoor appreciation event for Yadkin County School personnel is planned as a thank you for local teachers and staff. Pack the Park is sche… The Starmount soccer team took on Queen\'s Grant High School on May 13 in a playoff game. The team loss 6-1. Forbush closed out its season on Wednesday in the third round of the NCHSAA state 2A playoffs with a 2-0 loss to North Stanly. The Falcons end… As is tradition, wine festival weekend in Elkin kicked off on May 17 with the Hugh Chatham Health Foundation’s annual fundraising gala. This y… Send community and church events to trieditor@elkintribune.com by Monday at noon for the same week’s edition for publication in The Yadkin Rip… Harrison kburns@yadkinripple.com Area veterans and supporters gathered on a rainy Memorial Day in Hamptonville to recognize t… East Wilkes Lady Cardinals are headed to play in the 1A NCHSAA State Championship in softbal… The Lady Elk’s Track & Field Team won the Northwest 1A Conference Championship on May 2.… Scattered thunderstorms developing during the afternoon. High 76F. Winds SSW at 5 to 10 mph. Chance of rain 40%. Scattered thunderstorms in the evening, with mostly cloudy skies overnight. Low 62F. Winds light and variable. Chance of rain 40%. Sunshine and clouds mixed. A stray shower or thunderstorm is possible. High 82F. Winds light and variable. By Kitsey Burns Harrison kburns Kitsey Burns Harrison | The Yadkin Ripple Kitsey Burns Harrison | The Tribune Kitsey Burns Harrison | The Yadkin Ripple Your browser is out of date and potentially vulnerable to security risks.We recommend switching to one of the following browsers:'}]"
NC_2023_015fdf9dea46b84448b4530121a5c6b2.html.gz,2025-01-09-base,"[{'sentences': [{'generated_prob': 0.009320935234427452, 'sentence': 'Cloudy with occasional rain showers.', 'perplexity': 0, 'highlight_sentence_for_ai': False}, {'generated_prob': 0.006146538536995649, 'sentence': 'High 72F.', 'perplexity': 0, 'highlight_sentence_for_ai': False}, {'generated_prob': 0.018673915416002274, 'sentence': 'Winds light and variable.', 'perplexity': 0, 'highlight_sentence_for_ai': False}, {'generated_prob': 0.00888138823211193, 'sentence': 'Chance of rain 60%.. Mostly cloudy.', 'perplexity': 0, 'highlight_sentence_for_ai': False}, {'generated_prob': 0.010631388053297997, 'sentence': 'Slight chance of a rain shower.', 'perplexity': 0, 'highlight_sentence_for_ai': False}, {'generated_prob': 0.013496977277100086, 'sentence': 'Low 61F.', 'perplexity': 0, 'highlight_sentence_for_ai': False}, {'generated_prob': 0.009304993785917759, 'sentence': 'Winds light and variable.', 'perplexity': 0, 'highlight_sentence_for_ai': False}, {'generated_prob': 0.007428405340760946, 'sentence': 'Updated: June 2, 2024 @ 1:58 am The Memorial Day and the Fourth of July holidays serve to honor the men and women who died while serving the United States military and the establishment of the country respectively.', 'perplexity': 0, 'highlight_sentence_for_ai': False}, {'generated_prob': 0.006764356512576342, 'sentence': 'Memorial Day marks the “unofficial” beginning of the summer season, which also means the beginning of more wi… The N.C. Wildlife Resources Commission will open 32 trout streams and two lakes classified as Delayed Harvest to trout harvest on June 1 through Sept. 30.', 'perplexity': 0, 'highlight_sentence_for_ai': False}, {'generated_prob': 0.004922016058117151, 'sentence': ""Heidi Hudson's freshman season and Western Carolina's outdoor track and field season came to an end Saturday at the NCAA East First Round hosted by Kentucky."", 'perplexity': 0, 'highlight_sentence_for_ai': False}, {'generated_prob': 0.007610764354467392, 'sentence': 'Smoky Mountain representatives on the All-Mountain Seven Conference softball team are, from left: Abby Branning, Addie Mull and Kaitlyn Tahquette.', 'perplexity': 0, 'highlight_sentence_for_ai': False}, {'generated_prob': 0.01080351322889328, 'sentence': 'Carl Adams, 87, of Locust Creek, Sylva, passed away peacefully… Ellen Yvonne Weidman Mathews died on May 25, 2024, peacefully … Amy Leigh Monroe of New York City, and formerly of Sylva, N.C.… Mrs. Irene Kelly Tolley Davis, age 90, of Clover, S.C., passed… Peggy Painter Revis, age 92, of Sylva, passed away May 22, 2024.', 'perplexity': 0, 'highlight_sentence_for_ai': False}, {'generated_prob': 0.07846099883317947, 'sentence': ""IRA's benefits lauded Consider volunteering at the animal shelter We need to exercise our electoral muscles wisely; consider the stakes A simple, joyful response to Sylva's Pride decision Keep Webster's post office open Keep options alive for our schoolchildren Let's talk about what is morally right Franklin's words on libraries ring true right here Growing old ain't what it used to be Two sessions of Jackson County District Court were held last week at the Justice Center with Judge Mack Brittain presiding."", 'perplexity': 0, 'highlight_sentence_for_ai': False}, {'generated_prob': 0.03615672513842583, 'sentence': ""The following persons were arrested by the Jackson County Sheriff's Office between May 20 and 26."", 'perplexity': 0, 'highlight_sentence_for_ai': False}, {'generated_prob': 0.04084673896431923, 'sentence': ""The following persons were arrested by the Jackson County Sheriff's Office between May 13 and 19."", 'perplexity': 0, 'highlight_sentence_for_ai': False}, {'generated_prob': 0.00693374453112483, 'sentence': 'Sorry, there are no recent results for popular images.', 'perplexity': 0, 'highlight_sentence_for_ai': False}, {'generated_prob': 0.008016104809939861, 'sentence': 'Sorry, there are no recent results for popular videos.', 'perplexity': 0, 'highlight_sentence_for_ai': False}, {'generated_prob': 0.011470404453575611, 'sentence': 'Sorry, there are no recent results for popular commented articles.', 'perplexity': 0, 'highlight_sentence_for_ai': False}, {'generated_prob': 0.009281963109970093, 'sentence': 'Success!', 'perplexity': 0, 'highlight_sentence_for_ai': False}, {'generated_prob': 0.012743556872010231, 'sentence': 'An email has been sent to with a link to confirm list signup.', 'perplexity': 0, 'highlight_sentence_for_ai': False}, {'generated_prob': 0.02197706513106823, 'sentence': 'Error!', 'perplexity': 0, 'highlight_sentence_for_ai': False}, {'generated_prob': 0.022931048646569252, 'sentence': 'There was an error processing your request.', 'perplexity': 0, 'highlight_sentence_for_ai': False}, {'generated_prob': 0.014730744995176792, 'sentence': 'Would you like to receive breaking sports news alerts?', 'perplexity': 0, 'highlight_sentence_for_ai': False}, {'generated_prob': 0.016997268423438072, 'sentence': 'Signup today!', 'perplexity': 0, 'highlight_sentence_for_ai': False}, {'generated_prob': 0.01829690858721733, 'sentence': 'Would you like to receive breaking news alerts?', 'perplexity': 0, 'highlight_sentence_for_ai': False}, {'generated_prob': 0.020296217873692513, 'sentence': 'Signup today!', 'perplexity': 0, 'highlight_sentence_for_ai': False}, {'generated_prob': 0.011691974475979805, 'sentence': 'Would you like to receive weekly headlines?', 'perplexity': 0, 'highlight_sentence_for_ai': False}, {'generated_prob': 0.01701734960079193, 'sentence': 'Signup today!', 'perplexity': 0, 'highlight_sentence_for_ai': False}, {'generated_prob': 0.02180064097046852, 'sentence': 'Your browser is out of date and potentially vulnerable to security risks.We recommend switching to one of the following browsers:', 'perplexity': 0, 'highlight_sentence_for_ai': False}], 'paragraphs': [{'start_sentence_index': 0, 'num_sentences': 29, 'completely_generated_prob': 1.1173676947417224e-25}], 'completely_generated_prob': 0.0261024689270432, 'class_probabilities': {'human': 0.9731394009119056, 'ai': 0.0261024689270432, 'mixed': 0.0007581301610510362}, 'average_generated_prob': 0, 'predicted_class': 'human', 'confidence_score': 0.9731394009119056, 'confidence_category': 'high', 'confidence_scores_raw': {'identity': {'ai': 0.0261024689270432, 'human': 0.9731394009119056, 'mixed': 0.0007581301610510362}}, 'confidence_thresholds_raw': {'identity': {'ai': {'reject': 0.65, 'low': 0.75, 'medium': 0.92}, 'human': {'reject': 0.7, 'low': 0.82, 'medium': 0.92}, 'mixed': {'reject': 0.7, 'low': 0.8, 'medium': 0.88}}}, 'overall_burstiness': 0, 'writing_stats': {}, 'subclass': {'ai': {}, 'human': {}, 'mixed': {}}, 'result_message': 'Our detector is highly confident that the text is written entirely by a human.', 'document_classification': 'HUMAN_ONLY', 'version': '2025-01-09-base', 'language': 'en', 'pageNumber': 0, 'inputText': 'Cloudy with occasional rain showers. High 72F. Winds light and variable. Chance of rain 60%.. Mostly cloudy. Slight chance of a rain shower. Low 61F. Winds light and variable. Updated: June 2, 2024 @ 1:58 am The Memorial Day and the Fourth of July holidays serve to honor the men and women who died while serving the United States military and the establishment of the country respectively. Memorial Day marks the “unofficial” beginning of the summer season, which also means the beginning of more wi… The N.C. Wildlife Resources Commission will open 32 trout streams and two lakes classified as Delayed Harvest to trout harvest on June 1 through Sept. 30. Heidi Hudson’s freshman season and Western Carolina’s outdoor track and field season came to an end Saturday at the NCAA East First Round hosted by Kentucky. Smoky Mountain representatives on the All-Mountain Seven Conference softball team are, from left: Abby Branning, Addie Mull and Kaitlyn Tahquette. Carl Adams, 87, of Locust Creek, Sylva, passed away peacefully… Ellen Yvonne Weidman Mathews died on May 25, 2024, peacefully … Amy Leigh Monroe of New York City, and formerly of Sylva, N.C.… Mrs. Irene Kelly Tolley Davis, age 90, of Clover, S.C., passed… Peggy Painter Revis, age 92, of Sylva, passed away May 22, 2024. IRA’s benefits lauded Consider volunteering at the animal shelter We need to exercise our electoral muscles wisely; consider the stakes A simple, joyful response to Sylva’s Pride decision Keep Webster’s post office open Keep options alive for our schoolchildren Let’s talk about what is morally right Franklin’s words on libraries ring true right here Growing old ain’t what it used to be Two sessions of Jackson County District Court were held last week at the Justice Center with Judge Mack Brittain presiding. The following persons were arrested by the Jackson County Sheriff’s Office between May 20 and 26. The following persons were arrested by the Jackson County Sheriff’s Office between May 13 and 19. Sorry, there are no recent results for popular images. Sorry, there are no recent results for popular videos. Sorry, there are no recent results for popular commented articles. Success! An email has been sent to with a link to confirm list signup. Error! There was an error processing your request. Would you like to receive breaking sports news alerts? Signup today! Would you like to receive breaking news alerts? Signup today! Would you like to receive weekly headlines? Signup today! Your browser is out of date and potentially vulnerable to security risks.We recommend switching to one of the following browsers:'}]"
