File,version,documents
CT_2023_541836831f393abedf84d2ea25dc0125.html.gz,2025-01-09-base,"[{'sentences': [{'generated_prob': 2.148988096450921e-05, 'sentence': 'A prolonged decline in male fertility in the form of sperm concentrations appears to be connected to the use of pesticides, according to a study published Wednesday.', 'perplexity': 0, 'highlight_sentence_for_ai': False}, {'generated_prob': 2.3845819669077173e-05, 'sentence': 'Researchers compiled, rated and reviewed the results of 25 studies of certain pesticides and male fertility and found that men who had been exposed to certain classes of pesticides had significantly lower sperm concentrations.', 'perplexity': 0, 'highlight_sentence_for_ai': False}, {'generated_prob': 2.419314841972664e-05, 'sentence': 'The study, published Wednesday in Environmental Health Perspectives, included data from more than 1,700 men and spanned several decades.', 'perplexity': 0, 'highlight_sentence_for_ai': False}, {'generated_prob': 1.9495320884743705e-05, 'sentence': 'Free 24/7 Connecticut news stream: Watch NBC CT wherever you are “No matter how we looked at the analysis and results, we saw a persistent association between increasing levels of insecticide and decreases in sperm concentration,” said study author Melissa Perry, who is an environmental epidemiologist and the dean of the College of Public Health at George Mason University.', 'perplexity': 0, 'highlight_sentence_for_ai': False}, {'generated_prob': 1.939540743478574e-05, 'sentence': '“I would hope this study would get the attention of regulators seeking to make decisions to keep the public safe from inadvertent, unplanned impacts of insecticides.” For decades, scientists have been trying to untangle puzzling questions over male fertility.', 'perplexity': 0, 'highlight_sentence_for_ai': False}, {'generated_prob': 2.170023617509287e-05, 'sentence': 'Sperm concentrations are one of several factors that are a useful indicator.', 'perplexity': 0, 'highlight_sentence_for_ai': False}, {'generated_prob': 3.4042961488012224e-05, 'sentence': 'A report last year found that sperm counts were falling in every region of the globe and the pace of that decline was accelerating.', 'perplexity': 0, 'highlight_sentence_for_ai': False}, {'generated_prob': 2.9956774596939795e-05, 'sentence': 'Read the full story on NBCNews.com.', 'perplexity': 0, 'highlight_sentence_for_ai': False}], 'paragraphs': [{'start_sentence_index': 0, 'num_sentences': 8, 'completely_generated_prob': 3.002405151306975e-07}], 'completely_generated_prob': 0, 'class_probabilities': {'human': 1, 'ai': 0, 'mixed': 0}, 'average_generated_prob': 0, 'predicted_class': 'human', 'confidence_score': 1, 'confidence_category': 'high', 'confidence_scores_raw': {'identity': {'ai': 0, 'human': 1, 'mixed': 0}}, 'confidence_thresholds_raw': {'identity': {'ai': {'reject': 0.65, 'low': 0.75, 'medium': 0.92}, 'human': {'reject': 0.7, 'low': 0.82, 'medium': 0.92}, 'mixed': {'reject': 0.7, 'low': 0.8, 'medium': 0.88}}}, 'overall_burstiness': 0, 'writing_stats': {}, 'subclass': {'ai': {}, 'human': {}, 'mixed': {}}, 'result_message': 'Our detector is highly confident that the text is written entirely by a human.', 'document_classification': 'HUMAN_ONLY', 'version': '2025-01-09-base', 'language': 'en', 'pageNumber': 0, 'inputText': 'A prolonged decline in male fertility in the form of sperm concentrations appears to be connected to the use of pesticides, according to a study published Wednesday. Researchers compiled, rated and reviewed the results of 25 studies of certain pesticides and male fertility and found that men who had been exposed to certain classes of pesticides had significantly lower sperm concentrations. The study, published Wednesday in Environmental Health Perspectives, included data from more than 1,700 men and spanned several decades. Free 24/7 Connecticut news stream: Watch NBC CT wherever you are “No matter how we looked at the analysis and results, we saw a persistent association between increasing levels of insecticide and decreases in sperm concentration,” said study author Melissa Perry, who is an environmental epidemiologist and the dean of the College of Public Health at George Mason University. “I would hope this study would get the attention of regulators seeking to make decisions to keep the public safe from inadvertent, unplanned impacts of insecticides.” For decades, scientists have been trying to untangle puzzling questions over male fertility. Sperm concentrations are one of several factors that are a useful indicator. A report last year found that sperm counts were falling in every region of the globe and the pace of that decline was accelerating. Read the full story on NBCNews.com.'}]"
CT_2023_82a2167798eb431882d2c498a0ebc438.html.gz,2025-01-09-base,"[{'sentences': [{'generated_prob': 0.0004821993934456259, 'sentence': 'WTNH.com Please enter a search term.', 'perplexity': 0, 'highlight_sentence_for_ai': False}, {'generated_prob': 0.0006326717557385564, 'sentence': 'Please enter a search term.', 'perplexity': 0, 'highlight_sentence_for_ai': False}, {'generated_prob': 0.0005560207646340132, 'sentence': 'Posted: Dec 14, 2023 / 05:49 AM EST Updated: Dec 15, 2023 / 03:26 AM EST Posted: Dec 14, 2023 / 05:49 AM EST Updated: Dec 15, 2023 / 03:26 AM EST NEW HAVEN, Conn. (WTNH) - When Tooka gets home from school, she runs into the outstretched arms of her Uncle Mike.', 'perplexity': 0, 'highlight_sentence_for_ai': False}, {'generated_prob': 0.00022332870867103338, 'sentence': '“I missed you!” she cried.', 'perplexity': 0, 'highlight_sentence_for_ai': False}, {'generated_prob': 0.00036560476291924715, 'sentence': ""He's been a constant in her life for the past four years…a constant since this long-time police officer saved the girl's life."", 'perplexity': 0, 'highlight_sentence_for_ai': False}, {'generated_prob': 0.00022715420345775783, 'sentence': ""“They call her Tooka but not for me - it's little angel,” said Det."", 'perplexity': 0, 'highlight_sentence_for_ai': False}, {'generated_prob': 0.00026126584270969033, 'sentence': 'Michael Harton of the North Haven Police Department.', 'perplexity': 0, 'highlight_sentence_for_ai': False}, {'generated_prob': 0.00019109614368062466, 'sentence': 'Tooka, born prematurely, was with her mom, Nikki Huckaby, at the movie theater in North Haven when she was just a few months old.', 'perplexity': 0, 'highlight_sentence_for_ai': False}, {'generated_prob': 0.00027074082754552364, 'sentence': ""“I went to pick her up when the movie was over, and I realized she wasn't breathing,” said Huckaby."", 'perplexity': 0, 'highlight_sentence_for_ai': False}, {'generated_prob': 0.0001731446827761829, 'sentence': ""“I was like, 'Oh my God,' I was hysterical.” “I see Nicole running towards me with a little angel in her arms,” said Harton, who just happened to be watching over the theater that night."", 'perplexity': 0, 'highlight_sentence_for_ai': False}, {'generated_prob': 0.00017469906015321612, 'sentence': 'Dramatic video - never before released to the public - shows Harton spring into action.', 'perplexity': 0, 'highlight_sentence_for_ai': False}, {'generated_prob': 0.00021228627883829176, 'sentence': '“I grabbed her and tried to revive her as much as I could, and she just went limp on me,” he remembered.', 'perplexity': 0, 'highlight_sentence_for_ai': False}, {'generated_prob': 0.0002588327624835074, 'sentence': 'The certified EMT had never worked on a baby so small.', 'perplexity': 0, 'highlight_sentence_for_ai': False}, {'generated_prob': 0.00022769003408029675, 'sentence': 'Tooka was under fifteen pounds.', 'perplexity': 0, 'highlight_sentence_for_ai': False}, {'generated_prob': 0.00022217544028535485, 'sentence': '“The training kicked in.', 'perplexity': 0, 'highlight_sentence_for_ai': False}, {'generated_prob': 0.00017065933207049966, 'sentence': 'I was petrified, nervous,” said Harton.', 'perplexity': 0, 'highlight_sentence_for_ai': False}, {'generated_prob': 0.00025424003251828253, 'sentence': ""He performed the Heimlich maneuver, abdominal thrusts and back blows, techniques he'd learned for helping a choking infant."", 'perplexity': 0, 'highlight_sentence_for_ai': False}, {'generated_prob': 0.00035573088098317385, 'sentence': 'Huckaby tears up as she watches the body cam video for only the second time.', 'perplexity': 0, 'highlight_sentence_for_ai': False}, {'generated_prob': 0.00020510482136160135, 'sentence': ""“I couldn't do anything besides pray,” she said."", 'perplexity': 0, 'highlight_sentence_for_ai': False}, {'generated_prob': 0.0002206751669291407, 'sentence': 'But then, a miracle.', 'perplexity': 0, 'highlight_sentence_for_ai': False}, {'generated_prob': 0.00021834499784745276, 'sentence': 'The baby starts crying.', 'perplexity': 0, 'highlight_sentence_for_ai': False}, {'generated_prob': 0.00026877413620240986, 'sentence': '“That cry was the best thing ever,” said Harton, who believes the mucus she was choking on had begun to clear.', 'perplexity': 0, 'highlight_sentence_for_ai': False}, {'generated_prob': 0.00020409398712217808, 'sentence': '“I almost start crying myself,” he said.', 'perplexity': 0, 'highlight_sentence_for_ai': False}, {'generated_prob': 0.00031660171225667, 'sentence': 'During the emotional celebration, Harton holds Tooka close until he places her gently in the ambulance.', 'perplexity': 0, 'highlight_sentence_for_ai': False}, {'generated_prob': 0.6167145371437073, 'sentence': '“I always remember when I put her on the stretcher, she was like a little bundle of joy crying, and I was exhausted for two weeks after that,” he said.', 'perplexity': 0, 'highlight_sentence_for_ai': False}, {'generated_prob': 0.6761616468429565, 'sentence': ""But the story doesn't stop there."", 'perplexity': 0, 'highlight_sentence_for_ai': False}, {'generated_prob': 0.7294169664382935, 'sentence': ""Uncle Mike is now Tooka's godfather, showing up for her first day of school and delivering holiday presents alongside his wife, Auntie Sue."", 'perplexity': 0, 'highlight_sentence_for_ai': False}, {'generated_prob': 0.6844543814659119, 'sentence': ""“I'll be there for her graduation and wedding,” Harton said."", 'perplexity': 0, 'highlight_sentence_for_ai': False}, {'generated_prob': 0.7089710235595703, 'sentence': ""It's a moment that will always stand out in a 27-year career."", 'perplexity': 0, 'highlight_sentence_for_ai': False}, {'generated_prob': 0.7420516610145569, 'sentence': 'Now, Harton lives with a little angel by his side.', 'perplexity': 0, 'highlight_sentence_for_ai': False}, {'generated_prob': 0.6878616809844971, 'sentence': '“Unbeknownst to us, our family grew that day,” he said with emotion.', 'perplexity': 0, 'highlight_sentence_for_ai': False}, {'generated_prob': 0.8032441735267639, 'sentence': ""“Every time I see her, it's a great day.” Tooka is turning five on Friday, and Uncle Mike will be there to celebrate her birthday."", 'perplexity': 0, 'highlight_sentence_for_ai': False}, {'generated_prob': 0.14637073874473572, 'sentence': 'Copyright 2024 Nexstar Media Inc. All rights reserved.', 'perplexity': 0, 'highlight_sentence_for_ai': False}, {'generated_prob': 0.3203904330730438, 'sentence': 'This material may not be published, broadcast, rewritten, or redistributed.', 'perplexity': 0, 'highlight_sentence_for_ai': False}, {'generated_prob': 0.16549672186374664, 'sentence': 'Thanks for signing up!', 'perplexity': 0, 'highlight_sentence_for_ai': False}, {'generated_prob': 0.13233040273189545, 'sentence': 'Watch for us in your inbox.', 'perplexity': 0, 'highlight_sentence_for_ai': False}, {'generated_prob': 0.08808876574039459, 'sentence': 'Subscribe Now Thanks for signing up!', 'perplexity': 0, 'highlight_sentence_for_ai': False}, {'generated_prob': 0.08854990452528, 'sentence': 'Watch for us in your inbox.', 'perplexity': 0, 'highlight_sentence_for_ai': False}, {'generated_prob': 0.06508367508649826, 'sentence': 'Subscribe Now', 'perplexity': 0, 'highlight_sentence_for_ai': False}], 'paragraphs': [{'start_sentence_index': 0, 'num_sentences': 39, 'completely_generated_prob': 4.6411631964645186e-33}], 'completely_generated_prob': 0.07780643284428201, 'class_probabilities': {'human': 0.9203729942098717, 'ai': 0.07780643284428201, 'mixed': 0.0018205729458463018}, 'average_generated_prob': 0, 'predicted_class': 'human', 'confidence_score': 0.9203729942098717, 'confidence_category': 'high', 'confidence_scores_raw': {'identity': {'ai': 0.07780643284428201, 'human': 0.9203729942098717, 'mixed': 0.0018205729458463018}}, 'confidence_thresholds_raw': {'identity': {'ai': {'reject': 0.65, 'low': 0.75, 'medium': 0.92}, 'human': {'reject': 0.7, 'low': 0.82, 'medium': 0.92}, 'mixed': {'reject': 0.7, 'low': 0.8, 'medium': 0.88}}}, 'overall_burstiness': 0, 'writing_stats': {}, 'subclass': {'ai': {}, 'human': {}, 'mixed': {}}, 'result_message': 'Our detector is highly confident that the text is written entirely by a human.', 'document_classification': 'HUMAN_ONLY', 'version': '2025-01-09-base', 'language': 'en', 'pageNumber': 0, 'inputText': 'WTNH.com Please enter a search term. Please enter a search term. Posted: Dec 14, 2023 / 05:49 AM EST Updated: Dec 15, 2023 / 03:26 AM EST Posted: Dec 14, 2023 / 05:49 AM EST Updated: Dec 15, 2023 / 03:26 AM EST NEW HAVEN, Conn. (WTNH) – When Tooka gets home from school, she runs into the outstretched arms of her Uncle Mike. “I missed you!” she cried. He’s been a constant in her life for the past four years…a constant since this long-time police officer saved the girl’s life. “They call her Tooka but not for me – it’s little angel,” said Det. Michael Harton of the North Haven Police Department. Tooka, born prematurely, was with her mom, Nikki Huckaby, at the movie theater in North Haven when she was just a few months old. “I went to pick her up when the movie was over, and I realized she wasn’t breathing,” said Huckaby. “I was like, ‘Oh my God,’ I was hysterical.” “I see Nicole running towards me with a little angel in her arms,” said Harton, who just happened to be watching over the theater that night. Dramatic video – never before released to the public – shows Harton spring into action. “I grabbed her and tried to revive her as much as I could, and she just went limp on me,” he remembered. The certified EMT had never worked on a baby so small. Tooka was under fifteen pounds. “The training kicked in. I was petrified, nervous,” said Harton. He performed the Heimlich maneuver, abdominal thrusts and back blows, techniques he’d learned for helping a choking infant. Huckaby tears up as she watches the body cam video for only the second time. “I couldn’t do anything besides pray,” she said. But then, a miracle. The baby starts crying. “That cry was the best thing ever,” said Harton, who believes the mucus she was choking on had begun to clear. “I almost start crying myself,” he said. During the emotional celebration, Harton holds Tooka close until he places her gently in the ambulance. “I always remember when I put her on the stretcher, she was like a little bundle of joy crying, and I was exhausted for two weeks after that,” he said. But the story doesn’t stop there. Uncle Mike is now Tooka’s godfather, showing up for her first day of school and delivering holiday presents alongside his wife, Auntie Sue. “I’ll be there for her graduation and wedding,” Harton said. It’s a moment that will always stand out in a 27-year career. Now, Harton lives with a little angel by his side. “Unbeknownst to us, our family grew that day,” he said with emotion. “Every time I see her, it’s a great day.” Tooka is turning five on Friday, and Uncle Mike will be there to celebrate her birthday. Copyright 2024 Nexstar Media Inc. All rights reserved. This material may not be published, broadcast, rewritten, or redistributed. Thanks for signing up! Watch for us in your inbox. Subscribe Now Thanks for signing up! Watch for us in your inbox. Subscribe Now'}]"
CT_2023_8558de84c6b4a0dd587052bdf64cc94b.html.gz,2025-01-09-base,"[{'sentences': [{'generated_prob': 3.5776240110863e-05, 'sentence': 'Three months before the Oct. 7 terrorist attack, analysts in the Israeli military alerted their superiors to a serious threat from Hamas militants ᅳ a “plan designed to start a war.” But their concerns were dismissed by their superiors, according to an Israeli official familiar with the matter.', 'perplexity': 0, 'highlight_sentence_for_ai': False}, {'generated_prob': 3.355981971253641e-05, 'sentence': ""The incident is part of a growing body of evidence that Israeli Prime Minister Benjamin Netanyahu's government missed ᅳ or ignored ᅳ key warnings about Hamas' plans to attack the country."", 'perplexity': 0, 'highlight_sentence_for_ai': False}, {'generated_prob': 2.5273042410844937e-05, 'sentence': ""Free 24/7 Connecticut news stream: Watch NBC CT wherever you are Netanyahu, as well as Israeli military and intelligence officials, came under deeper scrutiny Thursday after The New York Times reported that Israeli authorities obtained Hamas' plans for an Oct. 7-style assault a year before it occurred."", 'perplexity': 0, 'highlight_sentence_for_ai': False}, {'generated_prob': 2.238565866719e-05, 'sentence': 'Israeli experts did not believe Hamas was capable of carrying out the attack and disregarded the step-by-step blueprint, according to the Times, which drew from documents, emails and interviews.', 'perplexity': 0, 'highlight_sentence_for_ai': False}, {'generated_prob': 2.4532098905183375e-05, 'sentence': 'More than 1,200 people died and over 200 were abducted in the attack, the worst terrorist strike in Israeli history.', 'perplexity': 0, 'highlight_sentence_for_ai': False}, {'generated_prob': 3.659252615761943e-05, 'sentence': 'NBC News has not independently confirmed the New York Times report or obtained a copy of the 40-page blueprint, which Israeli officials are said to have code-named “Jericho Wall.” Read the full story on NBC News.com here', 'perplexity': 0, 'highlight_sentence_for_ai': False}], 'paragraphs': [{'start_sentence_index': 0, 'num_sentences': 6, 'completely_generated_prob': 1.474742012248794e-05}], 'completely_generated_prob': 0.0032000700015312844, 'class_probabilities': {'human': 0.9967999299984688, 'ai': 0.0032000700015312844, 'mixed': 0}, 'average_generated_prob': 0, 'predicted_class': 'human', 'confidence_score': 0.9967999299984688, 'confidence_category': 'high', 'confidence_scores_raw': {'identity': {'ai': 0.0032000700015312844, 'human': 0.9967999299984688, 'mixed': 0}}, 'confidence_thresholds_raw': {'identity': {'ai': {'reject': 0.65, 'low': 0.75, 'medium': 0.92}, 'human': {'reject': 0.7, 'low': 0.82, 'medium': 0.92}, 'mixed': {'reject': 0.7, 'low': 0.8, 'medium': 0.88}}}, 'overall_burstiness': 0, 'writing_stats': {}, 'subclass': {'ai': {}, 'human': {}, 'mixed': {}}, 'result_message': 'Our detector is highly confident that the text is written entirely by a human.', 'document_classification': 'HUMAN_ONLY', 'version': '2025-01-09-base', 'language': 'en', 'pageNumber': 0, 'inputText': 'Three months before the Oct. 7 terrorist attack, analysts in the Israeli military alerted their superiors to a serious threat from Hamas militants — a “plan designed to start a war.” But their concerns were dismissed by their superiors, according to an Israeli official familiar with the matter. The incident is part of a growing body of evidence that Israeli Prime Minister Benjamin Netanyahu’s government missed — or ignored — key warnings about Hamas’ plans to attack the country. Free 24/7 Connecticut news stream: Watch NBC CT wherever you are Netanyahu, as well as Israeli military and intelligence officials, came under deeper scrutiny Thursday after The New York Times reported that Israeli authorities obtained Hamas’ plans for an Oct. 7-style assault a year before it occurred. Israeli experts did not believe Hamas was capable of carrying out the attack and disregarded the step-by-step blueprint, according to the Times, which drew from documents, emails and interviews. More than 1,200 people died and over 200 were abducted in the attack, the worst terrorist strike in Israeli history. NBC News has not independently confirmed the New York Times report or obtained a copy of the 40-page blueprint, which Israeli officials are said to have code-named “Jericho Wall.” Read the full story on NBC News.com here'}]"
