File,version,documents
TN_2022_090616172e4b1568efe2bd6a920fe7ba.html.gz,2025-01-09-base,"[{'sentences': [{'generated_prob': 0.00036087524495087564, 'sentence': 'WJHL | Tri-Cities News & Weather Please enter a search term.', 'perplexity': 0, 'highlight_sentence_for_ai': False}, {'generated_prob': 0.0007473400910384953, 'sentence': 'Please enter a search term.', 'perplexity': 0, 'highlight_sentence_for_ai': False}, {'generated_prob': 0.001382602727971971, 'sentence': 'by: Van Jones Posted: Jun 18, 2022 / 06:28 PM EDT Updated: Jun 18, 2022 / 07:57 PM EDT by: Van Jones Posted: Jun 18, 2022 / 06:28 PM EDT Updated: Jun 18, 2022 / 07:57 PM EDT (WJHL) Tenn./Va.', 'perplexity': 0, 'highlight_sentence_for_ai': False}, {'generated_prob': 0.0005808245041407645, 'sentence': '- Appalachian Power has released a statement regarding its response to widespread power outages caused by recent severe weather.', 'perplexity': 0, 'highlight_sentence_for_ai': False}, {'generated_prob': 0.000893283577170223, 'sentence': 'The power company states that nearly 2,400 employees and contractors are working hard to get power restored to customers.', 'perplexity': 0, 'highlight_sentence_for_ai': False}, {'generated_prob': 0.0005392590537667274, 'sentence': 'So far, power has been restored to 83,00 customers who lost power, but around 47,000 remain, according to a release from Appalachian Power.', 'perplexity': 0, 'highlight_sentence_for_ai': False}, {'generated_prob': 0.00048443549894727767, 'sentence': 'In addition, there are about 2,500 locations that need repairs made.', 'perplexity': 0, 'highlight_sentence_for_ai': False}, {'generated_prob': 0.0004064735257998109, 'sentence': '“Workers began assessing damage and making repairs yesterday evening, and this work is ongoing.', 'perplexity': 0, 'highlight_sentence_for_ai': False}, {'generated_prob': 0.0005207895301282406, 'sentence': 'Restoration times will be made available for customers this evening,” the release states.', 'perplexity': 0, 'highlight_sentence_for_ai': False}, {'generated_prob': 0.0005326956743374467, 'sentence': 'Outages peaked at around 5 p.m. on Friday with approximately 130,000 customers without power.', 'perplexity': 0, 'highlight_sentence_for_ai': False}, {'generated_prob': 0.0005800693179480731, 'sentence': ""For more information, check Appalachian Power's Outage Map."", 'perplexity': 0, 'highlight_sentence_for_ai': False}, {'generated_prob': 0.000431910710176453, 'sentence': 'Copyright 2024 Nexstar Media Inc. All rights reserved.', 'perplexity': 0, 'highlight_sentence_for_ai': False}, {'generated_prob': 0.0011558260302990675, 'sentence': 'This material may not be published, broadcast, rewritten, or redistributed.', 'perplexity': 0, 'highlight_sentence_for_ai': False}, {'generated_prob': 0.0007640508702024817, 'sentence': ""If you have the type of dad whose best friend has four legs, you're in luck when it comes to shopping for a Father's Day gift."", 'perplexity': 0, 'highlight_sentence_for_ai': False}, {'generated_prob': 0.0011124773882329464, 'sentence': 'Here are the top 10 features that can help get you more than you imagined was possible for your home.', 'perplexity': 0, 'highlight_sentence_for_ai': False}, {'generated_prob': 0.0006522339535877109, 'sentence': 'Chances are you need both dethatching and aerating to maintain a healthy lawn.', 'perplexity': 0, 'highlight_sentence_for_ai': False}, {'generated_prob': 0.00068098702467978, 'sentence': 'Learn more about what they entail and the best products to do it in this article.', 'perplexity': 0, 'highlight_sentence_for_ai': False}], 'paragraphs': [{'start_sentence_index': 0, 'num_sentences': 17, 'completely_generated_prob': 4.571217651318373e-15}], 'completely_generated_prob': 0.009180599824664711, 'class_probabilities': {'human': 0.9907801111847393, 'ai': 0.009180599824664711, 'mixed': 3.928899059593116e-05}, 'average_generated_prob': 0, 'predicted_class': 'human', 'confidence_score': 0.9907801111847393, 'confidence_category': 'high', 'confidence_scores_raw': {'identity': {'ai': 0.009180599824664711, 'human': 0.9907801111847393, 'mixed': 3.928899059593116e-05}}, 'confidence_thresholds_raw': {'identity': {'ai': {'reject': 0.65, 'low': 0.75, 'medium': 0.92}, 'human': {'reject': 0.7, 'low': 0.82, 'medium': 0.92}, 'mixed': {'reject': 0.7, 'low': 0.8, 'medium': 0.88}}}, 'overall_burstiness': 0, 'writing_stats': {}, 'subclass': {'ai': {}, 'human': {}, 'mixed': {}}, 'result_message': 'Our detector is highly confident that the text is written entirely by a human.', 'document_classification': 'HUMAN_ONLY', 'version': '2025-01-09-base', 'language': 'en', 'pageNumber': 0, 'inputText': 'WJHL | Tri-Cities News & Weather Please enter a search term. Please enter a search term. by: Van Jones Posted: Jun 18, 2022 / 06:28 PM EDT Updated: Jun 18, 2022 / 07:57 PM EDT by: Van Jones Posted: Jun 18, 2022 / 06:28 PM EDT Updated: Jun 18, 2022 / 07:57 PM EDT (WJHL) Tenn./Va. – Appalachian Power has released a statement regarding its response to widespread power outages caused by recent severe weather. The power company states that nearly 2,400 employees and contractors are working hard to get power restored to customers. So far, power has been restored to 83,00 customers who lost power, but around 47,000 remain, according to a release from Appalachian Power. In addition, there are about 2,500 locations that need repairs made. “Workers began assessing damage and making repairs yesterday evening, and this work is ongoing. Restoration times will be made available for customers this evening,” the release states. Outages peaked at around 5 p.m. on Friday with approximately 130,000 customers without power. For more information, check Appalachian Power’s Outage Map. Copyright 2024 Nexstar Media Inc. All rights reserved. This material may not be published, broadcast, rewritten, or redistributed. If you have the type of dad whose best friend has four legs, you’re in luck when it comes to shopping for a Father’s Day gift. Here are the top 10 features that can help get you more than you imagined was possible for your home. Chances are you need both dethatching and aerating to maintain a healthy lawn. Learn more about what they entail and the best products to do it in this article.'}]"
TN_2022_38049631c53beecc44438743e8ccdce0.html.gz,2025-01-09-base,"[{'sentences': [{'generated_prob': 0.001775992102921009, 'sentence': 'Lydia Fielder is a weekend anchor and multimedia journalist (MMJ) at WSMV4 Nashville.', 'perplexity': 0, 'highlight_sentence_for_ai': False}, {'generated_prob': 0.001747455564327538, 'sentence': 'She joined the team in October 2021.', 'perplexity': 0, 'highlight_sentence_for_ai': False}, {'generated_prob': 0.002048635156825185, 'sentence': 'She comes to Nashville from Northwest Arkansas where she spent 2.5 years as a reporter and fill-in anchor.', 'perplexity': 0, 'highlight_sentence_for_ai': False}, {'generated_prob': 0.0008672097465023398, 'sentence': 'Lydia also grew up in the area.', 'perplexity': 0, 'highlight_sentence_for_ai': False}, {'generated_prob': 0.0012474964605644345, 'sentence': 'Her notable coverage includes the Josh Duggar child pornography trial, an exclusive interview with an Arkansan charged in the U.S. Capitol riots, and many flooding and tornado events.', 'perplexity': 0, 'highlight_sentence_for_ai': False}, {'generated_prob': 0.00207810802385211, 'sentence': 'Her favorite memory in was spending a week in Omaha, Nebraska, covering the Arkansas Razorback baseball team in the 2022 College World Series (Woo Pig Sooie!).', 'perplexity': 0, 'highlight_sentence_for_ai': False}, {'generated_prob': 0.0021625226363539696, 'sentence': ""The second day of Lydia's career in journalism was the first day of the COVID-19 pandemic in the U.S. She credits the pandemic with helping her learn creative ways and different angles to deliver news."", 'perplexity': 0, 'highlight_sentence_for_ai': False}, {'generated_prob': 0.004623296204954386, 'sentence': 'Lydia graduated with honors from the University of Arkansas with a major in broadcast journalism and minors in political science and Spanish.', 'perplexity': 0, 'highlight_sentence_for_ai': False}, {'generated_prob': 0.0038853741716593504, 'sentence': 'There, she was an anchor and reporter for UATV News.', 'perplexity': 0, 'highlight_sentence_for_ai': False}, {'generated_prob': 0.0033227738458663225, 'sentence': 'During her time off, you can likely find Lydia on a run, at a live sporting event or on the dance floor.', 'perplexity': 0, 'highlight_sentence_for_ai': False}, {'generated_prob': 0.0028268329333513975, 'sentence': 'She feels blessed to call such a beautiful city her new home, which, she says, had a big city feel but the most hospitable people.', 'perplexity': 0, 'highlight_sentence_for_ai': False}, {'generated_prob': 0.004816582892090082, 'sentence': ""She'd love to hear your story ideas, or just a friendly “hello.” Email her anytime at Lydia.Fielder@wsmv.com."", 'perplexity': 0, 'highlight_sentence_for_ai': False}, {'generated_prob': 0.044140253216028214, 'sentence': 'News News News News News News News News News News News News News News US & World News News News News News News News News News News News News News News News News News News News News News News News News News News News News News News News News News News News News', 'perplexity': 0, 'highlight_sentence_for_ai': False}], 'paragraphs': [{'start_sentence_index': 0, 'num_sentences': 13, 'completely_generated_prob': 1.4476848035102901e-11}], 'completely_generated_prob': 0.020660391318316405, 'class_probabilities': {'human': 0.9793396086816837, 'ai': 0.020660391318316405, 'mixed': 0}, 'average_generated_prob': 0, 'predicted_class': 'human', 'confidence_score': 0.9793396086816837, 'confidence_category': 'high', 'confidence_scores_raw': {'identity': {'ai': 0.020660391318316405, 'human': 0.9793396086816837, 'mixed': 0}}, 'confidence_thresholds_raw': {'identity': {'ai': {'reject': 0.65, 'low': 0.75, 'medium': 0.92}, 'human': {'reject': 0.7, 'low': 0.82, 'medium': 0.92}, 'mixed': {'reject': 0.7, 'low': 0.8, 'medium': 0.88}}}, 'overall_burstiness': 0, 'writing_stats': {}, 'subclass': {'ai': {}, 'human': {}, 'mixed': {}}, 'result_message': 'Our detector is highly confident that the text is written entirely by a human.', 'document_classification': 'HUMAN_ONLY', 'version': '2025-01-09-base', 'language': 'en', 'pageNumber': 0, 'inputText': 'Lydia Fielder is a weekend anchor and multimedia journalist (MMJ) at WSMV4 Nashville. She joined the team in October 2021. She comes to Nashville from Northwest Arkansas where she spent 2.5 years as a reporter and fill-in anchor. Lydia also grew up in the area. Her notable coverage includes the Josh Duggar child pornography trial, an exclusive interview with an Arkansan charged in the U.S. Capitol riots, and many flooding and tornado events. Her favorite memory in was spending a week in Omaha, Nebraska, covering the Arkansas Razorback baseball team in the 2022 College World Series (Woo Pig Sooie!). The second day of Lydia’s career in journalism was the first day of the COVID-19 pandemic in the U.S. She credits the pandemic with helping her learn creative ways and different angles to deliver news. Lydia graduated with honors from the University of Arkansas with a major in broadcast journalism and minors in political science and Spanish. There, she was an anchor and reporter for UATV News. During her time off, you can likely find Lydia on a run, at a live sporting event or on the dance floor. She feels blessed to call such a beautiful city her new home, which, she says, had a big city feel but the most hospitable people. She’d love to hear your story ideas, or just a friendly “hello.” Email her anytime at Lydia.Fielder@wsmv.com. News News News News News News News News News News News News News News US & World News News News News News News News News News News News News News News News News News News News News News News News News News News News News News News News News News News News News'}]"
TN_2022_521d76efae4eb337a2a8f84d87dfa7e4.html.gz,2025-01-09-base,"[{'sentences': [{'generated_prob': 0.021304532885551453, 'sentence': 'Chattanooga Mostly Cloudy H 71° L 63° 69° Altamont Mostly Cloudy H 70° L 64° 66° Athens Fair H 77° L 62° 74° Benton Cloudy H 71° L 63° 69° Chatsworth Cloudy H 71° L 63° 69° Cleveland Rain H 71° L 63° 70° Dalton Light Rain H 72° L 63° 68° Dayton Fair H 70° L 59° 69° Dunlap Cloudy H 71° L 63° 69° Murphy Fair H 77° L 62° 74° Pikeville Fair H 70° L 59° 69° Scottsboro Cloudy H 70° L 65° 68° Summerville Rain H 74° L 64° 67° Ringgold Cloudy H 71° L 63° 69° Trenton Cloudy H 71° L 63° 69° Chattanooga Mostly Cloudy H 71° L 63° 69° Altamont Mostly Cloudy H 70° L 64° 66° Athens Fair H 77° L 62° 74° Benton Cloudy H 71° L 63° 69° Chatsworth Cloudy H 71° L 63° 69° Dalton Light Rain H 72° L 63° 68° Dayton Fair H 70° L 59° 69° Dunlap Cloudy H 71° L 63° 69° Murphy Fair H 77° L 62° 74° Pikeville Fair H 70° L 59° 69° Summerville Rain H 74° L 64° 67° Ringgold Cloudy H 71° L 63° 69° Trenton Cloudy H 71° L 63° 69° World AIDS Day is observed on December 1.', 'perplexity': 0, 'highlight_sentence_for_ai': False}, {'generated_prob': 0.12315871566534042, 'sentence': ""It's a time when people unite to raise awareness about the disease."", 'perplexity': 0, 'highlight_sentence_for_ai': False}, {'generated_prob': 8.881141184247099e-06, 'sentence': ""Jeanne White-Ginder is in Chattanooga to speak to people about her family's public struggle with AIDS after her teenage son was diagnosed in 1984."", 'perplexity': 0, 'highlight_sentence_for_ai': False}, {'generated_prob': 9.240426152246073e-06, 'sentence': 'Dr. William B. Walsh, president and chief executive officer of Project Hope shakes the hand of AIDS victim Ryan Wayne of Ciero, Indiana, in Washington Thursday, March 4, 1988.', 'perplexity': 0, 'highlight_sentence_for_ai': False}, {'generated_prob': 8.9276190919918e-06, 'sentence': 'White, who attends Hamilton High High School, testified before the Presidential Commission on the Human immunodeficiency Virus Epidemic.', 'perplexity': 0, 'highlight_sentence_for_ai': False}, {'generated_prob': 1.2003652955172583e-05, 'sentence': '(AP Photo/Scott Stewart) Ryan White became a household name.', 'perplexity': 0, 'highlight_sentence_for_ai': False}, {'generated_prob': 1.0706495231715962e-05, 'sentence': 'He was a teenager from Indiana who became infected after receiving a transfusion to treat his hemophilia.', 'perplexity': 0, 'highlight_sentence_for_ai': False}, {'generated_prob': 1.1526136404427234e-05, 'sentence': 'It was later determined that the blood was contaminated and contained the HIV virus.', 'perplexity': 0, 'highlight_sentence_for_ai': False}, {'generated_prob': 1.270305165235186e-05, 'sentence': ""White's family later went through a legal battle to fight for his right to attend school."", 'perplexity': 0, 'highlight_sentence_for_ai': False}, {'generated_prob': 1.2267686543054879e-05, 'sentence': 'At the time, other parents were fearful for their children to be around him.', 'perplexity': 0, 'highlight_sentence_for_ai': False}, {'generated_prob': 1.4470368114416488e-05, 'sentence': ""The teen's story drew national attention and celebrities like Elton John and Michael Jackson rallied around him."", 'perplexity': 0, 'highlight_sentence_for_ai': False}, {'generated_prob': 1.4038838344276883e-05, 'sentence': 'White lost his battle in 1990 but his mother continues to keep his memory alive by raising awareness.', 'perplexity': 0, 'highlight_sentence_for_ai': False}, {'generated_prob': 1.6480673366459087e-05, 'sentence': '""We\'ve come so far.', 'perplexity': 0, 'highlight_sentence_for_ai': False}, {'generated_prob': 8.706315384188201e-06, 'sentence': 'The problems we had with trying to fight to get Ryan in school was because people thought you could get AIDS from kissing, tears and sweat.', 'perplexity': 0, 'highlight_sentence_for_ai': False}, {'generated_prob': 7.610636657773284e-06, 'sentence': 'They thought mosquitos and fleas might transmit AIDS.', 'perplexity': 0, 'highlight_sentence_for_ai': False}, {'generated_prob': 7.79525998950703e-06, 'sentence': ""We've come a long way since then and we've made really good progress with the medications and now we have medicine that can get you undetectable,” White-Ginder told Channel 3."", 'perplexity': 0, 'highlight_sentence_for_ai': False}, {'generated_prob': 8.032296136661898e-06, 'sentence': 'At the time, White was one of a handful of highly visible people with AIDS who helped change the public perception of the disease.', 'perplexity': 0, 'highlight_sentence_for_ai': False}, {'generated_prob': 7.4188569669786375e-06, 'sentence': ""His mother says there is still more work to be done especially in education and that's why she travels the country speaking about AIDS."", 'perplexity': 0, 'highlight_sentence_for_ai': False}, {'generated_prob': 1.256190262211021e-05, 'sentence': 'White-Ginder will speak Friday night in Chattanooga for World AIDS Day.', 'perplexity': 0, 'highlight_sentence_for_ai': False}, {'generated_prob': 0.011349933221936226, 'sentence': 'The event is at Waterhouse Pavilion at 5:30 and is free to the public.', 'perplexity': 0, 'highlight_sentence_for_ai': False}, {'generated_prob': 0.01869547925889492, 'sentence': 'Your browser is out of date and potentially vulnerable to security risks.We recommend switching to one of the following browsers: Get up-to-the-minute news sent straight to your device.', 'perplexity': 0, 'highlight_sentence_for_ai': False}], 'paragraphs': [{'start_sentence_index': 0, 'num_sentences': 21, 'completely_generated_prob': 1.369041255298935e-18}], 'completely_generated_prob': 0.0375246461941804, 'class_probabilities': {'human': 0.9624347023880775, 'ai': 0.0375246461941804, 'mixed': 4.065141774218333e-05}, 'average_generated_prob': 0, 'predicted_class': 'human', 'confidence_score': 0.9624347023880775, 'confidence_category': 'high', 'confidence_scores_raw': {'identity': {'ai': 0.0375246461941804, 'human': 0.9624347023880775, 'mixed': 4.065141774218333e-05}}, 'confidence_thresholds_raw': {'identity': {'ai': {'reject': 0.65, 'low': 0.75, 'medium': 0.92}, 'human': {'reject': 0.7, 'low': 0.82, 'medium': 0.92}, 'mixed': {'reject': 0.7, 'low': 0.8, 'medium': 0.88}}}, 'overall_burstiness': 0, 'writing_stats': {}, 'subclass': {'ai': {}, 'human': {}, 'mixed': {}}, 'result_message': 'Our detector is highly confident that the text is written entirely by a human.', 'document_classification': 'HUMAN_ONLY', 'version': '2025-01-09-base', 'language': 'en', 'pageNumber': 0, 'inputText': 'Chattanooga Mostly Cloudy H 71° L 63° 69° Altamont Mostly Cloudy H 70° L 64° 66° Athens Fair H 77° L 62° 74° Benton Cloudy H 71° L 63° 69° Chatsworth Cloudy H 71° L 63° 69° Cleveland Rain H 71° L 63° 70° Dalton Light Rain H 72° L 63° 68° Dayton Fair H 70° L 59° 69° Dunlap Cloudy H 71° L 63° 69° Murphy Fair H 77° L 62° 74° Pikeville Fair H 70° L 59° 69° Scottsboro Cloudy H 70° L 65° 68° Summerville Rain H 74° L 64° 67° Ringgold Cloudy H 71° L 63° 69° Trenton Cloudy H 71° L 63° 69° Chattanooga Mostly Cloudy H 71° L 63° 69° Altamont Mostly Cloudy H 70° L 64° 66° Athens Fair H 77° L 62° 74° Benton Cloudy H 71° L 63° 69° Chatsworth Cloudy H 71° L 63° 69° Dalton Light Rain H 72° L 63° 68° Dayton Fair H 70° L 59° 69° Dunlap Cloudy H 71° L 63° 69° Murphy Fair H 77° L 62° 74° Pikeville Fair H 70° L 59° 69° Summerville Rain H 74° L 64° 67° Ringgold Cloudy H 71° L 63° 69° Trenton Cloudy H 71° L 63° 69° World AIDS Day is observed on December 1. It’s a time when people unite to raise awareness about the disease. Jeanne White-Ginder is in Chattanooga to speak to people about her family’s public struggle with AIDS after her teenage son was diagnosed in 1984. Dr. William B. Walsh, president and chief executive officer of Project Hope shakes the hand of AIDS victim Ryan Wayne of Ciero, Indiana, in Washington Thursday, March 4, 1988. White, who attends Hamilton High High School, testified before the Presidential Commission on the Human immunodeficiency Virus Epidemic. (AP Photo/Scott Stewart) Ryan White became a household name. He was a teenager from Indiana who became infected after receiving a transfusion to treat his hemophilia. It was later determined that the blood was contaminated and contained the HIV virus. White’s family later went through a legal battle to fight for his right to attend school. At the time, other parents were fearful for their children to be around him. The teen’s story drew national attention and celebrities like Elton John and Michael Jackson rallied around him. White lost his battle in 1990 but his mother continues to keep his memory alive by raising awareness. ""We\'ve come so far. The problems we had with trying to fight to get Ryan in school was because people thought you could get AIDS from kissing, tears and sweat. They thought mosquitos and fleas might transmit AIDS. We’ve come a long way since then and we’ve made really good progress with the medications and now we have medicine that can get you undetectable,” White-Ginder told Channel 3. At the time, White was one of a handful of highly visible people with AIDS who helped change the public perception of the disease. His mother says there is still more work to be done especially in education and that’s why she travels the country speaking about AIDS. White-Ginder will speak Friday night in Chattanooga for World AIDS Day. The event is at Waterhouse Pavilion at 5:30 and is free to the public. Your browser is out of date and potentially vulnerable to security risks.We recommend switching to one of the following browsers: Get up-to-the-minute news sent straight to your device.'}]"
