File,version,documents
CO_2023_5887a050b3a0d064dd83233e723902a0.html.gz,2025-01-09-base,"[{'sentences': [{'generated_prob': 1.756074561853893e-05, 'sentence': 'GRAND COUNTY, Colo. (KKTV) - As more wolves are released as part of reintroduction efforts in Colorado, one expert shared some of the impacts they could have on the people of the state and how officials are trying to facilitate coexistence with the returning species.', 'perplexity': 0, 'highlight_sentence_for_ai': False}, {'generated_prob': 1.9008029994438402e-05, 'sentence': ""Colorado Parks and Wildlife announced Friday that five additional wolves had been released in Colorado since the initial release, bringing the total up to 10 as of this article's last update."", 'perplexity': 0, 'highlight_sentence_for_ai': False}, {'generated_prob': 1.8100818124366924e-05, 'sentence': ""Colorado State University's Center for Human-Carnivore Coexistence Director Kevin Crooks told 11 News he thinks many of the believed effects of wolves' full reintroduction in the state “tend to be overplayed, they tend to be exaggerated in discourse.” “Colorado is currently a broken link in an otherwise relatively continuous chain of wolf populations along the Rocky Mountains,” Crooks said, adding that a sustainable wolf population in Colorado could close that chain and would be a significant conservation achievement."", 'perplexity': 0, 'highlight_sentence_for_ai': False}, {'generated_prob': 2.65766338998219e-05, 'sentence': ""Despite that, and the support for wolf reintroduction in 2020 that led to their return, it's still a source of concern for many Coloradans, especially ranchers with livestock in areas wolves will now also live in."", 'perplexity': 0, 'highlight_sentence_for_ai': False}, {'generated_prob': 0.0004319192375987768, 'sentence': '“Although most ranchers will not experience direct conflict with wolves here in Colorado, some will and some already have,” Crooks said, “and for those individual ranchers, wolves can have a substantial economic and emotional impact.” Crooks said his team and Colorado Parks and Wildlife have been working on a number of way to address the impacts to individual ranchers, looking into both proactive and reactive responses to situations that could arise with wolves and hosting forums between pro-wolf parties and ranchers for their concerns to be discussed.', 'perplexity': 0, 'highlight_sentence_for_ai': False}, {'generated_prob': 0.00036247808020561934, 'sentence': ""“These are real impacts that are important to consider,” Crooks said, “important not to minimize, because it's going to be these individual ranchers that are going to bear the brunt of the cost exerted by wolves.” When it comes to the potential of running across a wolf during a run or hike or visit to a park, Crooks said to enjoy the outdoors and the wildlife, but to stay aware, just like you would with any other potentially threatening wildlife."", 'perplexity': 0, 'highlight_sentence_for_ai': False}, {'generated_prob': 0.000515142222866416, 'sentence': ""“Wolves are generally afraid of people, and will avoid them, so they don't necessarily represent a direct threat to human safety,” Crooks said, “unless people have been habituating them by providing them with food for example.” Crooks' conversation with 11 News Digital Anchor Lauren Watson, with more information about the work the Center for Human-Carnivore Coexistence is doing and the conversation surrounding wolves in Colorado, can be watched below: Copyright 2023 KKTV."", 'perplexity': 0, 'highlight_sentence_for_ai': False}, {'generated_prob': 0.001098612672649324, 'sentence': 'All rights reserved.', 'perplexity': 0, 'highlight_sentence_for_ai': False}], 'paragraphs': [{'start_sentence_index': 0, 'num_sentences': 8, 'completely_generated_prob': 3.002405151306975e-07}], 'completely_generated_prob': 0.006922837844142335, 'class_probabilities': {'human': 0.99303778363816, 'ai': 0.006922837844142335, 'mixed': 3.937851769764606e-05}, 'average_generated_prob': 0, 'predicted_class': 'human', 'confidence_score': 0.99303778363816, 'confidence_category': 'high', 'confidence_scores_raw': {'identity': {'ai': 0.006922837844142335, 'human': 0.99303778363816, 'mixed': 3.937851769764606e-05}}, 'confidence_thresholds_raw': {'identity': {'ai': {'reject': 0.65, 'low': 0.75, 'medium': 0.92}, 'human': {'reject': 0.7, 'low': 0.82, 'medium': 0.92}, 'mixed': {'reject': 0.7, 'low': 0.8, 'medium': 0.88}}}, 'overall_burstiness': 0, 'writing_stats': {}, 'subclass': {'ai': {}, 'human': {}, 'mixed': {}}, 'result_message': 'Our detector is highly confident that the text is written entirely by a human.', 'document_classification': 'HUMAN_ONLY', 'version': '2025-01-09-base', 'language': 'en', 'pageNumber': 0, 'inputText': 'GRAND COUNTY, Colo. (KKTV) - As more wolves are released as part of reintroduction efforts in Colorado, one expert shared some of the impacts they could have on the people of the state and how officials are trying to facilitate coexistence with the returning species. Colorado Parks and Wildlife announced Friday that five additional wolves had been released in Colorado since the initial release, bringing the total up to 10 as of this article’s last update. Colorado State University’s Center for Human-Carnivore Coexistence Director Kevin Crooks told 11 News he thinks many of the believed effects of wolves’ full reintroduction in the state “tend to be overplayed, they tend to be exaggerated in discourse.” “Colorado is currently a broken link in an otherwise relatively continuous chain of wolf populations along the Rocky Mountains,” Crooks said, adding that a sustainable wolf population in Colorado could close that chain and would be a significant conservation achievement. Despite that, and the support for wolf reintroduction in 2020 that led to their return, it’s still a source of concern for many Coloradans, especially ranchers with livestock in areas wolves will now also live in. “Although most ranchers will not experience direct conflict with wolves here in Colorado, some will and some already have,” Crooks said, “and for those individual ranchers, wolves can have a substantial economic and emotional impact.” Crooks said his team and Colorado Parks and Wildlife have been working on a number of way to address the impacts to individual ranchers, looking into both proactive and reactive responses to situations that could arise with wolves and hosting forums between pro-wolf parties and ranchers for their concerns to be discussed. “These are real impacts that are important to consider,” Crooks said, “important not to minimize, because it’s going to be these individual ranchers that are going to bear the brunt of the cost exerted by wolves.” When it comes to the potential of running across a wolf during a run or hike or visit to a park, Crooks said to enjoy the outdoors and the wildlife, but to stay aware, just like you would with any other potentially threatening wildlife. “Wolves are generally afraid of people, and will avoid them, so they don’t necessarily represent a direct threat to human safety,” Crooks said, “unless people have been habituating them by providing them with food for example.” Crooks’ conversation with 11 News Digital Anchor Lauren Watson, with more information about the work the Center for Human-Carnivore Coexistence is doing and the conversation surrounding wolves in Colorado, can be watched below: Copyright 2023 KKTV. All rights reserved.'}]"
CO_2023_7f9bd58f5311466ef527df6bd3873910.html.gz,2025-01-09-base,"[{'sentences': [{'generated_prob': 0.00013515794125851244, 'sentence': 'WesternSlopeNow.com Please enter a search term.', 'perplexity': 0, 'highlight_sentence_for_ai': False}, {'generated_prob': 0.00014027401630301028, 'sentence': 'Please enter a search term.', 'perplexity': 0, 'highlight_sentence_for_ai': False}, {'generated_prob': 8.477636583847925e-05, 'sentence': 'by: Stephen Neukam, The Hill Posted: Mar 20, 2023 / 09:03 PM MDT Updated: Mar 20, 2023 / 09:03 PM MDT by: Stephen Neukam, The Hill Posted: Mar 20, 2023 / 09:03 PM MDT Updated: Mar 20, 2023 / 09:03 PM MDT (The Hill) - Candida auris, a rare and sometimes deadly fungal disease, is spreading through the U.S., the Centers for Disease Control and Prevention (CDC) warned this week, citing a “dramatic” increase in cases.', 'perplexity': 0, 'highlight_sentence_for_ai': False}, {'generated_prob': 7.078146154526621e-05, 'sentence': 'According to the CDC, Candida auris is a type of yeast that can cause severe illness in hospitalized patients.', 'perplexity': 0, 'highlight_sentence_for_ai': False}, {'generated_prob': 7.629895117133856e-05, 'sentence': 'It primarily affects older people and those with weakened immune systems, rejects treatments from traditional antifungal medications and has a mortality rate of up to 60 percent, health officials said.', 'perplexity': 0, 'highlight_sentence_for_ai': False}, {'generated_prob': 8.032315963646397e-05, 'sentence': 'There were at least 2,377 confirmed cases in the U.S. in 2022, according to CDC statistics.', 'perplexity': 0, 'highlight_sentence_for_ai': False}, {'generated_prob': 0.00010984184336848557, 'sentence': 'That total was a steep jump from the 1,474 cases in 2021 and continued a rapid increase from 2020, when there were just 757 confirmed cases.', 'perplexity': 0, 'highlight_sentence_for_ai': False}, {'generated_prob': 5.453677295008674e-05, 'sentence': ""Health officials said that the fungus's resistance to antifungal medication is “particularly concerning” because those medications are often the first option for treatment, saying it necessitates research into better protection and prevention measures against the fungus."", 'perplexity': 0, 'highlight_sentence_for_ai': False}, {'generated_prob': 8.463721314910799e-05, 'sentence': '“The rise in echinocandin-resistant cases and evidence of transmission is particularly concerning because echinocandins are first-line therapy for invasive Candida infections, including C auris,” a research paper into the spread of the fungus in the Annals of Internal Medicine said.', 'perplexity': 0, 'highlight_sentence_for_ai': False}, {'generated_prob': 6.725775165250525e-05, 'sentence': '“These findings highlight the need for improved detection and infection control practices to prevent spread of C auris.” The disease has now been tracked in half of the states in the U.S., and CDC officials said it was likely that the coronavirus pandemic worsened the spread of the fungus, as the increased attention on the COVID-19 virus meant there was less emphasis on screening for C. auris.', 'perplexity': 0, 'highlight_sentence_for_ai': False}, {'generated_prob': 7.629234460182488e-05, 'sentence': 'Last month, health officials in Mississippi said the fungal infection may be responsible for four recent deaths in the state.', 'perplexity': 0, 'highlight_sentence_for_ai': False}, {'generated_prob': 0.00014916626969352365, 'sentence': 'At least 12 people have been infected since November, a spokesperson for the Mississippi State Department of Health confirmed to NBC News.', 'perplexity': 0, 'highlight_sentence_for_ai': False}, {'generated_prob': 0.00014215294504538178, 'sentence': 'In November, Nevada health officials linked 63 deaths in the state to C. auris.', 'perplexity': 0, 'highlight_sentence_for_ai': False}, {'generated_prob': 0.012081515043973923, 'sentence': 'The virus was first reported in Japan in 2009, but researchers have tracked the earliest strain to South Korea in 1996.', 'perplexity': 0, 'highlight_sentence_for_ai': False}, {'generated_prob': 0.01271562185138464, 'sentence': 'The fungus does not usually present a risk to young people.', 'perplexity': 0, 'highlight_sentence_for_ai': False}, {'generated_prob': 0.010579659603536129, 'sentence': 'Copyright 2024 Nexstar Media Inc. All rights reserved.', 'perplexity': 0, 'highlight_sentence_for_ai': False}, {'generated_prob': 0.01033272035419941, 'sentence': 'This material may not be published, broadcast, rewritten, or redistributed.', 'perplexity': 0, 'highlight_sentence_for_ai': False}, {'generated_prob': 0.004565372597426176, 'sentence': ""If you have the type of dad whose best friend has four legs, you're in luck when it comes to shopping for a Father's Day gift."", 'perplexity': 0, 'highlight_sentence_for_ai': False}, {'generated_prob': 0.004159137606620789, 'sentence': 'Here are the top 10 features that can help get you more than you imagined was possible for your home.', 'perplexity': 0, 'highlight_sentence_for_ai': False}, {'generated_prob': 0.0027322738897055387, 'sentence': 'Chances are you need both dethatching and aerating to maintain a healthy lawn.', 'perplexity': 0, 'highlight_sentence_for_ai': False}, {'generated_prob': 0.003341264557093382, 'sentence': 'Learn more about what they entail and the best products to do it in this article.', 'perplexity': 0, 'highlight_sentence_for_ai': False}, {'generated_prob': 0.003702394664287567, 'sentence': 'Thanks for signing up!', 'perplexity': 0, 'highlight_sentence_for_ai': False}, {'generated_prob': 0.003784317523241043, 'sentence': 'Watch for us in your inbox.', 'perplexity': 0, 'highlight_sentence_for_ai': False}, {'generated_prob': 0.004552408121526241, 'sentence': 'Subscribe Now Thanks for signing up!', 'perplexity': 0, 'highlight_sentence_for_ai': False}, {'generated_prob': 0.004566411953419447, 'sentence': 'Watch for us in your inbox.', 'perplexity': 0, 'highlight_sentence_for_ai': False}, {'generated_prob': 0.004060741979628801, 'sentence': 'Subscribe Now', 'perplexity': 0, 'highlight_sentence_for_ai': False}], 'paragraphs': [{'start_sentence_index': 0, 'num_sentences': 26, 'completely_generated_prob': 5.1426723732539106e-23}], 'completely_generated_prob': 0.010645294179297668, 'class_probabilities': {'human': 0.9890699594933385, 'ai': 0.010645294179297668, 'mixed': 0.0002847463273638171}, 'average_generated_prob': 0, 'predicted_class': 'human', 'confidence_score': 0.9890699594933385, 'confidence_category': 'high', 'confidence_scores_raw': {'identity': {'ai': 0.010645294179297668, 'human': 0.9890699594933385, 'mixed': 0.0002847463273638171}}, 'confidence_thresholds_raw': {'identity': {'ai': {'reject': 0.65, 'low': 0.75, 'medium': 0.92}, 'human': {'reject': 0.7, 'low': 0.82, 'medium': 0.92}, 'mixed': {'reject': 0.7, 'low': 0.8, 'medium': 0.88}}}, 'overall_burstiness': 0, 'writing_stats': {}, 'subclass': {'ai': {}, 'human': {}, 'mixed': {}}, 'result_message': 'Our detector is highly confident that the text is written entirely by a human.', 'document_classification': 'HUMAN_ONLY', 'version': '2025-01-09-base', 'language': 'en', 'pageNumber': 0, 'inputText': 'WesternSlopeNow.com Please enter a search term. Please enter a search term. by: Stephen Neukam, The Hill Posted: Mar 20, 2023 / 09:03 PM MDT Updated: Mar 20, 2023 / 09:03 PM MDT by: Stephen Neukam, The Hill Posted: Mar 20, 2023 / 09:03 PM MDT Updated: Mar 20, 2023 / 09:03 PM MDT (The Hill) – Candida auris, a rare and sometimes deadly fungal disease, is spreading through the U.S., the Centers for Disease Control and Prevention (CDC) warned this week, citing a “dramatic” increase in cases. According to the CDC, Candida auris is a type of yeast that can cause severe illness in hospitalized patients. It primarily affects older people and those with weakened immune systems, rejects treatments from traditional antifungal medications and has a mortality rate of up to 60 percent, health officials said. There were at least 2,377 confirmed cases in the U.S. in 2022, according to CDC statistics. That total was a steep jump from the 1,474 cases in 2021 and continued a rapid increase from 2020, when there were just 757 confirmed cases. Health officials said that the fungus’s resistance to antifungal medication is “particularly concerning” because those medications are often the first option for treatment, saying it necessitates research into better protection and prevention measures against the fungus. “The rise in echinocandin-resistant cases and evidence of transmission is particularly concerning because echinocandins are first-line therapy for invasive Candida infections, including C auris,” a research paper into the spread of the fungus in the Annals of Internal Medicine said. “These findings highlight the need for improved detection and infection control practices to prevent spread of C auris.” The disease has now been tracked in half of the states in the U.S., and CDC officials said it was likely that the coronavirus pandemic worsened the spread of the fungus, as the increased attention on the COVID-19 virus meant there was less emphasis on screening for C. auris. Last month, health officials in Mississippi said the fungal infection may be responsible for four recent deaths in the state. At least 12 people have been infected since November, a spokesperson for the Mississippi State Department of Health confirmed to NBC News. In November, Nevada health officials linked 63 deaths in the state to C. auris. The virus was first reported in Japan in 2009, but researchers have tracked the earliest strain to South Korea in 1996. The fungus does not usually present a risk to young people. Copyright 2024 Nexstar Media Inc. All rights reserved. This material may not be published, broadcast, rewritten, or redistributed. If you have the type of dad whose best friend has four legs, you’re in luck when it comes to shopping for a Father’s Day gift. Here are the top 10 features that can help get you more than you imagined was possible for your home. Chances are you need both dethatching and aerating to maintain a healthy lawn. Learn more about what they entail and the best products to do it in this article. Thanks for signing up! Watch for us in your inbox. Subscribe Now Thanks for signing up! Watch for us in your inbox. Subscribe Now'}]"
