File,version,documents
IA_2020_03e758892fa36e2150016f6fb1b210a8.html.gz,2025-01-09-base,"[{'sentences': [{'generated_prob': 0.040549132972955704, 'sentence': ""Posted on 31 January 2020 by KWBG Comments Off on State Senator Jerry Behn, Legislative Review, Aired Friday, January 31, 2020 Posted on 31 January 2020 by KWBG Comments Off on Zach Stier, Children's Librarian and Candy Noelck, Programming Librarian, Ericson Public Library, Aired Friday, January 31, 2020 Posted on 31 January 2020 by KWBG Congratulations to King Ryan Ungs and Queen Ashley Behrendt, who were crowned during Friday afternoon's Pep Assembly at BHS."", 'perplexity': 0, 'highlight_sentence_for_ai': False}, {'generated_prob': 0.0032424628734588623, 'sentence': ""Comments Off on BHS Winter Royalty Posted on 31 January 2020 by KWBG Crock pot Ranch Pork Chops and Potatoes 3 Lbs Red Potatoes - quartered 6 (3/4 inch) Boneless Pork Chops Your choice of seasonings for meat: salt, pepper, garlic salt, Lawry's 1/2 Cup + 1 T Olive Oil 2 Tablespoons Dry Ranch Seasoning 2 teaspoons Apple Cider Vinegar 2 Tablespoons Butter - cubed Season meat to […] Comments Off on Friday's Recipes: Crock Pot Ranch Pork Chops & Potatoes and Caramel Cinnamon Rolls Posted on 31 January 2020 by KWBG Comments Off on Coaches Corner for January 31st: Steve Krafcisin, DMACC Women's Basketball Posted on 31 January 2020 by KWBG LOCAL RESULTS FROM YESTERDAY HIGH SCHOOL WRESTLING Ogden over Nevada 39-30 Ogden over Roland Story 48-15 Iowa Falls Alden over Ogden 58-18 HIGH SCHOOL GIRLS BASKETBALL Grandview Christian over Ogden 47-43 LOCAL SCHEDULE FOR TODAY HIGH SCHOOL GIRLS/BOYS BASKETBALL Ogden at Interstate 35 (6pm on KWBG) Carlisle at Boone […] Comments Off on KWBG Local Sports for January 31st Posted on 31 January 2020 by KWBG Ogden Wrestling Results from January 30th Weight Summary OGDE NEVA 182 Holden Fry (Nevada) over Tyler Kathman (Ogden) (Fall 3:30) 0 6 195 Xander Soder (Ogden) over Nate Anderson (Nevada) (Fall 0:58) 6 0 220 Blake Haub (Ogden) over Caden Jones (Nevada) (Fall 4:55) 6 0 285 Camdan Vincent (Nevada) over David Hammer (Ogden) (Fall 1:34) 0 6 […] Comments Off on Ogden Wrestling Results from January 30th Posted on 30 January 2020 by KWBG Comments Off on Diane Hinderaker, Boone County Human Service Council Chairperson, speaking about “Feel the Love” Food Drive, Aired Thursday, January 30, 2020 Posted on 30 January 2020 by KWBG Comments Off on Lt. James Beardsley and Dr. Harold Burgmayer, Salvation Army visit about upcoming concert with the Salvation Army Chicago Staff Band, Aired Thursday, January 30, 2020 Posted on 30 January 2020 by KWBG Comments Off on Coaches Corner for January 30th: Justin Baute, Boone Boys Basketball Loading crossword puzzle."", 'perplexity': 0, 'highlight_sentence_for_ai': False}, {'generated_prob': 0.00389552372507751, 'sentence': 'One moment please.', 'perplexity': 0, 'highlight_sentence_for_ai': False}, {'generated_prob': 0.003495254786685109, 'sentence': 'Copyright © KWBG Radio | Boone, Iowa.Original News Theme by.', 'perplexity': 0, 'highlight_sentence_for_ai': False}], 'paragraphs': [{'start_sentence_index': 0, 'num_sentences': 4, 'completely_generated_prob': 0.0006564766595293492}], 'completely_generated_prob': 0.0375246461941804, 'class_probabilities': {'human': 0.9624347023880775, 'ai': 0.0375246461941804, 'mixed': 4.065141774218333e-05}, 'average_generated_prob': 0, 'predicted_class': 'human', 'confidence_score': 0.9624347023880775, 'confidence_category': 'high', 'confidence_scores_raw': {'identity': {'ai': 0.0375246461941804, 'human': 0.9624347023880775, 'mixed': 4.065141774218333e-05}}, 'confidence_thresholds_raw': {'identity': {'ai': {'reject': 0.65, 'low': 0.75, 'medium': 0.92}, 'human': {'reject': 0.7, 'low': 0.82, 'medium': 0.92}, 'mixed': {'reject': 0.7, 'low': 0.8, 'medium': 0.88}}}, 'overall_burstiness': 0, 'writing_stats': {}, 'subclass': {'ai': {}, 'human': {}, 'mixed': {}}, 'result_message': 'Our detector is highly confident that the text is written entirely by a human.', 'document_classification': 'HUMAN_ONLY', 'version': '2025-01-09-base', 'language': 'en', 'pageNumber': 0, 'inputText': 'Posted on 31 January 2020 by KWBG Comments Off on State Senator Jerry Behn, Legislative Review, Aired Friday, January 31, 2020 Posted on 31 January 2020 by KWBG Comments Off on Zach Stier, Children’s Librarian and Candy Noelck, Programming Librarian, Ericson Public Library, Aired Friday, January 31, 2020 Posted on 31 January 2020 by KWBG Congratulations to King Ryan Ungs and Queen Ashley Behrendt, who were crowned during Friday afternoon’s Pep Assembly at BHS. Comments Off on BHS Winter Royalty Posted on 31 January 2020 by KWBG Crock pot Ranch Pork Chops and Potatoes 3 Lbs Red Potatoes – quartered 6 (3/4 inch) Boneless Pork Chops Your choice of seasonings for meat: salt, pepper, garlic salt, Lawry’s 1/2 Cup + 1 T Olive Oil 2 Tablespoons Dry Ranch Seasoning 2 teaspoons Apple Cider Vinegar 2 Tablespoons Butter – cubed Season meat to […] Comments Off on Friday’s Recipes: Crock Pot Ranch Pork Chops & Potatoes and Caramel Cinnamon Rolls Posted on 31 January 2020 by KWBG Comments Off on Coaches Corner for January 31st: Steve Krafcisin, DMACC Women’s Basketball Posted on 31 January 2020 by KWBG LOCAL RESULTS FROM YESTERDAY HIGH SCHOOL WRESTLING Ogden over Nevada 39-30 Ogden over Roland Story 48-15 Iowa Falls Alden over Ogden 58-18 HIGH SCHOOL GIRLS BASKETBALL Grandview Christian over Ogden 47-43 LOCAL SCHEDULE FOR TODAY HIGH SCHOOL GIRLS/BOYS BASKETBALL Ogden at Interstate 35 (6pm on KWBG) Carlisle at Boone […] Comments Off on KWBG Local Sports for January 31st Posted on 31 January 2020 by KWBG Ogden Wrestling Results from January 30th Weight Summary OGDE NEVA 182 Holden Fry (Nevada) over Tyler Kathman (Ogden) (Fall 3:30) 0 6 195 Xander Soder (Ogden) over Nate Anderson (Nevada) (Fall 0:58) 6 0 220 Blake Haub (Ogden) over Caden Jones (Nevada) (Fall 4:55) 6 0 285 Camdan Vincent (Nevada) over David Hammer (Ogden) (Fall 1:34) 0 6 […] Comments Off on Ogden Wrestling Results from January 30th Posted on 30 January 2020 by KWBG Comments Off on Diane Hinderaker, Boone County Human Service Council Chairperson, speaking about “Feel the Love” Food Drive, Aired Thursday, January 30, 2020 Posted on 30 January 2020 by KWBG Comments Off on Lt. James Beardsley and Dr. Harold Burgmayer, Salvation Army visit about upcoming concert with the Salvation Army Chicago Staff Band, Aired Thursday, January 30, 2020 Posted on 30 January 2020 by KWBG Comments Off on Coaches Corner for January 30th: Justin Baute, Boone Boys Basketball Loading crossword puzzle. One moment please. Copyright © KWBG Radio | Boone, Iowa.Original News Theme by .'}]"
IA_2020_31f9bfa475170deae1cf20c23345b2f5.html.gz,2025-01-09-base,"[{'sentences': [{'generated_prob': 0.00045538967242464423, 'sentence': 'Posted on 31 October 2020 by KWBG We still get many phone calls and emails from people asking where do I vote on November 3rd in Boone County?', 'perplexity': 0, 'highlight_sentence_for_ai': False}, {'generated_prob': 0.0004145443672314286, 'sentence': 'Here is a handy website to use so you know where to go and exercise your right to vote.', 'perplexity': 0, 'highlight_sentence_for_ai': False}, {'generated_prob': 0.0005329248961061239, 'sentence': 'Just enter your house number, street name and zip code and……….there ya go, your polling […] Comments Off on Where do I vote in Boone County?', 'perplexity': 0, 'highlight_sentence_for_ai': False}, {'generated_prob': 0.0006215974572114646, 'sentence': 'Posted on 30 October 2020 by KWBG ANKENY, IowaᅳA military veteran persevered through a pandemic and his wife accepting a job out-of-state to complete his DMACC Automotive Technology Associate Degree and go on to become the first DMACC Subaru-U graduate.', 'perplexity': 0, 'highlight_sentence_for_ai': False}, {'generated_prob': 0.0005050471518188715, 'sentence': 'Jared Szczepanski said when he was nearing the end of his enlistment with the U.S. Air Force, he was looking for opportunities in the automotive industry.', 'perplexity': 0, 'highlight_sentence_for_ai': False}, {'generated_prob': 0.0006024860194884241, 'sentence': ""[…] Comments Off on Military Veteran First to Complete DMACC's Subaru-U Program Posted on 30 October 2020 by KWBG Don't forget Saturday Night (October 31st) before you go to bed, set your clocks back one hour and check the batteries in your smoke detectors Comments Off on Fall Back/Check your batteries Posted on 30 October 2020 by KWBG Hocus Pocus Buns 2 cans crescent rolls 16 marshmallows 1/4 cup butter 1/4 cup sugar 1 tsp cinnamon Preheat oven to 375."", 'perplexity': 0, 'highlight_sentence_for_ai': False}, {'generated_prob': 0.0010532314190641046, 'sentence': 'Add butter to a small glass bowl and heat in the microwave for 30 seconds, until fully melted.', 'perplexity': 0, 'highlight_sentence_for_ai': False}, {'generated_prob': 0.0011521772248670459, 'sentence': 'In another small bowl, combine cinnamon and sugar.', 'perplexity': 0, 'highlight_sentence_for_ai': False}, {'generated_prob': 0.0011603169841691852, 'sentence': 'Line a baking sheet with parchment paper.', 'perplexity': 0, 'highlight_sentence_for_ai': False}, {'generated_prob': 0.0009168342803604901, 'sentence': ""[…] Comments Off on Friday's Recipes: Hocus Pocus Buns, Roasted Pumpkin Seeds and Classic Cinnamon Rolls Posted on 30 October 2020 by KWBG BOONE, IowaᅳDue to unforeseen circumstances, the graveside service for Rolland “Brodie” Mosman of Boone, Iowa, originally scheduled for Saturday, October 31, 2020 must be canceled and will take place at a later date."", 'perplexity': 0, 'highlight_sentence_for_ai': False}, {'generated_prob': 0.000958629825618118, 'sentence': 'The Schroeder-Stark-Welin Funeral Home, 609 7th Street, Boone, Iowa is assisting the family with the arrangements.', 'perplexity': 0, 'highlight_sentence_for_ai': False}, {'generated_prob': 0.0006386013119481504, 'sentence': 'Comments Off on Rolland “Brodie” Mosman Posted on 30 October 2020 by KWBG DES MOINES, IowaᅳIowa Secretary of Agriculture Mike Naig and Iowa Farm Bureau Federation President Craig Hill honored families from Boone, Buena Vista, Cerro Gordo, Clay, Madison, Mahaska, Marion, Shelby and Story counties with Century and Heritage Farm awards today.', 'perplexity': 0, 'highlight_sentence_for_ai': False}, {'generated_prob': 0.001302181277424097, 'sentence': 'To achieve Century or Heritage Farm status, each family must maintain ownership of the land for […] Comments Off on Secretary Naig Honors Century and Heritage Farm Families in Central Iowa Posted on 29 October 2020 by KWBG DES MOINES, IowaᅳThe weekly fuel report by the Iowa Department of Agriculture and Land Stewardship showed that the price of Natural gas rose 28 cents this week, currently at $3.29/MMbtu.', 'perplexity': 0, 'highlight_sentence_for_ai': False}, {'generated_prob': 0.00043032283429056406, 'sentence': 'Crude Oil Summary The price of global crude oil fell this week on the West Texas Intermediate (WTI) by $4.45 per barrel over last week, […] Comments Off on Weekly Fuel Report, Natural Gas Prices Continue to Climb Posted on 29 October 2020 by KWBG Comments Off on Mike Wendel, Director, James H. Andrew Railroad Museum and History Center, “All Aboard” Campaign for Boone and Scenic Valley Railroad, Aired Thursday, October 29, 2020 Posted on 29 October 2020 by KWBG BOONE, IowaᅳAlliant Energy customers on the southside of Boone and some in the rural part of Boone County sustained a power outage this afternoon.', 'perplexity': 0, 'highlight_sentence_for_ai': False}, {'generated_prob': 0.00032412621658295393, 'sentence': 'A report from Alliant said the cause was an issue at the substation on the south side of Boone.', 'perplexity': 0, 'highlight_sentence_for_ai': False}, {'generated_prob': 0.00042289990233257413, 'sentence': 'The incident occurred shortly after 2:00.', 'perplexity': 0, 'highlight_sentence_for_ai': False}, {'generated_prob': 0.0003801107231993228, 'sentence': 'Service is expected to be restored […] Comments Off on Alliant Power Outage Posted on 29 October 2020 by KWBG BOONE, IowaᅳA portion of the Alliant Energy service area in Boone and Boone County is currently experiencing an outage.', 'perplexity': 0, 'highlight_sentence_for_ai': False}, {'generated_prob': 0.0004897637409158051, 'sentence': 'There has been no report on the cause or when service will be restored.', 'perplexity': 0, 'highlight_sentence_for_ai': False}, {'generated_prob': 0.0004386449290905148, 'sentence': 'Comments Off on Alliant Energy Power Outage Loading crossword puzzle.', 'perplexity': 0, 'highlight_sentence_for_ai': False}, {'generated_prob': 0.0007825577631592751, 'sentence': 'One moment please.', 'perplexity': 0, 'highlight_sentence_for_ai': False}, {'generated_prob': 0.00044714100658893585, 'sentence': 'Copyright © KWBG Radio | Boone, Iowa.Original News Theme by.', 'perplexity': 0, 'highlight_sentence_for_ai': False}], 'paragraphs': [{'start_sentence_index': 0, 'num_sentences': 21, 'completely_generated_prob': 1.369041255298935e-18}], 'completely_generated_prob': 0.009998674697021016, 'class_probabilities': {'human': 0.990001325302979, 'ai': 0.009998674697021016, 'mixed': 0}, 'average_generated_prob': 0, 'predicted_class': 'human', 'confidence_score': 0.990001325302979, 'confidence_category': 'high', 'confidence_scores_raw': {'identity': {'ai': 0.009998674697021016, 'human': 0.990001325302979, 'mixed': 0}}, 'confidence_thresholds_raw': {'identity': {'ai': {'reject': 0.65, 'low': 0.75, 'medium': 0.92}, 'human': {'reject': 0.7, 'low': 0.82, 'medium': 0.92}, 'mixed': {'reject': 0.7, 'low': 0.8, 'medium': 0.88}}}, 'overall_burstiness': 0, 'writing_stats': {}, 'subclass': {'ai': {}, 'human': {}, 'mixed': {}}, 'result_message': 'Our detector is highly confident that the text is written entirely by a human.', 'document_classification': 'HUMAN_ONLY', 'version': '2025-01-09-base', 'language': 'en', 'pageNumber': 0, 'inputText': 'Posted on 31 October 2020 by KWBG We still get many phone calls and emails from people asking where do I vote on November 3rd in Boone County? Here is a handy website to use so you know where to go and exercise your right to vote. Just enter your house number, street name and zip code and……….there ya go, your polling […] Comments Off on Where do I vote in Boone County? Posted on 30 October 2020 by KWBG ANKENY, Iowa—A military veteran persevered through a pandemic and his wife accepting a job out-of-state to complete his DMACC Automotive Technology Associate Degree and go on to become the first DMACC Subaru-U graduate. Jared Szczepanski said when he was nearing the end of his enlistment with the U.S. Air Force, he was looking for opportunities in the automotive industry. […] Comments Off on Military Veteran First to Complete DMACC’s Subaru-U Program Posted on 30 October 2020 by KWBG Don’t forget Saturday Night (October 31st) before you go to bed, set your clocks back one hour and check the batteries in your smoke detectors Comments Off on Fall Back/Check your batteries Posted on 30 October 2020 by KWBG Hocus Pocus Buns 2 cans crescent rolls 16 marshmallows 1/4 cup butter 1/4 cup sugar 1 tsp cinnamon Preheat oven to 375. Add butter to a small glass bowl and heat in the microwave for 30 seconds, until fully melted. In another small bowl, combine cinnamon and sugar. Line a baking sheet with parchment paper. […] Comments Off on Friday’s Recipes: Hocus Pocus Buns, Roasted Pumpkin Seeds and Classic Cinnamon Rolls Posted on 30 October 2020 by KWBG BOONE, Iowa—Due to unforeseen circumstances, the graveside service for Rolland “Brodie” Mosman of Boone, Iowa, originally scheduled for Saturday, October 31, 2020 must be canceled and will take place at a later date. The Schroeder-Stark-Welin Funeral Home, 609 7th Street, Boone, Iowa is assisting the family with the arrangements. Comments Off on Rolland “Brodie” Mosman Posted on 30 October 2020 by KWBG DES MOINES, Iowa—Iowa Secretary of Agriculture Mike Naig and Iowa Farm Bureau Federation President Craig Hill honored families from Boone, Buena Vista, Cerro Gordo, Clay, Madison, Mahaska, Marion, Shelby and Story counties with Century and Heritage Farm awards today. To achieve Century or Heritage Farm status, each family must maintain ownership of the land for […] Comments Off on Secretary Naig Honors Century and Heritage Farm Families in Central Iowa Posted on 29 October 2020 by KWBG DES MOINES, Iowa—The weekly fuel report by the Iowa Department of Agriculture and Land Stewardship showed that the price of Natural gas rose 28 cents this week, currently at $3.29/MMbtu. Crude Oil Summary The price of global crude oil fell this week on the West Texas Intermediate (WTI) by $4.45 per barrel over last week, […] Comments Off on Weekly Fuel Report, Natural Gas Prices Continue to Climb Posted on 29 October 2020 by KWBG Comments Off on Mike Wendel, Director, James H. Andrew Railroad Museum and History Center, “All Aboard” Campaign for Boone and Scenic Valley Railroad, Aired Thursday, October 29, 2020 Posted on 29 October 2020 by KWBG BOONE, Iowa—Alliant Energy customers on the southside of Boone and some in the rural part of Boone County sustained a power outage this afternoon. A report from Alliant said the cause was an issue at the substation on the south side of Boone. The incident occurred shortly after 2:00. Service is expected to be restored […] Comments Off on Alliant Power Outage Posted on 29 October 2020 by KWBG BOONE, Iowa—A portion of the Alliant Energy service area in Boone and Boone County is currently experiencing an outage. There has been no report on the cause or when service will be restored. Comments Off on Alliant Energy Power Outage Loading crossword puzzle. One moment please. Copyright © KWBG Radio | Boone, Iowa.Original News Theme by .'}]"
