File,version,documents
MD_2023_02f75bc90aa8cca47f692ca836828298.html.gz,2025-01-09-base,"[{'sentences': [{'generated_prob': 0.00018982455367222428, 'sentence': 'The first official trailer for the highly anticipated sci-fi epic sequel “Dune: Part 2” has been released, starring Timothée Chalamet and Zendaya.', 'perplexity': 0, 'highlight_sentence_for_ai': False}, {'generated_prob': 0.0002667763037607074, 'sentence': ""In 2021's “Dune,” Paul Atreides (Timothée Chalamet) ventured to Arrakis, the universe's most dangerous and sandiest planet, to ensure his family and people's future as evil forces exploded in conflict."", 'perplexity': 0, 'highlight_sentence_for_ai': False}, {'generated_prob': 0.0003595090238377452, 'sentence': 'In the sequel, Atreides teams up with Chani (Zendaya) and the Fremen to exact revenge on those who destroyed his family, and he must juggle his love life with the fate of the universe at stake.', 'perplexity': 0, 'highlight_sentence_for_ai': False}, {'generated_prob': 0.00028491378179751337, 'sentence': 'The trailer shows Paul riding the back of a massive sand worm on the deserts of Arrakis while Chani and the Fremen cheer him on.', 'perplexity': 0, 'highlight_sentence_for_ai': False}, {'generated_prob': 0.00027176860021427274, 'sentence': '“Dune: Part 2” also introduces newcomers Léa Seydoux as Lady Margot, a Bene Gesserit, Souheila Yacoub as a Fremen warrior and Tim Blake Nelson.', 'perplexity': 0, 'highlight_sentence_for_ai': False}, {'generated_prob': 0.00021510710939764977, 'sentence': 'Returning to the cast alongside Chalamet and Zendaya are Rebecca Ferguson, Javier Bardem, Josh Brolin, Skarsgård, Dave Bautista, Charlotte Rampling and Stephen McKinley Henderson.', 'perplexity': 0, 'highlight_sentence_for_ai': False}, {'generated_prob': 0.0004190065374132246, 'sentence': 'Villeneuve directed the sequel and penned it with Jon Spaihts.', 'perplexity': 0, 'highlight_sentence_for_ai': False}, {'generated_prob': 0.0003722245746757835, 'sentence': '“Dune: Part 2” will hit theaters Nov. 3.', 'perplexity': 0, 'highlight_sentence_for_ai': False}, {'generated_prob': 0.0005996568943373859, 'sentence': 'Check out the trailer - here.', 'perplexity': 0, 'highlight_sentence_for_ai': False}, {'generated_prob': 0.0008558379486203194, 'sentence': ""'Dune 2' Updates: The First Trailer, Release Date & Everything Else You Need To Know Editorial credit: Andrea Raffin / Shutterstock.com Be the first to know latest important news & events directly to your inbox."", 'perplexity': 0, 'highlight_sentence_for_ai': False}, {'generated_prob': 0.0016829305095598102, 'sentence': '* *', 'perplexity': 0, 'highlight_sentence_for_ai': False}], 'paragraphs': [{'start_sentence_index': 0, 'num_sentences': 11, 'completely_generated_prob': 7.905466206762634e-10}], 'completely_generated_prob': 0.006608679833334144, 'class_probabilities': {'human': 0.9933913201666659, 'ai': 0.006608679833334144, 'mixed': 0}, 'average_generated_prob': 0, 'predicted_class': 'human', 'confidence_score': 0.9933913201666659, 'confidence_category': 'high', 'confidence_scores_raw': {'identity': {'ai': 0.006608679833334144, 'human': 0.9933913201666659, 'mixed': 0}}, 'confidence_thresholds_raw': {'identity': {'ai': {'reject': 0.65, 'low': 0.75, 'medium': 0.92}, 'human': {'reject': 0.7, 'low': 0.82, 'medium': 0.92}, 'mixed': {'reject': 0.7, 'low': 0.8, 'medium': 0.88}}}, 'overall_burstiness': 0, 'writing_stats': {}, 'subclass': {'ai': {}, 'human': {}, 'mixed': {}}, 'result_message': 'Our detector is highly confident that the text is written entirely by a human.', 'document_classification': 'HUMAN_ONLY', 'version': '2025-01-09-base', 'language': 'en', 'pageNumber': 0, 'inputText': 'The first official trailer for the highly anticipated sci-fi epic sequel “Dune: Part 2” has been released, starring Timothée Chalamet and Zendaya. In 2021’s “Dune,” Paul Atreides (Timothée Chalamet) ventured to Arrakis, the universe’s most dangerous and sandiest planet, to ensure his family and people’s future as evil forces exploded in conflict. In the sequel, Atreides teams up with Chani (Zendaya) and the Fremen to exact revenge on those who destroyed his family, and he must juggle his love life with the fate of the universe at stake. The trailer shows Paul riding the back of a massive sand worm on the deserts of Arrakis while Chani and the Fremen cheer him on. “Dune: Part 2” also introduces newcomers Léa Seydoux as Lady Margot, a Bene Gesserit, Souheila Yacoub as a Fremen warrior and Tim Blake Nelson. Returning to the cast alongside Chalamet and Zendaya are Rebecca Ferguson, Javier Bardem, Josh Brolin, Skarsgård, Dave Bautista, Charlotte Rampling and Stephen McKinley Henderson. Villeneuve directed the sequel and penned it with Jon Spaihts. “Dune: Part 2” will hit theaters Nov. 3. Check out the trailer – here. ‘Dune 2’ Updates: The First Trailer, Release Date & Everything Else You Need To Know Editorial credit: Andrea Raffin / Shutterstock.com Be the first to know latest important news & events directly to your inbox. * *'}]"
MD_2023_50d44d79e6018ee16d1209f15ed6a1ee.html.gz,2025-01-09-base,"[{'sentences': [{'generated_prob': 2.0536856027320027e-05, 'sentence': 'Across the hall at 98 Rock, Josh Spiegel has become one of the most unique news voices in Baltimore.', 'perplexity': 0, 'highlight_sentence_for_ai': False}, {'generated_prob': 2.0354485968709923e-05, 'sentence': 'Now Josh brings his own spin to the stories of the day to WBAL.', 'perplexity': 0, 'highlight_sentence_for_ai': False}, {'generated_prob': 2.2827827706350945e-05, 'sentence': ""Star golfer Scottie Scheffler was arrested last week prior to the start of the PGA Championship's second round."", 'perplexity': 0, 'highlight_sentence_for_ai': False}, {'generated_prob': 2.0499945094343275e-05, 'sentence': 'Scheffler, 27, was arrested for striking a police officer with his SUV as he was trying to drive around In his latest commentary, Josh Spiegel runs through a list of issues surrounding the Maryland primary.', 'perplexity': 0, 'highlight_sentence_for_ai': False}, {'generated_prob': 2.1224672309472226e-05, 'sentence': 'In his latest commentary, Josh Spiegel lets the masses know to get their “special glasses” as the country prepares for its first total solar eclipse in seven years.', 'perplexity': 0, 'highlight_sentence_for_ai': False}, {'generated_prob': 1.824544415285345e-05, 'sentence': ""In his latest commentary, Josh Spiegel speaks on the Francis Scott Key Bridge collapse and the Baltimore Orioles Opening Day, calling it “a roller coaster of emotions that couldn't be further apart.” LISTEN: The first U.S. spacecraft to land on the moon in more than 50 years will cut its mission short after landing sideways on the moon."", 'perplexity': 0, 'highlight_sentence_for_ai': False}, {'generated_prob': 1.8457998521625996e-05, 'sentence': ""In his latest commentary, Josh Spiegel discussed last week's landing of Odysseus Whether it was the outcome or the entertainment lineup, everyone had an opinion when it came to this year's Super Bowl matchup between the Kansas City Chiefs and San Francisco 49ers."", 'perplexity': 0, 'highlight_sentence_for_ai': False}, {'generated_prob': 1.8076789274346083e-05, 'sentence': 'In his latest commentary, Josh Spiegel In his latest commentary, Josh Spiegel discusses how hard it is to concentrate on the AFC Championship matchup between the Baltimore Ravens and Kansas City Chiefs when Taylor Swift is coming to Charm City to cheer on In his latest commentary, Josh Spiegel discusses the alleged sex scandal that has rocked Capitol Hill in Washington DC and how it involves a former aide to Maryland Democratic Sen. Ben Cardin.', 'perplexity': 0, 'highlight_sentence_for_ai': False}, {'generated_prob': 1.602213887963444e-05, 'sentence': 'In his latest commentary, Josh Spiegel discussed the rise of antisemitism in the United States.', 'perplexity': 0, 'highlight_sentence_for_ai': False}, {'generated_prob': 1.7318796381005086e-05, 'sentence': 'In his latest commentary, Josh Spiegel discussed the dangers that come from deer mating season.', 'perplexity': 0, 'highlight_sentence_for_ai': False}, {'generated_prob': 1.7759701222530566e-05, 'sentence': 'He even shares a traumatic experience.', 'perplexity': 0, 'highlight_sentence_for_ai': False}, {'generated_prob': 1.4451697097683791e-05, 'sentence': 'In his latest commentary, Josh Spiegel discussed the war between Israel and Hamas.', 'perplexity': 0, 'highlight_sentence_for_ai': False}, {'generated_prob': 2.047143061645329e-05, 'sentence': ""In his latest commentary, Josh Spiegel discussed placing term limits on everyone amid Senate GOP Leader Mitch McConnell's latest freeze-up."", 'perplexity': 0, 'highlight_sentence_for_ai': False}, {'generated_prob': 1.919441820064094e-05, 'sentence': 'In his latest commentary, Josh Spiegel discussed the issues in Howard County as it relates to the 20 school bus routes being canceled during the first week of classes.', 'perplexity': 0, 'highlight_sentence_for_ai': False}, {'generated_prob': 2.3175240130512975e-05, 'sentence': 'In his latest commentary, Josh Spiegel discussed the violent storms that rolled through Maryland on Monday, and how he kept himself occupied while dealing with multiple crises.', 'perplexity': 0, 'highlight_sentence_for_ai': False}, {'generated_prob': 0.0017815693281590939, 'sentence': 'In his latest commentary, Josh Spiegel discussed the Canadian wildfires that brought haze and air quality alerts to Maryland.', 'perplexity': 0, 'highlight_sentence_for_ai': False}, {'generated_prob': 0.0015461492585018277, 'sentence': 'In his latest commentary, Josh Spiegel discusses the rise of Marijuana poisoning in dogs.', 'perplexity': 0, 'highlight_sentence_for_ai': False}, {'generated_prob': 0.0017056071665138006, 'sentence': ""In his latest commentary, Josh Spiegel discusses his latest trip to an Urgent Care, and what's up with the bees?"", 'perplexity': 0, 'highlight_sentence_for_ai': False}, {'generated_prob': 0.0019277962855994701, 'sentence': ""In his latest commentary, Josh Spiegel says lawmakers were able to come together and “unite against contaminated water coming to Baltimore.” In his latest commentary, Josh Spiegel says Baltimore City Councilman Ryan Dorsey's proposal to ban gas-powered leaf blowers is genius."", 'perplexity': 0, 'highlight_sentence_for_ai': False}, {'generated_prob': 0.0016134976176545024, 'sentence': 'In his latest commentary, Josh Spiegel wonders how it is possible that aliens could be on the brink of invading Earth and we are not worried.', 'perplexity': 0, 'highlight_sentence_for_ai': False}, {'generated_prob': 0.0029249037615954876, 'sentence': 'In his latest commentary, Josh Spiegel says the State of the Union “speech itself was raucous.” WBAL NewsRadio 1090, FM 101.5 and the WBAL mobile app.', 'perplexity': 0, 'highlight_sentence_for_ai': False}, {'generated_prob': 0.013725199736654758, 'sentence': 'All day, every day: News, weather and traffic.', 'perplexity': 0, 'highlight_sentence_for_ai': False}, {'generated_prob': 0.018402019515633583, 'sentence': 'Also, insight and analysis, and the flagship stations for the Baltimore Ravens, the Baltimore Orioles and Navy Football.', 'perplexity': 0, 'highlight_sentence_for_ai': False}, {'generated_prob': 0.024180931970477104, 'sentence': 'Hearst Television participates in various affiliate marketing programs, which means we may get paid commissions on purchases made through our links to retailer sites.©2023, Hearst Television Inc. on behalf of WBAL NewsRadio 1090 and FM 101.5', 'perplexity': 0, 'highlight_sentence_for_ai': False}], 'paragraphs': [{'start_sentence_index': 0, 'num_sentences': 24, 'completely_generated_prob': 3.0444088223900345e-21}], 'completely_generated_prob': 0.021596770642208406, 'class_probabilities': {'human': 0.9781216349765232, 'ai': 0.021596770642208406, 'mixed': 0.00028159438126836863}, 'average_generated_prob': 0, 'predicted_class': 'human', 'confidence_score': 0.9781216349765232, 'confidence_category': 'high', 'confidence_scores_raw': {'identity': {'ai': 0.021596770642208406, 'human': 0.9781216349765232, 'mixed': 0.00028159438126836863}}, 'confidence_thresholds_raw': {'identity': {'ai': {'reject': 0.65, 'low': 0.75, 'medium': 0.92}, 'human': {'reject': 0.7, 'low': 0.82, 'medium': 0.92}, 'mixed': {'reject': 0.7, 'low': 0.8, 'medium': 0.88}}}, 'overall_burstiness': 0, 'writing_stats': {}, 'subclass': {'ai': {}, 'human': {}, 'mixed': {}}, 'result_message': 'Our detector is highly confident that the text is written entirely by a human.', 'document_classification': 'HUMAN_ONLY', 'version': '2025-01-09-base', 'language': 'en', 'pageNumber': 0, 'inputText': 'Across the hall at 98 Rock, Josh Spiegel has become one of the most unique news voices in Baltimore. Now Josh brings his own spin to the stories of the day to WBAL. Star golfer Scottie Scheffler was arrested last week prior to the start of the PGA Championship’s second round. Scheffler, 27, was arrested for striking a police officer with his SUV as he was trying to drive around In his latest commentary, Josh Spiegel runs through a list of issues surrounding the Maryland primary. In his latest commentary, Josh Spiegel lets the masses know to get their “special glasses” as the country prepares for its first total solar eclipse in seven years. In his latest commentary, Josh Spiegel speaks on the Francis Scott Key Bridge collapse and the Baltimore Orioles Opening Day, calling it “a roller coaster of emotions that couldn’t be further apart.” LISTEN: The first U.S. spacecraft to land on the moon in more than 50 years will cut its mission short after landing sideways on the moon. In his latest commentary, Josh Spiegel discussed last week’s landing of Odysseus Whether it was the outcome or the entertainment lineup, everyone had an opinion when it came to this year’s Super Bowl matchup between the Kansas City Chiefs and San Francisco 49ers. In his latest commentary, Josh Spiegel In his latest commentary, Josh Spiegel discusses how hard it is to concentrate on the AFC Championship matchup between the Baltimore Ravens and Kansas City Chiefs when Taylor Swift is coming to Charm City to cheer on In his latest commentary, Josh Spiegel discusses the alleged sex scandal that has rocked Capitol Hill in Washington DC and how it involves a former aide to Maryland Democratic Sen. Ben Cardin. In his latest commentary, Josh Spiegel discussed the rise of antisemitism in the United States. In his latest commentary, Josh Spiegel discussed the dangers that come from deer mating season. He even shares a traumatic experience. In his latest commentary, Josh Spiegel discussed the war between Israel and Hamas. In his latest commentary, Josh Spiegel discussed placing term limits on everyone amid Senate GOP Leader Mitch McConnell’s latest freeze-up. In his latest commentary, Josh Spiegel discussed the issues in Howard County as it relates to the 20 school bus routes being canceled during the first week of classes. In his latest commentary, Josh Spiegel discussed the violent storms that rolled through Maryland on Monday, and how he kept himself occupied while dealing with multiple crises. In his latest commentary, Josh Spiegel discussed the Canadian wildfires that brought haze and air quality alerts to Maryland. In his latest commentary, Josh Spiegel discusses the rise of Marijuana poisoning in dogs. In his latest commentary, Josh Spiegel discusses his latest trip to an Urgent Care, and what’s up with the bees? In his latest commentary, Josh Spiegel says lawmakers were able to come together and “unite against contaminated water coming to Baltimore.” In his latest commentary, Josh Spiegel says Baltimore City Councilman Ryan Dorsey’s proposal to ban gas-powered leaf blowers is genius. In his latest commentary, Josh Spiegel wonders how it is possible that aliens could be on the brink of invading Earth and we are not worried. In his latest commentary, Josh Spiegel says the State of the Union “speech itself was raucous.” WBAL NewsRadio 1090, FM 101.5 and the WBAL mobile app. All day, every day: News, weather and traffic. Also, insight and analysis, and the flagship stations for the Baltimore Ravens, the Baltimore Orioles and Navy Football. Hearst Television participates in various affiliate marketing programs, which means we may get paid commissions on purchases made through our links to retailer sites.©2023, Hearst Television Inc. on behalf of WBAL NewsRadio 1090 and FM 101.5'}]"
MD_2023_7aac14e830c31c415b3046a02cfc7a5a.html.gz,2025-01-09-base,"[{'sentences': [{'generated_prob': 0.0002408389700576663, 'sentence': 'Paris Hilton surprised fans by dropping a re-recorded version of her 2006 hit “Stars Are Blind” on Amazon Music.', 'perplexity': 0, 'highlight_sentence_for_ai': False}, {'generated_prob': 0.00022032801643945277, 'sentence': ""Hilton, 41, announced the news on Instagram, posting a photo of the album art alongside a video and photo of a digital billboard in New York City's Times Square advertising the song and writing the caption:“Surprise!"", 'perplexity': 0, 'highlight_sentence_for_ai': False}, {'generated_prob': 0.0005471999756991863, 'sentence': ""I just dropped an updated version of “Stars Are Blind (Paris' Version).” Check it out exclusively on @AmazonMusic This song has always meant so much to me, it felt right to close out 2022 with a refreshed version."", 'perplexity': 0, 'highlight_sentence_for_ai': False}, {'generated_prob': 0.0005732456338591874, 'sentence': 'And seeing my face lighting up Times Square is so special.', 'perplexity': 0, 'highlight_sentence_for_ai': False}, {'generated_prob': 0.0005421979585662484, 'sentence': 'Thank you to everyone who has always supported my music career.', 'perplexity': 0, 'highlight_sentence_for_ai': False}, {'generated_prob': 0.0003259059158153832, 'sentence': 'I literally have the best fans on the planet and have loved seeing all of your posts about the new song.', 'perplexity': 0, 'highlight_sentence_for_ai': False}, {'generated_prob': 0.00038879859494045377, 'sentence': 'P.S.', 'perplexity': 0, 'highlight_sentence_for_ai': False}, {'generated_prob': 0.00041340215830132365, 'sentence': ""More new music to come in the new year #NewYearNewP#StarsAreBlind” Hilton's music career was launched towards the end of her time on “The Simple Life,” which aired from 2003 to 2007."", 'perplexity': 0, 'highlight_sentence_for_ai': False}, {'generated_prob': 0.0003430024953559041, 'sentence': 'Her debut studio album “Paris” dropped in August 2006, with the tracks “Turn It Up,” and “Nothing In This World” in addition to “Stars Are Blind.” The latter song peaked at No.', 'perplexity': 0, 'highlight_sentence_for_ai': False}, {'generated_prob': 0.0003569011460058391, 'sentence': '18 on the Billboard Hot 100 chart.', 'perplexity': 0, 'highlight_sentence_for_ai': False}, {'generated_prob': 0.0003462545573711395, 'sentence': 'For the last decade, Hilton has also been moonlighting as a professional DJ.', 'perplexity': 0, 'highlight_sentence_for_ai': False}, {'generated_prob': 0.0004141655517742038, 'sentence': 'Editorial credit: Tinseltown / Shutterstock.com Be the first to know latest important news & events directly to your inbox.', 'perplexity': 0, 'highlight_sentence_for_ai': False}, {'generated_prob': 0.00039284926606342196, 'sentence': '* *', 'perplexity': 0, 'highlight_sentence_for_ai': False}], 'paragraphs': [{'start_sentence_index': 0, 'num_sentences': 13, 'completely_generated_prob': 1.4476848035102901e-11}], 'completely_generated_prob': 0.00982192507144982, 'class_probabilities': {'human': 0.9901780749285501, 'ai': 0.00982192507144982, 'mixed': 0}, 'average_generated_prob': 0, 'predicted_class': 'human', 'confidence_score': 0.9901780749285501, 'confidence_category': 'high', 'confidence_scores_raw': {'identity': {'ai': 0.00982192507144982, 'human': 0.9901780749285501, 'mixed': 0}}, 'confidence_thresholds_raw': {'identity': {'ai': {'reject': 0.65, 'low': 0.75, 'medium': 0.92}, 'human': {'reject': 0.7, 'low': 0.82, 'medium': 0.92}, 'mixed': {'reject': 0.7, 'low': 0.8, 'medium': 0.88}}}, 'overall_burstiness': 0, 'writing_stats': {}, 'subclass': {'ai': {}, 'human': {}, 'mixed': {}}, 'result_message': 'Our detector is highly confident that the text is written entirely by a human.', 'document_classification': 'HUMAN_ONLY', 'version': '2025-01-09-base', 'language': 'en', 'pageNumber': 0, 'inputText': 'Paris Hilton surprised fans by dropping a re-recorded version of her 2006 hit “Stars Are Blind” on Amazon Music. Hilton, 41, announced the news on Instagram, posting a photo of the album art alongside a video and photo of a digital billboard in New York City’s Times Square advertising the song and writing the caption:“Surprise! I just dropped an updated version of “Stars Are Blind (Paris’ Version).” Check it out exclusively on @AmazonMusic This song has always meant so much to me, it felt right to close out 2022 with a refreshed version. And seeing my face lighting up Times Square is so special. Thank you to everyone who has always supported my music career. I literally have the best fans on the planet and have loved seeing all of your posts about the new song. P.S. More new music to come in the new year #NewYearNewP#StarsAreBlind” Hilton’s music career was launched towards the end of her time on “The Simple Life,” which aired from 2003 to 2007. Her debut studio album “Paris” dropped in August 2006, with the tracks “Turn It Up,” and “Nothing In This World” in addition to “Stars Are Blind.” The latter song peaked at No. 18 on the Billboard Hot 100 chart. For the last decade, Hilton has also been moonlighting as a professional DJ. Editorial credit: Tinseltown / Shutterstock.com Be the first to know latest important news & events directly to your inbox. * *'}]"
