File,version,documents
SC_2024_12103412a53c60e7ed3a0f5b6fe57fb1.html.gz,2025-01-09-base,"[{'sentences': [{'generated_prob': 0.010452153161168098, 'sentence': ""Next up in 5 Example video title will go here for this video Next up in 5 Example video title will go here for this video PINEVILLE, N.C. ᅳ An argument over a customer's dog food and chicken led to a Walmart employee getting shot on Sunday, Pineville police said."", 'perplexity': 0, 'highlight_sentence_for_ai': False}, {'generated_prob': 0.013470249250531197, 'sentence': 'Pineville police responded to a reported shooting at the Walmart on Pineville-Matthews Road around 6:30 p.m. on Jan. 28.', 'perplexity': 0, 'highlight_sentence_for_ai': False}, {'generated_prob': 0.011503673158586025, 'sentence': 'When officers arrived, they found an employee who had been shot in the leg and learned that the whole incident apparently started over a self-checkout dispute.', 'perplexity': 0, 'highlight_sentence_for_ai': False}, {'generated_prob': 0.012516599148511887, 'sentence': 'You can stream WCNC Charlotte on Roku, Amazon Fire TV and Apple TV, just download the free app.', 'perplexity': 0, 'highlight_sentence_for_ai': False}, {'generated_prob': 0.007128001190721989, 'sentence': ""According to Pineville detectives, a Walmart employee noticed that Jonathan Alan Smith didn't scan some chicken and dog food while checking out."", 'perplexity': 0, 'highlight_sentence_for_ai': False}, {'generated_prob': 0.004184523597359657, 'sentence': 'The employee confronted Smith, who then scanned the dog food but did not pay for the chicken, investigators claimed.', 'perplexity': 0, 'highlight_sentence_for_ai': False}, {'generated_prob': 0.006331338081508875, 'sentence': 'Smith and the employee then got into an argument that led to a brief fight that was broken up by a group of employees.', 'perplexity': 0, 'highlight_sentence_for_ai': False}, {'generated_prob': 0.008677748963236809, 'sentence': 'Smith allegedly returned to the store a short time later with a gun, according to Pineville police.', 'perplexity': 0, 'highlight_sentence_for_ai': False}, {'generated_prob': 0.010189028456807137, 'sentence': 'Smith is accused of entering the store and confronting multiple employees before another fight broke out.', 'perplexity': 0, 'highlight_sentence_for_ai': False}, {'generated_prob': 0.010360727086663246, 'sentence': ""The gun fell out of Smith's pocket, leading to the employees and Smith struggling to control the weapon."", 'perplexity': 0, 'highlight_sentence_for_ai': False}, {'generated_prob': 0.013279249891638756, 'sentence': 'The gun then went off, shooting one of the employees in the knee.', 'perplexity': 0, 'highlight_sentence_for_ai': False}, {'generated_prob': 0.016015252098441124, 'sentence': 'Smith was arrested at the store and charged with assault with a deadly weapon inflicting serious injury and larceny.', 'perplexity': 0, 'highlight_sentence_for_ai': False}, {'generated_prob': 0.0012783212587237358, 'sentence': 'The employee was treated for their injuries and is expected to be OK, according to police.', 'perplexity': 0, 'highlight_sentence_for_ai': False}, {'generated_prob': 0.0016642307164147496, 'sentence': 'For the latest breaking news, weather and traffic alerts, download the WCNC Charlotte mobile app and enable push notifications.', 'perplexity': 0, 'highlight_sentence_for_ai': False}, {'generated_prob': 0.0013524512760341167, 'sentence': 'RELATED: You can start filing your taxes Monday.', 'perplexity': 0, 'highlight_sentence_for_ai': False}, {'generated_prob': 0.0016667062882333994, 'sentence': 'Here are free options for 2024 RELATED: No, there is no law against returning alcohol that has gone bad in North Carolina WCNC Charlotte is committed to reporting on the many issues facing the communities we serve.', 'perplexity': 0, 'highlight_sentence_for_ai': False}, {'generated_prob': 0.0011631454108282924, 'sentence': 'We tell the stories of people working to solve persistent social problems.', 'perplexity': 0, 'highlight_sentence_for_ai': False}, {'generated_prob': 0.0012106194626539946, 'sentence': 'We examine how problems can be solved or addressed to improve the quality of life and make a positive difference.', 'perplexity': 0, 'highlight_sentence_for_ai': False}, {'generated_prob': 0.0007901579956524074, 'sentence': 'WCNC Charlotte is seeking solutions for you.', 'perplexity': 0, 'highlight_sentence_for_ai': False}, {'generated_prob': 0.0014286631485447288, 'sentence': 'Send your tips or questions to newstips@wcnc.com.', 'perplexity': 0, 'highlight_sentence_for_ai': False}, {'generated_prob': 0.0007181970868259668, 'sentence': 'Flashpoint is a weekly in-depth look at politics in Charlotte, North Carolina, South Carolina, and beyond with host Ben Thompson.', 'perplexity': 0, 'highlight_sentence_for_ai': False}, {'generated_prob': 0.0006721829995512962, 'sentence': ""Listen to the podcast weekly.SUBSCRIBE: Apple Podcasts || Spotify || Pandora || Google Podcasts || iHeart All of WCNC Charlotte's podcasts are free and available for both streaming and download."", 'perplexity': 0, 'highlight_sentence_for_ai': False}, {'generated_prob': 0.0005189538351260126, 'sentence': 'You can listen now on Android, iPhone, Amazon, and other internet-connected devices.', 'perplexity': 0, 'highlight_sentence_for_ai': False}, {'generated_prob': 0.0008095288649201393, 'sentence': 'Join us from North Carolina, South Carolina, or on the go anywhere.', 'perplexity': 0, 'highlight_sentence_for_ai': False}, {'generated_prob': 0.0011536609381437302, 'sentence': 'Notifications can be turned off anytime in the browser settings.', 'perplexity': 0, 'highlight_sentence_for_ai': False}], 'paragraphs': [{'start_sentence_index': 0, 'num_sentences': 25, 'completely_generated_prob': 3.9598404170377325e-22}], 'completely_generated_prob': 0.024461651786716186, 'class_probabilities': {'human': 0.9754981327244504, 'ai': 0.024461651786716186, 'mixed': 4.0215488833363626e-05}, 'average_generated_prob': 0, 'predicted_class': 'human', 'confidence_score': 0.9754981327244504, 'confidence_category': 'high', 'confidence_scores_raw': {'identity': {'ai': 0.024461651786716186, 'human': 0.9754981327244504, 'mixed': 4.0215488833363626e-05}}, 'confidence_thresholds_raw': {'identity': {'ai': {'reject': 0.65, 'low': 0.75, 'medium': 0.92}, 'human': {'reject': 0.7, 'low': 0.82, 'medium': 0.92}, 'mixed': {'reject': 0.7, 'low': 0.8, 'medium': 0.88}}}, 'overall_burstiness': 0, 'writing_stats': {}, 'subclass': {'ai': {}, 'human': {}, 'mixed': {}}, 'result_message': 'Our detector is highly confident that the text is written entirely by a human.', 'document_classification': 'HUMAN_ONLY', 'version': '2025-01-09-base', 'language': 'en', 'pageNumber': 0, 'inputText': ""Next up in 5 Example video title will go here for this video Next up in 5 Example video title will go here for this video PINEVILLE, N.C. — An argument over a customer's dog food and chicken led to a Walmart employee getting shot on Sunday, Pineville police said. Pineville police responded to a reported shooting at the Walmart on Pineville-Matthews Road around 6:30 p.m. on Jan. 28. When officers arrived, they found an employee who had been shot in the leg and learned that the whole incident apparently started over a self-checkout dispute. You can stream WCNC Charlotte on Roku, Amazon Fire TV and Apple TV, just download the free app. According to Pineville detectives, a Walmart employee noticed that Jonathan Alan Smith didn't scan some chicken and dog food while checking out. The employee confronted Smith, who then scanned the dog food but did not pay for the chicken, investigators claimed. Smith and the employee then got into an argument that led to a brief fight that was broken up by a group of employees. Smith allegedly returned to the store a short time later with a gun, according to Pineville police. Smith is accused of entering the store and confronting multiple employees before another fight broke out. The gun fell out of Smith's pocket, leading to the employees and Smith struggling to control the weapon. The gun then went off, shooting one of the employees in the knee. Smith was arrested at the store and charged with assault with a deadly weapon inflicting serious injury and larceny. The employee was treated for their injuries and is expected to be OK, according to police. For the latest breaking news, weather and traffic alerts, download the WCNC Charlotte mobile app and enable push notifications. RELATED: You can start filing your taxes Monday. Here are free options for 2024 RELATED: No, there is no law against returning alcohol that has gone bad in North Carolina WCNC Charlotte is committed to reporting on the many issues facing the communities we serve. We tell the stories of people working to solve persistent social problems. We examine how problems can be solved or addressed to improve the quality of life and make a positive difference. WCNC Charlotte is seeking solutions for you. Send your tips or questions to newstips@wcnc.com. Flashpoint is a weekly in-depth look at politics in Charlotte, North Carolina, South Carolina, and beyond with host Ben Thompson. Listen to the podcast weekly.SUBSCRIBE: Apple Podcasts || Spotify || Pandora || Google Podcasts || iHeart All of WCNC Charlotte's podcasts are free and available for both streaming and download. You can listen now on Android, iPhone, Amazon, and other internet-connected devices. Join us from North Carolina, South Carolina, or on the go anywhere. Notifications can be turned off anytime in the browser settings.""}]"
SC_2024_4bf68860b5387efe7efbe057a969276c.html.gz,2025-01-09-base,"[{'sentences': [{'generated_prob': 1.7579861378180794e-05, 'sentence': ""COLUMBIA, S.C. (AP) ᅳ Another Republican presidential debate has been canceled after Nikki Haley's refusal to participate in any forum that doesn't also include former President Donald Trump, meaning that for the first time in years there will not be an on-the-ground face-off ahead of New Hampshire's primary next week."", 'perplexity': 0, 'highlight_sentence_for_ai': False}, {'generated_prob': 1.734215038595721e-05, 'sentence': 'CNN announced Wednesday that it was calling off its debate, which had been scheduled for Sunday at New England College.', 'perplexity': 0, 'highlight_sentence_for_ai': False}, {'generated_prob': 2.012045843002852e-05, 'sentence': ""That comes a day after ABC and WMUR-TV said they were also canceling Thursday's debate, planned at Saint Anselm College, following Haley's assertion that the next debate in which she participates “will either be with Donald Trump or Joe Biden.” Florida Gov."", 'perplexity': 0, 'highlight_sentence_for_ai': False}, {'generated_prob': 1.5097926734597422e-05, 'sentence': ""Ron DeSantis had committed to take part in both debates, but with front-runner Trump having skipped all of the GOP debates thus far, Haley's participation had been the deciding factor in whether they would go on."", 'perplexity': 0, 'highlight_sentence_for_ai': False}, {'generated_prob': 1.5957275536493398e-05, 'sentence': 'The move by the former South Carolina governor and United Nations ambassador could be in part a result of the last debate, which featured only Haley and DeSantis.', 'perplexity': 0, 'highlight_sentence_for_ai': False}, {'generated_prob': 2.063914689642843e-05, 'sentence': ""Haley didn't perform as well as expected, and DeSantis ultimately ended up beating her for second place in Monday's lead-off Iowa caucuses."", 'perplexity': 0, 'highlight_sentence_for_ai': False}, {'generated_prob': 0.00010024290531873703, 'sentence': 'Haley\'s decision to skip prompted reaction from her GOP rivals, with DeSantis saying that Haley “is afraid to debate because she doesn\'t want to answer the tough questions"" and a Trump spokesman calling her a “desperate globalist.""', 'perplexity': 0, 'highlight_sentence_for_ai': False}, {'generated_prob': 7.239864498842508e-05, 'sentence': 'Haley had argued to caucusgoers that picking her gives Republicans a better chance to defeat Biden, a Democrat, in November, pointing to survey data showing her with the largest lead among the GOP field in a theoretical general election matchup.', 'perplexity': 0, 'highlight_sentence_for_ai': False}, {'generated_prob': 8.375805919058621e-05, 'sentence': 'Although Haley finished third in Iowa, behind Trump and DeSantis, she has been shown to be better-positioned in the next state to vote, New Hampshire, and has angled to frame the remainder of the primary as a two-person race between Trump and herself.', 'perplexity': 0, 'highlight_sentence_for_ai': False}, {'generated_prob': 7.764226756989956e-05, 'sentence': 'CNN said Wednesday that it would instead host a town hall with Haley on Thursday from New England College.', 'perplexity': 0, 'highlight_sentence_for_ai': False}, {'generated_prob': 9.769140160642564e-05, 'sentence': 'DeSantis took part in his own CNN town hall on Tuesday.', 'perplexity': 0, 'highlight_sentence_for_ai': False}, {'generated_prob': 0.00016170110029634088, 'sentence': '___ Meg Kinnard can be reached at http://twitter.com/MegKinnardAP.', 'perplexity': 0, 'highlight_sentence_for_ai': False}, {'generated_prob': 0.0003680755035020411, 'sentence': ""___ Follow the AP's coverage of the 2024 election at https://apnews.com/hub/election-2024."", 'perplexity': 0, 'highlight_sentence_for_ai': False}, {'generated_prob': 0.00045726235839538276, 'sentence': 'Help to shape our coverage of Election 2024.', 'perplexity': 0, 'highlight_sentence_for_ai': False}, {'generated_prob': 0.0004992758040316403, 'sentence': 'Submit your questions about the June primaries using the form below.', 'perplexity': 0, 'highlight_sentence_for_ai': False}, {'generated_prob': 0.0006227180710993707, 'sentence': '_', 'perplexity': 0, 'highlight_sentence_for_ai': False}], 'paragraphs': [{'start_sentence_index': 0, 'num_sentences': 16, 'completely_generated_prob': 3.4496480286678e-14}], 'completely_generated_prob': 0.003212696250244639, 'class_probabilities': {'human': 0.9967873037497554, 'ai': 0.003212696250244639, 'mixed': 0}, 'average_generated_prob': 0, 'predicted_class': 'human', 'confidence_score': 0.9967873037497554, 'confidence_category': 'high', 'confidence_scores_raw': {'identity': {'ai': 0.003212696250244639, 'human': 0.9967873037497554, 'mixed': 0}}, 'confidence_thresholds_raw': {'identity': {'ai': {'reject': 0.65, 'low': 0.75, 'medium': 0.92}, 'human': {'reject': 0.7, 'low': 0.82, 'medium': 0.92}, 'mixed': {'reject': 0.7, 'low': 0.8, 'medium': 0.88}}}, 'overall_burstiness': 0, 'writing_stats': {}, 'subclass': {'ai': {}, 'human': {}, 'mixed': {}}, 'result_message': 'Our detector is highly confident that the text is written entirely by a human.', 'document_classification': 'HUMAN_ONLY', 'version': '2025-01-09-base', 'language': 'en', 'pageNumber': 0, 'inputText': 'COLUMBIA, S.C. (AP) — Another Republican presidential debate has been canceled after Nikki Haley\'s refusal to participate in any forum that doesn\'t also include former President Donald Trump, meaning that for the first time in years there will not be an on-the-ground face-off ahead of New Hampshire\'s primary next week. CNN announced Wednesday that it was calling off its debate, which had been scheduled for Sunday at New England College. That comes a day after ABC and WMUR-TV said they were also canceling Thursday\'s debate, planned at Saint Anselm College, following Haley\'s assertion that the next debate in which she participates “will either be with Donald Trump or Joe Biden.” Florida Gov. Ron DeSantis had committed to take part in both debates, but with front-runner Trump having skipped all of the GOP debates thus far, Haley\'s participation had been the deciding factor in whether they would go on. The move by the former South Carolina governor and United Nations ambassador could be in part a result of the last debate, which featured only Haley and DeSantis. Haley didn’t perform as well as expected, and DeSantis ultimately ended up beating her for second place in Monday\'s lead-off Iowa caucuses. Haley\'s decision to skip prompted reaction from her GOP rivals, with DeSantis saying that Haley “is afraid to debate because she doesn’t want to answer the tough questions"" and a Trump spokesman calling her a “desperate globalist."" Haley had argued to caucusgoers that picking her gives Republicans a better chance to defeat Biden, a Democrat, in November, pointing to survey data showing her with the largest lead among the GOP field in a theoretical general election matchup. Although Haley finished third in Iowa, behind Trump and DeSantis, she has been shown to be better-positioned in the next state to vote, New Hampshire, and has angled to frame the remainder of the primary as a two-person race between Trump and herself. CNN said Wednesday that it would instead host a town hall with Haley on Thursday from New England College. DeSantis took part in his own CNN town hall on Tuesday. ___ Meg Kinnard can be reached at http://twitter.com/MegKinnardAP. ___ Follow the AP\'s coverage of the 2024 election at https://apnews.com/hub/election-2024. Help to shape our coverage of Election 2024. Submit your questions about the June primaries using the form below. _'}]"
SC_2024_8584cc7e4b2b30982e417c0297adea6a.html.gz,2025-01-09-base,"[{'sentences': [{'generated_prob': 5.132503792992793e-05, 'sentence': 'HOLLYWOOD, S.C. (WCSC) - Charleston County deputies confirmed Friday night that a 27-year-old man is in custody after an hours-long standoff.', 'perplexity': 0, 'highlight_sentence_for_ai': False}, {'generated_prob': 6.013857273501344e-05, 'sentence': ""Andrew Robert Mettal is charged with first-degree criminal sexual conduct and kidnapping, Charleston County Sheriff's spokesperson Alexis Douglas said."", 'perplexity': 0, 'highlight_sentence_for_ai': False}, {'generated_prob': 4.979655204806477e-05, 'sentence': ""The word of Mettal's arrest came approximately five hours after the standoff began at a home on Mauss Hill Road."", 'perplexity': 0, 'highlight_sentence_for_ai': False}, {'generated_prob': 4.246211756253615e-05, 'sentence': 'Earlier in the afternoon, Douglas said deputies believed the man was the only person inside the home but she could not confirm whether it is his home.', 'perplexity': 0, 'highlight_sentence_for_ai': False}, {'generated_prob': 3.7994170270394534e-05, 'sentence': 'She said deputies had launched a can of pepper spray into the home in an effort to drive him outside.', 'perplexity': 0, 'highlight_sentence_for_ai': False}, {'generated_prob': 4.323685425333679e-05, 'sentence': 'She also could not say whether he is believed to have any weapons inside the home.', 'perplexity': 0, 'highlight_sentence_for_ai': False}, {'generated_prob': 5.226314897299744e-05, 'sentence': ""“We've been working diligently just to make sure we can get him out safely,” she said."", 'perplexity': 0, 'highlight_sentence_for_ai': False}, {'generated_prob': 4.9235575716011226e-05, 'sentence': 'Deputies at the scene said there was no immediate threat to the public outside the immediate area where the man had barricaded himself.', 'perplexity': 0, 'highlight_sentence_for_ai': False}, {'generated_prob': 7.163816189859062e-05, 'sentence': 'No nearby homes had been evacuated as of just before 6 p.m. Friday, she said.', 'perplexity': 0, 'highlight_sentence_for_ai': False}, {'generated_prob': 0.00014525480219163, 'sentence': 'The U.S.', 'perplexity': 0, 'highlight_sentence_for_ai': False}, {'generated_prob': 0.00010956666665151715, 'sentence': ""Marshals Task Force assisted the sheriff's office during the standoff."", 'perplexity': 0, 'highlight_sentence_for_ai': False}, {'generated_prob': 0.0002899761311709881, 'sentence': 'PUBLIC ADVISORY: We ask the public to stay away from Mauss Hill Road between Moon Dam Drive and Brown Meadow Lane in Hollywood.', 'perplexity': 0, 'highlight_sentence_for_ai': False}, {'generated_prob': 0.00037538749165832996, 'sentence': 'The CCSO SWAT team is engaging a wanted suspect.', 'perplexity': 0, 'highlight_sentence_for_ai': False}, {'generated_prob': 0.00029625624301843345, 'sentence': '#chsnews This is a developing story.', 'perplexity': 0, 'highlight_sentence_for_ai': False}, {'generated_prob': 0.00030686508398503065, 'sentence': 'Check back for updates.', 'perplexity': 0, 'highlight_sentence_for_ai': False}, {'generated_prob': 0.00025402085157111287, 'sentence': 'Copyright 2024 WCSC.', 'perplexity': 0, 'highlight_sentence_for_ai': False}, {'generated_prob': 0.0001731181109789759, 'sentence': 'All rights reserved.', 'perplexity': 0, 'highlight_sentence_for_ai': False}], 'paragraphs': [{'start_sentence_index': 0, 'num_sentences': 17, 'completely_generated_prob': 4.571217651318373e-15}], 'completely_generated_prob': 0.005318440655131629, 'class_probabilities': {'human': 0.9946815593448683, 'ai': 0.005318440655131629, 'mixed': 0}, 'average_generated_prob': 0, 'predicted_class': 'human', 'confidence_score': 0.9946815593448683, 'confidence_category': 'high', 'confidence_scores_raw': {'identity': {'ai': 0.005318440655131629, 'human': 0.9946815593448683, 'mixed': 0}}, 'confidence_thresholds_raw': {'identity': {'ai': {'reject': 0.65, 'low': 0.75, 'medium': 0.92}, 'human': {'reject': 0.7, 'low': 0.82, 'medium': 0.92}, 'mixed': {'reject': 0.7, 'low': 0.8, 'medium': 0.88}}}, 'overall_burstiness': 0, 'writing_stats': {}, 'subclass': {'ai': {}, 'human': {}, 'mixed': {}}, 'result_message': 'Our detector is highly confident that the text is written entirely by a human.', 'document_classification': 'HUMAN_ONLY', 'version': '2025-01-09-base', 'language': 'en', 'pageNumber': 0, 'inputText': 'HOLLYWOOD, S.C. (WCSC) - Charleston County deputies confirmed Friday night that a 27-year-old man is in custody after an hours-long standoff. Andrew Robert Mettal is charged with first-degree criminal sexual conduct and kidnapping, Charleston County Sheriff’s spokesperson Alexis Douglas said. The word of Mettal’s arrest came approximately five hours after the standoff began at a home on Mauss Hill Road. Earlier in the afternoon, Douglas said deputies believed the man was the only person inside the home but she could not confirm whether it is his home. She said deputies had launched a can of pepper spray into the home in an effort to drive him outside. She also could not say whether he is believed to have any weapons inside the home. “We’ve been working diligently just to make sure we can get him out safely,” she said. Deputies at the scene said there was no immediate threat to the public outside the immediate area where the man had barricaded himself. No nearby homes had been evacuated as of just before 6 p.m. Friday, she said. The U.S. Marshals Task Force assisted the sheriff’s office during the standoff. PUBLIC ADVISORY: We ask the public to stay away from Mauss Hill Road between Moon Dam Drive and Brown Meadow Lane in Hollywood. The CCSO SWAT team is engaging a wanted suspect. #chsnews This is a developing story. Check back for updates. Copyright 2024 WCSC. All rights reserved.'}]"
