File,version,documents
LA_2023_027dfcefcbefe5b7cdf05c7c1f441715.html.gz,2025-01-09-base,"[{'sentences': [{'generated_prob': 0.0015464122407138348, 'sentence': 'WNTZ-TV FOX 48 | CenLANow.com Please enter a search term.', 'perplexity': 0, 'highlight_sentence_for_ai': False}, {'generated_prob': 0.0014927342999726534, 'sentence': 'Please enter a search term.', 'perplexity': 0, 'highlight_sentence_for_ai': False}, {'generated_prob': 0.0026379432529211044, 'sentence': 'by: Tara Suter, The Hill Posted: Nov 29, 2023 / 10:47 AM CST Updated: Nov 29, 2023 / 10:47 AM CST by: Tara Suter, The Hill Posted: Nov 29, 2023 / 10:47 AM CST Updated: Nov 29, 2023 / 10:47 AM CST (The Hill) - Former Rep. Liz Cheney (R-Wyo.)', 'perplexity': 0, 'highlight_sentence_for_ai': False}, {'generated_prob': 0.0008106068708002567, 'sentence': ""asserts Rep. Kevin McCarthy (R-Calif.) flew down to Mar-a-Lago three weeks after the Jan. 6, 2021, riots on the Capitol because former President Trump was “not eating.” In her new book, “Oath and Honor,” ᅳ set to be released on Dec. 5 ᅳ Cheney said she was bewildered by McCarthy's reason for his visit to the former president's residence so shortly after the insurrection, according to CNN, who obtained an advanced copy of Cheney's book."", 'perplexity': 0, 'highlight_sentence_for_ai': False}, {'generated_prob': 0.0011486607836559415, 'sentence': ""She also claims the former House Speaker told her that Trump's staff called for him to come."", 'perplexity': 0, 'highlight_sentence_for_ai': False}, {'generated_prob': 0.0013983104145154357, 'sentence': '“Mar-a-Lago?', 'perplexity': 0, 'highlight_sentence_for_ai': False}, {'generated_prob': 0.0016890049446374178, 'sentence': 'What the hell, Kevin?” Cheney asked, per CNN.', 'perplexity': 0, 'highlight_sentence_for_ai': False}, {'generated_prob': 0.002074010204523802, 'sentence': ""“They're really worried,” he replied, according to her book."", 'perplexity': 0, 'highlight_sentence_for_ai': False}, {'generated_prob': 0.002585889771580696, 'sentence': ""“Trump's not eating, so they asked me to come see him.” “What?"", 'perplexity': 0, 'highlight_sentence_for_ai': False}, {'generated_prob': 0.003144156187772751, 'sentence': ""You went to Mar-a-Lago because Trump's not eating?” Cheney said."", 'perplexity': 0, 'highlight_sentence_for_ai': False}, {'generated_prob': 0.002418620977550745, 'sentence': ""“Yeah, he's really depressed,” McCarthy added."", 'perplexity': 0, 'highlight_sentence_for_ai': False}, {'generated_prob': 0.0001826114021241665, 'sentence': 'Cheney, who has emerged as an outspoken critic of the former president since the Jan. 6 riot, recalled another incident in her book where a fellow GOP lawmaker labeled Trump as “Orange Jesus.” While in the House, she was one of 10 Republicans who voted to impeach Trump following the Capitol riots.', 'perplexity': 0, 'highlight_sentence_for_ai': False}, {'generated_prob': 0.0008392031886614859, 'sentence': 'She also served as the vice chair on the House select committee investigating the Jan. 6 insurrection.', 'perplexity': 0, 'highlight_sentence_for_ai': False}, {'generated_prob': 0.0002358475176151842, 'sentence': 'In “Oath and Honor,” CNN also reported that Cheney says that McCarthy told her Trump was aware that he had lost the 2020 presidential election to Joe Biden ᅳ and had told him so two days after the election.', 'perplexity': 0, 'highlight_sentence_for_ai': False}, {'generated_prob': 0.0002391185989836231, 'sentence': ""“He knows it's over,” McCarthy told Cheney after speaking with Trump, CNN reported."", 'perplexity': 0, 'highlight_sentence_for_ai': False}, {'generated_prob': 0.00043416221160441637, 'sentence': '“He needs to go through all the stages of grief,” he added.', 'perplexity': 0, 'highlight_sentence_for_ai': False}, {'generated_prob': 0.0006868025520816445, 'sentence': ""The Hill has reached out to McCarthy's office for comment."", 'perplexity': 0, 'highlight_sentence_for_ai': False}, {'generated_prob': 0.0006474106339737773, 'sentence': 'Copyright 2024 Nexstar Media Inc. All rights reserved.', 'perplexity': 0, 'highlight_sentence_for_ai': False}, {'generated_prob': 0.0009425862226635218, 'sentence': 'This material may not be published, broadcast, rewritten, or redistributed.', 'perplexity': 0, 'highlight_sentence_for_ai': False}, {'generated_prob': 0.00036906421883031726, 'sentence': ""If you have the type of dad whose best friend has four legs, you're in luck when it comes to shopping for a Father's Day gift."", 'perplexity': 0, 'highlight_sentence_for_ai': False}, {'generated_prob': 0.0004019287880510092, 'sentence': 'Here are the top 10 features that can help get you more than you imagined was possible for your home.', 'perplexity': 0, 'highlight_sentence_for_ai': False}, {'generated_prob': 0.0004040412895847112, 'sentence': 'Chances are you need both dethatching and aerating to maintain a healthy lawn.', 'perplexity': 0, 'highlight_sentence_for_ai': False}, {'generated_prob': 0.0002985148166771978, 'sentence': 'Learn more about what they entail and the best products to do it in this article.', 'perplexity': 0, 'highlight_sentence_for_ai': False}], 'paragraphs': [{'start_sentence_index': 0, 'num_sentences': 23, 'completely_generated_prob': 2.3367398512545458e-20}], 'completely_generated_prob': 0.01036430175130087, 'class_probabilities': {'human': 0.9895959995471407, 'ai': 0.01036430175130087, 'mixed': 3.969870155839458e-05}, 'average_generated_prob': 0, 'predicted_class': 'human', 'confidence_score': 0.9895959995471407, 'confidence_category': 'high', 'confidence_scores_raw': {'identity': {'ai': 0.01036430175130087, 'human': 0.9895959995471407, 'mixed': 3.969870155839458e-05}}, 'confidence_thresholds_raw': {'identity': {'ai': {'reject': 0.65, 'low': 0.75, 'medium': 0.92}, 'human': {'reject': 0.7, 'low': 0.82, 'medium': 0.92}, 'mixed': {'reject': 0.7, 'low': 0.8, 'medium': 0.88}}}, 'overall_burstiness': 0, 'writing_stats': {}, 'subclass': {'ai': {}, 'human': {}, 'mixed': {}}, 'result_message': 'Our detector is highly confident that the text is written entirely by a human.', 'document_classification': 'HUMAN_ONLY', 'version': '2025-01-09-base', 'language': 'en', 'pageNumber': 0, 'inputText': 'WNTZ-TV FOX 48 | CenLANow.com Please enter a search term. Please enter a search term. by: Tara Suter, The Hill Posted: Nov 29, 2023 / 10:47 AM CST Updated: Nov 29, 2023 / 10:47 AM CST by: Tara Suter, The Hill Posted: Nov 29, 2023 / 10:47 AM CST Updated: Nov 29, 2023 / 10:47 AM CST (The Hill) – Former Rep. Liz Cheney (R-Wyo.) asserts Rep. Kevin McCarthy (R-Calif.) flew down to Mar-a-Lago three weeks after the Jan. 6, 2021, riots on the Capitol because former President Trump was “not eating.” In her new book, “Oath and Honor,” — set to be released on Dec. 5 — Cheney said she was bewildered by McCarthy’s reason for his visit to the former president’s residence so shortly after the insurrection, according to CNN, who obtained an advanced copy of Cheney’s book. She also claims the former House Speaker told her that Trump’s staff called for him to come. “Mar-a-Lago? What the hell, Kevin?” Cheney asked, per CNN. “They’re really worried,” he replied, according to her book. “Trump’s not eating, so they asked me to come see him.” “What? You went to Mar-a-Lago because Trump’s not eating?” Cheney said. “Yeah, he’s really depressed,” McCarthy added. Cheney, who has emerged as an outspoken critic of the former president since the Jan. 6 riot, recalled another incident in her book where a fellow GOP lawmaker labeled Trump as “Orange Jesus.” While in the House, she was one of 10 Republicans who voted to impeach Trump following the Capitol riots. She also served as the vice chair on the House select committee investigating the Jan. 6 insurrection. In “Oath and Honor,” CNN also reported that Cheney says that McCarthy told her Trump was aware that he had lost the 2020 presidential election to Joe Biden — and had told him so two days after the election. “He knows it’s over,” McCarthy told Cheney after speaking with Trump, CNN reported. “He needs to go through all the stages of grief,” he added. The Hill has reached out to McCarthy’s office for comment. Copyright 2024 Nexstar Media Inc. All rights reserved. This material may not be published, broadcast, rewritten, or redistributed. If you have the type of dad whose best friend has four legs, you’re in luck when it comes to shopping for a Father’s Day gift. Here are the top 10 features that can help get you more than you imagined was possible for your home. Chances are you need both dethatching and aerating to maintain a healthy lawn. Learn more about what they entail and the best products to do it in this article.'}]"
LA_2023_06eff89881318eb9af0d32ff9d50c0e5.html.gz,2025-01-09-base,"[{'sentences': [{'generated_prob': 0.0011469133896753192, 'sentence': ""Menu A few dozen stories across a few months give a brief window into America's wider arc."", 'perplexity': 0, 'highlight_sentence_for_ai': False}, {'generated_prob': 0.0007950664148665965, 'sentence': 'But what Scripps News found in that time speaks volumes for how solutions emerge in moving the country forward.', 'perplexity': 0, 'highlight_sentence_for_ai': False}, {'generated_prob': 0.0006798884714953601, 'sentence': ""We've traveled across time zones, spotlighting the efforts to address the complex challenges facing our communities."", 'perplexity': 0, 'highlight_sentence_for_ai': False}, {'generated_prob': 0.0008160407887771726, 'sentence': ""We've found people often don't agree on what the best solution is."", 'perplexity': 0, 'highlight_sentence_for_ai': False}, {'generated_prob': 0.0008445947314612567, 'sentence': 'We saw it in Philadelphia, where the overdose crisis has overtaken a city neighborhood.', 'perplexity': 0, 'highlight_sentence_for_ai': False}, {'generated_prob': 0.0008919141837395728, 'sentence': 'Advocates there believe in harm reduction: giving those who use safe ways to do it.', 'perplexity': 0, 'highlight_sentence_for_ai': False}, {'generated_prob': 0.001827494241297245, 'sentence': 'But the city council voted 13-1 against safe injections.', 'perplexity': 0, 'highlight_sentence_for_ai': False}, {'generated_prob': 0.0009907444473356009, 'sentence': 'Meanwhile, with child care, the last few months saw the expiring of pandemic relief funds from the federal government.', 'perplexity': 0, 'highlight_sentence_for_ai': False}, {'generated_prob': 0.00075557641685009, 'sentence': ""There's little agreement on what the government should do next."", 'perplexity': 0, 'highlight_sentence_for_ai': False}, {'generated_prob': 0.0008929342147894204, 'sentence': 'But child care offers a window into what can happen when leaders do agree.', 'perplexity': 0, 'highlight_sentence_for_ai': False}, {'generated_prob': 0.0006543343770317733, 'sentence': 'We went to New Mexico, whose leaders have infused millions of dollars in recent years to make child care more accessible and affordable.', 'perplexity': 0, 'highlight_sentence_for_ai': False}, {'generated_prob': 0.0005717091262340546, 'sentence': 'We saw similar efforts on alternate issues.', 'perplexity': 0, 'highlight_sentence_for_ai': False}, {'generated_prob': 0.001169741852208972, 'sentence': 'In Birmingham, a city program has put millions of dollars of its own into building Black businesses.', 'perplexity': 0, 'highlight_sentence_for_ai': False}, {'generated_prob': 0.0013474299339577556, 'sentence': 'Bergen County, New Jersey, has seen numerous agencies coordinate to achieve and maintain functional zero homelessness.', 'perplexity': 0, 'highlight_sentence_for_ai': False}, {'generated_prob': 0.0015153858112171292, 'sentence': 'And back in Philly, its eviction diversion program has kept thousands of people in homes ᅳ at a time when other cities have struggled.', 'perplexity': 0, 'highlight_sentence_for_ai': False}, {'generated_prob': 0.0018825932638719678, 'sentence': ""SEE MORE: Groups in Atlanta take aim at income inequality We've found that the seeds of change can start from beyond government."", 'perplexity': 0, 'highlight_sentence_for_ai': False}, {'generated_prob': 5.008275184081867e-05, 'sentence': 'A study out of Vancouver found that one-time cash sums help folks get out and stay out of homelessness.', 'perplexity': 0, 'highlight_sentence_for_ai': False}, {'generated_prob': 3.316601942060515e-05, 'sentence': 'Now cities in America are trying it out.', 'perplexity': 0, 'highlight_sentence_for_ai': False}, {'generated_prob': 4.0833700040820986e-05, 'sentence': 'A small group of pastors spent nine months on a fellowship to help make their congregations more LGBTQ-inclusive.', 'perplexity': 0, 'highlight_sentence_for_ai': False}, {'generated_prob': 4.452738357940689e-05, 'sentence': 'They walked into potential controversy and mostly found community.', 'perplexity': 0, 'highlight_sentence_for_ai': False}, {'generated_prob': 4.223926953272894e-05, 'sentence': 'And in El Paso, Texas, a professor, and his team used research to build a mental health program specifically for Hispanic Americans.', 'perplexity': 0, 'highlight_sentence_for_ai': False}, {'generated_prob': 4.6708446461707354e-05, 'sentence': ""Now they're working to branch it out."", 'perplexity': 0, 'highlight_sentence_for_ai': False}, {'generated_prob': 5.8386518503539264e-05, 'sentence': ""Perhaps what's stood out the most is those rare cases when a seemingly straightforward effort has made massive change."", 'perplexity': 0, 'highlight_sentence_for_ai': False}, {'generated_prob': 4.969008296029642e-05, 'sentence': ""We spent time in Atlanta with a program that trains young Black men to teach literacy in classrooms ᅳ rooms where Black men aren't nearly represented enough."", 'perplexity': 0, 'highlight_sentence_for_ai': False}, {'generated_prob': 4.4690928916679695e-05, 'sentence': 'We found Dayshon Smith.', 'perplexity': 0, 'highlight_sentence_for_ai': False}, {'generated_prob': 4.87434008391574e-05, 'sentence': ""He's one of the teachers who told us the program turned him around."", 'perplexity': 0, 'highlight_sentence_for_ai': False}, {'generated_prob': 4.702151636593044e-05, 'sentence': ""And back where we started, amidst the overwhelming overdose crisis in Philadelphia, a small group called Philly HEALs reaches out to those who've just lost a loved one and offers support."", 'perplexity': 0, 'highlight_sentence_for_ai': False}, {'generated_prob': 4.6658482460770756e-05, 'sentence': 'Jenn Doyle got that call after losing their daughter, Olivia.', 'perplexity': 0, 'highlight_sentence_for_ai': False}, {'generated_prob': 6.0520655097207054e-05, 'sentence': 'They told us the call wound up saving her life.', 'perplexity': 0, 'highlight_sentence_for_ai': False}, {'generated_prob': 6.805913290008903e-05, 'sentence': ""In our few months, we haven't found the magical solution that fully eliminates any one issue."", 'perplexity': 0, 'highlight_sentence_for_ai': False}, {'generated_prob': 7.304863538593054e-05, 'sentence': ""Those don't exist, because the issues are never that simple."", 'perplexity': 0, 'highlight_sentence_for_ai': False}, {'generated_prob': 8.866840653354302e-05, 'sentence': 'But we continue to uplift the impact and the efforts that help push America forward.', 'perplexity': 0, 'highlight_sentence_for_ai': False}, {'generated_prob': 4.680688289226964e-05, 'sentence': 'Trending stories at Scrippsnews.com', 'perplexity': 0, 'highlight_sentence_for_ai': False}], 'paragraphs': [{'start_sentence_index': 0, 'num_sentences': 33, 'completely_generated_prob': 3.09473749034336e-29}], 'completely_generated_prob': 0.006608679833334143, 'class_probabilities': {'human': 0.9933913201666659, 'ai': 0.006608679833334143, 'mixed': 0}, 'average_generated_prob': 0, 'predicted_class': 'human', 'confidence_score': 0.9933913201666659, 'confidence_category': 'high', 'confidence_scores_raw': {'identity': {'ai': 0.006608679833334143, 'human': 0.9933913201666659, 'mixed': 0}}, 'confidence_thresholds_raw': {'identity': {'ai': {'reject': 0.65, 'low': 0.75, 'medium': 0.92}, 'human': {'reject': 0.7, 'low': 0.82, 'medium': 0.92}, 'mixed': {'reject': 0.7, 'low': 0.8, 'medium': 0.88}}}, 'overall_burstiness': 0, 'writing_stats': {}, 'subclass': {'ai': {}, 'human': {}, 'mixed': {}}, 'result_message': 'Our detector is highly confident that the text is written entirely by a human.', 'document_classification': 'HUMAN_ONLY', 'version': '2025-01-09-base', 'language': 'en', 'pageNumber': 0, 'inputText': ""Menu A few dozen stories across a few months give a brief window into America's wider arc. But what Scripps News found in that time speaks volumes for how solutions emerge in moving the country forward. We've traveled across time zones, spotlighting the efforts to address the complex challenges facing our communities. We've found people often don't agree on what the best solution is. We saw it in Philadelphia, where the overdose crisis has overtaken a city neighborhood. Advocates there believe in harm reduction: giving those who use safe ways to do it. But the city council voted 13-1 against safe injections. Meanwhile, with child care, the last few months saw the expiring of pandemic relief funds from the federal government. There's little agreement on what the government should do next. But child care offers a window into what can happen when leaders do agree. We went to New Mexico, whose leaders have infused millions of dollars in recent years to make child care more accessible and affordable. We saw similar efforts on alternate issues. In Birmingham, a city program has put millions of dollars of its own into building Black businesses. Bergen County, New Jersey, has seen numerous agencies coordinate to achieve and maintain functional zero homelessness. And back in Philly, its eviction diversion program has kept thousands of people in homes — at a time when other cities have struggled. SEE MORE: Groups in Atlanta take aim at income inequality We've found that the seeds of change can start from beyond government. A study out of Vancouver found that one-time cash sums help folks get out and stay out of homelessness. Now cities in America are trying it out. A small group of pastors spent nine months on a fellowship to help make their congregations more LGBTQ-inclusive. They walked into potential controversy and mostly found community. And in El Paso, Texas, a professor, and his team used research to build a mental health program specifically for Hispanic Americans. Now they're working to branch it out. Perhaps what's stood out the most is those rare cases when a seemingly straightforward effort has made massive change. We spent time in Atlanta with a program that trains young Black men to teach literacy in classrooms — rooms where Black men aren't nearly represented enough. We found Dayshon Smith. He's one of the teachers who told us the program turned him around. And back where we started, amidst the overwhelming overdose crisis in Philadelphia, a small group called Philly HEALs reaches out to those who've just lost a loved one and offers support. Jenn Doyle got that call after losing their daughter, Olivia. They told us the call wound up saving her life. In our few months, we haven't found the magical solution that fully eliminates any one issue. Those don't exist, because the issues are never that simple. But we continue to uplift the impact and the efforts that help push America forward. Trending stories at Scrippsnews.com""}]"
