File,version,documents
MA_2021_05c16e2ccef9ed4281525c29c92016e7.html.gz,2025-01-09-base,"[{'sentences': [{'generated_prob': 5.2718136430485174e-05, 'sentence': ""FALL RIVER ᅳ The Southcoast Health system of hospitals couldn't have made it any clearer to its 7,500 employees: Either get jabbed or stay away."", 'perplexity': 0, 'highlight_sentence_for_ai': False}, {'generated_prob': 4.2392683099024e-05, 'sentence': ""And that's exactly what happened to 216 medical workers who were fired last Tuesday for refusing to comply with the nonprofit corporation's mandate to get a COVID-19 vaccination shot."", 'perplexity': 0, 'highlight_sentence_for_ai': False}, {'generated_prob': 3.652824671007693e-05, 'sentence': 'Another 102 hospital staff members -ᅳ who also had been placed on unpaid leave last month for missing a Nov. 15 vaccination deadline ᅳ were previously granted a deadline extension up until Friday, Nov. 26.', 'perplexity': 0, 'highlight_sentence_for_ai': False}, {'generated_prob': 3.3384585549356416e-05, 'sentence': 'Those 102 employees did in fact return to work the following Monday after showing proof of receiving their first dose, according to Southcoast Health spokesperson Katie Cox.', 'perplexity': 0, 'highlight_sentence_for_ai': False}, {'generated_prob': 3.825071325991303e-05, 'sentence': 'Anyone getting the Johnson & Johnson vaccine version only requires a single dose.', 'perplexity': 0, 'highlight_sentence_for_ai': False}, {'generated_prob': 3.585962258512154e-05, 'sentence': 'More health workers fired: UMass Memorial Health fires 200 caregivers who refused to get COVID vaccination Cox, in an email, said the 102 employees “will be tested regularly until they are fully vaccinated.” She said another 151 Southcoast Health employees have been granted vaccine exemptions based either on the merits of their religious belief or for medical reasons.', 'perplexity': 0, 'highlight_sentence_for_ai': False}, {'generated_prob': 3.312213812023401e-05, 'sentence': 'But Cox said all of them must be tested regularly.', 'perplexity': 0, 'highlight_sentence_for_ai': False}, {'generated_prob': 4.3162879592273384e-05, 'sentence': ""It's not clear whether any of the 216 fired employees will be eligible to reapply if they get vaccinated."", 'perplexity': 0, 'highlight_sentence_for_ai': False}, {'generated_prob': 0.00497481832280755, 'sentence': ""Southcoast Health includes Charlton Memorial Hospital in Fall River; St. Luke's Hospital in New Bedford; Tobey Hospital in Wareham; a psychiatric hospital in Dartmouth; two cancer treatment centers; and seven urgent care centers, including one in Middletown, Rhode Island."", 'perplexity': 0, 'highlight_sentence_for_ai': False}, {'generated_prob': 0.003370706457644701, 'sentence': 'The federal Centers for Medicare and Medicaid Services had previously issued a requirement that all employees of hospitals and other health care facilities receiving Medicare or Medicaid financial benefits must get a first dose by Dec. 5 and be fully vaccinated by Jan. 4.', 'perplexity': 0, 'highlight_sentence_for_ai': False}, {'generated_prob': 0.0042181783355772495, 'sentence': 'But that CMS order is now on hold since two federal district judges, one in Louisiana and the other in Missouri, issued a preliminary injunction enjoining, or prohibiting, that order from being carried out until either a final court decision has been rendered or another order is issued from an appellate court or the Supreme Court.', 'perplexity': 0, 'highlight_sentence_for_ai': False}, {'generated_prob': 0.0053117345087230206, 'sentence': 'Individual hospital systems, however, are free to implement their own COVID-19 employee vaccination requirements.', 'perplexity': 0, 'highlight_sentence_for_ai': False}, {'generated_prob': 0.006966767832636833, 'sentence': 'Omicron in MA: What we know about the first case of omicron COVID-19 variant detected in Middlesex County No deaths so far have been attributed to the omicron COVID variant, which to date has showed up in 38 countries, according to the World Health Organization.', 'perplexity': 0, 'highlight_sentence_for_ai': False}, {'generated_prob': 0.010045068338513374, 'sentence': ""The WHO, according to Britain's Daily Mail, “warned it could take weeks to determine how infectious the variant is, whether it causes more severe illness and how effective treatments and vaccines are against it.” Charles Winokoor may be reached at cwinokoor@heraldnews.com."", 'perplexity': 0, 'highlight_sentence_for_ai': False}, {'generated_prob': 0.06490561366081238, 'sentence': 'Support local journalism and subscribe to The Herald News today.', 'perplexity': 0, 'highlight_sentence_for_ai': False}], 'paragraphs': [{'start_sentence_index': 0, 'num_sentences': 15, 'completely_generated_prob': 2.5938383721896624e-13}], 'completely_generated_prob': 0.016043407479197306, 'class_probabilities': {'human': 0.983917575661319, 'ai': 0.016043407479197306, 'mixed': 3.901685948368921e-05}, 'average_generated_prob': 0, 'predicted_class': 'human', 'confidence_score': 0.983917575661319, 'confidence_category': 'high', 'confidence_scores_raw': {'identity': {'ai': 0.016043407479197306, 'human': 0.983917575661319, 'mixed': 3.901685948368921e-05}}, 'confidence_thresholds_raw': {'identity': {'ai': {'reject': 0.65, 'low': 0.75, 'medium': 0.92}, 'human': {'reject': 0.7, 'low': 0.82, 'medium': 0.92}, 'mixed': {'reject': 0.7, 'low': 0.8, 'medium': 0.88}}}, 'overall_burstiness': 0, 'writing_stats': {}, 'subclass': {'ai': {}, 'human': {}, 'mixed': {}}, 'result_message': 'Our detector is highly confident that the text is written entirely by a human.', 'document_classification': 'HUMAN_ONLY', 'version': '2025-01-09-base', 'language': 'en', 'pageNumber': 0, 'inputText': ""FALL RIVER — The Southcoast Health system of hospitals couldn’t have made it any clearer to its 7,500 employees: Either get jabbed or stay away. And that’s exactly what happened to 216 medical workers who were fired last Tuesday for refusing to comply with the nonprofit corporation’s mandate to get a COVID-19 vaccination shot. Another 102 hospital staff members -— who also had been placed on unpaid leave last month for missing a Nov. 15 vaccination deadline — were previously granted a deadline extension up until Friday, Nov. 26. Those 102 employees did in fact return to work the following Monday after showing proof of receiving their first dose, according to Southcoast Health spokesperson Katie Cox. Anyone getting the Johnson & Johnson vaccine version only requires a single dose. More health workers fired: UMass Memorial Health fires 200 caregivers who refused to get COVID vaccination Cox, in an email, said the 102 employees “will be tested regularly until they are fully vaccinated.” She said another 151 Southcoast Health employees have been granted vaccine exemptions based either on the merits of their religious belief or for medical reasons. But Cox said all of them must be tested regularly. It's not clear whether any of the 216 fired employees will be eligible to reapply if they get vaccinated. Southcoast Health includes Charlton Memorial Hospital in Fall River; St. Luke’s Hospital in New Bedford; Tobey Hospital in Wareham; a psychiatric hospital in Dartmouth; two cancer treatment centers; and seven urgent care centers, including one in Middletown, Rhode Island. The federal Centers for Medicare and Medicaid Services had previously issued a requirement that all employees of hospitals and other health care facilities receiving Medicare or Medicaid financial benefits must get a first dose by Dec. 5 and be fully vaccinated by Jan. 4. But that CMS order is now on hold since two federal district judges, one in Louisiana and the other in Missouri, issued a preliminary injunction enjoining, or prohibiting, that order from being carried out until either a final court decision has been rendered or another order is issued from an appellate court or the Supreme Court. Individual hospital systems, however, are free to implement their own COVID-19 employee vaccination requirements. Omicron in MA: What we know about the first case of omicron COVID-19 variant detected in Middlesex County No deaths so far have been attributed to the omicron COVID variant, which to date has showed up in 38 countries, according to the World Health Organization. The WHO, according to Britain’s Daily Mail, “warned it could take weeks to determine how infectious the variant is, whether it causes more severe illness and how effective treatments and vaccines are against it.” Charles Winokoor may be reached at cwinokoor@heraldnews.com. Support local journalism and subscribe to The Herald News today.""}]"
MA_2021_0e1d9d56655263368d77db50d891e442.html.gz,2025-01-09-base,"[{'sentences': [{'generated_prob': 0.006711171939969063, 'sentence': ""Repair-only Jones Library plan would need more funding AMHERST ᅳ Repairs to the heating, ventilation and air conditioning system and fixes to the aging fire alert system and sprinklers are the most immediate upgrades that should be undertaken at the Jones Library, if a full-scale renovation and expansion... Amherst's Moriah Luetjen (400 meters), Logan Alfandari (shot put) capture titles at MIAA Div."", 'perplexity': 0, 'highlight_sentence_for_ai': False}, {'generated_prob': 0.0078089432790875435, 'sentence': '4 Track & Field Championships (PHOTOS) WESTFIELD ᅳ Logan Alfandari sat by the shot put circle, crossed his legs and leaned his back on the fence.', 'perplexity': 0, 'highlight_sentence_for_ai': False}, {'generated_prob': 0.005892259534448385, 'sentence': ""It was the middle of the shot put final at the MIAA Division 4 Outdoor Track & Field Championships last Saturday, and Amherst's mammoth thrower... AGAWAM ᅳ Moriah Luetjen's best race is the 400 meters."", 'perplexity': 0, 'highlight_sentence_for_ai': False}, {'generated_prob': 0.005821533501148224, 'sentence': 'Two years ago as a freshman, she won it at the MIAA Division 4 Outdoor Track & Field Championships and followed it up with a first-place finish in the Freshman 400 at New Balance Outdoor...', 'perplexity': 0, 'highlight_sentence_for_ai': False}, {'generated_prob': 0.009933306835591793, 'sentence': ""Both the Iranian government's bombing of Israel and the Israeli government's bombing of Iran are extremely perilous for the Middle East and the United States."", 'perplexity': 0, 'highlight_sentence_for_ai': False}, {'generated_prob': 0.19221165776252747, 'sentence': 'That is why the dangerously one-sided U.S. congressional resolution, H.Res.', 'perplexity': 0, 'highlight_sentence_for_ai': False}, {'generated_prob': 0.17162136733531952, 'sentence': '1143,... Not long after 20 years of war finally ended in Vietnam in 1975, another wave of horrendous violence erupted just to the west.The Khmer Rouge, the Communist party of Cambodia, seized control of the country and began a brutal “reeducation” campaign...', 'perplexity': 0, 'highlight_sentence_for_ai': False}, {'generated_prob': 0.176103875041008, 'sentence': 'In case we need to contact you - we do not publish these in print or online Street Address Your phone number with area code E-mail Street Address Your phone number with area code E-mail Terms & Conditions Privacy Policy About Us Accessibility By using this site, you agree with our use of cookies to personalize your experience, measure ads and monitor how our site works to improve it for our users Copyright © 2023 to 2024 by H.S.', 'perplexity': 0, 'highlight_sentence_for_ai': False}, {'generated_prob': 0.2682878375053406, 'sentence': 'Gere & Sons, Inc. All rights reserved.', 'perplexity': 0, 'highlight_sentence_for_ai': False}], 'paragraphs': [{'start_sentence_index': 0, 'num_sentences': 9, 'completely_generated_prob': 4.1887248735431006e-08}], 'completely_generated_prob': 0.0592640951707379, 'class_probabilities': {'human': 0.9407359048292621, 'ai': 0.0592640951707379, 'mixed': 0}, 'average_generated_prob': 0, 'predicted_class': 'human', 'confidence_score': 0.9407359048292621, 'confidence_category': 'high', 'confidence_scores_raw': {'identity': {'ai': 0.0592640951707379, 'human': 0.9407359048292621, 'mixed': 0}}, 'confidence_thresholds_raw': {'identity': {'ai': {'reject': 0.65, 'low': 0.75, 'medium': 0.92}, 'human': {'reject': 0.7, 'low': 0.82, 'medium': 0.92}, 'mixed': {'reject': 0.7, 'low': 0.8, 'medium': 0.88}}}, 'overall_burstiness': 0, 'writing_stats': {}, 'subclass': {'ai': {}, 'human': {}, 'mixed': {}}, 'result_message': 'Our detector is highly confident that the text is written entirely by a human.', 'document_classification': 'HUMAN_ONLY', 'version': '2025-01-09-base', 'language': 'en', 'pageNumber': 0, 'inputText': 'Repair-only Jones Library plan would need more funding AMHERST — Repairs to the heating, ventilation and air conditioning system and fixes to the aging fire alert system and sprinklers are the most immediate upgrades that should be undertaken at the Jones Library, if a full-scale renovation and expansion... Amherst’s Moriah Luetjen (400 meters), Logan Alfandari (shot put) capture titles at MIAA Div. 4 Track & Field Championships (PHOTOS) WESTFIELD — Logan Alfandari sat by the shot put circle, crossed his legs and leaned his back on the fence. It was the middle of the shot put final at the MIAA Division 4 Outdoor Track & Field Championships last Saturday, and Amherst’s mammoth thrower... AGAWAM — Moriah Luetjen’s best race is the 400 meters. Two years ago as a freshman, she won it at the MIAA Division 4 Outdoor Track & Field Championships and followed it up with a first-place finish in the Freshman 400 at New Balance Outdoor... Both the Iranian government’s bombing of Israel and the Israeli government’s bombing of Iran are extremely perilous for the Middle East and the United States. That is why the dangerously one-sided U.S. congressional resolution, H.Res. 1143,... Not long after 20 years of war finally ended in Vietnam in 1975, another wave of horrendous violence erupted just to the west.The Khmer Rouge, the Communist party of Cambodia, seized control of the country and began a brutal “reeducation” campaign... In case we need to contact you - we do not publish these in print or online Street Address Your phone number with area code E-mail Street Address Your phone number with area code E-mail Terms & Conditions Privacy Policy About Us Accessibility By using this site, you agree with our use of cookies to personalize your experience, measure ads and monitor how our site works to improve it for our users Copyright © 2023 to 2024 by H.S. Gere & Sons, Inc. All rights reserved.'}]"
MA_2021_164f91d20d62ea4915275a2fd863830a.html.gz,2025-01-09-base,"[{'sentences': [{'generated_prob': 0.00017836240294855088, 'sentence': 'BARNSTABLE ᅳ A viral video that has gone through the Barnstable High School community shows what school officials say is a teacher intervening in a fight, grabbing and pulling to the floor a student, who hits a file cabinet along the way.', 'perplexity': 0, 'highlight_sentence_for_ai': False}, {'generated_prob': 0.00014843176177237183, 'sentence': 'The teacher, who was placed on administrative leave, works for the school full-time and was new to Barnstable High School this year, Barnstable School Superintendent Meg Mayo-Brown said Thursday.', 'perplexity': 0, 'highlight_sentence_for_ai': False}, {'generated_prob': 0.00010413316340418532, 'sentence': 'She declined to identify the teacher.', 'perplexity': 0, 'highlight_sentence_for_ai': False}, {'generated_prob': 0.00012287804565858096, 'sentence': 'Two students were having a dispute Thursday morning in an eighth grade classroom just before the eight-second video was shot by another student, she said.', 'perplexity': 0, 'highlight_sentence_for_ai': False}, {'generated_prob': 0.0001458838814869523, 'sentence': ""The student seen hitting the file cabinet was not transported to the hospital and was checked out by the school's nursing staff, Mayo-Brown said."", 'perplexity': 0, 'highlight_sentence_for_ai': False}, {'generated_prob': 0.00012715967022813857, 'sentence': 'She said she was unsure of the extent of any injuries.', 'perplexity': 0, 'highlight_sentence_for_ai': False}, {'generated_prob': 9.876403782982379e-05, 'sentence': '“Given it is a personnel problem and a student problem we are limited on what we can say publicly,” Mayo-Brown said.', 'perplexity': 0, 'highlight_sentence_for_ai': False}, {'generated_prob': 0.00015176585293374956, 'sentence': 'The video shows a teacher running to catch up to a student, who is chasing another student.', 'perplexity': 0, 'highlight_sentence_for_ai': False}, {'generated_prob': 0.0001921617513289675, 'sentence': 'The teacher grabs the student, spins him around, and takes him down to the floor.', 'perplexity': 0, 'highlight_sentence_for_ai': False}, {'generated_prob': 0.00018858149996958673, 'sentence': 'In the video, the sound of the student hitting the filing cabinet is audible, as he falls to the ground before he begins moaning.', 'perplexity': 0, 'highlight_sentence_for_ai': False}, {'generated_prob': 0.0005032868939451873, 'sentence': '“At approximately 8:15 a.m. this morning, a Barnstable High School teacher inappropriately physically intervened in a matter between two students,” a notification to the ""BHS Community"" from Mayo-Brown and the Barnstable High School Administrator-in-charge stated.', 'perplexity': 0, 'highlight_sentence_for_ai': False}, {'generated_prob': 0.00037461065221577883, 'sentence': '“The teacher exhibited actions contrary to the values and expectations of Barnstable Public Schools.” “We want our (Barnstable High School) community to know that we take this matter very seriously and that the health and safety of our students remain our first and foremost priority,” the notification said.', 'perplexity': 0, 'highlight_sentence_for_ai': False}, {'generated_prob': 0.0007526625413447618, 'sentence': 'Mayo-Brown would not identity the teacher seen in the video.', 'perplexity': 0, 'highlight_sentence_for_ai': False}, {'generated_prob': 0.0008394334581680596, 'sentence': 'The video has spread across social media sites.', 'perplexity': 0, 'highlight_sentence_for_ai': False}, {'generated_prob': 0.0008895805804058909, 'sentence': 'More: Need for more services a priority in new Barnstable schools budget Meg Mayo-Brown: Barnstable schools chief announces plans to leave in June of 2022 The next step is to conduct an internal investigation, which is separate from the Barnstable Police Department investigation, Mayo-Brown said.', 'perplexity': 0, 'highlight_sentence_for_ai': False}, {'generated_prob': 0.0006080963066779077, 'sentence': 'A police report was filed on the incident, she said.', 'perplexity': 0, 'highlight_sentence_for_ai': False}, {'generated_prob': 0.0006902429740875959, 'sentence': 'After the investigations are completed the school administration will determine the next steps, Mayo-Brown said.', 'perplexity': 0, 'highlight_sentence_for_ai': False}], 'paragraphs': [{'start_sentence_index': 0, 'num_sentences': 17, 'completely_generated_prob': 4.571217651318373e-15}], 'completely_generated_prob': 0.008764888981516596, 'class_probabilities': {'human': 0.9912351110184834, 'ai': 0.008764888981516596, 'mixed': 0}, 'average_generated_prob': 0, 'predicted_class': 'human', 'confidence_score': 0.9912351110184834, 'confidence_category': 'high', 'confidence_scores_raw': {'identity': {'ai': 0.008764888981516596, 'human': 0.9912351110184834, 'mixed': 0}}, 'confidence_thresholds_raw': {'identity': {'ai': {'reject': 0.65, 'low': 0.75, 'medium': 0.92}, 'human': {'reject': 0.7, 'low': 0.82, 'medium': 0.92}, 'mixed': {'reject': 0.7, 'low': 0.8, 'medium': 0.88}}}, 'overall_burstiness': 0, 'writing_stats': {}, 'subclass': {'ai': {}, 'human': {}, 'mixed': {}}, 'result_message': 'Our detector is highly confident that the text is written entirely by a human.', 'document_classification': 'HUMAN_ONLY', 'version': '2025-01-09-base', 'language': 'en', 'pageNumber': 0, 'inputText': 'BARNSTABLE — A viral video that has gone through the Barnstable High School community shows what school officials say is a teacher intervening in a fight, grabbing and pulling to the floor a student, who hits a file cabinet along the way. The teacher, who was placed on administrative leave, works for the school full-time and was new to Barnstable High School this year, Barnstable School Superintendent Meg Mayo-Brown said Thursday. She declined to identify the teacher. Two students were having a dispute Thursday morning in an eighth grade classroom just before the eight-second video was shot by another student, she said. The student seen hitting the file cabinet was not transported to the hospital and was checked out by the school’s nursing staff, Mayo-Brown said. She said she was unsure of the extent of any injuries. “Given it is a personnel problem and a student problem we are limited on what we can say publicly,” Mayo-Brown said. The video shows a teacher running to catch up to a student, who is chasing another student. The teacher grabs the student, spins him around, and takes him down to the floor. In the video, the sound of the student hitting the filing cabinet is audible, as he falls to the ground before he begins moaning. “At approximately 8:15 a.m. this morning, a Barnstable High School teacher inappropriately physically intervened in a matter between two students,” a notification to the ""BHS Community"" from Mayo-Brown and the Barnstable High School Administrator-in-charge stated. “The teacher exhibited actions contrary to the values and expectations of Barnstable Public Schools.” “We want our (Barnstable High School) community to know that we take this matter very seriously and that the health and safety of our students remain our first and foremost priority,” the notification said. Mayo-Brown would not identity the teacher seen in the video. The video has spread across social media sites. More: Need for more services a priority in new Barnstable schools budget Meg Mayo-Brown: Barnstable schools chief announces plans to leave in June of 2022 The next step is to conduct an internal investigation, which is separate from the Barnstable Police Department investigation, Mayo-Brown said. A police report was filed on the incident, she said. After the investigations are completed the school administration will determine the next steps, Mayo-Brown said.'}]"
