File,version,documents
MS_2020_002dc528cdf04376ff0df7dbccc98041.html.gz,2025-01-09-base,"[{'sentences': [{'generated_prob': 5.570723442360759e-05, 'sentence': 'https://www.gochoctaws.com/news/2020/9/11/WSOC_HayesCeltic.aspx By: David Nichols CLINTON, Miss.', 'perplexity': 0, 'highlight_sentence_for_ai': False}, {'generated_prob': 4.85600066895131e-05, 'sentence': ""ᅳ Mississippi College women's soccer All-American Caitlin Hayes has signed to play in the top women's league in Scotland, inking with Celtic FC Women on Friday (Sept. 11)."", 'perplexity': 0, 'highlight_sentence_for_ai': False}, {'generated_prob': 4.61115050711669e-05, 'sentence': 'Hayes (Warrington, England) helped lead the Lady Choctaws to their first-ever appearance in the NCAA Tournament in 2017, earning the #1 seed in the South Region following a Gulf South Conference regular season co-championship.', 'perplexity': 0, 'highlight_sentence_for_ai': False}, {'generated_prob': 4.700007048086263e-05, 'sentence': 'Individually, she became the first All-American in school history in 2017, also earning a spot on the All-GSC First Team in 2016 and 2017 and All-Region honors as a junior and senior.', 'perplexity': 0, 'highlight_sentence_for_ai': False}, {'generated_prob': 5.167820927454159e-05, 'sentence': 'She scored 20 career goals with eight assists, leading MC with nine scores in the 2015 season.', 'perplexity': 0, 'highlight_sentence_for_ai': False}, {'generated_prob': 5.8391859056428075e-05, 'sentence': 'Following her collegiate career, she joined Somatio Barcelona FA in Cyprus before playing with Lewes FC in the championship as a semi-professional.', 'perplexity': 0, 'highlight_sentence_for_ai': False}, {'generated_prob': 6.0359376220731065e-05, 'sentence': 'Signing with Celtic FC Women, Hayes is a full-time professional soccer player and joins a team that joins the full-time professional ranks in 2020.', 'perplexity': 0, 'highlight_sentence_for_ai': False}, {'generated_prob': 5.659284215653315e-05, 'sentence': '“My excitement to officially make the move to Celtic is through the roof,” said Hayes.', 'perplexity': 0, 'highlight_sentence_for_ai': False}, {'generated_prob': 7.421826012432575e-05, 'sentence': ""“It's a great honor to represent such a prestigious club and to make football my full-time job."", 'perplexity': 0, 'highlight_sentence_for_ai': False}, {'generated_prob': 7.046840619295835e-05, 'sentence': '“But no words can articulate the gratitude I have for MC and the pride I hold to be a part of the Choctaw family,” Hayes went on.', 'perplexity': 0, 'highlight_sentence_for_ai': False}, {'generated_prob': 8.434995106654242e-05, 'sentence': ""“Go Choctaws!” “We are so proud of Cailtin and extremely excited to see her succeed,” said MC women's soccer head coach Darryl Longabaugh."", 'perplexity': 0, 'highlight_sentence_for_ai': False}, {'generated_prob': 9.106515062740073e-05, 'sentence': '“She is a great young lady on and off the pitch.', 'perplexity': 0, 'highlight_sentence_for_ai': False}, {'generated_prob': 8.358169725397602e-05, 'sentence': 'God has great plans for her, and we are excited to see the difference she will make with Celtic FC.” The first match of the 2020 season is slated for Sunday, October 18 when Celtic FC faces Glasgow City.', 'perplexity': 0, 'highlight_sentence_for_ai': False}], 'paragraphs': [{'start_sentence_index': 0, 'num_sentences': 13, 'completely_generated_prob': 1.4476848035102901e-11}], 'completely_generated_prob': 0.004960347667224892, 'class_probabilities': {'human': 0.9950396523327751, 'ai': 0.004960347667224892, 'mixed': 0}, 'average_generated_prob': 0, 'predicted_class': 'human', 'confidence_score': 0.9950396523327751, 'confidence_category': 'high', 'confidence_scores_raw': {'identity': {'ai': 0.004960347667224892, 'human': 0.9950396523327751, 'mixed': 0}}, 'confidence_thresholds_raw': {'identity': {'ai': {'reject': 0.65, 'low': 0.75, 'medium': 0.92}, 'human': {'reject': 0.7, 'low': 0.82, 'medium': 0.92}, 'mixed': {'reject': 0.7, 'low': 0.8, 'medium': 0.88}}}, 'overall_burstiness': 0, 'writing_stats': {}, 'subclass': {'ai': {}, 'human': {}, 'mixed': {}}, 'result_message': 'Our detector is highly confident that the text is written entirely by a human.', 'document_classification': 'HUMAN_ONLY', 'version': '2025-01-09-base', 'language': 'en', 'pageNumber': 0, 'inputText': 'https://www.gochoctaws.com/news/2020/9/11/WSOC_HayesCeltic.aspx By: David Nichols CLINTON, Miss. — Mississippi College women’s soccer All-American Caitlin Hayes has signed to play in the top women’s league in Scotland, inking with Celtic FC Women on Friday (Sept. 11). Hayes (Warrington, England) helped lead the Lady Choctaws to their first-ever appearance in the NCAA Tournament in 2017, earning the #1 seed in the South Region following a Gulf South Conference regular season co-championship. Individually, she became the first All-American in school history in 2017, also earning a spot on the All-GSC First Team in 2016 and 2017 and All-Region honors as a junior and senior. She scored 20 career goals with eight assists, leading MC with nine scores in the 2015 season. Following her collegiate career, she joined Somatio Barcelona FA in Cyprus before playing with Lewes FC in the championship as a semi-professional. Signing with Celtic FC Women, Hayes is a full-time professional soccer player and joins a team that joins the full-time professional ranks in 2020. “My excitement to officially make the move to Celtic is through the roof,” said Hayes. “It’s a great honor to represent such a prestigious club and to make football my full-time job. “But no words can articulate the gratitude I have for MC and the pride I hold to be a part of the Choctaw family,” Hayes went on. “Go Choctaws!” “We are so proud of Cailtin and extremely excited to see her succeed,” said MC women’s soccer head coach Darryl Longabaugh. “She is a great young lady on and off the pitch. God has great plans for her, and we are excited to see the difference she will make with Celtic FC.” The first match of the 2020 season is slated for Sunday, October 18 when Celtic FC faces Glasgow City.'}]"
MS_2020_004206361a8869b83940d1f7f1b65bcb.html.gz,2025-01-09-base,"[{'sentences': [{'generated_prob': 0.00025155002367682755, 'sentence': 'With music inspired by 2-Pac and Johnny Cash, country rap duo The Lacs are coming to Perkinston this weekend.', 'perplexity': 0, 'highlight_sentence_for_ai': False}, {'generated_prob': 0.00022582827659789473, 'sentence': 'The Lacs is scheduled to perform Saturday, June 20 at South Mississippi Off-Road venue in Perkinston, just south of Highway 53.', 'perplexity': 0, 'highlight_sentence_for_ai': False}, {'generated_prob': 0.00024812520132400095, 'sentence': ""This won't be the first time rappers Brian King and Clay Sharpe have performed at Off-Road, but they are looking forward to one of their first events since COVID-19."", 'perplexity': 0, 'highlight_sentence_for_ai': False}, {'generated_prob': 0.0002445847785566002, 'sentence': '“It feels good to be back out there performing for our fans,” King said.', 'perplexity': 0, 'highlight_sentence_for_ai': False}, {'generated_prob': 0.00025293801445513964, 'sentence': 'The Lacs have been writing and recording music since 2002.', 'perplexity': 0, 'highlight_sentence_for_ai': False}, {'generated_prob': 0.0002693544956855476, 'sentence': 'Together, they have produced 13 albums.', 'perplexity': 0, 'highlight_sentence_for_ai': False}, {'generated_prob': 0.000301068153930828, 'sentence': 'In 2017, they started their label, Dirt Rock Empire.', 'perplexity': 0, 'highlight_sentence_for_ai': False}, {'generated_prob': 0.000389263586839661, 'sentence': 'With songs like ""Dirt Road Dollars” and “Let Your Country Hang Out” they have gained more than 100 million views on YouTube and more than one million songs sold digitally.', 'perplexity': 0, 'highlight_sentence_for_ai': False}, {'generated_prob': 0.0003064226475544274, 'sentence': 'The duo from Baxley, Georgia first started making music as a diversion, but their true calling became too loud to ignore.', 'perplexity': 0, 'highlight_sentence_for_ai': False}, {'generated_prob': 0.00031766260508447886, 'sentence': ""“Over the years, as we worked doing jobs we weren't necessarily passionate about, we tried to dig deeper into what our true passion was,” King said."", 'perplexity': 0, 'highlight_sentence_for_ai': False}, {'generated_prob': 0.00030806256108917296, 'sentence': '“Having a strong like for music growing up, we decided to try to record some music and realized we enjoyed creating music.', 'perplexity': 0, 'highlight_sentence_for_ai': False}, {'generated_prob': 0.0003357990353833884, 'sentence': 'The passion grew and we started recording more and more music, sharing it with our friends to see what they thought…The rest is history.” They write and collaborate on every song they have recorded.', 'perplexity': 0, 'highlight_sentence_for_ai': False}, {'generated_prob': 0.00040188588900491595, 'sentence': 'All songs are inspired by their backgrounds and a wide range of musical tastes.', 'perplexity': 0, 'highlight_sentence_for_ai': False}, {'generated_prob': 9.47901644394733e-05, 'sentence': '“You name it, we love it,” Sharpe said.', 'perplexity': 0, 'highlight_sentence_for_ai': False}, {'generated_prob': 0.0002439936506561935, 'sentence': '“From 2-Pac and Johnny Cash, from Bone Thugs n Harmony to Hank Jr. and Lynyrd Skynyrd.” Sharpe said when they first started, neither were strong singers.', 'perplexity': 0, 'highlight_sentence_for_ai': False}, {'generated_prob': 0.0001553954789415002, 'sentence': 'So they began to rap.', 'perplexity': 0, 'highlight_sentence_for_ai': False}, {'generated_prob': 0.0002092503709718585, 'sentence': '“We started rapping about what we knew best, which was country living,” Sharpe said.', 'perplexity': 0, 'highlight_sentence_for_ai': False}, {'generated_prob': 0.0003784360596910119, 'sentence': '“Eventually, as we developed our sound, we found Brian had a great voice and, combined with my raps, we were able to come up with the unique sound that has become The Lacs.” Over the years, King and Sharpe have seen the interest in country rap grow.', 'perplexity': 0, 'highlight_sentence_for_ai': False}, {'generated_prob': 0.00032524546259082854, 'sentence': '“It has grown so much since we started,” Sharpe said.', 'perplexity': 0, 'highlight_sentence_for_ai': False}, {'generated_prob': 0.0016704172594472766, 'sentence': '“People use to laugh when we said we did country rap, but now it is accepted and is creating a name for itself, gaining further attention from Nashville.” Other country rappers like Colt Ford, Ryan Upchurch, Big Smo, Lil Nas X, and Cowboy Troy have had success with mainstream audiences in recent years.', 'perplexity': 0, 'highlight_sentence_for_ai': False}, {'generated_prob': 0.003491099225357175, 'sentence': 'The Lacs can attest to it.', 'perplexity': 0, 'highlight_sentence_for_ai': False}, {'generated_prob': 0.0007861495250836015, 'sentence': ""“The country rap scene developed organically from artists that were influenced by both rap and country music, so they didn't have any musical barriers when creating music,” Sharpe said."", 'perplexity': 0, 'highlight_sentence_for_ai': False}, {'generated_prob': 0.0010386939393356442, 'sentence': ""“Now the whole thing has come full circle where you see mainstream artists collaborating with country rappers, and mainstream press like Rolling Stone Magazine coming out to our annual Lactember Fest music festival, so they can see first hand what country rap is about.” Tickets are on sale through South Mississippi Off Road's website and range from $20 to $60 for day passes."", 'perplexity': 0, 'highlight_sentence_for_ai': False}, {'generated_prob': 0.003203480737283826, 'sentence': 'VIP passes are $20 and meet and greet passes are $30.', 'perplexity': 0, 'highlight_sentence_for_ai': False}, {'generated_prob': 0.002881971886381507, 'sentence': 'Both King and Sharpe are looking forward to seeing some familiar fans.', 'perplexity': 0, 'highlight_sentence_for_ai': False}, {'generated_prob': 0.0037715770304203033, 'sentence': '“We have played at this Park before and it was a great time,” King said.', 'perplexity': 0, 'highlight_sentence_for_ai': False}, {'generated_prob': 0.003315931186079979, 'sentence': 'King said his favorite part of touring is meeting fans across the nation.', 'perplexity': 0, 'highlight_sentence_for_ai': False}, {'generated_prob': 0.013218427076935768, 'sentence': '“We love our country, playing live music, and enjoy the parties with everyone,” King said.', 'perplexity': 0, 'highlight_sentence_for_ai': False}, {'generated_prob': 0.5067628622055054, 'sentence': 'Sorry, there are no recent results for popular images.', 'perplexity': 0, 'highlight_sentence_for_ai': False}, {'generated_prob': 0.5096970796585083, 'sentence': 'Sorry, there are no recent results for popular commented articles.', 'perplexity': 0, 'highlight_sentence_for_ai': False}, {'generated_prob': 0.7397294640541077, 'sentence': 'Success!', 'perplexity': 0, 'highlight_sentence_for_ai': False}, {'generated_prob': 0.621354341506958, 'sentence': 'An email has been sent to with a link to confirm list signup.', 'perplexity': 0, 'highlight_sentence_for_ai': False}, {'generated_prob': 0.769679844379425, 'sentence': 'Error!', 'perplexity': 0, 'highlight_sentence_for_ai': False}, {'generated_prob': 0.769856870174408, 'sentence': 'There was an error processing your request.', 'perplexity': 0, 'highlight_sentence_for_ai': False}, {'generated_prob': 0.6476170420646667, 'sentence': 'Would you like to receive our daily news?', 'perplexity': 0, 'highlight_sentence_for_ai': False}, {'generated_prob': 0.6826881766319275, 'sentence': 'Signup today!', 'perplexity': 0, 'highlight_sentence_for_ai': False}, {'generated_prob': 0.6208286285400391, 'sentence': ""We're always interested in hearing about news in our community."", 'perplexity': 0, 'highlight_sentence_for_ai': False}, {'generated_prob': 0.6415097713470459, 'sentence': ""Let us know what's going on!"", 'perplexity': 0, 'highlight_sentence_for_ai': False}, {'generated_prob': 0.47847023606300354, 'sentence': 'Your browser is out of date and potentially vulnerable to security risks.We recommend switching to one of the following browsers:', 'perplexity': 0, 'highlight_sentence_for_ai': False}], 'paragraphs': [{'start_sentence_index': 0, 'num_sentences': 39, 'completely_generated_prob': 1.3880297752938097e-34}], 'completely_generated_prob': 0.01136512118398678, 'class_probabilities': {'human': 0.9871797121439676, 'ai': 0.01136512118398678, 'mixed': 0.0014551666720457282}, 'average_generated_prob': 0, 'predicted_class': 'human', 'confidence_score': 0.9871797121439676, 'confidence_category': 'high', 'confidence_scores_raw': {'identity': {'ai': 0.01136512118398678, 'human': 0.9871797121439676, 'mixed': 0.0014551666720457282}}, 'confidence_thresholds_raw': {'identity': {'ai': {'reject': 0.65, 'low': 0.75, 'medium': 0.92}, 'human': {'reject': 0.7, 'low': 0.82, 'medium': 0.92}, 'mixed': {'reject': 0.7, 'low': 0.8, 'medium': 0.88}}}, 'overall_burstiness': 0, 'writing_stats': {}, 'subclass': {'ai': {}, 'human': {}, 'mixed': {}}, 'result_message': 'Our detector is highly confident that the text is written entirely by a human.', 'document_classification': 'HUMAN_ONLY', 'version': '2025-01-09-base', 'language': 'en', 'pageNumber': 0, 'inputText': 'With music inspired by 2-Pac and Johnny Cash, country rap duo The Lacs are coming to Perkinston this weekend. The Lacs is scheduled to perform Saturday, June 20 at South Mississippi Off-Road venue in Perkinston, just south of Highway 53. This won’t be the first time rappers Brian King and Clay Sharpe have performed at Off-Road, but they are looking forward to one of their first events since COVID-19. “It feels good to be back out there performing for our fans,” King said. The Lacs have been writing and recording music since 2002. Together, they have produced 13 albums. In 2017, they started their label, Dirt Rock Empire. With songs like ""Dirt Road Dollars” and “Let Your Country Hang Out” they have gained more than 100 million views on YouTube and more than one million songs sold digitally. The duo from Baxley, Georgia first started making music as a diversion, but their true calling became too loud to ignore. “Over the years, as we worked doing jobs we weren’t necessarily passionate about, we tried to dig deeper into what our true passion was,” King said. “Having a strong like for music growing up, we decided to try to record some music and realized we enjoyed creating music. The passion grew and we started recording more and more music, sharing it with our friends to see what they thought…The rest is history.” They write and collaborate on every song they have recorded. All songs are inspired by their backgrounds and a wide range of musical tastes. “You name it, we love it,” Sharpe said. “From 2-Pac and Johnny Cash, from Bone Thugs n Harmony to Hank Jr. and Lynyrd Skynyrd.” Sharpe said when they first started, neither were strong singers. So they began to rap. “We started rapping about what we knew best, which was country living,” Sharpe said. “Eventually, as we developed our sound, we found Brian had a great voice and, combined with my raps, we were able to come up with the unique sound that has become The Lacs.” Over the years, King and Sharpe have seen the interest in country rap grow. “It has grown so much since we started,” Sharpe said. “People use to laugh when we said we did country rap, but now it is accepted and is creating a name for itself, gaining further attention from Nashville.” Other country rappers like Colt Ford, Ryan Upchurch, Big Smo, Lil Nas X, and Cowboy Troy have had success with mainstream audiences in recent years. The Lacs can attest to it. “The country rap scene developed organically from artists that were influenced by both rap and country music, so they didn\'t have any musical barriers when creating music,” Sharpe said. “Now the whole thing has come full circle where you see mainstream artists collaborating with country rappers, and mainstream press like Rolling Stone Magazine coming out to our annual Lactember Fest music festival, so they can see first hand what country rap is about.” Tickets are on sale through South Mississippi Off Road’s website and range from $20 to $60 for day passes. VIP passes are $20 and meet and greet passes are $30. Both King and Sharpe are looking forward to seeing some familiar fans. “We have played at this Park before and it was a great time,” King said. King said his favorite part of touring is meeting fans across the nation. “We love our country, playing live music, and enjoy the parties with everyone,” King said. Sorry, there are no recent results for popular images. Sorry, there are no recent results for popular commented articles. Success! An email has been sent to with a link to confirm list signup. Error! There was an error processing your request. Would you like to receive our daily news? Signup today! We\'re always interested in hearing about news in our community. Let us know what\'s going on! Your browser is out of date and potentially vulnerable to security risks.We recommend switching to one of the following browsers:'}]"
