File,version,documents
OH_2021_d0bdc4b078cdb7a64775e8133a4eeb19.html.gz,2025-01-09-base,"[{'sentences': [{'generated_prob': 1.8097331121680327e-05, 'sentence': 'Sections Links Express Wash Concepts (EWC) Friday announced the acquisition of three Bee Clean Express Car Wash locations, including two operating locations in Zanesville and Cambridge and a third currently under construction at 1850 Maysville Ave. in South Zanesville.', 'perplexity': 0, 'highlight_sentence_for_ai': False}, {'generated_prob': 1.874782537925057e-05, 'sentence': ""The acquisition brings Express Wash Concepts' overall express car wash portfolio to 57 operating locations under the following brands: Central Ohio-based Moo Moo Express Car Wash, Greater Dayton-based Flying Ace Express Car Wash, Greater Cleveland and Pittsburgh-based Clean Express Auto Wash, Toledo-based Meyers Auto Wash, Virginia-based Green Clean Express Auto Wash, and Richmond, Indiana and Mason, Ohio-based Snazzy's Express Car Wash. “The Bee Clean Express Car Wash brand is a Zanesville institution, and our team will work tirelessly to preserve this legacy while offering customers the highest quality wash and customer service experience possible,” said John Roush, Express Wash Concepts Chief Executive Officer."", 'perplexity': 0, 'highlight_sentence_for_ai': False}, {'generated_prob': 2.3410269932355732e-05, 'sentence': 'The acquisition is effective as of December 30, 2021, with no interruption to Bee Clean Express retail wash customers and Unlimited Club members.', 'perplexity': 0, 'highlight_sentence_for_ai': False}, {'generated_prob': 2.3144835722632706e-05, 'sentence': 'Express Wash Concepts will keep the Bee Clean Express branding, adding a sixth brand to its overall brand portfolio.', 'perplexity': 0, 'highlight_sentence_for_ai': False}, {'generated_prob': 0.001282233977690339, 'sentence': ""“Our team is looking forward to joining the Express Wash Concepts family and gaining access to EWC's proven operations express and accelerated career growth opportunities,” said Beau Hankinson, of Bee Clean Express Car Wash. “As a third-generation operator, it's an amazing feeling to look back at what we have built over the past 67 years, and confidently know that the right people are on hand to take this brand to the next level.” Express Wash Concepts was formed in April 2018 with the announcement of a strategic investment partnership with Wildcat Capital Management, the family office of TPG Capital co-founder, David Bonderman."", 'perplexity': 0, 'highlight_sentence_for_ai': False}, {'generated_prob': 0.0010908849071711302, 'sentence': ""In 2021, EWC announced its geographical footprint expansion beyond Ohio and into Virginia, Pittsburgh and Indiana through the acquisitions of Green Clean Express Auto Wash, CleanTown USA and Snazzy's Express Car Wash."", 'perplexity': 0, 'highlight_sentence_for_ai': False}, {'generated_prob': 0.00249772728420794, 'sentence': 'The Company plans to open an additional 50+ locations in 2022.', 'perplexity': 0, 'highlight_sentence_for_ai': False}, {'generated_prob': 0.0017203886527568102, 'sentence': 'The Express Wash Concepts family of brands feature fast, high quality and environmentally friendly express tunnel wash experiences and free vacuums.', 'perplexity': 0, 'highlight_sentence_for_ai': False}, {'generated_prob': 0.002344143111258745, 'sentence': ""The company's popular Unlimited Wash Club packages offer members the convenience and value of contactless payment and unlimited washing at any location."", 'perplexity': 0, 'highlight_sentence_for_ai': False}, {'generated_prob': 0.002911364659667015, 'sentence': 'Because Local Matters © 2024 WHIZ - Fox 5 / Marquee Broadcasting.', 'perplexity': 0, 'highlight_sentence_for_ai': False}], 'paragraphs': [{'start_sentence_index': 0, 'num_sentences': 10, 'completely_generated_prob': 5.7802509961791254e-09}], 'completely_generated_prob': 0.00954082155012564, 'class_probabilities': {'human': 0.9904183478663264, 'ai': 0.00954082155012564, 'mixed': 4.0830583547849345e-05}, 'average_generated_prob': 0, 'predicted_class': 'human', 'confidence_score': 0.9904183478663264, 'confidence_category': 'high', 'confidence_scores_raw': {'identity': {'ai': 0.00954082155012564, 'human': 0.9904183478663264, 'mixed': 4.0830583547849345e-05}}, 'confidence_thresholds_raw': {'identity': {'ai': {'reject': 0.65, 'low': 0.75, 'medium': 0.92}, 'human': {'reject': 0.7, 'low': 0.82, 'medium': 0.92}, 'mixed': {'reject': 0.7, 'low': 0.8, 'medium': 0.88}}}, 'overall_burstiness': 0, 'writing_stats': {}, 'subclass': {'ai': {}, 'human': {}, 'mixed': {}}, 'result_message': 'Our detector is highly confident that the text is written entirely by a human.', 'document_classification': 'HUMAN_ONLY', 'version': '2025-01-09-base', 'language': 'en', 'pageNumber': 0, 'inputText': 'Sections Links Express Wash Concepts (EWC) Friday announced the acquisition of three Bee Clean Express Car Wash locations, including two operating locations in Zanesville and Cambridge and a third currently under construction at 1850 Maysville Ave. in South Zanesville. The acquisition brings Express Wash Concepts’ overall express car wash portfolio to 57 operating locations under the following brands: Central Ohio-based Moo Moo Express Car Wash, Greater Dayton-based Flying Ace Express Car Wash, Greater Cleveland and Pittsburgh-based Clean Express Auto Wash, Toledo-based Meyers Auto Wash, Virginia-based Green Clean Express Auto Wash, and Richmond, Indiana and Mason, Ohio-based Snazzy’s Express Car Wash. “The Bee Clean Express Car Wash brand is a Zanesville institution, and our team will work tirelessly to preserve this legacy while offering customers the highest quality wash and customer service experience possible,” said John Roush, Express Wash Concepts Chief Executive Officer. The acquisition is effective as of December 30, 2021, with no interruption to Bee Clean Express retail wash customers and Unlimited Club members. Express Wash Concepts will keep the Bee Clean Express branding, adding a sixth brand to its overall brand portfolio. “Our team is looking forward to joining the Express Wash Concepts family and gaining access to EWC’s proven operations express and accelerated career growth opportunities,” said Beau Hankinson, of Bee Clean Express Car Wash. “As a third-generation operator, it’s an amazing feeling to look back at what we have built over the past 67 years, and confidently know that the right people are on hand to take this brand to the next level.” Express Wash Concepts was formed in April 2018 with the announcement of a strategic investment partnership with Wildcat Capital Management, the family office of TPG Capital co-founder, David Bonderman. In 2021, EWC announced its geographical footprint expansion beyond Ohio and into Virginia, Pittsburgh and Indiana through the acquisitions of Green Clean Express Auto Wash, CleanTown USA and Snazzy’s Express Car Wash. The Company plans to open an additional 50+ locations in 2022. The Express Wash Concepts family of brands feature fast, high quality and environmentally friendly express tunnel wash experiences and free vacuums. The company’s popular Unlimited Wash Club packages offer members the convenience and value of contactless payment and unlimited washing at any location. Because Local Matters © 2024 WHIZ – Fox 5 / Marquee Broadcasting.'}]"
OH_2021_f5cf127a94792d6ef6c2dbaa25fae2d3.html.gz,2025-01-09-base,"[{'sentences': [{'generated_prob': 0.0017443614779040217, 'sentence': 'Now 75 Sat 78 Sun 80 WEATHER AUTHORITY FORECAST - FRIDAY, MAY 31ST - NOON UPDATE FRIDAY: Mostly sunny.', 'perplexity': 0, 'highlight_sentence_for_ai': False}, {'generated_prob': 0.0007372173713520169, 'sentence': 'A bit warmer.', 'perplexity': 0, 'highlight_sentence_for_ai': False}, {'generated_prob': 0.0011063646525144577, 'sentence': 'High: 78 SATURDAY: Increasing clouds and humidity.', 'perplexity': 0, 'highlight_sentence_for_ai': False}, {'generated_prob': 0.0010715749813243747, 'sentence': 'Afternoon showers and storms.Low: 53 // High: 78 SUNDAY: Morning showers.', 'perplexity': 0, 'highlight_sentence_for_ai': False}, {'generated_prob': 0.0011462033726274967, 'sentence': 'Drier afternoon/evening.', 'perplexity': 0, 'highlight_sentence_for_ai': False}, {'generated_prob': 0.0009566050721332431, 'sentence': 'Humid.Low: 62 // High: 80 Happy Friday!', 'perplexity': 0, 'highlight_sentence_for_ai': False}, {'generated_prob': 0.00041967275319620967, 'sentence': 'Beautiful with sunshine and milder temperatures in the upper 70s are in store after a chillier morning!', 'perplexity': 0, 'highlight_sentence_for_ai': False}, {'generated_prob': 0.00045181240420788527, 'sentence': 'Then as we flip the calendar to June, (meteorological summer) humidity & rain chances start increasing.', 'perplexity': 0, 'highlight_sentence_for_ai': False}, {'generated_prob': 0.0003190480638295412, 'sentence': ""We'll see increasing high clouds already throughout our Friday evening and night."", 'perplexity': 0, 'highlight_sentence_for_ai': False}, {'generated_prob': 0.00036146040656603873, 'sentence': 'Otherwise enjoy the dry air for one more day!', 'perplexity': 0, 'highlight_sentence_for_ai': False}, {'generated_prob': 0.00027469469932839274, 'sentence': 'By Saturday afternoon scattered showers and thunderstorms begin to move into the Tri-state.', 'perplexity': 0, 'highlight_sentence_for_ai': False}, {'generated_prob': 0.00031070728437043726, 'sentence': ""We'll keep the shower chances alive into Sunday morning as humidity levels continue increasing."", 'perplexity': 0, 'highlight_sentence_for_ai': False}, {'generated_prob': 0.00036029424518346786, 'sentence': ""We'll be in the upper 70s to near 80 Saturday and closer to 80 Sunday with only isolated showers and storms in the afternoon."", 'perplexity': 0, 'highlight_sentence_for_ai': False}, {'generated_prob': 0.0005107809556648135, 'sentence': 'This lull lasts into most of Monday too.', 'perplexity': 0, 'highlight_sentence_for_ai': False}, {'generated_prob': 0.00037510841502808034, 'sentence': 'Enjoy it, since rounds of storms are likely each day next week as highs climb into the middle 80s.', 'perplexity': 0, 'highlight_sentence_for_ai': False}, {'generated_prob': 0.000562707195058465, 'sentence': 'Our weather pattern begins cooling off and clearing out late next week into the weekend.', 'perplexity': 0, 'highlight_sentence_for_ai': False}, {'generated_prob': 0.001203819178044796, 'sentence': 'Meteorologist Eric DoBrokaFollow me on Facebook: Meteorologist Eric DoBrokaFollow me on X: @ericdobrokawxFollow me on Instagram/Threads: @meteorologist_ericdobrokaDownload The Weather Authority App!', 'perplexity': 0, 'highlight_sentence_for_ai': False}, {'generated_prob': 0.0016534861642867327, 'sentence': '© 2024 Sinclair, Inc.', 'perplexity': 0, 'highlight_sentence_for_ai': False}], 'paragraphs': [{'start_sentence_index': 0, 'num_sentences': 18, 'completely_generated_prob': 6.037935602283885e-16}], 'completely_generated_prob': 0.01313536578364879, 'class_probabilities': {'human': 0.9868255020442053, 'ai': 0.01313536578364879, 'mixed': 3.913217214592489e-05}, 'average_generated_prob': 0, 'predicted_class': 'human', 'confidence_score': 0.9868255020442053, 'confidence_category': 'high', 'confidence_scores_raw': {'identity': {'ai': 0.01313536578364879, 'human': 0.9868255020442053, 'mixed': 3.913217214592489e-05}}, 'confidence_thresholds_raw': {'identity': {'ai': {'reject': 0.65, 'low': 0.75, 'medium': 0.92}, 'human': {'reject': 0.7, 'low': 0.82, 'medium': 0.92}, 'mixed': {'reject': 0.7, 'low': 0.8, 'medium': 0.88}}}, 'overall_burstiness': 0, 'writing_stats': {}, 'subclass': {'ai': {}, 'human': {}, 'mixed': {}}, 'result_message': 'Our detector is highly confident that the text is written entirely by a human.', 'document_classification': 'HUMAN_ONLY', 'version': '2025-01-09-base', 'language': 'en', 'pageNumber': 0, 'inputText': ""Now 75 Sat 78 Sun 80 WEATHER AUTHORITY FORECAST - FRIDAY, MAY 31ST - NOON UPDATE FRIDAY: Mostly sunny. A bit warmer. High: 78 SATURDAY: Increasing clouds and humidity. Afternoon showers and storms.Low: 53 // High: 78 SUNDAY: Morning showers. Drier afternoon/evening. Humid.Low: 62 // High: 80 Happy Friday! Beautiful with sunshine and milder temperatures in the upper 70s are in store after a chillier morning! Then as we flip the calendar to June, (meteorological summer) humidity & rain chances start increasing. We'll see increasing high clouds already throughout our Friday evening and night. Otherwise enjoy the dry air for one more day! By Saturday afternoon scattered showers and thunderstorms begin to move into the Tri-state. We'll keep the shower chances alive into Sunday morning as humidity levels continue increasing. We'll be in the upper 70s to near 80 Saturday and closer to 80 Sunday with only isolated showers and storms in the afternoon. This lull lasts into most of Monday too. Enjoy it, since rounds of storms are likely each day next week as highs climb into the middle 80s. Our weather pattern begins cooling off and clearing out late next week into the weekend. Meteorologist Eric DoBrokaFollow me on Facebook: Meteorologist Eric DoBrokaFollow me on X: @ericdobrokawxFollow me on Instagram/Threads: @meteorologist_ericdobrokaDownload The Weather Authority App! © 2024 Sinclair, Inc.""}]"
OH_2021_fca88deb8e07d0d08d5a90a00d45285e.html.gz,2025-01-09-base,"[{'sentences': [{'generated_prob': 0.0035632322542369366, 'sentence': 'Listen Live Photo: AM 1540 WBCO Breakfast with Santa, the Reindeer Dash, a parade, carolers, the Polar Express and of course, Santa in Galion on Saturday!', 'perplexity': 0, 'highlight_sentence_for_ai': False}, {'generated_prob': 0.0042507280595600605, 'sentence': 'Come Home to Galion will bring hundreds of people to the city this Saturday.', 'perplexity': 0, 'highlight_sentence_for_ai': False}, {'generated_prob': 0.002592209493741393, 'sentence': 'The event is created to be a free, family-friendly event for the community.', 'perplexity': 0, 'highlight_sentence_for_ai': False}, {'generated_prob': 0.006755545269697905, 'sentence': 'The event kicks off at 1 p.m. in Uptowne Galion with a variety of events.', 'perplexity': 0, 'highlight_sentence_for_ai': False}, {'generated_prob': 0.006623293273150921, 'sentence': 'The parade will begin at 4:15 p.m. and will travel through the Uptowne area on Harding Way East with the tree lighting immediately following on the square.', 'perplexity': 0, 'highlight_sentence_for_ai': False}, {'generated_prob': 0.004675158299505711, 'sentence': 'The parade brings Santa Claus to town and he will be in his house by 5:30 p.m. for visits with children.', 'perplexity': 0, 'highlight_sentence_for_ai': False}, {'generated_prob': 0.0028074602596461773, 'sentence': 'For a complete list of events, click here.', 'perplexity': 0, 'highlight_sentence_for_ai': False}, {'generated_prob': 0.004886498209089041, 'sentence': '16 hours ago in National Marian Shields Robinson, the mother of Michelle Obama who moved with the first family to the White House when son-in-law Barack Obama was elected president, has died.', 'perplexity': 0, 'highlight_sentence_for_ai': False}, {'generated_prob': 0.0021575340069830418, 'sentence': 'She was 86.', 'perplexity': 0, 'highlight_sentence_for_ai': False}, {'generated_prob': 0.004210289567708969, 'sentence': '1 day ago in Sports The wet weather just keeps coming this week at the French Open.', 'perplexity': 0, 'highlight_sentence_for_ai': False}, {'generated_prob': 0.0030629450920969248, 'sentence': ""It has been delaying and postponing matches ᅳ including on Friday ᅳ jumbling the schedule, prompting court changes and, all in all, creating stress and uncertainty for the world's best tennis players."", 'perplexity': 0, 'highlight_sentence_for_ai': False}, {'generated_prob': 0.0009589167311787605, 'sentence': ""1 day ago in Sports After days of barreling along the huge waves of Tahiti's island paradise, French Polynesian surfer Vahine Fierro has even more reason to look forward to this summer's Olympics."", 'perplexity': 0, 'highlight_sentence_for_ai': False}, {'generated_prob': 0.0013846616493538022, 'sentence': '1 day ago in Sports The Florida Panthers are on the verge of going back to the Stanley Cup Final for the second straight year and third time in franchise history because they are finding ways to win the tight ones.', 'perplexity': 0, 'highlight_sentence_for_ai': False}, {'generated_prob': 0.001713315723463893, 'sentence': ""1 day ago in Entertainment Thirty years later, Nicole's three sisters want her remembered for more than those static images or the violent way she died."", 'perplexity': 0, 'highlight_sentence_for_ai': False}, {'generated_prob': 0.002081958344206214, 'sentence': ""They fear the vibrant person they knew has been lost in the chaos of Simpson's murder trial, the questions it raised about race in America and the headlines spawned by his recent death."", 'perplexity': 0, 'highlight_sentence_for_ai': False}, {'generated_prob': 0.01579488255083561, 'sentence': 'AM 1540 WBCOCopyright 2024 Saga Communications, Inc. All rights reserved.', 'perplexity': 0, 'highlight_sentence_for_ai': False}, {'generated_prob': 0.021025583148002625, 'sentence': 'EEO Report | FCC Public File | FCC Applications For assistance accessing public files, contact pfhelp@wbcowqel.com Privacy Policy | Terms of Use | Contests & Rules | Some images copyright AP, Clipart.com Non-Discriminatory Advertising Letter | Advisory Public Notice - Non-Discriminatory Ad Contracts', 'perplexity': 0, 'highlight_sentence_for_ai': False}], 'paragraphs': [{'start_sentence_index': 0, 'num_sentences': 17, 'completely_generated_prob': 4.571217651318373e-15}], 'completely_generated_prob': 0.021601982568463345, 'class_probabilities': {'human': 0.9783576840560043, 'ai': 0.021601982568463345, 'mixed': 4.0333375532255976e-05}, 'average_generated_prob': 0, 'predicted_class': 'human', 'confidence_score': 0.9783576840560043, 'confidence_category': 'high', 'confidence_scores_raw': {'identity': {'ai': 0.021601982568463345, 'human': 0.9783576840560043, 'mixed': 4.0333375532255976e-05}}, 'confidence_thresholds_raw': {'identity': {'ai': {'reject': 0.65, 'low': 0.75, 'medium': 0.92}, 'human': {'reject': 0.7, 'low': 0.82, 'medium': 0.92}, 'mixed': {'reject': 0.7, 'low': 0.8, 'medium': 0.88}}}, 'overall_burstiness': 0, 'writing_stats': {}, 'subclass': {'ai': {}, 'human': {}, 'mixed': {}}, 'result_message': 'Our detector is highly confident that the text is written entirely by a human.', 'document_classification': 'HUMAN_ONLY', 'version': '2025-01-09-base', 'language': 'en', 'pageNumber': 0, 'inputText': ""Listen Live Photo: AM 1540 WBCO Breakfast with Santa, the Reindeer Dash, a parade, carolers, the Polar Express and of course, Santa in Galion on Saturday! Come Home to Galion will bring hundreds of people to the city this Saturday. The event is created to be a free, family-friendly event for the community. The event kicks off at 1 p.m. in Uptowne Galion with a variety of events. The parade will begin at 4:15 p.m. and will travel through the Uptowne area on Harding Way East with the tree lighting immediately following on the square. The parade brings Santa Claus to town and he will be in his house by 5:30 p.m. for visits with children. For a complete list of events, click here. 16 hours ago in National Marian Shields Robinson, the mother of Michelle Obama who moved with the first family to the White House when son-in-law Barack Obama was elected president, has died. She was 86. 1 day ago in Sports The wet weather just keeps coming this week at the French Open. It has been delaying and postponing matches — including on Friday — jumbling the schedule, prompting court changes and, all in all, creating stress and uncertainty for the world's best tennis players. 1 day ago in Sports After days of barreling along the huge waves of Tahiti's island paradise, French Polynesian surfer Vahine Fierro has even more reason to look forward to this summer's Olympics. 1 day ago in Sports The Florida Panthers are on the verge of going back to the Stanley Cup Final for the second straight year and third time in franchise history because they are finding ways to win the tight ones. 1 day ago in Entertainment Thirty years later, Nicole's three sisters want her remembered for more than those static images or the violent way she died. They fear the vibrant person they knew has been lost in the chaos of Simpson's murder trial, the questions it raised about race in America and the headlines spawned by his recent death. AM 1540 WBCOCopyright 2024 Saga Communications, Inc. All rights reserved. EEO Report | FCC Public File | FCC Applications For assistance accessing public files, contact pfhelp@wbcowqel.com Privacy Policy | Terms of Use | Contests & Rules | Some images copyright AP, Clipart.com Non-Discriminatory Advertising Letter | Advisory Public Notice - Non-Discriminatory Ad Contracts""}]"
