File,version,documents
PA_2022_9cc7ca18021f88ac5cd4e086981ba963.html.gz,2025-01-09-base,"[{'sentences': [{'generated_prob': 4.1470535506960005e-05, 'sentence': 'Sunny to start with a few clouds later.', 'perplexity': 0, 'highlight_sentence_for_ai': False}, {'generated_prob': 4.334342520451173e-05, 'sentence': 'High 80F.', 'perplexity': 0, 'highlight_sentence_for_ai': False}, {'generated_prob': 4.090058064321056e-05, 'sentence': 'Winds light and variable..', 'perplexity': 0, 'highlight_sentence_for_ai': False}, {'generated_prob': 4.442033969098702e-05, 'sentence': 'Some clouds.', 'perplexity': 0, 'highlight_sentence_for_ai': False}, {'generated_prob': 6.510207458632067e-05, 'sentence': 'Low near 52F.', 'perplexity': 0, 'highlight_sentence_for_ai': False}, {'generated_prob': 4.112299939151853e-05, 'sentence': 'Winds light and variable.', 'perplexity': 0, 'highlight_sentence_for_ai': False}, {'generated_prob': 8.539712143829092e-05, 'sentence': 'Updated: June 1, 2024 @ 11:43 am Reporter FOGELSVILLE, Pa. - A man was taken to the hospital Wednesday afternoon after an incident involving a snake estimated to be at least 15 feet long, according to a news release from the Upper Macungie Police Department.', 'perplexity': 0, 'highlight_sentence_for_ai': False}, {'generated_prob': 6.032428427715786e-05, 'sentence': 'Officers responded to the 1400 block of Church Street in Fogelsville shortly after 2 p.m. for the report of a man in cardiac arrest with a snake wrapped around his neck, township police said.', 'perplexity': 0, 'highlight_sentence_for_ai': False}, {'generated_prob': 3.626550460467115e-05, 'sentence': 'When patrol officers arrived on scene, they observed a 28-year-old man who was unresponsive and lying on the floor of the home with the mid portion of a large snake wrapped around his neck, according to the news release.', 'perplexity': 0, 'highlight_sentence_for_ai': False}, {'generated_prob': 3.270724118920043e-05, 'sentence': 'Due to the size of the reptile (estimated to be 15+ feet), one of the officers was able to shoot the snake without risking further injury to the man, township police said.', 'perplexity': 0, 'highlight_sentence_for_ai': False}, {'generated_prob': 2.6673738830140792e-05, 'sentence': 'Once the snake was injured from the gunshot, the officers were able to pull the man to safety, at which time emergency medical care was provided, according to the news release.', 'perplexity': 0, 'highlight_sentence_for_ai': False}, {'generated_prob': 6.265153206186369e-05, 'sentence': 'The man was transported to a local hospital for further treatment.', 'perplexity': 0, 'highlight_sentence_for_ai': False}, {'generated_prob': 0.00019588579016271979, 'sentence': ""At this time, township police say the man's medical condition is unknown."", 'perplexity': 0, 'highlight_sentence_for_ai': False}, {'generated_prob': 0.000133995185024105, 'sentence': 'The snake involved in the incident is dead, police said.', 'perplexity': 0, 'highlight_sentence_for_ai': False}, {'generated_prob': 0.00015039749268908054, 'sentence': ""We're told by neighbors this was the man's pet snake, but no one is certain of the type of snake it was."", 'perplexity': 0, 'highlight_sentence_for_ai': False}, {'generated_prob': 0.0003921475145034492, 'sentence': ""Scroll down for comments if available The boa constrictor-type snake, believed to be the man's pet, wrapped itself around the man's neck and cut off oxygen to his brain, the coroner said."", 'perplexity': 0, 'highlight_sentence_for_ai': False}, {'generated_prob': 0.014466645196080208, 'sentence': ""The boa constrictor-type snake, believed to be the man's pet, wrapped itself around the man's neck and cut off oxygen to his brain, the coroner said."", 'perplexity': 0, 'highlight_sentence_for_ai': False}, {'generated_prob': 0.11334899812936783, 'sentence': 'Reporter Get local Breaking News alerts sent directly to your inbox.', 'perplexity': 0, 'highlight_sentence_for_ai': False}, {'generated_prob': 0.0919383093714714, 'sentence': 'Success!', 'perplexity': 0, 'highlight_sentence_for_ai': False}, {'generated_prob': 0.15890690684318542, 'sentence': 'An email has been sent to with a link to confirm list signup.', 'perplexity': 0, 'highlight_sentence_for_ai': False}, {'generated_prob': 0.1268152892589569, 'sentence': 'Error!', 'perplexity': 0, 'highlight_sentence_for_ai': False}, {'generated_prob': 0.18437983095645905, 'sentence': 'There was an error processing your request.', 'perplexity': 0, 'highlight_sentence_for_ai': False}, {'generated_prob': 0.06489117443561554, 'sentence': 'Watch all of WFMZ-TV News and Syndicated Programing 24/7 on your Streaming App enabled TV.', 'perplexity': 0, 'highlight_sentence_for_ai': False}, {'generated_prob': 0.2526598274707794, 'sentence': 'Your browser is out of date and potentially vulnerable to security risks.We recommend switching to one of the following browsers: Get up-to-the-minute news sent straight to your device.', 'perplexity': 0, 'highlight_sentence_for_ai': False}], 'paragraphs': [{'start_sentence_index': 0, 'num_sentences': 24, 'completely_generated_prob': 3.0444088223900345e-21}], 'completely_generated_prob': 0.010189775877355948, 'class_probabilities': {'human': 0.9888953682527029, 'ai': 0.010189775877355948, 'mixed': 0.0009148558699411837}, 'average_generated_prob': 0, 'predicted_class': 'human', 'confidence_score': 0.9888953682527029, 'confidence_category': 'high', 'confidence_scores_raw': {'identity': {'ai': 0.010189775877355948, 'human': 0.9888953682527029, 'mixed': 0.0009148558699411837}}, 'confidence_thresholds_raw': {'identity': {'ai': {'reject': 0.65, 'low': 0.75, 'medium': 0.92}, 'human': {'reject': 0.7, 'low': 0.82, 'medium': 0.92}, 'mixed': {'reject': 0.7, 'low': 0.8, 'medium': 0.88}}}, 'overall_burstiness': 0, 'writing_stats': {}, 'subclass': {'ai': {}, 'human': {}, 'mixed': {}}, 'result_message': 'Our detector is highly confident that the text is written entirely by a human.', 'document_classification': 'HUMAN_ONLY', 'version': '2025-01-09-base', 'language': 'en', 'pageNumber': 0, 'inputText': ""Sunny to start with a few clouds later. High 80F. Winds light and variable.. Some clouds. Low near 52F. Winds light and variable. Updated: June 1, 2024 @ 11:43 am Reporter FOGELSVILLE, Pa. - A man was taken to the hospital Wednesday afternoon after an incident involving a snake estimated to be at least 15 feet long, according to a news release from the Upper Macungie Police Department. Officers responded to the 1400 block of Church Street in Fogelsville shortly after 2 p.m. for the report of a man in cardiac arrest with a snake wrapped around his neck, township police said. When patrol officers arrived on scene, they observed a 28-year-old man who was unresponsive and lying on the floor of the home with the mid portion of a large snake wrapped around his neck, according to the news release. Due to the size of the reptile (estimated to be 15+ feet), one of the officers was able to shoot the snake without risking further injury to the man, township police said. Once the snake was injured from the gunshot, the officers were able to pull the man to safety, at which time emergency medical care was provided, according to the news release. The man was transported to a local hospital for further treatment. At this time, township police say the man's medical condition is unknown. The snake involved in the incident is dead, police said. We're told by neighbors this was the man's pet snake, but no one is certain of the type of snake it was. Scroll down for comments if available The boa constrictor-type snake, believed to be the man's pet, wrapped itself around the man's neck and cut off oxygen to his brain, the coroner said. The boa constrictor-type snake, believed to be the man's pet, wrapped itself around the man's neck and cut off oxygen to his brain, the coroner said. Reporter Get local Breaking News alerts sent directly to your inbox. Success! An email has been sent to with a link to confirm list signup. Error! There was an error processing your request. Watch all of WFMZ-TV News and Syndicated Programing 24/7 on your Streaming App enabled TV. Your browser is out of date and potentially vulnerable to security risks.We recommend switching to one of the following browsers: Get up-to-the-minute news sent straight to your device.""}]"
PA_2022_a67512867fd89aecb6d633771a2f133b.html.gz,2025-01-09-base,"[{'sentences': [{'generated_prob': 5.16783184139058e-05, 'sentence': 'WPXI Now Connect A realty company at the center of a Channel 11 news investigation is facing new scrutiny, this time from Congress.', 'perplexity': 0, 'highlight_sentence_for_ai': False}, {'generated_prob': 3.610744533943944e-05, 'sentence': 'A real estate company at the center of a Channel 11 News investigation is facing action tonight from the Florida Attorney General.', 'perplexity': 0, 'highlight_sentence_for_ai': False}, {'generated_prob': 4.1287614294560626e-05, 'sentence': 'A warning for Pittsburgh area homeowners about a Florida realty company using a bold new sales tactic to break into the local market.', 'perplexity': 0, 'highlight_sentence_for_ai': False}, {'generated_prob': 3.674381514429115e-05, 'sentence': 'As mortgage rates continue to climb, buying a house is getting more expensive every month.', 'perplexity': 0, 'highlight_sentence_for_ai': False}, {'generated_prob': 4.356173303676769e-05, 'sentence': ""That's leaving many homebuyers looking at riskier options for financingᅳ but could that backfire?"", 'perplexity': 0, 'highlight_sentence_for_ai': False}, {'generated_prob': 4.486627585720271e-05, 'sentence': ""TONIGHT at 5:45 p.m., Channel 11's Angie Moreschi takes a look at whether the risk is worth it, in her latest FACT vs. FICTION report."", 'perplexity': 0, 'highlight_sentence_for_ai': False}, {'generated_prob': 4.880710912402719e-05, 'sentence': 'Several local polling locations were forced to open late this Election Day, leading to voters being told to come back later or vote provisionally.', 'perplexity': 0, 'highlight_sentence_for_ai': False}, {'generated_prob': 5.991924263071269e-05, 'sentence': 'Election Day is almost here, with just a few days left for you to cast your ballot.', 'perplexity': 0, 'highlight_sentence_for_ai': False}, {'generated_prob': 4.873033321928233e-05, 'sentence': 'Legislation introduced in response to a Channel 11 Investigation was signed into law today by Gov.', 'perplexity': 0, 'highlight_sentence_for_ai': False}, {'generated_prob': 5.7828139688353986e-05, 'sentence': 'Tom Wolf.', 'perplexity': 0, 'highlight_sentence_for_ai': False}, {'generated_prob': 6.664848478976637e-05, 'sentence': ""As Channel 11 reported exclusively last week, Carvana's Bridgeville location was on the Pennsylvania Department of Transportation's “Suspended Agents” list until April of 2023."", 'perplexity': 0, 'highlight_sentence_for_ai': False}, {'generated_prob': 9.017197589855641e-05, 'sentence': 'A livestream captured the moment gunfire erupted outside a Pittsburgh funeral Friday.', 'perplexity': 0, 'highlight_sentence_for_ai': False}, {'generated_prob': 6.871995719848201e-05, 'sentence': 'Carvana promises to simplify your car buying experience, but for some customers things are getting complicated.', 'perplexity': 0, 'highlight_sentence_for_ai': False}, {'generated_prob': 5.2792514907196164e-05, 'sentence': '© 2024 Cox Media Group.', 'perplexity': 0, 'highlight_sentence_for_ai': False}, {'generated_prob': 6.955620483495295e-05, 'sentence': 'This station is part of Cox Media Group Television.', 'perplexity': 0, 'highlight_sentence_for_ai': False}, {'generated_prob': 6.0224378103157505e-05, 'sentence': 'Learn about careers at Cox Media Group.', 'perplexity': 0, 'highlight_sentence_for_ai': False}, {'generated_prob': 7.444794027833268e-05, 'sentence': 'By using this website, you accept the terms of our Visitor Agreement and Privacy Policy, and understand your options regarding Ad Choices.', 'perplexity': 0, 'highlight_sentence_for_ai': False}], 'paragraphs': [{'start_sentence_index': 0, 'num_sentences': 17, 'completely_generated_prob': 4.571217651318373e-15}], 'completely_generated_prob': 0.004979884598153482, 'class_probabilities': {'human': 0.9950201154018465, 'ai': 0.004979884598153482, 'mixed': 0}, 'average_generated_prob': 0, 'predicted_class': 'human', 'confidence_score': 0.9950201154018465, 'confidence_category': 'high', 'confidence_scores_raw': {'identity': {'ai': 0.004979884598153482, 'human': 0.9950201154018465, 'mixed': 0}}, 'confidence_thresholds_raw': {'identity': {'ai': {'reject': 0.65, 'low': 0.75, 'medium': 0.92}, 'human': {'reject': 0.7, 'low': 0.82, 'medium': 0.92}, 'mixed': {'reject': 0.7, 'low': 0.8, 'medium': 0.88}}}, 'overall_burstiness': 0, 'writing_stats': {}, 'subclass': {'ai': {}, 'human': {}, 'mixed': {}}, 'result_message': 'Our detector is highly confident that the text is written entirely by a human.', 'document_classification': 'HUMAN_ONLY', 'version': '2025-01-09-base', 'language': 'en', 'pageNumber': 0, 'inputText': 'WPXI Now Connect A realty company at the center of a Channel 11 news investigation is facing new scrutiny, this time from Congress. A real estate company at the center of a Channel 11 News investigation is facing action tonight from the Florida Attorney General. A warning for Pittsburgh area homeowners about a Florida realty company using a bold new sales tactic to break into the local market. As mortgage rates continue to climb, buying a house is getting more expensive every month. That’s leaving many homebuyers looking at riskier options for financing— but could that backfire? TONIGHT at 5:45 p.m., Channel 11′s Angie Moreschi takes a look at whether the risk is worth it, in her latest FACT vs. FICTION report. Several local polling locations were forced to open late this Election Day, leading to voters being told to come back later or vote provisionally. Election Day is almost here, with just a few days left for you to cast your ballot. Legislation introduced in response to a Channel 11 Investigation was signed into law today by Gov. Tom Wolf. As Channel 11 reported exclusively last week, Carvana’s Bridgeville location was on the Pennsylvania Department of Transportation’s “Suspended Agents” list until April of 2023. A livestream captured the moment gunfire erupted outside a Pittsburgh funeral Friday. Carvana promises to simplify your car buying experience, but for some customers things are getting complicated. © 2024 Cox Media Group. This station is part of Cox Media Group Television. Learn about careers at Cox Media Group. By using this website, you accept the terms of our Visitor Agreement and Privacy Policy, and understand your options regarding Ad Choices.'}]"
PA_2022_b4e385316ef7e92665d6e062b3c9bafc.html.gz,2025-01-09-base,"[{'sentences': [{'generated_prob': 0.9976576566696167, 'sentence': '[November 1, 2022] Camp Hill, PA - PCN will provide a FREE LIVE STREAM from checkpoints throughout the PIAA Cross Country Championships course on Saturday, November 5, in Hershey, PA.', 'perplexity': 0, 'highlight_sentence_for_ai': True}, {'generated_prob': 0.9952268004417419, 'sentence': 'Complete coverage of the championship event will premiere on cable and streaming with PCN Select on November 23, starting at 6 PM.', 'perplexity': 0, 'highlight_sentence_for_ai': True}, {'generated_prob': 0.9931614995002747, 'sentence': '""PCN is thrilled to provide a way for family and friends to track their athletes during the event,"" stated Debra Kohr Sheppard, PCN President, and CEO.', 'perplexity': 0, 'highlight_sentence_for_ai': True}, {'generated_prob': 0.9914629459381104, 'sentence': '""It\'s a way for us to showcase the amazing athletes from around the Commonwealth while recognizing the generosity of our donors who make this free stream possible.""', 'perplexity': 0, 'highlight_sentence_for_ai': True}, {'generated_prob': 0.9970785975456238, 'sentence': ""PCN's free live stream coverage of the PIAA Cross Country Championships is available on pcntv.com, PCN Select mobile app, Apple TV, and Fire TV."", 'perplexity': 0, 'highlight_sentence_for_ai': True}, {'generated_prob': 0.99370938539505, 'sentence': ""Viewers can watch PCN's complete coverage of the PIAA Championships on cable in PA or streaming worldwide with PCN Select on November 23."", 'perplexity': 0, 'highlight_sentence_for_ai': True}, {'generated_prob': 0.9954537749290466, 'sentence': 'PCN Select is available on desktop, mobile, Apple TV, Fire TV, and Roku.', 'perplexity': 0, 'highlight_sentence_for_ai': True}, {'generated_prob': 0.9722627401351929, 'sentence': ""For more information about PCN's coverage of PIAA Championships, visit: pcntv.com/sports/ ABOUT PCN: PCN is a 501(c)(3) nonprofit television network dedicated to educating, connecting, and celebrating Pennsylvania's past, present, and future through cable television and streaming platforms."", 'perplexity': 0, 'highlight_sentence_for_ai': True}, {'generated_prob': 0.9580258131027222, 'sentence': ""To make a tax-deductible donation to support PCN's mission, visit pcntv.com/donate."", 'perplexity': 0, 'highlight_sentence_for_ai': True}, {'generated_prob': 0.9724572896957397, 'sentence': 'WEBSITE: pcntv.com HOW TO WATCH: Learn more at pcntv.com/how-to-watch SOCIAL MEDIA: Twitter, Facebook, YouTube - @pcntv, Instagram, TikTok - @pennsylvaniacablenetwork ###', 'perplexity': 0, 'highlight_sentence_for_ai': True}], 'paragraphs': [{'start_sentence_index': 0, 'num_sentences': 10, 'completely_generated_prob': 0.9316904254198173}], 'completely_generated_prob': 0.9997847017652333, 'class_probabilities': {'human': 0, 'ai': 0.9997847017652333, 'mixed': 0.00021529823476680056}, 'average_generated_prob': 1, 'predicted_class': 'ai', 'confidence_score': 0.9997847017652333, 'confidence_category': 'high', 'confidence_scores_raw': {'identity': {'ai': 0.9997847017652333, 'human': 0, 'mixed': 0.00021529823476680056}}, 'confidence_thresholds_raw': {'identity': {'ai': {'reject': 0.65, 'low': 0.75, 'medium': 0.92}, 'human': {'reject': 0.7, 'low': 0.82, 'medium': 0.92}, 'mixed': {'reject': 0.7, 'low': 0.8, 'medium': 0.88}}}, 'overall_burstiness': 0, 'writing_stats': {}, 'subclass': {'ai': {'predicted_class': 'pure_ai', 'result_message': '', 'confidence_score': 0.9999999998, 'confidence_category': 'high', 'class_probabilities': {'pure_ai': 0.9999999999, 'ai_paraphrased': 9.999999997e-11}, 'confidence_scores_raw': {'identity': {'pure_ai': 0.9999999998, 'ai_paraphrased': 9.999999997e-11}}, 'confidence_thresholds_raw': {'identity': {'pure_ai': {'reject': 0.65, 'low': 0.75, 'medium': 0.92}, 'ai_paraphrased': {'reject': 0.85, 'low': 0.9, 'medium': 0.95}}}}, 'human': {}, 'mixed': {}}, 'result_message': 'Our detector is highly confident that the text is written by AI.', 'document_classification': 'AI_ONLY', 'version': '2025-01-09-base', 'language': 'en', 'pageNumber': 0, 'inputText': '[November 1, 2022] Camp Hill, PA – PCN will provide a FREE LIVE STREAM from checkpoints throughout the PIAA Cross Country Championships course on Saturday, November 5, in Hershey, PA. Complete coverage of the championship event will premiere on cable and streaming with PCN Select on November 23, starting at 6 PM. ""PCN is thrilled to provide a way for family and friends to track their athletes during the event,"" stated Debra Kohr Sheppard, PCN President, and CEO. ""It\'s a way for us to showcase the amazing athletes from around the Commonwealth while recognizing the generosity of our donors who make this free stream possible."" PCN’s free live stream coverage of the PIAA Cross Country Championships is available on pcntv.com, PCN Select mobile app, Apple TV, and Fire TV. Viewers can watch PCN\'s complete coverage of the PIAA Championships on cable in PA or streaming worldwide with PCN Select on November 23. PCN Select is available on desktop, mobile, Apple TV, Fire TV, and Roku. For more information about PCN\'s coverage of PIAA Championships, visit: pcntv.com/sports/ ABOUT PCN: PCN is a 501(c)(3) nonprofit television network dedicated to educating, connecting, and celebrating Pennsylvania\'s past, present, and future through cable television and streaming platforms. To make a tax-deductible donation to support PCN\'s mission, visit pcntv.com/donate. WEBSITE: pcntv.com HOW TO WATCH: Learn more at pcntv.com/how-to-watch SOCIAL MEDIA: Twitter, Facebook, YouTube - @pcntv, Instagram, TikTok - @pennsylvaniacablenetwork ###'}]"
