File,version,documents
GA_2023_9f3c7b9c954029106bf91019f84fea5e.html.gz,2025-01-09-base,"[{'sentences': [{'generated_prob': 5.278920434648171e-05, 'sentence': ""Next up in 5 Example video title will go here for this video Next up in 5 Example video title will go here for this video MACON, Ga. ᅳ The Bibb County Sheriff's Office is investigating after a body was found dead on Christmas Eve, according to a press release."", 'perplexity': 0, 'highlight_sentence_for_ai': False}, {'generated_prob': 5.616556518361904e-05, 'sentence': 'They say they got calls about a shooting that happened on Saturday in the 1300 block of Fort Hill Street around 2 p.m.', 'perplexity': 0, 'highlight_sentence_for_ai': False}, {'generated_prob': 5.38872554898262e-05, 'sentence': 'When deputies got there they talked with a few people who said there were no shots fired in the area.', 'perplexity': 0, 'highlight_sentence_for_ai': False}, {'generated_prob': 3.948903759010136e-05, 'sentence': 'Deputies checked the area and did not see any signs of a shooting, the release says.', 'perplexity': 0, 'highlight_sentence_for_ai': False}, {'generated_prob': 4.618365710484795e-05, 'sentence': 'Around 7 a.m. on Christmas Eve, the E911 Center started getting calls from anonymous sources who gave minimal information as to what happened and where the victim of the shooting was.', 'perplexity': 0, 'highlight_sentence_for_ai': False}, {'generated_prob': 4.205368895782158e-05, 'sentence': 'Deputies were then sent to multiple locations and talked to people in the areas.', 'perplexity': 0, 'highlight_sentence_for_ai': False}, {'generated_prob': 5.229355883784592e-05, 'sentence': ""The release says they later got information that the victim, 52-year-old Artice Pettigrew's, body was hidden in the back of a vehicle at a home in the 1300 block of Fort Hill Street."", 'perplexity': 0, 'highlight_sentence_for_ai': False}, {'generated_prob': 5.60894695809111e-05, 'sentence': 'Investigators along with patrol deputies returned to the address in the 1300 block of Fort Hill Street just after 1 p.m. and were able to locate the victim.', 'perplexity': 0, 'highlight_sentence_for_ai': False}, {'generated_prob': 0.002247390802949667, 'sentence': 'They do not know what led up to the shooting at this time.', 'perplexity': 0, 'highlight_sentence_for_ai': False}, {'generated_prob': 0.00291850371286273, 'sentence': 'No one else was injured during the incident and next of kin has been notified per Deputy Coroner Lonnie Miley.', 'perplexity': 0, 'highlight_sentence_for_ai': False}, {'generated_prob': 0.002605304354801774, 'sentence': 'This incident is still under investigation.', 'perplexity': 0, 'highlight_sentence_for_ai': False}, {'generated_prob': 0.003078689333051443, 'sentence': ""Anyone with information about this incident is urged to contact the Bibb Sheriff's Office at 478-751 -7500 or Macon Regional Crime Stoppers at 1-877-68CRIME."", 'perplexity': 0, 'highlight_sentence_for_ai': False}, {'generated_prob': 0.0033211009576916695, 'sentence': 'MORE THAN A NUMBER: More Than A Number is a Poynter-Stand Together award-winning project by Justin Baxley designed to help families of loved ones impacted by tragedy and trauma interact with journalists in a less intrusive way.', 'perplexity': 0, 'highlight_sentence_for_ai': False}, {'generated_prob': 0.0028703014831990004, 'sentence': 'Families are able to fill out a form about their family and also receive an in-depth guide on the next steps.', 'perplexity': 0, 'highlight_sentence_for_ai': False}, {'generated_prob': 0.004091888200491667, 'sentence': 'More Than A Number officially launched in August with a streaming special available on 13WMAZ+ for on-demand streaming.', 'perplexity': 0, 'highlight_sentence_for_ai': False}, {'generated_prob': 0.0036984148900955915, 'sentence': 'For any questions or concerns about More Than A Number, contact us here at the following email: MoreThanANumber@13wmaz.com Notifications can be turned off anytime in the browser settings.', 'perplexity': 0, 'highlight_sentence_for_ai': False}], 'paragraphs': [{'start_sentence_index': 0, 'num_sentences': 16, 'completely_generated_prob': 3.4496480286678e-14}], 'completely_generated_prob': 0.01905673435412323, 'class_probabilities': {'human': 0.9806540082709894, 'ai': 0.01905673435412323, 'mixed': 0.0002892573748874461}, 'average_generated_prob': 0, 'predicted_class': 'human', 'confidence_score': 0.9806540082709894, 'confidence_category': 'high', 'confidence_scores_raw': {'identity': {'ai': 0.01905673435412323, 'human': 0.9806540082709894, 'mixed': 0.0002892573748874461}}, 'confidence_thresholds_raw': {'identity': {'ai': {'reject': 0.65, 'low': 0.75, 'medium': 0.92}, 'human': {'reject': 0.7, 'low': 0.82, 'medium': 0.92}, 'mixed': {'reject': 0.7, 'low': 0.8, 'medium': 0.88}}}, 'overall_burstiness': 0, 'writing_stats': {}, 'subclass': {'ai': {}, 'human': {}, 'mixed': {}}, 'result_message': 'Our detector is highly confident that the text is written entirely by a human.', 'document_classification': 'HUMAN_ONLY', 'version': '2025-01-09-base', 'language': 'en', 'pageNumber': 0, 'inputText': ""Next up in 5 Example video title will go here for this video Next up in 5 Example video title will go here for this video MACON, Ga. — The Bibb County Sheriff's Office is investigating after a body was found dead on Christmas Eve, according to a press release. They say they got calls about a shooting that happened on Saturday in the 1300 block of Fort Hill Street around 2 p.m. When deputies got there they talked with a few people who said there were no shots fired in the area. Deputies checked the area and did not see any signs of a shooting, the release says. Around 7 a.m. on Christmas Eve, the E911 Center started getting calls from anonymous sources who gave minimal information as to what happened and where the victim of the shooting was. Deputies were then sent to multiple locations and talked to people in the areas. The release says they later got information that the victim, 52-year-old Artice Pettigrew’s, body was hidden in the back of a vehicle at a home in the 1300 block of Fort Hill Street. Investigators along with patrol deputies returned to the address in the 1300 block of Fort Hill Street just after 1 p.m. and were able to locate the victim. They do not know what led up to the shooting at this time. No one else was injured during the incident and next of kin has been notified per Deputy Coroner Lonnie Miley. This incident is still under investigation. Anyone with information about this incident is urged to contact the Bibb Sheriff’s Office at 478-751 -7500 or Macon Regional Crime Stoppers at 1-877-68CRIME. MORE THAN A NUMBER: More Than A Number is a Poynter-Stand Together award-winning project by Justin Baxley designed to help families of loved ones impacted by tragedy and trauma interact with journalists in a less intrusive way. Families are able to fill out a form about their family and also receive an in-depth guide on the next steps. More Than A Number officially launched in August with a streaming special available on 13WMAZ+ for on-demand streaming. For any questions or concerns about More Than A Number, contact us here at the following email: MoreThanANumber@13wmaz.com Notifications can be turned off anytime in the browser settings.""}]"
GA_2023_c11dc4b8c305ebb69b6dab01313e86ed.html.gz,2025-01-09-base,"[{'sentences': [{'generated_prob': 3.316807124065235e-05, 'sentence': 'College Park Subway COLLEGE PARK, Ga. ᅳ More than $7,000 for a Subway Italian sub.', 'perplexity': 0, 'highlight_sentence_for_ai': False}, {'generated_prob': 2.6916619390249252e-05, 'sentence': ""That's what a metro Atlanta woman discovered charged to her credit card bill after ordering her regular #4 from a College Park Subway."", 'perplexity': 0, 'highlight_sentence_for_ai': False}, {'generated_prob': 2.7192025299882516e-05, 'sentence': '“I could have gone to Italy and got the sandwich,” Vera Conner said.', 'perplexity': 0, 'highlight_sentence_for_ai': False}, {'generated_prob': 2.344419226574246e-05, 'sentence': ""Conner says at the end of every week she checks her credit card statements and that's when she noticed the charge."", 'perplexity': 0, 'highlight_sentence_for_ai': False}, {'generated_prob': 2.9077393264742568e-05, 'sentence': ""“I know exactly what it normally costs, it's $7.54,” she said."", 'perplexity': 0, 'highlight_sentence_for_ai': False}, {'generated_prob': 2.8777692932635546e-05, 'sentence': 'But the bill for the meal charged to her credit card was $7,112.98.', 'perplexity': 0, 'highlight_sentence_for_ai': False}, {'generated_prob': 2.683442107809242e-05, 'sentence': '“I was like, oh, my God, how did this happen?” Conner said.', 'perplexity': 0, 'highlight_sentence_for_ai': False}, {'generated_prob': 2.8063328500138596e-05, 'sentence': 'Conner then noticed that the number on the tipline matched several numbers of her telephone number.', 'perplexity': 0, 'highlight_sentence_for_ai': False}, {'generated_prob': 2.6399966372991912e-05, 'sentence': 'She now believes the screen changed to tip when she was trying to enter her phone number to collect her Subway rewards points.', 'perplexity': 0, 'highlight_sentence_for_ai': False}, {'generated_prob': 3.1522533390671015e-05, 'sentence': 'I must have been keying it in the pad, and the screen changed,” Conner said.', 'perplexity': 0, 'highlight_sentence_for_ai': False}, {'generated_prob': 2.8566144465003163e-05, 'sentence': 'She thought it would be a simple fix but for nearly a month Conner has been trying unsuccessfully to get the charge reversed.', 'perplexity': 0, 'highlight_sentence_for_ai': False}, {'generated_prob': 3.1072857382241637e-05, 'sentence': 'Conner says the Subway store manager repeatedly refused to discuss it with her and she received a denial letter when she disputed the charge with her credit card company.', 'perplexity': 0, 'highlight_sentence_for_ai': False}, {'generated_prob': 2.9538814487750642e-05, 'sentence': ""“This is unbelievable because I feel like everyone that sees it has to know that it's a mistake."", 'perplexity': 0, 'highlight_sentence_for_ai': False}, {'generated_prob': 5.0954404287040234e-05, 'sentence': ""I've worked in retail before."", 'perplexity': 0, 'highlight_sentence_for_ai': False}, {'generated_prob': 5.294514267006889e-05, 'sentence': 'I know how we tally up at the end of the night,” Conner said.', 'perplexity': 0, 'highlight_sentence_for_ai': False}, {'generated_prob': 9.992824925575405e-05, 'sentence': 'Gray has reached out to Subway but has not heard back.', 'perplexity': 0, 'highlight_sentence_for_ai': False}, {'generated_prob': 0.00037865652120672166, 'sentence': ""WSB-TV's Your browser does not support HTML5 audio."", 'perplexity': 0, 'highlight_sentence_for_ai': False}, {'generated_prob': 0.0004079511563759297, 'sentence': 'news weather traffic Sign up below to be added to our mailing list for the latest news updates, access to exclusive contests, and more!', 'perplexity': 0, 'highlight_sentence_for_ai': False}, {'generated_prob': 0.0002716438320931047, 'sentence': 'Everything you love about wsbradio.com and more!', 'perplexity': 0, 'highlight_sentence_for_ai': False}, {'generated_prob': 0.0003240738296881318, 'sentence': 'Tap on any of the buttons below to download our app.', 'perplexity': 0, 'highlight_sentence_for_ai': False}, {'generated_prob': 0.00035356334410607815, 'sentence': 'Enable our Skill today to listen live at home on your Alexa Devices!', 'perplexity': 0, 'highlight_sentence_for_ai': False}, {'generated_prob': 6.77772331982851e-05, 'sentence': '© Cox Media Group.', 'perplexity': 0, 'highlight_sentence_for_ai': False}, {'generated_prob': 0.00015209328557830304, 'sentence': 'All Rights Reserved.', 'perplexity': 0, 'highlight_sentence_for_ai': False}, {'generated_prob': 0.00018625444499775767, 'sentence': 'By using this website, you accept the terms of our Visitor Agreement and Privacy Policy, and understand your options regarding Ad Choices.', 'perplexity': 0, 'highlight_sentence_for_ai': False}, {'generated_prob': 0.00017185766773764044, 'sentence': 'Learn about careers at Cox Media Group.', 'perplexity': 0, 'highlight_sentence_for_ai': False}, {'generated_prob': 0.0004990359884686768, 'sentence': 'You may be offline.', 'perplexity': 0, 'highlight_sentence_for_ai': False}, {'generated_prob': 0.000514908810146153, 'sentence': 'Please check your connection and try again using the Retry button.', 'perplexity': 0, 'highlight_sentence_for_ai': False}], 'paragraphs': [{'start_sentence_index': 0, 'num_sentences': 27, 'completely_generated_prob': 6.669367083709894e-24}], 'completely_generated_prob': 0.005203089766913354, 'class_probabilities': {'human': 0.9947969102330866, 'ai': 0.005203089766913354, 'mixed': 0}, 'average_generated_prob': 0, 'predicted_class': 'human', 'confidence_score': 0.9947969102330866, 'confidence_category': 'high', 'confidence_scores_raw': {'identity': {'ai': 0.005203089766913354, 'human': 0.9947969102330866, 'mixed': 0}}, 'confidence_thresholds_raw': {'identity': {'ai': {'reject': 0.65, 'low': 0.75, 'medium': 0.92}, 'human': {'reject': 0.7, 'low': 0.82, 'medium': 0.92}, 'mixed': {'reject': 0.7, 'low': 0.8, 'medium': 0.88}}}, 'overall_burstiness': 0, 'writing_stats': {}, 'subclass': {'ai': {}, 'human': {}, 'mixed': {}}, 'result_message': 'Our detector is highly confident that the text is written entirely by a human.', 'document_classification': 'HUMAN_ONLY', 'version': '2025-01-09-base', 'language': 'en', 'pageNumber': 0, 'inputText': 'College Park Subway COLLEGE PARK, Ga. — More than $7,000 for a Subway Italian sub. That’s what a metro Atlanta woman discovered charged to her credit card bill after ordering her regular #4 from a College Park Subway. “I could have gone to Italy and got the sandwich,” Vera Conner said. Conner says at the end of every week she checks her credit card statements and that’s when she noticed the charge. “I know exactly what it normally costs, it’s $7.54,” she said. But the bill for the meal charged to her credit card was $7,112.98. “I was like, oh, my God, how did this happen?” Conner said. Conner then noticed that the number on the tipline matched several numbers of her telephone number. She now believes the screen changed to tip when she was trying to enter her phone number to collect her Subway rewards points. I must have been keying it in the pad, and the screen changed,” Conner said. She thought it would be a simple fix but for nearly a month Conner has been trying unsuccessfully to get the charge reversed. Conner says the Subway store manager repeatedly refused to discuss it with her and she received a denial letter when she disputed the charge with her credit card company. “This is unbelievable because I feel like everyone that sees it has to know that it’s a mistake. I’ve worked in retail before. I know how we tally up at the end of the night,” Conner said. Gray has reached out to Subway but has not heard back. WSB-TV’s Your browser does not support HTML5 audio. news weather traffic Sign up below to be added to our mailing list for the latest news updates, access to exclusive contests, and more! Everything you love about wsbradio.com and more! Tap on any of the buttons below to download our app. Enable our Skill today to listen live at home on your Alexa Devices! © Cox Media Group. All Rights Reserved. By using this website, you accept the terms of our Visitor Agreement and Privacy Policy, and understand your options regarding Ad Choices. Learn about careers at Cox Media Group. You may be offline. Please check your connection and try again using the Retry button.'}]"
GA_2023_ca2381bb50f0b688b218e4757a0c51d4.html.gz,2025-01-09-base,"[{'sentences': [{'generated_prob': 0.00010179115633945912, 'sentence': 'Sections About Connect With Us Reporter Fiona King is a reporter for 41NBC News.', 'perplexity': 0, 'highlight_sentence_for_ai': False}, {'generated_prob': 8.077961683738977e-05, 'sentence': 'Fiona landed her first news job behind the scenes as a production assistant in Tucson, AZ.', 'perplexity': 0, 'highlight_sentence_for_ai': False}, {'generated_prob': 8.81845917319879e-05, 'sentence': 'She dabbled in Radio and Podcasting before eventually trading in her sunglasses for snow boots, as she took a job as a News Producer in Billings, MT for a statewide morning show.', 'perplexity': 0, 'highlight_sentence_for_ai': False}, {'generated_prob': 7.186511356849223e-05, 'sentence': 'There she learned the ins and outs of News Producing.', 'perplexity': 0, 'highlight_sentence_for_ai': False}, {'generated_prob': 6.467470666393638e-05, 'sentence': 'In this position, she covered severe weather coverage including flooding, wildfires, and tornadoes, as well as multiple presidential visits & numerous breaking news stories.', 'perplexity': 0, 'highlight_sentence_for_ai': False}, {'generated_prob': 7.582940452266484e-05, 'sentence': 'After that, she was able to make the jump to Phoenix, AZ as a morning News Producer for FOX 10 KSAZ-TV.', 'perplexity': 0, 'highlight_sentence_for_ai': False}, {'generated_prob': 8.807798440102488e-05, 'sentence': 'Fiona is now taking her newsroom experience straight to the community.', 'perplexity': 0, 'highlight_sentence_for_ai': False}, {'generated_prob': 7.52110208850354e-05, 'sentence': 'She is looking to tell stories directly from people in the community.', 'perplexity': 0, 'highlight_sentence_for_ai': False}, {'generated_prob': 0.00011209810327272862, 'sentence': ""Fiona grew up in Highspire, PA a small city outside of Harrisburg, PA. She earned a Bachelor's degree in Communications with a minor in Psychology from the University of Pittsburgh-Johnstown in 2013."", 'perplexity': 0, 'highlight_sentence_for_ai': False}, {'generated_prob': 0.00029892948805354536, 'sentence': '“When I was growing up, my father always told me to watch the news for at least 30 minutes a day.', 'perplexity': 0, 'highlight_sentence_for_ai': False}, {'generated_prob': 0.00029588304460048676, 'sentence': ""When I asked why, he said so that I know what's happening in the world."", 'perplexity': 0, 'highlight_sentence_for_ai': False}, {'generated_prob': 0.00039156433194875717, 'sentence': 'It was not until years later that I fully understood what a great gift I was given.', 'perplexity': 0, 'highlight_sentence_for_ai': False}, {'generated_prob': 0.0006001580040901899, 'sentence': ""My goal is to spread knowledge, information, and entertainment to individuals around the community.” If there's a story that needs to be told, reach out and let her know."", 'perplexity': 0, 'highlight_sentence_for_ai': False}, {'generated_prob': 0.4774201214313507, 'sentence': 'November 3, 2023 November 3, 2023 November 3, 2023 November 3, 2023 November 3, 2023 November 3, 2023 November 3, 2023 November 3, 2023 November 3, 2023 November 3, 2023 November 3, 2023 November 3, 2023 November 3, 2023 November 3, 2023 November 3, 2023 November 3, 2023 November 3, 2023 November 3, 2023 November 3, 2023 November 3, 2023 November 3, 2023 November 3, 2023 November 3, 2023 November 3, 2023 November 3, 2023 November 3, 2023 November 3, 2023 November 3, 2023 November 3, 2023 November 3, 2023 November 3, 2023 November 3, 2023 November 3, 2023 November 3, 2023 November 3, 2023 November 3, 2023 November 3, 2023 November 3, 2023 November 3, 2023 November 3, 2023 © 2024 41NBC News | WMGT-DT.', 'perplexity': 0, 'highlight_sentence_for_ai': False}, {'generated_prob': 0.07108904421329498, 'sentence': 'Clear.', 'perplexity': 0, 'highlight_sentence_for_ai': False}, {'generated_prob': 0.044433169066905975, 'sentence': 'Accurate.', 'perplexity': 0, 'highlight_sentence_for_ai': False}, {'generated_prob': 0.0542433075606823, 'sentence': 'To the Point.', 'perplexity': 0, 'highlight_sentence_for_ai': False}, {'generated_prob': 0.037970829755067825, 'sentence': ""Talk to 41NBC/WMGT's anchors, reporters and meteorologists."", 'perplexity': 0, 'highlight_sentence_for_ai': False}, {'generated_prob': 0.053325872868299484, 'sentence': 'When you see news happening, share it!', 'perplexity': 0, 'highlight_sentence_for_ai': False}, {'generated_prob': 0.08508199453353882, 'sentence': ""We'd love to hear from you."", 'perplexity': 0, 'highlight_sentence_for_ai': False}, {'generated_prob': 0.04111433029174805, 'sentence': '(478) 745- 4141 | Share It Download the 41NBC News App and the 41NBC Accuweather App on your smartphone or tablet.', 'perplexity': 0, 'highlight_sentence_for_ai': False}, {'generated_prob': 0.047200046479701996, 'sentence': 'NEWS App | WEATHER App Get breaking news alerts, daily headlines and exclusive offers in your inbox.', 'perplexity': 0, 'highlight_sentence_for_ai': False}, {'generated_prob': 0.034447506070137024, 'sentence': '41NBC Email Sign Up', 'perplexity': 0, 'highlight_sentence_for_ai': False}], 'paragraphs': [{'start_sentence_index': 0, 'num_sentences': 23, 'completely_generated_prob': 2.3367398512545458e-20}], 'completely_generated_prob': 0.07780643284428201, 'class_probabilities': {'human': 0.9203729942098717, 'ai': 0.07780643284428201, 'mixed': 0.0018205729458463018}, 'average_generated_prob': 0, 'predicted_class': 'human', 'confidence_score': 0.9203729942098717, 'confidence_category': 'high', 'confidence_scores_raw': {'identity': {'ai': 0.07780643284428201, 'human': 0.9203729942098717, 'mixed': 0.0018205729458463018}}, 'confidence_thresholds_raw': {'identity': {'ai': {'reject': 0.65, 'low': 0.75, 'medium': 0.92}, 'human': {'reject': 0.7, 'low': 0.82, 'medium': 0.92}, 'mixed': {'reject': 0.7, 'low': 0.8, 'medium': 0.88}}}, 'overall_burstiness': 0, 'writing_stats': {}, 'subclass': {'ai': {}, 'human': {}, 'mixed': {}}, 'result_message': 'Our detector is highly confident that the text is written entirely by a human.', 'document_classification': 'HUMAN_ONLY', 'version': '2025-01-09-base', 'language': 'en', 'pageNumber': 0, 'inputText': 'Sections About Connect With Us Reporter Fiona King is a reporter for 41NBC News. Fiona landed her first news job behind the scenes as a production assistant in Tucson, AZ. She dabbled in Radio and Podcasting before eventually trading in her sunglasses for snow boots, as she took a job as a News Producer in Billings, MT for a statewide morning show. There she learned the ins and outs of News Producing. In this position, she covered severe weather coverage including flooding, wildfires, and tornadoes, as well as multiple presidential visits & numerous breaking news stories. After that, she was able to make the jump to Phoenix, AZ as a morning News Producer for FOX 10 KSAZ-TV. Fiona is now taking her newsroom experience straight to the community. She is looking to tell stories directly from people in the community. Fiona grew up in Highspire, PA a small city outside of Harrisburg, PA. She earned a Bachelor’s degree in Communications with a minor in Psychology from the University of Pittsburgh-Johnstown in 2013. “When I was growing up, my father always told me to watch the news for at least 30 minutes a day. When I asked why, he said so that I know what’s happening in the world. It was not until years later that I fully understood what a great gift I was given. My goal is to spread knowledge, information, and entertainment to individuals around the community.” If there’s a story that needs to be told, reach out and let her know. November 3, 2023 November 3, 2023 November 3, 2023 November 3, 2023 November 3, 2023 November 3, 2023 November 3, 2023 November 3, 2023 November 3, 2023 November 3, 2023 November 3, 2023 November 3, 2023 November 3, 2023 November 3, 2023 November 3, 2023 November 3, 2023 November 3, 2023 November 3, 2023 November 3, 2023 November 3, 2023 November 3, 2023 November 3, 2023 November 3, 2023 November 3, 2023 November 3, 2023 November 3, 2023 November 3, 2023 November 3, 2023 November 3, 2023 November 3, 2023 November 3, 2023 November 3, 2023 November 3, 2023 November 3, 2023 November 3, 2023 November 3, 2023 November 3, 2023 November 3, 2023 November 3, 2023 November 3, 2023 © 2024 41NBC News | WMGT-DT. Clear. Accurate. To the Point. Talk to 41NBC/WMGT’s anchors, reporters and meteorologists. When you see news happening, share it! We’d love to hear from you. (478) 745- 4141 | Share It Download the 41NBC News App and the 41NBC Accuweather App on your smartphone or tablet. NEWS App | WEATHER App Get breaking news alerts, daily headlines and exclusive offers in your inbox. 41NBC Email Sign Up'}]"
