File,version,documents
OH_2023_6f6694cae83f09016fffe8d9305c1885.html.gz,2025-01-09-base,"[{'sentences': [{'generated_prob': 0.0004663497966248542, 'sentence': 'Jo Ingles is a professional journalist who covers politics and Ohio government for the Ohio Public Radio and Television for the Ohio Public Radio and Television Statehouse News Bureau.', 'perplexity': 0, 'highlight_sentence_for_ai': False}, {'generated_prob': 0.0004754075198434293, 'sentence': 'She reports on issues of importance to Ohioans including education, legislation, politics, and life and death issues such as capital punishment.', 'perplexity': 0, 'highlight_sentence_for_ai': False}, {'generated_prob': 0.0005203892360441387, 'sentence': ""Jo started her career in Louisville, Kentucky in the mid 80's when she helped produce a televised presidential debate for ABC News, worked for a creative services company and served as a general assignment report for a commercial radio station."", 'perplexity': 0, 'highlight_sentence_for_ai': False}, {'generated_prob': 0.0006075529381632805, 'sentence': 'In 1989, she returned back to her native Ohio to work at the WOSU Stations in Columbus where she began a long resume in public radio.', 'perplexity': 0, 'highlight_sentence_for_ai': False}, {'generated_prob': 0.00046071971883066, 'sentence': 'After working for more than a decade at WOSU-AM, Jo was hired by the Ohio Public Radio/TV News Bureau in 1999.', 'perplexity': 0, 'highlight_sentence_for_ai': False}, {'generated_prob': 0.00048066742601804435, 'sentence': 'Her work has been featured on national networks such as National Public Radio, Marketplace, the Great Lakes Radio Consortium and the BBC.', 'perplexity': 0, 'highlight_sentence_for_ai': False}, {'generated_prob': 0.0004643288266379386, 'sentence': ""She is often a guest on radio talk shows heard on Ohio's public radio stations."", 'perplexity': 0, 'highlight_sentence_for_ai': False}, {'generated_prob': 0.00045413602492772043, 'sentence': ""In addition, she's a regular guest on WOSU-TV's “Columbus on the Record”, WOSU Radio's “All Sides with Ann Fisher” and other radio and television shows throughout the state."", 'perplexity': 0, 'highlight_sentence_for_ai': False}, {'generated_prob': 0.0003774964134208858, 'sentence': 'Jo also writes for respected publications such as Columbus Monthly and the Reuters News Service.', 'perplexity': 0, 'highlight_sentence_for_ai': False}, {'generated_prob': 0.0003979286120738834, 'sentence': 'She has won many awards for her work across all of those platforms.', 'perplexity': 0, 'highlight_sentence_for_ai': False}, {'generated_prob': 0.0004053186275996268, 'sentence': ""She is currently the president of the Ohio Radio and TV Correspondent's Association, a board member for the Ohio Legislative Correspondent's Association and a board member for the Ohio Associated Press Broadcasters."", 'perplexity': 0, 'highlight_sentence_for_ai': False}, {'generated_prob': 0.0004115446354262531, 'sentence': 'Jo is also the media adviser for the Ohio Wesleyan University, “Transcript” newspaper.', 'perplexity': 0, 'highlight_sentence_for_ai': False}, {'generated_prob': 0.0004639153485186398, 'sentence': 'She also teaches radio productions courses there.', 'perplexity': 0, 'highlight_sentence_for_ai': False}, {'generated_prob': 0.0005835152696818113, 'sentence': 'She lives in southern Delaware County with her husband, Roger, and two children.', 'perplexity': 0, 'highlight_sentence_for_ai': False}], 'paragraphs': [{'start_sentence_index': 0, 'num_sentences': 14, 'completely_generated_prob': 1.9423489116273474e-12}], 'completely_generated_prob': 0.008764888981516596, 'class_probabilities': {'human': 0.9912351110184834, 'ai': 0.008764888981516596, 'mixed': 0}, 'average_generated_prob': 0, 'predicted_class': 'human', 'confidence_score': 0.9912351110184834, 'confidence_category': 'high', 'confidence_scores_raw': {'identity': {'ai': 0.008764888981516596, 'human': 0.9912351110184834, 'mixed': 0}}, 'confidence_thresholds_raw': {'identity': {'ai': {'reject': 0.65, 'low': 0.75, 'medium': 0.92}, 'human': {'reject': 0.7, 'low': 0.82, 'medium': 0.92}, 'mixed': {'reject': 0.7, 'low': 0.8, 'medium': 0.88}}}, 'overall_burstiness': 0, 'writing_stats': {}, 'subclass': {'ai': {}, 'human': {}, 'mixed': {}}, 'result_message': 'Our detector is highly confident that the text is written entirely by a human.', 'document_classification': 'HUMAN_ONLY', 'version': '2025-01-09-base', 'language': 'en', 'pageNumber': 0, 'inputText': 'Jo Ingles is a professional journalist who covers politics and Ohio government for the Ohio Public Radio and Television for the Ohio Public Radio and Television Statehouse News Bureau. She reports on issues of importance to Ohioans including education, legislation, politics, and life and death issues such as capital punishment. Jo started her career in Louisville, Kentucky in the mid 80’s when she helped produce a televised presidential debate for ABC News, worked for a creative services company and served as a general assignment report for a commercial radio station. In 1989, she returned back to her native Ohio to work at the WOSU Stations in Columbus where she began a long resume in public radio. After working for more than a decade at WOSU-AM, Jo was hired by the Ohio Public Radio/TV News Bureau in 1999. Her work has been featured on national networks such as National Public Radio, Marketplace, the Great Lakes Radio Consortium and the BBC. She is often a guest on radio talk shows heard on Ohio’s public radio stations. In addition, she’s a regular guest on WOSU-TV’s “Columbus on the Record”, WOSU Radio’s “All Sides with Ann Fisher” and other radio and television shows throughout the state. Jo also writes for respected publications such as Columbus Monthly and the Reuters News Service. She has won many awards for her work across all of those platforms. She is currently the president of the Ohio Radio and TV Correspondent’s Association, a board member for the Ohio Legislative Correspondent’s Association and a board member for the Ohio Associated Press Broadcasters. Jo is also the media adviser for the Ohio Wesleyan University, “Transcript” newspaper. She also teaches radio productions courses there. She lives in southern Delaware County with her husband, Roger, and two children.'}]"
OH_2023_7b98bd74b8116ee198bed21775e9b4f0.html.gz,2025-01-09-base,"[{'sentences': [{'generated_prob': 0.00010392632975708693, 'sentence': 'By: Jo Ingles | Statehouse News Bureau Posted on: Saturday, December 16, 2023 COLUMBUS, Ohio (Statehouse News Bureau) ᅳ Democratic state senators say gun violence is out of control in Ohio and the rest of the country.', 'perplexity': 0, 'highlight_sentence_for_ai': False}, {'generated_prob': 0.00014040697715245187, 'sentence': 'And they want their fellow lawmakers in the Ohio Legislature to do something to reduce it by passing some gun safety bills they have proposed.', 'perplexity': 0, 'highlight_sentence_for_ai': False}, {'generated_prob': 0.00016090121062006801, 'sentence': 'But the bills are a long shot in the Republican-dominated legislature.', 'perplexity': 0, 'highlight_sentence_for_ai': False}, {'generated_prob': 0.00021525236661545932, 'sentence': 'Sens.', 'perplexity': 0, 'highlight_sentence_for_ai': False}, {'generated_prob': 0.00016260660777334124, 'sentence': 'L-R- Sen Hearcel Craig (D-Columbus), Minority Leader Nickie Antonio (D-Lakewood) and Vernon Sykes (D-Akron) speak to reporters at the Ohio Statehouse about gun violence.', 'perplexity': 0, 'highlight_sentence_for_ai': False}, {'generated_prob': 0.00010682847641874105, 'sentence': '[Jo Ingles | Statehouse News Bureau]For Sen. Hearcel Craig (D-Columbus), this issue is personal.', 'perplexity': 0, 'highlight_sentence_for_ai': False}, {'generated_prob': 0.00012191633868496865, 'sentence': '“I live on the south side of Columbus and almost every day I hear gunfire near my home,” Craig said.', 'perplexity': 0, 'highlight_sentence_for_ai': False}, {'generated_prob': 0.00012874223466496915, 'sentence': 'Craig, along with Sen. Vernon Sykes (D-Akron) and Senate Minority Leader Nickie Antonio (D-Lakewood), said gun violence is out of control.', 'perplexity': 0, 'highlight_sentence_for_ai': False}, {'generated_prob': 0.00011096743401139975, 'sentence': '“I want you to think just a minute.', 'perplexity': 0, 'highlight_sentence_for_ai': False}, {'generated_prob': 8.292940037790686e-05, 'sentence': ""That's our children."", 'perplexity': 0, 'highlight_sentence_for_ai': False}, {'generated_prob': 0.000133531226310879, 'sentence': ""That's a father."", 'perplexity': 0, 'highlight_sentence_for_ai': False}, {'generated_prob': 0.00016657981905154884, 'sentence': ""That's a niece, nephew,” Craig said."", 'perplexity': 0, 'highlight_sentence_for_ai': False}, {'generated_prob': 0.00019612160394899547, 'sentence': 'SB 187- would harmonize Ohio law with federal law when it comes to prohibiting domestic abusers from having access to guns SB 188 - would provide gun owners with the option to store their firearms outside the home with regulated gun dealers or shooting range owners SB 189 - would give a non-refundable income tax credit of up to $250 per person per year to cover the cost of handgun safety training, safe storage or locking devices.', 'perplexity': 0, 'highlight_sentence_for_ai': False}, {'generated_prob': 0.0002332907752133906, 'sentence': 'Republicans have supermajorities in both chambers of the legislature.', 'perplexity': 0, 'highlight_sentence_for_ai': False}, {'generated_prob': 0.00017497516819275916, 'sentence': 'And in recent years, they have passed bills that give more rights to gun owners and loosen regulations on firearms.', 'perplexity': 0, 'highlight_sentence_for_ai': False}, {'generated_prob': 0.0001586602593306452, 'sentence': 'The Democrats stress these three bills are bipartisan and were developed after talking to stakeholders, including the National Rifle Association, Buckeye Firearms, Moms Demand Action for Gun Sense in America, the Ohio Mayors Alliance and local government leaders, as well as leaders in the alcohol, drug abuse and mental health arenas.', 'perplexity': 0, 'highlight_sentence_for_ai': False}, {'generated_prob': 9.375692025059834e-05, 'sentence': '“We want to do something.', 'perplexity': 0, 'highlight_sentence_for_ai': False}, {'generated_prob': 0.00018734157492872328, 'sentence': ""We want to get past 'stop.'"", 'perplexity': 0, 'highlight_sentence_for_ai': False}, {'generated_prob': 0.00010454545554239303, 'sentence': 'And this is not a ban on assault weapons or any other controversial issue dealing with guns,” Sykes said.', 'perplexity': 0, 'highlight_sentence_for_ai': False}, {'generated_prob': 4.6714274503756315e-05, 'sentence': 'But John Fortney, a spokesman for Senate President Matt Huffman (R-Lima), took issue with the legislation.', 'perplexity': 0, 'highlight_sentence_for_ai': False}, {'generated_prob': 6.267847493290901e-05, 'sentence': '“Unfortunately, Democrats continue to focus on restricting the second amendment rights of law-abiding Ohioans instead of focusing on the real problem of prosecuting violent crime and keeping offenders in prison,” Fortney said in a statement.', 'perplexity': 0, 'highlight_sentence_for_ai': False}, {'generated_prob': 5.2476349083008245e-05, 'sentence': ""Fortney added, “Criminals don't consult the Ohio Revised Code before committing crimes.” Antonio said she knows it's a challenge to pass bills restricting guns in this political climate."", 'perplexity': 0, 'highlight_sentence_for_ai': False}, {'generated_prob': 5.761410284321755e-05, 'sentence': ""But she said that's not enough of a reason to stop trying, especially legislation like this that has more widespread support."", 'perplexity': 0, 'highlight_sentence_for_ai': False}, {'generated_prob': 6.450951332226396e-05, 'sentence': '“These impossible kinds or pieces of legislation are only impossible until we pass them and then, suddenly we find out, suddenly, maybe 25 years, however long it takes, that indeed it was the right time.', 'perplexity': 0, 'highlight_sentence_for_ai': False}, {'generated_prob': 3.7925969081697986e-05, 'sentence': 'It was possible.', 'perplexity': 0, 'highlight_sentence_for_ai': False}, {'generated_prob': 6.0455597122199833e-05, 'sentence': ""If we don't introduce this legislation, we will never know that this time is the right time,” Antonio said."", 'perplexity': 0, 'highlight_sentence_for_ai': False}, {'generated_prob': 0.00016527698608115315, 'sentence': 'The three bills have been assigned to committees but none has received a hearing.', 'perplexity': 0, 'highlight_sentence_for_ai': False}], 'paragraphs': [{'start_sentence_index': 0, 'num_sentences': 27, 'completely_generated_prob': 6.669367083709894e-24}], 'completely_generated_prob': 0.0051780533755591265, 'class_probabilities': {'human': 0.9948219466244408, 'ai': 0.0051780533755591265, 'mixed': 0}, 'average_generated_prob': 0, 'predicted_class': 'human', 'confidence_score': 0.9948219466244408, 'confidence_category': 'high', 'confidence_scores_raw': {'identity': {'ai': 0.0051780533755591265, 'human': 0.9948219466244408, 'mixed': 0}}, 'confidence_thresholds_raw': {'identity': {'ai': {'reject': 0.65, 'low': 0.75, 'medium': 0.92}, 'human': {'reject': 0.7, 'low': 0.82, 'medium': 0.92}, 'mixed': {'reject': 0.7, 'low': 0.8, 'medium': 0.88}}}, 'overall_burstiness': 0, 'writing_stats': {}, 'subclass': {'ai': {}, 'human': {}, 'mixed': {}}, 'result_message': 'Our detector is highly confident that the text is written entirely by a human.', 'document_classification': 'HUMAN_ONLY', 'version': '2025-01-09-base', 'language': 'en', 'pageNumber': 0, 'inputText': 'By: Jo Ingles | Statehouse News Bureau Posted on: Saturday, December 16, 2023 COLUMBUS, Ohio (Statehouse News Bureau) — Democratic state senators say gun violence is out of control in Ohio and the rest of the country. And they want their fellow lawmakers in the Ohio Legislature to do something to reduce it by passing some gun safety bills they have proposed. But the bills are a long shot in the Republican-dominated legislature. Sens. L-R- Sen Hearcel Craig (D-Columbus), Minority Leader Nickie Antonio (D-Lakewood) and Vernon Sykes (D-Akron) speak to reporters at the Ohio Statehouse about gun violence. [Jo Ingles | Statehouse News Bureau]For Sen. Hearcel Craig (D-Columbus), this issue is personal. “I live on the south side of Columbus and almost every day I hear gunfire near my home,” Craig said. Craig, along with Sen. Vernon Sykes (D-Akron) and Senate Minority Leader Nickie Antonio (D-Lakewood), said gun violence is out of control. “I want you to think just a minute. That’s our children. That’s a father. That’s a niece, nephew,” Craig said. SB 187– would harmonize Ohio law with federal law when it comes to prohibiting domestic abusers from having access to guns SB 188 – would provide gun owners with the option to store their firearms outside the home with regulated gun dealers or shooting range owners SB 189 – would give a non-refundable income tax credit of up to $250 per person per year to cover the cost of handgun safety training, safe storage or locking devices. Republicans have supermajorities in both chambers of the legislature. And in recent years, they have passed bills that give more rights to gun owners and loosen regulations on firearms. The Democrats stress these three bills are bipartisan and were developed after talking to stakeholders, including the National Rifle Association, Buckeye Firearms, Moms Demand Action for Gun Sense in America, the Ohio Mayors Alliance and local government leaders, as well as leaders in the alcohol, drug abuse and mental health arenas. “We want to do something. We want to get past ‘stop.’ And this is not a ban on assault weapons or any other controversial issue dealing with guns,” Sykes said. But John Fortney, a spokesman for Senate President Matt Huffman (R-Lima), took issue with the legislation. “Unfortunately, Democrats continue to focus on restricting the second amendment rights of law-abiding Ohioans instead of focusing on the real problem of prosecuting violent crime and keeping offenders in prison,” Fortney said in a statement. Fortney added, “Criminals don’t consult the Ohio Revised Code before committing crimes.” Antonio said she knows it’s a challenge to pass bills restricting guns in this political climate. But she said that’s not enough of a reason to stop trying, especially legislation like this that has more widespread support. “These impossible kinds or pieces of legislation are only impossible until we pass them and then, suddenly we find out, suddenly, maybe 25 years, however long it takes, that indeed it was the right time. It was possible. If we don’t introduce this legislation, we will never know that this time is the right time,” Antonio said. The three bills have been assigned to committees but none has received a hearing.'}]"
OH_2023_92b7cdf99b3954cb3f504be7c44ed4b2.html.gz,2025-01-09-base,"[{'sentences': [{'generated_prob': 0.9974208474159241, 'sentence': 'In the digital age, businesses are constantly seeking ways to streamline operations and improve efficiency.', 'perplexity': 0, 'highlight_sentence_for_ai': True}, {'generated_prob': 0.9969018697738647, 'sentence': 'One tool that has proven to be a game-changer is the Portable Document Format (PDF).', 'perplexity': 0, 'highlight_sentence_for_ai': True}, {'generated_prob': 0.997952401638031, 'sentence': 'This article will explore how PDFs, particularly through the use of PDFSimpli, can effectively enhance business operations.', 'perplexity': 0, 'highlight_sentence_for_ai': True}, {'generated_prob': 0.9977442026138306, 'sentence': 'PDFs are a universal file format that maintains the formatting of a document, making them perfect for sharing and presenting information.', 'perplexity': 0, 'highlight_sentence_for_ai': True}, {'generated_prob': 0.9984820485115051, 'sentence': 'They are secure, compact, and accessible on any device, making them a staple in business operations.', 'perplexity': 0, 'highlight_sentence_for_ai': True}, {'generated_prob': 0.9981243014335632, 'sentence': 'PDFs can streamline business operations in several ways.', 'perplexity': 0, 'highlight_sentence_for_ai': True}, {'generated_prob': 0.9964041113853455, 'sentence': 'They can be used for everything from creating professional invoices and contracts to sharing presentations and reports.', 'perplexity': 0, 'highlight_sentence_for_ai': True}, {'generated_prob': 0.9978300929069519, 'sentence': 'With PDFs, businesses can ensure that their documents are always presented professionally and consistently, regardless of the device or platform used to view them.', 'perplexity': 0, 'highlight_sentence_for_ai': True}, {'generated_prob': 0.9970731139183044, 'sentence': 'When it comes to managing PDFs, PDFSimpli is a tool that businesses should pay attention to.', 'perplexity': 0, 'highlight_sentence_for_ai': True}, {'generated_prob': 0.9986827969551086, 'sentence': 'PDFSimpli offers a range of features that can help businesses streamline their operations.', 'perplexity': 0, 'highlight_sentence_for_ai': True}, {'generated_prob': 0.9974777698516846, 'sentence': 'These include converting files to and from PDF format, editing PDFs, compressing files to save space, and even adding electronic signatures for a professional touch.', 'perplexity': 0, 'highlight_sentence_for_ai': True}, {'generated_prob': 0.9984217882156372, 'sentence': 'In conclusion, PDFs offer a range of benefits that can help businesses streamline their operations.', 'perplexity': 0, 'highlight_sentence_for_ai': True}, {'generated_prob': 0.9954485297203064, 'sentence': 'They are a versatile, secure, and professional way to manage and share documents.', 'perplexity': 0, 'highlight_sentence_for_ai': True}, {'generated_prob': 0.9972637295722961, 'sentence': 'With tools like PDFSimpli, businesses can take full advantage of the power of PDFs to enhance their operations and improve efficiency.', 'perplexity': 0, 'highlight_sentence_for_ai': True}], 'paragraphs': [{'start_sentence_index': 0, 'num_sentences': 14, 'completely_generated_prob': 0.9482332318004326}], 'completely_generated_prob': 1, 'class_probabilities': {'human': 0, 'ai': 1, 'mixed': 0}, 'average_generated_prob': 1, 'predicted_class': 'ai', 'confidence_score': 1, 'confidence_category': 'high', 'confidence_scores_raw': {'identity': {'ai': 1, 'human': 0, 'mixed': 0}}, 'confidence_thresholds_raw': {'identity': {'ai': {'reject': 0.65, 'low': 0.75, 'medium': 0.92}, 'human': {'reject': 0.7, 'low': 0.82, 'medium': 0.92}, 'mixed': {'reject': 0.7, 'low': 0.8, 'medium': 0.88}}}, 'overall_burstiness': 0, 'writing_stats': {}, 'subclass': {'ai': {'predicted_class': 'pure_ai', 'result_message': '', 'confidence_score': 0.9999999998, 'confidence_category': 'high', 'class_probabilities': {'pure_ai': 0.9999999999, 'ai_paraphrased': 9.999999997e-11}, 'confidence_scores_raw': {'identity': {'pure_ai': 0.9999999998, 'ai_paraphrased': 9.999999997e-11}}, 'confidence_thresholds_raw': {'identity': {'pure_ai': {'reject': 0.65, 'low': 0.75, 'medium': 0.92}, 'ai_paraphrased': {'reject': 0.85, 'low': 0.9, 'medium': 0.95}}}}, 'human': {}, 'mixed': {}}, 'result_message': 'Our detector is highly confident that the text is written by AI.', 'document_classification': 'AI_ONLY', 'version': '2025-01-09-base', 'language': 'en', 'pageNumber': 0, 'inputText': 'In the digital age, businesses are constantly seeking ways to streamline operations and improve efficiency. One tool that has proven to be a game-changer is the Portable Document Format (PDF). This article will explore how PDFs, particularly through the use of PDFSimpli, can effectively enhance business operations. PDFs are a universal file format that maintains the formatting of a document, making them perfect for sharing and presenting information. They are secure, compact, and accessible on any device, making them a staple in business operations. PDFs can streamline business operations in several ways. They can be used for everything from creating professional invoices and contracts to sharing presentations and reports. With PDFs, businesses can ensure that their documents are always presented professionally and consistently, regardless of the device or platform used to view them. When it comes to managing PDFs, PDFSimpli is a tool that businesses should pay attention to. PDFSimpli offers a range of features that can help businesses streamline their operations. These include converting files to and from PDF format, editing PDFs, compressing files to save space, and even adding electronic signatures for a professional touch. In conclusion, PDFs offer a range of benefits that can help businesses streamline their operations. They are a versatile, secure, and professional way to manage and share documents. With tools like PDFSimpli, businesses can take full advantage of the power of PDFs to enhance their operations and improve efficiency.'}]"
