File,version,documents
TX_2022_00928fcc48c87c5ed9d2084b72b5f271.html.gz,2025-01-09-base,"[{'sentences': [{'generated_prob': 0.003063889453187585, 'sentence': ""Multiple Central Texas high school football players were recognized recently on the Blue Bell/Texas Sports Writers Association's lists."", 'perplexity': 0, 'highlight_sentence_for_ai': False}, {'generated_prob': 0.002671307185664773, 'sentence': 'The nonprofit donates funds to school districts, so they can set up emergency funds or eliminate school lunch debt to allow students to get a healthy meal.', 'perplexity': 0, 'highlight_sentence_for_ai': False}, {'generated_prob': 0.002257546177133918, 'sentence': 'This upcoming school year, Senate Bill 68 will go into effect, allowing students in the state of Texas two excused absences for career shadowing days.', 'perplexity': 0, 'highlight_sentence_for_ai': False}, {'generated_prob': 0.0022078431211411953, 'sentence': 'Students from Granger ISD testified for Senate Bill 68.', 'perplexity': 0, 'highlight_sentence_for_ai': False}, {'generated_prob': 0.002580029657110572, 'sentence': 'It would allow juniors and seniors in high school to take excused absences for “career shadowing days.” The $44 million bond includes a new secondary high school campus, new baseball and softball fields, a new football stadium and renovations and upgrades to the existing elementary school.', 'perplexity': 0, 'highlight_sentence_for_ai': False}, {'generated_prob': 0.001845563412643969, 'sentence': 'The Granger ISD school board and district leadership said they are excited about purchasing the additional land and what it could mean for the district.', 'perplexity': 0, 'highlight_sentence_for_ai': False}, {'generated_prob': 0.0024102374445647, 'sentence': 'Larry Fleck said he was ejected from his home and thrown around outside by the harsh winds.', 'perplexity': 0, 'highlight_sentence_for_ai': False}, {'generated_prob': 0.0019212093902751803, 'sentence': 'He ended up 20 yards away from where he first started, and his home was destroyed feet away from him.', 'perplexity': 0, 'highlight_sentence_for_ai': False}, {'generated_prob': 0.002872287528589368, 'sentence': 'Saturday, a fundraiser was held in downtown Granger to support those who lost almost everything in the tornado.', 'perplexity': 0, 'highlight_sentence_for_ai': False}, {'generated_prob': 0.003318408504128456, 'sentence': 'All money raised will go directly to the survivors.', 'perplexity': 0, 'highlight_sentence_for_ai': False}, {'generated_prob': 0.003722506109625101, 'sentence': 'Williamson County has finished its initial assessment of tornado damage.', 'perplexity': 0, 'highlight_sentence_for_ai': False}, {'generated_prob': 0.003121146699413657, 'sentence': 'Officials reported 1,119 buildings received some type of damage.', 'perplexity': 0, 'highlight_sentence_for_ai': False}, {'generated_prob': 0.005866067484021187, 'sentence': 'Granger residents are now cleaning up debris after tornadoes swept through the area Monday evening.', 'perplexity': 0, 'highlight_sentence_for_ai': False}, {'generated_prob': 0.004750713240355253, 'sentence': 'The National Weather Service says its preliminary reports shows Round Rock, Granger, and Elgin were all hit by EF-2 tornadoes.', 'perplexity': 0, 'highlight_sentence_for_ai': False}, {'generated_prob': 0.007146645337343216, 'sentence': ""The small town of Granger is reeling from Monday's tornado with numerous homes destroyed."", 'perplexity': 0, 'highlight_sentence_for_ai': False}, {'generated_prob': 0.005538946483284235, 'sentence': 'Local fire and police departments are taking donations.', 'perplexity': 0, 'highlight_sentence_for_ai': False}, {'generated_prob': 5.030385364079848e-05, 'sentence': 'Local school districts, colleges and universities are closing Thursday, Feb. 3 due to winter weather coming to Texas.', 'perplexity': 0, 'highlight_sentence_for_ai': False}, {'generated_prob': 4.212257408653386e-05, 'sentence': ""You can see if your student's school district in this article."", 'perplexity': 0, 'highlight_sentence_for_ai': False}, {'generated_prob': 4.669725240091793e-05, 'sentence': 'The Cotton Country Club in Granger has set up a reserved table at the historic venue with 13 place settings in memory of the thirteen Americans who lost their lives.', 'perplexity': 0, 'highlight_sentence_for_ai': False}, {'generated_prob': 4.820144022232853e-05, 'sentence': ""All the people that drove by are avid goers at the Cotton Country Club Dance Hall in Granger which is Dud's favorite place to dance every Sunday."", 'perplexity': 0, 'highlight_sentence_for_ai': False}, {'generated_prob': 5.7364231906831264e-05, 'sentence': 'Since January, 13 arrests have been made and three of the cases were so large the offenders were charged with felonies.', 'perplexity': 0, 'highlight_sentence_for_ai': False}, {'generated_prob': 6.30549038760364e-05, 'sentence': ""A mosquito trap in Granger has tested positive for West Nile, the area's first for the year."", 'perplexity': 0, 'highlight_sentence_for_ai': False}, {'generated_prob': 4.075480319443159e-05, 'sentence': 'Granger ISD says that this was possible due to the COVID-19 safety protocols in place as well as teachers who have gone above and beyond.', 'perplexity': 0, 'highlight_sentence_for_ai': False}, {'generated_prob': 5.3959665820002556e-05, 'sentence': 'A big show is scheduled for Friday in Granger featuring country star Neal McCoy, who started the day giving thanks by saying the Pledge of Allegiance.', 'perplexity': 0, 'highlight_sentence_for_ai': False}, {'generated_prob': 5.337239781511016e-05, 'sentence': ""Texas small businesses are feeling like they can't catch a break following the financial hits of COVID-19 and the recent winter storms."", 'perplexity': 0, 'highlight_sentence_for_ai': False}, {'generated_prob': 6.519128510262817e-05, 'sentence': 'Former President Donald Trump was found guilty on all 34 felony counts in his New York trial.', 'perplexity': 0, 'highlight_sentence_for_ai': False}, {'generated_prob': 7.919104245956987e-05, 'sentence': ""Here's how Donald Trump's sentencing could play out."", 'perplexity': 0, 'highlight_sentence_for_ai': False}, {'generated_prob': 6.380189734045416e-05, 'sentence': ""Can Donald Trump still be president now that he's been found guilty?"", 'perplexity': 0, 'highlight_sentence_for_ai': False}, {'generated_prob': 6.881103763589635e-05, 'sentence': ""Here's what the Constitution says."", 'perplexity': 0, 'highlight_sentence_for_ai': False}, {'generated_prob': 7.272480434039608e-05, 'sentence': 'A mix of reactions are pouring in as many are weighing in after Donald Trump was found guilty in his hush money trial.', 'perplexity': 0, 'highlight_sentence_for_ai': False}, {'generated_prob': 6.718393706250936e-05, 'sentence': 'See the photos of Trump and the crowd reacting to his guilty verdict.', 'perplexity': 0, 'highlight_sentence_for_ai': False}, {'generated_prob': 9.985936048906296e-05, 'sentence': 'This material may not be published, broadcast, rewritten, or redistributed.', 'perplexity': 0, 'highlight_sentence_for_ai': False}, {'generated_prob': 0.00010141480015590787, 'sentence': '©2024 FOX Television Stations', 'perplexity': 0, 'highlight_sentence_for_ai': False}], 'paragraphs': [{'start_sentence_index': 0, 'num_sentences': 33, 'completely_generated_prob': 3.09473749034336e-29}], 'completely_generated_prob': 0.006608679833334143, 'class_probabilities': {'human': 0.9933913201666659, 'ai': 0.006608679833334143, 'mixed': 0}, 'average_generated_prob': 0, 'predicted_class': 'human', 'confidence_score': 0.9933913201666659, 'confidence_category': 'high', 'confidence_scores_raw': {'identity': {'ai': 0.006608679833334143, 'human': 0.9933913201666659, 'mixed': 0}}, 'confidence_thresholds_raw': {'identity': {'ai': {'reject': 0.65, 'low': 0.75, 'medium': 0.92}, 'human': {'reject': 0.7, 'low': 0.82, 'medium': 0.92}, 'mixed': {'reject': 0.7, 'low': 0.8, 'medium': 0.88}}}, 'overall_burstiness': 0, 'writing_stats': {}, 'subclass': {'ai': {}, 'human': {}, 'mixed': {}}, 'result_message': 'Our detector is highly confident that the text is written entirely by a human.', 'document_classification': 'HUMAN_ONLY', 'version': '2025-01-09-base', 'language': 'en', 'pageNumber': 0, 'inputText': ""Multiple Central Texas high school football players were recognized recently on the Blue Bell/Texas Sports Writers Association's lists. The nonprofit donates funds to school districts, so they can set up emergency funds or eliminate school lunch debt to allow students to get a healthy meal. This upcoming school year, Senate Bill 68 will go into effect, allowing students in the state of Texas two excused absences for career shadowing days. Students from Granger ISD testified for Senate Bill 68. It would allow juniors and seniors in high school to take excused absences for “career shadowing days.” The $44 million bond includes a new secondary high school campus, new baseball and softball fields, a new football stadium and renovations and upgrades to the existing elementary school. The Granger ISD school board and district leadership said they are excited about purchasing the additional land and what it could mean for the district. Larry Fleck said he was ejected from his home and thrown around outside by the harsh winds. He ended up 20 yards away from where he first started, and his home was destroyed feet away from him. Saturday, a fundraiser was held in downtown Granger to support those who lost almost everything in the tornado. All money raised will go directly to the survivors. Williamson County has finished its initial assessment of tornado damage. Officials reported 1,119 buildings received some type of damage. Granger residents are now cleaning up debris after tornadoes swept through the area Monday evening. The National Weather Service says its preliminary reports shows Round Rock, Granger, and Elgin were all hit by EF-2 tornadoes. The small town of Granger is reeling from Monday's tornado with numerous homes destroyed. Local fire and police departments are taking donations. Local school districts, colleges and universities are closing Thursday, Feb. 3 due to winter weather coming to Texas. You can see if your student's school district in this article. The Cotton Country Club in Granger has set up a reserved table at the historic venue with 13 place settings in memory of the thirteen Americans who lost their lives. All the people that drove by are avid goers at the Cotton Country Club Dance Hall in Granger which is Dud’s favorite place to dance every Sunday. Since January, 13 arrests have been made and three of the cases were so large the offenders were charged with felonies. A mosquito trap in Granger has tested positive for West Nile, the area's first for the year. Granger ISD says that this was possible due to the COVID-19 safety protocols in place as well as teachers who have gone above and beyond. A big show is scheduled for Friday in Granger featuring country star Neal McCoy, who started the day giving thanks by saying the Pledge of Allegiance. Texas small businesses are feeling like they can't catch a break following the financial hits of COVID-19 and the recent winter storms. Former President Donald Trump was found guilty on all 34 felony counts in his New York trial. Here's how Donald Trump's sentencing could play out. Can Donald Trump still be president now that he's been found guilty? Here's what the Constitution says. A mix of reactions are pouring in as many are weighing in after Donald Trump was found guilty in his hush money trial. See the photos of Trump and the crowd reacting to his guilty verdict. This material may not be published, broadcast, rewritten, or redistributed. ©2024 FOX Television Stations""}]"
TX_2022_15a6d67738265a697b96317f21f1c4da.html.gz,2025-01-09-base,"[{'sentences': [{'generated_prob': 0.04371879622340202, 'sentence': ""Victoria May 9, 2024 @ 7:41 am A'Darius McCormick is from the Gulf Coast of Mississippi, where he idolized local reporters and anchors."", 'perplexity': 0, 'highlight_sentence_for_ai': False}, {'generated_prob': 0.030651239678263664, 'sentence': ""He furthered his interest in journalism in Biloxi High's yearbook staff."", 'perplexity': 0, 'highlight_sentence_for_ai': False}, {'generated_prob': 0.036573585122823715, 'sentence': ""A'Darius enrolled at Southern Miss and worked as a student anchor, reporter and podcast, radio and TV segment host."", 'perplexity': 0, 'highlight_sentence_for_ai': False}, {'generated_prob': 0.03942365199327469, 'sentence': ""Off the clock, A'Darius is an inspiring content creator on social media with an interest in vlogging and fashion."", 'perplexity': 0, 'highlight_sentence_for_ai': False}, {'generated_prob': 0.022545907646417618, 'sentence': 'He writes poetry, music and short stories.', 'perplexity': 0, 'highlight_sentence_for_ai': False}, {'generated_prob': 0.07726960629224777, 'sentence': ""A'Darius joined the 25 News Now August 8, 2022 and is excited to get to know the Crossroads as viewers get to know him."", 'perplexity': 0, 'highlight_sentence_for_ai': False}, {'generated_prob': 0.055638015270233154, 'sentence': 'PORT LAVACA, Texas - FEMA will open a Disaster Recovery Center for Calhoun County residents affected by the May 13 tornado and high winds.', 'perplexity': 0, 'highlight_sentence_for_ai': False}, {'generated_prob': 0.06624246388673782, 'sentence': ""The… VICTORIA, Texas - In the race for state representative District 30 AJ Louderback won with 55% of the vote to Jeff Bauknight's 45%."", 'perplexity': 0, 'highlight_sentence_for_ai': False}, {'generated_prob': 0.08698618412017822, 'sentence': 'VICTORIA, Texas - A local couple has released a 13 second video from a hit and run in the 2100 block of E. Sabine St.', 'perplexity': 0, 'highlight_sentence_for_ai': False}, {'generated_prob': 0.011885406449437141, 'sentence': 'It happened Wednesday, M… BLOOMINGTON, Texas - Bloomington High School honored Kevin Garza during their graduation commencement on Friday.', 'perplexity': 0, 'highlight_sentence_for_ai': False}, {'generated_prob': 0.013737140223383904, 'sentence': 'Garza, who was supposed to gr… CUERO, Texas - Emil Garza was officially sworn in office as the new mayor of Cuero on May 13.', 'perplexity': 0, 'highlight_sentence_for_ai': False}, {'generated_prob': 0.010282310657203197, 'sentence': ""VICTORIA, Texas - The former Mayor of Victoria Jeff Bauknight seeks to represent District 30 with a platform that extends beyond border securi… Hayes Farms discussed the agricultural community's vulnerability during hurricane season and shared tips like insurance coverage, protecting i… VICTORIA, Texas - A report to police of child abuse has sparked a full-scale investigation into a daycare facility."", 'perplexity': 0, 'highlight_sentence_for_ai': False}, {'generated_prob': 0.015534918755292892, 'sentence': 'PORT LAVACA, Texas - The agriculture community stands to lose more than just property during hurricane season.', 'perplexity': 0, 'highlight_sentence_for_ai': False}, {'generated_prob': 0.0037665627896785736, 'sentence': 'These people could possibly los… Your browser is out of date and potentially vulnerable to security risks.We recommend switching to one of the following browsers:', 'perplexity': 0, 'highlight_sentence_for_ai': False}], 'paragraphs': [{'start_sentence_index': 0, 'num_sentences': 14, 'completely_generated_prob': 1.9423489116273474e-12}], 'completely_generated_prob': 0.039837804045504216, 'class_probabilities': {'human': 0.9601216422360306, 'ai': 0.039837804045504216, 'mixed': 4.055371846526579e-05}, 'average_generated_prob': 0, 'predicted_class': 'human', 'confidence_score': 0.9601216422360306, 'confidence_category': 'high', 'confidence_scores_raw': {'identity': {'ai': 0.039837804045504216, 'human': 0.9601216422360306, 'mixed': 4.055371846526579e-05}}, 'confidence_thresholds_raw': {'identity': {'ai': {'reject': 0.65, 'low': 0.75, 'medium': 0.92}, 'human': {'reject': 0.7, 'low': 0.82, 'medium': 0.92}, 'mixed': {'reject': 0.7, 'low': 0.8, 'medium': 0.88}}}, 'overall_burstiness': 0, 'writing_stats': {}, 'subclass': {'ai': {}, 'human': {}, 'mixed': {}}, 'result_message': 'Our detector is highly confident that the text is written entirely by a human.', 'document_classification': 'HUMAN_ONLY', 'version': '2025-01-09-base', 'language': 'en', 'pageNumber': 0, 'inputText': ""Victoria May 9, 2024 @ 7:41 am A’Darius McCormick is from the Gulf Coast of Mississippi, where he idolized local reporters and anchors. He furthered his interest in journalism in Biloxi High’s yearbook staff. A’Darius enrolled at Southern Miss and worked as a student anchor, reporter and podcast, radio and TV segment host. Off the clock, A’Darius is an inspiring content creator on social media with an interest in vlogging and fashion. He writes poetry, music and short stories. A’Darius joined the 25 News Now August 8, 2022 and is excited to get to know the Crossroads as viewers get to know him. PORT LAVACA, Texas - FEMA will open a Disaster Recovery Center for Calhoun County residents affected by the May 13 tornado and high winds. The… VICTORIA, Texas - In the race for state representative District 30 AJ Louderback won with 55% of the vote to Jeff Bauknight's 45%. VICTORIA, Texas - A local couple has released a 13 second video from a hit and run in the 2100 block of E. Sabine St. It happened Wednesday, M… BLOOMINGTON, Texas - Bloomington High School honored Kevin Garza during their graduation commencement on Friday. Garza, who was supposed to gr… CUERO, Texas - Emil Garza was officially sworn in office as the new mayor of Cuero on May 13. VICTORIA, Texas - The former Mayor of Victoria Jeff Bauknight seeks to represent District 30 with a platform that extends beyond border securi… Hayes Farms discussed the agricultural community's vulnerability during hurricane season and shared tips like insurance coverage, protecting i… VICTORIA, Texas - A report to police of child abuse has sparked a full-scale investigation into a daycare facility. PORT LAVACA, Texas - The agriculture community stands to lose more than just property during hurricane season. These people could possibly los… Your browser is out of date and potentially vulnerable to security risks.We recommend switching to one of the following browsers:""}]"
TX_2022_23f24649fa84f7e0509c5cd8da9df101.html.gz,2025-01-09-base,"[{'sentences': [{'generated_prob': 0.08889364451169968, 'sentence': '73ºF Si recibes pagos por tus servicios o trabajos a través de aplicaciones como Zelle o Venmo, debes informar al IRS si superan los 600 dólares durante un año fiscal, pero esto a partir del 2023.', 'perplexity': 0, 'highlight_sentence_for_ai': False}, {'generated_prob': 0.07960313558578491, 'sentence': 'Los pagos que se hacen través de estas aplicaciones entran en la declaración del 2022 que se presenta en 2023.', 'perplexity': 0, 'highlight_sentence_for_ai': False}, {'generated_prob': 0.054922666400671005, 'sentence': 'También entran otras aplicaciones como PayPal y Cash App, es decir todos los que reciben pagos por estas plataformas que superen el monto que marca el IRS deberán declararlo con el Formulario 1099-K. Antes los usuarios de estas plataformas también debían de reportarlo con este mismo formulario, pero sólo si excedían los 20,000 dólares por año.', 'perplexity': 0, 'highlight_sentence_for_ai': False}, {'generated_prob': 0.04458334669470787, 'sentence': 'Lo que cambia en la nueva ley tributaria es el monto, ahora se redujo a 600 dólares por año en este 2022.', 'perplexity': 0, 'highlight_sentence_for_ai': False}, {'generated_prob': 0.012576252222061157, 'sentence': 'Si por Zelle te envían el pago de una cena o la cooperación para la compra del regalo de mamá estas transacciones no se declaran ante impuestos, aclaró el IRS.', 'perplexity': 0, 'highlight_sentence_for_ai': False}, {'generated_prob': 0.012787235900759697, 'sentence': '“El dinero recibido a través de aplicaciones de pago de terceros de amigos y familiares como obsequios personales o reembolsos de gastos personales no está sujeto a impuestos”, respondió la oficina de prensa.', 'perplexity': 0, 'highlight_sentence_for_ai': False}, {'generated_prob': 0.046538203954696655, 'sentence': 'Así que puedes despreocuparte por este punto, pero si eres comerciante o tu empleador te paga por Zelle o Venmo sí debes declararlo o hablarlo con tu preparador de impuestos.', 'perplexity': 0, 'highlight_sentence_for_ai': False}, {'generated_prob': 0.0630214586853981, 'sentence': 'A partir de 2023 cualquier pago que supere los 600 dólares por año debes reportarlo con el Formulario 1099-K en tu declaración de impuestos de 2022.', 'perplexity': 0, 'highlight_sentence_for_ai': False}, {'generated_prob': 0.1232757642865181, 'sentence': 'Es decir que si este auto lo vendiste por más de 600 dólares también debes reportarlo al IRS.', 'perplexity': 0, 'highlight_sentence_for_ai': False}, {'generated_prob': 0.5316633582115173, 'sentence': 'Especialistas recomiendan que estas transacciones de ventas de autos, las hagas con cheque o tarjeta para evitar posibles estafas.', 'perplexity': 0, 'highlight_sentence_for_ai': False}, {'generated_prob': 0.3135794401168823, 'sentence': 'Un caso fue el de Óscar Carrasco, quien perdió 3,000 dólares, en una transacción del pago de una camioneta por Zelle.', 'perplexity': 0, 'highlight_sentence_for_ai': False}, {'generated_prob': 0.15037551522254944, 'sentence': 'La principal recomendación es no confiarse y no entregar el producto sin recibir el dinero a una cuenta de banco.', 'perplexity': 0, 'highlight_sentence_for_ai': False}, {'generated_prob': 0.06626372039318085, 'sentence': '“Nunca deje a esa persona ir o el producto ir hasta tener el dinero en su cuenta”, aconseja Aguirre.', 'perplexity': 0, 'highlight_sentence_for_ai': False}], 'paragraphs': [{'start_sentence_index': 0, 'num_sentences': 13, 'completely_generated_prob': 1.4476848035102901e-11}], 'completely_generated_prob': 0.0829845098734776, 'class_probabilities': {'human': 0.9107721414213077, 'ai': 0.0829845098734776, 'mixed': 0.006243348705214614}, 'average_generated_prob': 0, 'predicted_class': 'human', 'confidence_score': 0.9107721414213077, 'confidence_category': 'medium', 'confidence_scores_raw': {'identity': {'ai': 0.0829845098734776, 'human': 0.9107721414213077, 'mixed': 0.006243348705214614}}, 'confidence_thresholds_raw': {'identity': {'ai': {'reject': 0.65, 'low': 0.75, 'medium': 0.92}, 'human': {'reject': 0.7, 'low': 0.82, 'medium': 0.92}, 'mixed': {'reject': 0.7, 'low': 0.8, 'medium': 0.88}}}, 'overall_burstiness': 0, 'writing_stats': {}, 'subclass': {'ai': {}, 'human': {}, 'mixed': {}}, 'result_message': 'Our detector is moderately confident that the text is written entirely by a human.', 'document_classification': 'HUMAN_ONLY', 'version': '2025-01-09-base', 'language': 'en', 'pageNumber': 0, 'inputText': '73ºF Si recibes pagos por tus servicios o trabajos a través de aplicaciones como Zelle o Venmo, debes informar al IRS si superan los 600 dólares durante un año fiscal, pero esto a partir del 2023. Los pagos que se hacen través de estas aplicaciones entran en la declaración del 2022 que se presenta en 2023. También entran otras aplicaciones como PayPal y Cash App, es decir todos los que reciben pagos por estas plataformas que superen el monto que marca el IRS deberán declararlo con el Formulario 1099-K. Antes los usuarios de estas plataformas también debían de reportarlo con este mismo formulario, pero sólo si excedían los 20,000 dólares por año. Lo que cambia en la nueva ley tributaria es el monto, ahora se redujo a 600 dólares por año en este 2022. Si por Zelle te envían el pago de una cena o la cooperación para la compra del regalo de mamá estas transacciones no se declaran ante impuestos, aclaró el IRS. “El dinero recibido a través de aplicaciones de pago de terceros de amigos y familiares como obsequios personales o reembolsos de gastos personales no está sujeto a impuestos”, respondió la oficina de prensa. Así que puedes despreocuparte por este punto, pero si eres comerciante o tu empleador te paga por Zelle o Venmo sí debes declararlo o hablarlo con tu preparador de impuestos. A partir de 2023 cualquier pago que supere los 600 dólares por año debes reportarlo con el Formulario 1099-K en tu declaración de impuestos de 2022. Es decir que si este auto lo vendiste por más de 600 dólares también debes reportarlo al IRS. Especialistas recomiendan que estas transacciones de ventas de autos, las hagas con cheque o tarjeta para evitar posibles estafas. Un caso fue el de Óscar Carrasco, quien perdió 3,000 dólares, en una transacción del pago de una camioneta por Zelle. La principal recomendación es no confiarse y no entregar el producto sin recibir el dinero a una cuenta de banco. “Nunca deje a esa persona ir o el producto ir hasta tener el dinero en su cuenta”, aconseja Aguirre.'}]"
