File,version,documents
MI_2024_01a673b1fef45cedfb15ad3b84548a7f.html.gz,2025-01-09-base,"[{'sentences': [{'generated_prob': 1.5446505130967125e-05, 'sentence': ""(NEW YORK) ᅳ Patients are being evacuated from Gaza's second-largest hospital, which has been under attack from Israel Defense Forces (IDF) troops, amid the ongoing Israel-Hamas war."", 'perplexity': 0, 'highlight_sentence_for_ai': False}, {'generated_prob': 1.5741501556476578e-05, 'sentence': 'At least 14 patients have been moved from Nasser Hospital ᅳ located in the southern city of Khan Younis ᅳ with the help of the World Health Organization (WHO), the Hamas-run Gaza Health Ministry said Monday.', 'perplexity': 0, 'highlight_sentence_for_ai': False}, {'generated_prob': 1.5173103747656569e-05, 'sentence': 'Nine patients are currently receiving care in European Gaza, International Medical Corps, UAE and Indonesia field hospitals, and five patients are in Al-Aqsa hospital in the south, the WHO said in a Monday release.', 'perplexity': 0, 'highlight_sentence_for_ai': False}, {'generated_prob': 1.4200436453393195e-05, 'sentence': 'Among the evacuated patients were two who needed continuous manual ventilation throughout their journey, according to the WHO.', 'perplexity': 0, 'highlight_sentence_for_ai': False}, {'generated_prob': 1.708725540083833e-05, 'sentence': 'Prior to the evacuation, the WHO said it and its partners had been denied entry into Nasser Hospital for two days.', 'perplexity': 0, 'highlight_sentence_for_ai': False}, {'generated_prob': 1.5304509361158125e-05, 'sentence': '“There are still more than 180 patients and 15 doctors and nurses inside Nasser,” WHO Director-General Dr. Tedros Adhanom Ghebreyesus said in a statement.', 'perplexity': 0, 'highlight_sentence_for_ai': False}, {'generated_prob': 1.8666845789994113e-05, 'sentence': '“The hospital is still experiencing an acute shortage of food, basic medical supplies, and oxygen.', 'perplexity': 0, 'highlight_sentence_for_ai': False}, {'generated_prob': 1.5568057278869674e-05, 'sentence': 'There is no tap water and no electricity, except a backup generator maintaining some lifesaving machines.” Additionally, the ministry claims at least five people have died since the hospital lost power and that Israeli forces have arrested medical staff, including the director of the hospital and the only doctor responsible for caring for patients in the ICU.', 'perplexity': 0, 'highlight_sentence_for_ai': False}, {'generated_prob': 1.5283436368918046e-05, 'sentence': 'Ghebreyesus previously stated in a post on the social platform X, formerly known as Twitter, on Sunday that the hospital was “not functioning anymore.” Israel has disputed the hospital is no longer functional.', 'perplexity': 0, 'highlight_sentence_for_ai': False}, {'generated_prob': 1.9554918253561482e-05, 'sentence': ""According to a post on Monday on X by Israel's Coordinator of Government Activities in the Territories (COGAT), which coordinates humanitarian aid for Gaza, supplies have been delivered to Nasser Hospital."", 'perplexity': 0, 'highlight_sentence_for_ai': False}, {'generated_prob': 1.8635482774698175e-05, 'sentence': 'Among the aid includes a tanker carrying diesel fuel, water bottles, bread loaves, a replacement generator and medicine donated by the WHO, COGAT said.', 'perplexity': 0, 'highlight_sentence_for_ai': False}, {'generated_prob': 2.462995507812593e-05, 'sentence': '“The Nasser hospital was operational during the entire IDF activity,” COGAT posted.', 'perplexity': 0, 'highlight_sentence_for_ai': False}, {'generated_prob': 2.7925836548092775e-05, 'sentence': '“We facilitated humanitarian aid and supplies to the hospital and coordinated a UN team to evacuate the patients.” In addition, the IDF claimed it found medicine meant for the Israeli hostages as well as weapons and terrorists, some of whom were allegedly posing as medical staff.', 'perplexity': 0, 'highlight_sentence_for_ai': False}, {'generated_prob': 0.003959213383495808, 'sentence': '“Boxes of medicine were found with the names of Israeli hostages on them,” the IDF said in a statement on Sunday.', 'perplexity': 0, 'highlight_sentence_for_ai': False}, {'generated_prob': 0.00581752322614193, 'sentence': '“The packages of medicine that were found were sealed and had not been transferred to the hostages.” The IDF said Monday it has arrested 200 people at the Nasser Hospital complex suspected of being terrorists.', 'perplexity': 0, 'highlight_sentence_for_ai': False}, {'generated_prob': 0.04656154289841652, 'sentence': ""Since Hamas' surprise terrorist attack on Israel on Oct. 7, 2023, nearly 29,000 people in Gaza have been killed and more than 68,800 have been injured, according to the Hamas-run Gaza Health Ministry."", 'perplexity': 0, 'highlight_sentence_for_ai': False}, {'generated_prob': 0.06205485016107559, 'sentence': ""About 1,200 have been killed in Israel, according to the Israeli Prime Minister's Office."", 'perplexity': 0, 'highlight_sentence_for_ai': False}, {'generated_prob': 0.03617372363805771, 'sentence': 'The IDF said 573 soldiers have been killed since the war began and 235 have been killed since the ground invasion began.', 'perplexity': 0, 'highlight_sentence_for_ai': False}, {'generated_prob': 0.11207166314125061, 'sentence': 'Additionally, there are about 134 hostages still believed to be in captivity in Gaza, 130 of them related to the current war and four related to the 2014 conflict.', 'perplexity': 0, 'highlight_sentence_for_ai': False}, {'generated_prob': 0.10872458666563034, 'sentence': ""Of the 134, at least 32 are believed to be dead, according to the IDF and the Israeli Prime Minister's Office."", 'perplexity': 0, 'highlight_sentence_for_ai': False}, {'generated_prob': 0.11386381089687347, 'sentence': ""ABC News' Sami Zayara contributed to this report."", 'perplexity': 0, 'highlight_sentence_for_ai': False}, {'generated_prob': 0.20959986746311188, 'sentence': 'Copyright © 2024, ABC Audio.', 'perplexity': 0, 'highlight_sentence_for_ai': False}, {'generated_prob': 0.18575522303581238, 'sentence': 'All rights reserved.', 'perplexity': 0, 'highlight_sentence_for_ai': False}, {'generated_prob': 0.23851943016052246, 'sentence': 'View More…', 'perplexity': 0, 'highlight_sentence_for_ai': False}], 'paragraphs': [{'start_sentence_index': 0, 'num_sentences': 24, 'completely_generated_prob': 3.0444088223900345e-21}], 'completely_generated_prob': 0.03908427887396223, 'class_probabilities': {'human': 0.9601676966499811, 'ai': 0.03908427887396223, 'mixed': 0.0007480244760566933}, 'average_generated_prob': 0, 'predicted_class': 'human', 'confidence_score': 0.9601676966499811, 'confidence_category': 'high', 'confidence_scores_raw': {'identity': {'ai': 0.03908427887396223, 'human': 0.9601676966499811, 'mixed': 0.0007480244760566933}}, 'confidence_thresholds_raw': {'identity': {'ai': {'reject': 0.65, 'low': 0.75, 'medium': 0.92}, 'human': {'reject': 0.7, 'low': 0.82, 'medium': 0.92}, 'mixed': {'reject': 0.7, 'low': 0.8, 'medium': 0.88}}}, 'overall_burstiness': 0, 'writing_stats': {}, 'subclass': {'ai': {}, 'human': {}, 'mixed': {}}, 'result_message': 'Our detector is highly confident that the text is written entirely by a human.', 'document_classification': 'HUMAN_ONLY', 'version': '2025-01-09-base', 'language': 'en', 'pageNumber': 0, 'inputText': '(NEW YORK) — Patients are being evacuated from Gaza’s second-largest hospital, which has been under attack from Israel Defense Forces (IDF) troops, amid the ongoing Israel-Hamas war. At least 14 patients have been moved from Nasser Hospital — located in the southern city of Khan Younis — with the help of the World Health Organization (WHO), the Hamas-run Gaza Health Ministry said Monday. Nine patients are currently receiving care in European Gaza, International Medical Corps, UAE and Indonesia field hospitals, and five patients are in Al-Aqsa hospital in the south, the WHO said in a Monday release. Among the evacuated patients were two who needed continuous manual ventilation throughout their journey, according to the WHO. Prior to the evacuation, the WHO said it and its partners had been denied entry into Nasser Hospital for two days. “There are still more than 180 patients and 15 doctors and nurses inside Nasser,” WHO Director-General Dr. Tedros Adhanom Ghebreyesus said in a statement. “The hospital is still experiencing an acute shortage of food, basic medical supplies, and oxygen. There is no tap water and no electricity, except a backup generator maintaining some lifesaving machines.” Additionally, the ministry claims at least five people have died since the hospital lost power and that Israeli forces have arrested medical staff, including the director of the hospital and the only doctor responsible for caring for patients in the ICU. Ghebreyesus previously stated in a post on the social platform X, formerly known as Twitter, on Sunday that the hospital was “not functioning anymore.” Israel has disputed the hospital is no longer functional. According to a post on Monday on X by Israel’s Coordinator of Government Activities in the Territories (COGAT), which coordinates humanitarian aid for Gaza, supplies have been delivered to Nasser Hospital. Among the aid includes a tanker carrying diesel fuel, water bottles, bread loaves, a replacement generator and medicine donated by the WHO, COGAT said. “The Nasser hospital was operational during the entire IDF activity,” COGAT posted. “We facilitated humanitarian aid and supplies to the hospital and coordinated a UN team to evacuate the patients.” In addition, the IDF claimed it found medicine meant for the Israeli hostages as well as weapons and terrorists, some of whom were allegedly posing as medical staff. “Boxes of medicine were found with the names of Israeli hostages on them,” the IDF said in a statement on Sunday. “The packages of medicine that were found were sealed and had not been transferred to the hostages.” The IDF said Monday it has arrested 200 people at the Nasser Hospital complex suspected of being terrorists. Since Hamas’ surprise terrorist attack on Israel on Oct. 7, 2023, nearly 29,000 people in Gaza have been killed and more than 68,800 have been injured, according to the Hamas-run Gaza Health Ministry. About 1,200 have been killed in Israel, according to the Israeli Prime Minister’s Office. The IDF said 573 soldiers have been killed since the war began and 235 have been killed since the ground invasion began. Additionally, there are about 134 hostages still believed to be in captivity in Gaza, 130 of them related to the current war and four related to the 2014 conflict. Of the 134, at least 32 are believed to be dead, according to the IDF and the Israeli Prime Minister’s Office. ABC News’ Sami Zayara contributed to this report. Copyright © 2024, ABC Audio. All rights reserved. View More…'}]"
MI_2024_0561014277ee05776e23d30f280f200f.html.gz,2025-01-09-base,"[{'sentences': [{'generated_prob': 1.0273039151798002e-05, 'sentence': 'A group of five cyclists were riding on a trail in Fall City, Wash., when they were attacked by at least one cougar this past weekend.', 'perplexity': 0, 'highlight_sentence_for_ai': False}, {'generated_prob': 1.1465572242741473e-05, 'sentence': ""The incident occurred on Saturday around 12:30 p.m., according to the King County Sheriff's Office, in a wilderness area along Tokul Creek approximately five miles north of the city of Snoqualmie."", 'perplexity': 0, 'highlight_sentence_for_ai': False}, {'generated_prob': 9.038725693244487e-06, 'sentence': 'A 60-year-old female was hospitalized for non-life threatening injuries, but is in stable condition, according to a statement from the Washington Department of Fish and Wildlife (WDFW).', 'perplexity': 0, 'highlight_sentence_for_ai': False}, {'generated_prob': 9.594498806109186e-06, 'sentence': '""We are thankful that the victim is stable after the incident this weekend,"" said Lieutenant Erik Olson.', 'perplexity': 0, 'highlight_sentence_for_ai': False}, {'generated_prob': 1.1316612472000998e-05, 'sentence': '""The people on scene took immediate action to render aid, and one of our officers was able to arrive within minutes to continue medical aid and coordinate transport.', 'perplexity': 0, 'highlight_sentence_for_ai': False}, {'generated_prob': 9.629345186112914e-06, 'sentence': 'We may have had a very different outcome without their heroic efforts.""', 'perplexity': 0, 'highlight_sentence_for_ai': False}, {'generated_prob': 1.0803554687299766e-05, 'sentence': 'Officers euthanized and removed one young male 75-pound cougar on arrival, but eyewitnesses indicate there may have been a second cougar as well at the scene, said the statement.', 'perplexity': 0, 'highlight_sentence_for_ai': False}, {'generated_prob': 1.118245654652128e-05, 'sentence': 'Officials were unable to find a second cougar that eye-witnesses said they saw on the scene.', 'perplexity': 0, 'highlight_sentence_for_ai': False}, {'generated_prob': 1.2705301742244046e-05, 'sentence': 'Such attacks rarely end up fatal.', 'perplexity': 0, 'highlight_sentence_for_ai': False}, {'generated_prob': 1.6885032891877927e-05, 'sentence': 'In Washington state, there have only been two fatal cougar attacks and approximately 20 other recorded encounters that resulted in human injury in the last 100 years, according to the WDFW.', 'perplexity': 0, 'highlight_sentence_for_ai': False}, {'generated_prob': 0.0011682395124807954, 'sentence': 'Cougars, the largest members of the cat family in Washington, are ""solitary and secretive animals rarely seen in the wild,"" reads a description of the mountain lion on the WDFW website.', 'perplexity': 0, 'highlight_sentence_for_ai': False}, {'generated_prob': 0.0018235626630485058, 'sentence': 'But sightings of them are on the rise in northeast Washington, according to a 2021 report by Northwest Public Broadcasting.', 'perplexity': 0, 'highlight_sentence_for_ai': False}, {'generated_prob': 0.0013108557322993875, 'sentence': 'There are an estimated 3,600 cougars in Washington state as of 2022, says the WDFW.', 'perplexity': 0, 'highlight_sentence_for_ai': False}, {'generated_prob': 0.0010975293116644025, 'sentence': 'If you do encounter a cougar in the wild, ""you definitely want to show the animal that you are not prey.', 'perplexity': 0, 'highlight_sentence_for_ai': False}, {'generated_prob': 0.0010926390532404184, 'sentence': 'They are used to their prey running away,"" said bear and cougar specialist Richard A. Beausoleil in a 2018 interview with WBUR.', 'perplexity': 0, 'highlight_sentence_for_ai': False}, {'generated_prob': 0.0014810313005000353, 'sentence': '""And so the very first thing is to stop, stand tall, make some noise, throw something at the animal if you can, but do not run.""', 'perplexity': 0, 'highlight_sentence_for_ai': False}, {'generated_prob': 0.0017323585925623775, 'sentence': 'If a cougar does attack, the WDFW suggests fighting back, as the cougar will flee if a person is aggressive enough.', 'perplexity': 0, 'highlight_sentence_for_ai': False}, {'generated_prob': 0.002709905384108424, 'sentence': '""Cougars have been driven away by people who have fought back using anything within reach, including sticks, rocks, shovels, backpacks, and clothing ᅳ even bare hands,"" reads their website.', 'perplexity': 0, 'highlight_sentence_for_ai': False}, {'generated_prob': 0.0010716787073761225, 'sentence': 'Copyright 2024 NPR.', 'perplexity': 0, 'highlight_sentence_for_ai': False}, {'generated_prob': 0.0020316527225077152, 'sentence': 'To see more, visit https://www.npr.org.', 'perplexity': 0, 'highlight_sentence_for_ai': False}], 'paragraphs': [{'start_sentence_index': 0, 'num_sentences': 20, 'completely_generated_prob': 1.0446359549956209e-17}], 'completely_generated_prob': 0.006608679833334143, 'class_probabilities': {'human': 0.9933913201666659, 'ai': 0.006608679833334143, 'mixed': 0}, 'average_generated_prob': 0, 'predicted_class': 'human', 'confidence_score': 0.9933913201666659, 'confidence_category': 'high', 'confidence_scores_raw': {'identity': {'ai': 0.006608679833334143, 'human': 0.9933913201666659, 'mixed': 0}}, 'confidence_thresholds_raw': {'identity': {'ai': {'reject': 0.65, 'low': 0.75, 'medium': 0.92}, 'human': {'reject': 0.7, 'low': 0.82, 'medium': 0.92}, 'mixed': {'reject': 0.7, 'low': 0.8, 'medium': 0.88}}}, 'overall_burstiness': 0, 'writing_stats': {}, 'subclass': {'ai': {}, 'human': {}, 'mixed': {}}, 'result_message': 'Our detector is highly confident that the text is written entirely by a human.', 'document_classification': 'HUMAN_ONLY', 'version': '2025-01-09-base', 'language': 'en', 'pageNumber': 0, 'inputText': 'A group of five cyclists were riding on a trail in Fall City, Wash., when they were attacked by at least one cougar this past weekend. The incident occurred on Saturday around 12:30 p.m., according to the King County Sheriff\'s Office, in a wilderness area along Tokul Creek approximately five miles north of the city of Snoqualmie. A 60-year-old female was hospitalized for non-life threatening injuries, but is in stable condition, according to a statement from the Washington Department of Fish and Wildlife (WDFW). ""We are thankful that the victim is stable after the incident this weekend,"" said Lieutenant Erik Olson. ""The people on scene took immediate action to render aid, and one of our officers was able to arrive within minutes to continue medical aid and coordinate transport. We may have had a very different outcome without their heroic efforts."" Officers euthanized and removed one young male 75-pound cougar on arrival, but eyewitnesses indicate there may have been a second cougar as well at the scene, said the statement. Officials were unable to find a second cougar that eye-witnesses said they saw on the scene. Such attacks rarely end up fatal. In Washington state, there have only been two fatal cougar attacks and approximately 20 other recorded encounters that resulted in human injury in the last 100 years, according to the WDFW. Cougars, the largest members of the cat family in Washington, are ""solitary and secretive animals rarely seen in the wild,"" reads a description of the mountain lion on the WDFW website. But sightings of them are on the rise in northeast Washington, according to a 2021 report by Northwest Public Broadcasting. There are an estimated 3,600 cougars in Washington state as of 2022, says the WDFW. If you do encounter a cougar in the wild, ""you definitely want to show the animal that you are not prey. They are used to their prey running away,"" said bear and cougar specialist Richard A. Beausoleil in a 2018 interview with WBUR. ""And so the very first thing is to stop, stand tall, make some noise, throw something at the animal if you can, but do not run."" If a cougar does attack, the WDFW suggests fighting back, as the cougar will flee if a person is aggressive enough. ""Cougars have been driven away by people who have fought back using anything within reach, including sticks, rocks, shovels, backpacks, and clothing — even bare hands,"" reads their website. Copyright 2024 NPR. To see more, visit https://www.npr.org.'}]"
