File,version,documents
CA_2022_0edb8e93127f85d34a8ec40ac473e528.html.gz,2025-01-09-base,"[{'sentences': [{'generated_prob': 0.012270582839846611, 'sentence': ""KBHR 93.3 and 102.5 - Big Bear News Music, News, Road Conditions, Sports - Big Bear Lake, California 12/31/2022 by KBHR NEWS Big Bear Lake, CA - Torches will illuminate the slopes at Snow Summit on New Year's Eve."", 'perplexity': 0, 'highlight_sentence_for_ai': False}, {'generated_prob': 0.007856535725295544, 'sentence': ""Beginning at about 8:00 p.m. Start the New Year by ringing in the New Year at Snow Summit's 58th annual Torchlight Parade."", 'perplexity': 0, 'highlight_sentence_for_ai': False}, {'generated_prob': 0.00815797969698906, 'sentence': 'Admission to the parade viewing area is FREE and open to all ages with a live DJ.', 'perplexity': 0, 'highlight_sentence_for_ai': False}, {'generated_prob': 0.007195129990577698, 'sentence': 'Watch 200+ skiers and snowboarders light up the night as they make their way down the face of the mountain in the dark with torches to create a spellbinding spectacle of light.', 'perplexity': 0, 'highlight_sentence_for_ai': False}, {'generated_prob': 0.0066730547696352005, 'sentence': 'Bundle up as wet weather is expected turning to snow later on New Years morning.', 'perplexity': 0, 'highlight_sentence_for_ai': False}, {'generated_prob': 0.005671530030667782, 'sentence': 'The event will begin around 7PM at Snow Summit and can be seen from many areas in Big Bear Lake within eyesight of the resort.', 'perplexity': 0, 'highlight_sentence_for_ai': False}, {'generated_prob': 0.00456353509798646, 'sentence': 'Filed Under: Arts & Entertainment, Recreation, Sports Tagged With: Big Bear Lake, big bear mountain resort, Snow Summit Big Bear News - KBHR 93.3 ""Big Bear News"" Provides Local & Current News Conditions for the Big Bear Valley · Copyright © 2024 Parallel Broadcasting, Inc. · All Rights Reserved · Log inRoad Conditions | Big Bear Weather | Big Bear News Alerts | Arts & Entertainment | Local Events | Local Fire & Safety | Big Bear Government | ""Think Snow"" Contest | Local Motor Sport News | Police | Lake Recreation | Nat\'l Forest News | BBV School Updates | Weather News | Local Sports NewsKBHR Site Design & Dev.', 'perplexity': 0, 'highlight_sentence_for_ai': False}, {'generated_prob': 0.010598228313028812, 'sentence': 'by Freebird Media', 'perplexity': 0, 'highlight_sentence_for_ai': False}], 'paragraphs': [{'start_sentence_index': 0, 'num_sentences': 8, 'completely_generated_prob': 3.002405151306975e-07}], 'completely_generated_prob': 0.024461651786716186, 'class_probabilities': {'human': 0.9754981327244504, 'ai': 0.024461651786716186, 'mixed': 4.0215488833363626e-05}, 'average_generated_prob': 0, 'predicted_class': 'human', 'confidence_score': 0.9754981327244504, 'confidence_category': 'high', 'confidence_scores_raw': {'identity': {'ai': 0.024461651786716186, 'human': 0.9754981327244504, 'mixed': 4.0215488833363626e-05}}, 'confidence_thresholds_raw': {'identity': {'ai': {'reject': 0.65, 'low': 0.75, 'medium': 0.92}, 'human': {'reject': 0.7, 'low': 0.82, 'medium': 0.92}, 'mixed': {'reject': 0.7, 'low': 0.8, 'medium': 0.88}}}, 'overall_burstiness': 0, 'writing_stats': {}, 'subclass': {'ai': {}, 'human': {}, 'mixed': {}}, 'result_message': 'Our detector is highly confident that the text is written entirely by a human.', 'document_classification': 'HUMAN_ONLY', 'version': '2025-01-09-base', 'language': 'en', 'pageNumber': 0, 'inputText': 'KBHR 93.3 and 102.5 - Big Bear News Music, News, Road Conditions, Sports - Big Bear Lake, California 12/31/2022 by KBHR NEWS Big Bear Lake, CA – Torches will illuminate the slopes at Snow Summit on New Year’s Eve. Beginning at about 8:00 p.m. Start the New Year by ringing in the New Year at Snow Summit’s 58th annual Torchlight Parade. Admission to the parade viewing area is FREE and open to all ages with a live DJ. Watch 200+ skiers and snowboarders light up the night as they make their way down the face of the mountain in the dark with torches to create a spellbinding spectacle of light. Bundle up as wet weather is expected turning to snow later on New Years morning. The event will begin around 7PM at Snow Summit and can be seen from many areas in Big Bear Lake within eyesight of the resort. Filed Under: Arts & Entertainment, Recreation, Sports Tagged With: Big Bear Lake, big bear mountain resort, Snow Summit Big Bear News - KBHR 93.3 ""Big Bear News"" Provides Local & Current News Conditions for the Big Bear Valley · Copyright © 2024 Parallel Broadcasting, Inc. · All Rights Reserved · Log inRoad Conditions | Big Bear Weather | Big Bear News Alerts | Arts & Entertainment | Local Events | Local Fire & Safety | Big Bear Government | ""Think Snow"" Contest | Local Motor Sport News | Police | Lake Recreation | Nat\'l Forest News | BBV School Updates | Weather News | Local Sports NewsKBHR Site Design & Dev. by Freebird Media'}]"
CA_2022_3794fb75bbb1060f4314be69c3233202.html.gz,2025-01-09-base,"[{'sentences': [{'generated_prob': 0.002272676909342408, 'sentence': 'Watch CBS News April 20, 2022 / 1:43 PM PDT / CBS San Francisco CARMEL (AP) -- Pebble Beach is the third course to become an anchor site for the U.S. Open, with the USGA announcing Wednesday four U.S.', 'perplexity': 0, 'highlight_sentence_for_ai': False}, {'generated_prob': 0.004058143589645624, 'sentence': ""Opens and four U.S. Women's Open over the next 26 years."", 'perplexity': 0, 'highlight_sentence_for_ai': False}, {'generated_prob': 0.005631995387375355, 'sentence': 'Pebble Beach joins Pinehurst No.', 'perplexity': 0, 'highlight_sentence_for_ai': False}, {'generated_prob': 0.0033989863004535437, 'sentence': '2 and Oakmont Country Club as anchor sites, a strategy that allows the USGA to return to its most famous U.S. Open courses more frequently.', 'perplexity': 0, 'highlight_sentence_for_ai': False}, {'generated_prob': 0.006109787616878748, 'sentence': 'The USGA made sure the women were not left behind.', 'perplexity': 0, 'highlight_sentence_for_ai': False}, {'generated_prob': 0.004298728425055742, 'sentence': ""The U.S. Women's Open will be held on America's most famous seaside course for the first time next year, and then it will return three more times in 2035, 2040 and 2048."", 'perplexity': 0, 'highlight_sentence_for_ai': False}, {'generated_prob': 0.0036533446982502937, 'sentence': 'Pebble Beach, which opened in 1919 and first hosted a USGA event in 1929 with the U.S.', 'perplexity': 0, 'highlight_sentence_for_ai': False}, {'generated_prob': 0.0034969060216099024, 'sentence': 'Amateur, was the first public course to host the U.S. Open in 1972.', 'perplexity': 0, 'highlight_sentence_for_ai': False}, {'generated_prob': 0.004451474640518427, 'sentence': 'That Open was famous for Jack Nicklaus hitting the pin with a 1-iron on the par-3 17th on his way to victory.', 'perplexity': 0, 'highlight_sentence_for_ai': False}, {'generated_prob': 0.0043329279869794846, 'sentence': ""John Bodenhamer, the USGA's chief championships officer, recalled a conversation with three-time major champion Nick Price who told him it matters where a player wins a U.S. Open."", 'perplexity': 0, 'highlight_sentence_for_ai': False}, {'generated_prob': 0.004975140560418367, 'sentence': '""There are certain places you go and stand out on them, they\'re meant for a U.S. Open or a U.S. Women\'s Open.', 'perplexity': 0, 'highlight_sentence_for_ai': False}, {'generated_prob': 0.003081496572121978, 'sentence': 'You play Pebble Beach, it is a bit of a religious experience,"" Bodenhamer said at a news conference overlooking the 18th hole.', 'perplexity': 0, 'highlight_sentence_for_ai': False}, {'generated_prob': 0.000913869240321219, 'sentence': '""We\'re going where players want to win.""', 'perplexity': 0, 'highlight_sentence_for_ai': False}, {'generated_prob': 0.0013189896708354354, 'sentence': 'Other big moments at Pebble Beach include Tom Watson chipping in on the 17th to beat Nicklaus in 1982, and Tiger Woods delivering his greatest performance when he won the 2000 U.S. Open by 15 shots, the widest margin in major championship history.', 'perplexity': 0, 'highlight_sentence_for_ai': False}, {'generated_prob': 0.003212525974959135, 'sentence': 'It most recently held the U.S. Open in 2019, when Gary Woodland chipped from one end of the 17th green to the other for a remarkable par save on his way to his first major.', 'perplexity': 0, 'highlight_sentence_for_ai': False}, {'generated_prob': 0.004230971913784742, 'sentence': 'Pebble Beach also hosts a PGA Tour event every February dating to 1947.', 'perplexity': 0, 'highlight_sentence_for_ai': False}, {'generated_prob': 0.006224221549928188, 'sentence': 'It once held a PGA Championship (1977) and the precursor to the Tour Championship (1988).', 'perplexity': 0, 'highlight_sentence_for_ai': False}, {'generated_prob': 0.010521533899009228, 'sentence': '""This relationship with Pebble Beach, long considered a national treasure, is a historic step forward for golf,"" said Mike Whan, the CEO of the USGA.', 'perplexity': 0, 'highlight_sentence_for_ai': False}, {'generated_prob': 0.0148537028580904, 'sentence': '""In addition to elevating our Open championships, the USGA and Pebble Bach are committed to working together to ensure a more diverse, welcoming and accessible game.""', 'perplexity': 0, 'highlight_sentence_for_ai': False}, {'generated_prob': 0.012397024780511856, 'sentence': ""Spyglass Hill, regarded as the toughest of the Pebble Beach courses in relatively calm conditions, will host the U.S. Senior Women's Open and the U.S. Senior Open in consecutive weeks in 2030."", 'perplexity': 0, 'highlight_sentence_for_ai': False}, {'generated_prob': 0.019653793424367905, 'sentence': 'As part of the commitment, the USGA and Pebble Beach plan to create internships and other career opportunities in golf, along with research into turf grass and water conservation.', 'perplexity': 0, 'highlight_sentence_for_ai': False}, {'generated_prob': 0.01615755446255207, 'sentence': '""Supporting youth education is a pillar of our community outreach and this partnership will great expand opportunities for young people to pursue a career in this industry,"" said David Stivers, CEO of Pebble Beach Co.', 'perplexity': 0, 'highlight_sentence_for_ai': False}, {'generated_prob': 0.06852877140045166, 'sentence': 'The U.S. Open now has only 10 open slots through 2051, with the next available year in 2028.', 'perplexity': 0, 'highlight_sentence_for_ai': False}, {'generated_prob': 0.110634446144104, 'sentence': 'Of the current anchor sites, Oakmont has hosted the U.S. Open nine times, the most of any club, and the U.S. Open returns to the Pittsburgh-area course in 2025, 2033, 2042 and 2049.', 'perplexity': 0, 'highlight_sentence_for_ai': False}, {'generated_prob': 0.10612082481384277, 'sentence': 'Pinehurst No.', 'perplexity': 0, 'highlight_sentence_for_ai': False}, {'generated_prob': 0.07488686591386795, 'sentence': '2 in North Carolina is the newcomer, first holding the U.S. Open in 1999 and returning in 2005 and 2014.', 'perplexity': 0, 'highlight_sentence_for_ai': False}, {'generated_prob': 0.057767048478126526, 'sentence': 'It has the U.S. Open in 2024, 2029, 2035, 2041 and 2047.', 'perplexity': 0, 'highlight_sentence_for_ai': False}, {'generated_prob': 0.04837805777788162, 'sentence': 'Pinehurst also was chosen as a secondary headquarters for the USGA.', 'perplexity': 0, 'highlight_sentence_for_ai': False}, {'generated_prob': 0.027357030659914017, 'sentence': 'The USGA still could have a fourth anchor site.', 'perplexity': 0, 'highlight_sentence_for_ai': False}, {'generated_prob': 0.024367518723011017, 'sentence': 'Among the clubs said to be under consideration are Shinnecock Hills and Winged Foot, both in New York.', 'perplexity': 0, 'highlight_sentence_for_ai': False}, {'generated_prob': 0.019702602177858353, 'sentence': 'Shinnecock Hills is hosting its sixth U.S. Open in 2026.', 'perplexity': 0, 'highlight_sentence_for_ai': False}, {'generated_prob': 0.010104034096002579, 'sentence': 'Bodenhamer spoke only of multi-year commitments the USGA has.', 'perplexity': 0, 'highlight_sentence_for_ai': False}, {'generated_prob': 0.0087397750467062, 'sentence': 'Oakland Hills outside Detroit recently was awarded U.S.', 'perplexity': 0, 'highlight_sentence_for_ai': False}, {'generated_prob': 0.009138248860836029, 'sentence': 'Opens in 2034 and 2051, while Merion outside Philadelphia has 2030 and 2050.', 'perplexity': 0, 'highlight_sentence_for_ai': False}, {'generated_prob': 0.0064970566891133785, 'sentence': '""There so many exciting things to come down the road,"" he said.', 'perplexity': 0, 'highlight_sentence_for_ai': False}, {'generated_prob': 0.009485884569585323, 'sentence': '""Every one of these long-term relationships are different.', 'perplexity': 0, 'highlight_sentence_for_ai': False}, {'generated_prob': 0.025080913677811623, 'sentence': 'You\'ll see more.""', 'perplexity': 0, 'highlight_sentence_for_ai': False}, {'generated_prob': 0.012097010388970375, 'sentence': 'First published on April 20, 2022 / 1:43 PM PDT © 2022 CBS Broadcasting Inc. All Rights Reserved.', 'perplexity': 0, 'highlight_sentence_for_ai': False}, {'generated_prob': 0.007490455638617277, 'sentence': '©2024 CBS Broadcasting Inc. All Rights Reserved.', 'perplexity': 0, 'highlight_sentence_for_ai': False}], 'paragraphs': [{'start_sentence_index': 0, 'num_sentences': 39, 'completely_generated_prob': 1.3880297752938097e-34}], 'completely_generated_prob': 0.039828139852797, 'class_probabilities': {'human': 0.9598887277771326, 'ai': 0.039828139852797, 'mixed': 0.0002831323700704621}, 'average_generated_prob': 0, 'predicted_class': 'human', 'confidence_score': 0.9598887277771326, 'confidence_category': 'high', 'confidence_scores_raw': {'identity': {'ai': 0.039828139852797, 'human': 0.9598887277771326, 'mixed': 0.0002831323700704621}}, 'confidence_thresholds_raw': {'identity': {'ai': {'reject': 0.65, 'low': 0.75, 'medium': 0.92}, 'human': {'reject': 0.7, 'low': 0.82, 'medium': 0.92}, 'mixed': {'reject': 0.7, 'low': 0.8, 'medium': 0.88}}}, 'overall_burstiness': 0, 'writing_stats': {}, 'subclass': {'ai': {}, 'human': {}, 'mixed': {}}, 'result_message': 'Our detector is highly confident that the text is written entirely by a human.', 'document_classification': 'HUMAN_ONLY', 'version': '2025-01-09-base', 'language': 'en', 'pageNumber': 0, 'inputText': 'Watch CBS News April 20, 2022 / 1:43 PM PDT / CBS San Francisco CARMEL (AP) -- Pebble Beach is the third course to become an anchor site for the U.S. Open, with the USGA announcing Wednesday four U.S. Opens and four U.S. Women\'s Open over the next 26 years. Pebble Beach joins Pinehurst No. 2 and Oakmont Country Club as anchor sites, a strategy that allows the USGA to return to its most famous U.S. Open courses more frequently. The USGA made sure the women were not left behind. The U.S. Women\'s Open will be held on America\'s most famous seaside course for the first time next year, and then it will return three more times in 2035, 2040 and 2048. Pebble Beach, which opened in 1919 and first hosted a USGA event in 1929 with the U.S. Amateur, was the first public course to host the U.S. Open in 1972. That Open was famous for Jack Nicklaus hitting the pin with a 1-iron on the par-3 17th on his way to victory. John Bodenhamer, the USGA\'s chief championships officer, recalled a conversation with three-time major champion Nick Price who told him it matters where a player wins a U.S. Open. ""There are certain places you go and stand out on them, they\'re meant for a U.S. Open or a U.S. Women\'s Open. You play Pebble Beach, it is a bit of a religious experience,"" Bodenhamer said at a news conference overlooking the 18th hole. ""We\'re going where players want to win."" Other big moments at Pebble Beach include Tom Watson chipping in on the 17th to beat Nicklaus in 1982, and Tiger Woods delivering his greatest performance when he won the 2000 U.S. Open by 15 shots, the widest margin in major championship history. It most recently held the U.S. Open in 2019, when Gary Woodland chipped from one end of the 17th green to the other for a remarkable par save on his way to his first major. Pebble Beach also hosts a PGA Tour event every February dating to 1947. It once held a PGA Championship (1977) and the precursor to the Tour Championship (1988). ""This relationship with Pebble Beach, long considered a national treasure, is a historic step forward for golf,"" said Mike Whan, the CEO of the USGA. ""In addition to elevating our Open championships, the USGA and Pebble Bach are committed to working together to ensure a more diverse, welcoming and accessible game."" Spyglass Hill, regarded as the toughest of the Pebble Beach courses in relatively calm conditions, will host the U.S. Senior Women\'s Open and the U.S. Senior Open in consecutive weeks in 2030. As part of the commitment, the USGA and Pebble Beach plan to create internships and other career opportunities in golf, along with research into turf grass and water conservation. ""Supporting youth education is a pillar of our community outreach and this partnership will great expand opportunities for young people to pursue a career in this industry,"" said David Stivers, CEO of Pebble Beach Co. The U.S. Open now has only 10 open slots through 2051, with the next available year in 2028. Of the current anchor sites, Oakmont has hosted the U.S. Open nine times, the most of any club, and the U.S. Open returns to the Pittsburgh-area course in 2025, 2033, 2042 and 2049. Pinehurst No. 2 in North Carolina is the newcomer, first holding the U.S. Open in 1999 and returning in 2005 and 2014. It has the U.S. Open in 2024, 2029, 2035, 2041 and 2047. Pinehurst also was chosen as a secondary headquarters for the USGA. The USGA still could have a fourth anchor site. Among the clubs said to be under consideration are Shinnecock Hills and Winged Foot, both in New York. Shinnecock Hills is hosting its sixth U.S. Open in 2026. Bodenhamer spoke only of multi-year commitments the USGA has. Oakland Hills outside Detroit recently was awarded U.S. Opens in 2034 and 2051, while Merion outside Philadelphia has 2030 and 2050. ""There so many exciting things to come down the road,"" he said. ""Every one of these long-term relationships are different. You\'ll see more."" First published on April 20, 2022 / 1:43 PM PDT © 2022 CBS Broadcasting Inc. All Rights Reserved. ©2024 CBS Broadcasting Inc. All Rights Reserved.'}]"
CA_2022_612821fd0f290752c70975d2c3d3da5c.html.gz,2025-01-09-base,"[{'sentences': [{'generated_prob': 0.0007497098995372653, 'sentence': ""x The SoCal Sound Sessions with Colin Meloy of The Decemberists Read more about 'Colin Meloy of The Decemberists Session with Hillary Gordon'..."", 'perplexity': 0, 'highlight_sentence_for_ai': False}, {'generated_prob': 0.0008030863245949149, 'sentence': 'Girl Ultra SoCal Sound Session from Arroz and Fun!', 'perplexity': 0, 'highlight_sentence_for_ai': False}, {'generated_prob': 0.0009474089602008462, 'sentence': ""Read more about 'Girl Ultra Session with Byron Gonzalez'... Winnetka Bowling League SoCal Sound Session with Mookie!"", 'perplexity': 0, 'highlight_sentence_for_ai': False}, {'generated_prob': 0.0010848484234884381, 'sentence': ""Read more about 'Winnetka Bowling League Session with Mookie'..."", 'perplexity': 0, 'highlight_sentence_for_ai': False}, {'generated_prob': 0.0012897617416456342, 'sentence': ""The SoCal Sound Session with Cuffed Up Read more about 'Cuffed Up Session with Tristan Dolce'..."", 'perplexity': 0, 'highlight_sentence_for_ai': False}, {'generated_prob': 0.004150583408772945, 'sentence': 'WIN TICKETS Members Only: Zach Bryan at Crypto.com Arena on Monday, June 3 SIGN UP FOR FREE TICKETS HERE Members Only: Zach Bryan at Crypto.com Arena on Tuesday, June 4 SIGN UP FOR FREE TICKETS HERE Members Only: Caifanes + Cafe Tacvba at Hollywood Bowl on Wednesday, June 5, 2024 SIGN UP FOR FREE TICKETS HERE Members Only: Tedeschi Trucks Band w/Little Feat at Greek Theatre on Friday, June 7 SIGN UP FOR FREE TICKETS HERE Members Only: Tedeschi Trucks Band w/Little Feat at Greek Theatre on Sunday, June 9 SIGN UP FOR FREE TICKETS HERE The Marias at Hollywood Forever Cemetery on Friday, August 23 SIGN UP FOR FREE TICKETS HERE Members Only: Johnny Marr & James at The Orpheum Theatre on Thursday, September 26 SIGN UP FOR FREE TICKETS HERE Amandititita & Ramona at The Regent on Friday, June 7 SIGN UP FOR FREE TICKETS HERE VIEW ALL EVENTS THANK YOU SUPPORTERS The SoCal Sound counts on each and every contribution to provide you with the best radio content in SoCal DONATE VOLUNTEER FEEDBACK', 'perplexity': 0, 'highlight_sentence_for_ai': False}], 'paragraphs': [{'start_sentence_index': 0, 'num_sentences': 6, 'completely_generated_prob': 1.474742012248794e-05}], 'completely_generated_prob': 0.021601982568463345, 'class_probabilities': {'human': 0.9783576840560043, 'ai': 0.021601982568463345, 'mixed': 4.0333375532255976e-05}, 'average_generated_prob': 0, 'predicted_class': 'human', 'confidence_score': 0.9783576840560043, 'confidence_category': 'high', 'confidence_scores_raw': {'identity': {'ai': 0.021601982568463345, 'human': 0.9783576840560043, 'mixed': 4.0333375532255976e-05}}, 'confidence_thresholds_raw': {'identity': {'ai': {'reject': 0.65, 'low': 0.75, 'medium': 0.92}, 'human': {'reject': 0.7, 'low': 0.82, 'medium': 0.92}, 'mixed': {'reject': 0.7, 'low': 0.8, 'medium': 0.88}}}, 'overall_burstiness': 0, 'writing_stats': {}, 'subclass': {'ai': {}, 'human': {}, 'mixed': {}}, 'result_message': 'Our detector is highly confident that the text is written entirely by a human.', 'document_classification': 'HUMAN_ONLY', 'version': '2025-01-09-base', 'language': 'en', 'pageNumber': 0, 'inputText': ""× The SoCal Sound Sessions with Colin Meloy of The Decemberists Read more about 'Colin Meloy of The Decemberists Session with Hillary Gordon'... Girl Ultra SoCal Sound Session from Arroz and Fun! Read more about 'Girl Ultra Session with Byron Gonzalez'... Winnetka Bowling League SoCal Sound Session with Mookie! Read more about 'Winnetka Bowling League Session with Mookie'... The SoCal Sound Session with Cuffed Up Read more about 'Cuffed Up Session with Tristan Dolce'... WIN TICKETS Members Only: Zach Bryan at Crypto.com Arena on Monday, June 3 SIGN UP FOR FREE TICKETS HERE Members Only: Zach Bryan at Crypto.com Arena on Tuesday, June 4 SIGN UP FOR FREE TICKETS HERE Members Only: Caifanes + Cafe Tacvba at Hollywood Bowl on Wednesday, June 5, 2024 SIGN UP FOR FREE TICKETS HERE Members Only: Tedeschi Trucks Band w/Little Feat at Greek Theatre on Friday, June 7 SIGN UP FOR FREE TICKETS HERE Members Only: Tedeschi Trucks Band w/Little Feat at Greek Theatre on Sunday, June 9 SIGN UP FOR FREE TICKETS HERE The Marias at Hollywood Forever Cemetery on Friday, August 23 SIGN UP FOR FREE TICKETS HERE Members Only: Johnny Marr & James at The Orpheum Theatre on Thursday, September 26 SIGN UP FOR FREE TICKETS HERE Amandititita & Ramona at The Regent on Friday, June 7 SIGN UP FOR FREE TICKETS HERE VIEW ALL EVENTS THANK YOU SUPPORTERS The SoCal Sound counts on each and every contribution to provide you with the best radio content in SoCal DONATE VOLUNTEER FEEDBACK""}]"
