File,version,documents
CA_2022_7940142ee5a58dbd4fdb054f9c44365f.html.gz,2025-01-09-base,"[{'sentences': [{'generated_prob': 0.006213590502738953, 'sentence': ""Lainey Wilson will be honored as 'Breakout Artist of the Year' at the upcoming 2022 CMT Artists Of The Year, premiering Oct. 14 at 8 p.m. CT on CMT."", 'perplexity': 0, 'highlight_sentence_for_ai': False}, {'generated_prob': 0.011523008346557617, 'sentence': ""Wilson shared the exciting news on social media, posting: “Holy moly…I'm so honored to be named this years' CMT Breakout Artist of the Year!"", 'perplexity': 0, 'highlight_sentence_for_ai': False}, {'generated_prob': 0.010358423925936222, 'sentence': ""I am so appreciative of my @cmt fam and all of their support over the years… it makes this moment feel that much sweeter and I can't wait to celebrate on Oct. 14!"", 'perplexity': 0, 'highlight_sentence_for_ai': False}, {'generated_prob': 0.01640441082417965, 'sentence': ""Y'all tune in at 9/8c on CMT."", 'perplexity': 0, 'highlight_sentence_for_ai': False}, {'generated_prob': 0.017604554072022438, 'sentence': '#CMTAOTY” Wilson No.', 'perplexity': 0, 'highlight_sentence_for_ai': False}, {'generated_prob': 0.015072519890964031, 'sentence': '1 hits include “Things A Man Oughta Know” and “Never Say Never” with Cole Swindell.', 'perplexity': 0, 'highlight_sentence_for_ai': False}, {'generated_prob': 0.006586788222193718, 'sentence': 'She will also be dropping her new album, Bell Bottom Country, on Oct. 28.', 'perplexity': 0, 'highlight_sentence_for_ai': False}, {'generated_prob': 0.012878743931651115, 'sentence': 'Wilson added: “This past year has been a wild ride.', 'perplexity': 0, 'highlight_sentence_for_ai': False}, {'generated_prob': 0.009715750813484192, 'sentence': 'To be considered for this award reinforces that the years of hard work my team and I have put in was all worth it.', 'perplexity': 0, 'highlight_sentence_for_ai': False}, {'generated_prob': 0.15085947513580322, 'sentence': ""The team at CMT feels like family, and the way they genuinely support artists on their platform is so special and important for dreamers like me.” The 2022 CMT Artists Of The Year will be broadcast from Nashville's Schermerhorn Symphony Center, with Carly Pearce, Cody Johnson, Kane Brown, Luke Combs and Walker Hayes set to perform, and Alan Jackson will named 'Artist of a Lifetime.'"", 'perplexity': 0, 'highlight_sentence_for_ai': False}, {'generated_prob': 0.3042016327381134, 'sentence': 'Additional honorees, performers and presenters will be announced soon.', 'perplexity': 0, 'highlight_sentence_for_ai': False}, {'generated_prob': 0.10147454589605331, 'sentence': 'Editorial credit: Vicki L. Miller / Shutterstock.com Your email address will not be published.', 'perplexity': 0, 'highlight_sentence_for_ai': False}, {'generated_prob': 0.09044341742992401, 'sentence': 'Comment You may use these HTML tags and attributes: <a href="""" title=""""> <abbr title=""""> <acronym title=""""> <b> <blockquote cite=""""> <cite> <code> <del datetime=""""> <em> <i> <q cite=""""> <s> <strike> <strong> Name * Email * Website Save my name, email, and website in this browser for the next time I comment.', 'perplexity': 0, 'highlight_sentence_for_ai': False}, {'generated_prob': 0.19576437771320343, 'sentence': 'Δ', 'perplexity': 0, 'highlight_sentence_for_ai': False}], 'paragraphs': [{'start_sentence_index': 0, 'num_sentences': 14, 'completely_generated_prob': 1.9423489116273474e-12}], 'completely_generated_prob': 0.05924693143200553, 'class_probabilities': {'human': 0.9404634541111649, 'ai': 0.05924693143200553, 'mixed': 0.0002896144568295141}, 'average_generated_prob': 0, 'predicted_class': 'human', 'confidence_score': 0.9404634541111649, 'confidence_category': 'high', 'confidence_scores_raw': {'identity': {'ai': 0.05924693143200553, 'human': 0.9404634541111649, 'mixed': 0.0002896144568295141}}, 'confidence_thresholds_raw': {'identity': {'ai': {'reject': 0.65, 'low': 0.75, 'medium': 0.92}, 'human': {'reject': 0.7, 'low': 0.82, 'medium': 0.92}, 'mixed': {'reject': 0.7, 'low': 0.8, 'medium': 0.88}}}, 'overall_burstiness': 0, 'writing_stats': {}, 'subclass': {'ai': {}, 'human': {}, 'mixed': {}}, 'result_message': 'Our detector is highly confident that the text is written entirely by a human.', 'document_classification': 'HUMAN_ONLY', 'version': '2025-01-09-base', 'language': 'en', 'pageNumber': 0, 'inputText': 'Lainey Wilson will be honored as ‘Breakout Artist of the Year’ at the upcoming 2022 CMT Artists Of The Year, premiering Oct. 14 at 8 p.m. CT on CMT. Wilson shared the exciting news on social media, posting: “Holy moly…I’m so honored to be named this years’ CMT Breakout Artist of the Year! I am so appreciative of my @cmt fam and all of their support over the years… it makes this moment feel that much sweeter and I can’t wait to celebrate on Oct. 14! Y’all tune in at 9/8c on CMT. #CMTAOTY” Wilson No. 1 hits include “Things A Man Oughta Know” and “Never Say Never” with Cole Swindell. She will also be dropping her new album, Bell Bottom Country, on Oct. 28. Wilson added: “This past year has been a wild ride. To be considered for this award reinforces that the years of hard work my team and I have put in was all worth it. The team at CMT feels like family, and the way they genuinely support artists on their platform is so special and important for dreamers like me.” The 2022 CMT Artists Of The Year will be broadcast from Nashville’s Schermerhorn Symphony Center, with Carly Pearce, Cody Johnson, Kane Brown, Luke Combs and Walker Hayes set to perform, and Alan Jackson will named ‘Artist of a Lifetime.’ Additional honorees, performers and presenters will be announced soon. Editorial credit: Vicki L. Miller / Shutterstock.com Your email address will not be published. Comment You may use these HTML tags and attributes: <a href="""" title=""""> <abbr title=""""> <acronym title=""""> <b> <blockquote cite=""""> <cite> <code> <del datetime=""""> <em> <i> <q cite=""""> <s> <strike> <strong> Name * Email * Website Save my name, email, and website in this browser for the next time I comment. Δ'}]"
CA_2022_86cac2a4425a48dc454ddc9e321f2b91.html.gz,2025-01-09-base,"[{'sentences': [{'generated_prob': 0.01950738951563835, 'sentence': ""David Benoit10am - 12pm Listen Now 12am - 7am Jazz After Midnight 7am - 10am Chuck Southcott | Swing Time 10am - 12pm David Benoit | Jazz and the 88's 12pm - 2pm Nick Tyler | Jazz 2pm - 6pm Gary Wagner | Nothin' but the Blues 6pm - 10pm Jose Rizo | Jazz on the Latin Side 10pm - 12am Jerry Sharell | Weekends with Sinatra and Sharell 10:49 AM Kenny Barron Dpw 10:44 AM Joe Sample Carmel 10:36 AM Ramsey Lewis Slippin' Into Darkness New Member Sweepstakes No Winner Accepted May 23, 2024 Spring 2024 Grand Prize Sweepstakes - Trip to Italy Robert Catalanotti May 14, 2024 Web Week Sweepstakes Laura Crankshaw May 9, 2024 2023 Days of Giving Sweepstakes David Freeman December 11, 2023 Fall 2023 Grand Prize Sweepstakes - Trip to Argentina and Chile Evelyn Kwong October 23, 2023 Web Week Sweepstakes Denise Rene October 19, 2023 New Member Sweepstakes Kellee Akins October 19, 2023 Spring 2023 Grand Prize Sweepstakes - Trip to Spain Carolyn Anderson May 12, 2023 Web Week Sweepstakes Leslie O'Rourke May 4, 2023 New Member Sweepstakes Scott Baker May 4, 2023 2022 Days of Giving Sweepstakes Steve Cooper December 16, 2022 Fall 2022 Grand Prize Sweepstakes - Signed, Framed Photograph (Prize #1) No Winner Accepted November 4, 2022 Fall 2022 Grand Prize Sweepstakes - Bose Headphones and CD Package (Prize #3) No Winner Accepted November 4, 2022 Fall 2022 Grand Prize Sweepstakes - $1,000 American Express Gift Card (Prize #2) Jean Acosta November 4, 2022 New Member Sweepstakes Adel Yaraghi November 1, 2022 Web Week Sweepstakes Leslie Shatz October 31, 2022 Nothin' But The Blues Sweepstakes #2 Alison Cotter June 2, 2022 Spring 2021 Grand Prize Sweepstakes - Trip To Ireland Michael Burnley May 26, 2022 Nothin' But The Blues Sweepstakes #1 Ken Fujimoto May 23, 2022 New Member Sweepstakes Carolyn Seely May 23, 2022 Web Week Sweepstakes James Larson May 16, 2022 Days of Giving Sweepstakes - 12/11/21 Ron Groezinger December 27, 2021 Days of Giving Sweepstakes - 12/10/21 Nancy Wagstaff-Maley December 27, 2021 Fall 2021 Grand Prize Sweepstakes - The Jazz Cruise James Weiss October 29, 2021 Web Week Sweepstakes Jennifer Drennan October 21, 2021 New Member Sweepstakes Patti Chikahisa October 12, 2021 New Member Sweepstakes Keith Quinn May 6, 2021 Web Week Sweepstakes Sean Verner May 6, 2021 Spring 2021 Grand Prize Sweepstakes - Sarah Vaughan Photograph Alexander Echevarria May 6, 2021 Spring 2021 Grand Prize Sweepstakes - $1,000 AMEX Card Desiree Allard May 6, 2021 Days of Giving Sweepstakes - 12/12/20 Jordan Kleinman December 28, 2020 Days of Giving Sweepstakes - 12/11/20 Brenden Mukanos December 23, 2020 Fall 2020 Grand Prize Sweepstakes - $1,000 AMEX Card Frank Fasullo October 16, 2020 New Member Sweepstakes John Folger October 16, 2020 Fall 2020 Grand Prize Sweepstakes - Miles Davis Photograph Warren Simandle October 16, 2020 Web Week Sweepstakes Marc Melocchi October 14, 2020 New Member Sweepstakes Keith Martin May 1, 2020 Spring 2020 Grand Prize Sweepstakes Michael Ward May 1, 2020 Web Week Sweepstakes Walston Gallie April 13, 2020 End of Year Sweepstakes Barbara Rodriguez January 7, 2020 Fall 2019 Grand Prize Sweepstakes Mitchell Papkin November 16, 2019 New Member Sweepstakes Laurine Tuleja November 14, 2019 Web Week Sweepstakes Gerry Cox November 4, 2019 Web Week Sweepstakes Paul Jablon April 15, 2019 Spring 2019 Grand Prize Sweepstakes Joseph Kwan April 15, 2019 End of Year Sweepstakes Jessica Bird January 3, 2019 Days of Giving Sweepstakes Eugene Smith December 28, 2018 Web Week Sweepstakes Judi Sinclair October 23, 2018 Fall 2018 Grand Prize Sweepstakes George Erber October 23, 2018 New Member Sweepstakes Dan Payne October 23, 2018 Features Donate for Limited Boxes and T 5/28/2024 2:19 PM KJazz Trip to Italy 5/6/2024 6:57 AM Summer Event Series - The Queen Mary 5/8/2024 1:35 PM The Grape 5/5/2024 5:30 PM KJazz HD2The Bebop Channel 4/19/2024 7:33 PM KJazz Archived Programs and Interviews 4/19/2024 7:33 PM Contact Us EMAIL info881@kkjz.org TELEPHONE 310.478.5540 GENERAL INFO contact us Latest Facebook Newsletter Sign Up Copyright © 2024 · KJazz 88.1® · KKJZ® Global Jazz, Inc. and KKJZ Fundraising, Inc. listen · donate · privacy policy · contest rules · contact Station Management/Diversity/Local Content and Services KKJZ Public File · Financial Statements Copyright Notice FCC Applications There are no currently pending applications requiring online public notice."", 'perplexity': 0, 'highlight_sentence_for_ai': False}, {'generated_prob': 0.001402924070134759, 'sentence': 'Date Last updated 7/9/21 local KJazz is a broadcast service of CSULB', 'perplexity': 0, 'highlight_sentence_for_ai': False}], 'paragraphs': [{'start_sentence_index': 0, 'num_sentences': 2, 'completely_generated_prob': 0.02318840472169716}], 'completely_generated_prob': 0.039828139852797, 'class_probabilities': {'human': 0.9598887277771326, 'ai': 0.039828139852797, 'mixed': 0.0002831323700704621}, 'average_generated_prob': 0, 'predicted_class': 'human', 'confidence_score': 0.9598887277771326, 'confidence_category': 'high', 'confidence_scores_raw': {'identity': {'ai': 0.039828139852797, 'human': 0.9598887277771326, 'mixed': 0.0002831323700704621}}, 'confidence_thresholds_raw': {'identity': {'ai': {'reject': 0.65, 'low': 0.75, 'medium': 0.92}, 'human': {'reject': 0.7, 'low': 0.82, 'medium': 0.92}, 'mixed': {'reject': 0.7, 'low': 0.8, 'medium': 0.88}}}, 'overall_burstiness': 0, 'writing_stats': {}, 'subclass': {'ai': {}, 'human': {}, 'mixed': {}}, 'result_message': 'Our detector is highly confident that the text is written entirely by a human.', 'document_classification': 'HUMAN_ONLY', 'version': '2025-01-09-base', 'language': 'en', 'pageNumber': 0, 'inputText': ""David Benoit10am - 12pm Listen Now 12am - 7am Jazz After Midnight 7am - 10am Chuck Southcott | Swing Time 10am - 12pm David Benoit | Jazz and the 88's 12pm - 2pm Nick Tyler | Jazz 2pm - 6pm Gary Wagner | Nothin' but the Blues 6pm - 10pm Jose Rizo | Jazz on the Latin Side 10pm - 12am Jerry Sharell | Weekends with Sinatra and Sharell 10:49 AM Kenny Barron Dpw 10:44 AM Joe Sample Carmel 10:36 AM Ramsey Lewis Slippin' Into Darkness New Member Sweepstakes No Winner Accepted May 23, 2024 Spring 2024 Grand Prize Sweepstakes - Trip to Italy Robert Catalanotti May 14, 2024 Web Week Sweepstakes Laura Crankshaw May 9, 2024 2023 Days of Giving Sweepstakes David Freeman December 11, 2023 Fall 2023 Grand Prize Sweepstakes - Trip to Argentina and Chile Evelyn Kwong October 23, 2023 Web Week Sweepstakes Denise Rene October 19, 2023 New Member Sweepstakes Kellee Akins October 19, 2023 Spring 2023 Grand Prize Sweepstakes - Trip to Spain Carolyn Anderson May 12, 2023 Web Week Sweepstakes Leslie O'Rourke May 4, 2023 New Member Sweepstakes Scott Baker May 4, 2023 2022 Days of Giving Sweepstakes Steve Cooper December 16, 2022 Fall 2022 Grand Prize Sweepstakes - Signed, Framed Photograph (Prize #1) No Winner Accepted November 4, 2022 Fall 2022 Grand Prize Sweepstakes - Bose Headphones and CD Package (Prize #3) No Winner Accepted November 4, 2022 Fall 2022 Grand Prize Sweepstakes - $1,000 American Express Gift Card (Prize #2) Jean Acosta November 4, 2022 New Member Sweepstakes Adel Yaraghi November 1, 2022 Web Week Sweepstakes Leslie Shatz October 31, 2022 Nothin' But The Blues Sweepstakes #2 Alison Cotter June 2, 2022 Spring 2021 Grand Prize Sweepstakes - Trip To Ireland Michael Burnley May 26, 2022 Nothin' But The Blues Sweepstakes #1 Ken Fujimoto May 23, 2022 New Member Sweepstakes Carolyn Seely May 23, 2022 Web Week Sweepstakes James Larson May 16, 2022 Days of Giving Sweepstakes - 12/11/21 Ron Groezinger December 27, 2021 Days of Giving Sweepstakes - 12/10/21 Nancy Wagstaff-Maley December 27, 2021 Fall 2021 Grand Prize Sweepstakes - The Jazz Cruise James Weiss October 29, 2021 Web Week Sweepstakes Jennifer Drennan October 21, 2021 New Member Sweepstakes Patti Chikahisa October 12, 2021 New Member Sweepstakes Keith Quinn May 6, 2021 Web Week Sweepstakes Sean Verner May 6, 2021 Spring 2021 Grand Prize Sweepstakes - Sarah Vaughan Photograph Alexander Echevarria May 6, 2021 Spring 2021 Grand Prize Sweepstakes - $1,000 AMEX Card Desiree Allard May 6, 2021 Days of Giving Sweepstakes - 12/12/20 Jordan Kleinman December 28, 2020 Days of Giving Sweepstakes - 12/11/20 Brenden Mukanos December 23, 2020 Fall 2020 Grand Prize Sweepstakes - $1,000 AMEX Card Frank Fasullo October 16, 2020 New Member Sweepstakes John Folger October 16, 2020 Fall 2020 Grand Prize Sweepstakes - Miles Davis Photograph Warren Simandle October 16, 2020 Web Week Sweepstakes Marc Melocchi October 14, 2020 New Member Sweepstakes Keith Martin May 1, 2020 Spring 2020 Grand Prize Sweepstakes Michael Ward May 1, 2020 Web Week Sweepstakes Walston Gallie April 13, 2020 End of Year Sweepstakes Barbara Rodriguez January 7, 2020 Fall 2019 Grand Prize Sweepstakes Mitchell Papkin November 16, 2019 New Member Sweepstakes Laurine Tuleja November 14, 2019 Web Week Sweepstakes Gerry Cox November 4, 2019 Web Week Sweepstakes Paul Jablon April 15, 2019 Spring 2019 Grand Prize Sweepstakes Joseph Kwan April 15, 2019 End of Year Sweepstakes Jessica Bird January 3, 2019 Days of Giving Sweepstakes Eugene Smith December 28, 2018 Web Week Sweepstakes Judi Sinclair October 23, 2018 Fall 2018 Grand Prize Sweepstakes George Erber October 23, 2018 New Member Sweepstakes Dan Payne October 23, 2018 Features Donate for Limited Boxes and T 5/28/2024 2:19 PM KJazz Trip to Italy 5/6/2024 6:57 AM Summer Event Series - The Queen Mary 5/8/2024 1:35 PM The Grape 5/5/2024 5:30 PM KJazz HD2The Bebop Channel 4/19/2024 7:33 PM KJazz Archived Programs and Interviews 4/19/2024 7:33 PM Contact Us EMAIL info881@kkjz.org TELEPHONE 310.478.5540 GENERAL INFO contact us Latest Facebook Newsletter Sign Up Copyright © 2024 · KJazz 88.1® · KKJZ® Global Jazz, Inc. and KKJZ Fundraising, Inc. listen · donate · privacy policy · contest rules · contact Station Management/Diversity/Local Content and Services KKJZ Public File · Financial Statements Copyright Notice FCC Applications There are no currently pending applications requiring online public notice. Date Last updated 7/9/21 local KJazz is a broadcast service of CSULB""}]"
CA_2022_9f336d30b803513da84996d8d007aa45.html.gz,2025-01-09-base,"[{'sentences': [{'generated_prob': 0.0012275754706934094, 'sentence': ""Holly Hofmann's jazz series continues this month at Tio Leo's Restaurant and Lounge at 5302 Napa St. at Morena Blvd."", 'perplexity': 0, 'highlight_sentence_for_ai': False}, {'generated_prob': 0.002642475301399827, 'sentence': ""Jazz at Tio Leo's is happening every Sunday evening from 5-7pm and features Southern California's finest jazz musicians in a quiet, spacious setting with full bar and Mexican cuisine."", 'perplexity': 0, 'highlight_sentence_for_ai': False}, {'generated_prob': 0.00354320602491498, 'sentence': 'There is also plenty of free parking.', 'perplexity': 0, 'highlight_sentence_for_ai': False}, {'generated_prob': 0.003673836588859558, 'sentence': ""See this month's schedule below: Read full article…LikeLeave a comment Donate your used vehicle to Jazz 88.3 because it's the best result from a kind act AND it is truly one of the most reliable revenue sources we have."", 'perplexity': 0, 'highlight_sentence_for_ai': False}, {'generated_prob': 0.0024573265109211206, 'sentence': 'Call 1-888- JAZZ-CAR (1-888-529-9227).', 'perplexity': 0, 'highlight_sentence_for_ai': False}, {'generated_prob': 0.002806751523166895, 'sentence': ""Read full article…LikeLeave a comment Another way to join KSDS San Diego's Jazz 88.3 is with the listening stream."", 'perplexity': 0, 'highlight_sentence_for_ai': False}, {'generated_prob': 0.0032442444935441017, 'sentence': ""There's the KSDS APP."", 'perplexity': 0, 'highlight_sentence_for_ai': False}, {'generated_prob': 0.002222866751253605, 'sentence': ""Please search 'KSDS Jazz' in your respective Google or Apple store."", 'perplexity': 0, 'highlight_sentence_for_ai': False}, {'generated_prob': 0.0025230322498828173, 'sentence': 'Read full article…LikeLeave a comment The San Diego Community College District and City College is committed to supporting The San Diego Promise, an initiative that allows local students to attend City College for FREE.', 'perplexity': 0, 'highlight_sentence_for_ai': False}, {'generated_prob': 0.003103685798123479, 'sentence': 'Read full article…LikeLeave a comment KSDS-FM has apps for iOS and Android-based devices.', 'perplexity': 0, 'highlight_sentence_for_ai': False}, {'generated_prob': 0.0023713489063084126, 'sentence': 'Download from: KSDS-FM is part of the San Diego City College District and donations are tax-deductible.', 'perplexity': 0, 'highlight_sentence_for_ai': False}, {'generated_prob': 0.0030040587298572063, 'sentence': 'Playlist Archive is a service of NetChain Communications.', 'perplexity': 0, 'highlight_sentence_for_ai': False}, {'generated_prob': 0.002352734562009573, 'sentence': 'KSDS-FM website developed by NetChain Communications and hosted by NetChain Web Framework.', 'perplexity': 0, 'highlight_sentence_for_ai': False}], 'paragraphs': [{'start_sentence_index': 0, 'num_sentences': 13, 'completely_generated_prob': 1.4476848035102901e-11}], 'completely_generated_prob': 0.01565789170260218, 'class_probabilities': {'human': 0.9843421082973979, 'ai': 0.01565789170260218, 'mixed': 0}, 'average_generated_prob': 0, 'predicted_class': 'human', 'confidence_score': 0.9843421082973979, 'confidence_category': 'high', 'confidence_scores_raw': {'identity': {'ai': 0.01565789170260218, 'human': 0.9843421082973979, 'mixed': 0}}, 'confidence_thresholds_raw': {'identity': {'ai': {'reject': 0.65, 'low': 0.75, 'medium': 0.92}, 'human': {'reject': 0.7, 'low': 0.82, 'medium': 0.92}, 'mixed': {'reject': 0.7, 'low': 0.8, 'medium': 0.88}}}, 'overall_burstiness': 0, 'writing_stats': {}, 'subclass': {'ai': {}, 'human': {}, 'mixed': {}}, 'result_message': 'Our detector is highly confident that the text is written entirely by a human.', 'document_classification': 'HUMAN_ONLY', 'version': '2025-01-09-base', 'language': 'en', 'pageNumber': 0, 'inputText': ""Holly Hofmann's jazz series continues this month at Tio Leo's Restaurant and Lounge at 5302 Napa St. at Morena Blvd. Jazz at Tio Leo's is happening every Sunday evening from 5-7pm and features Southern California's finest jazz musicians in a quiet, spacious setting with full bar and Mexican cuisine. There is also plenty of free parking. See this month's schedule below: Read full article…LikeLeave a comment Donate your used vehicle to Jazz 88.3 because it's the best result from a kind act AND it is truly one of the most reliable revenue sources we have. Call 1-888- JAZZ-CAR (1-888-529-9227). Read full article…LikeLeave a comment Another way to join KSDS San Diego's Jazz 88.3 is with the listening stream. There's the KSDS APP. Please search 'KSDS Jazz' in your respective Google or Apple store. Read full article…LikeLeave a comment The San Diego Community College District and City College is committed to supporting The San Diego Promise, an initiative that allows local students to attend City College for FREE. Read full article…LikeLeave a comment KSDS-FM has apps for iOS and Android-based devices. Download from: KSDS-FM is part of the San Diego City College District and donations are tax-deductible. Playlist Archive is a service of NetChain Communications. KSDS-FM website developed by NetChain Communications and hosted by NetChain Web Framework.""}]"
