File,version,documents
FL_2023_0782858619fd5fa933374059de8a9448.html.gz,2025-01-09-base,"[{'sentences': [{'generated_prob': 0.0003805736487265676, 'sentence': 'WFLA Please enter a search term.', 'perplexity': 0, 'highlight_sentence_for_ai': False}, {'generated_prob': 0.00037826786865480244, 'sentence': 'Please enter a search term.', 'perplexity': 0, 'highlight_sentence_for_ai': False}, {'generated_prob': 0.0002906975569203496, 'sentence': ""by: Rebecca Beitsch, The Hill Posted: Dec 12, 2023 / 03:07 PM EST Updated: Dec 12, 2023 / 02:06 PM EST by: Rebecca Beitsch, The Hill Posted: Dec 12, 2023 / 03:07 PM EST Updated: Dec 12, 2023 / 02:06 PM EST (The Hill) - Special counsel Jack Smith plans to call witnesses who have analyzed data extracted from former President Trump's cellphone, including one who can weigh in on his Twitter habits and another who has analyzed the movement of the Jan. 6, 2021, crowd following Trump's speech that day."", 'perplexity': 0, 'highlight_sentence_for_ai': False}, {'generated_prob': 0.00012879379210062325, 'sentence': ""The Monday filing is the first indication of how Smith plans to use a massive tranche of information gathered from Trump's account on Twitter, the social media network now known as X, following a secret court battle to secure access to the account."", 'perplexity': 0, 'highlight_sentence_for_ai': False}, {'generated_prob': 0.00011178514978382736, 'sentence': ""Prosecutors in the election interference case also extracted data from Trump's White House cell phone, and that of an aide, described in the filing only as “Individual 1.” The expert, who is unnamed in the court filing, reviewed how Trump and the aide used their phone throughout the post-election period, and has “specifically identified the periods of time during which the defendant's phone was unlocked and the Twitter application was open on Jan. 6.” It's unclear the extent of the information prosecutors have from Trump's phone, though the filing says the expert analyzed “images found on the phones and websites visited.” But it's possible the expert could provide greater insight into Trump's posting of a tweet attacking then-Vice President Mike Pence."", 'perplexity': 0, 'highlight_sentence_for_ai': False}, {'generated_prob': 0.00013665045844390988, 'sentence': ""Another expert prosecutors plan to bring in for testimony will analyze how a crowd of Trump's supporters moved in response to his call to march toward the Capitol."", 'perplexity': 0, 'highlight_sentence_for_ai': False}, {'generated_prob': 0.006112001836299896, 'sentence': ""The expert “plotted the location history data for Google accounts and devices associated with individuals who moved, on January 6, 2021, from an area at or near the Ellipse to an area encompassing the United States Capitol building.” Their review “will aid the jury in understanding the movements of individuals toward the Capitol area during and after the defendant's speech at the Ellipse.” Trump is set to face trial March 4 on four counts related to his efforts to subvert the transfer of power."", 'perplexity': 0, 'highlight_sentence_for_ai': False}, {'generated_prob': 0.024624943733215332, 'sentence': 'Copyright 2024 Nexstar Media Inc. All rights reserved.', 'perplexity': 0, 'highlight_sentence_for_ai': False}, {'generated_prob': 0.030374204739928246, 'sentence': 'This material may not be published, broadcast, rewritten, or redistributed.', 'perplexity': 0, 'highlight_sentence_for_ai': False}, {'generated_prob': 0.011465271934866905, 'sentence': ""If you have the type of dad whose best friend has four legs, you're in luck when it comes to shopping for a Father's Day gift."", 'perplexity': 0, 'highlight_sentence_for_ai': False}, {'generated_prob': 0.010069591924548149, 'sentence': 'Here are the top 10 features that can help get you more than you imagined was possible for your home.', 'perplexity': 0, 'highlight_sentence_for_ai': False}, {'generated_prob': 0.009641237556934357, 'sentence': 'Chances are you need both dethatching and aerating to maintain a healthy lawn.', 'perplexity': 0, 'highlight_sentence_for_ai': False}, {'generated_prob': 0.012867821380496025, 'sentence': 'Learn more about what they entail and the best products to do it in this article.', 'perplexity': 0, 'highlight_sentence_for_ai': False}, {'generated_prob': 0.010953890159726143, 'sentence': 'Thanks for signing up!', 'perplexity': 0, 'highlight_sentence_for_ai': False}, {'generated_prob': 0.015575656667351723, 'sentence': 'Watch for us in your inbox.', 'perplexity': 0, 'highlight_sentence_for_ai': False}, {'generated_prob': 0.010945324786007404, 'sentence': 'Subscribe Now', 'perplexity': 0, 'highlight_sentence_for_ai': False}], 'paragraphs': [{'start_sentence_index': 0, 'num_sentences': 16, 'completely_generated_prob': 3.4496480286678e-14}], 'completely_generated_prob': 0.022904691944108657, 'class_probabilities': {'human': 0.9763346885865695, 'ai': 0.022904691944108657, 'mixed': 0.0007606194693219039}, 'average_generated_prob': 0, 'predicted_class': 'human', 'confidence_score': 0.9763346885865695, 'confidence_category': 'high', 'confidence_scores_raw': {'identity': {'ai': 0.022904691944108657, 'human': 0.9763346885865695, 'mixed': 0.0007606194693219039}}, 'confidence_thresholds_raw': {'identity': {'ai': {'reject': 0.65, 'low': 0.75, 'medium': 0.92}, 'human': {'reject': 0.7, 'low': 0.82, 'medium': 0.92}, 'mixed': {'reject': 0.7, 'low': 0.8, 'medium': 0.88}}}, 'overall_burstiness': 0, 'writing_stats': {}, 'subclass': {'ai': {}, 'human': {}, 'mixed': {}}, 'result_message': 'Our detector is highly confident that the text is written entirely by a human.', 'document_classification': 'HUMAN_ONLY', 'version': '2025-01-09-base', 'language': 'en', 'pageNumber': 0, 'inputText': 'WFLA Please enter a search term. Please enter a search term. by: Rebecca Beitsch, The Hill Posted: Dec 12, 2023 / 03:07 PM EST Updated: Dec 12, 2023 / 02:06 PM EST by: Rebecca Beitsch, The Hill Posted: Dec 12, 2023 / 03:07 PM EST Updated: Dec 12, 2023 / 02:06 PM EST (The Hill) – Special counsel Jack Smith plans to call witnesses who have analyzed data extracted from former President Trump’s cellphone, including one who can weigh in on his Twitter habits and another who has analyzed the movement of the Jan. 6, 2021, crowd following Trump’s speech that day. The Monday filing is the first indication of how Smith plans to use a massive tranche of information gathered from Trump’s account on Twitter, the social media network now known as X, following a secret court battle to secure access to the account. Prosecutors in the election interference case also extracted data from Trump’s White House cell phone, and that of an aide, described in the filing only as “Individual 1.” The expert, who is unnamed in the court filing, reviewed how Trump and the aide used their phone throughout the post-election period, and has “specifically identified the periods of time during which the defendant’s phone was unlocked and the Twitter application was open on Jan. 6.” It’s unclear the extent of the information prosecutors have from Trump’s phone, though the filing says the expert analyzed “images found on the phones and websites visited.” But it’s possible the expert could provide greater insight into Trump’s posting of a tweet attacking then-Vice President Mike Pence. Another expert prosecutors plan to bring in for testimony will analyze how a crowd of Trump’s supporters moved in response to his call to march toward the Capitol. The expert “plotted the location history data for Google accounts and devices associated with individuals who moved, on January 6, 2021, from an area at or near the Ellipse to an area encompassing the United States Capitol building.” Their review “will aid the jury in understanding the movements of individuals toward the Capitol area during and after the defendant’s speech at the Ellipse.” Trump is set to face trial March 4 on four counts related to his efforts to subvert the transfer of power. Copyright 2024 Nexstar Media Inc. All rights reserved. This material may not be published, broadcast, rewritten, or redistributed. If you have the type of dad whose best friend has four legs, you’re in luck when it comes to shopping for a Father’s Day gift. Here are the top 10 features that can help get you more than you imagined was possible for your home. Chances are you need both dethatching and aerating to maintain a healthy lawn. Learn more about what they entail and the best products to do it in this article. Thanks for signing up! Watch for us in your inbox. Subscribe Now'}]"
FL_2023_1b2e23db62527896299e950da552d910.html.gz,2025-01-09-base,"[{'sentences': [{'generated_prob': 0.00012765370775014162, 'sentence': 'ALBANY, Ga. (WALB) - A group of lawmakers are pushing the U.S.', 'perplexity': 0, 'highlight_sentence_for_ai': False}, {'generated_prob': 0.00018800295947585255, 'sentence': 'Postal Service for answers over slow delivery and stolen mail.', 'perplexity': 0, 'highlight_sentence_for_ai': False}, {'generated_prob': 0.0002716177550610155, 'sentence': 'Quite a few Georgians are experiencing stolen mail, misdelivered mail, unexplainable mail service delays, and even closures of post offices during standard business hours.', 'perplexity': 0, 'highlight_sentence_for_ai': False}, {'generated_prob': 0.00022622602409683168, 'sentence': ""That's why a bipartisan group of 13 Georgia U.S. House members are demanding answers from the Postmaster General."", 'perplexity': 0, 'highlight_sentence_for_ai': False}, {'generated_prob': 0.0003060572489630431, 'sentence': 'The letter consists of eight questions regarding the service breakdown in Georgia ahead of the holidays.', 'perplexity': 0, 'highlight_sentence_for_ai': False}, {'generated_prob': 0.00023411969596054405, 'sentence': 'One question asked to the Postmaster General includes, “How many complaints from the state of Georgia were received by USPS in fiscal years 2022 and 2023?” Another question asks, “what steps is USPS taking to reduce instances of mail theft?” Georgia Congressman Mike Collins said, “Our constituents are taxpayers and customers of USPS.', 'perplexity': 0, 'highlight_sentence_for_ai': False}, {'generated_prob': 0.0001927376724779606, 'sentence': 'They depend upon the agency to fulfill its mission, and when it does not, to provide top-tier customer service.', 'perplexity': 0, 'highlight_sentence_for_ai': False}, {'generated_prob': 0.0002112039946950972, 'sentence': ""That's why we're concerned by reports from our constituents, including local elected officials, about the failure of USPS to respond to complaints with actions ᅳ and not just words.” Collins requested that the Postmaster reply to his eight questions by January 8th, 2024."", 'perplexity': 0, 'highlight_sentence_for_ai': False}, {'generated_prob': 0.00020670212688855827, 'sentence': 'According to the AJC, the postal service said it received the letter and would reply to his office.', 'perplexity': 0, 'highlight_sentence_for_ai': False}, {'generated_prob': 0.00021252014266792685, 'sentence': 'The letter and questions submitted to the postmaster can be read below.', 'perplexity': 0, 'highlight_sentence_for_ai': False}, {'generated_prob': 0.0001529871515231207, 'sentence': 'Copyright 2023 WALB.', 'perplexity': 0, 'highlight_sentence_for_ai': False}, {'generated_prob': 0.00014160978025756776, 'sentence': 'All rights reserved.', 'perplexity': 0, 'highlight_sentence_for_ai': False}], 'paragraphs': [{'start_sentence_index': 0, 'num_sentences': 12, 'completely_generated_prob': 1.0731758790825431e-10}], 'completely_generated_prob': 0.008958492756682587, 'class_probabilities': {'human': 0.9910415072433174, 'ai': 0.008958492756682587, 'mixed': 0}, 'average_generated_prob': 0, 'predicted_class': 'human', 'confidence_score': 0.9910415072433174, 'confidence_category': 'high', 'confidence_scores_raw': {'identity': {'ai': 0.008958492756682587, 'human': 0.9910415072433174, 'mixed': 0}}, 'confidence_thresholds_raw': {'identity': {'ai': {'reject': 0.65, 'low': 0.75, 'medium': 0.92}, 'human': {'reject': 0.7, 'low': 0.82, 'medium': 0.92}, 'mixed': {'reject': 0.7, 'low': 0.8, 'medium': 0.88}}}, 'overall_burstiness': 0, 'writing_stats': {}, 'subclass': {'ai': {}, 'human': {}, 'mixed': {}}, 'result_message': 'Our detector is highly confident that the text is written entirely by a human.', 'document_classification': 'HUMAN_ONLY', 'version': '2025-01-09-base', 'language': 'en', 'pageNumber': 0, 'inputText': 'ALBANY, Ga. (WALB) - A group of lawmakers are pushing the U.S. Postal Service for answers over slow delivery and stolen mail. Quite a few Georgians are experiencing stolen mail, misdelivered mail, unexplainable mail service delays, and even closures of post offices during standard business hours. That’s why a bipartisan group of 13 Georgia U.S. House members are demanding answers from the Postmaster General. The letter consists of eight questions regarding the service breakdown in Georgia ahead of the holidays. One question asked to the Postmaster General includes, “How many complaints from the state of Georgia were received by USPS in fiscal years 2022 and 2023?” Another question asks, “what steps is USPS taking to reduce instances of mail theft?” Georgia Congressman Mike Collins said, “Our constituents are taxpayers and customers of USPS. They depend upon the agency to fulfill its mission, and when it does not, to provide top-tier customer service. That’s why we’re concerned by reports from our constituents, including local elected officials, about the failure of USPS to respond to complaints with actions — and not just words.” Collins requested that the Postmaster reply to his eight questions by January 8th, 2024. According to the AJC, the postal service said it received the letter and would reply to his office. The letter and questions submitted to the postmaster can be read below. Copyright 2023 WALB. All rights reserved.'}]"
