File,version,documents
FL_2024_0cfebac85507ed9d07676e956c6bc8b1.html.gz,2025-01-09-base,"[{'sentences': [{'generated_prob': 0.011503743007779121, 'sentence': 'Photo: Henrico Police Department A married former Virginia teacher admitted to sneaking into the home of a 14-year-old student to have sex with him.', 'perplexity': 0, 'highlight_sentence_for_ai': False}, {'generated_prob': 0.007000664249062538, 'sentence': 'Megan Pauline Jordan, 25, who had previously worked at Hungary Creek Middle School, pleaded guilty to four counts of carnal knowledge and one count of indecent liberties of a minor, all felonies, in relation to her sexual relationship with a student that took place during a calendar school year.', 'perplexity': 0, 'highlight_sentence_for_ai': False}, {'generated_prob': 0.016881968826055527, 'sentence': ""“During the 2022-23 school year, Ms. Jordan was having sexual relations with her 14-year-old student,” Henrico County Commonwealth's Attorney Shannon Taylor announced Tuesday (February 6) via the Richmond Times-Dispatch."", 'perplexity': 0, 'highlight_sentence_for_ai': False}, {'generated_prob': 0.02317940816283226, 'sentence': ""“On several occasions, Ms. Jordan would go to the victim's house and have sexual intercourse with the student."", 'perplexity': 0, 'highlight_sentence_for_ai': False}, {'generated_prob': 0.007842211052775383, 'sentence': 'Her DNA was recovered from his bed linens,” Taylor added.', 'perplexity': 0, 'highlight_sentence_for_ai': False}, {'generated_prob': 0.02808864787220955, 'sentence': 'Jordan was arrested in June 2023 and initially faced five counts of carnal knowledge of a minor and two counts of indecent liberties with a minor in relation to the incident.', 'perplexity': 0, 'highlight_sentence_for_ai': False}, {'generated_prob': 0.027837486937642097, 'sentence': 'The former teacher is currently being held without bond and faces up to 50 years in prison with her sentencing scheduled for May 20, Taylor confirmed.', 'perplexity': 0, 'highlight_sentence_for_ai': False}, {'generated_prob': 0.02122729830443859, 'sentence': 'A person claiming to have been one of Jordan\'s students said he ""knew there was something was wrong with her and the student\'s relationship"" in a post shared on social media, according to the New York Post.', 'perplexity': 0, 'highlight_sentence_for_ai': False}, {'generated_prob': 0.02276465855538845, 'sentence': '""The student wouldn\'t do any of the work and she wouldn\'t bat an eye,” the user wrote.', 'perplexity': 0, 'highlight_sentence_for_ai': False}, {'generated_prob': 0.02998119220137596, 'sentence': '“I noticed subtle flirting and teasing, the tension between them was insane.', 'perplexity': 0, 'highlight_sentence_for_ai': False}, {'generated_prob': 0.03019445762038231, 'sentence': 'She deserves a life sentence for grooming this poor kid,” he added.', 'perplexity': 0, 'highlight_sentence_for_ai': False}], 'paragraphs': [{'start_sentence_index': 0, 'num_sentences': 11, 'completely_generated_prob': 7.905466206762634e-10}], 'completely_generated_prob': 0.0375246461941804, 'class_probabilities': {'human': 0.9624347023880775, 'ai': 0.0375246461941804, 'mixed': 4.065141774218333e-05}, 'average_generated_prob': 0, 'predicted_class': 'human', 'confidence_score': 0.9624347023880775, 'confidence_category': 'high', 'confidence_scores_raw': {'identity': {'ai': 0.0375246461941804, 'human': 0.9624347023880775, 'mixed': 4.065141774218333e-05}}, 'confidence_thresholds_raw': {'identity': {'ai': {'reject': 0.65, 'low': 0.75, 'medium': 0.92}, 'human': {'reject': 0.7, 'low': 0.82, 'medium': 0.92}, 'mixed': {'reject': 0.7, 'low': 0.8, 'medium': 0.88}}}, 'overall_burstiness': 0, 'writing_stats': {}, 'subclass': {'ai': {}, 'human': {}, 'mixed': {}}, 'result_message': 'Our detector is highly confident that the text is written entirely by a human.', 'document_classification': 'HUMAN_ONLY', 'version': '2025-01-09-base', 'language': 'en', 'pageNumber': 0, 'inputText': 'Photo: Henrico Police Department A married former Virginia teacher admitted to sneaking into the home of a 14-year-old student to have sex with him. Megan Pauline Jordan, 25, who had previously worked at Hungary Creek Middle School, pleaded guilty to four counts of carnal knowledge and one count of indecent liberties of a minor, all felonies, in relation to her sexual relationship with a student that took place during a calendar school year. “During the 2022-23 school year, Ms. Jordan was having sexual relations with her 14-year-old student,” Henrico County Commonwealth’s Attorney Shannon Taylor announced Tuesday (February 6) via the Richmond Times-Dispatch. “On several occasions, Ms. Jordan would go to the victim’s house and have sexual intercourse with the student. Her DNA was recovered from his bed linens,” Taylor added. Jordan was arrested in June 2023 and initially faced five counts of carnal knowledge of a minor and two counts of indecent liberties with a minor in relation to the incident. The former teacher is currently being held without bond and faces up to 50 years in prison with her sentencing scheduled for May 20, Taylor confirmed. A person claiming to have been one of Jordan\'s students said he ""knew there was something was wrong with her and the student\'s relationship"" in a post shared on social media, according to the New York Post. ""The student wouldn’t do any of the work and she wouldn’t bat an eye,” the user wrote. “I noticed subtle flirting and teasing, the tension between them was insane. She deserves a life sentence for grooming this poor kid,” he added.'}]"
FL_2024_3047e972afc43428ba24f8b92ffdded4.html.gz,2025-01-09-base,"[{'sentences': [{'generated_prob': 7.362146425293759e-05, 'sentence': ""Share Timothy Breedlove is accused of leading Volusia Sheriff's Office deputies on a chase with two kids in the backseat."", 'perplexity': 0, 'highlight_sentence_for_ai': False}, {'generated_prob': 3.942905823350884e-05, 'sentence': 'The 25-year-old was charged with fleeing or attempting to elude law enforcement, two counts of aggravated child abuse, three counts of false imprisonment and driving with a suspended license.', 'perplexity': 0, 'highlight_sentence_for_ai': False}, {'generated_prob': 2.0883673641947098e-05, 'sentence': ""(Video: Volusia Sheriff's Office) VOLUSIA COUNTY, Fla. - A 25-year-old man was arrested after he allegedly led deputies on a 38-mile, multi-county chase with two young children in the car on Sunday afternoon."", 'perplexity': 0, 'highlight_sentence_for_ai': False}, {'generated_prob': 1.6021202100091614e-05, 'sentence': 'Timothy Breedlove of Altamonte Springs was charged with fleeing or attempting to elude law enforcement, two counts of aggravated child abuse, three counts of false imprisonment and driving with a suspended license after the incident that began to unfold in the area of State Road 415 in Deltona and continued into Sanford.', 'perplexity': 0, 'highlight_sentence_for_ai': False}, {'generated_prob': 1.1666340469673742e-05, 'sentence': 'Breedlove was also issued citations for fleeing, running a red light, having an expired vehicle registration and driving with a suspended license.', 'perplexity': 0, 'highlight_sentence_for_ai': False}, {'generated_prob': 1.5067857020767406e-05, 'sentence': ""Photo: Volusia Sheriff's Office Deputies first tried to pull Breelove over when they noticed his registration as expired, according to the Volusia Sheriff's Office."", 'perplexity': 0, 'highlight_sentence_for_ai': False}, {'generated_prob': 1.424343827238772e-05, 'sentence': 'Breedlove then allegedly sped up and started to weave through traffic as he headed north on SR-415 to SR-44 and Interstate-4.', 'perplexity': 0, 'highlight_sentence_for_ai': False}, {'generated_prob': 1.7881655367091298e-05, 'sentence': ""Thirty-eight miles later, deputies deployed stop sticks which eventually caused both of the tires of the passenger side of Breedlove's white BMW to come off the rims."", 'perplexity': 0, 'highlight_sentence_for_ai': False}, {'generated_prob': 1.9218890884076245e-05, 'sentence': 'Breedlove pulled over in Sanford, and deputies took him into custody.', 'perplexity': 0, 'highlight_sentence_for_ai': False}, {'generated_prob': 1.9196979337721132e-05, 'sentence': ""MORE CRIME: Bystanders fight Florida man accused of whipping dog with chain outside Deltona gas station Photo: Volusia Sheriff's Office During the arrest and after deputies ordered Breedlove to get on the ground, they realized there were two young children in the backseat."", 'perplexity': 0, 'highlight_sentence_for_ai': False}, {'generated_prob': 2.2516669559990987e-05, 'sentence': '""Oh, you got a kid in the car too?""', 'perplexity': 0, 'highlight_sentence_for_ai': False}, {'generated_prob': 1.8184045984526165e-05, 'sentence': 'one deputy is heard asking Breedlove on the bodycam video.', 'perplexity': 0, 'highlight_sentence_for_ai': False}, {'generated_prob': 1.8794478819472715e-05, 'sentence': 'ALSO IN FLORIDA: Man charged in death of Florida Highway Patrol trooper, semi-truck driver, officials say Photo: Volusia Sheriff\'s Office The children were ""visibly upset"" and can be heard on the bodycam footage crying, but they appeared to be unharmed, deputies said.', 'perplexity': 0, 'highlight_sentence_for_ai': False}, {'generated_prob': 8.408218855038285e-05, 'sentence': 'Deputies asked Breedlove why he didn\'t stop his car during the chase, and he said he ""has been having a hard time lately"" and just wanted to celebrate a birthday at the beach, according to an arrest affidavit.', 'perplexity': 0, 'highlight_sentence_for_ai': False}, {'generated_prob': 7.390862447209656e-05, 'sentence': 'Photo: Volusia Sheriff\'s Office CRIME: Drunk driver slams into ambulance, hits loaded school bus during attempted escape, Florida deputies say ""Timothy advised once he sped up he realized he had already committed a violation and decided he would continue to drive until trying to make it to his mother\'s house in Sanford,"" the affidavit continued.', 'perplexity': 0, 'highlight_sentence_for_ai': False}, {'generated_prob': 4.9523019697517157e-05, 'sentence': 'During the chase, the kids\' mother reportedly told Breedlove to stop and ""think about the children\'s safety,"" which is why he told deputies he was driving to Sanford.', 'perplexity': 0, 'highlight_sentence_for_ai': False}, {'generated_prob': 5.101072747493163e-05, 'sentence': 'Juvenile Services in Volusia County was notified of the incident, and Breedlove was booked into the Seminole County Jail where he remains in custody as of Monday afternoon.', 'perplexity': 0, 'highlight_sentence_for_ai': False}, {'generated_prob': 5.5208940466400236e-05, 'sentence': 'This material may not be published, broadcast, rewritten, or redistributed.', 'perplexity': 0, 'highlight_sentence_for_ai': False}, {'generated_prob': 5.698926543118432e-05, 'sentence': '©2024 FOX Television Stations', 'perplexity': 0, 'highlight_sentence_for_ai': False}], 'paragraphs': [{'start_sentence_index': 0, 'num_sentences': 19, 'completely_generated_prob': 7.952272508076387e-17}], 'completely_generated_prob': 0.0032155735640056345, 'class_probabilities': {'human': 0.9967844264359944, 'ai': 0.0032155735640056345, 'mixed': 0}, 'average_generated_prob': 0, 'predicted_class': 'human', 'confidence_score': 0.9967844264359944, 'confidence_category': 'high', 'confidence_scores_raw': {'identity': {'ai': 0.0032155735640056345, 'human': 0.9967844264359944, 'mixed': 0}}, 'confidence_thresholds_raw': {'identity': {'ai': {'reject': 0.65, 'low': 0.75, 'medium': 0.92}, 'human': {'reject': 0.7, 'low': 0.82, 'medium': 0.92}, 'mixed': {'reject': 0.7, 'low': 0.8, 'medium': 0.88}}}, 'overall_burstiness': 0, 'writing_stats': {}, 'subclass': {'ai': {}, 'human': {}, 'mixed': {}}, 'result_message': 'Our detector is highly confident that the text is written entirely by a human.', 'document_classification': 'HUMAN_ONLY', 'version': '2025-01-09-base', 'language': 'en', 'pageNumber': 0, 'inputText': 'Share Timothy Breedlove is accused of leading Volusia Sheriff\'s Office deputies on a chase with two kids in the backseat. The 25-year-old was charged with fleeing or attempting to elude law enforcement, two counts of aggravated child abuse, three counts of false imprisonment and driving with a suspended license. (Video: Volusia Sheriff\'s Office) VOLUSIA COUNTY, Fla. - A 25-year-old man was arrested after he allegedly led deputies on a 38-mile, multi-county chase with two young children in the car on Sunday afternoon. Timothy Breedlove of Altamonte Springs was charged with fleeing or attempting to elude law enforcement, two counts of aggravated child abuse, three counts of false imprisonment and driving with a suspended license after the incident that began to unfold in the area of State Road 415 in Deltona and continued into Sanford. Breedlove was also issued citations for fleeing, running a red light, having an expired vehicle registration and driving with a suspended license. Photo: Volusia Sheriff\'s Office Deputies first tried to pull Breelove over when they noticed his registration as expired, according to the Volusia Sheriff\'s Office. Breedlove then allegedly sped up and started to weave through traffic as he headed north on SR-415 to SR-44 and Interstate-4. Thirty-eight miles later, deputies deployed stop sticks which eventually caused both of the tires of the passenger side of Breedlove\'s white BMW to come off the rims. Breedlove pulled over in Sanford, and deputies took him into custody. MORE CRIME: Bystanders fight Florida man accused of whipping dog with chain outside Deltona gas station Photo: Volusia Sheriff\'s Office During the arrest and after deputies ordered Breedlove to get on the ground, they realized there were two young children in the backseat. ""Oh, you got a kid in the car too?"" one deputy is heard asking Breedlove on the bodycam video. ALSO IN FLORIDA: Man charged in death of Florida Highway Patrol trooper, semi-truck driver, officials say Photo: Volusia Sheriff\'s Office The children were ""visibly upset"" and can be heard on the bodycam footage crying, but they appeared to be unharmed, deputies said. Deputies asked Breedlove why he didn\'t stop his car during the chase, and he said he ""has been having a hard time lately"" and just wanted to celebrate a birthday at the beach, according to an arrest affidavit. Photo: Volusia Sheriff\'s Office CRIME: Drunk driver slams into ambulance, hits loaded school bus during attempted escape, Florida deputies say ""Timothy advised once he sped up he realized he had already committed a violation and decided he would continue to drive until trying to make it to his mother\'s house in Sanford,"" the affidavit continued. During the chase, the kids\' mother reportedly told Breedlove to stop and ""think about the children\'s safety,"" which is why he told deputies he was driving to Sanford. Juvenile Services in Volusia County was notified of the incident, and Breedlove was booked into the Seminole County Jail where he remains in custody as of Monday afternoon. This material may not be published, broadcast, rewritten, or redistributed. ©2024 FOX Television Stations'}]"
