File,version,documents
NH_2021_1b9cbcb4bcd5b786f739441e71e37f95.html.gz,2025-01-09-base,"[{'sentences': [{'generated_prob': 0.0007517014746554196, 'sentence': ""Former executive editor Reilly Olinger '22 shares the top five lessons she learned in her time at the College The Dartmouth will postpone production of the May 26 Mirror issue to May 27."", 'perplexity': 0, 'highlight_sentence_for_ai': False}, {'generated_prob': 0.0003232473973184824, 'sentence': 'Students grappling with uncertain foreign study plans amid the pandemic may soon be bracing for another blow.', 'perplexity': 0, 'highlight_sentence_for_ai': False}, {'generated_prob': 0.00017278952873311937, 'sentence': 'The College will slash funding for off-campus programs and scrap a significant number of its study abroad trips ᅳ a decision that has already sparked uproar throughout the Dartmouth community.', 'perplexity': 0, 'highlight_sentence_for_ai': False}, {'generated_prob': 0.00017578323604539037, 'sentence': 'Despite staffing and pandemic-related challenges, the Campus Climate and Culture Initiative ᅳ which the College launched in early 2019 to assess the educational and work environments of its departments and revise sexual misconduct policies ᅳ is proceeding with its current initiatives.', 'perplexity': 0, 'highlight_sentence_for_ai': False}, {'generated_prob': 0.00017513743659947067, 'sentence': 'Although undergraduate advisors have always had a role in enforcing community guidelines and school policy, pandemic regulations have added new duties, and with them new concerns.', 'perplexity': 0, 'highlight_sentence_for_ai': False}, {'generated_prob': 0.00021371807088144124, 'sentence': 'Students seeking academic assistance this fall will have to adapt to changes in Tutor Clearinghouse offerings.', 'perplexity': 0, 'highlight_sentence_for_ai': False}, {'generated_prob': 0.00026546319713816047, 'sentence': 'One-on-one tutoring has been dramatically reduced, and residential experts, study groups and conversation partners have all been eliminated due to budgetary constraints.', 'perplexity': 0, 'highlight_sentence_for_ai': False}, {'generated_prob': 0.0002253470302093774, 'sentence': 'Changing policies and administrative deadlines have left members of the Class of 2024 frustrated, but many who were interested in taking gap years have since finalized their plans.', 'perplexity': 0, 'highlight_sentence_for_ai': False}, {'generated_prob': 0.0002843770489562303, 'sentence': 'The weather vane depicting an image of a Native American, which formerly sat atop Baker-Berry Library, was removed last Friday in response to student and community concerns about its alleged offensive nature.', 'perplexity': 0, 'highlight_sentence_for_ai': False}, {'generated_prob': 0.00023939242237247527, 'sentence': ""Dartmouth's first Commencement ceremony, held in 1771, bore very little resemblance to the modern graduation ceremony ᅳ and even less to the virtual ceremony that will be held for the Class of 2020 this June."", 'perplexity': 0, 'highlight_sentence_for_ai': False}, {'generated_prob': 0.00025386401102878153, 'sentence': 'With admissions testing and non-essential travel on hold, current high school juniors have been left stressed over college admissions requirements and facing the prospect of getting to know Dartmouth and other colleges remotely.', 'perplexity': 0, 'highlight_sentence_for_ai': False}], 'paragraphs': [{'start_sentence_index': 0, 'num_sentences': 11, 'completely_generated_prob': 7.905466206762634e-10}], 'completely_generated_prob': 0.00982192507144982, 'class_probabilities': {'human': 0.9901780749285501, 'ai': 0.00982192507144982, 'mixed': 0}, 'average_generated_prob': 0, 'predicted_class': 'human', 'confidence_score': 0.9901780749285501, 'confidence_category': 'high', 'confidence_scores_raw': {'identity': {'ai': 0.00982192507144982, 'human': 0.9901780749285501, 'mixed': 0}}, 'confidence_thresholds_raw': {'identity': {'ai': {'reject': 0.65, 'low': 0.75, 'medium': 0.92}, 'human': {'reject': 0.7, 'low': 0.82, 'medium': 0.92}, 'mixed': {'reject': 0.7, 'low': 0.8, 'medium': 0.88}}}, 'overall_burstiness': 0, 'writing_stats': {}, 'subclass': {'ai': {}, 'human': {}, 'mixed': {}}, 'result_message': 'Our detector is highly confident that the text is written entirely by a human.', 'document_classification': 'HUMAN_ONLY', 'version': '2025-01-09-base', 'language': 'en', 'pageNumber': 0, 'inputText': 'Former executive editor Reilly Olinger ’22 shares the top five lessons she learned in her time at the College The Dartmouth will postpone production of the May 26 Mirror issue to May 27. Students grappling with uncertain foreign study plans amid the pandemic may soon be bracing for another blow. The College will slash funding for off-campus programs and scrap a significant number of its study abroad trips — a decision that has already sparked uproar throughout the Dartmouth community. Despite staffing and pandemic-related challenges, the Campus Climate and Culture Initiative — which the College launched in early 2019 to assess the educational and work environments of its departments and revise sexual misconduct policies — is proceeding with its current initiatives. Although undergraduate advisors have always had a role in enforcing community guidelines and school policy, pandemic regulations have added new duties, and with them new concerns. Students seeking academic assistance this fall will have to adapt to changes in Tutor Clearinghouse offerings. One-on-one tutoring has been dramatically reduced, and residential experts, study groups and conversation partners have all been eliminated due to budgetary constraints. Changing policies and administrative deadlines have left members of the Class of 2024 frustrated, but many who were interested in taking gap years have since finalized their plans. The weather vane depicting an image of a Native American, which formerly sat atop Baker-Berry Library, was removed last Friday in response to student and community concerns about its alleged offensive nature. Dartmouth’s first Commencement ceremony, held in 1771, bore very little resemblance to the modern graduation ceremony — and even less to the virtual ceremony that will be held for the Class of 2020 this June. With admissions testing and non-essential travel on hold, current high school juniors have been left stressed over college admissions requirements and facing the prospect of getting to know Dartmouth and other colleges remotely.'}]"
NH_2021_1ede1d52c26c826941bcf635ef77d8ef.html.gz,2025-01-09-base,"[{'sentences': [{'generated_prob': 0.00023737568699289113, 'sentence': 'Mainly clear.', 'perplexity': 0, 'highlight_sentence_for_ai': False}, {'generated_prob': 0.00022382271708920598, 'sentence': 'Low 51F.', 'perplexity': 0, 'highlight_sentence_for_ai': False}, {'generated_prob': 0.000523494032677263, 'sentence': 'Winds WNW at 10 to 20 mph..', 'perplexity': 0, 'highlight_sentence_for_ai': False}, {'generated_prob': 0.0006291887257248163, 'sentence': 'Mainly clear.', 'perplexity': 0, 'highlight_sentence_for_ai': False}, {'generated_prob': 0.0005401300732046366, 'sentence': 'Low 51F.', 'perplexity': 0, 'highlight_sentence_for_ai': False}, {'generated_prob': 0.0004895395832136273, 'sentence': 'Winds WNW at 10 to 20 mph.', 'perplexity': 0, 'highlight_sentence_for_ai': False}, {'generated_prob': 0.0010387126822024584, 'sentence': 'Updated: June 1, 2024 @ 9:06 pm Matt Harnish of Dover Police Department in the 2020 CHaD Hockey game.', 'perplexity': 0, 'highlight_sentence_for_ai': False}, {'generated_prob': 0.0014980820706114173, 'sentence': ""LEBANON ᅳ Children's Hospital at Dartmouth-Hitchcock (CHaD) is excited to announce the return of the CHaD Battle of the Badges Hockey Championship."", 'perplexity': 0, 'highlight_sentence_for_ai': False}, {'generated_prob': 0.0014699922176077962, 'sentence': 'On Sun., March 13, 2022, first responders from across the state will skate and raise money for CHaD at SNHU Arena in Manchester.', 'perplexity': 0, 'highlight_sentence_for_ai': False}, {'generated_prob': 0.0008228147635236382, 'sentence': 'The game is returning for its fourteenth edition after being cancelled in 2021 due to the COVID-19 pandemic.', 'perplexity': 0, 'highlight_sentence_for_ai': False}, {'generated_prob': 0.0015461257426068187, 'sentence': 'Once the teams are selected and announced in early October, the players will undertake a mission to personally raise at least $1,500 to support programs that CHaD families rely on every day.', 'perplexity': 0, 'highlight_sentence_for_ai': False}, {'generated_prob': 0.0015008733607828617, 'sentence': 'They begin practicing as a team on a monthly basis in November, continuing through early March.', 'perplexity': 0, 'highlight_sentence_for_ai': False}, {'generated_prob': 0.0011626315535977483, 'sentence': 'There will be at least one scrimmage between the teams in early 2022.', 'perplexity': 0, 'highlight_sentence_for_ai': False}, {'generated_prob': 0.0012342991540208459, 'sentence': 'The players will also be paired with a CHaD ambassador, called a CHaD Buddy, to connect them to the game and its mission.', 'perplexity': 0, 'highlight_sentence_for_ai': False}, {'generated_prob': 0.0019417651928961277, 'sentence': 'These children and their families are current or former CHaD patients who have benefited from the programs supported by the game and other CHaD fundraising endeavors.', 'perplexity': 0, 'highlight_sentence_for_ai': False}, {'generated_prob': 0.00876882579177618, 'sentence': 'Several Buddies will be paired with players they have been connected to for years, with the game representing just a small part of the bonds between the players and the Buddy families.', 'perplexity': 0, 'highlight_sentence_for_ai': False}, {'generated_prob': 0.018415292724967003, 'sentence': 'At the last game in March 2020, Fire came away with a 9-4 victory to earn its second straight win.', 'perplexity': 0, 'highlight_sentence_for_ai': False}, {'generated_prob': 0.012028362601995468, 'sentence': 'The event raised over $200,000 despite being closed to fans in the early days of the pandemic.', 'perplexity': 0, 'highlight_sentence_for_ai': False}, {'generated_prob': 0.016682010143995285, 'sentence': 'In 14 years, over $2.6 million has been generated by the event through the commitment of generous sponsors, donors, attendees and players.', 'perplexity': 0, 'highlight_sentence_for_ai': False}, {'generated_prob': 0.029132474213838577, 'sentence': 'Official game time and ticket options will be announced soon.', 'perplexity': 0, 'highlight_sentence_for_ai': False}, {'generated_prob': 0.03260720521211624, 'sentence': 'For additional information, visit www.CHaDHockey.org.', 'perplexity': 0, 'highlight_sentence_for_ai': False}, {'generated_prob': 0.05752814561128616, 'sentence': 'Sorry, there are no recent results for popular articles.', 'perplexity': 0, 'highlight_sentence_for_ai': False}, {'generated_prob': 0.1071670800447464, 'sentence': 'Sorry, there are no recent results for popular images.', 'perplexity': 0, 'highlight_sentence_for_ai': False}, {'generated_prob': 0.10640689730644226, 'sentence': 'Sorry, there are no recent results for popular videos.', 'perplexity': 0, 'highlight_sentence_for_ai': False}, {'generated_prob': 0.10341230779886246, 'sentence': 'Sorry, there are no recent results for popular commented articles.', 'perplexity': 0, 'highlight_sentence_for_ai': False}, {'generated_prob': 0.44273775815963745, 'sentence': 'First Amendment: Congress shall make no law respecting an establishment of religion, or prohibiting the free exercise thereof; or abridging the freedom of speech, or of the press; or the right of the people peaceably to assemble, and to petition the Government for a redress of grievances.', 'perplexity': 0, 'highlight_sentence_for_ai': False}, {'generated_prob': 0.3490751385688782, 'sentence': 'Your browser is out of date and potentially vulnerable to security risks.We recommend switching to one of the following browsers:', 'perplexity': 0, 'highlight_sentence_for_ai': False}], 'paragraphs': [{'start_sentence_index': 0, 'num_sentences': 27, 'completely_generated_prob': 6.669367083709894e-24}], 'completely_generated_prob': 0.022745863024791507, 'class_probabilities': {'human': 0.9769575598928755, 'ai': 0.022745863024791507, 'mixed': 0.0002965770823330031}, 'average_generated_prob': 0, 'predicted_class': 'human', 'confidence_score': 0.9769575598928755, 'confidence_category': 'high', 'confidence_scores_raw': {'identity': {'ai': 0.022745863024791507, 'human': 0.9769575598928755, 'mixed': 0.0002965770823330031}}, 'confidence_thresholds_raw': {'identity': {'ai': {'reject': 0.65, 'low': 0.75, 'medium': 0.92}, 'human': {'reject': 0.7, 'low': 0.82, 'medium': 0.92}, 'mixed': {'reject': 0.7, 'low': 0.8, 'medium': 0.88}}}, 'overall_burstiness': 0, 'writing_stats': {}, 'subclass': {'ai': {}, 'human': {}, 'mixed': {}}, 'result_message': 'Our detector is highly confident that the text is written entirely by a human.', 'document_classification': 'HUMAN_ONLY', 'version': '2025-01-09-base', 'language': 'en', 'pageNumber': 0, 'inputText': 'Mainly clear. Low 51F. Winds WNW at 10 to 20 mph.. Mainly clear. Low 51F. Winds WNW at 10 to 20 mph. Updated: June 1, 2024 @ 9:06 pm Matt Harnish of Dover Police Department in the 2020 CHaD Hockey game. LEBANON — Children’s Hospital at Dartmouth-Hitchcock (CHaD) is excited to announce the return of the CHaD Battle of the Badges Hockey Championship. On Sun., March 13, 2022, first responders from across the state will skate and raise money for CHaD at SNHU Arena in Manchester. The game is returning for its fourteenth edition after being cancelled in 2021 due to the COVID-19 pandemic. Once the teams are selected and announced in early October, the players will undertake a mission to personally raise at least $1,500 to support programs that CHaD families rely on every day. They begin practicing as a team on a monthly basis in November, continuing through early March. There will be at least one scrimmage between the teams in early 2022. The players will also be paired with a CHaD ambassador, called a CHaD Buddy, to connect them to the game and its mission. These children and their families are current or former CHaD patients who have benefited from the programs supported by the game and other CHaD fundraising endeavors. Several Buddies will be paired with players they have been connected to for years, with the game representing just a small part of the bonds between the players and the Buddy families. At the last game in March 2020, Fire came away with a 9-4 victory to earn its second straight win. The event raised over $200,000 despite being closed to fans in the early days of the pandemic. In 14 years, over $2.6 million has been generated by the event through the commitment of generous sponsors, donors, attendees and players. Official game time and ticket options will be announced soon. For additional information, visit www.CHaDHockey.org. Sorry, there are no recent results for popular articles. Sorry, there are no recent results for popular images. Sorry, there are no recent results for popular videos. Sorry, there are no recent results for popular commented articles. First Amendment: Congress shall make no law respecting an establishment of religion, or prohibiting the free exercise thereof; or abridging the freedom of speech, or of the press; or the right of the people peaceably to assemble, and to petition the Government for a redress of grievances. Your browser is out of date and potentially vulnerable to security risks.We recommend switching to one of the following browsers:'}]"
