File,version,documents
MT_2024_7c5d03552f6e3619095c504dbb3e3af7.html.gz,2025-01-09-base,"[{'sentences': [{'generated_prob': 0.0005371375591494143, 'sentence': ""It was anybody's guess what the weather would look like for the athletes and their teams participating in the MHSA State A-B Track Meet in Laurel on May 23-25."", 'perplexity': 0, 'highlight_sentence_for_ai': False}, {'generated_prob': 0.0005944911390542984, 'sentence': 'In fact, the open field practice time on Thursday was cancelled and the Class A boys pole vault was postponed until the Friday morni… The Reed Point High School art class began painting the underpasses in their town with the desire to turn the graffiti into a Montana-inspired… The end of the year always comes fast at Nye School, and teacher Linda Wombolt said the last week is always one of the busiest.', 'perplexity': 0, 'highlight_sentence_for_ai': False}, {'generated_prob': 0.0006250555161386728, 'sentence': 'There was a co… Many Stillwater County residents paid their respects to veterans of the area, commemorating those who gave their lives to secure the freedoms … Each year, Columbus FFA hosts a pie auction awards night.', 'perplexity': 0, 'highlight_sentence_for_ai': False}, {'generated_prob': 0.0007251606439240277, 'sentence': 'This is our last and main fundraiser for the year.', 'perplexity': 0, 'highlight_sentence_for_ai': False}, {'generated_prob': 0.0006986423977650702, 'sentence': 'Each FFA member brings a homemade… Get our free email newsletters ᅳ latest headlines and e-edition notifications.', 'perplexity': 0, 'highlight_sentence_for_ai': False}, {'generated_prob': 0.0006337114609777927, 'sentence': 'Leah Connor, a 2012 Absarokee High School graduate, recently was awarded her PhD in Chemistry from Yale University.', 'perplexity': 0, 'highlight_sentence_for_ai': False}, {'generated_prob': 0.0006956466240808368, 'sentence': 'Congratulations Dr. Connor!', 'perplexity': 0, 'highlight_sentence_for_ai': False}, {'generated_prob': 0.0008972802897915244, 'sentence': '2024 Date Max Min Precip The Nye Community Foundation has awarded 10 scholarships in 2024 totaling $21,000.00.', 'perplexity': 0, 'highlight_sentence_for_ai': False}, {'generated_prob': 0.0008781452779658139, 'sentence': 'Scholarships are supported by the Nye Community Foundati… The Stillwater Brewfest is a local benefit for the Museum of the Beartooths.', 'perplexity': 0, 'highlight_sentence_for_ai': False}, {'generated_prob': 0.001081156893633306, 'sentence': ""This year's event on Saturday, June 15 will feature Montana brews… The Columbus Police Department, Stillwater County Sheriff's Office, Montana Highway Patrol and the state livestock inspector responded to 253 … To view our latest e-Edition, click the image on the left."", 'perplexity': 0, 'highlight_sentence_for_ai': False}, {'generated_prob': 0.0011053694179281592, 'sentence': 'The Stillwater County News publishes its obituaries and death notices with Legacy.com, a leading online obituary database that partners with more than 1,500 newspapers.', 'perplexity': 0, 'highlight_sentence_for_ai': False}, {'generated_prob': 0.0011796856997534633, 'sentence': 'Funeral homes often submit obituaries as a service to the families they are assisting.', 'perplexity': 0, 'highlight_sentence_for_ai': False}, {'generated_prob': 0.0008535022498108447, 'sentence': 'However, we will be happy to accept obituaries from family members pending proper verification of the death.', 'perplexity': 0, 'highlight_sentence_for_ai': False}, {'generated_prob': 0.001101426430977881, 'sentence': ""This Lady Cougar golf information was left out as an oversight when I was gathering information in last week's printed edition."", 'perplexity': 0, 'highlight_sentence_for_ai': False}, {'generated_prob': 0.013718953356146812, 'sentence': 'I sincerely ap… Maylee Lowell, a 2023 Columbus graduate, wrapped up her freshman season of softball with the North Dakota State College of Science Wildcats at… In a very competitive state tournament on a demanding course, the Columbus Cougars put toget… Willie Green was set free in 2008 after serving 27 years in prison for a murder he did not c… This Lady Cougar golf information was left out as an oversight when I was gathering informat… Maylee Lowell, a 2023 Columbus graduate, wrapped up her freshman season of softball with the… Your browser is out of date and potentially vulnerable to security risks.We recommend switching to one of the following browsers: Get up-to-the-minute news sent straight to your device.', 'perplexity': 0, 'highlight_sentence_for_ai': False}], 'paragraphs': [{'start_sentence_index': 0, 'num_sentences': 15, 'completely_generated_prob': 2.5938383721896624e-13}], 'completely_generated_prob': 0.024461651786716186, 'class_probabilities': {'human': 0.9754981327244504, 'ai': 0.024461651786716186, 'mixed': 4.0215488833363626e-05}, 'average_generated_prob': 0, 'predicted_class': 'human', 'confidence_score': 0.9754981327244504, 'confidence_category': 'high', 'confidence_scores_raw': {'identity': {'ai': 0.024461651786716186, 'human': 0.9754981327244504, 'mixed': 4.0215488833363626e-05}}, 'confidence_thresholds_raw': {'identity': {'ai': {'reject': 0.65, 'low': 0.75, 'medium': 0.92}, 'human': {'reject': 0.7, 'low': 0.82, 'medium': 0.92}, 'mixed': {'reject': 0.7, 'low': 0.8, 'medium': 0.88}}}, 'overall_burstiness': 0, 'writing_stats': {}, 'subclass': {'ai': {}, 'human': {}, 'mixed': {}}, 'result_message': 'Our detector is highly confident that the text is written entirely by a human.', 'document_classification': 'HUMAN_ONLY', 'version': '2025-01-09-base', 'language': 'en', 'pageNumber': 0, 'inputText': 'It was anybody’s guess what the weather would look like for the athletes and their teams participating in the MHSA State A-B Track Meet in Laurel on May 23-25. In fact, the open field practice time on Thursday was cancelled and the Class A boys pole vault was postponed until the Friday morni… The Reed Point High School art class began painting the underpasses in their town with the desire to turn the graffiti into a Montana-inspired… The end of the year always comes fast at Nye School, and teacher Linda Wombolt said the last week is always one of the busiest. There was a co… Many Stillwater County residents paid their respects to veterans of the area, commemorating those who gave their lives to secure the freedoms … Each year, Columbus FFA hosts a pie auction awards night. This is our last and main fundraiser for the year. Each FFA member brings a homemade… Get our free email newsletters — latest headlines and e-edition notifications. Leah Connor, a 2012 Absarokee High School graduate, recently was awarded her PhD in Chemistry from Yale University. Congratulations Dr. Connor! 2024 Date Max Min Precip The Nye Community Foundation has awarded 10 scholarships in 2024 totaling $21,000.00. Scholarships are supported by the Nye Community Foundati… The Stillwater Brewfest is a local benefit for the Museum of the Beartooths. This year’s event on Saturday, June 15 will feature Montana brews… The Columbus Police Department, Stillwater County Sheriff’s Office, Montana Highway Patrol and the state livestock inspector responded to 253 … To view our latest e-Edition, click the image on the left. The Stillwater County News publishes its obituaries and death notices with Legacy.com, a leading online obituary database that partners with more than 1,500 newspapers. Funeral homes often submit obituaries as a service to the families they are assisting. However, we will be happy to accept obituaries from family members pending proper verification of the death. This Lady Cougar golf information was left out as an oversight when I was gathering information in last week’s printed edition. I sincerely ap… Maylee Lowell, a 2023 Columbus graduate, wrapped up her freshman season of softball with the North Dakota State College of Science Wildcats at… In a very competitive state tournament on a demanding course, the Columbus Cougars put toget… Willie Green was set free in 2008 after serving 27 years in prison for a murder he did not c… This Lady Cougar golf information was left out as an oversight when I was gathering informat… Maylee Lowell, a 2023 Columbus graduate, wrapped up her freshman season of softball with the… Your browser is out of date and potentially vulnerable to security risks.We recommend switching to one of the following browsers: Get up-to-the-minute news sent straight to your device.'}]"
MT_2024_82f511a01a0f23ce9df372d9eb898182.html.gz,2025-01-09-base,"[{'sentences': [{'generated_prob': 0.017012236639857292, 'sentence': 'STEVE DAINES As a fifth-generation Montanan, I have fond memories with my Grandpa Daines of learning how to fish and hunt north of Big Timber, and my goal is to pass these traditions on to my own children and grandchildren.', 'perplexity': 0, 'highlight_sentence_for_ai': False}, {'generated_prob': 0.023466521874070168, 'sentence': 'There is no better way to experience Montana than backpacking, hunting, hiking or fishing.', 'perplexity': 0, 'highlight_sentence_for_ai': False}, {'generated_prob': 0.027843520045280457, 'sentence': 'I share this passion with many Montanans, which is why improving access to our public lands is such a high priority.', 'perplexity': 0, 'highlight_sentence_for_ai': False}, {'generated_prob': 0.01510249450802803, 'sentence': ""That's why I introduced my “Montana Sportsmen Conservation Act.” Montanans should determine what is best for our public lands, not bureaucrats in Washington, D.C. My bill carries out what Montanans have asked forᅳit improves wildlife habitat and public access to public land and mitigates the risk of wildfires."", 'perplexity': 0, 'highlight_sentence_for_ai': False}, {'generated_prob': 0.0016670774202793837, 'sentence': 'Javascript is required for you to be able to read premium content.', 'perplexity': 0, 'highlight_sentence_for_ai': False}, {'generated_prob': 0.0024365426506847143, 'sentence': 'Please enable it in your browser settings.', 'perplexity': 0, 'highlight_sentence_for_ai': False}, {'generated_prob': 0.005663839168846607, 'sentence': 'To view our latest e-Edition, click the image on the left.', 'perplexity': 0, 'highlight_sentence_for_ai': False}, {'generated_prob': 0.005631676875054836, 'sentence': 'Your browser is out of date and potentially vulnerable to security risks.We recommend switching to one of the following browsers: Get up-to-the-minute news sent straight to your device.', 'perplexity': 0, 'highlight_sentence_for_ai': False}, {'generated_prob': 0.0074121784418821335, 'sentence': 'Account processing issue - the email address may already exist Sign up with Thank you.', 'perplexity': 0, 'highlight_sentence_for_ai': False}, {'generated_prob': 0.006229869090020657, 'sentence': 'Your account has been registered, and you are now logged in.', 'perplexity': 0, 'highlight_sentence_for_ai': False}, {'generated_prob': 0.007673761807382107, 'sentence': 'Check your email for details.', 'perplexity': 0, 'highlight_sentence_for_ai': False}, {'generated_prob': 0.006037011742591858, 'sentence': 'Invalid password or account does not exist Sign in with Submitting this form below will send a message to your email with a link to change your password.', 'perplexity': 0, 'highlight_sentence_for_ai': False}, {'generated_prob': 0.00506760086864233, 'sentence': 'An email message containing instructions on how to reset your password has been sent to the email address listed on your account.', 'perplexity': 0, 'highlight_sentence_for_ai': False}, {'generated_prob': 0.01466661412268877, 'sentence': 'No promotional rates found.', 'perplexity': 0, 'highlight_sentence_for_ai': False}, {'generated_prob': 0.009619038552045822, 'sentence': 'Secure & Encrypted Secure transaction.', 'perplexity': 0, 'highlight_sentence_for_ai': False}, {'generated_prob': 0.005507808644324541, 'sentence': 'Secure transaction.', 'perplexity': 0, 'highlight_sentence_for_ai': False}, {'generated_prob': 0.005942994728684425, 'sentence': 'Cancel anytime.', 'perplexity': 0, 'highlight_sentence_for_ai': False}, {'generated_prob': 0.005641845520585775, 'sentence': 'Thank you.', 'perplexity': 0, 'highlight_sentence_for_ai': False}, {'generated_prob': 0.007782090455293655, 'sentence': 'Your gift purchase was successful!', 'perplexity': 0, 'highlight_sentence_for_ai': False}, {'generated_prob': 0.010790111497044563, 'sentence': 'Your purchase was successful, and you are now logged in.', 'perplexity': 0, 'highlight_sentence_for_ai': False}, {'generated_prob': 0.01003281120210886, 'sentence': 'A receipt was sent to your email.', 'perplexity': 0, 'highlight_sentence_for_ai': False}], 'paragraphs': [{'start_sentence_index': 0, 'num_sentences': 21, 'completely_generated_prob': 1.369041255298935e-18}], 'completely_generated_prob': 0.024461651786716183, 'class_probabilities': {'human': 0.9754981327244504, 'ai': 0.024461651786716183, 'mixed': 4.0215488833363626e-05}, 'average_generated_prob': 0, 'predicted_class': 'human', 'confidence_score': 0.9754981327244504, 'confidence_category': 'high', 'confidence_scores_raw': {'identity': {'ai': 0.024461651786716183, 'human': 0.9754981327244504, 'mixed': 4.0215488833363626e-05}}, 'confidence_thresholds_raw': {'identity': {'ai': {'reject': 0.65, 'low': 0.75, 'medium': 0.92}, 'human': {'reject': 0.7, 'low': 0.82, 'medium': 0.92}, 'mixed': {'reject': 0.7, 'low': 0.8, 'medium': 0.88}}}, 'overall_burstiness': 0, 'writing_stats': {}, 'subclass': {'ai': {}, 'human': {}, 'mixed': {}}, 'result_message': 'Our detector is highly confident that the text is written entirely by a human.', 'document_classification': 'HUMAN_ONLY', 'version': '2025-01-09-base', 'language': 'en', 'pageNumber': 0, 'inputText': 'STEVE DAINES As a fifth-generation Montanan, I have fond memories with my Grandpa Daines of learning how to fish and hunt north of Big Timber, and my goal is to pass these traditions on to my own children and grandchildren. There is no better way to experience Montana than backpacking, hunting, hiking or fishing. I share this passion with many Montanans, which is why improving access to our public lands is such a high priority. That’s why I introduced my “Montana Sportsmen Conservation Act.” Montanans should determine what is best for our public lands, not bureaucrats in Washington, D.C. My bill carries out what Montanans have asked for—it improves wildlife habitat and public access to public land and mitigates the risk of wildfires. Javascript is required for you to be able to read premium content. Please enable it in your browser settings. To view our latest e-Edition, click the image on the left. Your browser is out of date and potentially vulnerable to security risks.We recommend switching to one of the following browsers: Get up-to-the-minute news sent straight to your device. Account processing issue - the email address may already exist Sign up with Thank you . Your account has been registered, and you are now logged in. Check your email for details. Invalid password or account does not exist Sign in with Submitting this form below will send a message to your email with a link to change your password. An email message containing instructions on how to reset your password has been sent to the email address listed on your account. No promotional rates found. Secure & Encrypted Secure transaction. Secure transaction. Cancel anytime. Thank you. Your gift purchase was successful! Your purchase was successful, and you are now logged in. A receipt was sent to your email.'}]"
MT_2024_8350a7532b1b03963f3c27b33883a75c.html.gz,2025-01-09-base,"[{'sentences': [{'generated_prob': 4.6934783313190565e-05, 'sentence': 'Mark Racicot penned a long letter repetitiously trying to make a case that former President Donald Trump is disqualified from running for president due to the 14th amendment prohibiting “insurrectionists” from running for office.', 'perplexity': 0, 'highlight_sentence_for_ai': False}, {'generated_prob': 4.311838711146265e-05, 'sentence': 'None of the myriad of charges against the former president mention the word insurrection.', 'perplexity': 0, 'highlight_sentence_for_ai': False}, {'generated_prob': 4.227634417475201e-05, 'sentence': ""But I suppose in Mr. Racicot's opinion as a lawyer, being found guilty of or even charged with a crime is immaterial."", 'perplexity': 0, 'highlight_sentence_for_ai': False}, {'generated_prob': 5.298928590491414e-05, 'sentence': 'In fact, the definition of insurrection is a violent uprising against a government or institution.', 'perplexity': 0, 'highlight_sentence_for_ai': False}, {'generated_prob': 5.0731941882986575e-05, 'sentence': 'Though liberals especially the Democrat “insurrectionist-mongers” in Congress use the label incorrectly and ignore the many calls by their own to reverse two previous Republican presidential victories (Gore v. Bush; Clinton v. Trump) Mr. Racicot, who supported Biden in the 2020 presidential election, seems incapable of distinguishing a protest from an insurrection.', 'perplexity': 0, 'highlight_sentence_for_ai': False}, {'generated_prob': 5.294021684676409e-05, 'sentence': 'By the way, how well do you think your 2020 choice is doing?', 'perplexity': 0, 'highlight_sentence_for_ai': False}, {'generated_prob': 6.317905354080722e-05, 'sentence': 'Going to support and vote for him again in 2024?', 'perplexity': 0, 'highlight_sentence_for_ai': False}, {'generated_prob': 6.213485903572291e-05, 'sentence': 'Did Racicot voice such strong anti-insurrection opinions when the violent George Floyd “mostly peaceful” demonstrators stormed, looted and burned a police precinct (I believe that is violence against an institution) harming fleeing officers?', 'perplexity': 0, 'highlight_sentence_for_ai': False}, {'generated_prob': 5.463097841129638e-05, 'sentence': 'Did he call for their arrest and prosecution?', 'perplexity': 0, 'highlight_sentence_for_ai': False}, {'generated_prob': 0.00010215575457550585, 'sentence': 'Crickets!', 'perplexity': 0, 'highlight_sentence_for_ai': False}, {'generated_prob': 6.192085857037455e-05, 'sentence': ""No, Mr. Racicot, you may have parlayed your political career into a cushy lobbying gig in Washington, using your political influence to the disadvantage of the people and in favor of big business, but you don't get to interpret the Constitution... that will be up to the Supreme Court."", 'perplexity': 0, 'highlight_sentence_for_ai': False}, {'generated_prob': 8.566927863284945e-05, 'sentence': 'And I dare say they will likely see the issue of insurrection and the fourteenth amendment quite differently.', 'perplexity': 0, 'highlight_sentence_for_ai': False}, {'generated_prob': 0.00020551233319565654, 'sentence': 'David Myerowitz Columbia Falls twitter facebook LinkedIn Email copyright © 2024 Terms of Use | Privacy Policy PO BOX 189, 926 Nucleus Avenue Columbia Falls, MT 59912 406-892-2151', 'perplexity': 0, 'highlight_sentence_for_ai': False}], 'paragraphs': [{'start_sentence_index': 0, 'num_sentences': 13, 'completely_generated_prob': 1.4476848035102901e-11}], 'completely_generated_prob': 0.0031733866852551138, 'class_probabilities': {'human': 0.996826613314745, 'ai': 0.0031733866852551138, 'mixed': 0}, 'average_generated_prob': 0, 'predicted_class': 'human', 'confidence_score': 0.996826613314745, 'confidence_category': 'high', 'confidence_scores_raw': {'identity': {'ai': 0.0031733866852551138, 'human': 0.996826613314745, 'mixed': 0}}, 'confidence_thresholds_raw': {'identity': {'ai': {'reject': 0.65, 'low': 0.75, 'medium': 0.92}, 'human': {'reject': 0.7, 'low': 0.82, 'medium': 0.92}, 'mixed': {'reject': 0.7, 'low': 0.8, 'medium': 0.88}}}, 'overall_burstiness': 0, 'writing_stats': {}, 'subclass': {'ai': {}, 'human': {}, 'mixed': {}}, 'result_message': 'Our detector is highly confident that the text is written entirely by a human.', 'document_classification': 'HUMAN_ONLY', 'version': '2025-01-09-base', 'language': 'en', 'pageNumber': 0, 'inputText': 'Mark Racicot penned a long letter repetitiously trying to make a case that former President Donald Trump is disqualified from running for president due to the 14th amendment prohibiting “insurrectionists” from running for office. None of the myriad of charges against the former president mention the word insurrection. But I suppose in Mr. Racicot’s opinion as a lawyer, being found guilty of or even charged with a crime is immaterial. In fact, the definition of insurrection is a violent uprising against a government or institution. Though liberals especially the Democrat “insurrectionist-mongers” in Congress use the label incorrectly and ignore the many calls by their own to reverse two previous Republican presidential victories (Gore v. Bush; Clinton v. Trump) Mr. Racicot, who supported Biden in the 2020 presidential election, seems incapable of distinguishing a protest from an insurrection. By the way, how well do you think your 2020 choice is doing? Going to support and vote for him again in 2024? Did Racicot voice such strong anti-insurrection opinions when the violent George Floyd “mostly peaceful” demonstrators stormed, looted and burned a police precinct (I believe that is violence against an institution) harming fleeing officers? Did he call for their arrest and prosecution? Crickets! No, Mr. Racicot, you may have parlayed your political career into a cushy lobbying gig in Washington, using your political influence to the disadvantage of the people and in favor of big business, but you don’t get to interpret the Constitution . . . that will be up to the Supreme Court. And I dare say they will likely see the issue of insurrection and the fourteenth amendment quite differently. David Myerowitz Columbia Falls twitter facebook LinkedIn Email copyright © 2024 Terms of Use | Privacy Policy PO BOX 189, 926 Nucleus Avenue Columbia Falls, MT 59912 406-892-2151'}]"
