File,version,documents
OH_2021_71b4d4442cf655f7baa2134778c0d8e8.html.gz,2025-01-09-base,"[{'sentences': [{'generated_prob': 0.00030008217436261475, 'sentence': 'WKBN.com Please enter a search term.', 'perplexity': 0, 'highlight_sentence_for_ai': False}, {'generated_prob': 0.0002930980990640819, 'sentence': 'Please enter a search term.', 'perplexity': 0, 'highlight_sentence_for_ai': False}, {'generated_prob': 0.0006923741893842816, 'sentence': ""by: Julian Resendiz Posted: Jul 22, 2021 / 05:21 PM EDT Updated: Jul 22, 2021 / 06:11 PM EDT Two drivers arrested after currency located in wall behind commercial vehicle's bathroom by: Julian Resendiz Posted: Jul 22, 2021 / 05:21 PM EDT Updated: Jul 22, 2021 / 06:11 PM EDT EL PASO, Texas (Border Report) - A southbound operation at the Presidio, Texas, port of entry netted federal officials $465,755 in undeclared cash this week."", 'perplexity': 0, 'highlight_sentence_for_ai': False}, {'generated_prob': 0.00047401836491189897, 'sentence': ""The seized currency was in 14 bundles in a wall behind the vehicle's restroom; the two bus drivers were arrested, according to U.S. Customs and Border Protection."", 'perplexity': 0, 'highlight_sentence_for_ai': False}, {'generated_prob': 0.00022788337082602084, 'sentence': 'The seizure took place at noon on Tuesday after CBP and Homeland Security Investigations agents selected a passenger bus headed to Mexico.', 'perplexity': 0, 'highlight_sentence_for_ai': False}, {'generated_prob': 0.0002680180186871439, 'sentence': 'A CBP dog trained to sniff out guns and currency alerted the agents to an anomaly, and the bus was passed through an X-ray system.', 'perplexity': 0, 'highlight_sentence_for_ai': False}, {'generated_prob': 0.0003238616918679327, 'sentence': 'The walled compartment held the 14 currency-filled bundles, CBP said.', 'perplexity': 0, 'highlight_sentence_for_ai': False}, {'generated_prob': 0.00023782267817296088, 'sentence': 'HSI arrested and took custody of the drivers - two Mexican citizens ages 47 and 68 - questioned and released six bus passengers.', 'perplexity': 0, 'highlight_sentence_for_ai': False}, {'generated_prob': 0.0001636385713936761, 'sentence': 'The bus was seized as well.', 'perplexity': 0, 'highlight_sentence_for_ai': False}, {'generated_prob': 0.00013331831723917276, 'sentence': ""“The majority of CBP's work involves the processing of people and items entering the U.S. from abroad however CBP also routinely conducts operations to stop the flow of unreported currency, weapons, ammunition and other items from leaving the U.S.,” CBP El Paso Director of Field Operations Hector Mancha said in a statement."", 'perplexity': 0, 'highlight_sentence_for_ai': False}, {'generated_prob': 0.009108330123126507, 'sentence': 'Although there is no limit to the amount of money that travelers may carry when crossing U.S. borders, federal law [31 U.S.C.', 'perplexity': 0, 'highlight_sentence_for_ai': False}, {'generated_prob': 0.009423158131539822, 'sentence': '5316] requires that travelers report currency or monetary instruments in excess of $10,000 to a CBP officer at the airport, seaport, or land border crossing when entering or leaving the United States.', 'perplexity': 0, 'highlight_sentence_for_ai': False}, {'generated_prob': 0.015691688284277916, 'sentence': ""Penalties may include seizure of most or all of the traveler's currency, and potential criminal charges."", 'perplexity': 0, 'highlight_sentence_for_ai': False}, {'generated_prob': 0.017181627452373505, 'sentence': 'An individual may petition for the return of seized currency, but the petitioner must prove that the source and intended use of the currency is legitimate.', 'perplexity': 0, 'highlight_sentence_for_ai': False}, {'generated_prob': 0.00944125559180975, 'sentence': 'Copyright 2024 Nexstar Media Inc. All rights reserved.', 'perplexity': 0, 'highlight_sentence_for_ai': False}, {'generated_prob': 0.010543753392994404, 'sentence': 'This material may not be published, broadcast, rewritten, or redistributed.', 'perplexity': 0, 'highlight_sentence_for_ai': False}, {'generated_prob': 0.005455806385725737, 'sentence': 'Thanks for signing up!', 'perplexity': 0, 'highlight_sentence_for_ai': False}, {'generated_prob': 0.012887893244624138, 'sentence': 'Watch for us in your inbox.', 'perplexity': 0, 'highlight_sentence_for_ai': False}, {'generated_prob': 0.00535785686224699, 'sentence': 'Subscribe Now About Border Report The mission of BorderReport.com is to provide real-time delivery of the untold local stories about people living, working and migrating along the U.S. border with Mexico.', 'perplexity': 0, 'highlight_sentence_for_ai': False}, {'generated_prob': 0.0051713059656322, 'sentence': 'The information is gathered by experienced and trusted Nexstar Media Group journalists hired specifically to cover the border.', 'perplexity': 0, 'highlight_sentence_for_ai': False}, {'generated_prob': 0.005007379222661257, 'sentence': 'View live cameras at the border.', 'perplexity': 0, 'highlight_sentence_for_ai': False}, {'generated_prob': 0.0034953970462083817, 'sentence': 'The mission of BorderReport.com is to provide real-time delivery of the untold local stories about people living, working and migrating along the U.S. border with Mexico.', 'perplexity': 0, 'highlight_sentence_for_ai': False}, {'generated_prob': 0.004185147117823362, 'sentence': 'The information is gathered by experienced and trusted Nexstar Media Group journalists hired specifically to cover the border.', 'perplexity': 0, 'highlight_sentence_for_ai': False}], 'paragraphs': [{'start_sentence_index': 0, 'num_sentences': 23, 'completely_generated_prob': 2.3367398512545458e-20}], 'completely_generated_prob': 0.01666837706656291, 'class_probabilities': {'human': 0.9832910861754778, 'ai': 0.01666837706656291, 'mixed': 4.0536757959336665e-05}, 'average_generated_prob': 0, 'predicted_class': 'human', 'confidence_score': 0.9832910861754778, 'confidence_category': 'high', 'confidence_scores_raw': {'identity': {'ai': 0.01666837706656291, 'human': 0.9832910861754778, 'mixed': 4.0536757959336665e-05}}, 'confidence_thresholds_raw': {'identity': {'ai': {'reject': 0.65, 'low': 0.75, 'medium': 0.92}, 'human': {'reject': 0.7, 'low': 0.82, 'medium': 0.92}, 'mixed': {'reject': 0.7, 'low': 0.8, 'medium': 0.88}}}, 'overall_burstiness': 0, 'writing_stats': {}, 'subclass': {'ai': {}, 'human': {}, 'mixed': {}}, 'result_message': 'Our detector is highly confident that the text is written entirely by a human.', 'document_classification': 'HUMAN_ONLY', 'version': '2025-01-09-base', 'language': 'en', 'pageNumber': 0, 'inputText': ""WKBN.com Please enter a search term. Please enter a search term. by: Julian Resendiz Posted: Jul 22, 2021 / 05:21 PM EDT Updated: Jul 22, 2021 / 06:11 PM EDT Two drivers arrested after currency located in wall behind commercial vehicle's bathroom by: Julian Resendiz Posted: Jul 22, 2021 / 05:21 PM EDT Updated: Jul 22, 2021 / 06:11 PM EDT EL PASO, Texas (Border Report) – A southbound operation at the Presidio, Texas, port of entry netted federal officials $465,755 in undeclared cash this week. The seized currency was in 14 bundles in a wall behind the vehicle’s restroom; the two bus drivers were arrested, according to U.S. Customs and Border Protection. The seizure took place at noon on Tuesday after CBP and Homeland Security Investigations agents selected a passenger bus headed to Mexico. A CBP dog trained to sniff out guns and currency alerted the agents to an anomaly, and the bus was passed through an X-ray system. The walled compartment held the 14 currency-filled bundles, CBP said. HSI arrested and took custody of the drivers – two Mexican citizens ages 47 and 68 – questioned and released six bus passengers. The bus was seized as well. “The majority of CBP’s work involves the processing of people and items entering the U.S. from abroad however CBP also routinely conducts operations to stop the flow of unreported currency, weapons, ammunition and other items from leaving the U.S.,” CBP El Paso Director of Field Operations Hector Mancha said in a statement. Although there is no limit to the amount of money that travelers may carry when crossing U.S. borders, federal law [31 U.S.C. 5316] requires that travelers report currency or monetary instruments in excess of $10,000 to a CBP officer at the airport, seaport, or land border crossing when entering or leaving the United States. Penalties may include seizure of most or all of the traveler’s currency, and potential criminal charges. An individual may petition for the return of seized currency, but the petitioner must prove that the source and intended use of the currency is legitimate. Copyright 2024 Nexstar Media Inc. All rights reserved. This material may not be published, broadcast, rewritten, or redistributed. Thanks for signing up! Watch for us in your inbox. Subscribe Now About Border Report The mission of BorderReport.com is to provide real-time delivery of the untold local stories about people living, working and migrating along the U.S. border with Mexico. The information is gathered by experienced and trusted Nexstar Media Group journalists hired specifically to cover the border. View live cameras at the border. The mission of BorderReport.com is to provide real-time delivery of the untold local stories about people living, working and migrating along the U.S. border with Mexico. The information is gathered by experienced and trusted Nexstar Media Group journalists hired specifically to cover the border.""}]"
OH_2021_9a40073f49a25c590f5cb381296b7bf8.html.gz,2025-01-09-base,"[{'sentences': [{'generated_prob': 9.06384811969474e-05, 'sentence': ""Next up in 5 Example video title will go here for this video Next up in 5 Example video title will go here for this video TOLEDO, Ohio ᅳ Editor's note: the above video aired on Jan. 7, 2021."", 'perplexity': 0, 'highlight_sentence_for_ai': False}, {'generated_prob': 5.63119538128376e-05, 'sentence': ""The union representing journalists who work at The Blade has filed an unfair labor practice against the paper and its parent company, Block Communications, over what the union says is management's refusal to bargain in a safe manner during a pandemic."", 'perplexity': 0, 'highlight_sentence_for_ai': False}, {'generated_prob': 6.245569966267794e-05, 'sentence': ""The Toledo News Guild released a statement about the lawsuit, saying that throughout the pandemic, the paper's management and an attorney with the firm King & Ballow - which represents The Blade - have insisted that negotiations occur in-person and indoors."", 'perplexity': 0, 'highlight_sentence_for_ai': False}, {'generated_prob': 5.203590990277007e-05, 'sentence': '""This has been part of their campaign to bust our union, impose their will and terms upon us, and beat back dissent over unethical practices at the newspaper and Block interference with the editorial independence of Blade journalists,"" the statement read.', 'perplexity': 0, 'highlight_sentence_for_ai': False}, {'generated_prob': 7.361681491602212e-05, 'sentence': 'A call for comment placed to The Blade has not been returned as of publication time.', 'perplexity': 0, 'highlight_sentence_for_ai': False}, {'generated_prob': 7.523914246121421e-05, 'sentence': 'The lawsuit comes weeks after Blade journalists held a byline strike following what workers called censorship of their reporting on the Jan. 6 U.S. Capitol breach.', 'perplexity': 0, 'highlight_sentence_for_ai': False}, {'generated_prob': 7.002168422332034e-05, 'sentence': ""RELATED: The Blade journalists forego reporter bylines following ethics concerns; Block family member resigns arts commission post after social media backlash The guild's statement goes on to say that proposed alternatives such as meeting outdoors were rejected while an attorney has refused to wear a mask during negotiations."", 'perplexity': 0, 'highlight_sentence_for_ai': False}, {'generated_prob': 8.45802205731161e-05, 'sentence': 'Attempts to bring in a federal mediator were scuttled by Block Communications and its attorney because federal mediators are prohibited from meeting in-person during the pandemic, according to the guild.', 'perplexity': 0, 'highlight_sentence_for_ai': False}, {'generated_prob': 6.799297261750326e-05, 'sentence': '""Insisting on in-person bargaining during a pandemic is reckless and irresponsible.', 'perplexity': 0, 'highlight_sentence_for_ai': False}, {'generated_prob': 7.524394459323958e-05, 'sentence': 'It has also hampered negotiations.', 'perplexity': 0, 'highlight_sentence_for_ai': False}, {'generated_prob': 5.9459463955136016e-05, 'sentence': 'Agreed-to bargaining dates last week were rejected by the company because of their demand that we bargain in-person, even after during one of the largest snow events in Toledo history.', 'perplexity': 0, 'highlight_sentence_for_ai': False}, {'generated_prob': 6.326721631921828e-05, 'sentence': 'A company representative flippantly said they would fly their attorney into town overnight, during a snow emergency, to bargain in person the next day instead of bargaining remotely,"" the statement said.', 'perplexity': 0, 'highlight_sentence_for_ai': False}, {'generated_prob': 7.641581032657996e-05, 'sentence': 'The guild also called out Block Communications for demanding that sales staff, who were successfully working remotely, report to the office during a Level 3 snow emergency.', 'perplexity': 0, 'highlight_sentence_for_ai': False}, {'generated_prob': 6.650131399510428e-05, 'sentence': 'The union argued in the statement that the NewsGuild-CWA is engaged in bargaining at dozens of newspapers and media outlets across the country while negotiating remotely is the practice used nearly everywhere.', 'perplexity': 0, 'highlight_sentence_for_ai': False}, {'generated_prob': 8.446309948340058e-05, 'sentence': ""Additionally, Block Communications - which also owns the Pittsburgh Post-Gazette - is using remote formats to bargain with the outlets' workers unions in Pennsylvania."", 'perplexity': 0, 'highlight_sentence_for_ai': False}, {'generated_prob': 0.00011117866961285472, 'sentence': 'Finally, the guild said that refusal to bargain remotely has impeded members from being able to safely observe contract negotiations.', 'perplexity': 0, 'highlight_sentence_for_ai': False}, {'generated_prob': 0.00013217869854997844, 'sentence': 'RELATED: NAACP Toledo releases statement on US Capitol insurrection, The Blade and controversial social media post made by Block family member RELATED VIDEO: Notifications can be turned off anytime in the browser settings.', 'perplexity': 0, 'highlight_sentence_for_ai': False}], 'paragraphs': [{'start_sentence_index': 0, 'num_sentences': 17, 'completely_generated_prob': 4.571217651318373e-15}], 'completely_generated_prob': 0.006576924694833349, 'class_probabilities': {'human': 0.9934230753051666, 'ai': 0.006576924694833349, 'mixed': 0}, 'average_generated_prob': 0, 'predicted_class': 'human', 'confidence_score': 0.9934230753051666, 'confidence_category': 'high', 'confidence_scores_raw': {'identity': {'ai': 0.006576924694833349, 'human': 0.9934230753051666, 'mixed': 0}}, 'confidence_thresholds_raw': {'identity': {'ai': {'reject': 0.65, 'low': 0.75, 'medium': 0.92}, 'human': {'reject': 0.7, 'low': 0.82, 'medium': 0.92}, 'mixed': {'reject': 0.7, 'low': 0.8, 'medium': 0.88}}}, 'overall_burstiness': 0, 'writing_stats': {}, 'subclass': {'ai': {}, 'human': {}, 'mixed': {}}, 'result_message': 'Our detector is highly confident that the text is written entirely by a human.', 'document_classification': 'HUMAN_ONLY', 'version': '2025-01-09-base', 'language': 'en', 'pageNumber': 0, 'inputText': 'Next up in 5 Example video title will go here for this video Next up in 5 Example video title will go here for this video TOLEDO, Ohio — Editor\'s note: the above video aired on Jan. 7, 2021. The union representing journalists who work at The Blade has filed an unfair labor practice against the paper and its parent company, Block Communications, over what the union says is management\'s refusal to bargain in a safe manner during a pandemic. The Toledo News Guild released a statement about the lawsuit, saying that throughout the pandemic, the paper\'s management and an attorney with the firm King & Ballow - which represents The Blade - have insisted that negotiations occur in-person and indoors. ""This has been part of their campaign to bust our union, impose their will and terms upon us, and beat back dissent over unethical practices at the newspaper and Block interference with the editorial independence of Blade journalists,"" the statement read. A call for comment placed to The Blade has not been returned as of publication time. The lawsuit comes weeks after Blade journalists held a byline strike following what workers called censorship of their reporting on the Jan. 6 U.S. Capitol breach. RELATED: The Blade journalists forego reporter bylines following ethics concerns; Block family member resigns arts commission post after social media backlash The guild\'s statement goes on to say that proposed alternatives such as meeting outdoors were rejected while an attorney has refused to wear a mask during negotiations. Attempts to bring in a federal mediator were scuttled by Block Communications and its attorney because federal mediators are prohibited from meeting in-person during the pandemic, according to the guild. ""Insisting on in-person bargaining during a pandemic is reckless and irresponsible. It has also hampered negotiations. Agreed-to bargaining dates last week were rejected by the company because of their demand that we bargain in-person, even after during one of the largest snow events in Toledo history. A company representative flippantly said they would fly their attorney into town overnight, during a snow emergency, to bargain in person the next day instead of bargaining remotely,"" the statement said. The guild also called out Block Communications for demanding that sales staff, who were successfully working remotely, report to the office during a Level 3 snow emergency. The union argued in the statement that the NewsGuild-CWA is engaged in bargaining at dozens of newspapers and media outlets across the country while negotiating remotely is the practice used nearly everywhere. Additionally, Block Communications - which also owns the Pittsburgh Post-Gazette - is using remote formats to bargain with the outlets\' workers unions in Pennsylvania. Finally, the guild said that refusal to bargain remotely has impeded members from being able to safely observe contract negotiations. RELATED: NAACP Toledo releases statement on US Capitol insurrection, The Blade and controversial social media post made by Block family member RELATED VIDEO: Notifications can be turned off anytime in the browser settings.'}]"
OH_2021_b30c53a15c704e435be2065c5709e20e.html.gz,2025-01-09-base,"[{'sentences': [{'generated_prob': 0.00013907683023717254, 'sentence': 'Now 47 Sat 80 Sun 67 Jack joined WTOV as a multimedia journalist in July 2021.', 'perplexity': 0, 'highlight_sentence_for_ai': False}, {'generated_prob': 0.00012055521801812574, 'sentence': 'Prior to coming to the Ohio Valley, he worked as a producer for 93.7 The Fan in Pittsburgh, Pa.', 'perplexity': 0, 'highlight_sentence_for_ai': False}, {'generated_prob': 0.0001325024786638096, 'sentence': ""In addition to his work at The Fan, Jack worked for the TribLive High School Sports Network, providing play-by-play coverage for dozens of high school sporting events across Western, Pa. Jack graduated from Waynesburg University in spring 2021 with a communication's degree with a focus in Sports Broadcasting/Sports Information."", 'perplexity': 0, 'highlight_sentence_for_ai': False}, {'generated_prob': 0.00010395671415608376, 'sentence': 'During his time at Waynesburg, Jack served as both a talent and producer for the campus TV station, Sports Director of the campus radio station, and Executive Producer of the Waynesburg University Sports Network.', 'perplexity': 0, 'highlight_sentence_for_ai': False}, {'generated_prob': 0.00010797788854688406, 'sentence': 'Jack also won a Communicator and Tele Award for his work as a producer for WCTV at Waynesburg.', 'perplexity': 0, 'highlight_sentence_for_ai': False}, {'generated_prob': 9.257651981897652e-05, 'sentence': 'Jack can attribute his passion for the business to one thing, his grandfather, Bill.', 'perplexity': 0, 'highlight_sentence_for_ai': False}, {'generated_prob': 9.531923569738865e-05, 'sentence': 'Bill is the longtime voice of the Pittsburgh Panthers football and basketball teams and the Pittsburgh Steelers.', 'perplexity': 0, 'highlight_sentence_for_ai': False}, {'generated_prob': 7.987022399902344e-05, 'sentence': 'At just 8 years old, Jack stepped into the press box of a Pitt game for the first time, and since then, he has worked alongside his grandfather as a spotter.', 'perplexity': 0, 'highlight_sentence_for_ai': False}, {'generated_prob': 6.467921048169956e-05, 'sentence': 'Jack grew up in the South Hills of Pittsburgh, and is a huge fan of the Steelers, Pirates, Penguins, and Pitt Panthers.', 'perplexity': 0, 'highlight_sentence_for_ai': False}, {'generated_prob': 8.060241088969633e-05, 'sentence': 'In his free time, Jack enjoys golfing, playing video games, spending time with friends and family, and going to his family lake house at Conneaut Lake, Pa. © 2024 Sinclair, Inc.', 'perplexity': 0, 'highlight_sentence_for_ai': False}], 'paragraphs': [{'start_sentence_index': 0, 'num_sentences': 10, 'completely_generated_prob': 5.7802509961791254e-09}], 'completely_generated_prob': 0.005203089766913354, 'class_probabilities': {'human': 0.9947969102330866, 'ai': 0.005203089766913354, 'mixed': 0}, 'average_generated_prob': 0, 'predicted_class': 'human', 'confidence_score': 0.9947969102330866, 'confidence_category': 'high', 'confidence_scores_raw': {'identity': {'ai': 0.005203089766913354, 'human': 0.9947969102330866, 'mixed': 0}}, 'confidence_thresholds_raw': {'identity': {'ai': {'reject': 0.65, 'low': 0.75, 'medium': 0.92}, 'human': {'reject': 0.7, 'low': 0.82, 'medium': 0.92}, 'mixed': {'reject': 0.7, 'low': 0.8, 'medium': 0.88}}}, 'overall_burstiness': 0, 'writing_stats': {}, 'subclass': {'ai': {}, 'human': {}, 'mixed': {}}, 'result_message': 'Our detector is highly confident that the text is written entirely by a human.', 'document_classification': 'HUMAN_ONLY', 'version': '2025-01-09-base', 'language': 'en', 'pageNumber': 0, 'inputText': ""Now 47 Sat 80 Sun 67 Jack joined WTOV as a multimedia journalist in July 2021. Prior to coming to the Ohio Valley, he worked as a producer for 93.7 The Fan in Pittsburgh, Pa. In addition to his work at The Fan, Jack worked for the TribLive High School Sports Network, providing play-by-play coverage for dozens of high school sporting events across Western, Pa. Jack graduated from Waynesburg University in spring 2021 with a communication's degree with a focus in Sports Broadcasting/Sports Information. During his time at Waynesburg, Jack served as both a talent and producer for the campus TV station, Sports Director of the campus radio station, and Executive Producer of the Waynesburg University Sports Network. Jack also won a Communicator and Tele Award for his work as a producer for WCTV at Waynesburg. Jack can attribute his passion for the business to one thing, his grandfather, Bill. Bill is the longtime voice of the Pittsburgh Panthers football and basketball teams and the Pittsburgh Steelers. At just 8 years old, Jack stepped into the press box of a Pitt game for the first time, and since then, he has worked alongside his grandfather as a spotter. Jack grew up in the South Hills of Pittsburgh, and is a huge fan of the Steelers, Pirates, Penguins, and Pitt Panthers. In his free time, Jack enjoys golfing, playing video games, spending time with friends and family, and going to his family lake house at Conneaut Lake, Pa. © 2024 Sinclair, Inc.""}]"
