File,version,documents
OH_2023_1a2dc98cc84354c9bd44007f2133da90.html.gz,2025-01-09-base,"[{'sentences': [{'generated_prob': 4.592535333358683e-05, 'sentence': 'Researchers at The Ohio State University found that ultrasound technology could be one way of breaking up the strong bonds that make ""forever chemicals"" so hard to get rid of.', 'perplexity': 0, 'highlight_sentence_for_ai': False}, {'generated_prob': 4.232007631799206e-05, 'sentence': 'Professor Linda Weavers, who researches ultrasound technology, said her team used sound waves to emit sound at an ultrasonic frequency so low it created tiny bubbles.', 'perplexity': 0, 'highlight_sentence_for_ai': False}, {'generated_prob': 4.1968232835642993e-05, 'sentence': 'She referred to the bubbles as tiny ""combustion chambers.""', 'perplexity': 0, 'highlight_sentence_for_ai': False}, {'generated_prob': 5.9221754781901836e-05, 'sentence': 'The bubbles reached temperatures of 10,000 Kelvin, which is so hot it cleaves, or tears, apart the strong flourine bond that held the molecules together in a process called ultrasonic degradation.', 'perplexity': 0, 'highlight_sentence_for_ai': False}, {'generated_prob': 5.191456511965953e-05, 'sentence': '""So it\'s that high temperature that\'s...breaking the bonds, because these bonds are so strong.', 'perplexity': 0, 'highlight_sentence_for_ai': False}, {'generated_prob': 3.601416028686799e-05, 'sentence': 'I need to add energy to break these bonds apart,"" Weavers said.', 'perplexity': 0, 'highlight_sentence_for_ai': False}, {'generated_prob': 6.025128095643595e-05, 'sentence': 'PFAS (polyflouroalkyl) substances are more commonly known as ""forever chemicals"" because the harmful substances are notorious for being hard to break down and dissipate at a molecular level.', 'perplexity': 0, 'highlight_sentence_for_ai': False}, {'generated_prob': 6.387627945514396e-05, 'sentence': 'PFAS are toxic chemicals that come from the creation of a laundry list of everyday items such as cookware, cosmetics and food wrappers.', 'perplexity': 0, 'highlight_sentence_for_ai': False}, {'generated_prob': 9.330546163255349e-05, 'sentence': 'And long-term exposure to even just a tiny amount of the man-made chemicals can pose health risks, like decreased fertility and some types of cancer.', 'perplexity': 0, 'highlight_sentence_for_ai': False}, {'generated_prob': 0.0001914741878863424, 'sentence': 'The researchers focused their efforts on groundwater contaminated by the foam firefighters use to put out fires.', 'perplexity': 0, 'highlight_sentence_for_ai': False}, {'generated_prob': 0.005242735613137484, 'sentence': 'The team used lab-made mixtures containing three different sized compounds of fluorotelomer sulfonates and their results showed that over a period of three hours, the smaller compounds degraded much faster than the larger ones.', 'perplexity': 0, 'highlight_sentence_for_ai': False}, {'generated_prob': 0.00743706664070487, 'sentence': ""Other PFAS treatment methods weren't able to treat smaller PFAS as efficiently."", 'perplexity': 0, 'highlight_sentence_for_ai': False}, {'generated_prob': 0.005552583374083042, 'sentence': 'Weavers said this technique provides an advantage over other ways people have tried to rid groundwater of ""forever chemicals,"" such as incinerating the water containing it or just filtering it out and sticking the chemicals in landfills without actually getting rid of it.', 'perplexity': 0, 'highlight_sentence_for_ai': False}, {'generated_prob': 0.010847769677639008, 'sentence': 'Weavers said despite this breakthrough, there is still a long way to go in eliminating ""forever chemicals"" from the environment.', 'perplexity': 0, 'highlight_sentence_for_ai': False}, {'generated_prob': 0.008783639408648014, 'sentence': '""(PFAS) deserve that name.', 'perplexity': 0, 'highlight_sentence_for_ai': False}, {'generated_prob': 0.007847877219319344, 'sentence': 'So, you know, even if we find a technology that breaks them down, they\'re going to be around for a long time, because they\'re in so many places,"" Weavers said.', 'perplexity': 0, 'highlight_sentence_for_ai': False}, {'generated_prob': 0.01225969847291708, 'sentence': 'Weavers said the next challenge is to find an economically sound way to use this technology in everyday life to slowly chip away at the amount of forever chemicals.', 'perplexity': 0, 'highlight_sentence_for_ai': False}, {'generated_prob': 0.013618826866149902, 'sentence': 'She said this could be feasibly used for creating small, high-energy water filtration devices in everyday homes.', 'perplexity': 0, 'highlight_sentence_for_ai': False}, {'generated_prob': 0.02200424298644066, 'sentence': 'The research was published in The Journal of Physical Chemistry A.', 'perplexity': 0, 'highlight_sentence_for_ai': False}], 'paragraphs': [{'start_sentence_index': 0, 'num_sentences': 19, 'completely_generated_prob': 7.952272508076387e-17}], 'completely_generated_prob': 0.00954082155012564, 'class_probabilities': {'human': 0.9904183478663264, 'ai': 0.00954082155012564, 'mixed': 4.0830583547849345e-05}, 'average_generated_prob': 0, 'predicted_class': 'human', 'confidence_score': 0.9904183478663264, 'confidence_category': 'high', 'confidence_scores_raw': {'identity': {'ai': 0.00954082155012564, 'human': 0.9904183478663264, 'mixed': 4.0830583547849345e-05}}, 'confidence_thresholds_raw': {'identity': {'ai': {'reject': 0.65, 'low': 0.75, 'medium': 0.92}, 'human': {'reject': 0.7, 'low': 0.82, 'medium': 0.92}, 'mixed': {'reject': 0.7, 'low': 0.8, 'medium': 0.88}}}, 'overall_burstiness': 0, 'writing_stats': {}, 'subclass': {'ai': {}, 'human': {}, 'mixed': {}}, 'result_message': 'Our detector is highly confident that the text is written entirely by a human.', 'document_classification': 'HUMAN_ONLY', 'version': '2025-01-09-base', 'language': 'en', 'pageNumber': 0, 'inputText': 'Researchers at The Ohio State University found that ultrasound technology could be one way of breaking up the strong bonds that make ""forever chemicals"" so hard to get rid of. Professor Linda Weavers, who researches ultrasound technology, said her team used sound waves to emit sound at an ultrasonic frequency so low it created tiny bubbles. She referred to the bubbles as tiny ""combustion chambers."" The bubbles reached temperatures of 10,000 Kelvin, which is so hot it cleaves, or tears, apart the strong flourine bond that held the molecules together in a process called ultrasonic degradation. ""So it\'s that high temperature that\'s...breaking the bonds, because these bonds are so strong. I need to add energy to break these bonds apart,"" Weavers said. PFAS (polyflouroalkyl) substances are more commonly known as ""forever chemicals"" because the harmful substances are notorious for being hard to break down and dissipate at a molecular level. PFAS are toxic chemicals that come from the creation of a laundry list of everyday items such as cookware, cosmetics and food wrappers. And long-term exposure to even just a tiny amount of the man-made chemicals can pose health risks, like decreased fertility and some types of cancer. The researchers focused their efforts on groundwater contaminated by the foam firefighters use to put out fires. The team used lab-made mixtures containing three different sized compounds of fluorotelomer sulfonates and their results showed that over a period of three hours, the smaller compounds degraded much faster than the larger ones. Other PFAS treatment methods weren\'t able to treat smaller PFAS as efficiently. Weavers said this technique provides an advantage over other ways people have tried to rid groundwater of ""forever chemicals,"" such as incinerating the water containing it or just filtering it out and sticking the chemicals in landfills without actually getting rid of it. Weavers said despite this breakthrough, there is still a long way to go in eliminating ""forever chemicals"" from the environment. ""(PFAS) deserve that name. So, you know, even if we find a technology that breaks them down, they\'re going to be around for a long time, because they\'re in so many places,"" Weavers said. Weavers said the next challenge is to find an economically sound way to use this technology in everyday life to slowly chip away at the amount of forever chemicals. She said this could be feasibly used for creating small, high-energy water filtration devices in everyday homes. The research was published in The Journal of Physical Chemistry A.'}]"
OH_2023_271654ad371e5f0a581863bdac4ca6ec.html.gz,2025-01-09-base,"[{'sentences': [{'generated_prob': 0.0030487123876810074, 'sentence': 'Big winner: Morgan Wallen, who performed ""\'98 Braves"" at Atlanta\'s Truist Park, won 11 awards at the Billboard Music Awards.', 'perplexity': 0, 'highlight_sentence_for_ai': False}, {'generated_prob': 0.002430735621601343, 'sentence': '(Christopher Polk/Penske Media via Getty Images) 2023 has been the year of Morgan Wallen!', 'perplexity': 0, 'highlight_sentence_for_ai': False}, {'generated_prob': 0.0014890565071254969, 'sentence': 'Morgan took home 11 awards over the weekend at the Billboard Music Awards, and it was just announced that he was the top artist on the Billboard Hot 100 for 2023.', 'perplexity': 0, 'highlight_sentence_for_ai': False}, {'generated_prob': 0.0012567102676257491, 'sentence': 'Not only did he win top artist, his hit “Last Night” also won top streaming song of 2023 as well.', 'perplexity': 0, 'highlight_sentence_for_ai': False}, {'generated_prob': 0.0018792884657159448, 'sentence': 'Morgan is the first primarily country artist to win the award since the late, great Kenny Rogers won it in 1981.', 'perplexity': 0, 'highlight_sentence_for_ai': False}, {'generated_prob': 0.0018019055714830756, 'sentence': 'Sign up below to be added to our mailing list for the latest news updates, access to exclusive contests, and more!', 'perplexity': 0, 'highlight_sentence_for_ai': False}, {'generated_prob': 0.0015795936342328787, 'sentence': 'Everything you love about k99online.com and more!', 'perplexity': 0, 'highlight_sentence_for_ai': False}, {'generated_prob': 0.0021736114285886288, 'sentence': 'Tap on any of the buttons below to download our app.', 'perplexity': 0, 'highlight_sentence_for_ai': False}, {'generated_prob': 0.0019487302051857114, 'sentence': 'Enable our Skill today to listen live at home on your Alexa Devices!', 'perplexity': 0, 'highlight_sentence_for_ai': False}, {'generated_prob': 0.0018731836462393403, 'sentence': '© Cox Media Group.', 'perplexity': 0, 'highlight_sentence_for_ai': False}, {'generated_prob': 0.002907539252191782, 'sentence': 'All Rights Reserved.', 'perplexity': 0, 'highlight_sentence_for_ai': False}, {'generated_prob': 0.002658578334376216, 'sentence': 'By using this website, you accept the terms of our Visitor Agreement and Privacy Policy, and understand your options regarding Ad Choices.', 'perplexity': 0, 'highlight_sentence_for_ai': False}, {'generated_prob': 0.0021264730021357536, 'sentence': 'Learn about careers at Cox Media Group.', 'perplexity': 0, 'highlight_sentence_for_ai': False}, {'generated_prob': 0.003199868369847536, 'sentence': 'You may be offline.', 'perplexity': 0, 'highlight_sentence_for_ai': False}, {'generated_prob': 0.007790065370500088, 'sentence': 'Please check your connection and try again using the Retry button.', 'perplexity': 0, 'highlight_sentence_for_ai': False}], 'paragraphs': [{'start_sentence_index': 0, 'num_sentences': 15, 'completely_generated_prob': 2.5938383721896624e-13}], 'completely_generated_prob': 0.02065958899652478, 'class_probabilities': {'human': 0.979301577189572, 'ai': 0.02065958899652478, 'mixed': 3.883381390324206e-05}, 'average_generated_prob': 0, 'predicted_class': 'human', 'confidence_score': 0.979301577189572, 'confidence_category': 'high', 'confidence_scores_raw': {'identity': {'ai': 0.02065958899652478, 'human': 0.979301577189572, 'mixed': 3.883381390324206e-05}}, 'confidence_thresholds_raw': {'identity': {'ai': {'reject': 0.65, 'low': 0.75, 'medium': 0.92}, 'human': {'reject': 0.7, 'low': 0.82, 'medium': 0.92}, 'mixed': {'reject': 0.7, 'low': 0.8, 'medium': 0.88}}}, 'overall_burstiness': 0, 'writing_stats': {}, 'subclass': {'ai': {}, 'human': {}, 'mixed': {}}, 'result_message': 'Our detector is highly confident that the text is written entirely by a human.', 'document_classification': 'HUMAN_ONLY', 'version': '2025-01-09-base', 'language': 'en', 'pageNumber': 0, 'inputText': 'Big winner: Morgan Wallen, who performed ""\'98 Braves"" at Atlanta\'s Truist Park, won 11 awards at the Billboard Music Awards. (Christopher Polk/Penske Media via Getty Images) 2023 has been the year of Morgan Wallen! Morgan took home 11 awards over the weekend at the Billboard Music Awards, and it was just announced that he was the top artist on the Billboard Hot 100 for 2023. Not only did he win top artist, his hit “Last Night” also won top streaming song of 2023 as well. Morgan is the first primarily country artist to win the award since the late, great Kenny Rogers won it in 1981. Sign up below to be added to our mailing list for the latest news updates, access to exclusive contests, and more! Everything you love about k99online.com and more! Tap on any of the buttons below to download our app. Enable our Skill today to listen live at home on your Alexa Devices! © Cox Media Group. All Rights Reserved. By using this website, you accept the terms of our Visitor Agreement and Privacy Policy, and understand your options regarding Ad Choices. Learn about careers at Cox Media Group. You may be offline. Please check your connection and try again using the Retry button.'}]"
OH_2023_29dffcdea82615c2c907263ea50a94b4.html.gz,2025-01-09-base,"[{'sentences': [{'generated_prob': 0.0008033197373151779, 'sentence': ""By: Alli Harlan On Saturday night, deputies from the Logan County Sheriff's Office were dispatched to a crash on State Route 368 in Huntsville."", 'perplexity': 0, 'highlight_sentence_for_ai': False}, {'generated_prob': 0.000685874663759023, 'sentence': 'A witness claimed that a vehicle crossed the center line, went off the left side of the road, and hit a utility pole.', 'perplexity': 0, 'highlight_sentence_for_ai': False}, {'generated_prob': 0.0006211043801158667, 'sentence': 'Deputies were advised that the driver, later identified as Shawn Shellenbarger, 51 of Belle Center, asked the witness to not contact law enforcement and they noted that he appeared to be intoxicated.', 'perplexity': 0, 'highlight_sentence_for_ai': False}, {'generated_prob': 0.0006471535307355225, 'sentence': 'Once Shellenbarger knew law enforcement was en route, he ran away from the scene.', 'perplexity': 0, 'highlight_sentence_for_ai': False}, {'generated_prob': 0.0007595837814733386, 'sentence': ""Deputies contacted the Hardin County Sheriff's Office because that is where he resides."", 'perplexity': 0, 'highlight_sentence_for_ai': False}, {'generated_prob': 0.00041451159631833434, 'sentence': 'Shellenbarger was unable to be reached.', 'perplexity': 0, 'highlight_sentence_for_ai': False}, {'generated_prob': 0.0004351526440586895, 'sentence': ""Sunday, deputies from the Logan County Sheriff's office received a voicemail from him stating that he was in an accident the night before and that he doesn't remember anything other than swerving because a car had come left of center."", 'perplexity': 0, 'highlight_sentence_for_ai': False}, {'generated_prob': 0.0005149889038875699, 'sentence': 'Shellenbarger claimed he did not remember leaving, but he remembered walking and someone picking him up.', 'perplexity': 0, 'highlight_sentence_for_ai': False}, {'generated_prob': 0.0007386886281892657, 'sentence': 'He thought it was a dream, but contacted authorities when he found his car was not in the garage.', 'perplexity': 0, 'highlight_sentence_for_ai': False}, {'generated_prob': 0.0013072766596451402, 'sentence': ""The Logan County Sheriff's Department continues to investigate the situation."", 'perplexity': 0, 'highlight_sentence_for_ai': False}, {'generated_prob': 0.00111324992030859, 'sentence': '© Copyright 2024, Peak of Ohio by V-Teck Communications.', 'perplexity': 0, 'highlight_sentence_for_ai': False}, {'generated_prob': 0.004000138491392136, 'sentence': 'All Rights Reserved.', 'perplexity': 0, 'highlight_sentence_for_ai': False}], 'paragraphs': [{'start_sentence_index': 0, 'num_sentences': 12, 'completely_generated_prob': 1.0731758790825431e-10}], 'completely_generated_prob': 0.00982192507144982, 'class_probabilities': {'human': 0.9901780749285501, 'ai': 0.00982192507144982, 'mixed': 0}, 'average_generated_prob': 0, 'predicted_class': 'human', 'confidence_score': 0.9901780749285501, 'confidence_category': 'high', 'confidence_scores_raw': {'identity': {'ai': 0.00982192507144982, 'human': 0.9901780749285501, 'mixed': 0}}, 'confidence_thresholds_raw': {'identity': {'ai': {'reject': 0.65, 'low': 0.75, 'medium': 0.92}, 'human': {'reject': 0.7, 'low': 0.82, 'medium': 0.92}, 'mixed': {'reject': 0.7, 'low': 0.8, 'medium': 0.88}}}, 'overall_burstiness': 0, 'writing_stats': {}, 'subclass': {'ai': {}, 'human': {}, 'mixed': {}}, 'result_message': 'Our detector is highly confident that the text is written entirely by a human.', 'document_classification': 'HUMAN_ONLY', 'version': '2025-01-09-base', 'language': 'en', 'pageNumber': 0, 'inputText': 'By: Alli Harlan On Saturday night, deputies from the Logan County Sheriff’s Office were dispatched to a crash on State Route 368 in Huntsville. A witness claimed that a vehicle crossed the center line, went off the left side of the road, and hit a utility pole. Deputies were advised that the driver, later identified as Shawn Shellenbarger, 51 of Belle Center, asked the witness to not contact law enforcement and they noted that he appeared to be intoxicated. Once Shellenbarger knew law enforcement was en route, he ran away from the scene. Deputies contacted the Hardin County Sheriff’s Office because that is where he resides. Shellenbarger was unable to be reached. Sunday, deputies from the Logan County Sheriff’s office received a voicemail from him stating that he was in an accident the night before and that he doesn’t remember anything other than swerving because a car had come left of center. Shellenbarger claimed he did not remember leaving, but he remembered walking and someone picking him up. He thought it was a dream, but contacted authorities when he found his car was not in the garage. The Logan County Sheriff’s Department continues to investigate the situation. © Copyright 2024, Peak of Ohio by V-Teck Communications. All Rights Reserved.'}]"
OH_2023_32d19038fc7e4e9d762205f63c82b08a.html.gz,2025-01-09-base,"[{'sentences': [{'generated_prob': 0.004271868150681257, 'sentence': 'News, Sports and Weather The sentencing hearing was held for a man who previously pleaded guilty to charges related to a shooting in Findlay in April.', 'perplexity': 0, 'highlight_sentence_for_ai': False}, {'generated_prob': 0.003168371506035328, 'sentence': 'Isaiah J. Moore, 21, was sentenced to six to nine years in prison during his sentencing hearing on Friday in Hancock County Common Pleas Court in Findlay.', 'perplexity': 0, 'highlight_sentence_for_ai': False}, {'generated_prob': 0.003568548709154129, 'sentence': 'In November, Moore pleaded guilty to two counts of felonious assault, a second-degree felony, in connection with the April 8th shooting at a building on East Front Street that wounded two men.', 'perplexity': 0, 'highlight_sentence_for_ai': False}, {'generated_prob': 0.0035501671954989433, 'sentence': 'The police department says officers responded that night to a building at 230 East Front Street in reference to a fight involving shots being fired.', 'perplexity': 0, 'highlight_sentence_for_ai': False}, {'generated_prob': 0.003800174919888377, 'sentence': 'The two men who were shot were treated at Blanchard Valley Hospital and are still recovering from their injuries.', 'perplexity': 0, 'highlight_sentence_for_ai': False}, {'generated_prob': 0.0037575915921479464, 'sentence': 'Court records show that Moore had a jury trial scheduled for January but in November entered a plea of guilty to the two charges.', 'perplexity': 0, 'highlight_sentence_for_ai': False}, {'generated_prob': 0.003264774801209569, 'sentence': 'As part of the plea deal, a gun specification was dropped.', 'perplexity': 0, 'highlight_sentence_for_ai': False}, {'generated_prob': 0.006309967488050461, 'sentence': ""Matt Demczyk, News Director 419-422-2056 [email protected] (From Findlay City Schools) We are so excited to host Hancock County's Summer Lunch Program, offering FREE lunches to everyone OUR MISSION: To be the electronic media of choice for information, entertainment, and meeting community needs OUR INFORMATION WFIN Studio P.O."", 'perplexity': 0, 'highlight_sentence_for_ai': False}, {'generated_prob': 0.012393640354275703, 'sentence': 'Box 1507 Findlay, Ohio 45839-1507 551 Lake Cascades Parkway - Findlay, Ohio 45840 Phone: 419-422-4545 Contact Us Blanchard River Broadcasting Company A Division of The Findlay Publishing Company WFIN || WKXA || 106.3 The Fox Please read our Privacy Statement and Commenting Policy Public File If you need help accessing the file due to a disability, please contact [email protected] EEO FCC Applications', 'perplexity': 0, 'highlight_sentence_for_ai': False}], 'paragraphs': [{'start_sentence_index': 0, 'num_sentences': 9, 'completely_generated_prob': 4.1887248735431006e-08}], 'completely_generated_prob': 0.024462635563563522, 'class_probabilities': {'human': 0.9755373644364365, 'ai': 0.024462635563563522, 'mixed': 0}, 'average_generated_prob': 0, 'predicted_class': 'human', 'confidence_score': 0.9755373644364365, 'confidence_category': 'high', 'confidence_scores_raw': {'identity': {'ai': 0.024462635563563522, 'human': 0.9755373644364365, 'mixed': 0}}, 'confidence_thresholds_raw': {'identity': {'ai': {'reject': 0.65, 'low': 0.75, 'medium': 0.92}, 'human': {'reject': 0.7, 'low': 0.82, 'medium': 0.92}, 'mixed': {'reject': 0.7, 'low': 0.8, 'medium': 0.88}}}, 'overall_burstiness': 0, 'writing_stats': {}, 'subclass': {'ai': {}, 'human': {}, 'mixed': {}}, 'result_message': 'Our detector is highly confident that the text is written entirely by a human.', 'document_classification': 'HUMAN_ONLY', 'version': '2025-01-09-base', 'language': 'en', 'pageNumber': 0, 'inputText': 'News, Sports and Weather The sentencing hearing was held for a man who previously pleaded guilty to charges related to a shooting in Findlay in April. Isaiah J. Moore, 21, was sentenced to six to nine years in prison during his sentencing hearing on Friday in Hancock County Common Pleas Court in Findlay. In November, Moore pleaded guilty to two counts of felonious assault, a second-degree felony, in connection with the April 8th shooting at a building on East Front Street that wounded two men. The police department says officers responded that night to a building at 230 East Front Street in reference to a fight involving shots being fired. The two men who were shot were treated at Blanchard Valley Hospital and are still recovering from their injuries. Court records show that Moore had a jury trial scheduled for January but in November entered a plea of guilty to the two charges. As part of the plea deal, a gun specification was dropped. Matt Demczyk, News Director 419-422-2056 [email protected] (From Findlay City Schools) We are so excited to host Hancock County’s Summer Lunch Program, offering FREE lunches to everyone OUR MISSION: To be the electronic media of choice for information, entertainment, and meeting community needs OUR INFORMATION WFIN Studio P.O. Box 1507 Findlay, Ohio 45839-1507 551 Lake Cascades Parkway - Findlay, Ohio 45840 Phone: 419-422-4545 Contact Us Blanchard River Broadcasting Company A Division of The Findlay Publishing Company WFIN || WKXA || 106.3 The Fox Please read our Privacy Statement and Commenting Policy Public File If you need help accessing the file due to a disability, please contact [email protected] EEO FCC Applications'}]"
