File,version,documents
NV_2024_3e7ed5e269e34ef53dc76b38fe36850d.html.gz,2025-01-09-base,"[{'sentences': [{'generated_prob': 5.287197564030066e-05, 'sentence': 'ARI SHAPIRO, HOST: Where do we go from here?', 'perplexity': 0, 'highlight_sentence_for_ai': False}, {'generated_prob': 6.445027247536927e-05, 'sentence': ""That's the question many are asking after a wild week in Washington."", 'perplexity': 0, 'highlight_sentence_for_ai': False}, {'generated_prob': 3.934825872420333e-05, 'sentence': 'A bipartisan bill on immigration legislation could have been a major shift in U.S. border policy, but it fizzled almost immediately in a divided Senate.', 'perplexity': 0, 'highlight_sentence_for_ai': False}, {'generated_prob': 3.506971552269533e-05, 'sentence': 'Joining us to discuss what is next is NPR immigration correspondent Jasmine Garsd.', 'perplexity': 0, 'highlight_sentence_for_ai': False}, {'generated_prob': 8.026418800000101e-05, 'sentence': 'Hi there.', 'perplexity': 0, 'highlight_sentence_for_ai': False}, {'generated_prob': 4.217687455820851e-05, 'sentence': 'JASMINE GARSD, BYLINE: Hi.', 'perplexity': 0, 'highlight_sentence_for_ai': False}, {'generated_prob': 3.063624899368733e-05, 'sentence': 'SHAPIRO: Does the end of this bill mean nothing will change on immigration?', 'perplexity': 0, 'highlight_sentence_for_ai': False}, {'generated_prob': 2.789638892863877e-05, 'sentence': 'GARSD: Yes and no.', 'perplexity': 0, 'highlight_sentence_for_ai': False}, {'generated_prob': 2.9485250706784427e-05, 'sentence': ""I definitely think there's a sense that on the legislative side, nothing can change, not with this level of political polarization."", 'perplexity': 0, 'highlight_sentence_for_ai': False}, {'generated_prob': 2.6406109100207686e-05, 'sentence': 'But the flow of people trying to reach the southern border, that continues.', 'perplexity': 0, 'highlight_sentence_for_ai': False}, {'generated_prob': 2.8130802093073726e-05, 'sentence': ""People coming from Latin America, Asia, Africa and the Middle East - that's not stopping just because Congress did."", 'perplexity': 0, 'highlight_sentence_for_ai': False}, {'generated_prob': 2.499683978385292e-05, 'sentence': 'SHAPIRO: And why does this keep happening?', 'perplexity': 0, 'highlight_sentence_for_ai': False}, {'generated_prob': 1.9755207176785916e-05, 'sentence': 'GARSD: Well, look.', 'perplexity': 0, 'highlight_sentence_for_ai': False}, {'generated_prob': 2.3517690351582132e-05, 'sentence': 'The U.N. has said that last year there was a record rise in displaced people around the world.', 'perplexity': 0, 'highlight_sentence_for_ai': False}, {'generated_prob': 2.423998921585735e-05, 'sentence': ""That's obvious at the border."", 'perplexity': 0, 'highlight_sentence_for_ai': False}, {'generated_prob': 4.062679363414645e-05, 'sentence': ""I've met folks fleeing from the Russia-Ukraine conflict, escaping repression in Turkey, government persecution in Venezuela and a lot of people who are simply leaving collapsed economies."", 'perplexity': 0, 'highlight_sentence_for_ai': False}, {'generated_prob': 3.390173151274212e-05, 'sentence': 'There also is a lot of misinformation.', 'perplexity': 0, 'highlight_sentence_for_ai': False}, {'generated_prob': 3.703389666043222e-05, 'sentence': ""I constantly talk to migrants on the border who have been told that once they get to the U.S., they're going to be allowed to stay, legally, permanently if they ask for asylum."", 'perplexity': 0, 'highlight_sentence_for_ai': False}, {'generated_prob': 3.689331788336858e-05, 'sentence': 'But getting asylum in the U.S. is difficult.', 'perplexity': 0, 'highlight_sentence_for_ai': False}, {'generated_prob': 5.537244942388497e-05, 'sentence': ""It can be expensive, and there's a massive backlog."", 'perplexity': 0, 'highlight_sentence_for_ai': False}, {'generated_prob': 6.950897659407929e-05, 'sentence': 'Only about half the cases that reached a decision last year got granted asylum.', 'perplexity': 0, 'highlight_sentence_for_ai': False}, {'generated_prob': 4.3109914258820936e-05, 'sentence': 'SHAPIRO: The bill that died in the Senate, a lot of it was focused on border enforcement.', 'perplexity': 0, 'highlight_sentence_for_ai': False}, {'generated_prob': 6.726705760229379e-05, 'sentence': ""So with that gone, what's enforcement going to look like going forward?"", 'perplexity': 0, 'highlight_sentence_for_ai': False}, {'generated_prob': 3.355243825353682e-05, 'sentence': 'GARSD: The Biden administration has ramped up deportations.', 'perplexity': 0, 'highlight_sentence_for_ai': False}, {'generated_prob': 5.15431456733495e-05, 'sentence': 'Also, the Mexican National Guard is increasingly stopping migrants coming north to the U.S. SHAPIRO: But this issue also extends way beyond the border.', 'perplexity': 0, 'highlight_sentence_for_ai': False}, {'generated_prob': 7.996818021638319e-05, 'sentence': 'Migrants have been sent all over the country.', 'perplexity': 0, 'highlight_sentence_for_ai': False}, {'generated_prob': 2.2041307602194138e-05, 'sentence': 'GARSD: Absolutely.', 'perplexity': 0, 'highlight_sentence_for_ai': False}, {'generated_prob': 8.861625974532217e-05, 'sentence': ""I mean, New York City alone has received around - over 170,000 migrants in the last two years, and city government says it can't afford it."", 'perplexity': 0, 'highlight_sentence_for_ai': False}, {'generated_prob': 0.0001862997596617788, 'sentence': ""Now, while cities like Chicago, New York and Denver are struggling to manage that influx, you have parts of the Rust Belt, like Erie and Pittsburgh, for example, where there's a pretty severe labor shortage."", 'perplexity': 0, 'highlight_sentence_for_ai': False}, {'generated_prob': 0.0003390485653653741, 'sentence': 'And some politicians and business leaders are wondering, where is the immigrant labor?', 'perplexity': 0, 'highlight_sentence_for_ai': False}, {'generated_prob': 0.00038805895019322634, 'sentence': 'So last week Fed chair Jerome Powell went on CBS\'s ""60 Minutes,"" and he talked about labor and immigration.', 'perplexity': 0, 'highlight_sentence_for_ai': False}, {'generated_prob': 0.0001967977441381663, 'sentence': '(SOUNDBITE OF TV SHOW, ""60 MINUTES"") JEROME POWELL: I will say, over time, though, the U.S. economy has benefited from immigration.', 'perplexity': 0, 'highlight_sentence_for_ai': False}, {'generated_prob': 0.00031137350015342236, 'sentence': 'And frankly, just in the last year, a big part of the story of the labor market coming back into better balance is immigration returning to levels that were more typical of the pre-pandemic era.', 'perplexity': 0, 'highlight_sentence_for_ai': False}, {'generated_prob': 0.00027699899510480464, 'sentence': 'GARSD: So the border bill that died this week, one thing that got missed in all the drama surrounding it was that it would have expedited work permits for asylum-seekers, something which a lot of cities and business leaders have been asking for.', 'perplexity': 0, 'highlight_sentence_for_ai': False}, {'generated_prob': 0.00019999314099550247, 'sentence': ""SHAPIRO: Well, if there's not likely to be any more action in Congress, what is next?"", 'perplexity': 0, 'highlight_sentence_for_ai': False}, {'generated_prob': 0.00016635308566037565, 'sentence': ""GARSD: Well, again, there's Texas."", 'perplexity': 0, 'highlight_sentence_for_ai': False}, {'generated_prob': 0.0005366288241930306, 'sentence': 'Texas is still in a standoff with the federal government about who gets to enforce immigration law at the border and how.', 'perplexity': 0, 'highlight_sentence_for_ai': False}, {'generated_prob': 0.0003345848526805639, 'sentence': 'Texas Governor Greg Abbott recently said that he is going to keep busing migrants to cities like New York and Chicago.', 'perplexity': 0, 'highlight_sentence_for_ai': False}, {'generated_prob': 0.00025901634944602847, 'sentence': 'And the Biden administration has said it needs Congress to pass legislation in order to ramp up border enforcement.', 'perplexity': 0, 'highlight_sentence_for_ai': False}, {'generated_prob': 0.0002477201633155346, 'sentence': ""SHAPIRO: NPR's Jasmine Garsd."", 'perplexity': 0, 'highlight_sentence_for_ai': False}, {'generated_prob': 0.0001827594533096999, 'sentence': 'Thank you.', 'perplexity': 0, 'highlight_sentence_for_ai': False}, {'generated_prob': 0.0002335368626518175, 'sentence': 'GARSD: Thanks.', 'perplexity': 0, 'highlight_sentence_for_ai': False}, {'generated_prob': 0.000135105598019436, 'sentence': '(SOUNDBITE OF 9TH WONDER SONG, ""SEASON COURAGE"") Transcript provided by NPR, Copyright NPR.', 'perplexity': 0, 'highlight_sentence_for_ai': False}, {'generated_prob': 0.0001993988553294912, 'sentence': 'NPR transcripts are created on a rush deadline by an NPR contractor.', 'perplexity': 0, 'highlight_sentence_for_ai': False}, {'generated_prob': 0.0002581620356068015, 'sentence': 'This text may not be in its final form and may be updated or revised in the future.', 'perplexity': 0, 'highlight_sentence_for_ai': False}, {'generated_prob': 0.00015832384815439582, 'sentence': 'Accuracy and availability may vary.', 'perplexity': 0, 'highlight_sentence_for_ai': False}, {'generated_prob': 0.00020036319619975984, 'sentence': ""The authoritative record of NPR's programming is the audio record."", 'perplexity': 0, 'highlight_sentence_for_ai': False}], 'paragraphs': [{'start_sentence_index': 0, 'num_sentences': 47, 'completely_generated_prob': 9.775140688337147e-42}], 'completely_generated_prob': 0.006635186464044889, 'class_probabilities': {'human': 0.9933648135359551, 'ai': 0.006635186464044889, 'mixed': 0}, 'average_generated_prob': 0, 'predicted_class': 'human', 'confidence_score': 0.9933648135359551, 'confidence_category': 'high', 'confidence_scores_raw': {'identity': {'ai': 0.006635186464044889, 'human': 0.9933648135359551, 'mixed': 0}}, 'confidence_thresholds_raw': {'identity': {'ai': {'reject': 0.65, 'low': 0.75, 'medium': 0.92}, 'human': {'reject': 0.7, 'low': 0.82, 'medium': 0.92}, 'mixed': {'reject': 0.7, 'low': 0.8, 'medium': 0.88}}}, 'overall_burstiness': 0, 'writing_stats': {}, 'subclass': {'ai': {}, 'human': {}, 'mixed': {}}, 'result_message': 'Our detector is highly confident that the text is written entirely by a human.', 'document_classification': 'HUMAN_ONLY', 'version': '2025-01-09-base', 'language': 'en', 'pageNumber': 0, 'inputText': 'ARI SHAPIRO, HOST: Where do we go from here? That\'s the question many are asking after a wild week in Washington. A bipartisan bill on immigration legislation could have been a major shift in U.S. border policy, but it fizzled almost immediately in a divided Senate. Joining us to discuss what is next is NPR immigration correspondent Jasmine Garsd. Hi there. JASMINE GARSD, BYLINE: Hi. SHAPIRO: Does the end of this bill mean nothing will change on immigration? GARSD: Yes and no. I definitely think there\'s a sense that on the legislative side, nothing can change, not with this level of political polarization. But the flow of people trying to reach the southern border, that continues. People coming from Latin America, Asia, Africa and the Middle East - that\'s not stopping just because Congress did. SHAPIRO: And why does this keep happening? GARSD: Well, look. The U.N. has said that last year there was a record rise in displaced people around the world. That\'s obvious at the border. I\'ve met folks fleeing from the Russia-Ukraine conflict, escaping repression in Turkey, government persecution in Venezuela and a lot of people who are simply leaving collapsed economies. There also is a lot of misinformation. I constantly talk to migrants on the border who have been told that once they get to the U.S., they\'re going to be allowed to stay, legally, permanently if they ask for asylum. But getting asylum in the U.S. is difficult. It can be expensive, and there\'s a massive backlog. Only about half the cases that reached a decision last year got granted asylum. SHAPIRO: The bill that died in the Senate, a lot of it was focused on border enforcement. So with that gone, what\'s enforcement going to look like going forward? GARSD: The Biden administration has ramped up deportations. Also, the Mexican National Guard is increasingly stopping migrants coming north to the U.S. SHAPIRO: But this issue also extends way beyond the border. Migrants have been sent all over the country. GARSD: Absolutely. I mean, New York City alone has received around - over 170,000 migrants in the last two years, and city government says it can\'t afford it. Now, while cities like Chicago, New York and Denver are struggling to manage that influx, you have parts of the Rust Belt, like Erie and Pittsburgh, for example, where there\'s a pretty severe labor shortage. And some politicians and business leaders are wondering, where is the immigrant labor? So last week Fed chair Jerome Powell went on CBS\'s ""60 Minutes,"" and he talked about labor and immigration. (SOUNDBITE OF TV SHOW, ""60 MINUTES"") JEROME POWELL: I will say, over time, though, the U.S. economy has benefited from immigration. And frankly, just in the last year, a big part of the story of the labor market coming back into better balance is immigration returning to levels that were more typical of the pre-pandemic era. GARSD: So the border bill that died this week, one thing that got missed in all the drama surrounding it was that it would have expedited work permits for asylum-seekers, something which a lot of cities and business leaders have been asking for. SHAPIRO: Well, if there\'s not likely to be any more action in Congress, what is next? GARSD: Well, again, there\'s Texas. Texas is still in a standoff with the federal government about who gets to enforce immigration law at the border and how. Texas Governor Greg Abbott recently said that he is going to keep busing migrants to cities like New York and Chicago. And the Biden administration has said it needs Congress to pass legislation in order to ramp up border enforcement. SHAPIRO: NPR\'s Jasmine Garsd. Thank you. GARSD: Thanks. (SOUNDBITE OF 9TH WONDER SONG, ""SEASON COURAGE"") Transcript provided by NPR, Copyright NPR. NPR transcripts are created on a rush deadline by an NPR contractor. This text may not be in its final form and may be updated or revised in the future. Accuracy and availability may vary. The authoritative record of NPR’s programming is the audio record.'}]"
NV_2024_8d724a8582d9e862bb4d655eea806a54.html.gz,2025-01-09-base,"[{'sentences': [{'generated_prob': 2.367551496718079e-05, 'sentence': 'Menu It has a been a turbulent time for the aviation industry amid a string of recent incidents.', 'perplexity': 0, 'highlight_sentence_for_ai': False}, {'generated_prob': 2.9721577448071912e-05, 'sentence': 'In January, a door plug flew off a passenger plane mid-flight, grounding a whole fleet of Boeing Max 9 jets.', 'perplexity': 0, 'highlight_sentence_for_ai': False}, {'generated_prob': 2.88022420136258e-05, 'sentence': ""As recently as Thursday, two JetBlue planes collided in Boston, with one plane's wingtip coming in contact with another plane's tail."", 'perplexity': 0, 'highlight_sentence_for_ai': False}, {'generated_prob': 1.7829243006417528e-05, 'sentence': 'Most Americans, however ᅳ especially those who are frequent flyers ᅳ still feel air travel is generally safe, according to a new joint poll by The Associated Press and NORC.', 'perplexity': 0, 'highlight_sentence_for_ai': False}, {'generated_prob': 1.5121868273126893e-05, 'sentence': 'But only 2 in 10 adults in the U.S. are confident that planes are being properly maintained or are safe from structural faults.', 'perplexity': 0, 'highlight_sentence_for_ai': False}, {'generated_prob': 1.706121111055836e-05, 'sentence': 'And about 4 in 10 Americans believe pilots and air traffic controllers can maintain the safety of air travel.', 'perplexity': 0, 'highlight_sentence_for_ai': False}, {'generated_prob': 1.9216573491576128e-05, 'sentence': ""Americans also aren't so confident in those leading the industry."", 'perplexity': 0, 'highlight_sentence_for_ai': False}, {'generated_prob': 1.7555270460434258e-05, 'sentence': 'Only about 20% said they are confident in the work federal agencies, commercial airlines or airplane manufacturers do to uphold air safety, according to the poll.', 'perplexity': 0, 'highlight_sentence_for_ai': False}, {'generated_prob': 2.4056083930190653e-05, 'sentence': 'But a higher 45% are confident in the ability of pilots to maintain their safety.', 'perplexity': 0, 'highlight_sentence_for_ai': False}, {'generated_prob': 2.538789703976363e-05, 'sentence': 'Still, Americans consider planes, along with cars, among the safest forms of transportation in the country.', 'perplexity': 0, 'highlight_sentence_for_ai': False}, {'generated_prob': 2.52863610512577e-05, 'sentence': 'They feel less safe with bicycles or public transportation.', 'perplexity': 0, 'highlight_sentence_for_ai': False}, {'generated_prob': 2.505486918380484e-05, 'sentence': 'SEE MORE: NTSB: Bolts missing before panel blew out on Alaska Airlines Boeing Trending stories at Scrippsnews.com Report a typo', 'perplexity': 0, 'highlight_sentence_for_ai': False}], 'paragraphs': [{'start_sentence_index': 0, 'num_sentences': 12, 'completely_generated_prob': 1.0731758790825431e-10}], 'completely_generated_prob': 0.0031733866852551138, 'class_probabilities': {'human': 0.996826613314745, 'ai': 0.0031733866852551138, 'mixed': 0}, 'average_generated_prob': 0, 'predicted_class': 'human', 'confidence_score': 0.996826613314745, 'confidence_category': 'high', 'confidence_scores_raw': {'identity': {'ai': 0.0031733866852551138, 'human': 0.996826613314745, 'mixed': 0}}, 'confidence_thresholds_raw': {'identity': {'ai': {'reject': 0.65, 'low': 0.75, 'medium': 0.92}, 'human': {'reject': 0.7, 'low': 0.82, 'medium': 0.92}, 'mixed': {'reject': 0.7, 'low': 0.8, 'medium': 0.88}}}, 'overall_burstiness': 0, 'writing_stats': {}, 'subclass': {'ai': {}, 'human': {}, 'mixed': {}}, 'result_message': 'Our detector is highly confident that the text is written entirely by a human.', 'document_classification': 'HUMAN_ONLY', 'version': '2025-01-09-base', 'language': 'en', 'pageNumber': 0, 'inputText': ""Menu It has a been a turbulent time for the aviation industry amid a string of recent incidents. In January, a door plug flew off a passenger plane mid-flight, grounding a whole fleet of Boeing Max 9 jets. As recently as Thursday, two JetBlue planes collided in Boston, with one plane's wingtip coming in contact with another plane's tail. Most Americans, however — especially those who are frequent flyers — still feel air travel is generally safe, according to a new joint poll by The Associated Press and NORC. But only 2 in 10 adults in the U.S. are confident that planes are being properly maintained or are safe from structural faults. And about 4 in 10 Americans believe pilots and air traffic controllers can maintain the safety of air travel. Americans also aren’t so confident in those leading the industry. Only about 20% said they are confident in the work federal agencies, commercial airlines or airplane manufacturers do to uphold air safety, according to the poll. But a higher 45% are confident in the ability of pilots to maintain their safety. Still, Americans consider planes, along with cars, among the safest forms of transportation in the country. They feel less safe with bicycles or public transportation. SEE MORE: NTSB: Bolts missing before panel blew out on Alaska Airlines Boeing Trending stories at Scrippsnews.com Report a typo""}]"
