File,version,documents
MA_2020_5f85b915c495343d8f63909f58133379.html.gz,2025-01-09-base,"[{'sentences': [{'generated_prob': 7.648876635357738e-05, 'sentence': 'Recent exit polling data from Morning Consult suggests 44% of Biden voters cast their votes for the Democratic nominee as a vote “against” Trump, rather than in support of the former vice president.', 'perplexity': 0, 'highlight_sentence_for_ai': False}, {'generated_prob': 5.9936046454822645e-05, 'sentence': ""As the 2020 Presidential election results pour in, Morning Consult is conducting exit polls to provide context for voter's decisions in the monumental election."", 'perplexity': 0, 'highlight_sentence_for_ai': False}, {'generated_prob': 6.150425906525925e-05, 'sentence': ""Data collected lists COVID-19, economic recovery, and health care as the issues dominating the election, with Joe Biden's voters twice as likely as Trump's voters to say their vote was more against the opponent."", 'perplexity': 0, 'highlight_sentence_for_ai': False}, {'generated_prob': 5.677883746102452e-05, 'sentence': ""Only 22% of Trump's supporters say their vote was mostly against Biden, the data suggests."", 'perplexity': 0, 'highlight_sentence_for_ai': False}, {'generated_prob': 6.269562436500564e-05, 'sentence': ""“When it comes to what voters are looking for, Biden's backers were most likely to prioritize judgment, stability, honesty and trustworthiness in their choice for president, while Trump's supporters elevated judgment, mental fitness, effectiveness and strong leadership,” Morning Consult writes."", 'perplexity': 0, 'highlight_sentence_for_ai': False}, {'generated_prob': 7.503770029870793e-05, 'sentence': 'Controlling the spread of COVID-19 and revitalizing economic recovery from the pandemic were “very important” factors for both Democratic and Republican voters.', 'perplexity': 0, 'highlight_sentence_for_ai': False}, {'generated_prob': 6.4969586674124e-05, 'sentence': 'Exit poll data suggests 93% of Biden supporters and 59% of Trump supporters considered controlling the spread of COVID-19 as a very important issue when voting.', 'perplexity': 0, 'highlight_sentence_for_ai': False}, {'generated_prob': 7.941028161440045e-05, 'sentence': 'But the two camps strayed on issues from there, including universal health care coverage, climate change and racial inequality.', 'perplexity': 0, 'highlight_sentence_for_ai': False}, {'generated_prob': 6.589313852600753e-05, 'sentence': ""Polling suggests 83% of Biden supporters considered universal health care an important issue compared to 43% of Trump's supporters."", 'perplexity': 0, 'highlight_sentence_for_ai': False}, {'generated_prob': 7.1507747634314e-05, 'sentence': 'One of the largest differences between the two camps was climate change.', 'perplexity': 0, 'highlight_sentence_for_ai': False}, {'generated_prob': 6.840217974968255e-05, 'sentence': ""About 19% of Trump supporters said addressing climate change was an important issue to them compared to 74% of Biden's supporters."", 'perplexity': 0, 'highlight_sentence_for_ai': False}, {'generated_prob': 0.014791585505008698, 'sentence': 'Trump voters, data suggests, also overwhelmingly voted in support of reducing the number of immigrants allowed entrance into the country and building a U.S.-Mexico border wall, compared to Biden voters.', 'perplexity': 0, 'highlight_sentence_for_ai': False}, {'generated_prob': 0.017690518870949745, 'sentence': 'A greater disparity between the two camps was displayed in their views of systemic racism in the U.S. Over half of Biden supporters said racial discrimination in the country is systemic, and only 16% of Trump supporters agreed.', 'perplexity': 0, 'highlight_sentence_for_ai': False}, {'generated_prob': 0.025257276371121407, 'sentence': '“Trump voters, on the other hand, were 24 points more likely than Biden voters to align with the view that discrimination in the United States is a product of individuals who hold racist views, 72 percent to 48 percent,” according to Morning Consult.', 'perplexity': 0, 'highlight_sentence_for_ai': False}, {'generated_prob': 0.006074921693652868, 'sentence': 'Related Content: If you purchase a product or register for an account through a link on our site, we may receive compensation.', 'perplexity': 0, 'highlight_sentence_for_ai': False}, {'generated_prob': 0.006294915918260813, 'sentence': 'By using this site, you consent to our User Agreement and agree that your clicks, interactions, and personal information may be collected, recorded, and/or stored by us and social media and other third-party partners in accordance with our Privacy Policy.', 'perplexity': 0, 'highlight_sentence_for_ai': False}, {'generated_prob': 0.004454107489436865, 'sentence': 'Use of and/or registration on any portion of this site constitutes acceptance of our User Agreement (updated 4/18/2024), Privacy Policy and Cookie Statement, and Your Privacy Choices and Rights (updated 12/31/2023).', 'perplexity': 0, 'highlight_sentence_for_ai': False}, {'generated_prob': 0.0041804020293056965, 'sentence': 'Cookie Settings/Do Not Sell My Personal Information © 2024 Advance Local Media LLC.', 'perplexity': 0, 'highlight_sentence_for_ai': False}, {'generated_prob': 0.002153572393581271, 'sentence': 'All rights reserved (About Us).', 'perplexity': 0, 'highlight_sentence_for_ai': False}, {'generated_prob': 0.0036877968814224005, 'sentence': 'The material on this site may not be reproduced, distributed, transmitted, cached or otherwise used, except with the prior written permission of Advance Local.', 'perplexity': 0, 'highlight_sentence_for_ai': False}, {'generated_prob': 0.002856048522517085, 'sentence': 'Community Rules apply to all content you upload or otherwise submit to this site.', 'perplexity': 0, 'highlight_sentence_for_ai': False}, {'generated_prob': 0.0066839298233389854, 'sentence': ""YouTube's privacy policy is available here and YouTube's terms of service is available here."", 'perplexity': 0, 'highlight_sentence_for_ai': False}, {'generated_prob': 0.008805789984762669, 'sentence': 'Ad Choices', 'perplexity': 0, 'highlight_sentence_for_ai': False}], 'paragraphs': [{'start_sentence_index': 0, 'num_sentences': 23, 'completely_generated_prob': 2.3367398512545458e-20}], 'completely_generated_prob': 0.017366979968111772, 'class_probabilities': {'human': 0.9817247978651885, 'ai': 0.017366979968111772, 'mixed': 0.0009082221666997225}, 'average_generated_prob': 0, 'predicted_class': 'human', 'confidence_score': 0.9817247978651885, 'confidence_category': 'high', 'confidence_scores_raw': {'identity': {'ai': 0.017366979968111772, 'human': 0.9817247978651885, 'mixed': 0.0009082221666997225}}, 'confidence_thresholds_raw': {'identity': {'ai': {'reject': 0.65, 'low': 0.75, 'medium': 0.92}, 'human': {'reject': 0.7, 'low': 0.82, 'medium': 0.92}, 'mixed': {'reject': 0.7, 'low': 0.8, 'medium': 0.88}}}, 'overall_burstiness': 0, 'writing_stats': {}, 'subclass': {'ai': {}, 'human': {}, 'mixed': {}}, 'result_message': 'Our detector is highly confident that the text is written entirely by a human.', 'document_classification': 'HUMAN_ONLY', 'version': '2025-01-09-base', 'language': 'en', 'pageNumber': 0, 'inputText': 'Recent exit polling data from Morning Consult suggests 44% of Biden voters cast their votes for the Democratic nominee as a vote “against” Trump, rather than in support of the former vice president. As the 2020 Presidential election results pour in, Morning Consult is conducting exit polls to provide context for voter’s decisions in the monumental election. Data collected lists COVID-19, economic recovery, and health care as the issues dominating the election, with Joe Biden’s voters twice as likely as Trump’s voters to say their vote was more against the opponent. Only 22% of Trump’s supporters say their vote was mostly against Biden, the data suggests. “When it comes to what voters are looking for, Biden’s backers were most likely to prioritize judgment, stability, honesty and trustworthiness in their choice for president, while Trump’s supporters elevated judgment, mental fitness, effectiveness and strong leadership,” Morning Consult writes. Controlling the spread of COVID-19 and revitalizing economic recovery from the pandemic were “very important” factors for both Democratic and Republican voters. Exit poll data suggests 93% of Biden supporters and 59% of Trump supporters considered controlling the spread of COVID-19 as a very important issue when voting. But the two camps strayed on issues from there, including universal health care coverage, climate change and racial inequality. Polling suggests 83% of Biden supporters considered universal health care an important issue compared to 43% of Trump’s supporters. One of the largest differences between the two camps was climate change. About 19% of Trump supporters said addressing climate change was an important issue to them compared to 74% of Biden’s supporters. Trump voters, data suggests, also overwhelmingly voted in support of reducing the number of immigrants allowed entrance into the country and building a U.S.-Mexico border wall, compared to Biden voters. A greater disparity between the two camps was displayed in their views of systemic racism in the U.S. Over half of Biden supporters said racial discrimination in the country is systemic, and only 16% of Trump supporters agreed. “Trump voters, on the other hand, were 24 points more likely than Biden voters to align with the view that discrimination in the United States is a product of individuals who hold racist views, 72 percent to 48 percent,” according to Morning Consult. Related Content: If you purchase a product or register for an account through a link on our site, we may receive compensation. By using this site, you consent to our User Agreement and agree that your clicks, interactions, and personal information may be collected, recorded, and/or stored by us and social media and other third-party partners in accordance with our Privacy Policy. Use of and/or registration on any portion of this site constitutes acceptance of our User Agreement (updated 4/18/2024), Privacy Policy and Cookie Statement, and Your Privacy Choices and Rights (updated 12/31/2023). Cookie Settings/Do Not Sell My Personal Information © 2024 Advance Local Media LLC. All rights reserved (About Us). The material on this site may not be reproduced, distributed, transmitted, cached or otherwise used, except with the prior written permission of Advance Local. Community Rules apply to all content you upload or otherwise submit to this site. YouTube’s privacy policy is available here and YouTube’s terms of service is available here. Ad Choices'}]"
MA_2020_61082bd0ebb02d17538ceacd1cb179ae.html.gz,2025-01-09-base,"[{'sentences': [{'generated_prob': 0.000728992628864944, 'sentence': '24/7 News Boston 25 News app (WFXT/Boston 25 News) Stay connected to news from around Massachusetts with our free Boston 25 News and Weather apps.', 'perplexity': 0, 'highlight_sentence_for_ai': False}, {'generated_prob': 0.0007627768209204078, 'sentence': 'Our free news app is available on iOS and Android, as well as Roku, Amazon Fire & Apple TV.', 'perplexity': 0, 'highlight_sentence_for_ai': False}, {'generated_prob': 0.0010707381879910827, 'sentence': 'Our free weather app is available on iOS and Android.', 'perplexity': 0, 'highlight_sentence_for_ai': False}, {'generated_prob': 0.0009208295959979296, 'sentence': 'The Boston 25 app gives you access to lots of local content, including: How to watch Boston 25 News on your phone or Smart TV Did you know you can watch Boston 25 News on your phone or on your Smart TV?', 'perplexity': 0, 'highlight_sentence_for_ai': False}, {'generated_prob': 0.0009270652080886066, 'sentence': ""Here's how The Boston 25 Weather app gives you access to local weather data from the Boston 25 Weather team, including: Find your device below and download the app to get started!"", 'perplexity': 0, 'highlight_sentence_for_ai': False}, {'generated_prob': 0.0007670607301406562, 'sentence': 'How to watch Boston 25 News on Roku You can always watch Boston 25 News for free on our mobile livestream, our Boston 25 Now mobile app, and our Boston 25 Smart TV app available on Roku, Amazon Firestick, and AppleTV.', 'perplexity': 0, 'highlight_sentence_for_ai': False}, {'generated_prob': 0.000970558263361454, 'sentence': 'How to watch Boston 25 NOW with your Amazon Fire TV Stick You can always watch Boston 25 News for free on our mobile livestream, our Boston 25 Now mobile app, and our Boston 25 Smart TV app available on Roku, Amazon Firestick, and AppleTV.', 'perplexity': 0, 'highlight_sentence_for_ai': False}, {'generated_prob': 0.0008511901251040399, 'sentence': '© 2019 Cox Media Group © 2024 Cox Media Group.', 'perplexity': 0, 'highlight_sentence_for_ai': False}, {'generated_prob': 0.0007498617051169276, 'sentence': 'This station is part of Cox Media Group Television.', 'perplexity': 0, 'highlight_sentence_for_ai': False}, {'generated_prob': 0.0006475712871178985, 'sentence': 'Learn about careers at Cox Media Group.', 'perplexity': 0, 'highlight_sentence_for_ai': False}, {'generated_prob': 0.0008954030927270651, 'sentence': 'By using this website, you accept the terms of our Visitor Agreement and Privacy Policy, and understand your options regarding Ad Choices.', 'perplexity': 0, 'highlight_sentence_for_ai': False}], 'paragraphs': [{'start_sentence_index': 0, 'num_sentences': 11, 'completely_generated_prob': 7.905466206762634e-10}], 'completely_generated_prob': 0.01281881855424871, 'class_probabilities': {'human': 0.9871811814457513, 'ai': 0.01281881855424871, 'mixed': 0}, 'average_generated_prob': 0, 'predicted_class': 'human', 'confidence_score': 0.9871811814457513, 'confidence_category': 'high', 'confidence_scores_raw': {'identity': {'ai': 0.01281881855424871, 'human': 0.9871811814457513, 'mixed': 0}}, 'confidence_thresholds_raw': {'identity': {'ai': {'reject': 0.65, 'low': 0.75, 'medium': 0.92}, 'human': {'reject': 0.7, 'low': 0.82, 'medium': 0.92}, 'mixed': {'reject': 0.7, 'low': 0.8, 'medium': 0.88}}}, 'overall_burstiness': 0, 'writing_stats': {}, 'subclass': {'ai': {}, 'human': {}, 'mixed': {}}, 'result_message': 'Our detector is highly confident that the text is written entirely by a human.', 'document_classification': 'HUMAN_ONLY', 'version': '2025-01-09-base', 'language': 'en', 'pageNumber': 0, 'inputText': ""24/7 News Boston 25 News app (WFXT/Boston 25 News) Stay connected to news from around Massachusetts with our free Boston 25 News and Weather apps. Our free news app is available on iOS and Android, as well as Roku, Amazon Fire & Apple TV. Our free weather app is available on iOS and Android. The Boston 25 app gives you access to lots of local content, including: How to watch Boston 25 News on your phone or Smart TV Did you know you can watch Boston 25 News on your phone or on your Smart TV? Here's how The Boston 25 Weather app gives you access to local weather data from the Boston 25 Weather team, including: Find your device below and download the app to get started! How to watch Boston 25 News on Roku You can always watch Boston 25 News for free on our mobile livestream, our Boston 25 Now mobile app, and our Boston 25 Smart TV app available on Roku, Amazon Firestick, and AppleTV. How to watch Boston 25 NOW with your Amazon Fire TV Stick You can always watch Boston 25 News for free on our mobile livestream, our Boston 25 Now mobile app, and our Boston 25 Smart TV app available on Roku, Amazon Firestick, and AppleTV. © 2019 Cox Media Group © 2024 Cox Media Group. This station is part of Cox Media Group Television. Learn about careers at Cox Media Group. By using this website, you accept the terms of our Visitor Agreement and Privacy Policy, and understand your options regarding Ad Choices.""}]"
MA_2020_7bd4ddbe3bbc7aa82f0af30c5c461baa.html.gz,2025-01-09-base,"[{'sentences': [{'generated_prob': 0.00043653231114149094, 'sentence': ""Massachusetts firefighters are pushing to find out when they can get the COVID-19 vaccine after hundreds of union members tested positive for the virus justRead More Doctors at the DCU Center field hospital in Worcester say they've already seen more coronavirus patients in a few weeks than during all the timeRead More (CNN) ᅳ The number of patients hospitalized across the US with Covid-19 is the highest it's ever been ᅳ and at this rate health experts warn theyRead More Flames tore through a Brookline apartment building, leaving dozens of residents displaced Monday evening."", 'perplexity': 0, 'highlight_sentence_for_ai': False}, {'generated_prob': 0.000486543751321733, 'sentence': ""SKY7 HD flew overhead as several firefighters fought the flames fromRead More WASHINGTON (AP) ᅳ President Donald Trump's push for $2,000 COVID-19 relief checks now rests with the Senate after the House voted overwhelmingly to meet theRead More CVS and Walgreens will begin vaccinating patients and healthcare providers in long-term care facilities across Massachusetts Monday."", 'perplexity': 0, 'highlight_sentence_for_ai': False}, {'generated_prob': 0.0007132202154025435, 'sentence': 'Operation Warp Speed made a deal with theRead More WASHINGTON (AP) ᅳ Shelving his objections, President Donald Trump has signed a $2 trillion-plus COVID-19 and annual federal spending package providing relief for millions of Americans, evenRead More The Massachusetts Department of Public Health released an updated list on Thursday detailing the number of coronavirus cases in cities and towns across the Commonwealth.', 'perplexity': 0, 'highlight_sentence_for_ai': False}, {'generated_prob': 0.0002666472573764622, 'sentence': 'RELATED: Mass.Read More Many people lined up outside COVID-19 testing sites across the state Wednesday just two days ahead of the Christmas holiday.', 'perplexity': 0, 'highlight_sentence_for_ai': False}, {'generated_prob': 0.00034964963560923934, 'sentence': 'As many hit the roads,Read More The Rockland community gathered to say goodbye to a beloved bus driver a give her a special send-off Wednesday.', 'perplexity': 0, 'highlight_sentence_for_ai': False}, {'generated_prob': 0.00035628702607937157, 'sentence': 'Due to the ongoing coronavirus pandemic,Read More WHDH TV 7NEWS WLVI TV CW56 Sunbeam Television Corp 7 Bulfinch Place Boston, MA 02114 News Tips: (800) 280-TIPS Tell Hank: (855) 247-HANK Join us All content © Copyright 2000 - 2024 WHDH-TV.', 'perplexity': 0, 'highlight_sentence_for_ai': False}, {'generated_prob': 0.0002746470272541046, 'sentence': ""WHDH broadcast educational and informational programming for children, and file quarterly reports with the FCC detailing the station's outreach to children."", 'perplexity': 0, 'highlight_sentence_for_ai': False}, {'generated_prob': 0.0002966313622891903, 'sentence': 'The public may view the reports by going to WHDH.com and clicking on ""FCC Public File"", or by visiting the FCC\'s website at FCC.org.', 'perplexity': 0, 'highlight_sentence_for_ai': False}, {'generated_prob': 0.00021238418412394822, 'sentence': 'For more information on this site, please read our Privacy Policy, and Terms of Service.', 'perplexity': 0, 'highlight_sentence_for_ai': False}], 'paragraphs': [{'start_sentence_index': 0, 'num_sentences': 9, 'completely_generated_prob': 4.1887248735431006e-08}], 'completely_generated_prob': 0.009998674697021016, 'class_probabilities': {'human': 0.990001325302979, 'ai': 0.009998674697021016, 'mixed': 0}, 'average_generated_prob': 0, 'predicted_class': 'human', 'confidence_score': 0.990001325302979, 'confidence_category': 'high', 'confidence_scores_raw': {'identity': {'ai': 0.009998674697021016, 'human': 0.990001325302979, 'mixed': 0}}, 'confidence_thresholds_raw': {'identity': {'ai': {'reject': 0.65, 'low': 0.75, 'medium': 0.92}, 'human': {'reject': 0.7, 'low': 0.82, 'medium': 0.92}, 'mixed': {'reject': 0.7, 'low': 0.8, 'medium': 0.88}}}, 'overall_burstiness': 0, 'writing_stats': {}, 'subclass': {'ai': {}, 'human': {}, 'mixed': {}}, 'result_message': 'Our detector is highly confident that the text is written entirely by a human.', 'document_classification': 'HUMAN_ONLY', 'version': '2025-01-09-base', 'language': 'en', 'pageNumber': 0, 'inputText': 'Massachusetts firefighters are pushing to find out when they can get the COVID-19 vaccine after hundreds of union members tested positive for the virus justRead More Doctors at the DCU Center field hospital in Worcester say they’ve already seen more coronavirus patients in a few weeks than during all the timeRead More (CNN) — The number of patients hospitalized across the US with Covid-19 is the highest it’s ever been — and at this rate health experts warn theyRead More Flames tore through a Brookline apartment building, leaving dozens of residents displaced Monday evening. SKY7 HD flew overhead as several firefighters fought the flames fromRead More WASHINGTON (AP) — President Donald Trump’s push for $2,000 COVID-19 relief checks now rests with the Senate after the House voted overwhelmingly to meet theRead More CVS and Walgreens will begin vaccinating patients and healthcare providers in long-term care facilities across Massachusetts Monday. Operation Warp Speed made a deal with theRead More WASHINGTON (AP) — Shelving his objections, President Donald Trump has signed a $2 trillion-plus COVID-19 and annual federal spending package providing relief for millions of Americans, evenRead More The Massachusetts Department of Public Health released an updated list on Thursday detailing the number of coronavirus cases in cities and towns across the Commonwealth. RELATED: Mass.Read More Many people lined up outside COVID-19 testing sites across the state Wednesday just two days ahead of the Christmas holiday. As many hit the roads,Read More The Rockland community gathered to say goodbye to a beloved bus driver a give her a special send-off Wednesday. Due to the ongoing coronavirus pandemic,Read More WHDH TV 7NEWS WLVI TV CW56 Sunbeam Television Corp 7 Bulfinch Place Boston, MA 02114 News Tips: (800) 280-TIPS Tell Hank: (855) 247-HANK Join us All content © Copyright 2000 - 2024 WHDH-TV. WHDH broadcast educational and informational programming for children, and file quarterly reports with the FCC detailing the station\'s outreach to children. The public may view the reports by going to WHDH.com and clicking on ""FCC Public File"", or by visiting the FCC\'s website at FCC.org. For more information on this site, please read our Privacy Policy, and Terms of Service.'}]"
