File,version,documents
KS_2021_04723212fba2aefd773f1b6e9b5f69ba.html.gz,2025-01-09-base,"[{'sentences': [{'generated_prob': 9.276642231270671e-05, 'sentence': 'My name is Jared Broyles, and I am co-anchor of 13 News this Morning.', 'perplexity': 0, 'highlight_sentence_for_ai': False}, {'generated_prob': 8.165967301465571e-05, 'sentence': 'I grew up in the tiny town of Panola in Southeast Oklahoma-- attending the same school that my paternal grandparents had, graduating nearly 50 years after them.', 'perplexity': 0, 'highlight_sentence_for_ai': False}, {'generated_prob': 0.00010241326526738703, 'sentence': ""I received my bachelor's degree from the University of Central Oklahoma in Edmond (north of OKC); Broadcast Communications with an emphasis in News."", 'perplexity': 0, 'highlight_sentence_for_ai': False}, {'generated_prob': 0.00010426665539853275, 'sentence': 'From there, I got my first TV job at the CBS affiliate in Fort Smith, Arkansas.', 'perplexity': 0, 'highlight_sentence_for_ai': False}, {'generated_prob': 0.00012461547157727182, 'sentence': 'I stayed for 9 years, working as a producer, reporter, and later weekend anchor during that time.', 'perplexity': 0, 'highlight_sentence_for_ai': False}, {'generated_prob': 0.00011017185170203447, 'sentence': 'One of my most memorable stories includes a young girl with terminal cancer who desperately wanted to meet her biological father.', 'perplexity': 0, 'highlight_sentence_for_ai': False}, {'generated_prob': 0.00010308256605640054, 'sentence': 'I was privileged to tell her story, and a private investigator who saw the story managed to track her dad down.', 'perplexity': 0, 'highlight_sentence_for_ai': False}, {'generated_prob': 7.855744479456916e-05, 'sentence': 'They had the opportunity to meet before she passed away.', 'perplexity': 0, 'highlight_sentence_for_ai': False}, {'generated_prob': 7.072187145240605e-05, 'sentence': 'I have never forgotten her.', 'perplexity': 0, 'highlight_sentence_for_ai': False}, {'generated_prob': 6.926525384187698e-05, 'sentence': 'Another time, a photographer and I spent 24 straight hours covering a devastating tornado that hit Waldron, Arkansas.', 'perplexity': 0, 'highlight_sentence_for_ai': False}, {'generated_prob': 6.95435082889162e-05, 'sentence': 'The following morning I did a live shot for the national CBS morning newscast having had no sleep.', 'perplexity': 0, 'highlight_sentence_for_ai': False}, {'generated_prob': 6.99761149007827e-05, 'sentence': 'I worked for a couple of years as the director of communications and as a non-traditional teacher for Lavaca Public Schools--a district not far from Fort Smith.', 'perplexity': 0, 'highlight_sentence_for_ai': False}, {'generated_prob': 0.00010139635560335591, 'sentence': 'TV news has a way of getting into your blood, and I wanted to return to broadcasting.', 'perplexity': 0, 'highlight_sentence_for_ai': False}, {'generated_prob': 0.000115866721898783, 'sentence': 'I spent 4 years working as an evening anchor in Topeka before feeling called to launch Foster the Cause, a ministry that works to recruit, train, and support new Christian foster and adoptive families through local churches here in Northeast Kansas.', 'perplexity': 0, 'highlight_sentence_for_ai': False}, {'generated_prob': 8.480874384986237e-05, 'sentence': 'I have long volunteered and worked as a child advocate--something I am incredibly passionate about.', 'perplexity': 0, 'highlight_sentence_for_ai': False}, {'generated_prob': 9.250613948097453e-05, 'sentence': 'I did that for three years and was a stay-at-home parent before getting a call about a job opportunity at WIBW 13 News in December 2020.', 'perplexity': 0, 'highlight_sentence_for_ai': False}, {'generated_prob': 0.00010887141252169386, 'sentence': 'How could I say no to the #1 News Station in Northeast Kansas?', 'perplexity': 0, 'highlight_sentence_for_ai': False}, {'generated_prob': 8.039765089051798e-05, 'sentence': 'I spent several months working as the digital news content manager for WIBW, managing our website, social media accounts, and live web desk.', 'perplexity': 0, 'highlight_sentence_for_ai': False}, {'generated_prob': 6.862395821372047e-05, 'sentence': 'When the opportunity arose for a morning co-anchor role, I jumped at the opportunity.', 'perplexity': 0, 'highlight_sentence_for_ai': False}, {'generated_prob': 6.86998464516364e-05, 'sentence': ""I feel like I've come full circle; I started my career wanting to be a morning news anchor!"", 'perplexity': 0, 'highlight_sentence_for_ai': False}, {'generated_prob': 6.887476774863899e-05, 'sentence': 'My daughters and I love Topeka and Northeast Kansas, and I look forward to waking up with our viewers for many years to come.', 'perplexity': 0, 'highlight_sentence_for_ai': False}, {'generated_prob': 0.00014809920685365796, 'sentence': 'News Safety State Politics Local State State National Health Accidents Coronavirus State Kansas Proud', 'perplexity': 0, 'highlight_sentence_for_ai': False}], 'paragraphs': [{'start_sentence_index': 0, 'num_sentences': 22, 'completely_generated_prob': 1.790351317743908e-19}], 'completely_generated_prob': 0.0051780533755591265, 'class_probabilities': {'human': 0.9948219466244408, 'ai': 0.0051780533755591265, 'mixed': 0}, 'average_generated_prob': 0, 'predicted_class': 'human', 'confidence_score': 0.9948219466244408, 'confidence_category': 'high', 'confidence_scores_raw': {'identity': {'ai': 0.0051780533755591265, 'human': 0.9948219466244408, 'mixed': 0}}, 'confidence_thresholds_raw': {'identity': {'ai': {'reject': 0.65, 'low': 0.75, 'medium': 0.92}, 'human': {'reject': 0.7, 'low': 0.82, 'medium': 0.92}, 'mixed': {'reject': 0.7, 'low': 0.8, 'medium': 0.88}}}, 'overall_burstiness': 0, 'writing_stats': {}, 'subclass': {'ai': {}, 'human': {}, 'mixed': {}}, 'result_message': 'Our detector is highly confident that the text is written entirely by a human.', 'document_classification': 'HUMAN_ONLY', 'version': '2025-01-09-base', 'language': 'en', 'pageNumber': 0, 'inputText': ""My name is Jared Broyles, and I am co-anchor of 13 News this Morning. I grew up in the tiny town of Panola in Southeast Oklahoma-- attending the same school that my paternal grandparents had, graduating nearly 50 years after them. I received my bachelor's degree from the University of Central Oklahoma in Edmond (north of OKC); Broadcast Communications with an emphasis in News. From there, I got my first TV job at the CBS affiliate in Fort Smith, Arkansas. I stayed for 9 years, working as a producer, reporter, and later weekend anchor during that time. One of my most memorable stories includes a young girl with terminal cancer who desperately wanted to meet her biological father. I was privileged to tell her story, and a private investigator who saw the story managed to track her dad down. They had the opportunity to meet before she passed away. I have never forgotten her. Another time, a photographer and I spent 24 straight hours covering a devastating tornado that hit Waldron, Arkansas. The following morning I did a live shot for the national CBS morning newscast having had no sleep. I worked for a couple of years as the director of communications and as a non-traditional teacher for Lavaca Public Schools--a district not far from Fort Smith. TV news has a way of getting into your blood, and I wanted to return to broadcasting. I spent 4 years working as an evening anchor in Topeka before feeling called to launch Foster the Cause, a ministry that works to recruit, train, and support new Christian foster and adoptive families through local churches here in Northeast Kansas. I have long volunteered and worked as a child advocate--something I am incredibly passionate about. I did that for three years and was a stay-at-home parent before getting a call about a job opportunity at WIBW 13 News in December 2020. How could I say no to the #1 News Station in Northeast Kansas? I spent several months working as the digital news content manager for WIBW, managing our website, social media accounts, and live web desk. When the opportunity arose for a morning co-anchor role, I jumped at the opportunity. I feel like I've come full circle; I started my career wanting to be a morning news anchor! My daughters and I love Topeka and Northeast Kansas, and I look forward to waking up with our viewers for many years to come. News Safety State Politics Local State State National Health Accidents Coronavirus State Kansas Proud""}]"
KS_2021_1e888e02811a8a1b0d76a39866a1e7e8.html.gz,2025-01-09-base,"[{'sentences': [{'generated_prob': 0.0003348720201756805, 'sentence': 'State officials are seeking feedback from Kansans to help guide future housing development efforts.', 'perplexity': 0, 'highlight_sentence_for_ai': False}, {'generated_prob': 0.000412828492699191, 'sentence': ""The initiative, part of the state's first comprehensive housing needs assessment in nearly 30 years, aims to review current housing opportunities, identify strategic goals and develop recommendations to guide future housing development."", 'perplexity': 0, 'highlight_sentence_for_ai': False}, {'generated_prob': 0.0006074049742892385, 'sentence': ""“We've long known that the state's shortage of comprehensive housing data limits our ability to provide affordable homes for Kansans,” said Ryan Vincent, Executive Director of Kansas Housing Resources Corporation."", 'perplexity': 0, 'highlight_sentence_for_ai': False}, {'generated_prob': 0.00048083701403811574, 'sentence': ""“The feedback gathered through this study will be a crucial first step in identifying current needs and resources so we can ensure that every Kansas community has the housing needed to grow and thrive.” The study's current discovery phase includes a series of public listening sessions and a statewide survey to gauge community and stakeholder input."", 'perplexity': 0, 'highlight_sentence_for_ai': False}, {'generated_prob': 0.0007520061917603016, 'sentence': 'Consultants will use feedback gathered throughout the discovery process to assess opportunities and set strategic housing goals.', 'perplexity': 0, 'highlight_sentence_for_ai': False}, {'generated_prob': 0.0005673834239132702, 'sentence': ""The project's final phase involves developing a statewide housing plan and recommendations, with delivery anticipated by December 2021."", 'perplexity': 0, 'highlight_sentence_for_ai': False}, {'generated_prob': 0.0005283748614601791, 'sentence': 'Community members are encouraged to share their input three ways: Complete the Kansas Statewide Housing Needs Assessment online survey, available in both English and Spanish.', 'perplexity': 0, 'highlight_sentence_for_ai': False}, {'generated_prob': 0.0008609824581071734, 'sentence': ""Participate in their region's public listening session."", 'perplexity': 0, 'highlight_sentence_for_ai': False}, {'generated_prob': 0.0006674182368442416, 'sentence': 'Sessions will be held in person and virtually.', 'perplexity': 0, 'highlight_sentence_for_ai': False}, {'generated_prob': 0.000504828174598515, 'sentence': 'Visit the Kansas Statewide Housing Needs Assessment webpage to learn more and spread the word.', 'perplexity': 0, 'highlight_sentence_for_ai': False}, {'generated_prob': 0.0005780990468338132, 'sentence': ""Governor Laura Kelly, noting the state's shortage of quality, affordable housing and need for comprehensive data, announced the study's launch in December."", 'perplexity': 0, 'highlight_sentence_for_ai': False}, {'generated_prob': 0.0008353089797310531, 'sentence': ""The state's Office of Rural Prosperity and Kansas Housing Resources Corporation (KHRC), the state's housing finance agency, manage the project."", 'perplexity': 0, 'highlight_sentence_for_ai': False}, {'generated_prob': 0.0012377803213894367, 'sentence': 'RDG Planning & Design, a consulting group with extensive housing experience in Kansas, was chosen to lead the study through a competitive RFP process.', 'perplexity': 0, 'highlight_sentence_for_ai': False}, {'generated_prob': 0.0017238798318430781, 'sentence': '(Information courtesy Kansas Housing Resources Corporation.)', 'perplexity': 0, 'highlight_sentence_for_ai': False}, {'generated_prob': 0.0013370856177061796, 'sentence': 'Copyright © 2024 KRSL/KZRS Russell Radio | White Communications LLC | All Rights Reserved FCC Public File - KRSL / KRSL-FM / KZRS-FM | FCC EEO | FCC Applications Contact Information: Mike McKenna, General Manager - 785-483-3121 / mike@krsl.com', 'perplexity': 0, 'highlight_sentence_for_ai': False}], 'paragraphs': [{'start_sentence_index': 0, 'num_sentences': 15, 'completely_generated_prob': 2.5938383721896624e-13}], 'completely_generated_prob': 0.006922837844142335, 'class_probabilities': {'human': 0.99303778363816, 'ai': 0.006922837844142335, 'mixed': 3.937851769764606e-05}, 'average_generated_prob': 0, 'predicted_class': 'human', 'confidence_score': 0.99303778363816, 'confidence_category': 'high', 'confidence_scores_raw': {'identity': {'ai': 0.006922837844142335, 'human': 0.99303778363816, 'mixed': 3.937851769764606e-05}}, 'confidence_thresholds_raw': {'identity': {'ai': {'reject': 0.65, 'low': 0.75, 'medium': 0.92}, 'human': {'reject': 0.7, 'low': 0.82, 'medium': 0.92}, 'mixed': {'reject': 0.7, 'low': 0.8, 'medium': 0.88}}}, 'overall_burstiness': 0, 'writing_stats': {}, 'subclass': {'ai': {}, 'human': {}, 'mixed': {}}, 'result_message': 'Our detector is highly confident that the text is written entirely by a human.', 'document_classification': 'HUMAN_ONLY', 'version': '2025-01-09-base', 'language': 'en', 'pageNumber': 0, 'inputText': ""State officials are seeking feedback from Kansans to help guide future housing development efforts. The initiative, part of the state's first comprehensive housing needs assessment in nearly 30 years, aims to review current housing opportunities, identify strategic goals and develop recommendations to guide future housing development. “We've long known that the state's shortage of comprehensive housing data limits our ability to provide affordable homes for Kansans,” said Ryan Vincent, Executive Director of Kansas Housing Resources Corporation. “The feedback gathered through this study will be a crucial first step in identifying current needs and resources so we can ensure that every Kansas community has the housing needed to grow and thrive.” The study's current discovery phase includes a series of public listening sessions and a statewide survey to gauge community and stakeholder input. Consultants will use feedback gathered throughout the discovery process to assess opportunities and set strategic housing goals. The project's final phase involves developing a statewide housing plan and recommendations, with delivery anticipated by December 2021. Community members are encouraged to share their input three ways: Complete the Kansas Statewide Housing Needs Assessment online survey, available in both English and Spanish. Participate in their region's public listening session. Sessions will be held in person and virtually. Visit the Kansas Statewide Housing Needs Assessment webpage to learn more and spread the word. Governor Laura Kelly, noting the state's shortage of quality, affordable housing and need for comprehensive data, announced the study's launch in December. The state's Office of Rural Prosperity and Kansas Housing Resources Corporation (KHRC), the state's housing finance agency, manage the project. RDG Planning & Design, a consulting group with extensive housing experience in Kansas, was chosen to lead the study through a competitive RFP process. (Information courtesy Kansas Housing Resources Corporation.) Copyright © 2024 KRSL/KZRS Russell Radio | White Communications LLC | All Rights Reserved FCC Public File - KRSL / KRSL-FM / KZRS-FM | FCC EEO | FCC Applications Contact Information: Mike McKenna, General Manager - 785-483-3121 / mike@krsl.com""}]"
KS_2021_222b564ceeef42fbc705d7545c14e8fd.html.gz,2025-01-09-base,"[{'sentences': [{'generated_prob': 9.128038072958589e-06, 'sentence': 'LOUISVILLE, Ky. (WAVE/Gray News) - Sen. Rand Paul, R-Ky., has been suspended from YouTube after making controversial comments about COVID-19 and masks in a video last week, WAVE reported.', 'perplexity': 0, 'highlight_sentence_for_ai': False}, {'generated_prob': 1.1869121408381034e-05, 'sentence': ""In the video Paul posted a few days ago, which was later removed, he claimed that “cloth masks don't work” and most over-the-counter masks don't prevent infection, according to Forbes."", 'perplexity': 0, 'highlight_sentence_for_ai': False}, {'generated_prob': 9.305080311605707e-06, 'sentence': 'The Centers for Disease Control and Prevention has long reported that both masks offer some protection from COVID.', 'perplexity': 0, 'highlight_sentence_for_ai': False}, {'generated_prob': 8.743225407670252e-06, 'sentence': 'The senator blasted YouTube for deleting his video, saying it censored his content.', 'perplexity': 0, 'highlight_sentence_for_ai': False}, {'generated_prob': 9.958543159882538e-06, 'sentence': '“I think this kind of censorship is very dangerous, incredibly anti-free speech, and truly anti-progress of science, which involves skepticism and argumentation to arrive at the truth,” Paul said in a statement.', 'perplexity': 0, 'highlight_sentence_for_ai': False}, {'generated_prob': 8.511734449712094e-06, 'sentence': 'YouTube argued Paul violated its COVID-19 medical misinformation rules.', 'perplexity': 0, 'highlight_sentence_for_ai': False}, {'generated_prob': 1.0024994480772875e-05, 'sentence': 'The site has threatened Paul with a two-week suspension if another video is removed.', 'perplexity': 0, 'highlight_sentence_for_ai': False}, {'generated_prob': 8.418499419349246e-06, 'sentence': 'If a third is deleted, he will likely be permanently banned.', 'perplexity': 0, 'highlight_sentence_for_ai': False}, {'generated_prob': 1.700004213489592e-05, 'sentence': ""Paul's YouTube account is still visible."", 'perplexity': 0, 'highlight_sentence_for_ai': False}, {'generated_prob': 8.240661372838076e-06, 'sentence': 'This comes as Rep. Marjorie Taylor Greene, R-Ga., is serving a weeklong Twitter suspension for violating its terms of service by making false claims about the COVID-19 vaccines.', 'perplexity': 0, 'highlight_sentence_for_ai': False}, {'generated_prob': 7.459475455107167e-06, 'sentence': 'Copyright 2021 WAVE via Gray Media Group, Inc. All rights reserved.', 'perplexity': 0, 'highlight_sentence_for_ai': False}, {'generated_prob': 6.793024112994317e-06, 'sentence': 'Gray Media Group, Inc., contributed to this report.', 'perplexity': 0, 'highlight_sentence_for_ai': False}], 'paragraphs': [{'start_sentence_index': 0, 'num_sentences': 12, 'completely_generated_prob': 1.0731758790825431e-10}], 'completely_generated_prob': 0, 'class_probabilities': {'human': 1, 'ai': 0, 'mixed': 0}, 'average_generated_prob': 0, 'predicted_class': 'human', 'confidence_score': 1, 'confidence_category': 'high', 'confidence_scores_raw': {'identity': {'ai': 0, 'human': 1, 'mixed': 0}}, 'confidence_thresholds_raw': {'identity': {'ai': {'reject': 0.65, 'low': 0.75, 'medium': 0.92}, 'human': {'reject': 0.7, 'low': 0.82, 'medium': 0.92}, 'mixed': {'reject': 0.7, 'low': 0.8, 'medium': 0.88}}}, 'overall_burstiness': 0, 'writing_stats': {}, 'subclass': {'ai': {}, 'human': {}, 'mixed': {}}, 'result_message': 'Our detector is highly confident that the text is written entirely by a human.', 'document_classification': 'HUMAN_ONLY', 'version': '2025-01-09-base', 'language': 'en', 'pageNumber': 0, 'inputText': 'LOUISVILLE, Ky. (WAVE/Gray News) - Sen. Rand Paul, R-Ky., has been suspended from YouTube after making controversial comments about COVID-19 and masks in a video last week, WAVE reported. In the video Paul posted a few days ago, which was later removed, he claimed that “cloth masks don’t work” and most over-the-counter masks don’t prevent infection, according to Forbes. The Centers for Disease Control and Prevention has long reported that both masks offer some protection from COVID. The senator blasted YouTube for deleting his video, saying it censored his content. “I think this kind of censorship is very dangerous, incredibly anti-free speech, and truly anti-progress of science, which involves skepticism and argumentation to arrive at the truth,” Paul said in a statement. YouTube argued Paul violated its COVID-19 medical misinformation rules. The site has threatened Paul with a two-week suspension if another video is removed. If a third is deleted, he will likely be permanently banned. Paul’s YouTube account is still visible. This comes as Rep. Marjorie Taylor Greene, R-Ga., is serving a weeklong Twitter suspension for violating its terms of service by making false claims about the COVID-19 vaccines. Copyright 2021 WAVE via Gray Media Group, Inc. All rights reserved. Gray Media Group, Inc., contributed to this report.'}]"
